NIRE,Empresa,Município,Month,Year,Type
35112093689,E.M.B DE AVILA CONSULTORIA,SÃO PAULO,11,1992,Empresario
35112093697,CHIANG SHUN MING VIDEO,SÃO PAULO,11,1992,Empresario
35112093701,ANA MARIA FERREIRA DIAS,SÃO PAULO,11,1992,Empresario
35112093719,N S PERELLI,PRESIDENTE EPITÁCIO,11,1992,Empresario
35112093727,JOSE A L DO AMARAL ATIBAIA,ATIBAIA,11,1992,Empresario
35112093735,ALCIDES ANTONIO DE OLIVEIRA GRAFICA,SÃO JOSÉ DOS CAMPOS,11,1992,Empresario
35112093743,ROSANA APARECIDA TEODORO POLICARPO,PEDREIRA,11,1992,Empresario
35112093751,DF INVENCIONE,ITATIBA,11,1992,Empresario
35112093760,MARIA HELENA A. MARQUES,ARARAQUARA,11,1992,Empresario
35112093778,ANTONIO SERGIO MORON,VALINHOS,11,1992,Empresario
35112093786,JOAQUIM EVANGELISTA PONTAL,PONTAL,11,1992,Empresario
35112093794,LUIZ EDUARDO BAGIO,RIBEIRÃO PRETO,11,1992,Empresario
35112093808,MADALENA MAGGIO BARBIERATTO,RIBEIRÃO PRETO,11,1992,Empresario
35112093816,NOEMIA DOS SANTOS,CAMPINAS,11,1992,Empresario
35112093824,NOEMIA DIAS DAMACENO ALVES,CAMPINAS,11,1992,Empresario
35112093832,MAXUEL JOSE GONCALVES,PIRACICABA,11,1992,Empresario
35112093841,CELSO FELICIO SILVANO,PIRACICABA,11,1992,Empresario
35112093859,JOEL DE ALENCAR BASSOLI,FERNANDO PRESTES,11,1992,Empresario
35112093867,A MONSON MEDIDORES,BAURU,11,1992,Empresario
35112093875,ANTONIO GALDINO CAMILO,ATIBAIA,11,1992,Empresario
35112093883,MARIA DAS GRACAS DOS SANTOS PEREIRA AVICOLA,SÃO PAULO,11,1992,Empresario
35112093891,MARIA APPARECIDA ALMEIDA CARDOSO,BRAGANÇA PAULISTA,11,1992,Empresario
35112093905,M M DE OLIVEIRA BRITO TAUBATE,TAUBATÉ,11,1992,Empresario
35112093913,LUIZ NEVES DE LYRA,CARAPICUÍBA,11,1992,Empresario
35112093921,IVO DE CAMPOS AVICULTURA IMPERADOR,SÃO PAULO,11,1992,Empresario
35112093930,E J DE ANDRADE,MOGI MIRIM,11,1992,Empresario
35112093948,VALERIA SANCHES COMITRE,POÁ,11,1992,Empresario
35112093956,CELSO RICARDO MENDES,SÃO PAULO,11,1992,Empresario
35112093964,LUCIANO NINELLI,SÃO CAETANO DO SUL,11,1992,Empresario
35112093972,APARECIDO RIBEIRO MERCEARIA,PORTO FERREIRA,11,1992,Empresario
35112093981,MARA DE CASSIA SOARES,TAUBATÉ,11,1992,Empresario
35112093999,SEBASTIAO TADEU FARIAS JARDIM,RIBEIRÃO PRETO,11,1992,Empresario
35112094006,NAIR PEREIRA MONTANA,BATATAIS,11,1992,Empresario
35112094014,MAURINO PIMENTEL,RIBEIRÃO PRETO,11,1992,Empresario
35112094022,MARIA DE LOURDES MARTINS FERNANDES,RIBEIRÃO PRETO,11,1992,Empresario
35112094031,MARCO AURELIO PANARI,RIBEIRÃO PRETO,11,1992,Empresario
35112094049,MARCO ANTONIO PORTO VELLUDO,SERRA AZUL,11,1992,Empresario
35112094057,AMAURI PEDRO MURAD PONTAL,PONTAL,11,1992,Empresario
35112094065,AMELIA MARTINS GONCALVES,RIBEIRÃO PRETO,11,1992,Empresario
35112094073,ANA BERNARDINO CANELA,SERTÃOZINHO,11,1992,Empresario
35112094081,ANTONIO FIRMO DA SILVA,RIBEIRÃO PRETO,11,1992,Empresario
35112094090,ANTONIO GOULART RIBEIRAO PRETO,RIBEIRÃO PRETO,11,1992,Empresario
35112094103,JAIR PIZORUSSO,JARDINÓPOLIS,11,1992,Empresario
35112094111,ALCIDES R DE AZEVEDO-AGOUGUE,AMERICANA,11,1992,Empresario
35112094120,GERSON GOMES DE ARAUJO SAO JOSE CAMPOS,SÃO JOSÉ DOS CAMPOS,11,1992,Empresario
35112094138,DULCE MOREIRA DE SOUZA,AVANHANDAVA,11,1992,Empresario
35112094146,LUZIA APARECIDA MENEZES,PENÁPOLIS,11,1992,Empresario
35112094154,MARIA JOSE PICININI SAMPAIO LIMEIRA,LIMEIRA,11,1992,Empresario
35112094162,CLAUDIO CESAR KUHL,LIMEIRA,11,1992,Empresario
35112094171,MARLI DUTRA DE MORAIS,TAUBATÉ,11,1992,Empresario
35112094189,C M DA SILVA,TAUBATÉ,11,1992,Empresario
35112094197,EDSON ARANTES,SÃO PAULO,11,1992,Empresario
35112094201,MARIA SALETE CANO BOMBONIERE,GUARUJÁ,11,1992,Empresario
35112094219,REINALDO OTAVIO DA SILVA GUERRA,SÃO PAULO,11,1992,Empresario
35112094227,JOSE DE LIMA FILHO - SETE BARRAS,SETE BARRAS,11,1992,Empresario
35112094235,ALVAIR SEBASTIAO CARDOSO SERTAOZINHO,SERTÃOZINHO,11,1992,Empresario
35112094243,RODRIGO FARIA DE SOUZA,FRANCA,11,1992,Empresario
35112094251,ROSELENE HERNANDEZ,RIBEIRÃO PRETO,11,1992,Empresario
35112094260,MARIA ELISA ROSA SILVA,BEBEDOURO,11,1992,Empresario
35112094278,DONISETE APARECIDO GARCIA,IBITINGA,11,1992,Empresario
35112094286,JOSE ALCIDES ALMEIDA TEIXEIRA,PEDREIRA,11,1992,Empresario
35112094294,LIRIO FRANCISCO DE SOUZA,PENÁPOLIS,11,1992,Empresario
35112094308,MARIA SEVERINA DE LIMA PENAPOLIS,PENÁPOLIS,11,1992,Empresario
35112094316,JOSE AMILTON FILIPPIM PENAPOLIS,PENÁPOLIS,11,1992,Empresario
35112094324,L C MATTOS,TABOÃO DA SERRA,11,1992,Empresario
35112094332,MARCIO CAVALCANTE DA SILVA,SÃO PAULO,11,1992,Empresario
35112094341,FRANCELINO OLIVEIRA FEIRANTE,SÃO PAULO,11,1992,Empresario
35112094359,MARINILDA DE ARAUJO GLACILIANO,SÃO PAULO,11,1992,Empresario
35112094367,MARLI DINIS FERREIRA SJCAMPOS,SÃO JOSÉ DOS CAMPOS,11,1992,Empresario
35112094375,SIRLEI MARIA BARBOSA MILANI,RIBEIRÃO PRETO,11,1992,Empresario
35112094383,ANTONIO JERONIMO DE MELO IRACEMAPOLIS,IRACEMÁPOLIS,11,1992,Empresario
35112094391,MARIO HELENO ANJOS DO MONTE,PRESIDENTE PRUDENTE,11,1992,Empresario
35112094405,DORIVAL MOREIRA LANCHES,ITAPETININGA,11,1992,Empresario
35112094413,ORANDIR JOSE MARTINS,SÃO PAULO,11,1992,Empresario
35112094421,CARLOS H. RODRIGUES FLORICULTURA,SÃO PAULO,11,1992,Empresario
35112094430,NILTON CARLOS DA SILVA ARTIGOS RELIGIOSOS,SÃO PAULO,11,1992,Empresario
35112094448,PAULO ALVES DIAS-SERTAOZINHO,SERTÃOZINHO,11,1992,Empresario
35112094456,ADEJAIR CARLOS DA SILVA RIBEIRAO PRETO,RIBEIRÃO PRETO,11,1992,Empresario
35112094464,LAZARO ANTONIO PEREIRA ITAPEVA,ITAPEVA,11,1992,Empresario
35112094472,JOAREZ MOREIRA DE SOUZA FILHO,SÃO JOSÉ DOS CAMPOS,11,1992,Empresario
35207996163,ADVANTAGE DO BRASIL COMERCIO E PROMOCOES LTDA.,SAO PAULO,11,1992,Sociedade Limitada
35207996279,XYZ FILM INTERNACIONAL LTDA,SAO PAULO,11,1992,Sociedade Limitada
35207996325,D.GARRONE E CIA LTDA ME,PEDERNEIRAS,11,1992,Sociedade Limitada
35207996333,G. HERNANDES & CIA LTDA,SANTOS,11,1992,Sociedade Limitada
35207996945,MIRACEMA NUODEX INDUSTRIA QUIMICA LTDA,CAMPINAS,11,1992,Sociedade Limitada
35210492227,TRIANNE CONFECCOES LTDA.,SAO PAULO,11,1992,Sociedade Limitada
35210591322,TOP MUSIC COMERCIO DE DISCOS E FITAS LTDA.,SAO PAULO,11,1992,Sociedade Limitada
35210597495,"SIMOES, SANTANA & ASATO LTDA.",PRESIDENTE PRUDENTE,11,1992,Sociedade Limitada
35210616767,NELUDI DISTRIBUIDORA DE LEITE E DERIVADOS LTDA.,SAO PAULO,11,1992,Sociedade Limitada
35210684355,HIGH POWER FOTO VIDEO LOCADORA LTDA.,SAO PAULO,11,1992,Sociedade Limitada
35210687184,RW TELE SERVICOS E PUBLICIDADE LTDA.,SAO PAULO,11,1992,Sociedade Limitada
35210729979,DROGARIA HAUS LTDA.,REGISTRO,11,1992,Sociedade Limitada
35210740549,PORTAS E JANELAS RIO PRETO ESQUADRIAS LTDA.,SAO JOSE DO RIO PRETO,11,1992,Sociedade Limitada
35210745427,DISTRIBUIDORA HOLANDA CAMPELLO LTDA,SAO PAULO,11,1992,Sociedade Limitada
35210750463,MARCAL & FILHOS SERRALHERIA COMERCIO E SERVICOS LTDA.,SAO PAULO,11,1992,Sociedade Limitada
35210751168,RENOX ACESSORIOS DA MODA LTDA.,SAO PAULO,11,1992,Sociedade Limitada
35210751559,USITEC CERAMICA TECNICA LTDA.,SANTO ANDRE,11,1992,Sociedade Limitada
35210752733,SILVESTRIN & FLAVIO LTDA.,FERNANDOPOLIS,11,1992,Sociedade Limitada
35210753594,COMERCIO DE COSMETICOS BOUTIQUE LTDA.,SAO PAULO,11,1992,Sociedade Limitada
35210755236,FALA & DIAS LTDA.,SOROCABA,11,1992,Sociedade Limitada
35210760418,E.V.DE MELO & V.L.P. DE MELO LTDA.,SAO JOSE DOS CAMPOS,11,1992,Sociedade Limitada
35210762658,W.B.C CONSTRUTORA E INCORPORADORA LTDA.,RIBEIRAO PRETO,11,1992,Sociedade Limitada
35210763131,COMOGOL COMERCIO DE OLEOS E GORDURAS LTDA,MATAO,11,1992,Sociedade Limitada
35210763221,ITO ASSESSORIA E CONSULTORIA EM GESTAO EMPRESARIAL E PUBLICA LTDA,SAO PAULO,11,1992,Sociedade Limitada
35210763352,IDEA - INDUSTRIA E COMERCIO LTDA.,GETULINA,11,1992,Sociedade Limitada
35210766572,DIPRO AGROINDUSTRIA LTDA,SAO PAULO,11,1992,Sociedade Limitada
35210767480,L.S. COMERCIAL DE ARTEFATOS DE TECIDOS LTDA.,SAO PAULO,11,1992,Sociedade Limitada
35210768974,BRINKTEL COMERCIO E SERVICOS LTDA.,SAO BERNARDO DO CAMPO,11,1992,Sociedade Limitada
35210770383,PAPELARIA PRINTEI LTDA,SANTA BARBARA D'OESTE,11,1992,Sociedade Limitada
35210884273,INDUSTRIA COMERCIO DE ROUPAS AJEM LTDA.,SALTO,11,1992,Sociedade Limitada
35211064041,BEIJA FLOR COMERCIO DE PECAS E MECANICA LTDA.,CHARQUEADA,11,1992,Sociedade Limitada
35211173311,PWJ COMERCIO DE ESQUADRIAS LTDA.,SAO PAULO,11,1992,Sociedade Limitada
35211196991,BECO DO PARAISO RESTAURANTE LTDA.,SAO PAULO,11,1992,Sociedade Limitada
35211200807,EXATA ETIQUETAS LTDA.,SAO PAULO,11,1992,Sociedade Limitada
35211205965,I. P. K. MODAS LTDA.,SAO PAULO,11,1992,Sociedade Limitada
35211220808,KAMICASE JR CONFECCOES LTDA.,SAO PAULO,11,1992,Sociedade Limitada
35211221561,BALDI & BALDI LTDA.,ARACATUBA,11,1992,Sociedade Limitada
35211221898,RIBEIROLINS VIAGENS E TURISMO LTDA.,CAMPINAS,11,1992,Sociedade Limitada
35211221901,DEPOSITO DE BEBIDAS ATLANTIDA LTDA.,CAMPINAS,11,1992,Sociedade Limitada
35211221910,FANED COMERCIO E ASSISTENCIA TECNICA LTDA.,CAMPINAS,11,1992,Sociedade Limitada
35211221928,MOTO COMPETITION PERFORMANCE COMERCIO E ASSISTENCIA TECNICA LTDA.,CAMPINAS,11,1992,Sociedade Limitada
35211221936,MEIFER COMERCIO DE CONFECCOES LTDA.,PRESIDENTE PRUDENTE,11,1992,Sociedade Limitada
35211221944,CENTRAL SERRANA COMERCIO DE MATERIAL ELETRICO E SERVICOS LTDA,SERRANA,11,1992,Sociedade Limitada
35211221952,MODENESE & SILVA LTDA.,BOA ESPERANCA DO SUL,11,1992,Sociedade Limitada
35211221961,ANTONIO TEIXEIRA DA SILVA & CIA.LTDA.,MARABA PAULISTA,11,1992,Sociedade Limitada
35211221979,JUCIVAN INDUSTRIA E COMERCIO LTDA.,RIO CLARO,11,1992,Sociedade Limitada
35211221987,M. J. OLIVEIRA & CIA. LTDA.,RIO CLARO,11,1992,Sociedade Limitada
35211221995,ALMEIDA OKANO & FILHOS LTDA.,MORRO AGUDO,11,1992,Sociedade Limitada
35211222002,F.R. COMERCIO DE CARNES NOBRES LTDA.,RIBEIRAO PRETO,11,1992,Sociedade Limitada
35211225532,NETO ESTACIONAMENTOS LTDA.,SAO PAULO,11,1992,Sociedade Limitada
35211225541,BAR E MERCEARIA CARAPINA LTDA.,GUARULHOS,11,1992,Sociedade Limitada
35211225559,DOCERIA DOCEL LTDA.,SAO PAULO,11,1992,Sociedade Limitada
35211225567,EDTELMA COMERCIO DE PECAS PARA MAQUINAS E TECNOLOGIA LTDA.,SAO JOSE DOS CAMPOS,11,1992,Sociedade Limitada
35211225575,EDMAP INDUSTRIA DE ARTEFATOS DE MADEIRA LTDA.,RIBEIRAO PIRES,11,1992,Sociedade Limitada
35211225583,FERRGUTI COMERCIO E SERVICOS LTDA.,JUQUITIBA,11,1992,Sociedade Limitada
35211225591,GUARANY SUPER SACOLAO DE FRUTAS E LEGUMES LTDA.,SAO PAULO,11,1992,Sociedade Limitada
35211225613,TEXTIL ESPERANCA LTDA.,AMERICANA,11,1992,Sociedade Limitada
35211225621,PROJIMEC - PROJETOS E MONTAGENS INDUSTRIAIS LTDA.,SAO BERNARDO DO CAMPO,11,1992,Sociedade Limitada
35211225630,SHOPPING FRUTAS MORUMBI LTDA.,SAO PAULO,11,1992,Sociedade Limitada
35211225648,CAMARGO & KRAEMER LTDA.,VINHEDO,11,1992,Sociedade Limitada
35211225664,NOVAGAS EQUIPAMENTOS E SERVICOS LTDA.,SAO JOSE DOS CAMPOS,11,1992,Sociedade Limitada
35211225672,BUENO SERVICOS ADMINISTRATIVOS LTDA,SAO PAULO,11,1992,Sociedade Limitada
35211225681,ZAPAROLI COMERCIAL ELETRICA E SERVICOS LTDA.,SAO PAULO,11,1992,Sociedade Limitada
35211225699,MAMMUT PRODUCOES CINEMATOGRAFICAS LTDA.,SAO PAULO,11,1992,Sociedade Limitada
35211225702,CASA DE CARNES JARDINS DA BANDEIRAS LTDA.,SAO PAULO,11,1992,Sociedade Limitada
35211225711,DE LAURENTIS INDUSTRIA E COMERCIO DE PAPEIS LTDA,SAO PAULO,11,1992,Sociedade Limitada
35211225842,TRIONON TRANSPORTES LTDA.,DIADEMA,11,1992,Sociedade Limitada
35211225851,QUITANDA FLOR DA FORMOSA LTDA.,SAO PAULO,11,1992,Sociedade Limitada
35211225869,GRAFICA MOCO LTDA,GUARARAPES,11,1992,Sociedade Limitada
35211225877,NANNY ITU COMERCIO DE ROUPAS LTDA.,ITU,11,1992,Sociedade Limitada
35211225885,RODOLOG EXPRESS LTDA,NOVA ODESSA,11,1992,Sociedade Limitada
35211225893,FRENTE & VERSO PAPELARIA E COPIADORA LTDA.,RIBEIRAO PRETO,11,1992,Sociedade Limitada
35211225907,CENTRAL AR - COMERCIO E INSTALACAO DE AR CONDICIONADOS LTDA,RIBEIRAO PRETO,11,1992,Sociedade Limitada
35211225915,IZAS MOVEIS E DECORACOES LTDA.,RIBEIRAO PRETO,11,1992,Sociedade Limitada
35211225923,NOVA RETIFICA DE MOTORES E PECAS LTDA.,SAO PAULO,11,1992,Sociedade Limitada
35211225931,J. AMANCIO DISTRIBUIDORA DE AUTO PECAS LTDA.,RIBEIRAO PRETO,11,1992,Sociedade Limitada
35211225940,LUIS ANTONIO DANTIS E CIA LTDA,MOGI-GUACU,11,1992,Sociedade Limitada
35211226041,GOLDEN TRAVEL TURISMO E CAMBIO LTDA.,SAO PAULO,11,1992,Sociedade Limitada
35211226059,SOUZA REIS MANANCIAL EVANGELICO E BAZAR LTDA.,SAO VICENTE,11,1992,Sociedade Limitada
35211226067,TONOLLI & ARAUJO LTDA,CAIEIRAS,11,1992,Sociedade Limitada
35211226075,SAFETY AVIONICS COMERCIO AERONAUTICO LTDA.,SAO PAULO,11,1992,Sociedade Limitada
35211226083,PLENACOM PINTURA E CONSTRUCOES LTDA.,SAO PAULO,11,1992,Sociedade Limitada
35211226091,ADEGA E FLIPERAMA BONS IRMAOS LTDA.,TABOAO DA SERRA,11,1992,Sociedade Limitada
35211226105,RICJOCIS COMERCIO DE ALIMENTOS LTDA.,SAO PAULO,11,1992,Sociedade Limitada
35211226113,ADEGA E BAR V & N CHAVES LTDA.,SAO PAULO,11,1992,Sociedade Limitada
35211226121,C.E. MACIEL & MACIEL LTDA.,SAO JOSE DOS CAMPOS,11,1992,Sociedade Limitada
35211226181,SOUSA E BRANDI LTDA.,FRANCA,11,1992,Sociedade Limitada
35211226199,BOMBONIERE DOCE VIDEIRA LTDA.,SAO PAULO,11,1992,Sociedade Limitada
35211226202,CENTER UNIDOS COMERCIO DE MATERIAIS PARA CONSTRUCAO LTDA.,MAIRIPORA,11,1992,Sociedade Limitada
35211226211,MENDONCA & VENITE LTDA.,VALINHOS,11,1992,Sociedade Limitada
35211226229,TAMBURO & TAMBURO LTDA.,AMPARO,11,1992,Sociedade Limitada
35211226237,COMERCIO DE BEBIDAS DOIS IRMAOS LTDA.,SAO JOSE DO RIO PRETO,11,1992,Sociedade Limitada
35211226245,LOGUERCIO & PERROTTA REPRESENTACAO COMERCIAL LTDA.,SANTO ANDRE,11,1992,Sociedade Limitada
35211226261,MORADA DO SOL ABC RESTAURANTE LTDA.,SANTO ANDRE,11,1992,Sociedade Limitada
35211226270,J ZUCHETTO NETO REPRESENTACAO COMERCIAL LTDA.,SAO CAETANO DO SUL,11,1992,Sociedade Limitada
35211226296,ELETRO MECANICA ITORORO S JCAMPOS LTDA.,SAO JOSE DOS CAMPOS,11,1992,Sociedade Limitada
35211226300,DIAS & ABRANTES LTDA.,SAO PAULO,11,1992,Sociedade Limitada
35211226318,LANCHONETE GILSONDHIOU LTDA.,SUMARE,11,1992,Sociedade Limitada
35211226326,AMA SERVICOS LTDA,SAO CAETANO DO SUL,11,1992,Sociedade Limitada
35211226334,DINHOS DISCOS LTDA.,SAO PAULO,11,1992,Sociedade Limitada
35211226342,MACELEE'S PIZZARIA E RESTAURANTE LTDA.,SAO PAULO,11,1992,Sociedade Limitada
35211226351,AUTO IDEAL MECANICA LTDA.,SAO PAULO,11,1992,Sociedade Limitada
35211226369,SOLCI & ROMERA LTDA.,SOROCABA,11,1992,Sociedade Limitada
35211226377,ELETROMECANICA JEL WATC LTDA,VOTORANTIM,11,1992,Sociedade Limitada
35211226385,POTOKA'S DOCES E SALGADOS LTDA.,SAO PAULO,11,1992,Sociedade Limitada
35211226407,"PIXOTE INSTRUMENTOS MUSICAIS, SOM E ACESSORIOS LTDA.",CAMPO LIMPO PAULISTA,11,1992,Sociedade Limitada
35211226415,IPO-JR REPRESENTACOES COMERCIAIS LTDA.,SAO PAULO,11,1992,Sociedade Limitada
35211226423,INDUS COMERCIAL LTDA.,GUARULHOS,11,1992,Sociedade Limitada
35211226431,S & F MODAS E PRESENTES LTDA.,SAO PAULO,11,1992,Sociedade Limitada
35211226440,COMERCIAL E CENTRO DE EDUCACAO INFANTIL RAIO DE LUZ LTDA.,GUARULHOS,11,1992,Sociedade Limitada
35211226458,BAZAR PINGO AZUL LTDA.,SAO PAULO,11,1992,Sociedade Limitada
35211226466,NOVA REAL JANDIRA LANCHES LTDA.,JANDIRA,11,1992,Sociedade Limitada
35211226474,FRANDUTHI MIMOS E MIMOS LTDA.,SAO PAULO,11,1992,Sociedade Limitada
35211226482,MOGI MIRIM - RENOVADORA AUTOMOTIVA LTDA.,SAO PAULO,11,1992,Sociedade Limitada
35211226491,TRANSPORTADORA TRANS-MILK RBF LTDA.,SAO PAULO,11,1992,Sociedade Limitada
35211226504,ETHOS ! COMUNICACAO LTDA.,SAO PAULO,11,1992,Sociedade Limitada
35211226512,MEGATRANS-INDUSTRIA E COMERCIO DE TRANSFORMADORES LTDA.,SAO CAETANO DO SUL,11,1992,Sociedade Limitada
35211226521,L.C.LIMA ENTREGAS RAPIDAS LTDA.,SAO PAULO,11,1992,Sociedade Limitada
35211226539,GUIMARAES PNEUS LTDA.,RIBEIRAO PRETO,11,1992,Sociedade Limitada
35211226547,COMERCIAL LOJA PILAR LTDA.,PILAR DO SUL,11,1992,Sociedade Limitada
35211226555,FUMAIUOLO PIZZARIA LTDA.,SAO PAULO,11,1992,Sociedade Limitada
35211226563,HOLLER BOYS MOTO LTDA.,SAO PAULO,11,1992,Sociedade Limitada
35211226571,PLAST-BENA COMERCIO DE PLASTICOS LTDA.,SAO PAULO,11,1992,Sociedade Limitada
35211226580,SELLAN TRANSPORTES DE CARGAS E ENCOMENDAS LTDA.,SAO PAULO,11,1992,Sociedade Limitada
35211226598,RENTAL RADIO COMERCIO DE RADIOS LTDA.,SAO PAULO,11,1992,Sociedade Limitada
35211226601,CASA ARTES DOS SABORES LTDA.,SAO PAULO,11,1992,Sociedade Limitada
35211226610,ARTUZO E MAIA COMERCIAL LTDA.,SAO PAULO,11,1992,Sociedade Limitada
35211226628,LANCHONETE LUZ E TERRA LTDA.,OSASCO,11,1992,Sociedade Limitada
35211226636,TU MODAS CONFECCOES LTDA.,SAO PAULO,11,1992,Sociedade Limitada
35211226644,MODAS FARRO LTDA.,SAO PAULO,11,1992,Sociedade Limitada
35211226652,D'PAIVA AR CONDICIONADO E REFRIGERACAO LTDA.,CARAPICUIBA,11,1992,Sociedade Limitada
35211226661,PALLETEM COMERCIO DE EMBALAGENS E EQUIPAMENTOS LTDA.,SAO PAULO,11,1992,Sociedade Limitada
35211226679,RONCATO E FILHOS USINAGEM LTDA.,MAUA,11,1992,Sociedade Limitada
35211226687,FIRENZEPLAST - MERCANTIL E INDUSTRIA LTDA.,SAO PAULO,11,1992,Sociedade Limitada
35211226695,GAYER- DIESEL TRANSPORTADOR REVENDEDOR RETALHISTA LTDA.,SAO PAULO,11,1992,Sociedade Limitada
35211226709,NOE COMERCIO E CONSULTORIA EM INFORMATICA LTDA.,SANTANA DE PARNAIBA,11,1992,Sociedade Limitada
35211226717,CORAGGIO MODAS LTDA.,SAO PAULO,11,1992,Sociedade Limitada
35211226725,NOVE COMERCIO DE OBJETOS DE DECORACAO LTDA.,SAO PAULO,11,1992,Sociedade Limitada
35211226733,DERFLON COMERCIAL LTDA.,SAO PAULO,11,1992,Sociedade Limitada
35211226750,PRIMEIRA IMPRESSAO COMERCIO DE MOVEIS LTDA,SAO PAULO,11,1992,Sociedade Limitada
35211226768,ZANETI & ALVES LTDA.,SAO JOSE DO RIO PRETO,11,1992,Sociedade Limitada
35211226776,FIAN COMERCIO DE CALCADOS LTDA.,SAO PAULO,11,1992,Sociedade Limitada
35211226784,TELEVALLE BAURU EQUIPAMENTOS DE TELECOMUNICACAO LTDA.,BAURU,11,1992,Sociedade Limitada
35211226792,FACCHINI NUMBER ACESSORIOS PARA VEICULOS LTDA,SAO JOSE DO RIO PRETO,11,1992,Sociedade Limitada
35211226806,W J RIO PRETO MADEIRAS LTDA.,SAO JOSE DO RIO PRETO,11,1992,Sociedade Limitada
35211226814,HIDRO LAR COMERCIO DE MATERIAIS DE CONSTRUCAO LTDA.,SAO PAULO,11,1992,Sociedade Limitada
35211226822,CENTRALCOMPRAS COMERCIO E REPRESENTACAO LTDA,SAO JOSE DO RIO PRETO,11,1992,Sociedade Limitada
35211226831,F. QUINTANA INCORPORACAO E CONSTRUCAO CIVIL LTDA.,SAO JOSE DO RIO PRETO,11,1992,Sociedade Limitada
35211226849,AUTO ESCOLA BAILAO & OLIVEIRA LTDA.,SAO JOSE DO RIO PRETO,11,1992,Sociedade Limitada
35211226857,AUTO POSTO ESTRELA DE GUAPIACU LTDA.,GUAPIACU,11,1992,Sociedade Limitada
35211226865,TRANSPORTADORA TRANSDINO COSMORAMA LTDA,COSMORAMA,11,1992,Sociedade Limitada
35211226873,CASA DE QUADROS SILVA & COSTA LTDA.,SAO JOSE DO RIO PRETO,11,1992,Sociedade Limitada
35211226881,MASTER BEAUTY PRODUTOS DE BELEZA LTDA.,SAO JOSE DO RIO PRETO,11,1992,Sociedade Limitada
35211226890,GHERBAL CONSTRUCOES E CONSULTORIA LTDA.,ROSANA,11,1992,Sociedade Limitada
35211226903,FARMACIA SANTA MONICA DE PIRAJU LTDA.,PIRAJU,11,1992,Sociedade Limitada
35211226911,ANDRADE & NASCIMENTO LTDA,SANTOS,11,1992,Sociedade Limitada
35211226920,S.V.M. COMERCIO E SERVICOS LTDA.,SANTOS,11,1992,Sociedade Limitada
35211226938,SERRALHERIA ARTISTICA MANUTEC LTDA.,SAO PAULO,11,1992,Sociedade Limitada
35211226946,FAST FACTORING FOMENTO COMERCIAL LTDA.,SAO PAULO,11,1992,Sociedade Limitada
35211226954,CHRISTIE S PRODUTOS ALIMENTICIOS LTDA.,SAO PAULO,11,1992,Sociedade Limitada
35211226962,ADEGA RAVI LTDA.,SAO PAULO,11,1992,Sociedade Limitada
35211226971,GOUDEM CONSTRUTORA LTDA,AVARE,11,1992,Sociedade Limitada
35211226989,AUTO ELETRICA DOIS IRMAOS ITARIRI LTDA.,ITARIRI,11,1992,Sociedade Limitada
35211226997,VIDEO BRONX COMERCIO E LOCADORA DE FILMES LIMITADA.,SAO PAULO,11,1992,Sociedade Limitada
35211227004,VIEIRA & SANTANA JUNIOR LTDA.,SOROCABA,11,1992,Sociedade Limitada
35211227012,MORENO & MORENO LTDA.,SAO JOSE DO RIO PRETO,11,1992,Sociedade Limitada
35211227021,ESTEVAM FERREIRA & FERREIRA LTDA.,SAO JOSE DOS CAMPOS,11,1992,Sociedade Limitada
35211227039,NOVA ERA EMPREENDIMENTOS E PARTICIPACOES LTDA.,SAO PAULO,11,1992,Sociedade Limitada
35211227047,ANCHIETA EMPREENDIMENTOS E PARTICIPACOES LTDA.,SAO PAULO,11,1992,Sociedade Limitada
35211227055,MORAIS & MATOS COMERCIO E REPRESENTACOES LTDA.,PIRACICABA,11,1992,Sociedade Limitada
35211227063,"SLEASH HIDRAULIK - COMERCIO DE MATERIAS ELETRICOS, HIDRAULICOS E FERRAGENS LTDA.",SAO PAULO,11,1992,Sociedade Limitada
35211227071,UTILIDADES HAVAI LTDA,SAO BERNARDO DO CAMPO,11,1992,Sociedade Limitada
35211227080,LV COMERCIAL LTDA.,SAO PAULO,11,1992,Sociedade Limitada
35211227098,TRES PASSOS LANCHONETE LTDA.,SAO PAULO,11,1992,Sociedade Limitada
35211227101,ETIC'S CONFECCOES E COMERCIO LTDA.,SANTANA DE PARNAIBA,11,1992,Sociedade Limitada
35211227110,BANANA STRIP CONFECCOES LTDA. ME,SAO BERNARDO DO CAMPO,11,1992,Sociedade Limitada
35211227128,UNIVERSAL TELEFONES COMERCIO E SERVICOS LTDA.,PERUIBE,11,1992,Sociedade Limitada
35211227136,MADEIROL COMERCIO DE MADEIRAS LTDA.,PERUIBE,11,1992,Sociedade Limitada
35211227144,JUPETI COMERCIO E TERRAPLENAGEM LTDA,TREMEMBE,11,1992,Sociedade Limitada
35211227152,LANCHONETE DRINK DE COTIA LTDA,SAO PAULO,11,1992,Sociedade Limitada
35211227161,ABSTRACT WAVE COMERCIO VAREJISTA DE ARTIGOS DESPORTIVOS LTDA.,SAO BERNARDO DO CAMPO,11,1992,Sociedade Limitada
35211227187,AMEPEGE COMERCIO DE ARMARINHOS LTDA.,CAMPINAS,11,1992,Sociedade Limitada
35211227195,BAR E MERCEARIA MORANGUINHO DE COSMOPOLIS LTDA,COSMOPOLIS,11,1992,Sociedade Limitada
35211227209,ALVITUR TRASNSPORTES E TURISMO LTDA.,BAURU,11,1992,Sociedade Limitada
35211227217,265 COMERCIO DE REFEICOES LTDA.,SAO PAULO,11,1992,Sociedade Limitada
35211227225,CAETANO & YAMANOI LTDA.,BAURU,11,1992,Sociedade Limitada
35211227233,GOFFI & MOREIRA CONFECCOES LTDA - M.E.,PINDAMONHANGABA,11,1992,Sociedade Limitada
35211227241,TECNO TRONIC COMERCIO E ASSESSORIA EM TELECOMUNICACOES LTDA,SAO PAULO,11,1992,Sociedade Limitada
35211227250,DARLIFLEX INDUSTRIA E COMERCIO DE METAIS SANITARIOS LTDA.,SAO PAULO,11,1992,Sociedade Limitada
35211227268,BICICLETARIA OLIMPICA LTDA.,TAUBATE,11,1992,Sociedade Limitada
35211227276,LOJA ULTRALUX COMERCIAL LTDA.,MOGI DAS CRUZES,11,1992,Sociedade Limitada
35211227284,VATECNICA COMERCIO DE HIDRAULICOS E ASSISTENCIA TECNICA LTDA.,MOGI DAS CRUZES,11,1992,Sociedade Limitada
35211227292,M. SAT EQUIPAMENTOS E PERIFERICOS LTDA.,ARARAQUARA,11,1992,Sociedade Limitada
35211227306,MILLIMAG - INDUSTRIA E COMERCIO DE ABRASIVOS LTDA.,RIO CLARO,11,1992,Sociedade Limitada
35211227314,O RECANTO DO REI OURO BAR E LANCHES LTDA,SAO PAULO,11,1992,Sociedade Limitada
35211227322,OURICURI BAR LTDA.,SAO PAULO,11,1992,Sociedade Limitada
35211227331,CALCADOS PARTHENON LTDA.,FRANCA,11,1992,Sociedade Limitada
35211227349,H. IMADA & CIA. LTDA.,FRANCA,11,1992,Sociedade Limitada
35211227357,MORADA PRUDENTINA MATERIAIS PARA CONSTRUCAO LTDA.,PRESIDENTE PRUDENTE,11,1992,Sociedade Limitada
35211227365,ESQUADRIAS METALICAS PLANASUL LTDA.,SAO PAULO,11,1992,Sociedade Limitada
35211227373,ADIVERSOS COMERCIAL LTDA.,SAO PAULO,11,1992,Sociedade Limitada
35211227381,CASA DE CARNES MANU-DANI LTDA.,SAO PAULO,11,1992,Sociedade Limitada
35211227390,HOUSE KEEPING INDUSTRIA E COMERCIO DE PRODUTOS DE LIMPEZA LTDA.,SAO PAULO,11,1992,Sociedade Limitada
35211227403,ADRIFRAN MODAS LTDA.,SAO PAULO,11,1992,Sociedade Limitada
35211227411,TEXAS - TURBINAS A VAPOR LTDA.,PIRACICABA,11,1992,Sociedade Limitada
35211227420,BOUTIQUE K.Y. LTDA.,PIRACICABA,11,1992,Sociedade Limitada
35211227438,N.W.F.-EXTINTORES LTDA.,SAO PAULO,11,1992,Sociedade Limitada
35211227446,COELHO SAPECA CONFECCOES LTDA.,SAO PAULO,11,1992,Sociedade Limitada
35211227454,BRUNASSI MATERIAIS PARA CONSTRUCAO LTDA.,SAO PAULO,11,1992,Sociedade Limitada
35211227462,FARMACIA CHAMOMILE LTDA,CAMPO LIMPO PAULISTA,11,1992,Sociedade Limitada
35211227471,SOPOLL COMERCIAL LTDA.,SAO PAULO,11,1992,Sociedade Limitada
35211227489,GUIMARAES GOMES CONSTRUTORA E INCORPORADORA LTDA.,SAO PAULO,11,1992,Sociedade Limitada
35211227497,OFICINA DE SISTEMAS E COMERCIO DE INFORMATICA LTDA,SAO PAULO,11,1992,Sociedade Limitada
35211227501,FAGRON TECHNOLOGIES LTDA,JUNDIAI,11,1992,Sociedade Limitada
35211227519,GERACAO XXI ARTIGOS ESPORTIVOS LTDA.,SAO PAULO,11,1992,Sociedade Limitada
35211227527,RESTAURANTE PERIODICO EXPRESS LTDA.,SAO PAULO,11,1992,Sociedade Limitada
35211227535,AVICOLA MERCEARIA E ROTESSERIE AXEL LTDA.,SAO PAULO,11,1992,Sociedade Limitada
35211227543,TITULAR ORGANIZACAO COMERCIAL DE BRINDES E PONTOS COMERCIAIS LTDA.,SAO PAULO,11,1992,Sociedade Limitada
35211227551,PREDOMINANCE ARQUITETURA DECORACAO EXPORTACAO IMPORTACAO E COMERCIO LTDA.,SAO PAULO,11,1992,Sociedade Limitada
35211227560,W.C. COMERCIO E LOCACAO DE VIDEOS E SON LTDA.,SAO PAULO,11,1992,Sociedade Limitada
35211227578,PASSOCA BAR E DIVERSOES ELETRONICAS LTDA.,SAO PAULO,11,1992,Sociedade Limitada
35211227586,CHEIDA - MANUTENCAO DE APARELHOS ELETRONICOS LTDA.,SAO PAULO,11,1992,Sociedade Limitada
35211227594,QUITANDAO DO ADAIR LTDA.,SAO PAULO,11,1992,Sociedade Limitada
35211227608,FERREIRA & DIAS LTDA.,HORTOLANDIA,11,1992,Sociedade Limitada
35211227616,ZAMPOLI VIDEO LOCADORA LTDA.,GUARULHOS,11,1992,Sociedade Limitada
35211227624,LAS AMERICAS EDITORA CULTURAL LTDA.,SAO PAULO,11,1992,Sociedade Limitada
35211227632,CRONYM BIKE MANIA COMERCIO DE BICICLETAS LTDA.,CACAPAVA,11,1992,Sociedade Limitada
35211227641,CPV TRANSPORTES E SERVICOS LTDA.,CACAPAVA,11,1992,Sociedade Limitada
35211227659,MODAL AUTO CENTER LTDA,MONTEIRO LOBATO,11,1992,Sociedade Limitada
35211227667,C. F. CARVALHO COMERCIAL LTDA.,CARAGUATATUBA,11,1992,Sociedade Limitada
35211227675,COMERCIO DE BATERIAS NOSSA SENHORA DE FATIMA LTDA.,CRUZEIRO,11,1992,Sociedade Limitada
35211227683,GENA AUTO MECANICA FUNILARIA E PINTURA LTDA,TABOAO DA SERRA,11,1992,Sociedade Limitada
35211227691,MERCEARIA T K LTDA.,SAO PAULO,11,1992,Sociedade Limitada
35211227705,GRAXOMAX COMERCIO DE LUBRIFICANTES LTDA.,SAO PAULO,11,1992,Sociedade Limitada
