NIRE,Empresa,Município,Month,Year,Type
35300135041,FERTIFOS ADMINISTRACAO E PARTICIPACAO S/A,SAO PAULO,11,1992,Sociedade por Acoes
35300135059,ZAHRAN ADMINISTRACAO E PARTICIPACOES S/A.,SAO PAULO,11,1992,Sociedade por Acoes
35300135067,"SANTA ROSA PARTICIPACOES S/A ""EM RECUPERACAO JUDICIAL""",SANTA RITA DO PASSA QUATRO,11,1992,Sociedade por Acoes
35300135075,SASCO DO BRASIL S.A.,SAO PAULO,11,1992,Sociedade por Acoes
35300135083,RTK TRADING S/A.,FERRAZ DE VASCONCELOS,11,1992,Sociedade por Acoes
35300135091,IMOBILIARIA GUEIMONAT S.A.,SAO PAULO,11,1992,Sociedade por Acoes
35300135105,VELUPAR S/A.ADMINISTRACOES DE BENS IMOBILIARIOS,SAO PAULO,11,1992,Sociedade por Acoes
35300135113,BANCO INTERIOR DE SAO PAULO S.A.,SAO JOSE DO RIO PRETO,11,1992,Sociedade por Acoes
35300135121,MITSUI O.S.K. LINES - AMERICA DO SUL S/A.,SAO PAULO,11,1992,Sociedade por Acoes
35300135130,NOVA GAULE COMERCIO E PARTICIPACOES S.A.,SAO PAULO,11,1992,Sociedade por Acoes
35300135148,"EBS ADMINISTRADORA DE BENS S.A., EM LIQUIDACAO ORDINARIA",BARUERI,11,1992,Sociedade por Acoes
35300135156,DIAMOND ELETRONICA INDUSTRIA E COMERCIO S.A.,SAO PAULO,11,1992,Sociedade por Acoes
35300135164,ABRIL COMUNICACOES S/A,SAO PAULO,11,1992,Sociedade por Acoes
35300135181,CROB EMPREENDIMENTOS E PARTICIPACOES S/A,SAO PAULO,11,1992,Sociedade por Acoes
35300135199,BOMPAR CAMBIO E TURISMOS/A.,SAO PAULO,11,1992,Sociedade por Acoes
35300135202,CREDIBEL PARTICIPACOES S.A.,VOTORANTIM,11,1992,Sociedade por Acoes
35300135211,M & E S/A.,COTIA,11,1992,Sociedade por Acoes
35300135229,CAP-COMPONENTES AUTOMOTIVOS E PARTICIPACOES S.A,SAO PAULO,11,1992,Sociedade por Acoes
35300135237,ROMINOR COMERCIO EMPREENDIMENTOS E PARTICIPACOES S/A,SANTA BARBARA D'OESTE,11,1992,Sociedade por Acoes
35300135245,TIMBER REPRESENTACOES E PARTICIPACOES S/A,CAMPINAS,11,1992,Sociedade por Acoes
35300135261,ONITAL S/A.,SAO PAULO,11,1992,Sociedade por Acoes
35300525841,BANCO CREDIT SUISSE BRASIL S.A.,SAO PAULO,11,1992,Sociedade por Acoes
35300525990,UNICAR S.A.,SAO PAULO,11,1992,Sociedade por Acoes
35300526058,FUNDICAO BALANCINS S.A.,EMBU-GUACU,11,1992,Sociedade por Acoes
35300526091,OSBORNE PARTICIPACOES E REPRESENTACOES S/A.,SAO PAULO,11,1992,Sociedade por Acoes
35400022906,COOPHAGUAR - COOPERATIVA HABITACIONAL DE GUARATINGUETA E REGIAO,SAO PAULO,11,1992,Cooperativa
35400022914,COOPERATIVA HABITACIONAL DOS TRABALHADORES DO VALE DO PARAIBA - COHABITA LTDA.,JACAREI,11,1992,Cooperativa
35400022922,COOTRAO - COOPERATIVA DE TRANSPORTES RODOVIARIOS AUTONOMOS DE OURINHOS,OURINHOS,11,1992,Cooperativa
35400022931,COOPERATIVA DE ECONOMIA E CREDITO MUTUO DOS SERVIDORES DA UNESP - COOPUNESP,RIO CLARO,11,1992,Cooperativa
35400022949,UNIMED NORTE PAULISTA COOPERATIVA DE TRABALHO MEDICO,ITUVERAVA,11,1992,Cooperativa
35400022906,COOPHAGUAR - COOPERATIVA HABITACIONAL DE GUARATINGUETA E REGIAO,SAO PAULO,11,1992,Cooperativa
35400022914,COOPERATIVA HABITACIONAL DOS TRABALHADORES DO VALE DO PARAIBA - COHABITA LTDA.,JACAREI,11,1992,Cooperativa
35400022922,COOTRAO - COOPERATIVA DE TRANSPORTES RODOVIARIOS AUTONOMOS DE OURINHOS,OURINHOS,11,1992,Cooperativa
35400022931,COOPERATIVA DE ECONOMIA E CREDITO MUTUO DOS SERVIDORES DA UNESP - COOPUNESP,RIO CLARO,11,1992,Cooperativa
35400022949,UNIMED NORTE PAULISTA COOPERATIVA DE TRABALHO MEDICO,ITUVERAVA,11,1992,Cooperativa
35500021171,CONSORCIO LOT/RADIAL - VILA LEOPOLDINA,SAO PAULO,11,1992,Consorcio
35500021189,CONSORCIO - ALCOA / ALCANBRASIL / C.B.A. / FURUKAWA- II,SAO PAULO,11,1992,Consorcio
35500021197,CONSORCIO COPENE A,SAO PAULO,11,1992,Consorcio
35500099595,"CONSORCIO ENERCONSULT, PROJETEC, PLENA E ELC",SAO PAULO,11,1992,Consorcio
35500099609,COEST CONSTRUTORA S/A - DUTOFLEX TUBOS FLEXIVEIS INDUSTRIA E COMERCIO LTDA.,SAO PAULO,11,1992,Consorcio
35500021171,CONSORCIO LOT/RADIAL - VILA LEOPOLDINA,SAO PAULO,11,1992,Consorcio
35500021189,CONSORCIO - ALCOA / ALCANBRASIL / C.B.A. / FURUKAWA- II,SAO PAULO,11,1992,Consorcio
35500021197,CONSORCIO COPENE A,SAO PAULO,11,1992,Consorcio
35500099595,"CONSORCIO ENERCONSULT, PROJETEC, PLENA E ELC",SAO PAULO,11,1992,Consorcio
35500099609,COEST CONSTRUTORA S/A - DUTOFLEX TUBOS FLEXIVEIS INDUSTRIA E COMERCIO LTDA.,SAO PAULO,11,1992,Consorcio
35110758209,MARCO AURELIO MARTINS FERREIRA- SORVETERIA,OSASCO,11,1992,Empresario
35110772970,SEBASTIAO ORTIZ PAZ GUARULHOS.,GUARULHOS,11,1992,Empresario
35110782461,VERA LUCIA BARROSO,ITAQUAQUECETUBA,11,1992,Empresario
35111477599,EDNA MAURA VALENTE ALVAREDO,BROTAS,11,1992,Empresario
35111482908,OTACILIO FRANCISCO DOS SANTOS ENGENHEIRO COELHO.,ENGENHEIRO COELHO,11,1992,Empresario
35111489589,WAGNER ANTONIO DE LIMA,RIBEIRÃO PRETO,11,1992,Empresario
35112034470,GUALBERTO RUBENS LEMAIRE VICENTE,SÃO PAULO,11,1992,Empresario
35112044483,JOSE DA SILVA VASCONCELOS,OSASCO,11,1992,Empresario
35112068498,JOSEPH SAMI DUVIVIER,SANTO ANDRÉ,11,1992,Empresario
35112068501,JOSE VALMIR SATIRO,SÃO BERNARDO DO CAMPO,11,1992,Empresario
35112068510,AMELIA MARIA CUSTODIO LORENA,LORENA,11,1992,Empresario
35112068528,M M DA SILVA GUARUJA,GUARUJÁ,11,1992,Empresario
35112071871,NILTON ALVES DE ALMEIDA,JUNDIAÍ,11,1992,Empresario
35112071880,VINICIO BRAZ DE LIMA,JUNDIAÍ,11,1992,Empresario
35112071898,NELY MESSIAS BARBOSA,JUNDIAÍ,11,1992,Empresario
35112071901,JOAO FERREIRA DOS SANTOS MOGI DAS CRUZES,MOGI DAS CRUZES,11,1992,Empresario
35112071910,CARLOS ALBERTO RIBEIRO MERCEARIA,MOGI DAS CRUZES,11,1992,Empresario
35112071928,ROSANGELA BATISTA NUNES,MOGI DAS CRUZES,11,1992,Empresario
35112071936,FERNANDO ANDRE MATAO,MATÃO,11,1992,Empresario
35112071944,ARNALDO MENDES PEREIRA VETERINARIA,NOVA CANAÃ PAULISTA,11,1992,Empresario
35112071952,JOSE PEREIRA MARQUES NETO,CAÇAPAVA,11,1992,Empresario
35112071961,ALMIR PAULO DO NASCIMENTO,RIBEIRÃO BONITO,11,1992,Empresario
35112071979,VANDA LUCIA LEITE,CRUZEIRO,11,1992,Empresario
35112071987,M M SISMEIRO DE OLIVEIRA,ASSIS,11,1992,Empresario
35112071995,JOSE CARLOS NUNES S.PIRAPORA,SALTO DE PIRAPORA,11,1992,Empresario
35112072002,AIRTON JOSE DE FREITAS,AGUDOS,11,1992,Empresario
35112072011,MARCIO AURELIO FONTES FERREIRA,SILVEIRAS,11,1992,Empresario
35112072029,M C LACERDA MAGAZINE,CRUZEIRO,11,1992,Empresario
35112072037,OSWALDO TEIXEIRA DORIA MERCEARIA,CRUZEIRO,11,1992,Empresario
35112072045,MARIA JOSE BRASIL,CRUZEIRO,11,1992,Empresario
35112072053,ANTONIO DA SILVA MERCADINHO PRESIDENTE PRUDENTE,PRESIDENTE PRUDENTE,11,1992,Empresario
35112072061,F DE OLIVEIRA-PRESIDENTE PRUDENTE,PRESIDENTE PRUDENTE,11,1992,Empresario
35112072070,ORALINA ZIBORDI RAMPAZZO,CÂNDIDO MOTA,11,1992,Empresario
35112072088,JOSE LOPES TORRES PIRACICABA,PIRACICABA,11,1992,Empresario
35112072096,PEDRO DE ALMEIDA BAZAR,PRESIDENTE PRUDENTE,11,1992,Empresario
35112072100,ANTONIO VALENTIM CARMONA,SÃO PAULO,11,1992,Empresario
35112072118,JOSE MARIA AMARAL ADUBOS,MOGI DAS CRUZES,11,1992,Empresario
35112072126,MARIANA PACINI DA SILVA MERCEARIA,MOGI DAS CRUZES,11,1992,Empresario
35112072134,ANA MARIA DE CAMARGO DO PRADO,MOGI DAS CRUZES,11,1992,Empresario
35112072142,MARIA COCA DOS SANTOS,BOTUCATU,11,1992,Empresario
35112072151,MARIA ODETE TIBERIO MARSICANO,BIRIGÜI,11,1992,Empresario
35112072169,AEDISON DE OLIVEIRA,GUARARAPES,11,1992,Empresario
35112072177,NEUSA VIEIRA MONZINI ARACATUBA,ARAÇATUBA,11,1992,Empresario
35112072185,JOSE ROBERTO DE OLIVEIRA JAU,JAÚ,11,1992,Empresario
35112072193,ARLINDO DE ALMEIDA BAR,OSVALDO CRUZ,11,1992,Empresario
35112072207,SILVANA CRISTINA CARVALHO MARCON,ARAÇATUBA,11,1992,Empresario
35112072215,SANDRA REGINA TORRES DIAS ITU,ITU,11,1992,Empresario
35112072223,JOSE PEREIRA SOBRINHO BAR E MERCEARIA,FERRAZ DE VASCONCELOS,11,1992,Empresario
35112072231,TERCILIA MARIA DE SOUZA BAZAR E BOMBONIERE,POÁ,11,1992,Empresario
35112072240,ANTONIO CARLOS PAVAO MATERIAL DE CONSTRUCAO,FERRAZ DE VASCONCELOS,11,1992,Empresario
35112072258,CLAIR BIANCARDI COLLISTOCK LANCHONETE,POÁ,11,1992,Empresario
35112072266,CELIA APARECIDA DE OLIVEIRA LANCHONETE,PORTO FERREIRA,11,1992,Empresario
35112072274,JOSE ROBERTO BOMBONATI,SERTÃOZINHO,11,1992,Empresario
35112072282,RONALDO MICHELETTI,ITÁPOLIS,11,1992,Empresario
35112072291,GENI MARIA DE OLIVEIRA FRANCA.,FRANCA,11,1992,Empresario
35112072304,JOSE EMILIANO DOS SANTOS MIGUELOPOLIS,MIGUELÓPOLIS,11,1992,Empresario
35112072312,KOON HY KIM,ASSIS,11,1992,Empresario
35112072321,JOSE CARLOS BRAVIM MATERIAIS DE CONSTRUCAO,BERTIOGA,11,1992,Empresario
35112072339,JARBAS MENDES DA SILVA,CUBATÃO,11,1992,Empresario
35112072347,CLAUDIR ERNESTO LICHTNOW,COTIA,11,1992,Empresario
35112072355,ADAMO BOCCI,PRESIDENTE VENCESLAU,11,1992,Empresario
35112072363,MARIA DE FATIMA FERNANDES AMBROSIO,PRESIDENTE VENCESLAU,11,1992,Empresario
35112072371,ILIANE CARVALHO MACHADO,MANDURI,11,1992,Empresario
35112072380,JOAQUIM BATISTA DOS SANTOS GUARULHOS,GUARULHOS,11,1992,Empresario
35112072398,EDVANIR BUENO GODOI,GUARULHOS,11,1992,Empresario
35112072401,PAULO DA SILVA PEIXOTO,SÃO PAULO,11,1992,Empresario
35112072410,ROGERIO DE SOUZA BIASOTTO,OSASCO,11,1992,Empresario
35112072428,ANTONIO PEREIRA DA SILVA-PIZZARIA,SÃO PAULO,11,1992,Empresario
35112072436,ILDA KIMURA MISAKA,SÃO PAULO,11,1992,Empresario
35112072444,S CARLOS - ARMARINHOS,BRAGANÇA PAULISTA,11,1992,Empresario
35112072452,LILIANA PACE DE MELLO,BRAGANÇA PAULISTA,11,1992,Empresario
35112072461,ANDRE LONZI DE OLIVEIRA,BRAGANÇA PAULISTA,11,1992,Empresario
35112072479,JOSE FERREIRA PIRACAIA,PIRACAIA,11,1992,Empresario
35112072487,GILBERTO GONCALVES-AMBULANTE,FERRAZ DE VASCONCELOS,11,1992,Empresario
35112072495,ARMANDO CASTRO FILHO,MORUNGABA,11,1992,Empresario
35112072509,MARLENE COSTA GUSMAO AMARAL,GUAPIARA,11,1992,Empresario
35112072517,MARIA LUIZA GARBUIO STOQUE,GUATAPARÁ,11,1992,Empresario
35112072525,MARCOS DA CRUZ-SORVETES,SÃO JOAQUIM DA BARRA,11,1992,Empresario
35112072533,JOSIMAR FREITAS RIBEIRAO PRETO,RIBEIRÃO PRETO,11,1992,Empresario
35112072541,JOSE HENRIQUE SIMOES DOS SANTOS,ALTINÓPOLIS,11,1992,Empresario
35112072550,JOSE CARLOS RAMOS ACOUGUE,RIBEIRÃO PRETO,11,1992,Empresario
35112072568,JOAO B MARQUES PEREIRA M AGUDO,MORRO AGUDO,11,1992,Empresario
35112072576,EMILIA APARECIDA DE OLIVEIRA SOUZA RIB.PRETO,RIBEIRÃO PRETO,11,1992,Empresario
35112072584,CARLOS ROBERTO DE FREITAS RIBEIRAO PRETO,RIBEIRÃO PRETO,11,1992,Empresario
35112072592,PEDRO MARTINS DE OLIVEIRA RIBEIRAO PRETO,RIBEIRÃO PRETO,11,1992,Empresario
35112072606,TEREZA PEREIRA FRANCA,RIBEIRÃO PRETO,11,1992,Empresario
35112072614,THAIS REZENDE DE MELO MARQUES,RIBEIRÃO PRETO,11,1992,Empresario
35112072622,VALMIR APARECIDO DE OLIVEIRA OTICA,,11,1992,Empresario
35112072631,CACILDO APARECIDO MUNIZ MERCEARIA,GUARACI,11,1992,Empresario
35112072649,EDSON RODRIGUES DO PRADO MOGI DAS CRUZES,MOGI DAS CRUZES,11,1992,Empresario
35112072657,MOHAMED HUSSEIN ALI YOUSSEF,MOGI DAS CRUZES,11,1992,Empresario
35112072665,MANOEL VITOR DOS SANTOS ITABERA,ITABERÁ,11,1992,Empresario
35112072673,AMABILE BIMBATTI FERREIRA,ITAPEVA,11,1992,Empresario
35112072681,WALTER FERREIRA DA SILVA JALES,JALES,11,1992,Empresario
35112072690,JANETE APARECIDA ALVES BARBOSA BOMBONIERE,SÃO PAULO,11,1992,Empresario
35112072703,EDIVIZELIA OLIVEIRA MAIA,EMBU DAS ARTES,11,1992,Empresario
35112072711,AMAURI GARCIA DOMINGUES,AVARÉ,11,1992,Empresario
35112072720,PATRICIA ELENA DE SOUZA,PARAGUAÇU PAULISTA,11,1992,Empresario
35112072738,SERGIO LUIZ DE CARVALHO CONFECCOES,LORENA,11,1992,Empresario
35112072746,RUY FERNANDES,LORENA,11,1992,Empresario
35112072754,MANOEL CABOCLO DA SILVA AUTO PECAS,SÃO PAULO,11,1992,Empresario
35112072762,JOSE HENRIQUE PICOLO VOTUPORANGA,VOTUPORANGA,11,1992,Empresario
35112072771,FABIANA FERNANDES PAIZAN,LINS,11,1992,Empresario
35112072789,FLORISVALDO DIONISIO SOUZA,CARAPICUÍBA,11,1992,Empresario
35112072797,GENIVALTE FERREIRA SANTOS,SÃO PAULO,11,1992,Empresario
35112072801,ROGERIA DIAS,ARARAQUARA,11,1992,Empresario
35112072819,TEREZINHA OLIVEIRA DE BITENCOURT,BOTUCATU,11,1992,Empresario
35112072827,FLAVIO APARECIDO PINHEIRO,ATIBAIA,11,1992,Empresario
35112072835,PAULO HENRIQUE CHIAVEGATO,PEDREIRA,11,1992,Empresario
35112072843,ELIEL FERREIRA SOARES ITATIBA,ITATIBA,11,1992,Empresario
35112072851,JANE DA SILVA FIORINI,SÃO PAULO,11,1992,Empresario
35112072860,ORLANDO QUALHO-LOTERIAS,SÃO PAULO,11,1992,Empresario
35112072878,JAINE M. BOZELLI ALMEIDA,JUNDIAÍ,11,1992,Empresario
35112072886,JEFERSON LUIS RIGOLDI,TUPÃ,11,1992,Empresario
35112072894,LAURENTINO DE ANDRADE,ARARAQUARA,11,1992,Empresario
35112072908,CARLOS CESAR VANZELA,JOSÉ BONIFÁCIO,11,1992,Empresario
35112072916,NORAIR GAZOTTO FORNER,ENGENHEIRO COELHO,11,1992,Empresario
35112072924,VALDENICE BAZZO HERRERO SANTANA,TUPÃ,11,1992,Empresario
35112072932,VALQUIRIA CUNHA,IBITINGA,11,1992,Empresario
35112072941,DORIVAL JOSE FERREIRA,CÂNDIDO MOTA,11,1992,Empresario
35112072959,WILSON CARLOS MARTINS P PRUDENTE,PRESIDENTE PRUDENTE,11,1992,Empresario
35112072967,EDINALDO COSMO DE MOURA VINHEDO,VINHEDO,11,1992,Empresario
35112072975,JOSEFA DA SILVA PORTO,SÃO BERNARDO DO CAMPO,11,1992,Empresario
35112072983,VALDIR DE OLIVEIRA BENS MOVEIS,SÃO PAULO,11,1992,Empresario
35112072991,MARCOS MUNHOZ,IBITINGA,11,1992,Empresario
35112073009,RUBER LEITE DE SIQUEIRA,JACAREÍ,11,1992,Empresario
35112073017,SEBASTIAO CARLOS DE FREITAS,JACAREÍ,11,1992,Empresario
35112073025,OSWALD E FRIEDRICHSDORF,VÁRZEA PAULISTA,11,1992,Empresario
35112073033,WILSON R.BIGARDI,JUNDIAÍ,11,1992,Empresario
35112073041,JORGE CARLOS SPELLING,CAMPINAS,11,1992,Empresario
35112073050,VIRGINIA RODRIGUES SERAIDARIAN,CAMPINAS,11,1992,Empresario
35112073068,LEOMARA APARECIDA ESBELTI DOS SANTOS,VALINHOS,11,1992,Empresario
35112073076,DARCI VIANA SOUZA,CAMPINAS,11,1992,Empresario
35112073084,SILVANA APARECIDA ROSSI SUZANO,SUZANO,11,1992,Empresario
35112073092,REGINALDO JOSE CONSERVANI,SANTA GERTRUDES,11,1992,Empresario
35112073106,ELZITO L.SARAFIM,RIO CLARO,11,1992,Empresario
35112073114,DELMA MITSUMI MIYATA SAKAGAMI FEIRANTE,SÃO PAULO,11,1992,Empresario
35112073122,MARLI VIEIRA RODRIGUES,SANTO ANDRÉ,11,1992,Empresario
35112073131,EVANILDO ARAUJO SILVA,SÃO BERNARDO DO CAMPO,11,1992,Empresario
35112073149,CONCEICAO APARECIDA FERRES CHACON,AVANHANDAVA,11,1992,Empresario
35112073157,REGINA CELIA DE PAULA SANTOS,SÃO JOSÉ DOS CAMPOS,11,1992,Empresario
35112073165,ORLANDO DA SILVA PEREIRA BATATAIS,BATATAIS,11,1992,Empresario
35112073173,NATALIA CARDOSO DOS SANTOS,SERTÃOZINHO,11,1992,Empresario
35112073181,BENEDITO LOURENCO SAO JOSE DOS CAMPOS,SÃO JOSÉ DOS CAMPOS,11,1992,Empresario
35112073190,CLARICE DE SOUZA LEITE SJCAMPOS,SÃO JOSÉ DOS CAMPOS,11,1992,Empresario
35112073203,J A DE VASCONCELOS,SÃO JOSÉ DOS CAMPOS,11,1992,Empresario
35112073211,F.W.WATANABE,SÃO PAULO,11,1992,Empresario
35112073220,SHIGUECO HIRATA UCHIMA,SOROCABA,11,1992,Empresario
35112073238,DERCY LOURENCO,PIRAPORA DO BOM JESUS,11,1992,Empresario
35112073246,CREUZA LOPES BUENO ARACATUBA,ARAÇATUBA,11,1992,Empresario
35112073254,EDUARDO ALVES DE SOUZA AVICULTURA,OSASCO,11,1992,Empresario
35112073262,TERENCIO RODRIGUES GOES,MAUÁ,11,1992,Empresario
35112073271,SANDRA MARIA PEREIRA,AURIFLAMA,11,1992,Empresario
35112073289,IVANI DE SOUZA,MATÃO,11,1992,Empresario
35112073297,A.P.S. JERONIMO,SÃO JOÃO DA BOA VISTA,11,1992,Empresario
35112073301,ORIVALDO MARIOTTO,IBATÉ,11,1992,Empresario
35112073319,ANTONIO OSVALDO DE CARVALHO SAO CARLOS,SÃO CARLOS,11,1992,Empresario
35112073327,ROBERTO AUGUSTO DONEGA,GUZOLÂNDIA,11,1992,Empresario
35112073335,ISAC JACINTO DA SILVA,PINDAMONHANGABA,11,1992,Empresario
35112073343,IVONE DE OLIVEIRA MONTEIRO,SÃO PAULO,11,1992,Empresario
35112073351,HERMINIO MARINHO DA SILVA BAR,SÃO PAULO,11,1992,Empresario
35112073360,JAIME ALVES FERREIRA GUARAREMA,GUARULHOS,11,1992,Empresario
35112073378,JOAO MIGUEL VILLA,ITATIBA,11,1992,Empresario
35112073386,ELIZABETH CARMONA CORTEZ PIRES,SÃO CARLOS,11,1992,Empresario
35112073394,R B SILVA CARBOTEC,SÃO PAULO,11,1992,Empresario
35112073408,SONIA REGINA MENIN,VERA CRUZ,11,1992,Empresario
35112073416,PAULO SERGIO DE ARAUJO ESPORTES,SÃO PAULO,11,1992,Empresario
35112073424,PAULO KLETLINGUER JUNIOR,SALTO,11,1992,Empresario
35112073432,VERISSIMO GOMES DOS SANTOS,ARARAS,11,1992,Empresario
35112073441,PAULO CESAR PALHARES CATANDUVA,CATANDUVA,11,1992,Empresario
35112073459,VALDOMIRO FERREIRA CORDEIRO.,LEME,11,1992,Empresario
35112073467,EDILENE DE GODOY,PIRASSUNUNGA,11,1992,Empresario
35112073475,JOSE ROBERTO PEREIRA - BAR,JOSÉ BONIFÁCIO,11,1992,Empresario
35112073483,VALDEMIR APARECIDO SILVA AGUDOS,AGUDOS,11,1992,Empresario
35112073491,LUIZ JOSE MULLER ALVES,OSVALDO CRUZ,11,1992,Empresario
35112073505,FERNANDO DE OLIVEIRA BAZAR,MAIRINQUE,11,1992,Empresario
35112073513,MANOEL RESENDE DE SOUZA LEME,LEME,11,1992,Empresario
35112073521,ALINE APARECIDA JAZE WOLPERT,JUQUIÁ,11,1992,Empresario
35112073530,FRANCISCO LASSO DE LA VEGA FILHO,SANTO ANDRÉ,11,1992,Empresario
35112073548,ANTONIO CELESTINO FERREIRA BAR,OSVALDO CRUZ,11,1992,Empresario
35112073556,ANTONIA DE MIRANDA RABELLO,IBIÚNA,11,1992,Empresario
35112073564,LUIZ CARLOS LIBERATO,AVARÉ,11,1992,Empresario
35112073572,MARIA NEIDE RIBEIRO,,11,1992,Empresario
35112073581,SANTO TORTELLI,SÃO CAETANO DO SUL,11,1992,Empresario
35112073599,MARCIO FRACCAROLI VEICULOS,SANTOS,11,1992,Empresario
35112073602,EDUARDO DE CASTRO NETO REPRESENTACAO,SANTOS,11,1992,Empresario
35112073611,ALDA DE ALMEIDA MARQUES,SANTOS,11,1992,Empresario
35112073629,JOSE ROBERTO PENNINCKS,MOGI DAS CRUZES,11,1992,Empresario
35112073637,JOSE VIEIRA CARNEIRO,SÃO BERNARDO DO CAMPO,11,1992,Empresario
35112073645,TELMA REGINA GABRIEL,SÃO BERNARDO DO CAMPO,11,1992,Empresario
35112073653,APARECIDA MARIA REIS,SÃO JOSÉ DOS CAMPOS,11,1992,Empresario
35112073661,RICARDO CARDOSO,IACANGA,11,1992,Empresario
35112073670,ANDRE LUIZ PERIN,VALINHOS,11,1992,Empresario
35112073688,CLEUSA D'FORTON,LOUVEIRA,11,1992,Empresario
35112073696,ENSO SEBASTIAO PASQUINELI ACOUGUE,PRESIDENTE PRUDENTE,11,1992,Empresario
35112073700,GILDETE MICHELMAN FERREIRA DE SOUSA,SÃO JOSÉ DOS CAMPOS,11,1992,Empresario
35112073718,GERALDO MMAGELA DE ASSIS,ESPÍRITO SANTO DO PINHAL,11,1992,Empresario
35112073726,MARIA LUIZA APPARECIDA DA SILVA,LEME,11,1992,Empresario
35112073734,ELIANA OLIVEIRA DOS SANTOS,SÃO PAULO,11,1992,Empresario
35112073742,FRANCISCO XAVIER GOMES FERNANDES,ATIBAIA,11,1992,Empresario
35112073751,ELIAS LAOR DE BARROS NEVES,SANTA CRUZ DA CONCEIÇÃO,11,1992,Empresario
35112073769,RAQUEL F. DOS SANTOS FRANCO,VÁRZEA PAULISTA,11,1992,Empresario
35112073777,MARGARETE APARECIDA CHULTEZ,SANTO ANDRÉ,11,1992,Empresario
35112073785,ANTONIO CARLOS DE MIRANDA SANTO ANDRE,SANTO ANDRÉ,11,1992,Empresario
35112073793,SONIA REGINA DE SOUZA BAR,VARGEM GRANDE DO SUL,11,1992,Empresario
35112073807,FLAVIO DE OLIVEIRA CONFECCOES,PIRAPOZINHO,11,1992,Empresario
35112073815,RONALDO JUNQUEIRA BARBOSA REIS,LINS,11,1992,Empresario
35112073823,MARIA DE LOURDES GIROTTO PELITEIRO,SANTA CRUZ DAS PALMEIRAS,11,1992,Empresario
35112073831,ADEMIR CANALI PEIXARIA,INDAIATUBA,11,1992,Empresario
35112073840,MASAO HASHIMOTO,SÃO PAULO,11,1992,Empresario
35112073858,EUNICE INOUE BRANCO HASHIMOTO,JAMBEIRO,11,1992,Empresario
35112073866,YEN TSAI SHU HUEI,MAUÁ,11,1992,Empresario
35112073874,JOCELY DA SILVA BUENO DOMINGUES,CHARQUEADA,11,1992,Empresario
35112073882,RITA DE CASSIA MEDICO MARTINEZ,RIBEIRÃO PRETO,11,1992,Empresario
35112073891,REINALDO GARCIA BAURU,BAURU,11,1992,Empresario
35112073904,ROGERIO RODRIGUES ALVES-GAMES,SÃO PAULO,11,1992,Empresario
35112073912,TELMO FAUSTINO GEMELGO,SÃO PAULO,11,1992,Empresario
35112073921,ISVALDO GREGORIO TRANSPORTES,SÃO PAULO,11,1992,Empresario
35112073939,ANTONIO MIRANDA PEREIRA BAR,OSASCO,11,1992,Empresario
35112073947,LURDES FERREIRA,SÃO PAULO,11,1992,Empresario
35112073955,J.LOPES TRANSPORTES,SÃO PAULO,11,1992,Empresario
35112073963,FABIO ANTONIO TEIXEIRA SUMARE,SUMARÉ,11,1992,Empresario
35112073971,WILSON TAVARES DA SILVA,SÃO JOSÉ DOS CAMPOS,11,1992,Empresario
35112073980,ROSA MARIA OKUBO CIAMPI,SÃO PAULO,11,1992,Empresario
35112073998,JORGE YOSHIYUKI YOKOMIZO,SUZANO,11,1992,Empresario
35112074005,ANTONIO HENRIQUE CONFESSOR-GUARULHOS-,GUARULHOS,11,1992,Empresario
35112074013,SANDRO EDUARDO RODRIGUES,IBITINGA,11,1992,Empresario
35112074021,JOSE DE SOUSA-SEVERINIA,,11,1992,Empresario
35112074030,SILVIA TAWATA MIYASATO PERUIBE,PERUÍBE,11,1992,Empresario
35112074048,FIORAVANTE IAZZETTI GRANDO,TATUÍ,11,1992,Empresario
35112074056,IDAIR SILVA FERREIRA,ASSIS,11,1992,Empresario
35112074064,JOSE ROBERTO FREIRE MARILIA,MARÍLIA,11,1992,Empresario
35112074072,NELSON MARTINS DOS SANTOS TUPA,TUPÃ,11,1992,Empresario
35112074081,TULIO SILVEIRA BRETAS,IBIÚNA,11,1992,Empresario
35112074099,CARLITO PEDRO DA CUNHA,SÃO PAULO,11,1992,Empresario
35112074102,BENEDITO VIEIRA DE GOES,IBIÚNA,11,1992,Empresario
35112074111,AMERICO ANTUNES SOARES,GUARATINGUETÁ,11,1992,Empresario
35112074129,RUBENS PAULO BATISTA-MARTINOPOLIS,MARTINÓPOLIS,11,1992,Empresario
35112074137,LUIZ CLOVIS PEDRO,ANGATUBA,11,1992,Empresario
35112074145,ANNA MARIA DE PAULA,CÂNDIDO MOTA,11,1992,Empresario
35112074153,LUCIANO DE ABREU MATERIAIS PARA CONSTRUCAO,ITAPEVI,11,1992,Empresario
35112074161,RICARDO CORREA,SÃO PAULO,11,1992,Empresario
35112074170,SUZI CECILIA LEITE MOLENA,,11,1992,Empresario
35112074188,MANOEL BATISTA DE SANTANA,PRAIA GRANDE,11,1992,Empresario
35112074196,MARCO BOFFA CARBURADORES,SÃO PAULO,11,1992,Empresario
35112074200,TIAGO DIAS DA SILVA MERCEARIA,SÃO PAULO,11,1992,Empresario
35112074218,IVAN PEREIRA DE CAMARGO ATIBAIA,ATIBAIA,11,1992,Empresario
35112074226,OTACILIO RIBEIRO BRAGA TAUBATE,TAUBATÉ,11,1992,Empresario
35112074234,J A G PADULA,TAUBATÉ,11,1992,Empresario
35112074242,LEON D.M.PERES,LIMEIRA,11,1992,Empresario
35112074251,M. DOMINICI - DECORACOES,BRAGANÇA PAULISTA,11,1992,Empresario
35112074269,JOSE HENRIQUE PEREIRA ANDRADE,SANTOS,11,1992,Empresario
35112074277,JOAO IVO S PERANOVICH,ATIBAIA,11,1992,Empresario
35112074285,DIRCE RODRIGUES JOAQUIM,ASSIS,11,1992,Empresario
35112074293,JOSETE DE ARAUJO DALLINGA,EMBU DAS ARTES,11,1992,Empresario
35112074307,FERNANDO TOYOMI SHIMIZU,LEME,11,1992,Empresario
35112074315,ADEMIR APARECIDO ROSA LEME,LEME,11,1992,Empresario
35112074323,TAKEHIKO SUZUKI,PINDAMONHANGABA,11,1992,Empresario
35112074331,LAIR GARCIA BELETATO DE SOUZA,SALES OLIVEIRA,11,1992,Empresario
35112074340,C A T LIMA,SÃO PAULO,11,1992,Empresario
35112074358,ERIVALDO DO VALE SILVA,SÃO CAETANO DO SUL,11,1992,Empresario
35112074366,ANDREA TAVARES ANTUNES DE SOUZA,DIADEMA,11,1992,Empresario
35112074374,VANIA MARIA POLETTINI ZULIANI,MOGI MIRIM,11,1992,Empresario
35112074382,ANTONIO LUCIO DE LIMA NETO,SANDOVALINA,11,1992,Empresario
35112074391,MARIA HELENA DO CARMO ARAUJO,TARABAI,11,1992,Empresario
35112074404,ALBA PALMA DE CARVALHO,PORTO FELIZ,11,1992,Empresario
35112074412,MANOEL CARLOS FONSECA IBITINGA,IBITINGA,11,1992,Empresario
35112074421,EUNICE GONZAGA SANTANA,ITARIRI,11,1992,Empresario
35112074439,ROSANA CARONE,SÃO PAULO,11,1992,Empresario
35112074447,JOSE LUIZ MUNHOZ LAFRAIA,SÃO PAULO,11,1992,Empresario
35112074455,IONE MARIA DEPOIAN RADOMILE,OSASCO,11,1992,Empresario
35112074463,MAGNALDA PEREIRA DA SILVA,SÃO PAULO,11,1992,Empresario
35112074471,IVANILDA LACERDA DE OLIVEIRA,SANTO ANDRÉ,11,1992,Empresario
35112074480,LUCIANO VEROLA NETTO,ÁGUAS DA PRATA,11,1992,Empresario
35112074498,JOAO VITOR GOMES,SÃO PAULO,11,1992,Empresario
35112074501,PAULO SERGIO DA SILVA MOJI GUACU,,11,1992,Empresario
35112074510,EDMILSON JOSE SILVA BAURU,BAURU,11,1992,Empresario
35112074528,NIVALDO PAVAN JUNIOR,RIO CLARO,11,1992,Empresario
35112074536,PEDRO EDGARD BELLINI RIO PRETO,SÃO JOSÉ DO RIO PRETO,11,1992,Empresario
35112074544,APARECIDA LUIZ DA COSTA - RIO PRETO,SÃO JOSÉ DO RIO PRETO,11,1992,Empresario
35112074552,CARLOS ALBERTO PENEDO NOGUEIRA,NOVA GRANADA,11,1992,Empresario
35112074561,PERSIDA APARECIDA FAQUIM,POTIRENDABA,11,1992,Empresario
35112074579,SEBASTIAO NARCIZO GOMES,MIRASSOL,11,1992,Empresario
35112074587,E M ALVES DE MELO,SÃO JOSÉ DO RIO PRETO,11,1992,Empresario
35112074595,LIZETTE SANT'ANNA MAJUDA,SÃO JOSÉ DO RIO PRETO,11,1992,Empresario
35112074609,MARCOS ROBERTO DE BRITO,CATANDUVA,11,1992,Empresario
35112074617,ROBERTA CHRISTINA AGUILAR RIO PRETO,SÃO JOSÉ DO RIO PRETO,11,1992,Empresario
35112074625,NELSON PEREIRA DA SILVA FERNANDOPOLIS,FERNANDÓPOLIS,11,1992,Empresario
35112074633,BEATRIZ HELENA EHLIN MARTINS,SÃO JOÃO DA BOA VISTA,11,1992,Empresario
35112074641,NELSON FARINAZZO CONFECCOES,SÃO JOSÉ DO RIO PRETO,11,1992,Empresario
35112074650,NERALDINO FERREITA VIEIRA,,11,1992,Empresario
35112074668,RUBENS ANTONIO MORAES,SÃO JOSÉ DO RIO PRETO,11,1992,Empresario
35112074676,MARIA ROSA BERNARDES GRECCO RIO PRETO,SÃO JOSÉ DO RIO PRETO,11,1992,Empresario
35112074684,RENATO VIEIRA DA SILVA NEVES PAULISTA,NEVES PAULISTA,11,1992,Empresario
35112074692,MARIA BEATRIZ RIBEIRO MIRANDA,PAULO DE FARIA,11,1992,Empresario
35112074706,BEATRIZ RAUL TREVELATO,SÃO JOSÉ DO RIO PRETO,11,1992,Empresario
35112074714,JOSE BENEDITO DOS REIS,SÃO JOSÉ DO RIO PRETO,11,1992,Empresario
35112074722,ANA LUCIA S FERRAZ,SÃO JOSÉ DO RIO PRETO,11,1992,Empresario
35112074731,ODAIR ROBERTO MORELATO,MIRASSOL,11,1992,Empresario
35112074749,SONIA GALDEANO CAMAROTTO,GENERAL SALGADO,11,1992,Empresario
35112074757,DANIEL SOUZA ROCHA,MINEIROS DO TIETÊ,11,1992,Empresario
35112074765,FRANCISCO RODRIGUES DE SANT'ANA RIO PRETO,SÃO JOSÉ DO RIO PRETO,11,1992,Empresario
35112074773,ANTONIO CARLOS PAULETO-POLONI-,POLONI,11,1992,Empresario
35112074781,JOAO DONIZETI LUCAS RIO PRETO,SÃO JOSÉ DO RIO PRETO,11,1992,Empresario
35112074790,LAURITO DELIBERTO NETO,SÃO JOSÉ DO RIO PRETO,11,1992,Empresario
35112074803,LUCIA BERCELINO DE ARAUJO,SÃO JOSÉ DO RIO PRETO,11,1992,Empresario
35112074811,MARIA HELENA DE ALMEIDA CAMARGO,URUPÊS,11,1992,Empresario
35112074820,P E DA SILVA JUNIOR,SÃO JOÃO DA BOA VISTA,11,1992,Empresario
35112074838,NEURECY LOURENCO BAR E MERCEARIA,SANTO ANDRÉ,11,1992,Empresario
35112074846,PATRICIA CRISTINA FERREIRA PORTELA,MOGI DAS CRUZES,11,1992,Empresario
