NIRE,Empresa,Município,Month,Year,Type
35112971341,ALESSANDRA DE MELLO STOCCO,SÃO JOSÉ DOS CAMPOS,3,1994,Empresario
35112971350,V F DO ESPIRITO SANTO,SÃO JOSÉ DOS CAMPOS,3,1994,Empresario
35112971368,ROSELIN CHEBILESKI,MOGI DAS CRUZES,3,1994,Empresario
35112971376,GERSON JULIO PEREIRA BAR,SÃO PAULO,3,1994,Empresario
35112971384,MARIZA LUCIENE COSTA RIBEIRO-CIDADE NAUTICA,SÃO VICENTE,3,1994,Empresario
35112971392,MARIA FERREIRA DE LIMA MARQUES PENSAO,SÃO VICENTE,3,1994,Empresario
35112971406,MARIA PATRICIO DE LIMA BAR E LANCHES,SANTOS,3,1994,Empresario
35112971414,MARILDA QUINTINO DA SILVA BAZAR,SÃO PAULO,3,1994,Empresario
35112971422,UMBERTO DE SOUZA SOARES,SANTOS,3,1994,Empresario
35112971431,PATRICIA CONCEICAO DE CAMARGO,ITAPEVA,3,1994,Empresario
35112971449,MARIA APARECIDA DE OLIVEIRA RODRIGUES USINAGEM,DIADEMA,3,1994,Empresario
35112971457,N C TEIXEIRA C MACEDO,,3,1994,Empresario
35112971465,EDMILSON PEREIRA DE CARVALHO AURIFLAMA,AURIFLAMA,3,1994,Empresario
35112971473,ANA MARIA SARAIVA,BAURU,3,1994,Empresario
35112971481,PAULO EDUARDO DO NASCIMENTO - PISCINAS,LEME,3,1994,Empresario
35112971490,CLAUDIO MAIA JUNIOR,DIVINOLÂNDIA,3,1994,Empresario
35112971503,SIMONE MULLER,PIRASSUNUNGA,3,1994,Empresario
35112971511,CARLOS ALBERTO DE GODOY MOREIRA E COSTA REPRESENTACOES,SÃO PAULO,3,1994,Empresario
35112971520,SELMA ROSEMAR DE PAULA TAUBATE,TAUBATÉ,3,1994,Empresario
35112971538,MARCOS ROBERTO MUNIZ DOS SANTOS BAURU,BAURU,3,1994,Empresario
35112971546,RILDA CLAUDIA NUNES,SÃO JOSÉ DOS CAMPOS,3,1994,Empresario
35112971554,GENER LUIZ BAFINI S J CAMPOS,SÃO JOSÉ DOS CAMPOS,3,1994,Empresario
35112971562,JULIETA DE OLIVEIRA-RESTAURANTE,SÃO PAULO,3,1994,Empresario
35112971571,AMANDIO DINIS MARQUES,SÃO VICENTE,3,1994,Empresario
35112971589,MELLIZA CRISTINA BELLINI DA SILVA,SÃO PAULO,3,1994,Empresario
35112971601,SILVIA ALVES VIEIRA CALÇADOS,GUARULHOS,3,1994,Empresario
35112971619,G CARUSO,HORTOLÂNDIA,3,1994,Empresario
35112971627,ELZA MATIUZZI XAVIER,CARAPICUÍBA,3,1994,Empresario
35112971635,DJALMA JOSE PASCHOAL,SÃO PAULO,3,1994,Empresario
35112971643,INES ANGELA TECHIO,SÃO PAULO,3,1994,Empresario
35112971651,LUIZ CASSIO GENEROSO INDAIATUBA,INDAIATUBA,3,1994,Empresario
35112971660,BENEDITO CELSO DOS SANTOS ART'S,SÃO PAULO,3,1994,Empresario
35112971678,SANDRA MARA APARECIDA DA SILVA CALEJON DE ALMEIDA,SÃO BERNARDO DO CAMPO,3,1994,Empresario
35112971686,DORA MARIA ALBINO TUCCI,JOANÓPOLIS,3,1994,Empresario
35112971694,J. M. S. TEIXEIRA BAURU,BAURU,3,1994,Empresario
35112971708,ANTONIO CLAUDIO RIBEIRO,SÃO JOÃO DA BOA VISTA,3,1994,Empresario
35112971716,VANDO ALVES DE CARVALHO,SÃO PAULO,3,1994,Empresario
35112971724,ANA MARIA SANTOS BAR,SÃO PAULO,3,1994,Empresario
35112971732,SERGIO GOMES,SANTOS,3,1994,Empresario
35112971741,AMELIA PEREIRA ALVES,SANTOS,3,1994,Empresario
35112971759,MARIA APARECIDA DE ALMEIDA SILVA,SANTOS,3,1994,Empresario
35112971767,ROBSON AUGUSTO BUENO DE OLIVEIRA,SÃO PAULO,3,1994,Empresario
35112971775,RONALDO VIANA DO CARMO,PIACATU,3,1994,Empresario
35112971783,DINALVA DE J GUIMARAES DE JESUS,OSASCO,3,1994,Empresario
35112971791,EUCLIDES FRANCISCO ALARCON,SÃO BERNARDO DO CAMPO,3,1994,Empresario
35112971805,J L R DA SILVA LANCHONETE,VARGEM GRANDE DO SUL,3,1994,Empresario
35112971813,JACOB TENORIO DA SILVA,SÃO PAULO,3,1994,Empresario
35112971821,CARMIN VOLOVICI,SÃO PAULO,3,1994,Empresario
35112971830,THIAGO O. MOLINA MINI MERCADO E CASA DE CARNES,SÃO PAULO,3,1994,Empresario
35112971848,NILTON GONCALVES DE LIMA MERCEARIA,BOA ESPERANÇA DO SUL,3,1994,Empresario
35112971856,CELINA ALVES DOMINGUES KLEMP,LINS,3,1994,Empresario
35112971864,MARIA DO AMPARO ALVES SILVA,DIADEMA,3,1994,Empresario
35112971872,JESUS AUGUSTO BASSAN SANTA FE DO SUL,SANTA FÉ DO SUL,3,1994,Empresario
35112971881,SANTINA MARCONDES DOS SANTOS,MARTINÓPOLIS,3,1994,Empresario
35112971899,GRAZIELLA HADDAD LABATE,ITAPETININGA,3,1994,Empresario
35112971902,TATSUO TAKAHASHI,OSVALDO CRUZ,3,1994,Empresario
35112971911,VANDA DE FATIMA GUSTINELLI SILVA,PIRACICABA,3,1994,Empresario
35112971929,MARIA APARECIDA PAOLI FOLENA,IBIÚNA,3,1994,Empresario
35112971937,FRANCISCO CARLOS DA SILVA OLIVEIRA,SANTO ANDRÉ,3,1994,Empresario
35112971945,ABILIO JORGE PERALTA ACOUGUE,SÃO PAULO,3,1994,Empresario
35112971953,MARCELO RAMOS DOS SANTOS TAPECARIA,SUZANO,3,1994,Empresario
35112971961,ADRIANA VASQUES,SÃO PAULO,3,1994,Empresario
35112971970,AURI LEITE DE OLIVEIRA,SÃO PAULO,3,1994,Empresario
35112971988,JOSE MOACIR GUZZI,LIMEIRA,3,1994,Empresario
35112971996,SOLANGE P SEMPREBON,LIMEIRA,3,1994,Empresario
35112972003,ANTONIO APARECIDO MENDES MERCEARIA,LIMEIRA,3,1994,Empresario
35112972011,ARNALDO CALIXTO VIEIRA BAR,SÃO PAULO,3,1994,Empresario
35112972020,MARIA AUGUSTA TEMPLE DE ALMEIDA PEDREIRA,SÃO PAULO,3,1994,Empresario
35112972038,ANCELMO RODRIGUES FILHO PIZZARIA E LANCHONETE,SÃO PAULO,3,1994,Empresario
35112972046,RAUL PEROZZI,SANTO ANDRÉ,3,1994,Empresario
35112972054,DALVA LUCIA BARBOSA,SÃO JOSÉ DO RIO PRETO,3,1994,Empresario
35112972062,IVNA G FERREIRA,ORINDIÚVA,3,1994,Empresario
35112972071,PATRICIA DE CARVALHO LIMA RIO PRETO,SÃO JOSÉ DO RIO PRETO,3,1994,Empresario
35112972089,RENATO ALVES DA SILVA RIO PRETO,SÃO JOSÉ DO RIO PRETO,3,1994,Empresario
35112972097,HENRIQUE FLAMINIO FILHO,JACAREÍ,3,1994,Empresario
35112972101,SONIA MARIA BISPO SJ-CAMPOS,SÃO JOSÉ DOS CAMPOS,3,1994,Empresario
35112972119,JOSE APARECIDO DA SILVA JACAREI,JACAREÍ,3,1994,Empresario
35112972127,KIYOKO HIRAKUI,SÃO JOSÉ DOS CAMPOS,3,1994,Empresario
35112972135,L B DA R MENDES,SÃO JOSÉ DOS CAMPOS,3,1994,Empresario
35112972143,ADAIR ROBERTO,RIBEIRÃO PRETO,3,1994,Empresario
35112972151,ANTONIO HENRIQUE GARCIA-FRANCA,FRANCA,3,1994,Empresario
35112972160,LUIZ CARLOS DOMINIQUINI CALCADOS,FRANCA,3,1994,Empresario
35112972178,MARISA DE CARVALHO RIO PRETO,SÃO JOSÉ DO RIO PRETO,3,1994,Empresario
35112972186,AMARILIA ROSA DA SILVA,JOSÉ BONIFÁCIO,3,1994,Empresario
35112972208,RITA DE CASSIA TOMASELLO ARAUJO,SÃO JOSÉ DO RIO PRETO,3,1994,Empresario
35112972216,SHIRLEY ROSANA DE OLIVEIRA,SÃO JOSÉ DO RIO PRETO,3,1994,Empresario
35112972224,GENOVEVA QUINTILIANO COSTA RIO PRETO,SÃO JOSÉ DO RIO PRETO,3,1994,Empresario
35112972232,MARTA MARTINS ROBERTO,NOVA GRANADA,3,1994,Empresario
35112972241,PEDRO LUIS TORRES DELGADO,BADY BASSITT,3,1994,Empresario
35112972259,JOSE FERNANDO DE OLIVEIRA CANDIDO,RIBEIRÃO PRETO,3,1994,Empresario
35112972267,HELI GAIOLI,RIBEIRÃO PRETO,3,1994,Empresario
35112972275,CLEMILDA SOUSA ANDRADE,FRANCA,3,1994,Empresario
35112972283,CLEVERSON MAGALHAES PEREIRA PINTO,FRANCA,3,1994,Empresario
35112972291,E. BERTOLINI,ARARAQUARA,3,1994,Empresario
35112972305,ERNANI DONIZETE PASTI,SÃO JOSÉ DA BELA VISTA,3,1994,Empresario
35112972313,J. SOUZA FRANCA,FRANCA,3,1994,Empresario
35112972321,MARIA DE FATIMA AZEVEDO FRANCA,FRANCA,3,1994,Empresario
35112972330,NELSON BACCARO FRANCA,FRANCA,3,1994,Empresario
35112972348,PAULO CESAR VELOSO,FRANCA,3,1994,Empresario
35112972356,GUILHERMINA MARIA DE SOUSA SILVA,SÃO JOSÉ DA BELA VISTA,3,1994,Empresario
35112972364,JOSE AUGUSTO FERREIRA FRANCA,FRANCA,3,1994,Empresario
35112972372,SONIA MARIA GARCIA DE MATOS,FRANCA,3,1994,Empresario
35112972381,PEDRO DIAS DE CARVALHO,SÃO JOSÉ DO RIO PRETO,3,1994,Empresario
35112972399,CLEUSA FERNANDES BORGES HILARIO,OLÍMPIA,3,1994,Empresario
35112972402,CRISTIANE GASQUES DRUDI MIRASSOL,MIRASSOL,3,1994,Empresario
35112972411,LUIZ FERNANDO FREU OLIMPIA,OLÍMPIA,3,1994,Empresario
35112972429,MARCOS HENRIQUE SANTOS RIO PRETO,SÃO JOSÉ DO RIO PRETO,3,1994,Empresario
35112972437,MARILENE DE CARVALHO RIO PRETO,SÃO JOSÉ DO RIO PRETO,3,1994,Empresario
35112972445,R M D B BOCALON,SÃO JOSÉ DO RIO PRETO,3,1994,Empresario
35112972453,SILVANA FERREIRA DA COSTA SCRIVANTI,MIRASSOL,3,1994,Empresario
35112972461,VALDOMIRO AIZA DE ARAUJO,SÃO JOSÉ DO RIO PRETO,3,1994,Empresario
35112972470,ADAUTO ALVARO ARVATI RIO PRETO,SÃO JOSÉ DO RIO PRETO,3,1994,Empresario
35112972488,ADELAIDE GADOTI DE SOUZA GEACCHETO,RIOLÂNDIA,3,1994,Empresario
35112972496,AGENOR CORREA DE CASTRO-RIO PRETO,SÃO JOSÉ DO RIO PRETO,3,1994,Empresario
35112972500,ANA MARIA DA SILVA RIO PRETO,SÃO JOSÉ DO RIO PRETO,3,1994,Empresario
35112972518,ATAIDE BAPTISTA,NOVA GRANADA,3,1994,Empresario
35112972526,L. G. DE RESENDE,SÃO JOSÉ DO RIO PRETO,3,1994,Empresario
35112972534,ANTONIO YOSHIO OYAGI,REGISTRO,3,1994,Empresario
35112972542,CLAUDIO BEZERRA DE OLIVEIRA,SÃO PAULO,3,1994,Empresario
35112972551,JOSE RAIMUNDO DA SILVA PEREIRA,OSASCO,3,1994,Empresario
35112972569,FON KUO PAO,MOGI DAS CRUZES,3,1994,Empresario
35112972577,MAURICIO RODRIGUES DA SILVA FEIRANTE,SÃO PAULO,3,1994,Empresario
35112972585,A. G. DE SOUZA PECAS,SANTOS,3,1994,Empresario
35112972593,L F AUGUSTO LANCHES,PRAIA GRANDE,3,1994,Empresario
35112972607,ROSANGELA BONATTI LIMA,DIADEMA,3,1994,Empresario
35112972615,DENILSON SANTANA,LENÇÓIS PAULISTA,3,1994,Empresario
35112972623,COSME FERREIRA,BAURU,3,1994,Empresario
35112972631,LUZIA HIRSCH,SÃO PAULO,3,1994,Empresario
35112972640,JOSE FERNANDO FONSECA DE BARAO DE AZEVEDO BAURU,BAURU,3,1994,Empresario
35112972658,SERGIO YOSHIOKA,JUQUITIBA,3,1994,Empresario
35112972666,JORGE BARBOSA - FRUTEIRO,SÃO PAULO,3,1994,Empresario
35112972674,HAROLDO RICCETTO FILHO,JUQUITIBA,3,1994,Empresario
35112972682,MARILIZ YUMI KAWATI - SACOLAO,EMBU-GUAÇU,3,1994,Empresario
35112972691,MARCOS ANTONIO PROENCE ARMANDO,BARRA DO TURVO,3,1994,Empresario
35112972704,GENIEL AUGUSTO DA SILVA,CUNHA,3,1994,Empresario
35112972712,ELAINE CRISTINA LOPES,TABOÃO DA SERRA,3,1994,Empresario
35112972721,ULISSES SERISSA - INDAIATUBA,INDAIATUBA,3,1994,Empresario
35112972739,TERESA BENEDITA DE CAMARGO SILVA,IGUAPE,3,1994,Empresario
35112972747,ADALTO FORNAZARI DE ARAUJO,VOTUPORANGA,3,1994,Empresario
35112972755,FRANCISCO SEGISFREDO MOURA,GUARULHOS,3,1994,Empresario
35112972763,IZABEL REDONDO FERNANDES,CAFELÂNDIA,3,1994,Empresario
35112972771,N GALLANO,MOGI MIRIM,3,1994,Empresario
35112972780,VIVALDA RIBEIRO DOS SANTOS,,3,1994,Empresario
35112972798,CLEUSA APARECIDA GUILHERME MATEO,SÃO PAULO,3,1994,Empresario
35112972801,EDINA LURIO UTSUNOMIYA,CAJAMAR,3,1994,Empresario
35112972810,MARCELO F DE PAULA,SÃO PAULO,3,1994,Empresario
35112972828,SANDRA DOS SANTOS NOZELLA BAR E LANCHES,SÃO PAULO,3,1994,Empresario
35112972836,MARISA PIRES DOTTO,JANDIRA,3,1994,Empresario
35112972844,JOAO BOSCO PADARIA,ALUMÍNIO,3,1994,Empresario
35112972852,CLAUDIA REGINA EVANGELISTA ITATIBA,ITATIBA,3,1994,Empresario
35112972861,MARCELO PAIS DE ANDRADE,SÃO PAULO,3,1994,Empresario
35112972879,JOSE PAULO TEIXEIRA PIZZARIA,OSASCO,3,1994,Empresario
35112972887,YANG YUAN,SÃO PAULO,3,1994,Empresario
35112972895,JORGE ALVES GUARULHOS,GUARULHOS,3,1994,Empresario
35112972909,MARCIA REGINA VALSECHI BOBOWSKI,SÃO PAULO,3,1994,Empresario
35112972917,SERGIO LUIS TEIXEIRA DA SILVA,CAPIVARI,3,1994,Empresario
35112972925,MICHAEL ERICH WROBLEWSKI,RIBEIRÃO PRETO,3,1994,Empresario
35112972933,HAROLDO DIAS XAVIER - FEIRANTE,SÃO VICENTE,3,1994,Empresario
35112972941,ANTONIO PEREIRA DA SILVA GAS,TAUBATÉ,3,1994,Empresario
35112972950,W. BEZERRA DE SOUZA,TAUBATÉ,3,1994,Empresario
35112972968,CRISTINA IHAS,ITUPEVA,3,1994,Empresario
35112972976,CARLOS ALBERTO APARECIDO APOLINARIO,CARAGUATATUBA,3,1994,Empresario
35112972984,MARIA ANGELA VILLELA SAVIAN,CARAGUATATUBA,3,1994,Empresario
35112972992,MICHEL CAROLI.,SERRA NEGRA,3,1994,Empresario
35112973000,NILSON LOPES DA SILVA CARAGUATATUBA,CARAGUATATUBA,3,1994,Empresario
35112973018,SILVANA STAMPACCHIO,SÃO PAULO,3,1994,Empresario
35112973026,VANI INGE BURG,CAMPINAS,3,1994,Empresario
35112973034,DALVA DE FATIMA B. RODRIGUES,CAMPINAS,3,1994,Empresario
35112973042,MARCIA CRISTINA NOGUEIRA CUNHA CAMPINAS,CAMPINAS,3,1994,Empresario
35112973051,ELISA CRISTINA CAMARA BARBOSA,RIBEIRÃO PRETO,3,1994,Empresario
35112973069,MARIA CRISTINA ZAMBELLI CARBONERI,RIBEIRÃO PRETO,3,1994,Empresario
35112973077,ROSA YOSHIKO NISIYAMAMOTO,RIBEIRÃO PRETO,3,1994,Empresario
35112973085,JOSE CARLOS DOS SANTOS MONGAGUA-QUIOSQUE TREZE,MONGAGUÁ,3,1994,Empresario
35112973093,CARLA REGINA CARVALHO REINA,RIBEIRÃO PRETO,3,1994,Empresario
35112973107,GERALDO MAGELA TOLINTINO LEITE,SÃO PAULO,3,1994,Empresario
35112973115,NADIR DE CAMARGO CUSTODIO PINHEIRO,SANTA CRUZ DO RIO PARDO,3,1994,Empresario
35112973123,PAULO GERMANO DE CASTRO TAQUARITINGA,TAQUARITINGA,3,1994,Empresario
35112973131,MARIA DA CONCEICAO HORTA SALVADO CANONGIA LOPES,SOROCABA,3,1994,Empresario
35112973140,SERGIO E.VIEIRA JR.,SANTA RITA DO PASSA QUATRO,3,1994,Empresario
35112973158,JOSE EDGAR MELLO SILVA DO PRADO-BAURU,BAURU,3,1994,Empresario
35112973166,FABIO DA SILVA BASTOS,QUATÁ,3,1994,Empresario
35112973174,CARLOS CESAR M TUMA JARDINOPOLIS,JARDINÓPOLIS,3,1994,Empresario
35112973182,MARIA APARECIDA MIRAVETE MARINI,CAMPOS DO JORDÃO,3,1994,Empresario
35112973191,PEDRO FERREIRA GONCALVES PINDAMONHANGABA,PINDAMONHANGABA,3,1994,Empresario
35112973204,JOSE WLADEMIR RODRIGUES PINDA,PINDAMONHANGABA,3,1994,Empresario
35112973212,DARCY DE OLIVEIRA FILHO,PINDAMONHANGABA,3,1994,Empresario
35112973221,SAID SALIM LASMAR RIBEIRAO PRETO,RIBEIRÃO PRETO,3,1994,Empresario
35112973239,TAKESHIGE KAKUTA TRANSPORTES,TAUBATÉ,3,1994,Empresario
35112973247,MARISA NICOLINO NASCIMENTO TAVARES,PINDAMONHANGABA,3,1994,Empresario
35112973255,ROSANGELA APARECIDA MENEZES,SANTO ANDRÉ,3,1994,Empresario
35112973263,VALDEHI CAVALCANTE DE ALBUQUERQUE,SÃO PAULO,3,1994,Empresario
35112973271,ROSE MERI APARECIDA ROSSONI GUARNIERI,,3,1994,Empresario
35112973280,MARIA DE LOURDES DIAS GLOE,SÃO PAULO,3,1994,Empresario
35112973298,JOSE EVARISTO ARROYOS,BARRA BONITA,3,1994,Empresario
35112973301,MANOEL JACINTO DE ALMEIDA-CONFECCAO,GUARULHOS,3,1994,Empresario
35112973310,MARIA APARECIDA DE MATTOS ANDREOZZI ARARAQUARA,ARARAQUARA,3,1994,Empresario
35112973328,MARLENE VANDERLEY DA SILVA,OURINHOS,3,1994,Empresario
35112973336,NELSON APARECIDO DE NADAI,MARÍLIA,3,1994,Empresario
35112973344,OLIVIA SOUZA PEDROSA MELO,OURINHOS,3,1994,Empresario
35112973352,OSMAR DE OLIVEIRA PENQUES LINS,LINS,3,1994,Empresario
35112973361,RITA CLAUDIA OLIVEIRA GOMES,MONTE ALTO,3,1994,Empresario
35112973379,ROSENEIDE MARLY FAZOLARO GOMES ARARAQUARA,ARARAQUARA,3,1994,Empresario
35112973387,SEBASTIANA PIRES FERRARI CATIGUA,CATIGUÁ,3,1994,Empresario
35112973395,SILVIA REGINA PEREIRA SAO CARLOS,SÃO CARLOS,3,1994,Empresario
35112973409,CLAUDINEI DE ALMEIDA TRENTIN,PORTO FELIZ,3,1994,Empresario
35112973417,ROSEMARY DE JESUS PXANTICOSUSQUE,PORTO FELIZ,3,1994,Empresario
35112973425,ROSANA APARECIDA CAMPANARO,JUNDIAÍ,3,1994,Empresario
35112973433,MARLY APARECIDA TEIXEIRA SUMARE,SUMARÉ,3,1994,Empresario
35112973441,LEILA MARISA PASSARO SILVA,GUAPIARA,3,1994,Empresario
35112973450,JOSE MEDEIROS DOS SANTOS CONSTRUCAO,PERUÍBE,3,1994,Empresario
35112973468,SERGIO MARTINS PELEGRINA,BAURU,3,1994,Empresario
35112973476,JOAQUIM GANDRA DE OLIVEIRA PLIS,PENÁPOLIS,3,1994,Empresario
35112973484,VALTER BIZACHI,LEME,3,1994,Empresario
35112973492,LUIZ ANTONIO DOS SANTOS GUARA,GUARÁ,3,1994,Empresario
35112973506,MARCELO LUIZ FERREIRA,SANTA CRUZ DO RIO PARDO,3,1994,Empresario
35112973514,ANTONIO LIMA DE SOUZA-INSTALACOES INDUSTRIAIS,SÃO CARLOS,3,1994,Empresario
35112973522,DOMENICO ANTONIO GHINELLI,CABRÁLIA PAULISTA,3,1994,Empresario
35112973531,ANTONIO NATAL MICOCCI,SÃO CARLOS,3,1994,Empresario
35112973549,MARIA ROSARIO DA COSTA FUSCO,SÃO PAULO,3,1994,Empresario
35112973557,VALMI PERES AIDAR JUNIOR,CATANDUVA,3,1994,Empresario
35112973565,A S FERREIRA DOCES,SÃO PAULO,3,1994,Empresario
35112973573,V M S LUONGO,SÃO PAULO,3,1994,Empresario
35112973581,SERGIO LUIS DOS SANTOS SILVA,CAPÃO BONITO,3,1994,Empresario
35112973590,TERESA IKUKO YARA,SÃO PAULO,3,1994,Empresario
35112973603,ADIR COSTA FARIA,SANTO ANDRÉ,3,1994,Empresario
35112973611,ANTONIO SINESIO RODRIGUES TRANSPORTADORA,SANTO ANDRÉ,3,1994,Empresario
35112973620,JAIRO ANDRADE SERVIÇOS EMPRESARIAIS,SÃO PAULO,3,1994,Empresario
35112973638,CARLOS EDUARDO DE OLIVEIRA SAO THIAGO,SÃO PAULO,3,1994,Empresario
35112973646,MARCOS ANTONIO DE MIRA,GUARULHOS,3,1994,Empresario
35112973654,MARCIA DO CARMO MIRANDA-RIO PRETO,SÃO JOSÉ DO RIO PRETO,3,1994,Empresario
35112973662,CLAUDIO NUNES UCHOA,UCHOA,3,1994,Empresario
35112973671,RUBENS DE SOUZA RIO PRETO.,SÃO JOSÉ DO RIO PRETO,3,1994,Empresario
35112973689,MARCOS FARINELLI,SANTO ANDRÉ,3,1994,Empresario
35112973697,MARCIA B BARBOSA PRESENTES,SÃO PAULO,3,1994,Empresario
35112973701,ANTONIO CARLOS PIRES DO AMARAL,CAMPO LIMPO PAULISTA,3,1994,Empresario
35112973719,MARCOS AMERICO DONIZETE MONTEIRO,SANTO ANDRÉ,3,1994,Empresario
35112973727,HELMOTI MUSEKA,MONGAGUÁ,3,1994,Empresario
35112973743,ELIZABETH SALUSTIANO DE SOUZA,CAMPINAS,3,1994,Empresario
35112973751,LILIAN MARY DE SOUZA GOMES CAMPINAS,CAMPINAS,3,1994,Empresario
35112973760,LUIS SALVIA JUNIOR - VIDROS,SÃO PAULO,3,1994,Empresario
35112973778,BENTO NOGUEIRA DO NASCIMENTO,CAMPINAS,3,1994,Empresario
35112973786,REINALDO DE ABREU RIZEK BARUERI,JANDIRA,3,1994,Empresario
35112973794,SEBASTIÃO VIANA ENTREGAS RAPIDAS,SÃO PAULO,3,1994,Empresario
35112973808,ANTONIO VITOR PECCIOLI,CATANDUVA,3,1994,Empresario
35112973816,ALEXANDRE EMANUEL GULLI PRESIDENTE PRUDENTE,PRESIDENTE PRUDENTE,3,1994,Empresario
35112973824,APARECIDO NOGUEIRA DA SILVA LANCHONETE ME,MARÍLIA,3,1994,Empresario
35112973832,BENEDITA ELISA MORAES,ARARAQUARA,3,1994,Empresario
35112973841,DEVANIR DE MATOS FERNANDES LENCOIS PAULISTA,LENÇÓIS PAULISTA,3,1994,Empresario
35112973859,FABIO CAGNIN,ARARAQUARA,3,1994,Empresario
35112973867,ISABEL DE FATIMA MORAIS MELIN,PEDERNEIRAS,3,1994,Empresario
35112973875,JOAO FERREIRA MISSAO,ARARAQUARA,3,1994,Empresario
35112973883,JOAO NUNES SALTO GRANDE,SALTO GRANDE,3,1994,Empresario
35112973891,LUIZ MARIO FERNANDES,JUNQUEIRÓPOLIS,3,1994,Empresario
35112973905,"MONICA APARECIDA PELEGRIN LENCOIS ""INABILITADA PARA EXERCER ATIVIDADE EMPRESARIAL""",LENÇÓIS PAULISTA,3,1994,Empresario
35112973913,MIZAEL BOSCHETTI,ADAMANTINA,3,1994,Empresario
35112973921,RITA DE CASSIA SILVA NEGRAO MARQUES DE OLIVEIRA,SÃO ROQUE,3,1994,Empresario
35112973930,ANTONIO LUIZ SILVEIRA SERRANA,SERRANA,3,1994,Empresario
35112973948,JULIO GENTILLE,JUNDIAÍ,3,1994,Empresario
35112973956,PAULO BICCIO OSASCO,OSASCO,3,1994,Empresario
35112973964,JOAO TEIXEIRA DIAS OSASCO,OSASCO,3,1994,Empresario
35112973972,ALEXANDRE MARTINS BATZLI,ITATIBA,3,1994,Empresario
35112973981,MARCOS ANTONIO BIZARRI,PIRANGI,3,1994,Empresario
35112973999,FLAVIA FERNANDES MAGALHAES RIBEIRAO PRETO,RIBEIRÃO PRETO,3,1994,Empresario
35112974006,J.DOS SANTOS FILHO RIBEIRAO PRETO,RIBEIRÃO PRETO,3,1994,Empresario
35112974014,LURDES SILVA OLIVEIRA,SÃO JOAQUIM DA BARRA,3,1994,Empresario
35112974022,MARIA JOSE NUNES COELHO,BATATAIS,3,1994,Empresario
35112974031,MARIA TERESA DE MATHIA PASCHOALINO,RIBEIRÃO PRETO,3,1994,Empresario
35112974049,RODOLPHO RUBENS REHDER,RIBEIRÃO PRETO,3,1994,Empresario
35112974057,R.D.F. DO NASCIMENTO - TAPECARIA,TUPÃ,3,1994,Empresario
35112974065,MARINA BENEDITA LEITE SJCAMPOS,SÃO JOSÉ DOS CAMPOS,3,1994,Empresario
35112974073,S DEVALIN DE OLIVEIRA,SÃO JOSÉ DOS CAMPOS,3,1994,Empresario
35112974081,SEBASTIAO VILELA FERREIRA MERCADINHO,SÃO JOSÉ DOS CAMPOS,3,1994,Empresario
35112974090,M S ZAVASKI MOVEIS,SÃO PAULO,3,1994,Empresario
35112974103,MARIA LUCIA BORGES GRAFICAS,SÃO PAULO,3,1994,Empresario
35112974111,R C MONTEIRO SJCAMPOS,SÃO JOSÉ DOS CAMPOS,3,1994,Empresario
35112974120,VALDAIR DOS SANTOS MERCEARIA,SÃO JOSÉ DOS CAMPOS,3,1994,Empresario
35112974138,GERMANO DE OLIVEIRA E SOUZA NETO REPRESENTACOES,SÃO PAULO,3,1994,Empresario
35112974146,JOSE RAYMUNDO FILHO AUTO PECAS,POÁ,3,1994,Empresario
35112974154,MARIA OLINDA RODRIGUES,SÃO PAULO,3,1994,Empresario
35112974162,ARLINDO SANTOS MACHADO BIJUTERIAS,SÃO VICENTE,3,1994,Empresario
35112974171,ELIZABETH REQUEJO COSTA-JOQUEI CLUBE,SÃO VICENTE,3,1994,Empresario
35112974189,MARISTELA GONCALVES VERA-SAO VICENTE,SÃO VICENTE,3,1994,Empresario
35112974197,JOAO FRANCISCO DA SILVA-SAO VICENTE,SÃO VICENTE,3,1994,Empresario
35112974201,NILSON MALTA DA SILVA,SÃO PAULO,3,1994,Empresario
35112974219,ALEXANDER FIGUEIREDO,CRISTAIS PAULISTA,3,1994,Empresario
35112974227,CELIO APARECIDO MARTINELLI DE ARAUJO CAIUA,CAIUÁ,3,1994,Empresario
35112974235,MILTON LUIZ ASSIS,ASSIS,3,1994,Empresario
35112974243,PAULO TAVARES,OSASCO,3,1994,Empresario
35112974251,JOSE DO AMARAL MOTA,BAURU,3,1994,Empresario
35112974260,MARIA APARECIDA DIAS RIO CLARO,RIO CLARO,3,1994,Empresario
35112974278,LUIZ BEZERRA DA SILVA EDITORA E PUBLICIDADE,SÃO PAULO,3,1994,Empresario
35112974286,ANTONIO ARRAIS FILHO,TABOÃO DA SERRA,3,1994,Empresario
35112974294,LUIZ GONZAGA BUSSINATI,TABOÃO DA SERRA,3,1994,Empresario
35112974308,SONIA SANCHEZ TOME,SÃO PAULO,3,1994,Empresario
35112974316,LUCY ELIZABETH TILLI,SÃO PAULO,3,1994,Empresario
35112974324,JULIO CESAR CLAUDINO-LIMEIRA,LIMEIRA,3,1994,Empresario
35112974332,JULIETA CORREIA DE ARAUJO-TRAYLLER,CAMPINAS,3,1994,Empresario
35112974341,FABIO APARECIDO DE SOUZA TORQUATO LANCHONETE,CAMPINAS,3,1994,Empresario
35112974359,VALMA M. G. OLIVEIRA EVENTOS,SÃO PAULO,3,1994,Empresario
35112974367,JORGE JOSE DOS SANTOS EDITORA,ITAPEVI,3,1994,Empresario
35112974375,ROBSOM ALEXANDRE DE SIQUEIRA-LIMEIRA,LIMEIRA,3,1994,Empresario
35112974383,ROSENILDA AMORIM DA SILVA - LIMEIRA,LIMEIRA,3,1994,Empresario
35112974391,OTILA DA SILVA SILVEIRA,LIMEIRA,3,1994,Empresario
35112974405,TOSHIE YAMANAKA,SÃO PAULO,3,1994,Empresario
35112974413,CECILIA S. FERREIRA MERCEARIA,CARAPICUÍBA,3,1994,Empresario
35112974421,CELIO JOSE DOS SANTOS,SÃO BERNARDO DO CAMPO,3,1994,Empresario
35112974430,MARIA JOSE ALVES RELIGIOSOS ME.,GUARULHOS,3,1994,Empresario
35112974448,CARLOS AUGUSTO MOREIRA DECORACOES,SÃO PAULO,3,1994,Empresario
35112974456,MARIA J. DA ROSA COMUNICACOES,OSASCO,3,1994,Empresario
35112974464,VIVIANE ALICE ROSSI,OSASCO,3,1994,Empresario
35112974472,JOSE APARECIDO DURANTI,,3,1994,Empresario
35112974481,SEBASTIAO MARIO DE SOUZA,JAGUARIÚNA,3,1994,Empresario
35112974502,ROSELI GABRIEL,JALES,3,1994,Empresario
35112974511,LUIZ H O FERRAZ,CRUZEIRO,3,1994,Empresario
35112974529,MIRIAM ROSA,SÃO PAULO,3,1994,Empresario
35112974537,RAUL FERNANDO BANCHIERI TEIXEIRA,SÃO PAULO,3,1994,Empresario
35112974545,MARIA APARECIDA DA CRUZ SORVETERIA CARAPICUIBA,CARAPICUÍBA,3,1994,Empresario
35112974553,JORGE PAULO MOYSES PIZZARIA,SÃO PAULO,3,1994,Empresario
35112974561,ISRAEL FERREIRA DE ASSIS INTERMEDIACOES,SÃO PAULO,3,1994,Empresario
35112974570,MAURICIO ABREU,JUQUITIBA,3,1994,Empresario
35112974588,A.C.MIQUILES FILHO ELETRICA,SÃO PAULO,3,1994,Empresario
35112974596,MARIA DE ANDRADE PIACETELI,SÃO PAULO,3,1994,Empresario
35112974600,PAULO JOHNSON GABRIEL DA CUNHA,SÃO PAULO,3,1994,Empresario
35207996864,MITA DE LUPERCIO SERRALHEIRA LTDA,,3,1994,Sociedade Limitada
35210095236,TODESCHINI DISTRIBUIDORA DE AUTO PECAS LTDA.,SAO PAULO,3,1994,Sociedade Limitada
35210754337,RECUGUACU CALCADOS LTDA,MOGI-GUACU,3,1994,Sociedade Limitada
35210756046,APETECE PRODUTOS ALIMENTICIOS LTDA.,BARUERI,3,1994,Sociedade Limitada
35210758723,JIM COMERCIO DE AUTOMOVEIS LTDA.,SAO PAULO,3,1994,Sociedade Limitada
35210760779,MINI MERCADO JORGAN LTDA,SANTOS,3,1994,Sociedade Limitada
35210763506,MERCEARIA MURAYAMA LTDA.,CAMPINAS,3,1994,Sociedade Limitada
35210764481,AUTO MECANICA E ELETRICA MEGA QUATRO LTDA.,SAO PAULO,3,1994,Sociedade Limitada
35210764596,TAMBORTAM TAMBORES LTDA,TABOAO DA SERRA,3,1994,Sociedade Limitada
35210771011,CELSO ROBERTO DA SILVEIRA & CIA LTDA.,PORTO FELIZ,3,1994,Sociedade Limitada
35210771461,COMERCIO DE FRIOS E LATICINIOS BONSUCESSO LTDA.,OSASCO,3,1994,Sociedade Limitada
35211454078,LEVILI BAZAR E COMERCIO LTDA.,SAO PAULO,3,1994,Sociedade Limitada
35211462861,COMERCIAL DE ALIMENTOS ALFANO LTDA.,RIBEIRAO PRETO,3,1994,Sociedade Limitada
35212097791,LIB COMERCIO DE PNEUS LTDA.,SAO CAETANO DO SUL,3,1994,Sociedade Limitada
35212122575,EDER LUCIO BRAGHIN & CIA. LTDA.,PIRAPOZINHO,3,1994,Sociedade Limitada
35212122583,J.M.DOS SANTOS & CIA S.ANASTACIO LTDA.,SANTO ANASTACIO,3,1994,Sociedade Limitada
35212122591,CUNHA & SILVA CHAVANTES LTDA.,CHAVANTES,3,1994,Sociedade Limitada
35212122605,NELSON CAMARGO & FILHOS LTDA.,VOTUPORANGA,3,1994,Sociedade Limitada
35212122613,FABRICA DE VELAS IMPERIAL LTDA.,LIMEIRA,3,1994,Sociedade Limitada
35212122621,BOSCOVITA INDUSTRIA E COMERCIO LTDA.,LIMEIRA,3,1994,Sociedade Limitada
35212122630,COMERCIAL LUVE LIMEIRA LTDA.,LIMEIRA,3,1994,Sociedade Limitada
35212122648,BKB RIO DISTRIBUIDORA DE BEBIDAS LTDA,RIO CLARO,3,1994,Sociedade Limitada
35212122656,BARDELIN & TAKEMOTO LTDA.,AMERICANA,3,1994,Sociedade Limitada
35212122664,MERCEARIA OLIVEIRA II LTDA,SAO PAULO,3,1994,Sociedade Limitada
35212122672,J. R. REGAZZO REPRESENTACOES LTDA.,SANTA BARBARA D'OESTE,3,1994,Sociedade Limitada
35212123725,ROCHEDO CONSTRUCAO E JARDINAGEM LTDA.,EMBU,3,1994,Sociedade Limitada
35212123733,KI-NATA INDUSTRIA E COMERCIO LTDA.,SAO PAULO,3,1994,Sociedade Limitada
35212123741,"DECOLORES TRATAMENTO DE SUPERFICIE E METAIS LTDA. - ""INABILITADA PARA EXERCER ATIVIDADE EMPRESARIAL""",ITAQUAQUECETUBA,3,1994,Sociedade Limitada
35212123750,SEAWRIGHT COMERCIO E REPRESENTACOES DE LINGERIE LTDA.,PARANAPANEMA,3,1994,Sociedade Limitada
35212123768,SOUZA ALVES CURSOS LIVRES LTDA.,SAO JOSE DOS CAMPOS,3,1994,Sociedade Limitada
35212123776,PIRESVEL TRANSPORTES LTDA.,SAO PAULO,3,1994,Sociedade Limitada
35212123784,ARVAZ PRODUCOES EM INFORMATICA SOCIEDADE LIMITADA,SAO PAULO,3,1994,Sociedade Limitada
35212123792,FANNYS COMERCIO EM INFORMATICA LTDA.,SAO PAULO,3,1994,Sociedade Limitada
35212123806,CAR HOUSE DE SAO CARLOS-COMERCIO DE VEICULOS LTDA.,SAO CARLOS,3,1994,Sociedade Limitada
35212123814,"MARCA COMPRA, VENDA E CONSTRUCAO DE IMOVEIS LTDA",SAO PAULO,3,1994,Sociedade Limitada
35212123822,COMERCIO DISTRIBUICAO DE TINTAS CENTRO PAULISTA LTDA.,SAO CARLOS,3,1994,Sociedade Limitada
35212123831,MERCANTIL LINDH LTDA.,SAO PAULO,3,1994,Sociedade Limitada
