NIRE,Empresa,Município,Month,Year,Type
35212137050,PASTELARIA MARIA FULO LTDA.,SAO PAULO,3,1994,Sociedade Limitada
35212137068,TECNOPECAS COMERCIO E RECUPERADORA DE PECAS AUTOMOTIVAS LTDA,JACAREI,3,1994,Sociedade Limitada
35212137076,ALCIONE & FERRAZ LTDA.,CACAPAVA,3,1994,Sociedade Limitada
35212137084,"LW COMUNICACAO, CRIACAO, PRODUCAO E DESENVOLVIMENTO LTDA",SAO PAULO,3,1994,Sociedade Limitada
35212137092,ASGEM - COMERCIO E SERVICOS DE INFORMATICA LTDA.,SAO PAULO,3,1994,Sociedade Limitada
35212137106,MARQUES & VILELA REPRESENTACOES COMERCIAIS LTDA.,JUQUITIBA,3,1994,Sociedade Limitada
35212137114,VOLPATO & BERGAMO LTDA.,BARRA BONITA,3,1994,Sociedade Limitada
35212137122,IGARAPE COMERCIO DE AGUA BEBIDAS E BEBEDOUROS LTDA.,SANTO ANDRE,3,1994,Sociedade Limitada
35212137131,EMBAFORM INDUSTRIA E COMERCIO LTDA.,SAO PAULO,3,1994,Sociedade Limitada
35212137149,"CABEC INFORMATICA, COMERCIO E REPRESENTACOES LTDA.",SAO PAULO,3,1994,Sociedade Limitada
35212137157,BASSANESI COMERCIO DE EMBALAGENS DE PAPELAO LTDA,SAO PAULO,3,1994,Sociedade Limitada
35212137165,JOLIE CENTER EQUIPAMENTO DE ESTETICA LTDA.,SAO PAULO,3,1994,Sociedade Limitada
35212137173,SUCATA CONFECCOES E ESTAMPARIA LTDA.,SAO PAULO,3,1994,Sociedade Limitada
35212137181,RIDANI COMERCIO E REPRESENTACAO LTDA.,SAO PAULO,3,1994,Sociedade Limitada
35212137190,P SANTOS PRODUTOS ALIMENTICIOS LTDA.,SAO PAULO,3,1994,Sociedade Limitada
35212137203,RUBUGLUS REPRESENTACOES LTDA.,DIADEMA,3,1994,Sociedade Limitada
35212137211,BLISS REPRESENTACOES LTDA.,SAO PAULO,3,1994,Sociedade Limitada
35212137220,MASSAHIRO REPRESENTACOES LTDA.,SAO PAULO,3,1994,Sociedade Limitada
35212137238,BOTTARO REPRESENTACOES LTDA.,SAO PAULO,3,1994,Sociedade Limitada
35212137246,MONTE REAL ROUPAS PROFISSIONAIS LTDA.,TABOAO DA SERRA,3,1994,Sociedade Limitada
35212137254,MONTE CASTELO VIDEO LOCADORA LTDA.,SAO BERNARDO DO CAMPO,3,1994,Sociedade Limitada
35212137262,COMERCIAL BUENO & SANTOS LTDA.,SAO JOSE DOS CAMPOS,3,1994,Sociedade Limitada
35212137271,MULTIPLA EDITORA E TECNOLOGIA EDUCACIONAL LTDA,JUNDIAI,3,1994,Sociedade Limitada
35212137289,GS - COMUNICACOES SOCIAIS LTDA.,SAO PAULO,3,1994,Sociedade Limitada
35212137297,COFOFA MODA INFANTIL LTDA.,SAO CAETANO DO SUL,3,1994,Sociedade Limitada
35212137301,RIMA COMERCIO DE PRODUTOS E SERVICOS ESTETICOS LTDA.,SOROCABA,3,1994,Sociedade Limitada
35212137319,SAKITA COMERCIO DE FRUTAS LTDA.,SAO PAULO,3,1994,Sociedade Limitada
35212137327,LANIFICIO RECORD LTDA.,SAO PAULO,3,1994,Sociedade Limitada
35212137335,ITAPECERICA SUPER LANCHES LTDA.,SAO PAULO,3,1994,Sociedade Limitada
35212137343,DEVEKTUR VIAGENS E TURISMO LTDA.,SAO PAULO,3,1994,Sociedade Limitada
35212137351,M. F. DO NASCIMENTO & CIA. LTDA.,SANTOS,3,1994,Sociedade Limitada
35212137360,EGG HEARD SOM E ACESSORIOS LTDA,INDAIATUBA,3,1994,Sociedade Limitada
35212137378,MARMORARIA MARAPE LTDA.,SAO PAULO,3,1994,Sociedade Limitada
35212137386,"KONTAK VIAGENS, TURISMO E EVENTOS LTDA",SAO PAULO,3,1994,Sociedade Limitada
35212137394,CONFECCOES TRIMIX LTDA.,SAO PAULO,3,1994,Sociedade Limitada
35212137408,A PLUS CONSULTORIA E SISTEMAS LTDA.,SAO PAULO,3,1994,Sociedade Limitada
35212137416,"DRYLAC - SOLVENTES, TINTAS E VERNIZES LTDA.",SALTO,3,1994,Sociedade Limitada
35212137424,CALENDULA COMERCIO DE ARTIGOS PARA PRESENTES LTDA.,SAO PAULO,3,1994,Sociedade Limitada
35212137432,"RECORD-COMERCIO, PRODUCOES E EVENTOS EVANGELICOS LTDA",SANTOS,3,1994,Sociedade Limitada
35212137441,TERRASSA INDUSTRIA E COMERCIO DE VESTUARIOS E ACESSORIOS LTDA.,INDAIATUBA,3,1994,Sociedade Limitada
35212137459,LEITERIA DOMICILIAR LTDA.,SAO PAULO,3,1994,Sociedade Limitada
35212137467,SANDREPEC PECAS AUTOMOTIVAS LTDA.,SANTO ANDRE,3,1994,Sociedade Limitada
35212137475,ARTE & EFEITO COMERCIO DE EMBALAGENS LTDA,SAO BERNARDO DO CAMPO,3,1994,Sociedade Limitada
35212137483,SLBB COMUNICACAO LTDA.,SAO PAULO,3,1994,Sociedade Limitada
35212137491,"FGF EXPORTADORA, IMPORTADORA E COMERCIAL LTDA.",SAO PAULO,3,1994,Sociedade Limitada
35212137505,RIOSAMPA CORRETORA DE SEGUROS LTDA.,SAO PAULO,3,1994,Sociedade Limitada
35212137513,MATHEUS MALHAS MOLDES AVIAMENTOS E MAQUINAS LTDA.,SAO JOSE DOS CAMPOS,3,1994,Sociedade Limitada
35212137521,LOPAS-MATERIAIS PARA CONSTRUCAO DE GARCA LTDA.,GARCA,3,1994,Sociedade Limitada
35212137530,O PORAO COMERCIO DE DISCOS CD'S LTDA.,BAURU,3,1994,Sociedade Limitada
35212137548,CASPER TRANSPORTES LTDA.,SAO PAULO,3,1994,Sociedade Limitada
35212137556,MOGNOCAMP COMERCIO DE MADEIRAS LTDA.,VALINHOS,3,1994,Sociedade Limitada
35212137564,J.D.L. ARTSCRIN COMERCIO LTDA.,MATAO,3,1994,Sociedade Limitada
35212137572,AGRO PECUARIA BARREIRO LTDA.,PEDERNEIRAS,3,1994,Sociedade Limitada
35212137581,FEIRAO DE FRUTAS MK LTDA.,SAO PAULO,3,1994,Sociedade Limitada
35212137599,STYLUS INDUSTRIA E COMERCIO DE MOVEIS LIMEIRA LTDA.,LIMEIRA,3,1994,Sociedade Limitada
35212137602,PAMAPE COMERCIO E REPRESENTACOES LTDA.,SAO PAULO,3,1994,Sociedade Limitada
35212137611,DAKOMOL INDUSTRIA E COMERCIO DE MOLAS LTDA.,SAO PAULO,3,1994,Sociedade Limitada
35212137629,W.BRITO EMPREITEIRA LTDA.,SAO PAULO,3,1994,Sociedade Limitada
35212137637,"COMERCIAL EXPORTADORA, IMPORTADORA DE TINTAS GOMES, FREIRE & PEREIRA LTDA.",SAO PAULO,3,1994,Sociedade Limitada
35212137645,DELTACINE PRODUCOES CINEMATOGRAFICAS LTDA.,COTIA,3,1994,Sociedade Limitada
35212137653,D-JULI-ENE PROMOCAO DE VENDAS LTDA,SAO JOSE DO RIO PRETO,3,1994,Sociedade Limitada
35212137661,J.G. SANTOS - RESTAURANTE E LANCHONETE LTDA,SANTOS,3,1994,Sociedade Limitada
35212137670,MAR - CONSTRUCOES E EMPREENDIMENTOS LTDA.,SANTOS,3,1994,Sociedade Limitada
35212137688,CRISTAIS DOURADO COMERCIO E REPRESENTACOES LTDA.,CRISTAIS PAULISTA,3,1994,Sociedade Limitada
35212137696,N. Y. IMPRESSOS COMERCIAIS E INDUSTRIAIS LTDA.,SAO JOSE DOS CAMPOS,3,1994,Sociedade Limitada
35212137700,PIZZARIA DONATELLO LTDA.,GUARULHOS,3,1994,Sociedade Limitada
35212137718,TOPAZIO CONSULTORIA ASSESSORIA EMPRESARIAL E COMERCIO LTDA ME,GUARULHOS,3,1994,Sociedade Limitada
35212137726,MQA COMERCIO E SERVICOS LTDA.,BARUERI,3,1994,Sociedade Limitada
35212137734,MERCADINHO FRUTAL LTDA.,SAO PAULO,3,1994,Sociedade Limitada
35212137742,D'PICANCO CONFECCOES LTDA.,SAO PAULO,3,1994,Sociedade Limitada
35212137751,EUGENIO SERVICOS DE FESTAS LTDA.,SAO PAULO,3,1994,Sociedade Limitada
35212137769,"ADVANCE REPRESENTACOES, IMPORTACOES E EXPORTACOES LTDA.",ITU,3,1994,Sociedade Limitada
35212137777,AUTO PECAS NOMURA & YOSHIDA LTDA.,JACAREI,3,1994,Sociedade Limitada
35212137785,LUMAL - COMERCIO DE PRODUTOS E EQUIPAMENTOS CLINICOS E VETERINARIOS LTDA.,SAO JOSE DOS CAMPOS,3,1994,Sociedade Limitada
35212137793,DANE COMERCIO DE VIDROS E SERVICOS LTDA.,JANDIRA,3,1994,Sociedade Limitada
35212137807,NORTH PLANEJAMENTO E CONSTRUCAO LTDA.,SAO PAULO,3,1994,Sociedade Limitada
35212137815,RHOMA-DE MARILIA REPRESENTACOES E COMERCIO DE MATERIAIS LTDA.,MARILIA,3,1994,Sociedade Limitada
35212137823,FONSECA JR. & CIA. LTDA.,SANTOS,3,1994,Sociedade Limitada
35212137831,CARMASSIO TRANSPORTE DE VEICULOS E CARGAS LTDA.,SAO BERNARDO DO CAMPO,3,1994,Sociedade Limitada
35212137840,SPUMEFLEX COMERCIO E INDUSTRIA DE COLCHOES LTDA.,SAO PAULO,3,1994,Sociedade Limitada
35212137858,CASA DO GAUCHO - LATICINIOS E BEBIDAS LTDA.,GUARULHOS,3,1994,Sociedade Limitada
35212137866,EVAS GINSENG IMPORTACAO E EXPORTACAO LTDA,SAO PAULO,3,1994,Sociedade Limitada
35212137874,PHOLLYPACK DISTRIBUIDORA DE EMBALAGEM LTDA.,SOROCABA,3,1994,Sociedade Limitada
35212137882,CALY REPRESENTACOES LTDA.,SAO PAULO,3,1994,Sociedade Limitada
35212137891,MARTINS & SOUZA ARACATUBA LTDA.,ARACATUBA,3,1994,Sociedade Limitada
35212137904,H L L COMERCIO DE SISTEMAS INDUSTRIAIS LTDA.,JAMBEIRO,3,1994,Sociedade Limitada
35212137912,ARMARINHOS E PAPELARIA LUANA LTDA.,GUARULHOS,3,1994,Sociedade Limitada
35212137921,PUGABU COMERCIO DE ROUPAS LTDA.,POA,3,1994,Sociedade Limitada
35212137939,FISPRO EQUIPAMENTOS FISIOTERAPICOS LTDA.,SAO PAULO,3,1994,Sociedade Limitada
35212137947,"PANAMERICANO TRANSPORTES, LOCACAO E ENTREGAS RAPIDAS LTDA.",ATIBAIA,3,1994,Sociedade Limitada
35212137955,J.N. COMERCIO DE MATERIAIS PARA CONSTRUCOES E CONSTRUTORA LTDA.,CAMPINAS,3,1994,Sociedade Limitada
35212137963,MED-RIO - COMERCIO E REPRESENTACOES LTDA.,SAO JOSE DO RIO PRETO,3,1994,Sociedade Limitada
35212137971,LIG FAIXAS COMERCIO DE FAIXAS E LETREIROS LTDA.,SAO JOSE DO RIO PRETO,3,1994,Sociedade Limitada
35212137980,CENTER BIKE OLIVEIRA LTDA.,SAO JOSE DO RIO PRETO,3,1994,Sociedade Limitada
35212137998,EMPORSAN COMERCIAL LTDA.,SAO PAULO,3,1994,Sociedade Limitada
35212138005,H.N.INDUSTRIA E COMERCIO LTDA.,EMBU,3,1994,Sociedade Limitada
35212138013,IRVINE LOCACAO E COMERCIO DE EQUIPAMENTOS PARA INFORMATICA E PERIFERICOS LTDA.,VINHEDO,3,1994,Sociedade Limitada
35212138021,MODELO & BRITO LTDA,SAO PAULO,3,1994,Sociedade Limitada
35212138030,INBRAS CONECTIVIDADE LTDA.,SAO PAULO,3,1994,Sociedade Limitada
35212138048,NILMAD - REPRESENTACOES COMERCIAIS LTDA,SAO PAULO,3,1994,Sociedade Limitada
35212138056,PANIFICADORA BANNYSII LTDA.,EMBU,3,1994,Sociedade Limitada
35212138064,NOVAMOTOR COMERCIO E SERVICOS LTDA,OSASCO,3,1994,Sociedade Limitada
35212138072,CEPAL COMERCIO E RECARGA DE EXTINTORES LTDA.,SAO PAULO,3,1994,Sociedade Limitada
35212138081,BRUNCITRUS COMERCIO DE FRUTAS E TRANSPORTES LTDA.,CORDEIROPOLIS,3,1994,Sociedade Limitada
35212138099,MINIMERCADO GAMA LTDA.,LIMEIRA,3,1994,Sociedade Limitada
35212138102,THIAGRO COMERCIO E REPRESENTACAO DE PRODUTOS AGROPECUARIOS LTDA.,LIMEIRA,3,1994,Sociedade Limitada
35212138111,COMERCIAL MARILIA DE SAO VICENTE LTDA.,SANTOS,3,1994,Sociedade Limitada
35212138129,DAUMBAILO SERVICOS E COMERCIO DE INFORMATICA LTDA.,SAO PAULO,3,1994,Sociedade Limitada
35212138137,BABALOO MODAS LTDA.,GUARUJA,3,1994,Sociedade Limitada
35212138145,COMERCIO DE PESCADOS CANANEIA LTDA.,SAO VICENTE,3,1994,Sociedade Limitada
35212138153,ZAVATIERI & ZAVATIERI LTDA.,NOVA ODESSA,3,1994,Sociedade Limitada
35212138161,M.H.B. BAURU COMERCIO E REPRESENTACOES LTDA.,BAURU,3,1994,Sociedade Limitada
35212138170,JOAQUIM ROBERTO DE ALMEIDA LEITE NETO & CIA LTDA.,ITUVERAVA,3,1994,Sociedade Limitada
35212138188,ZEBRA IMPORTACAO DISTRIBUICAO E COMERCIALIZACAO LTDA.,SAO PAULO,3,1994,Sociedade Limitada
35212138196,DIVA PRESENTES LTDA.,SAO CAETANO DO SUL,3,1994,Sociedade Limitada
35212138200,W.G.S. - COMERCIO DE CAIXAS REGISTRADORAS E SISTEMAS LIMITADA,SAO PAULO,3,1994,Sociedade Limitada
35212138218,ANA'S BAR E LANCHONETE LTDA.,GUARULHOS,3,1994,Sociedade Limitada
35212138226,POLE POSITION LAVA RAPIDO E LANCHONETE LTDA,GUARULHOS,3,1994,Sociedade Limitada
35212138234,AGRO COMERCIAL RECANTO AZUL LTDA.,COTIA,3,1994,Sociedade Limitada
35212138242,VANUZA G. DE SOUZA & CIA LTDA,SOCORRO,3,1994,Sociedade Limitada
35212138251,DISTRIBUIDORA DE PRODUTOS ALIMENTICIOS BONETTI LTDA.,SOCORRO,3,1994,Sociedade Limitada
35212138269,A.A. ELOTEC LOCACAO E COMERCIO LTDA.,SAO PAULO,3,1994,Sociedade Limitada
35212138277,METZNER & CIA LTDA.,ITATIBA,3,1994,Sociedade Limitada
35212138285,C.A.C. MARTINS & CIA LTDA.,AMPARO,3,1994,Sociedade Limitada
35212138293,"MINAMITECH COMERCIO, IMPORTACAO E EXPORTACAO LTDA",SAO PAULO,3,1994,Sociedade Limitada
35212138307,CAMISARIA SANTA ISABEL LTDA.,SAO PAULO,3,1994,Sociedade Limitada
35212138315,HOTBLAST INDUSTRIA E COMERCIO LTDA.,SAO PAULO,3,1994,Sociedade Limitada
35212138323,TROPICAL MOVIMENTACAO DE CARGAS SAO PAULO LTDA.,SAO PAULO,3,1994,Sociedade Limitada
35212138340,BECKER MEMORIAS COMERCIO DE MOVEIS E OBJETOS USADOS LTDA.,SAO PAULO,3,1994,Sociedade Limitada
35212138358,MERCEARIA GOES & MONTEIRO LTDA.,ITAPETININGA,3,1994,Sociedade Limitada
35212138366,ICARO - OFICINA E COMERCIO DE AUTO PECAS LTDA.,PALMITAL,3,1994,Sociedade Limitada
35212138374,LE-BLANC COMERCIO DE ENXOVAIS LTDA.,PRESIDENTE PRUDENTE,3,1994,Sociedade Limitada
35212138382,PARALENS COMERCIO DE PRODUTOS OPTICOS LTDA.,SAO PAULO,3,1994,Sociedade Limitada
35212138391,WORLD STYLE CONFECCOES LTDA.,TABOAO DA SERRA,3,1994,Sociedade Limitada
35212138404,BRAZIMPORT COMERCIO DE ARTIGOS DE PRESENTE LTDA.,SAO PAULO,3,1994,Sociedade Limitada
35212138412,TECHNICAL - INSTRUMENTOS E SISTEMA INDUSTRIAL LTDA,SAO BERNARDO DO CAMPO,3,1994,Sociedade Limitada
35212138421,ALMEIDA'S CAR AUTO CENTER SERVICOS DE MECANICA EM GERAL LTDA.,BARUERI,3,1994,Sociedade Limitada
35212138439,CIRTECH COMERCIO DE INFORMATICA E SUPRIMENTOS LTDA.,SAO ROQUE,3,1994,Sociedade Limitada
35212138447,BBR COMERCIO E PRODUCOES FOTOGRAFICAS LTDA.,SAO PAULO,3,1994,Sociedade Limitada
35212138455,NACIONAL TECNOLOGIA EM INFORMATICA COMERCIO IMPORTACAO E EXPORTACAO LTDA,SAO PAULO,3,1994,Sociedade Limitada
35212138463,J.F TAPECARIA E DECORACOES LTDA,SAO PAULO,3,1994,Sociedade Limitada
35212138471,DEMETRIOS CONSTRUTORA LTDA.,SAO PAULO,3,1994,Sociedade Limitada
35212138480,AGAMENON COMERCIO E CONFECCAO LTDA.,TABOAO DA SERRA,3,1994,Sociedade Limitada
35212138498,JUNTOS & MISTURADOS LTDA,SAO PAULO,3,1994,Sociedade Limitada
35212138501,FAVARO & FAVARO COMERCIO DE SUPRIMENTOS PARA ESCRITORIO LTDA,PARAGUACU PAULISTA,3,1994,Sociedade Limitada
35212138510,COMWARE COMUNICACAO E COMERCIO DE COMPUTADORES LTDA.,BAURU,3,1994,Sociedade Limitada
35212138528,AGRO INDUSTRIAL PARIS LTDA.,CANDIDO MOTA,3,1994,Sociedade Limitada
35212138536,DALAQUA E PELEGRINI LTDA.,PRESIDENTE PRUDENTE,3,1994,Sociedade Limitada
35212138544,BITTENCOURT EMPRESA DE COMPUTACAO LTDA.,RIBEIRAO PIRES,3,1994,Sociedade Limitada
35212138552,AGROPECUARIA SERRA PRETA DE QUATA LTDA.,QUATA,3,1994,Sociedade Limitada
35212138561,AMORIM LTDA.,SAO CAETANO DO SUL,3,1994,Sociedade Limitada
35212138579,PORTP SEGURO DO BRASIL - COMERCIO DE MOVEIS E DECORACOES LTDA.,SAO PAULO,3,1994,Sociedade Limitada
35212138587,COMDIS COMERCIAL DE LAMINAS DE ACO LTDA.,SAO PAULO,3,1994,Sociedade Limitada
35212138595,D. MARTINI SERVICOS LTDA,SAO PAULO,3,1994,Sociedade Limitada
35212138609,"ENGESEG ENGENHARIA DE SEGURANCA PROJETOS, COMERCIO, IMPORTACAO E EXPORTACAO LTDA.",SAO CAETANO DO SUL,3,1994,Sociedade Limitada
35212138617,REPAVAL - COMERCIAL DE FERRO E ACO LTDA.,SAO PAULO,3,1994,Sociedade Limitada
35212138625,STRELAR REPRESENTACAO COMERCIAL LTDA.,MAUA,3,1994,Sociedade Limitada
35212138633,DI OLI CONFECCOES INDUSTRIA E COMERCIO LTDA.,SAO PAULO,3,1994,Sociedade Limitada
35212138641,B & B BRASIL CONFECCOES LTDA,SAO JOSE DO RIO PARDO,3,1994,Sociedade Limitada
35212138650,BUFFET FERNANDES ALPHAVILLE LTDA.,BARUERI,3,1994,Sociedade Limitada
35212138668,MELANI COMERCIO DE SUPRIMENTOS E EQUIPAMENTOS PARA INFORMATICA E ELETRO ELETRONICA LTDA.,SAO BERNARDO DO CAMPO,3,1994,Sociedade Limitada
35212138676,MANSAO VERA CRUZ BUFFET LTDA.,SAO BERNARDO DO CAMPO,3,1994,Sociedade Limitada
35212138684,JAMPER MATERIAIS INSTALACOES E MONTAGENS ELETRICAS LTDA,SOROCABA,3,1994,Sociedade Limitada
35212138692,MERCADINHO BOM JESUS DO AMPARO LTDA.,SAO PAULO,3,1994,Sociedade Limitada
35212138706,NECHAR CLEMENTE COMERCIO E REPRESENTACOES LTDA.,RIO CLARO,3,1994,Sociedade Limitada
35212138714,BRASPORT DE SANTOS COMERCIAL EXPORTADORA E IMPORTADORA LTDA.,SANTOS,3,1994,Sociedade Limitada
35212138722,EMPORIO DO VIDEO LTDA.,SANTOS,3,1994,Sociedade Limitada
35212138731,MOLIANI & ROQUE LTDA.,SANTOS,3,1994,Sociedade Limitada
35212138749,QUINA ELETRICA E HIDRAULICA LTDA.,GUARUJA,3,1994,Sociedade Limitada
35212138757,GUATAMBU COMERCIO DE VASILHAMES EM GERAL LTDA.,SAO PAULO,3,1994,Sociedade Limitada
35212138765,BONECO DE PAPEL - BAZAR E PAPELARIA LTDA.,SAO PAULO,3,1994,Sociedade Limitada
35212138773,N F TOMAZINI VIAGENS E EXCURSOES LTDA,SAO PAULO,3,1994,Sociedade Limitada
35212138781,CWK COMERCIO E SERVICO LTDA,SAO BERNARDO DO CAMPO,3,1994,Sociedade Limitada
35212138790,PAES E DOCES ANGRA UM LTDA,SAO PAULO,3,1994,Sociedade Limitada
35212138803,SERCOM GESSO LTDA.,SAO PAULO,3,1994,Sociedade Limitada
35212138811,OITENTA E SEIS & NOVENTA E NOVE SERVICOS E COMERCIO DE INFORMATICA LTDA.,SAO PAULO,3,1994,Sociedade Limitada
35212138820,PROJETO NETUNO PRATICAS ESPORTIVAS E COMERCIO LTDA.,SAO PAULO,3,1994,Sociedade Limitada
35212138838,TV E IMAGEM JVM COMERCIO E SERVICOS LTDA.,SAO PAULO,3,1994,Sociedade Limitada
35212138846,SAP-ZIM COMERCIO DE ROUPAS E CONFECCOES LTDA.,SAO PAULO,3,1994,Sociedade Limitada
35212138854,MOD-LINE MOVEIS PARA ESCRITORIO LTDA.,ITAQUAQUECETUBA,3,1994,Sociedade Limitada
35212138862,TECNOTRON TECNOLOGIA EM CHAVES ELETRONICAS INDUSTRIA E COMERCIO LTDA.,SAO PAULO,3,1994,Sociedade Limitada
35212138871,CASA DE CARNES SOUZA MONTEIRO LTDA.,SAO BERNARDO DO CAMPO,3,1994,Sociedade Limitada
35212138889,CASA DE CARNES CUNHA E PAIVA LTDA.,SAO BERNARDO DO CAMPO,3,1994,Sociedade Limitada
35212138897,DISTRIBUIDORA DE COSMETICOS MONTE CRISTO LTDA.,SAO PAULO,3,1994,Sociedade Limitada
35212138919,FRANCIAL FACTORING LTDA.,SAO PAULO,3,1994,Sociedade Limitada
35212138927,HSBC EMPREENDIMENTOS IMOBILIARIOS (BRASIL) LTDA.,SAO PAULO,3,1994,Sociedade Limitada
35212138935,FERMAKLE TRANSPORTE LTDA.,LEME,3,1994,Sociedade Limitada
35212138943,MAIO & SIMOES LTDA.,LEME,3,1994,Sociedade Limitada
35212138951,PETA'S CALCADOS LTDA.,SAO ROQUE,3,1994,Sociedade Limitada
35212138960,BAR E MERCEARIA ARAUJO IBIUNA LTDA.,IBIUNA,3,1994,Sociedade Limitada
35212138978,MARK STAR COMERCIO E REPRESENTACOES LTDA.,SAO BERNARDO DO CAMPO,3,1994,Sociedade Limitada
35212138986,ESCONDERIJO BAR LTDA,SAO PAULO,3,1994,Sociedade Limitada
35212138994,SILVA & RODRIGUES COMERCIO DE MADERIAS LTDA.,SAO PAULO,3,1994,Sociedade Limitada
35212139001,SHOPPING DAS OPORTUNIDADES COMERCIO LTDA.,SAO PAULO,3,1994,Sociedade Limitada
35212139010,JFGS COMERCIO DE ARTIGOS USADOS LTDA.,SAO PAULO,3,1994,Sociedade Limitada
35212139028,AGUA VIVA COMERCIO DE MATERIAIS PARA CONSTRUCAO LTDA.,SAO PAULO,3,1994,Sociedade Limitada
35212139036,DONUTS MORUMBI COMERCIO DE ALIMENTOS LTDA.,SAO PAULO,3,1994,Sociedade Limitada
35212139044,EUROBLOCK SISTEMAS CONSTRUTIVOS LTDA.,SAO PAULO,3,1994,Sociedade Limitada
35212139052,PETER BOX MODAS LTDA,SAO PAULO,3,1994,Sociedade Limitada
35212139061,LOJA DE MOVEIS PARAISO LTDA.,MAUA,3,1994,Sociedade Limitada
35212139079,ANGLO AMERICAN NIQUEL BRASIL LTDA.,SAO PAULO,3,1994,Sociedade Limitada
35212139095,ALL MESSAGE CESTAS E PRESENTES LTDA.,SAO PAULO,3,1994,Sociedade Limitada
35212139109,STARQUIM - COMERCIO E REPRESENTACAO DE PRODUTOS QUIMICOS LTDA.,GUARULHOS,3,1994,Sociedade Limitada
35212139117,KAEMPA COMERCIO DE PAPEL E PAPELAO LTDA.,GUARULHOS,3,1994,Sociedade Limitada
35212139125,AKAMINE MAQUINAS LTDA,SAO BERNARDO DO CAMPO,3,1994,Sociedade Limitada
35212139133,"J.R.H. COMERCIO, REPRESETNACOES, IMPORTACAO E EXPORTACAO LTDA.",SAO PAULO,3,1994,Sociedade Limitada
35212139141,HIDRO ELETRICA FABRILAR LTDA.,SAO PAULO,3,1994,Sociedade Limitada
35212139150,VIA SAT COMERCIAL LTDA.,SAO JOSE DOS CAMPOS,3,1994,Sociedade Limitada
35212139176,COMERCIO DE TECIDOS MARCELINHO LTDA,SAO PAULO,3,1994,Sociedade Limitada
35212139184,TRANSLEITE PIONEIRO - COMERCIO E DISTRIBUICAO DE LEITE LTDA.,SAO PAULO,3,1994,Sociedade Limitada
35212139192,TRANSLEITE CIGANA - COMERCIO E DISTRIBUIDORA DE LEITE LTDA.,SAO PAULO,3,1994,Sociedade Limitada
35212139206,TRANSLEITE SAUDE - COMERCIO E DISTRIBUIDORA DE LEITE LTDA.,SAO PAULO,3,1994,Sociedade Limitada
35212139214,PAES E DOCES LE LOGIS LTDA.,SAO PAULO,3,1994,Sociedade Limitada
35212139222,BAR E LANCHES ROUXINOL IMPERADOR LTDA.,SAO PAULO,3,1994,Sociedade Limitada
35212139231,KRAMER AUTOPECAS E SERVICOS LTDA - M.E.,GUARULHOS,3,1994,Sociedade Limitada
35212139249,MARPAU INDUSTRIA E COMERCIO LTDA.,SAO PAULO,3,1994,Sociedade Limitada
35212139257,DISOUND SONORIZACAO E ALARMES LTDA.,SAO PAULO,3,1994,Sociedade Limitada
35212139265,CENTRO DE TREINAMENTOS DESPORTIVOS DE ITATIBA LTDA,ITATIBA,3,1994,Sociedade Limitada
35212139273,AVANTE & SILVA LTDA.,SAO MANUEL,3,1994,Sociedade Limitada
35212139281,COMERCIO DE GAS PIRANGI LTDA.,PIRANGI,3,1994,Sociedade Limitada
35212139290,DICAR - COMERCIO DE PNEUS LTDA.,AGUAS DE LINDOIA,3,1994,Sociedade Limitada
35212139303,MIRBEL - DISTRIBUIDORA DE BEBIDAS LTDA.,RIBEIRAO PRETO,3,1994,Sociedade Limitada
35212139311,SERALEX - COMERCIO DE VEICULOS LTDA.,RIBEIRAO PRETO,3,1994,Sociedade Limitada
35212139320,LUJU - COMERCIO E REPRESENTACOES LTDA.,RIBEIRAO PRETO,3,1994,Sociedade Limitada
35212139338,TERRA & FERNANDES LTDA.,RIBEIRAO PRETO,3,1994,Sociedade Limitada
35212139346,REFRIGERACAO BARATO & MENEGHEL LTDA,AMERICANA,3,1994,Sociedade Limitada
35212139354,XAVANTE - COMERCIO DE TINTAS E PRESTACAO DE SERVICOS LTDA.,RIBEIRAO PRETO,3,1994,Sociedade Limitada
35212139362,COLOMB'OPCOES ALIMENTICIAS LTDA.,SAO PAULO,3,1994,Sociedade Limitada
35212139371,CBR - ELETRICA LTDA.,SAO PAULO,3,1994,Sociedade Limitada
35212139389,CODIFREL COMERCIO DE PECAS PARA AUTOS E SERVICOS LTDA.,SAO PAULO,3,1994,Sociedade Limitada
35212139397,R C TOOLS COMERCIAL DE FERRAMENTAS LTDA.,SAO PAULO,3,1994,Sociedade Limitada
35212139401,CONFECCOES LULUTEX LTDA.,SAO PAULO,3,1994,Sociedade Limitada
35212139419,"COMERCIO DE PECAS, FUNILARIA E PINTURA TREZ AMIGOS LTDA.",SAO PAULO,3,1994,Sociedade Limitada
35212139427,CANA CAIANA MODA E PRESENTES LTDA.,SAO PAULO,3,1994,Sociedade Limitada
35212139435,CONDWATTS INDUSTRIA E COMERCIO DE CONDUTORES ELETRICOS LTDA.,GUARULHOS,3,1994,Sociedade Limitada
35212139443,MILASSA COMERCIAL E DISTRIBUIDORA LTDA.,SAO PAULO,3,1994,Sociedade Limitada
35212139451,WR CAMAC PARAFUSOS E ELEMENTOS DE FIXACAO LTDA.,SAO PAULO,3,1994,Sociedade Limitada
35212139478,ADBE SILVA REPRESENTACOES LTDA,GUARULHOS,3,1994,Sociedade Limitada
35212139486,AGRO-PECUARIA CAPELA VELHA LTDA.,GUAREI,3,1994,Sociedade Limitada
35212139494,BRITTO & PIEDADE LTDA.,SAO JOSE DO RIO PRETO,3,1994,Sociedade Limitada
35212139508,DOMAR PRODUTOS DE LIMPEZA LTDA.,POLONI,3,1994,Sociedade Limitada
35212139516,FABIO NOSE REPRESENTACOES LTDA.,SAO PAULO,3,1994,Sociedade Limitada
35212139524,L'AGENCE MODELOS COMERCIO DE CONFECCOES LTDA.,SAO JOSE DO RIO PRETO,3,1994,Sociedade Limitada
35212139532,MINEIRAO COMERCIO IMPORTACAO E EXPORTACAO LTDA.,SAO PAULO,3,1994,Sociedade Limitada
35212139541,APOCALIPSE INDUSTRIA E COMERCIO DE ARTEFATOS DO VESTUARIO IMPORTACAO E EXPORTACAO LTDA.,SAO PAULO,3,1994,Sociedade Limitada
35212139559,GARIMAC DIESEL LTDA.,SAO PAULO,3,1994,Sociedade Limitada
35212139567,CORRADO & KYOMEN REPRESENTACOES LTDA.,SAO PAULO,3,1994,Sociedade Limitada
35212139575,AVICOLA E MERCEARIA NIWATORI LTDA.,SAO PAULO,3,1994,Sociedade Limitada
35212139583,NOVA AMERICA COMERCIO DE CORTINAS E LAVANDEIRA LTDA.,SAO PAULO,3,1994,Sociedade Limitada
35212139591,"OZELLE ARTEZANATO, COMERCIO E INDUSTRIA LTDA.",SAO PAULO,3,1994,Sociedade Limitada
35212139605,CEREALISTA PFEIFER LTDA.,BAURU,3,1994,Sociedade Limitada
35212139613,PIZZARIA RECANTO PERNAPOLE LTDA.,SAO PAULO,3,1994,Sociedade Limitada
35212139621,SOFT LINE COSMETICOS LTDA.,SAO CAETANO DO SUL,3,1994,Sociedade Limitada
35212139630,AVICOLA BELENA LTDA.,SAO PAULO,3,1994,Sociedade Limitada
35212139648,CALENDARIOS IPANEMA LTDA,SAO PAULO,3,1994,Sociedade Limitada
35212139656,ELLIMS CONFECCOES LTDA.,SAO PAULO,3,1994,Sociedade Limitada
35212139664,MAYKI COMERCIO DE PRODUTOS ALIMENTICIOS LTDA,SAO PAULO,3,1994,Sociedade Limitada
35212139672,BAR E MERCEARIA LIBERTADO LTDA.,SAO PAULO,3,1994,Sociedade Limitada
35212139681,ANDRIGO COMERCIAL LTDA.,SAO PAULO,3,1994,Sociedade Limitada
35212139699,BERALDI & BUENO LTDA.,BOTUCATU,3,1994,Sociedade Limitada
35212139702,TYKA DISTRIBUIDORA DE PRODUTOS DE LIMPEZA LTDA,SANTO ANTONIO DE POSSE,3,1994,Sociedade Limitada
35212139711,PRODUTORA GOULART DE ANDRADE LTDA.,COTIA,3,1994,Sociedade Limitada
35212139729,STEP BLUE CONFECCOES LTDA.,TAUBATE,3,1994,Sociedade Limitada
35212139737,COMERCIAL SANTA IZABEL DE CARAGUA - COMERCIO DE GENEROS ALIMENTICIOS LTDA.,CARAGUATATUBA,3,1994,Sociedade Limitada
35212139745,HAGAS - DISTRIBUIDORA DE GAS TREMEMBE LTDA.,TREMEMBE,3,1994,Sociedade Limitada
35212139753,PROQUISP QUIMICA LTDA.,SANTANA DE PARNAIBA,3,1994,Sociedade Limitada
35212139761,RO KE REPRESENTACOES LTDA.,SAO JOSE DO RIO PRETO,3,1994,Sociedade Limitada
35212139770,FORT SERV ASSESSORIA EMPRESARIAL LTDA.,SAO PAULO,3,1994,Sociedade Limitada
35212139788,KAJUJOAOKAJA LANCHETERIA LTDA.,SAO PAULO,3,1994,Sociedade Limitada
35212139796,CHAPLIN SERVICOS TEMPORARIOS LTDA.,SAO PAULO,3,1994,Sociedade Limitada
35212139800,CURIMAD COMERCIO DE CONFECCOES LTDA.,SAO PAULO,3,1994,Sociedade Limitada
35212139818,CLAFER FOGOES E FERRAGENS LTDA.,SAO PAULO,3,1994,Sociedade Limitada
35212139826,"BORGES MARTIN INDUSTRIA, COMERCIO E REPRESENTACAO DE PRODUTOS ALIMENTICIOS LTDA.",PINDAMONHANGABA,3,1994,Sociedade Limitada
35212139834,AVEANEDA & BATISTA LTDA,TUPA,3,1994,Sociedade Limitada
35212139842,GACTA COMERCIAL LTDA,SAO PAULO,3,1994,Sociedade Limitada
35212139851,ROMA INTERNACIONAL EDITORA LTDA.,SAO PAULO,3,1994,Sociedade Limitada
35212139869,"PROSPERO, PROSPERO & NUNES LTDA.",SAO CARLOS,3,1994,Sociedade Limitada
35212139877,SALSA E CAPRICHO RESTAURANTE LTDA.,RIBEIRAO PRETO,3,1994,Sociedade Limitada
35212139885,LUDEMARY INDUSTRIA E COMERCIO DE CALCADOS LTDA.,JAU,3,1994,Sociedade Limitada
35212139893,E.C.R. CONFECCOES LTDA.,SOROCABA,3,1994,Sociedade Limitada
35212139915,CASTELLO & SALVE LTDA.,ITATIBA,3,1994,Sociedade Limitada
35212139923,INDUSTRIA DE LUVAS PATMOS LTDA.,AVANHANDAVA,3,1994,Sociedade Limitada
35212139931,ALL LINE COMERCIO VAREJISTA DE ARTIGOS NACIONAIS E IMPORTADOS LTDA.,SOROCABA,3,1994,Sociedade Limitada
35212139940,J. J. GAS LTDA.,BATATAIS,3,1994,Sociedade Limitada
35212139958,RANOLI EMPREITEIRA DE MAO DE OBRA E COMERCIO DE MATERIAIS PARA CONSTRUCAO LTDA.,ILHA COMPRIDA,3,1994,Sociedade Limitada
35212139966,XEDOS COMERCIAL DE FERRAMENTAS LTDA,BOTUCATU,3,1994,Sociedade Limitada
35212139974,HATA-SHO INDUSTRIA E COMERCIO DE ARTEFATOS DE PLASTICOS LTDA.,VALINHOS,3,1994,Sociedade Limitada
35212139982,FREEGRAF COMERCIO E REPRESENTACOES LTDA.,TABOAO DA SERRA,3,1994,Sociedade Limitada
35212139991,OLIVEIRA FERNANDES COMERCIO E REPRESENTACAO LTDA,SAO PAULO,3,1994,Sociedade Limitada
35212140000,FLEXOPLAST INDUSTRIA E COMERCIO DE EMBALAGENS LTDA,SAO PAULO,3,1994,Sociedade Limitada
35212140018,RETRASTEEL INDUSTRIA E COMERCIO DE ARTEFATOS METALICOS LTDA.,ARARAS,3,1994,Sociedade Limitada
35212140026,SMG ELETRONICA COMERCIO E CONSERTOS LTDA.,SAO PAULO,3,1994,Sociedade Limitada
