NIRE,Empresa,Município,Month,Year,Type
35113603516,ADRIANA APARECIDA GARCIA MORAIS DISTRIBUIDORA DE JORNAIS,GUARULHOS,1,1995,Empresario
35113603524,CLEUSA A DE SOUZA RESENDE,PIRACICABA,1,1995,Empresario
35113603532,JEFFERSON GRANZIOL PIRACICABA,PIRACICABA,1,1995,Empresario
35113603541,CESAR EDUARDO MIGLIORANZA,PIRACICABA,1,1995,Empresario
35113603559,ANTONIO CESAR CARDOSO PIRACICABA,PIRACICABA,1,1995,Empresario
35113603567,SERGIO CAPUCIM,PIRACICABA,1,1995,Empresario
35113603575,ANA PAULA DA SILVA ALVES FEIRANTE,SÃO PAULO,1,1995,Empresario
35113603583,MARIA DO SOCORRO FRANCO MODAS,SÃO PAULO,1,1995,Empresario
35113603591,GILBERTO PARO PRAIA GRANDE,PRAIA GRANDE,1,1995,Empresario
35113603605,ANTONIO J. SOUZA LANCHES LITORAL,PRAIA GRANDE,1,1995,Empresario
35113603613,WILSON SOARES MOGI GUACU,,1,1995,Empresario
35113603621,ADEVANIL MOREIRA ESTIVA,ESTIVA GERBI,1,1995,Empresario
35113603630,OZEBIO RIBEIRO M GUACU,MOGI GUAÇU,1,1995,Empresario
35113603648,L J SANTOS BAR,,1,1995,Empresario
35113603656,ELOISA REGINA GARCIA BORDIN AGUAI,AGUAÍ,1,1995,Empresario
35113603664,OSNI APARECIDO GARCIA MOJI GUACU,MOGI GUAÇU,1,1995,Empresario
35113603672,ALESSANDRA PEREIRA TEIXEIRA,,1,1995,Empresario
35113603681,M L O MAJIOLO,MOGI MIRIM,1,1995,Empresario
35113603699,CARLOS LEME LOCADORA,MOGI MIRIM,1,1995,Empresario
35113603702,SERGIO DA SILVA M GUACU,,1,1995,Empresario
35113603711,PAULO SERGIO DA SILVA ARAPEI,ARAPEÍ,1,1995,Empresario
35113603729,MARCOS ROGERIO NUNES RIBEIRO FEIRANTE,VOTORANTIM,1,1995,Empresario
35113603737,CECILIO INACIO,VOTORANTIM,1,1995,Empresario
35113603745,ALCIDES ALVES DOS SANTSO VOTORANTIM,VOTORANTIM,1,1995,Empresario
35113603753,HELIO LIBERATORI,CATANDUVA,1,1995,Empresario
35113603761,ZAQUEU COCENCO GAMBARY,SOROCABA,1,1995,Empresario
35113603770,ALICE VIDAL DA SILVA SOROCABA,SOROCABA,1,1995,Empresario
35113603788,WANDERLEY CORREA COSTA SOROCABA,SOROCABA,1,1995,Empresario
35113603796,JOSE MACHADO SOROCABA,SOROCABA,1,1995,Empresario
35113603800,F. GOMES SOROCABA,SOROCABA,1,1995,Empresario
35113603818,ANTONIO ALVARO LIMA E SILVA,ANDRADINA,1,1995,Empresario
35113603826,ADOLPHO PATRAO SAO CARLOS,SÃO CARLOS,1,1995,Empresario
35113603834,ALBERTO FUDINORI HIRAKAWA,SOROCABA,1,1995,Empresario
35113603842,M R DO NASCIMENTO CONFECCOES,SÃO PAULO,1,1995,Empresario
35113603851,KARINA CARDILI,ITÁPOLIS,1,1995,Empresario
35113603869,I L DOS SANTOS SILVA,SÃO JOSÉ DOS CAMPOS,1,1995,Empresario
35113603877,JOAO RIZZI SJ DOS CAMPOS,SÃO JOSÉ DOS CAMPOS,1,1995,Empresario
35113603885,SONIA MARIA PARISE JACAREI,JACAREÍ,1,1995,Empresario
35113603893,MARIA DALVA DE SANTIS MORAIS,BRAGANÇA PAULISTA,1,1995,Empresario
35113603907,SIMONE SARAIVA LOURO,BRAGANÇA PAULISTA,1,1995,Empresario
35113603915,MATEUS AFONSO BRAULIO BUZATO ATIBAIA,ATIBAIA,1,1995,Empresario
35113603923,M.I.M. BUENO ESTACIONAMENTO,BRAGANÇA PAULISTA,1,1995,Empresario
35113603931,CRISTIANE FADIL,BRAGANÇA PAULISTA,1,1995,Empresario
35113603940,MARA REGINA RODRIGUES BARATO,MONTE ALTO,1,1995,Empresario
35113603958,ANTONIO CARLOS RUGERO,PIRASSUNUNGA,1,1995,Empresario
35113603966,FAUSTO JOSE COUCEIRO,APARECIDA,1,1995,Empresario
35113603974,MARIA JOSE DA SILVA DISTRIBUIDORA,GUARULHOS,1,1995,Empresario
35113603982,RITA DE CASSIA SILVA CORREIA,SANTANA DE PARNAÍBA,1,1995,Empresario
35113603991,CLAUDIA SILVA CARDOSO JANDIRA,JANDIRA,1,1995,Empresario
35113604008,MARCIO TEIXEIRA JANDIRA,JANDIRA,1,1995,Empresario
35113604016,CARLOS SERGIO ROTTOLI A NOGUEIRA,ARTUR NOGUEIRA,1,1995,Empresario
35113604024,REGINA SUELI APARECIDO AVARE,AVARÉ,1,1995,Empresario
35113604032,SILVANIA VISCONDE MENDES ROSA,PEDREGULHO,1,1995,Empresario
35113604041,ENILVA DO NASCIMENTO BERGANTON,PIRAJU,1,1995,Empresario
35113604059,VANIA RUBIAN BONTURI BOLSONARO,IPORANGA,1,1995,Empresario
35113604067,OTAVIO MAURI NETO,MACEDÔNIA,1,1995,Empresario
35113604075,MARIA CELUSA PEREIRA ALVES BAR,CARAPICUÍBA,1,1995,Empresario
35113604083,MARIANGELA VALERIA SOARES DE PAULA,CAMPINAS,1,1995,Empresario
35113604091,PAULO SERGIO SCHOFIELD,CAMPINAS,1,1995,Empresario
35113604105,MARIA A A CORREA,JUNDIAÍ,1,1995,Empresario
35113604113,ALTAIR A BATISTA,VÁRZEA PAULISTA,1,1995,Empresario
35113604121,I R DA SILVA DEL GELMO,JUNDIAÍ,1,1995,Empresario
35113604130,IRENE LEMOS DA ROCHA EMBALAGENS,GUARULHOS,1,1995,Empresario
35113604148,M T DO NASCIMENTO SIQUEIRA,SÃO PAULO,1,1995,Empresario
35113604156,A MARQUES GARCIA MATERIAL DE CONTRUCAO,ITAQUAQUECETUBA,1,1995,Empresario
35113604164,ALEXANDRE HIGASHIJIMA,TUPÃ,1,1995,Empresario
35113604172,ELIZALDO DIOGO,,1,1995,Empresario
35113604181,JESUS CAVALLINI,POMPÉIA,1,1995,Empresario
35113604199,AMELIA C MARQUES,VARGEM,1,1995,Empresario
35113604202,CESAR ROBERTO DOS SANTOS,MONTE ALTO,1,1995,Empresario
35113604211,CRISTINA FERNANDES WILE SILVA,VARGEM GRANDE PAULISTA,1,1995,Empresario
35113604229,DURVAL BONATELLI JUNIOR,SUZANO,1,1995,Empresario
35113604237,JOELMA RAMOS DE QUEIROZ XAVIER,CAJAMAR,1,1995,Empresario
35113604245,VALDECIR DE GODOY BORGES,SÃO CARLOS,1,1995,Empresario
35113604253,ISMAEL JESUINO CANTARELLAS,SOCORRO,1,1995,Empresario
35113604261,JOANA ANGELICA DE OLIVEIRA,MARÍLIA,1,1995,Empresario
35113604270,DURVALINO LENHARI,BRAGANÇA PAULISTA,1,1995,Empresario
35113604288,CELMIR LUIZ NORBIATO,PRESIDENTE PRUDENTE,1,1995,Empresario
35113604296,CLAUDIO RODRIGUES FILHO SJCAMPOS,SÃO JOSÉ DOS CAMPOS,1,1995,Empresario
35113604300,ANDREA MARCIA MASSUD IANNICELLI,JACAREÍ,1,1995,Empresario
35113604318,JOSE HERNANDES FILHO TRANSPORTES E TURISMO,MONTEIRO LOBATO,1,1995,Empresario
35113604326,LUIZ ARTHUR DE ASSUMPCAO TOGNATO,OSASCO,1,1995,Empresario
35113604334,BENEDITO JANUARIO SANTOS FILHO CUBATAO,CUBATÃO,1,1995,Empresario
35113604342,CELSO IERVOLINO LANGGAARD BARBOSA DE OLIVEIRA,SÃO PAULO,1,1995,Empresario
35113604351,JOEL FRANCISCO PIO,BOITUVA,1,1995,Empresario
35113604369,LUIZ CARLOS MANOEL - SUCATAS,SANTO ANDRÉ,1,1995,Empresario
35113604377,DEISIMAR GUEDES MARCONDES,ITARARÉ,1,1995,Empresario
35113604385,JESUS PEREIRA CATANDUVA,CATANDUVA,1,1995,Empresario
35113604393,JOSE D. M. BERTOLINI,SÃO PAULO,1,1995,Empresario
35113604407,MARIA FATIMA DE LIMA DUARTE,SÃO PAULO,1,1995,Empresario
35113604415,ENEZILDA R PEREIRA LORENA,LORENA,1,1995,Empresario
35113604423,M F S CAPUCHO PINTO,CACHOEIRA PAULISTA,1,1995,Empresario
35113604431,JOSE CARLOS BUENO PIRASSUNUNGA,PIRASSUNUNGA,1,1995,Empresario
35113604440,JACIRA MARIA RIBEIRO RICCI,ASSIS,1,1995,Empresario
35113604458,DORISIA SERAFIM DA SILVA,SÃO MANUEL,1,1995,Empresario
35113604466,GUILHERME E.A.P. CASTRO VALENTE,JAÚ,1,1995,Empresario
35113604474,JOAO ROLIM DE MEDEIROS CIRINEU CERAMICA,ITAPETININGA,1,1995,Empresario
35113604482,S P F LOPES CASA DE CARNES,SÃO PAULO,1,1995,Empresario
35113604491,L M DE L MARTINS MERCEARIA,SÃO PAULO,1,1995,Empresario
35113604504,ROBERTO GARCIA SCRIPTORE LANCHONETE,SÃO PAULO,1,1995,Empresario
35113604512,RODRIGO FERREIRA ROSA,ITARARÉ,1,1995,Empresario
35113604521,LUIZ FERNANDO DUTRA PIGNANELLI,BEBEDOURO,1,1995,Empresario
35113604539,MAURICIO ALVES DA SILVA - ARARAQUARA,ARARAQUARA,1,1995,Empresario
35113604547,CANDIDA APARECIDA NUNES DA SILVA PAZATTO,IBATÉ,1,1995,Empresario
35113604555,ELIZABETH MARQUES PARREIRA VIDEO,FRANCA,1,1995,Empresario
35113604563,APARECIDO CARLOS GALLUCCI-FRANCA,FRANCA,1,1995,Empresario
35113604571,JOAO CASTELAN FRANCA,FRANCA,1,1995,Empresario
35113604580,GETULIO LIMA DE OLIVEIRA,FRANCA,1,1995,Empresario
35113604598,PRISCILLA ANDRADE-ESSENCIAS E PERFUMARIAS,SANTOS,1,1995,Empresario
35113604601,CLAUDIA LUCIA GALDINO PIQUETE,PIQUETE,1,1995,Empresario
35113604610,F A DE ASSIS LORENA,LORENA,1,1995,Empresario
35113604628,CESAR NUNES PIQUETE,PIQUETE,1,1995,Empresario
35113604636,TONI ANDERSON FERREIRA,SOROCABA,1,1995,Empresario
35113604644,MERCIS REGINA CAMARGO RODRIGUES SOROCABA,SOROCABA,1,1995,Empresario
35113604652,JOSE CARLOS BARREIRA SOROCABA,SOROCABA,1,1995,Empresario
35113604661,ISABEL DAS GRACAS FOGACA HERGESEL,SOROCABA,1,1995,Empresario
35113604679,HERMELINDO MONTESINOS BERNABEU SOROCABA,SOROCABA,1,1995,Empresario
35113604687,NILSON BONSAVER,SÃO PAULO,1,1995,Empresario
35113604695,AGNALDO SALGADO DE OLIVEIRA,SOROCABA,1,1995,Empresario
35113604709,ROSELI DE ANDRADE BALDO,SOROCABA,1,1995,Empresario
35113604717,JOSE CARLOS VINCENZO,SÃO BERNARDO DO CAMPO,1,1995,Empresario
35113604725,JULIANO GLAUCO CALZAVARA,BRAGANÇA PAULISTA,1,1995,Empresario
35113604733,TADEU ADRIANO MAZZOCHI,BRAGANÇA PAULISTA,1,1995,Empresario
35113604741,EDIMILSON MEDEIROS BRAGANCA PAULISTA,BRAGANÇA PAULISTA,1,1995,Empresario
35113604750,RAQUEL DE CAMPOS BUENO,SÃO PAULO,1,1995,Empresario
35113604768,JOSE SOARES SOBRINHO,GUARULHOS,1,1995,Empresario
35113604776,DANIEL FROSSI,SÃO PAULO,1,1995,Empresario
35113604784,RAIMUNDO RODRIGUES DE SOUZA BAR E MERCEARIA,SÃO PAULO,1,1995,Empresario
35113604792,P C COSTA ACOUGUE,HORTOLÂNDIA,1,1995,Empresario
35113604806,VANDERLEI HUDOROVIC,CAMPINAS,1,1995,Empresario
35113604814,SONIA MARIA DE MORAES MORELLI,HORTOLÂNDIA,1,1995,Empresario
35113604822,LUSIA MAYUMI TAGAWA,ADAMANTINA,1,1995,Empresario
35113604831,FELICIO ROBERTO MARQUES,CARDOSO,1,1995,Empresario
35113604849,SILVANE MARIA BILATTO SERAFIM,SÃO SEBASTIÃO DA GRAMA,1,1995,Empresario
35113604857,NIVALDO CESAR NATES,CARDOSO,1,1995,Empresario
35113604865,GILDO GOMES GUARDA CONFECCOES,SÃO PAULO,1,1995,Empresario
35113604873,JOAO DO PRADO CUNHA,CUNHA,1,1995,Empresario
35113604881,MARIA CRISTINA DE SOUZA CARAPICUIBA,COTIA,1,1995,Empresario
35113604890,PEDRO JOSE DE SOUZA JALES,JALES,1,1995,Empresario
35113604903,EVANDRO R LUCIANO BOITUVA,BOITUVA,1,1995,Empresario
35113604911,SAMUEL DA SILVA PRADO,SERRA NEGRA,1,1995,Empresario
35113604920,MARINA RENESTO BONFANTE,ITÁPOLIS,1,1995,Empresario
35113604938,CARLOS DE ASSUMPCAO JUNIOR FRANCA,FRANCA,1,1995,Empresario
35113604946,MANOEL MAURICIO LUCIANO FRANCA,FRANCA,1,1995,Empresario
35113604954,SANDRO MORETI RIBEIRO,FRANCA,1,1995,Empresario
35113604962,WAGNER JOSE BELOTI FRANCA,FRANCA,1,1995,Empresario
35113604971,APARECIDA PIRS FELICIO PATROCINIO,PATROCÍNIO PAULISTA,1,1995,Empresario
35113604989,ROSELI MARIA DO NASCIMENTO ANDRADRE,PATROCÍNIO PAULISTA,1,1995,Empresario
35113604997,EDIMAR ALVES FERREIRA PATROCINIO,PATROCÍNIO PAULISTA,1,1995,Empresario
35113605004,R A BERNARDES FRANCA,FRANCA,1,1995,Empresario
35113605012,AUGUSTO DE OLIVEIRA RESTINGA,RESTINGA,1,1995,Empresario
35113605021,SERGIO EMERENCIANO DE SOUSA FRANCA,FRANCA,1,1995,Empresario
35113605039,ROGERIO ROSSINI SAO JOAQUIM DA BARRA,SÃO JOAQUIM DA BARRA,1,1995,Empresario
35113605047,MARIA HELENA TOSTE DE SOUZA,SÃO JOAQUIM DA BARRA,1,1995,Empresario
35113605055,ANTONIO CARLOS FONSECA DE FREITAS,ARAÇATUBA,1,1995,Empresario
35113605063,ROSEMEIRE CORREA DE OLIVEIRA,SANTO ANDRÉ,1,1995,Empresario
35113605071,PERSEU BEVILACQUA,SANTO ANDRÉ,1,1995,Empresario
35113605080,MARIA DE LURDES DA LUZ TAVARES,SANTO ANDRÉ,1,1995,Empresario
35113605098,FATIMA FREIRE MOLINARI,SANTO ANDRÉ,1,1995,Empresario
35113605101,CARMELITA ELISA CAMPOS,SANTO ANDRÉ,1,1995,Empresario
35113605110,ANTONIO DE MOURA DECORACOES,SANTO ANDRÉ,1,1995,Empresario
35113605128,VALQUIRIA MARIA DE ARAUJO,SANTO ANDRÉ,1,1995,Empresario
35113605144,MARCOS ANTONIO ALVES PRESIDENTE PRUDENTE,PRESIDENTE PRUDENTE,1,1995,Empresario
35113605152,SELMA DA SILVA PEREIRA DE LIMA,PRESIDENTE PRUDENTE,1,1995,Empresario
35113605161,FRANCISCO AMERICO LEITE,PRESIDENTE PRUDENTE,1,1995,Empresario
35113605179,MARTA FERNANDES INFORMATICA,PRESIDENTE PRUDENTE,1,1995,Empresario
35113605187,JOAO ALBINO CAMILLO,RIBEIRÃO PRETO,1,1995,Empresario
35113605195,JOSE TROMBETA RIBEIRAO PRETO,RIBEIRÃO PRETO,1,1995,Empresario
35113605209,KEILA SCOTT,RIBEIRÃO PRETO,1,1995,Empresario
35113605217,LUCIA HELENA PICINATO,RIBEIRÃO PRETO,1,1995,Empresario
35113605225,MARCOS ANTONIO PEREIRA ALTINOPOLIS,ALTINÓPOLIS,1,1995,Empresario
35113605233,PELCIO TEODORO FERREIRA,RIBEIRÃO PRETO,1,1995,Empresario
35113605241,RICARDO HALAK,RIBEIRÃO PRETO,1,1995,Empresario
35113605250,SUELI KAZON NETO,RIBEIRÃO PRETO,1,1995,Empresario
35113605268,VICENTE PAULO SILVA,ITUVERAVA,1,1995,Empresario
35113605276,MAURICIO ANTONIO MOURAO,RIBEIRÃO PRETO,1,1995,Empresario
35113605284,MARIA CRISTINA HIROKO YAMADA YOKOSAWA PRESENTES,RIBEIRÃO PRETO,1,1995,Empresario
35113605292,GILBERTO DOSWALDO,RIBEIRÃO PRETO,1,1995,Empresario
35113605306,ANTONIO KALIL EL DIB,RIBEIRÃO PRETO,1,1995,Empresario
35113605314,ANDREA FERREIRA ROMERO XAVIER,RIBEIRÃO PRETO,1,1995,Empresario
35113605322,JORDAO DOS SANTOS BRITO BAURU,BAURU,1,1995,Empresario
35113605331,PAULO BARRA NOVA DE MELO BAR,JABOTICABAL,1,1995,Empresario
35113605349,SIMONE BERGAMINI CONSTANZO FRUTAS,SÃO PAULO,1,1995,Empresario
35113605357,EDUARDO TADASHI TSUZUKI VERDURAS,SÃO PAULO,1,1995,Empresario
35113605365,EDILENE MACENA CAVALCANTE FRUTAS,SÃO PAULO,1,1995,Empresario
35113605373,ANDRE LUIZ DA CRUZ FRUTEIRO,SÃO PAULO,1,1995,Empresario
35113605381,ZILDA BATISTA RIBEIRO,PARAÍSO,1,1995,Empresario
35113605390,BENEDITA ANTONIA DE OLIVEIRA SILVA BAR,ATIBAIA,1,1995,Empresario
35113605403,A OLIVEIRA FILHO LIVRARIA E PAPELARIA,SÃO PAULO,1,1995,Empresario
35113605411,JESENI SANTOS COSTA - COMÉRCIO E SERVIÇOS,EMBU DAS ARTES,1,1995,Empresario
35113605420,GRIMALDE PEREIRA DE SOUZA,TABOÃO DA SERRA,1,1995,Empresario
35113605438,JOSE MIGUEL RODRIGUES FILHO,TABOÃO DA SERRA,1,1995,Empresario
35113605446,IOLANDA APARECIDA AMARAL DE QUEIROS,SÃO PAULO,1,1995,Empresario
35113605454,MARCIA TEODORA DA SILVA SANTO ANDRE,SANTO ANDRÉ,1,1995,Empresario
35113605462,FERNANDO DESTRO,ITAPUÍ,1,1995,Empresario
35113605471,JURACI DUARTE COELHO INACIO,SÃO PAULO,1,1995,Empresario
35113605489,HOSSEIN NIKKHAH MATANAGH,RIBEIRÃO PRETO,1,1995,Empresario
35113605497,ZILDA HONORATO ORLANDIA,ORLÂNDIA,1,1995,Empresario
35113605501,GILSON DONIZETI MARCELO,ORLÂNDIA,1,1995,Empresario
35113605519,GIANE ANDREA MEDRADO GREGOLDO,RIBEIRÃO PRETO,1,1995,Empresario
35113605527,ANDRE DA SILVA - ARMARINHOS,SÃO PAULO,1,1995,Empresario
35113605535,RAIMUNDA NONATA SILVA COUTINHO FLORICULTURA,SÃO PAULO,1,1995,Empresario
35113605543,ROSA M G MENEGUELI MODAS,SÃO CAETANO DO SUL,1,1995,Empresario
35113605551,JOSE CARLOS GARCIA MOVEIS,SANTO ANDRÉ,1,1995,Empresario
35113605560,IVANEY PAULO E SILVA JACAREI,JACAREÍ,1,1995,Empresario
35113605578,BENEDITA MARIA DOS SANTOS FRUTAS,SÃO JOSÉ DOS CAMPOS,1,1995,Empresario
35113605586,HAYDEE S GUSMAO,CARAGUATATUBA,1,1995,Empresario
35113605594,LOURDES BUENO SJCAMPOS,SÃO JOSÉ DOS CAMPOS,1,1995,Empresario
35113605608,DORALICE APARECIDA DIAS MONGANGUA,MONGAGUÁ,1,1995,Empresario
35113605616,ANTONIO GALOFORO DA SILVA RIBEIRAO PRETO,RIBEIRÃO PRETO,1,1995,Empresario
35113605624,JACSON MACEDO OLIVEIRA,SÃO PAULO,1,1995,Empresario
35113605632,AMARO SILVESTRE DA SILVA,SÃO PAULO,1,1995,Empresario
35113605641,M FERNANDES JUNIOR,AMERICANA,1,1995,Empresario
35113605659,SERGIO PRECEGUEIRO-AMERICANA,AMERICANA,1,1995,Empresario
35113605667,CELIO DE MARCHI CUNHA,SÃO PAULO,1,1995,Empresario
35113605675,MARISA PACHECO DELPHINO,,1,1995,Empresario
35113605683,SANDRA REGINA BARAIBAR BOARETTO,,1,1995,Empresario
35113605691,W. MENEGATTI JUNIOR-TECIDOS,NOVA ODESSA,1,1995,Empresario
35113605705,EDINALIA DE SOUZA BORDIM,SÃO PAULO,1,1995,Empresario
35113605713,JOAO CLAUDINO DE ALBUQUERQUE,SANTOS,1,1995,Empresario
35113605721,ISAIAS FERREIRA DA LUZ BUBIPEL,SÃO VICENTE,1,1995,Empresario
35113605730,ILIO DE LIMA JUNIOR,INDAIATUBA,1,1995,Empresario
35113605748,EDUARDO CESCHIN,INDAIATUBA,1,1995,Empresario
35113605756,MARIA APARECIDA B. DA SILVA,INDAIATUBA,1,1995,Empresario
35113605764,ELIAS NUNES FILHO,SALTO,1,1995,Empresario
35113605772,ARLENI DE SOUZA MOREIRA,DIADEMA,1,1995,Empresario
35113605781,OBERDA MUNIZ,ITAPECERICA DA SERRA,1,1995,Empresario
35113605799,MARTA CELIA PEREIRA DOS SANTOS,OSASCO,1,1995,Empresario
35113605802,MONIQUE BRANDAO DE FREITAS,CAMPINAS,1,1995,Empresario
35113605811,IVONIL ALAUK,SÃO PAULO,1,1995,Empresario
35113605829,CARLOS JOSE MONTEIRO,JUNDIAÍ,1,1995,Empresario
35113605837,VERA LUCIA DANA ZANELLATO,MAIRIPORÃ,1,1995,Empresario
35113605845,DIVINO DANTAS DISTRIBUIDORA,SANTO ANDRÉ,1,1995,Empresario
35113605853,ODAIR RAMOS TORNOS,SÃO PAULO,1,1995,Empresario
35113605861,WAGNER EURIPEDES FERNANDES,,1,1995,Empresario
35113605870,ELISA SILVA CARDOSO MONTES,BATATAIS,1,1995,Empresario
35113605888,MARCELO HIPOLITO RIBEIRO,MORRO AGUDO,1,1995,Empresario
35113605896,MARIA HELENA DE MORAIS SILVA-RIBEIRAO PRETO,RIBEIRÃO PRETO,1,1995,Empresario
35113605900,ROBERTO AMERICO DE ARAUJO,RIBEIRÃO PRETO,1,1995,Empresario
35113605918,VILMAR FERNANDES DE CARLOS-RIBEIRAO PRETO,RIBEIRÃO PRETO,1,1995,Empresario
35113605926,WILSON TELES LOPES,SÃO JOAQUIM DA BARRA,1,1995,Empresario
35113605934,TELMA REGINA DE ANDRADE FREIRIA MELIS,BATATAIS,1,1995,Empresario
35113605942,PAULO ROBERTO LUCCAS RIBEIRAO PRETO,RIBEIRÃO PRETO,1,1995,Empresario
35113605951,JAIME CESAR ALE,JARDINÓPOLIS,1,1995,Empresario
35113605969,ANISIO RIBEIRO MORRO AGUDO,MORRO AGUDO,1,1995,Empresario
35113605977,AGUINALDO RUCIRETA GERMANO,CRAVINHOS,1,1995,Empresario
35113605985,ARACELI INOJOSA MICHELIN,RIBEIRÃO PRETO,1,1995,Empresario
35113605993,R P SILVA UTILIDADES DOMESTICA,SÃO PAULO,1,1995,Empresario
35113606001,RAQUEL ALMEIDA DE ABREU DALBEN DOCES E SORVETES,SÃO PAULO,1,1995,Empresario
35113606019,SONIA CRISTINA GRETTER RANCHARIA,RANCHARIA,1,1995,Empresario
35207997143,GLOBO PARTICIPACOES LTDA.,SAO PAULO,1,1995,Sociedade Limitada
35207997232,AGROPECUARIA FLOR DA SERRA LTDA.,SAO PAULO,1,1995,Sociedade Limitada
35210629419,TRANSWEST - TRANSPORTES LTDA.,SAO PAULO,1,1995,Sociedade Limitada
35210749929,INVEX FACTORING LTDA.,SAO PAULO,1,1995,Sociedade Limitada
35210754248,DROGARIA RL LTDA.,MAUA,1,1995,Sociedade Limitada
35210770227,CHRIS BAR LTDA.,SAO PAULO,1,1995,Sociedade Limitada
35210773463,GE - GE - DISTRIBUIDORA DE MATERIAIS PARA CONSTRUCAO LTDA,CAMPINAS,1,1995,Sociedade Limitada
35210880901,LCSO SERVICOS DE INFORMATICA LTDA.,COTIA,1,1995,Sociedade Limitada
35211342342,NELSONCAR COMERCIO DE PECAS E SERVICOS LTDA.,SAO PAULO,1,1995,Sociedade Limitada
35212062343,THAURUS RIO PRETO CONFECCOES LTDA.,SAO JOSE DO RIO PRETO,1,1995,Sociedade Limitada
35212599916,ART-RIO INDUSTRIA E COMERCIO DE PRE-MOLDADOS DE CIMENTO LTDA.,ONDA VERDE,1,1995,Sociedade Limitada
35212759336,MACDERMID GRAPHICS SOLUTIONS LTDA.,JANDIRA,1,1995,Sociedade Limitada
35212759573,REFRIGERACAO PIRASSUNUNGA LTDA.,PIRASSUNUNGA,1,1995,Sociedade Limitada
35212759581,CONFECCOES E COMERCIO DE ROUPAS TOPLING LTDA.,MIGUELOPOLIS,1,1995,Sociedade Limitada
35212759590,ELETROMEC ELETROMECANICA DE COSMOPOLIS LTDA.,COSMOPOLIS,1,1995,Sociedade Limitada
35212759603,J. R. PAPEL E BRINQUEDO DE LIMEIRA LTDA,LIMEIRA,1,1995,Sociedade Limitada
35212759611,NOVAES E NOVAES LTDA.,GUARIBA,1,1995,Sociedade Limitada
35212759620,LOGICA TRANSPORTES LTDA.,VIRADOURO,1,1995,Sociedade Limitada
35212759638,LAURENTIZ E LAURENTIZ LTDA.,GUARIBA,1,1995,Sociedade Limitada
35212759646,ADVCON COMERCIO CONSULTORIA E ASSESSORIA LTDA.,SANTOS,1,1995,Sociedade Limitada
35212759654,GUEMI CONFECCOES E TECIDOS COMERCIO IMPORTACAO E EXPORTACAO LTDA.,SAO PAULO,1,1995,Sociedade Limitada
35212759662,COMERCIAL PAES E DANTAS LTDA.,SAO PAULO,1,1995,Sociedade Limitada
35212759981,GRACIANO AGROPECUARIA LTDA,ARARAQUARA,1,1995,Sociedade Limitada
35212759999,TRANSVELOZ TRANSPORTES RODOVIARIOS LTDA.,OSASCO,1,1995,Sociedade Limitada
35212760008,NENA BLUES FASHION COMERCIO LTDA.,SAO PAULO,1,1995,Sociedade Limitada
35212760016,M.H. DAMIANI PRODUTOS DE LIMPEZA LTDA.,SANTA BARBARA D'OESTE,1,1995,Sociedade Limitada
35212760024,ADORELLA LTDA.,SOROCABA,1,1995,Sociedade Limitada
35212760032,CEELE CONFECCOES LTDA - ME,TAQUARITINGA,1,1995,Sociedade Limitada
35212760041,REFRIAR MANUTENCAO E COMERCIO LTDA.,MATAO,1,1995,Sociedade Limitada
35212760059,BAR E MERCEARIA MISSON LTDA.,AMERICANA,1,1995,Sociedade Limitada
35212760067,AGROLATINO INDUSTRIA E COMERCIO DE ADUBOS E FERTILIZANTES LTDA,MATAO,1,1995,Sociedade Limitada
35212760075,BIANA'S ACESSORIOS PARA MODA IMPORTACAO E EXPORTACAO LTDA,SAO PAULO,1,1995,Sociedade Limitada
35212760083,PHR PRODUTOS E SERVICOS LTDA,SAO PAULO,1,1995,Sociedade Limitada
35212760121,CARLOS ALBERTO SCHERMA & CIA LTDA.,LEME,1,1995,Sociedade Limitada
35212760156,MELO E MELO LTDA,SAO JOSE DOS CAMPOS,1,1995,Sociedade Limitada
35212760202,VADAC AUTO PECAS LTDA.,MAUA,1,1995,Sociedade Limitada
35212760211,FERREIRA E MENEGALLE CLUB BAR LTDA,SANTO ANDRE,1,1995,Sociedade Limitada
35212760229,HALL DA PIZZA LTDA.,DIADEMA,1,1995,Sociedade Limitada
35212760237,PETROPOL SAO PAULO COMERCIAL E INDUSTRIAL LTDA.,SAO PAULO,1,1995,Sociedade Limitada
35212760245,PARAISO EXTRACAO E COMERCIO DE AREIA LTDA.,TREMEMBE,1,1995,Sociedade Limitada
35212760253,TAFS - MATERIAIS PARA CONSTRUCAO LTDA.,BRAGANCA PAULISTA,1,1995,Sociedade Limitada
35212760296,DESTAK INDUSTRIA E COMERCIO DE MOVEIS BARRETOS LTDA.,BARRETOS,1,1995,Sociedade Limitada
35212760300,CAMBIO TECNICO E MECANICA ROCHA LTDA,CARAPICUIBA,1,1995,Sociedade Limitada
35212760318,MADEIREIRA ANJOS LTDA,SANTO ANDRE,1,1995,Sociedade Limitada
35212760326,LANCHONETE CHURRASCAO DA ESTACAO LTDA.,SAO PAULO,1,1995,Sociedade Limitada
35212760351,RAMATIRO PAES E DOCES LTDA.,SAO PAULO,1,1995,Sociedade Limitada
35212760571,AMARAL E FERREIRA DISCO LTDA,IGARAPAVA,1,1995,Sociedade Limitada
35212760580,LANCHONETE E PESQUEIRO DO SERGINHO LTDA.,MIRACATU,1,1995,Sociedade Limitada
35212760598,SAI E FONSECA LTDA,ITUPEVA,1,1995,Sociedade Limitada
35212760601,BIBO'S CREACOES LTDA.,SAO PAULO,1,1995,Sociedade Limitada
35212760610,AJAX CONSTRUTORA E COMERCIO DE MATERIAIS PARA CONSTRUCAO ITUPEVA LTDA.,SOROCABA,1,1995,Sociedade Limitada
35212760628,R B COMERCIO DE BATERIAS LTDA.,ARARAS,1,1995,Sociedade Limitada
35212760636,H.F. CONSULTORIA E COMERCIO LTDA,CAMPINAS,1,1995,Sociedade Limitada
35212760644,APOLINARIO IMOVEIS LTDA,DIADEMA,1,1995,Sociedade Limitada
35212760652,MECANICA MARTINS ITUPEVA LTDA.,ITUPEVA,1,1995,Sociedade Limitada
35212760661,ARYMANA MATERIAIS E ACABAMENTOS LTDA.,CAMPINAS,1,1995,Sociedade Limitada
35212760679,DRAPERY COMERCIO E SERVICOS DE LIMPEZA LTDA.,CAMPINAS,1,1995,Sociedade Limitada
35212760687,FERNANDES E LIMNIDES LTDA.,GENERAL SALGADO,1,1995,Sociedade Limitada
35212760695,SB PONTAL COMERCIO DE CARROCERIAS LTDA,PONTAL,1,1995,Sociedade Limitada
35212760792,S.A.D. - TECNOLOGIA E SERVICOS INDUSTRIAIS LTDA,SERTAOZINHO,1,1995,Sociedade Limitada
35212760806,CITOMAC MATERIAIS PARA CONSTRUCAO LTDA,SAO SEBASTIAO DA GRAMA,1,1995,Sociedade Limitada
35212760814,CARMOA CONFECCOES LTDA.,BROTAS,1,1995,Sociedade Limitada
35212760822,CACHORRO QUENTE DO BIGODE LTDA.,SAO PAULO,1,1995,Sociedade Limitada
35212760831,MAGNO CEZAR PORTO E CIA LTDA,ARARAS,1,1995,Sociedade Limitada
35212760849,GENESIS ARACATUBA INDUSTRIA E COMERCIO DE ARTEFATOS DE FERRO LTDA,ARACATUBA,1,1995,Sociedade Limitada
35212760857,MACEDO E CAMPOS PENAPOLIS LTDA.,PENAPOLIS,1,1995,Sociedade Limitada
35212760865,GOMES E FAGUNDES ARACATUBA LTDA.,ARACATUBA,1,1995,Sociedade Limitada
35212760873,MARIO PRATA ARTIGOS DA MODA LTDA,BIRIGUI,1,1995,Sociedade Limitada
35212760881,ELOHIM INDUSTRIA E COMERCIO DE CALCADOS LTDA.,GABRIEL MONTEIRO,1,1995,Sociedade Limitada
35212760890,CONIN TOPOGRAFIA E ENGENHARIA LTDA,RIBEIRAO PIRES,1,1995,Sociedade Limitada
35212760903,DREAM'S CAR COMERCIO DE VEICULOS LTDA.,SAO PAULO,1,1995,Sociedade Limitada
35212760911,BY WORLD VIAGENS E TURISMO LTDA,SAO JOSE DO RIO PRETO,1,1995,Sociedade Limitada
35212760920,PORTA TREKOS ROUPAS ARMARINHOS E ACESSORIOS LTDA.,RIBEIRAO PRETO,1,1995,Sociedade Limitada
35212760938,BOTUPECAS COMERCIAL LTDA.,RIBEIRAO PRETO,1,1995,Sociedade Limitada
35212760946,REFRIGERACAO LOYOLLA LTDA.,RIBEIRAO PRETO,1,1995,Sociedade Limitada
35212760954,THE BEST COMERCIO DE LANCHES LTDA.,RIBEIRAO PRETO,1,1995,Sociedade Limitada
35212760962,SAFETY TRADING IMPORTACAO E EXPORTACAO LTDA.,RIBEIRAO PRETO,1,1995,Sociedade Limitada
35212760971,LUA DE MEL PRODUTOS ALIMENTARES LTDA.,RIBEIRAO PRETO,1,1995,Sociedade Limitada
35212760989,STEUDEL LOCACAO E TRANSPORTES EXECUTIVOS LTDA,RIBEIRAO PRETO,1,1995,Sociedade Limitada
35212760997,LAZULI HILL COMERCIO DE ROUPAS E ACESSORIOS LTDA.,SAO PAULO,1,1995,Sociedade Limitada
35212761217,AUTO POSTO COMANDANTE LTDA,PINDAMONHANGABA,1,1995,Sociedade Limitada
35212761225,BAR E PASTELARIA MISSACA LTDA.,BAURU,1,1995,Sociedade Limitada
35212761233,ESCRITORIO EMPRESARIAL ALVARES PENTEADO LTDA.,SAO PAULO,1,1995,Sociedade Limitada
35212761241,P.B.V. COMERCIO REPRESENTACAO EXPORTACAO E IMPORTACAO LTDA.,SAO PAULO,1,1995,Sociedade Limitada
35212761250,METAL D'OURO INDUSTRIA DE ACESSORIOS PARA PANIFICACAO LTDA.,ATIBAIA,1,1995,Sociedade Limitada
35212761268,ACU DISTRIBUIDORA DE FRUTAS LTDA.,BAURU,1,1995,Sociedade Limitada
35212761276,SILVA ROCHA E BARUQUE LTDA.,LORENA,1,1995,Sociedade Limitada
35212761292,EMPACOTADORA E COMERCIO DE CEREAIS UNIVERSO LTDA,FLORIDA PAULISTA,1,1995,Sociedade Limitada
35212761306,MARTINS PLASTIC INFORMATICA LTDA.,VARZEA PAULISTA,1,1995,Sociedade Limitada
35212761314,BEST SOFTWARE PRODUTOS PARA INFORMATICA LTDA.,JARINU,1,1995,Sociedade Limitada
35212761322,KONDRAT ENGENHARIA E COMERCIO LTDA.,SAO PAULO,1,1995,Sociedade Limitada
35212761331,MELO & SILVA DISTRIBUIDORA DE FLORES LTDA.,PARANAPANEMA,1,1995,Sociedade Limitada
35212761349,FURLAN & FURLAN DE TUPA LTDA.,TUPA,1,1995,Sociedade Limitada
35212761357,PRISMA-PAPER INDUSTRIA E COMERCIO DE PRODUTOS PARA PAPELARIA LTDA.,SAO PAULO,1,1995,Sociedade Limitada
35212761365,PIXEL SERVICOS S/C LTDA,SAO BERNARDO DO CAMPO,1,1995,Sociedade Limitada
35212761373,SOUZA E BEZERRA LTDA,PIRACICABA,1,1995,Sociedade Limitada
35212761381,ANHANGUERA RIO PRETO REPRESENTACOES LTDA,SAO JOSE DO RIO PRETO,1,1995,Sociedade Limitada
35212761390,REIS E CACHONI LTDA.,OURINHOS,1,1995,Sociedade Limitada
35212761403,KGF REPRESENTACOES COMERCIAIS LTDA.,SAO PAULO,1,1995,Sociedade Limitada
35212761411,S I SOLUCOES EMBALAGENS E MANUSEIO LTDA,SANTA ISABEL,1,1995,Sociedade Limitada
35212761420,TRADE & TRUST COMERCIO IMPORTACAO EXPORTACAO E PARTICIPACAO LTDA.,SAO PAULO,1,1995,Sociedade Limitada
