NIRE,Empresa,Município,Month,Year,Type
35113588274,ADERBAL M. DE OLIVEIRA LENCOIS PAULISTA,LENÇÓIS PAULISTA,1,1995,Empresario
35113588282,HERON POLONIO,BARIRI,1,1995,Empresario
35113588291,GENI RODRIGUES DA ROCHA P EPITACIO,PRESIDENTE EPITÁCIO,1,1995,Empresario
35113588304,MARA CRISTINA V G DA COSTA,TUPÃ,1,1995,Empresario
35113588312,EDUARDO ANGELO DOS SANTOS,GUARARAPES,1,1995,Empresario
35113588321,JOSE CLAUDIO MARCUSSI,BIRIGÜI,1,1995,Empresario
35113588339,MARIA SANTINA CAVATAO JORGE NUPORANGA,NUPORANGA,1,1995,Empresario
35113588347,JOAO BATISTA DE FREITAS-BARRETOS,BARRETOS,1,1995,Empresario
35113588355,ANTONIO PEREIRA VIANA ITAPIRA,ITAPIRA,1,1995,Empresario
35113588363,MARIA RITA NUNES FERREIRA DIAS,GUARULHOS,1,1995,Empresario
35113588371,GENARO RODRIGUES DOS SANTOS FILHO ARMARINHOS,SÃO PAULO,1,1995,Empresario
35113588380,MARIA APARECIDA BARBOSA DE LUCA,TUPÃ,1,1995,Empresario
35113588398,AREOLINO LOPES DE ALEXANDRIA/FILHO FLORINEA,FLORÍNIA,1,1995,Empresario
35113588401,CARMEN SILVIA BISI FERREIRA,TUPÃ,1,1995,Empresario
35113588410,INES DA SILVA FERRAREZI ITAPETININGA,ITAPETININGA,1,1995,Empresario
35113588428,ELIENE DE OLIVEIRA GOMES ITARARE,ITARARÉ,1,1995,Empresario
35113588436,ANTONIO ACIR DOS SANTOS ALVAREZ,BAURU,1,1995,Empresario
35113588444,SAMIRA ADRIANA SANTANA,CERQUILHO,1,1995,Empresario
35113588452,MARCILENE DONIZETTI FOLTRAN GOMES,CERQUILHO,1,1995,Empresario
35113588461,EDILAINE CRISTINA DOS SANTOS,CERQUILHO,1,1995,Empresario
35113588479,A. C. DOS SANTOS UBATUBA,UBATUBA,1,1995,Empresario
35113588487,ERIVELTO ANTONIO MARCHINI SPORT,CAJOBI,1,1995,Empresario
35113588495,ROSELENE DE FATIMA BERTOLDI FIALHO,JAGUARIÚNA,1,1995,Empresario
35113588509,LOURDES ESPOSITO ZAVANELLA,SOCORRO,1,1995,Empresario
35113588517,MARIA INES SANTO PEDRO CARVALHO,NOVO HORIZONTE,1,1995,Empresario
35113588525,CREUSA TEIXEIRA DE SOUZA PERUIBE,PERUÍBE,1,1995,Empresario
35113588533,IRADEMA OLIVEIRA DA SILVA,IACRI,1,1995,Empresario
35113588541,CARLOS ALBERTO MALVINO DISTRIBUIDORA DE MATERIAIS ELETRICOS E ELETRONICOS,SÃO CARLOS,1,1995,Empresario
35113588550,REGINA CELIA BERNARDES RAMALHO,JAGUARIÚNA,1,1995,Empresario
35113588568,TERUKO OKUMA SAWAKI,MOGI DAS CRUZES,1,1995,Empresario
35113588576,ELAINE APARECIDA ACARA,OSASCO,1,1995,Empresario
35113588584,LUCIA TERSIMANIAN AGOPIAN,SÃO PAULO,1,1995,Empresario
35113588592,ADENILSON JORGE DAS NEVES,SÃO PAULO,1,1995,Empresario
35113588606,JOANA D'ARC NAVARRO FERNANDOPOLIS,FERNANDÓPOLIS,1,1995,Empresario
35113588614,AMADEU MARQUES AGUDOS,AGUDOS,1,1995,Empresario
35113588622,ANTONO CORREA TRANSPORTES,LEME,1,1995,Empresario
35113588631,CLAUDIONOR DE OLIVEIRA BARRETOS,BARRETOS,1,1995,Empresario
35113588649,EDNA SOARES PEREIRA,SÃO PAULO,1,1995,Empresario
35113588657,MARIA DA CONCEICAO DE VASCONCELOS AVEIRO,SÃO PAULO,1,1995,Empresario
35113588665,CIDI SATIO SHIINO,GUARULHOS,1,1995,Empresario
35113588673,CLAUDIONOR FREIRE DA SILVA-AGUAS DE LINDOIA,ÁGUAS DE LINDÓIA,1,1995,Empresario
35113588681,MARIA HELENA FAUSTINO,SANTA BRANCA,1,1995,Empresario
35113588690,IZAIAS ANTONIO DE JESUS,ITAPEVI,1,1995,Empresario
35113588703,ALEX ZACCARO,ITAPEVI,1,1995,Empresario
35113588711,R B ALVESITU,ITU,1,1995,Empresario
35113588720,MARLENE PEREIRA DOS SANTOS GREGORIO,GUARULHOS,1,1995,Empresario
35113588738,VALTER MOREIRA DA SILVA GUARAREMA,GUARAREMA,1,1995,Empresario
35113588746,ELIZABETH JULIEN CALUX,GUARAREMA,1,1995,Empresario
35113588754,MARTINHO DE MORAES PAIS VEICULOS,MOGI DAS CRUZES,1,1995,Empresario
35113588762,CARLOS MOREIRA DA SILVA QUELUZ,QUELUZ,1,1995,Empresario
35113588771,M J A DESIDERIO,BOCAINA,1,1995,Empresario
35113588789,SILVIO PINHEIRO FRUTAS,PRESIDENTE PRUDENTE,1,1995,Empresario
35113588797,TERESA BENEDITA APARECIDA MAYO ALVES,PARAIBUNA,1,1995,Empresario
35113588801,JOSE RODRIGUES LEDO,DIADEMA,1,1995,Empresario
35113588819,A J DE SIQUEIRA MERCEARIA,JACAREÍ,1,1995,Empresario
35113588827,J DUARTE DE LIMA,SÃO PAULO,1,1995,Empresario
35113588835,HEBER GIROTTO,OSASCO,1,1995,Empresario
35113588843,ROSINALVA VALERIO,SÃO BERNARDO DO CAMPO,1,1995,Empresario
35113588851,MARIA DA ASSUNCAO FONSECA TRUNCI,SÃO PAULO,1,1995,Empresario
35113588878,DORACI FONTANA CONFECCOES,RIO CLARO,1,1995,Empresario
35113588886,JARBAS BENEDITO TEIXEIRA,CARAPICUÍBA,1,1995,Empresario
35113588894,SIMONE GUAZELLI,BRAGANÇA PAULISTA,1,1995,Empresario
35113588908,ANTONIO APP LEME FRANCO,BRAGANÇA PAULISTA,1,1995,Empresario
35113588916,DANIEL INACIO DA SILVA FEIRANTE,SÃO PAULO,1,1995,Empresario
35113588924,GERALDO TONINI,HORTOLÂNDIA,1,1995,Empresario
35113588932,MARLENE COLLADO DA SILVA SANTOS BAR E LANCHES,SÃO PAULO,1,1995,Empresario
35113588941,MARIO VIVIANI NETTO,PEREIRA BARRETO,1,1995,Empresario
35113588959,DAGBERTO LOPES DE OLIVEIRA,FERNANDÓPOLIS,1,1995,Empresario
35113588967,DEBORA CRISTINA LOPES,OLÍMPIA,1,1995,Empresario
35113588975,AGRINALDO VICENTE DOS SANTOS,OLÍMPIA,1,1995,Empresario
35113588983,LEILA BERTANHA DAMASCENO,IGARAPAVA,1,1995,Empresario
35113588991,JANETE APARECIDA LEME PEDRA BELA,PEDRA BELA,1,1995,Empresario
35113589009,TEREZINHA DIAS DE NARDO,SÃO CARLOS,1,1995,Empresario
35113589017,TERESINHA VARESTEIRO AGUEIRO,SÃO PAULO,1,1995,Empresario
35113589025,RUI XAVIER PEREIRA,SÃO PAULO,1,1995,Empresario
35113589033,MARIA DA CONCEICAO DA SILVA SANTOS,SÃO PAULO,1,1995,Empresario
35113589041,MARIA DO SOCORRO CANUTO ANDRADE,SÃO PAULO,1,1995,Empresario
35113589050,REGINALDO CRUZ SOARES,SÃO PAULO,1,1995,Empresario
35113589068,EDEVAL RODRIGUES DA SILVA,MIGUELÓPOLIS,1,1995,Empresario
35113589076,WALDOMIRO PECAN,OSVALDO CRUZ,1,1995,Empresario
35113589084,OSWALDO GOMES LOCADORA,JAÚ,1,1995,Empresario
35113589092,VALDEMAR ALMEIDA FILHO,SÃO PAULO,1,1995,Empresario
35113589106,ANA MARIA DE JESUS,AMÉRICO BRASILIENSE,1,1995,Empresario
35113589114,MARIA INES PEREIRA DE ARAUJO GOLO,SOCORRO,1,1995,Empresario
35113589122,MANOEL RODRIGUES DOS SANTOS LANCHONETE,TUPÃ,1,1995,Empresario
35113589131,ANDRE LUIS SELANI,RIBEIRÃO PRETO,1,1995,Empresario
35113589149,BENEDITO DE ARRUDA - AUTOPEÇAS,ITU,1,1995,Empresario
35113589157,MARIA J R A NUNES,PORTO FELIZ,1,1995,Empresario
35113589165,MARCOS ALBINO DE OLIVEIRA ROZA,SÃO PAULO,1,1995,Empresario
35113589173,VERA LUCIA DE ARAUJO VIEIRA,SÃO PAULO,1,1995,Empresario
35113589181,LUZIA APARECIDA GOMES ASSIS,ASSIS,1,1995,Empresario
35113589190,JOAO ROBERTO MALHEIRO ANDRADINA,ANDRADINA,1,1995,Empresario
35113589203,RUTE FERREIRA UNIFORMES,SÃO PAULO,1,1995,Empresario
35113589211,GIRLENE HENRIQUE PEREIRA LOPES,POÁ,1,1995,Empresario
35113589220,AKIKO TANI DA SILVA,BARUERI,1,1995,Empresario
35113589238,NILSON CONRADO BAUMER,BAURU,1,1995,Empresario
35113589246,JOAO BENEDITO CORREA PIRASSUNUNGA,PIRASSUNUNGA,1,1995,Empresario
35113589254,HELCIO JOSE POMPEO - OLIMPIA,OLÍMPIA,1,1995,Empresario
35113589262,CASSIA CRISTINA FERREIRA IBITINGA,IBITINGA,1,1995,Empresario
35113589271,JOAO ANTONIO VELASCO,ASSIS,1,1995,Empresario
35113589289,AILSON MORENO DOS SANTOS,ITAPETININGA,1,1995,Empresario
35113589297,TANIA RAHAL TAHA,RIBEIRÃO PRETO,1,1995,Empresario
35113589301,ULISSES BRUNO FILHO GUACU,,1,1995,Empresario
35113589319,PLINIO RODRIGUES JALES,JALES,1,1995,Empresario
35113589327,CELSO SOARES SAO SEBASTIAO,SÃO SEBASTIÃO,1,1995,Empresario
35113589335,TEREZINHA DE FATIMA A. RIBEIRO,SÃO JOÃO DA BOA VISTA,1,1995,Empresario
35113589343,NILDE ALVES CORREIA CONFECCOES,ITAQUAQUECETUBA,1,1995,Empresario
35113589351,M HARTEMAN,AMERICANA,1,1995,Empresario
35113589360,LUZINETE BATISTA DE SOUZA,SÃO PAULO,1,1995,Empresario
35113589378,LUCIANO F ANDRE CUNHA,CUNHA,1,1995,Empresario
35113589386,VERA LUCIA PEREIRA DE MELO KODAMA GUARA,GUARÁ,1,1995,Empresario
35113589394,VALDECI DUTRA SANTANA,SÃO JOSÉ DO RIO PRETO,1,1995,Empresario
35113589408,MARIA AUGUSTA LEONARDO DOS SANTOS,SÃO PAULO,1,1995,Empresario
35113589416,NELCIMAR CELESTINO DE SOUZA LUCAS,SÃO PAULO,1,1995,Empresario
35113589424,JOSE APARECIDO CAMBUI BAURU,BAURU,1,1995,Empresario
35113589432,ANA PAULA MARIANO DE OLIVEIRA ARACATUBA,ARAÇATUBA,1,1995,Empresario
35113589441,R R CARDOSO,RINÓPOLIS,1,1995,Empresario
35113589459,ELIANE SANTELLO TOMAZELLI,SÃO PAULO,1,1995,Empresario
35113589467,J.H. MILANI,AMERICANA,1,1995,Empresario
35113589475,VALMIRA SERRA FREITAS,TABOÃO DA SERRA,1,1995,Empresario
35113589483,FRANCISCO AUDACY BARRETO DE OLIVEIRA,SÃO PAULO,1,1995,Empresario
35113589491,JOSE MANUEL TEIXEIRA DE FREITAS,GUARULHOS,1,1995,Empresario
35113589505,ANTONIO MARCOS COMINO,VOTUPORANGA,1,1995,Empresario
35113589513,ILDA MARIA PIRES CORREA LANCHONETE,ARUJÁ,1,1995,Empresario
35113589521,JOSE THOMAZ DE SOUZA SUZANO,SUZANO,1,1995,Empresario
35113589530,MARIA APARECIDA DE MORAES SILVA INFORMATICA,SÃO PAULO,1,1995,Empresario
35113589548,EVA DIAS FERREIRA - BAZAR,TABOÃO DA SERRA,1,1995,Empresario
35113589556,DORIANA GUEDES DE ARAUJO - MERCEARIA,TABOÃO DA SERRA,1,1995,Empresario
35113589564,MARIA REGINA MARTUCCI DE GODOY,ITAPIRA,1,1995,Empresario
35113589572,LUIZ SALES DA SILVA BAR E MERCEARIA,FRANCO DA ROCHA,1,1995,Empresario
35113589581,TEREZA ANTONIA LISBOA BRANCALHONE ITAPIRA,ITAPIRA,1,1995,Empresario
35113589599,S DE O CAMARGO,SUZANO,1,1995,Empresario
35113589602,PAULA CARMAGNANI MACHADO MATERIAIS PARA FOTOS,SÃO PAULO,1,1995,Empresario
35113589611,ELIANE HELENA OLMO,SÃO PAULO,1,1995,Empresario
35113589629,MARCOS ANTONIO DOS SANTOS ESTEVES - FERNANDOPOLIS,FERNANDÓPOLIS,1,1995,Empresario
35113589637,REGIANE PEREIRA DE LIMA - ATIBAIA,ATIBAIA,1,1995,Empresario
35113589645,S L DE CARVALHO GUARATINGUETA,GUARATINGUETÁ,1,1995,Empresario
35113589653,JOSE VICENTE DE OLIVEIRA BAURU,BAURU,1,1995,Empresario
35113589661,BENEDITO VENANCIO DE ATAIDE,FERNANDÓPOLIS,1,1995,Empresario
35113589670,H A BARKE,ASSIS,1,1995,Empresario
35113589688,NADIA GHIRALDI,MONGAGUÁ,1,1995,Empresario
35113589696,JOSE CLAUDIO CARLESCI BRINQUEDOS,AMÉRICO BRASILIENSE,1,1995,Empresario
35113589700,JOAO GUEDES CAVALCANTE,SÃO JOSÉ DO RIO PARDO,1,1995,Empresario
35113589718,PEDRO LUIS DANIEL CIRINO SAO PEDRO,SÃO PEDRO,1,1995,Empresario
35113589726,JOELCYR SALVADOR JUNIOR,PORTO FELIZ,1,1995,Empresario
35113589734,MILTON APARECIDO FERMINO IACANGA,IACANGA,1,1995,Empresario
35113589742,MARCOS DE OLIVEIRA-TRANSPORTES,FRANCO DA ROCHA,1,1995,Empresario
35113589751,VANESSA PRADO SIGNORINI,MOGI DAS CRUZES,1,1995,Empresario
35113589769,JOSE BONIFACIO DE ASSIS MERCEARIA,MOGI DAS CRUZES,1,1995,Empresario
35113589777,JOAO CARLOS ELOIS,RIBEIRÃO PRETO,1,1995,Empresario
35113589785,VALDIR BENEDITO DE SOUZA UBATUBA,UBATUBA,1,1995,Empresario
35113589793,MARIA MADALENA DOS SANTOS MOJI MIRIM,MOGI MIRIM,1,1995,Empresario
35113589807,RICARDO CARVALHO ROQUE,SANTA RITA DO PASSA QUATRO,1,1995,Empresario
35113589815,NEUZA ALVES DE SOUZA,GASTÃO VIDIGAL,1,1995,Empresario
35113589823,CACILDA FRANCO RIBEIRO BOUTIQUE,ITUPEVA,1,1995,Empresario
35113589831,OSMAR FRANCISCO DE OLIVEIRA BRINQUEDOS,CÂNDIDO MOTA,1,1995,Empresario
35113589840,IVANI PEREIRA SACCO TIETE,CERQUILHO,1,1995,Empresario
35113589858,ROGERIO CESAR DE OLIVEIRA BOTUCATU,BOTUCATU,1,1995,Empresario
35113589866,MARIA JOSE PIRES NOVOA,BOREBI,1,1995,Empresario
35113589874,VALDEIR BEZERRA DA SILVA,AMÉRICO BRASILIENSE,1,1995,Empresario
35113589882,MARIA ALICE DE LIMA GALLEGO,AMÉRICO BRASILIENSE,1,1995,Empresario
35113589891,JOAO ALMEIDA DE GOES,COTIA,1,1995,Empresario
35113589904,APARECIDA FERREIRA DA COSTA ARARAS,ARARAS,1,1995,Empresario
35113589912,JOAO BARCO,BARUERI,1,1995,Empresario
35113589921,EDILENE NUNES DA SILVA,GUARULHOS,1,1995,Empresario
35113589939,ELIZABETH P MASCARENHAS BAZAR,FRANCISCO MORATO,1,1995,Empresario
35113589947,JOELCIO A DA GAMA MERCEARIA,FRANCISCO MORATO,1,1995,Empresario
35113589955,D R DA SILVA MARMORES,FRANCISCO MORATO,1,1995,Empresario
35113589963,TERCILIA M DE L SANTOS CONFECCOES,FRANCISCO MORATO,1,1995,Empresario
35113589971,VALDETINA ALVES LIMA-BAR,FRANCISCO MORATO,1,1995,Empresario
35113589980,RONIE SOARES,ITAPIRA,1,1995,Empresario
35113589998,MARCO ANTONIO ROSA BARRETOS,BARRETOS,1,1995,Empresario
35113590007,MARICIA ROZANI POLACHINI RODELA,GARÇA,1,1995,Empresario
35113590015,MOISES ALVES BUENO MERCEARIA,MOGI DAS CRUZES,1,1995,Empresario
35113590023,INES SALLES BUENO DA SILVA,JUNDIAÍ,1,1995,Empresario
35113590031,AMALIA PEREIRA ALVES BAR,GUARULHOS,1,1995,Empresario
35113590040,L FERREIRA RICARDO BAR,GUARULHOS,1,1995,Empresario
35113590058,IVAN ALVES PEREIRA BAR,SÃO PAULO,1,1995,Empresario
35113590066,J VALENTIM DE OLIVEIRA BAR,SÃO PAULO,1,1995,Empresario
35113590074,MARINETE DA SILVA GAUNA LANGERIE,SÃO PAULO,1,1995,Empresario
35113590082,PAULO ROBERTO DOS SANTOS ROCHA SERRALHERIA,SÃO PAULO,1,1995,Empresario
35113590091,MANUEL FERNANDO DA SILVA ALVES,SÃO PAULO,1,1995,Empresario
35113590104,EDVALDO PEREIRA DA SILVA GUARULHOS,GUARULHOS,1,1995,Empresario
35113590112,MARGARIDA TERESINHA DE OLIVEIRA OTICA,MONTE MOR,1,1995,Empresario
35113590121,GILMAR ALVES BATISTA INDAIATUBA,INDAIATUBA,1,1995,Empresario
35113590139,ALAIDE FERREIRA DA SILVA ASSIS,ASSIS,1,1995,Empresario
35113590147,EDUARDO ALEXANDRE A. CAVALIERI,FRANCISCO MORATO,1,1995,Empresario
35113590155,MARCO ANTONIO CALIMAN,SÃO PAULO,1,1995,Empresario
35113590163,ALBERTO WEISSER,VOTUPORANGA,1,1995,Empresario
35113590171,RAFAEL PEREIRA DE SOUZA NETO,PINDAMONHANGABA,1,1995,Empresario
35113590180,OLINDA ANTONIA DA SILVA BARRETOS,BARRETOS,1,1995,Empresario
35113590198,MARIA APARECIDA PEREIRA LUPE,AMÉRICO BRASILIENSE,1,1995,Empresario
35113590201,JOAO VIEIRA AUTO PECAS,SÃO PAULO,1,1995,Empresario
35113590210,MAURICIO ZANON JUNIOR CAJATI,PARIQUERA-AÇU,1,1995,Empresario
35113590228,ANTONIO JOSE DE MATOS PILAR DO SUL,PILAR DO SUL,1,1995,Empresario
35113590236,ELISABETH NEVES DA SILVA SEGATO,ITARARÉ,1,1995,Empresario
35113590244,ROBERTS AUGUSTO COMODARO,PEDREGULHO,1,1995,Empresario
35113590252,VICENTE SIVIERO,SABINO,1,1995,Empresario
35113590261,ANDREIA MARA IUNG ENEMBRECK DA SILVA,ITARARÉ,1,1995,Empresario
35113590279,JOAO APARECIDO KIRSTUS BRAGANCA PAULISTA,BRAGANÇA PAULISTA,1,1995,Empresario
35113590287,ISABEL GONCALVES VINCE,SÃO PAULO,1,1995,Empresario
35113590295,KOJI TAKEUCHI,SÃO PAULO,1,1995,Empresario
35113590309,MAURO BATAGIN,SÃO PAULO,1,1995,Empresario
35113590317,MARIA APARECIDA FRANCO MOGI DAS CRUZES,MOGI DAS CRUZES,1,1995,Empresario
35113590325,ANDREIA VIVIANE LEITE,BIRITIBA-MIRIM,1,1995,Empresario
35113590333,JOSE MARIO T NERY,CACONDE,1,1995,Empresario
35113590341,MARIA JOSE DA SILVA SANTOS BIRITIBA MIRIM,RIBEIRÃO PRETO,1,1995,Empresario
35113590350,MARIA APARECIDA LUCANO ALVARES,ASSIS,1,1995,Empresario
35113590368,IZAURA CORREA SARAPUI,SARAPUÍ,1,1995,Empresario
35113590376,DIRCEU LOPES VASCONCELOS GUARATINGUETA,GUARATINGUETÁ,1,1995,Empresario
35113590384,APARECIDO MONTALVAO SANTA BARBARA,,1,1995,Empresario
35113590392,ANDREA FERNANDES GUIMARAES,PIRASSUNUNGA,1,1995,Empresario
35113590406,ANTONIO JULIO ALAMBARI,ALAMBARI,1,1995,Empresario
35113590414,PAULO DE TARCIO SILVA,SÃO PAULO,1,1995,Empresario
35113590422,MIYOKO KAVAGUTI,BARRETOS,1,1995,Empresario
35113590431,PAULO SERGIO ANGELO GUARULHOS,GUARULHOS,1,1995,Empresario
35113590449,JOAO RODRIGUES DA SILVA SAO SEBASTIAO,SÃO SEBASTIÃO,1,1995,Empresario
35113590457,JOSE APPARECIDO PIRES BAURU,BAURU,1,1995,Empresario
35113590465,L A FERNANDES JUNIOR LORENA,LORENA,1,1995,Empresario
35113590473,C.XAVIER DA SILVA AUTOMOVEIS,ATIBAIA,1,1995,Empresario
35113590481,MARIA APARECIDA FIDELIS BAURU,BAURU,1,1995,Empresario
35113590490,WALTER GONCALVES DE ABREU BADY BASSITT,BADY BASSITT,1,1995,Empresario
35113590503,GILBERTO FABIO GARCIA ALVES,ORINDIÚVA,1,1995,Empresario
35113590511,ROBERTO FERREIRA DA COSTA RIO PRETO,SÃO JOSÉ DO RIO PRETO,1,1995,Empresario
35113590520,VERIDIANA ANTUNES RIBEIRO,MIRASSOL,1,1995,Empresario
35113590538,J R NOVAES,SÃO JOSÉ DO RIO PRETO,1,1995,Empresario
35113590546,MARA CRISTINA DE OLIVEIRA CONFECCOES,SANTO ANDRÉ,1,1995,Empresario
35113590554,CARLO CEZAR DOS SANTOS,PRESIDENTE PRUDENTE,1,1995,Empresario
35113590562,MARIA EUNICE DA SILVA ANTUNES-APARECIDA,APARECIDA,1,1995,Empresario
35113590571,EDNA MARIA BITTENCOURT DE OLIVEIRA ARNEIRO BAZAR,GUARATINGUETÁ,1,1995,Empresario
35113590589,MARIA DE LOURDES DA CONCEICAO SANTOS TREMEMBE,TREMEMBÉ,1,1995,Empresario
35113590597,AROLDO G W MARTINS,ITANHAÉM,1,1995,Empresario
35113590601,CID JOFFRE W MARTINS CRUZEIRO,CRUZEIRO,1,1995,Empresario
35113590619,EDSON DE JESUS MORAES SOROCABA,SOROCABA,1,1995,Empresario
35113590627,JOSE CARLOS CELESTINO DOS SANTOS,SOROCABA,1,1995,Empresario
35113590635,FRANCISCO DE OLIVEIRA TRANSPORTES,SOROCABA,1,1995,Empresario
35113590643,CLOVIS MARQUES VOTORANTIM,VOTORANTIM,1,1995,Empresario
35113590651,INES CORDEIRO DE ALENCAR SOUZA,,1,1995,Empresario
35113590660,FRANCISCO MARTIM DA COSTA,SÃO PAULO,1,1995,Empresario
35113590678,JACI SILVA DE SOUZA GUARULHOS,GUARULHOS,1,1995,Empresario
35113590686,JOSEMAR GOMES PEREIRA,SÃO PAULO,1,1995,Empresario
35113590694,SIDNEI PISTILI,OSASCO,1,1995,Empresario
35113590708,MARIA JOSE MILITAO DA SILVA,DIADEMA,1,1995,Empresario
35113590716,ROGERIO CACERES PORTERO,SÃO BERNARDO DO CAMPO,1,1995,Empresario
35113590724,LEDA MARA ACRA RIBEIRO DOS SANTOS,ARAÇOIABA DA SERRA,1,1995,Empresario
35113590732,JOAO BATISTA SAMPAIO DE SOUZA,SUZANO,1,1995,Empresario
35113590741,LUIZ CARLOS ESTEVES CONFECCAO,CAMPINAS,1,1995,Empresario
35113590759,DAVID JOSE PELEGRINI,CAMPINAS,1,1995,Empresario
35113590767,JANAINA CARLA DE SOUZA,TABOÃO DA SERRA,1,1995,Empresario
35113590775,TEREZA BORGES GONCALO,PIRACICABA,1,1995,Empresario
35113590783,VICENTINA LOPES DE SOUZA GOUVEIA,SÃO PEDRO,1,1995,Empresario
35113590791,MARIA EDITE SOARES BIO PIRACICABA,PIRACICABA,1,1995,Empresario
35113590805,NEUZA CRISTINA FERREIRA CAMARGO,PIRACICABA,1,1995,Empresario
35113590813,EDISON BRUNELLI,PIRACICABA,1,1995,Empresario
35113590821,J B DIAS QUITANDA E MERCEARIA,SÃO BERNARDO DO CAMPO,1,1995,Empresario
35113590830,JULIO CESAR DA SILVA BATERIAS,VARGEM GRANDE DO SUL,1,1995,Empresario
35113590848,JOAQUIM ALEXANDRE DE CASTRO,BANANAL,1,1995,Empresario
35113590856,M L BORGES BUFFET,JUNDIAÍ,1,1995,Empresario
35113590864,JOSE EMILIANO DOS SANTOS,LUCÉLIA,1,1995,Empresario
35113590872,TATIANA SANTOS STEFANI,ATIBAIA,1,1995,Empresario
35113590881,APARECIDA DEOLINDA BASSO BURRIM,SERTÃOZINHO,1,1995,Empresario
35113590899,JUZUE REIS RIBEIRO TAMBAU,TAMBAÚ,1,1995,Empresario
35113590902,MIRLENE CRISTINA PEREIRA FERRARESI,SÃO JOSÉ DO RIO PARDO,1,1995,Empresario
35113590911,EDUARDO GUIMBRA GUERRA,SÃO PAULO,1,1995,Empresario
35113590929,GERALDO LESBAO MEIRA,MATÃO,1,1995,Empresario
35113590937,EDSON J PIRES ARAN,ANHUMAS,1,1995,Empresario
35113590945,M L B SASSI,BORBOREMA,1,1995,Empresario
35113590953,SILVANA APARECIDA DE ALMEIDA ARARAS,ARARAS,1,1995,Empresario
35113590961,APARECIDA CARMELA MORETTI,SÃO PAULO,1,1995,Empresario
35113590970,LUCINDA CLARA PASTINI,PORANGABA,1,1995,Empresario
35113590988,EDILSON SOUZA SILVA,SÃO PAULO,1,1995,Empresario
35113590996,E. M. DE BARROS,SANTOS,1,1995,Empresario
35113591003,NOEME DA CONCEICAO FERREIRA,SÃO PAULO,1,1995,Empresario
35113591011,RAIMUNDO FERRAZ ROCHA NETO,SÃO PAULO,1,1995,Empresario
35113591020,SU CHIN FU,ITAPECERICA DA SERRA,1,1995,Empresario
35113591038,A DE SOUSA PEREIRA MERCEARIA,,1,1995,Empresario
35113591046,ALAIDE APARECIDA SCABELLO,,1,1995,Empresario
35113591054,EDEVALDO DA CUNHA GOUVEIRA GUACU,MOGI GUAÇU,1,1995,Empresario
35113591062,MARIA DO CARMO SILVA BUENO ROUPAS,MOGI GUAÇU,1,1995,Empresario
35113591071,FATIMA DE PAULA BRITO BAR,SÃO PAULO,1,1995,Empresario
35113591089,PEDRO RENATO HELDT,SÃO PAULO,1,1995,Empresario
35113591097,CLAUDIO PETINATTI,SÃO SEBASTIÃO,1,1995,Empresario
35113591101,L GENTIL BAZAR,LUCÉLIA,1,1995,Empresario
35113591119,EMERSON LEANDRO POSSETTI GENERAL SALGADO,GENERAL SALGADO,1,1995,Empresario
35113591127,PATRICIA PALACIOS DE ABREU BAR,SÃO BERNARDO DO CAMPO,1,1995,Empresario
35113591135,MARIA DO ROSARIO VICENTE DUQUE CONFECCOES,SÃO PAULO,1,1995,Empresario
35113591143,CARLOS ALBERTO DE SOUSA AUTO PECAS,SÃO PAULO,1,1995,Empresario
35113591259,SOLANGE BONETTI MORAIS DECORACOES,VINHEDO,1,1995,Empresario
35113591267,FLAVIA APARECIDA MENDES,FERNANDÓPOLIS,1,1995,Empresario
35113591275,ANTONIO RODRIGUES CARVALHO FERNANDOPOLIS,FERNANDÓPOLIS,1,1995,Empresario
35113591283,RUBENS MATIAS DOS SANTOS IBITINGA,IBITINGA,1,1995,Empresario
35113591291,JOSIVALDO BELARMINO DA SILVA BAR,SÃO PAULO,1,1995,Empresario
35113591305,MANOEL DE MELLO BARROS,SANTA RITA DO PASSA QUATRO,1,1995,Empresario
35113591313,FABIO NEVES VIANA,NOVO HORIZONTE,1,1995,Empresario
35113591321,ELIAS ARAUJO VERAS,PIRAPORA DO BOM JESUS,1,1995,Empresario
35113591330,CICERO LUIZ RODRIGUES,GUARULHOS,1,1995,Empresario
35113591348,MARIA APARECIDA DOS SANTOS SILVA,SÃO JOÃO DA BOA VISTA,1,1995,Empresario
35113591356,LUIZ CARLOS LEME BRISOLA,ITAÍ,1,1995,Empresario
35113591364,NELCI M C DE CASTRO,TANABI,1,1995,Empresario
35113591372,RAIMUNDO PEREIRA DOS SANTOS-JANDIRA,JANDIRA,1,1995,Empresario
35113591381,EDINA TONON DIAS,CORONEL MACEDO,1,1995,Empresario
35113591399,OSMAR ESTAVARINGO,SÃO PAULO,1,1995,Empresario
35113591402,ANTONIO TEIXEIRA DE CERQUEIRA-BAR,ITAQUAQUECETUBA,1,1995,Empresario
35113591411,MARILENE VIEIRA GOULART-MOVEIS,EMBU DAS ARTES,1,1995,Empresario
35113591429,ANGELO DURANTE,TAQUARITINGA,1,1995,Empresario
35113591437,ALEXANDRE TADAO KONDA,BAURU,1,1995,Empresario
35113591445,ADALBERTO DE OLIVEIRA BRAZ,ITU,1,1995,Empresario
35113591453,FRANCISCO DE ASSIS RIBEIRO CARVOARIA,JOANÓPOLIS,1,1995,Empresario
35113591461,MARIA CARDOZO DA SILVA FEIRANTE,JUNDIAÍ,1,1995,Empresario
35113591470,JOSE MAURO NICOLIN ILHABELA,ILHABELA,1,1995,Empresario
35113591488,FAUZI MOUSSA MOVEIS,SÃO PAULO,1,1995,Empresario
35113591496,IZABEL COELHO GASPARINI,BOTUCATU,1,1995,Empresario
35113591500,JOSE VASCONCELOS DE ARAUJO SILVA AVARE,AVARÉ,1,1995,Empresario
35113591518,YOUNG MAN TA,SÃO PAULO,1,1995,Empresario
35113591526,FATIMA AP.PEREIRA BORDINI-LANCHONETE,DIADEMA,1,1995,Empresario
35113591534,LEONOR RAIMUNDO,SANTA BÁRBARA D'OESTE,1,1995,Empresario
35113591542,ANA BELA JARDIM DA SILVA,SÃO PAULO,1,1995,Empresario
35113591551,GUILHERMO RUBEN AGUIRRE RODRIGUEZ,SÃO PAULO,1,1995,Empresario
35113591569,SIMONI MESTI SAMORANO RICIOPO,SÃO PAULO,1,1995,Empresario
35113591577,MARIA DINIZ QUIRINO DA SILVA,PRAIA GRANDE,1,1995,Empresario
35113591585,JOAO ALBIERO,PRAIA GRANDE,1,1995,Empresario
35113591593,ELENA GOMES SOARES,PRAIA GRANDE,1,1995,Empresario
35113591607,ANTONIO ERNANDI VIEIRA DE AGUIAR,SÃO PAULO,1,1995,Empresario
35113591615,AIRES PEREIRA DAVID,INDAIATUBA,1,1995,Empresario
35113591623,MARIA APPARECIDA MARSON,PIRACICABA,1,1995,Empresario
35113591631,EDIMILSON GOMES FERREIRA PIRACICABA,PIRACICABA,1,1995,Empresario
35113591640,CICERO LIMA DE SOUZA TABATINGA,TABATINGA,1,1995,Empresario
35113591658,HERIVELTO CARLOS CANALES-AGUAS DA PRATA,ÁGUAS DA PRATA,1,1995,Empresario
35113591666,IZILDA DE A. FINI,SÃO JOSÉ DOS CAMPOS,1,1995,Empresario
35113591674,TELMA SEBASTIANA GRAVINEZ PERISSINATO,SÃO JOSÉ DO RIO PARDO,1,1995,Empresario
35113591682,J H DE SOUZA FRANCA,FRANCA,1,1995,Empresario
35113591691,CLEONICE FATIMA DINIS CINTRA,FRANCA,1,1995,Empresario
35113591704,ANTONIO DONIZETTI GOMES-OSASCO,OSASCO,1,1995,Empresario
35113591712,HILARICE ANALIA LUZ MORITA,SÃO CARLOS,1,1995,Empresario
35113591721,ANDRE LUIZ FELTRAN,JUNDIAÍ,1,1995,Empresario
35113591739,MARIA IRENE RECCHIA-CAJAMAR,CAJAMAR,1,1995,Empresario
35113591747,G A MARIANO CAMPINAS,HORTOLÂNDIA,1,1995,Empresario
35113591755,FRANCISCO DAS CHAGAS GONCALVES FURTADO,LEME,1,1995,Empresario
35113591763,JOSE DO ESPIRITO SANTO ALVES,COTIA,1,1995,Empresario
35113591771,ARNALDO HENRIQUE QUINILATO,SOROCABA,1,1995,Empresario
35113591780,MARCIA DAMIANI VICTORELLI,PIRASSUNUNGA,1,1995,Empresario
35113591798,FRANCISCO HELIO DA SILVA-MAIRINQUE,MAIRINQUE,1,1995,Empresario
35113591801,EUNICE SETSUKO MASSUDA OYAMA,DUARTINA,1,1995,Empresario
35113591810,ANGELITA GONCALVES DIAS MEGGIATO,LEME,1,1995,Empresario
35113591828,LAERCIO FERNANDES FERRER,ÁLVARES MACHADO,1,1995,Empresario
35113591836,LUZIA CARRION DA SILVA,PRESIDENTE PRUDENTE,1,1995,Empresario
35113591844,MARIA SUELI BENITES,,1,1995,Empresario
35113591852,MARCO A DE ALMEIDA,ITANHAÉM,1,1995,Empresario
35113591861,EDNA ROSA DE ANDRADE JALES,JALES,1,1995,Empresario
35113591879,M F ANTUNES PINTO DE OLIVEIRA,SÃO PAULO,1,1995,Empresario
35113591887,AMELIA AVELINA SILVESTRE POA,POÁ,1,1995,Empresario
35113591895,GILBERTO DA SILVA SABINO TELECOMUNICACOES,SÃO PAULO,1,1995,Empresario
35113591909,VERA APARECIDA GEREMIAS DOS ANJOS MEIRA,SUMARÉ,1,1995,Empresario
35113591925,ANTONIO MARCOS GODOI,SUMARÉ,1,1995,Empresario
35113591933,DELMA VIEIRA DE AZEVEDO,BAURU,1,1995,Empresario
35113591941,MARLI DE SOUZA DOS SANTOS,BAURU,1,1995,Empresario
35113591950,AGNALDO SALLES DE OLIVEIRA AMERICO BRASILIENSE,AMÉRICO BRASILIENSE,1,1995,Empresario
35113591968,M.L. REZADOR,AMERICANA,1,1995,Empresario
35113591976,JACIRA MARIA FIDELIS LAUREANO,SUMARÉ,1,1995,Empresario
35113591984,JOEL TEIXEIRA DE LIMA PNEUMATICOS,ITAPECERICA DA SERRA,1,1995,Empresario
35113591992,FABIO RENATO DA SILVA,PORTO FELIZ,1,1995,Empresario
35113592000,JAIR MOTA,PORTO FELIZ,1,1995,Empresario
35113592018,WAGNER GONCALVES PAPELARIA,LIMEIRA,1,1995,Empresario
35113592026,NEUSA VIEIRA DE SOUSA CASTELLO,LIMEIRA,1,1995,Empresario
35113592034,DENISE DOS SANTOS PINELA,SÃO PAULO,1,1995,Empresario
35113592042,ROSA HANAKO MIWA,SÃO PAULO,1,1995,Empresario
35113592051,JUNIO APARECIDO XAVIER,SÃO PAULO,1,1995,Empresario
35113592069,A. DONIZETE G. DA SILVA LIMEIRA,LIMEIRA,1,1995,Empresario
35113592077,JOSIANE DIAS SARAUZA,SANTO ANDRÉ,1,1995,Empresario
35113592085,LUIZ ALBERTO DE OLIVEIRA SANTO ANDRE,SANTO ANDRÉ,1,1995,Empresario
35113592093,DURVALINA BATISTA NUNES,SÃO PAULO,1,1995,Empresario
35113592107,ROSILENE SILVEIRA FLORES,CAMPINAS,1,1995,Empresario
35113592115,VICENTE LUIS ROTELLA,VINHEDO,1,1995,Empresario
35113592123,D.N. OLIVEIRA,FERNANDÓPOLIS,1,1995,Empresario
35113592131,JOAO BATISTA BORDIN VINHEDO,VINHEDO,1,1995,Empresario
35113592140,JARDELINA MENK SILVA,SÃO VICENTE,1,1995,Empresario
