NIRE,Empresa,Município,Month,Year,Type
35600094757,SEF SALAO DE BELEZA EIRELI,SAO PAULO,8,2012,Armazens Gerais Empresario
35600094765,ESCOLA DE BELEZA PICOLO COSTA EIRELI,SAO PAULO,8,2012,Armazens Gerais Empresario
35600094773,RR CAR COMERCIO DE VEICULOS LTDA EIRELI,SAO PAULO,8,2012,Armazens Gerais Empresario
35600094781,ORGANIZACAO CONTABIL ASTORGA EIRELI,SAO PAULO,8,2012,Armazens Gerais Empresario
35600094790,CLAUDIO ACHKAR CONFECCOES EIRELI,BRAGANCA PAULISTA,8,2012,Armazens Gerais Empresario
35600094803,MOSAICO HUMANO TREINAMENTO EIRELI,SAO PAULO,8,2012,Armazens Gerais Empresario
35600094811,AKTIVA EMBALAGENS INDUSTRIA E COMERCIO EIRELI,SAO PAULO,8,2012,Armazens Gerais Empresario
35600094820,SCUP EIRELI,SAO PAULO,8,2012,Armazens Gerais Empresario
35600094838,JJRJ MODAS EIRELI,SAO PAULO,8,2012,Armazens Gerais Empresario
35600094846,MBRAS SERVICOS ADMINISTRATIVOS EIRELI,SAO PAULO,8,2012,Armazens Gerais Empresario
35600094854,BRAS LING COMERCIAL EIRELI,SAO PAULO,8,2012,Armazens Gerais Empresario
35600094862,ETHAR COMERCIO E ASSESSORIA EIRELI,SAO PAULO,8,2012,Armazens Gerais Empresario
35600094889,AUTO POSTO GENESIS J. A. EIRELI,SAO PAULO,8,2012,Armazens Gerais Empresario
35600094897,AMIGO'S BAR E RESTAURANTE EIRELI,SAO PAULO,8,2012,Armazens Gerais Empresario
35600094901,TODOS OS SENTIDOS CONSULTORIA AMBIENTAL EIRELI,SAO PAULO,8,2012,Armazens Gerais Empresario
35600094919,PAMI COMERCIALDE MOLAS E FERRAGENS EIRELI,SAO PAULO,8,2012,Armazens Gerais Empresario
35600094927,STREET FIVE INDUSTRIA E COMERCIO DE ROUPAS EM GERAL IMPORTACAO E EXPORTACAO EIRELI,TAQUARITINGA,8,2012,Armazens Gerais Empresario
35600094935,COMAL PARTICIPACOES EIRELI,SAO PAULO,8,2012,Armazens Gerais Empresario
35600094943,VERTIX ESTRUTURACAO DE NEGOCIOS - EIRELI,SAO PAULO,8,2012,Armazens Gerais Empresario
35600094951,THE ONE FITNESS EIRELI,REGISTRO,8,2012,Armazens Gerais Empresario
35600094960,CATEDRAL DO WHISKY REPRESENTACAO EIRELI,ITATIBA,8,2012,Armazens Gerais Empresario
35600094978,G M EXPRESS ENTREGAS RAPIDAS - EIRELI,SAO PAULO,8,2012,Armazens Gerais Empresario
35600094986,CRESPIM INFORMATICA EIRELI,SAO PAULO,8,2012,Armazens Gerais Empresario
35600094994,"NOVA ALIANCA COMERCIO, PRESTACAO DE SERVICOS ESPECIALIZADOS EM ELEVADORES - EIRELI",SAO PAULO,8,2012,Armazens Gerais Empresario
35600095001,ARP VENDA E ASSISTENCIA TECNICA DE RELOGIO DE PONTO - EIRELI,SAO PAULO,8,2012,Armazens Gerais Empresario
35600095010,NS COMERCIO DE ROUPAS E ACESSORIOS EIRELI,BARUERI,8,2012,Armazens Gerais Empresario
35600095028,TECPART GESTAO EMPRESARIAL EIRELI,SAO PAULO,8,2012,Armazens Gerais Empresario
35600095036,EFX SERVICOS ADMINISTRATIVOS EIRELI,SAO PAULO,8,2012,Armazens Gerais Empresario
35600095044,MANTIQUEIRA SOLUCOES AMBIENTAIS - EIRELI,SAO PAULO,8,2012,Armazens Gerais Empresario
35600095052,XFIT SUPPLEMENT EIRELE,OSASCO,8,2012,Armazens Gerais Empresario
35600095061,MAGALHAES & MIRANDA CONSULTORIA DE IMOVEIS EIRELI,SAO PAULO,8,2012,Armazens Gerais Empresario
35600095079,LEP REPRESENTACOES COMERCIAIS.EIRELI,SAO PAULO,8,2012,Armazens Gerais Empresario
35600095087,DUDENICK COMERCIAL EIRELI,SUMARE,8,2012,Armazens Gerais Empresario
35600095095,STUDIO XXI METALURGICA EIRELI,ITAPEVI,8,2012,Armazens Gerais Empresario
35600095109,STRIKER SP SERVICOS OPERACIONAIS EIRELI,SAO PAULO,8,2012,Armazens Gerais Empresario
35600099457,JV MATERIAIS ELETRICO E CONSTRUCAO EIRELI,GUARULHOS,8,2012,Armazens Gerais Empresario
35600099465,"EFA - CONSTRUCOES, SERVICOS E COMERCIO EIRELI",SAO PAULO,8,2012,Armazens Gerais Empresario
35600099473,NRS COMERCIO DE TAMBORES EIRELI,SAO PAULO,8,2012,Armazens Gerais Empresario
35600099481,MR LANZA TRANSPORTES EIRELI,ITUPEVA,8,2012,Armazens Gerais Empresario
35600099490,CAMANZA TRANSPORTES E LOGISTICA EIRELI,SAO PAULO,8,2012,Armazens Gerais Empresario
35600099503,AUTO ELETRICO E MECANICA VS EIRELI,GUARULHOS,8,2012,Armazens Gerais Empresario
35600099511,A.L. CAMPOS ESCRITORIO DE CONTABILIDADE EIRELI,TAUBATE,8,2012,Armazens Gerais Empresario
35600099520,EJC MULTIMARCAS COMERCIO DE VEICULOS EIRELI,SAO JOSE DOS CAMPOS,8,2012,Armazens Gerais Empresario
35600099538,ORION COMERCIO E SERVICOS DE EQUIPAMENTOS EIRELI,TAUBATE,8,2012,Armazens Gerais Empresario
35600099546,ML COBRANCA EMPRESARIAL EIRELI,ITAQUAQUECETUBA,8,2012,Armazens Gerais Empresario
35600099554,RZK GRAVACOES TECNICAS EIRELI,GUARULHOS,8,2012,Armazens Gerais Empresario
35600099562,D.K.CALCADOS EIRELI,ITAQUAQUECETUBA,8,2012,Armazens Gerais Empresario
35600099571,CONNECTION CALL RESEARCH INFORMATICA EIRELI,SAO PAULO,8,2012,Armazens Gerais Empresario
35600099589,ELETROGROUP ONE COMERCIO DE MOVEIS E ELETRONICOS EIRELI,BERTIOGA,8,2012,Armazens Gerais Empresario
35600099597,DONICAR COMERCIO DE PECAS E SERVICOS EIRELI,SAO PAULO,8,2012,Armazens Gerais Empresario
35600099601,"SILVER 777 TRADING - IMPORTACAO, EXPORTACAO E COMERCIO EIRELI",GUARULHOS,8,2012,Armazens Gerais Empresario
35600099619,PETROTAN INTERMEDIACAO DE NEGOCIOS EIRELI,SANTA ISABEL,8,2012,Armazens Gerais Empresario
35600099627,S.A. CENTRO DE NEGOCIOS EIRELI,SAO PAULO,8,2012,Armazens Gerais Empresario
35600099635,RE PRESTACAO DE SERVICO EM AUTOMACAO COMERCIAL EIRELI,GUARULHOS,8,2012,Armazens Gerais Empresario
35600099643,CICLO CREDIT COBRANCAS E APOIO ADMINISTRATIVO EIRELI,SAO PAULO,8,2012,Armazens Gerais Empresario
35600099651,VIDAS FARMACIA EIRELI,SAO PAULO,8,2012,Armazens Gerais Empresario
35600099660,DANIELA ALMEIDA DE OLIVEIRA CABELEIREIRA EIRELI,SAO PAULO,8,2012,Armazens Gerais Empresario
35600099678,D B BICHUETTI SERVICOS MEDICOS EIRELI,SAO PAULO,8,2012,Armazens Gerais Empresario
35600099686,ANTONIO ALFREDO GOMES DOS SANTOS ARQUITETURA EIRELI,GUARULHOS,8,2012,Armazens Gerais Empresario
35600099694,DADUDA ARTIGOS PARA FESTA E LANCHONETE EIRELI,POA,8,2012,Armazens Gerais Empresario
35600099708,JHMP SERVICOS LOGISTICOS E TREINAMENTOS EIRELI,SUZANO,8,2012,Armazens Gerais Empresario
35600099716,FLASH KIDS MODA JOVEM EIRELI,GUARULHOS,8,2012,Armazens Gerais Empresario
35600102415,DESAFIO RECURSOS HUMANOS EIRELI,SANTO ANDRE,8,2012,Armazens Gerais Empresario
35600102423,RILUX ILUMINACAO INDUSTRIAL EIRELI,SALTO,8,2012,Armazens Gerais Empresario
35600102431,RILUME ILUMINACAO INDUSTRIAL EIRELI,SALTO,8,2012,Armazens Gerais Empresario
35600102440,DELAMONICA MODAS E ACESSORIOS EIRELI,RIBEIRAO PRETO,8,2012,Armazens Gerais Empresario
35600102458,RC PECAS SOROCABA EIRELI,SOROCABA,8,2012,Armazens Gerais Empresario
35600104094,BM WORKS COMERCIO IMPORTACAO E EXPORTACAO EIRELI,SAO PAULO,8,2012,Armazens Gerais Empresario
35600104108,CIRCUIT GAMES COMERCIAL - EIRELI,MOGI DAS CRUZES,8,2012,Armazens Gerais Empresario
35600104116,TRUCKPECAS COMERCIO DE PECAS E SERVICOS - EIRELI,SAO PAULO,8,2012,Armazens Gerais Empresario
35600104124,AJI COMERCIO DE ROUPAS EIRELI,TAUBATE,8,2012,Armazens Gerais Empresario
35600104132,SANTO AMARO COMERCIO DE PRODUTOS DE LIMPEZA EIRELI,SAO PAULO,8,2012,Armazens Gerais Empresario
35600104141,CEL COMERCIO DE MATERIAL PARA CONSTRUCAO EIRELI,SAO PAULO,8,2012,Armazens Gerais Empresario
35600104167,J.A.M. MODAS EIRELI,SAO PAULO,8,2012,Armazens Gerais Empresario
35600104175,STG CONSULTING - TECNOLOGIA DA INFORMACAO EIRELI,SAO PAULO,8,2012,Armazens Gerais Empresario
35600104183,TURNN COMERCIO E CONFECCOES DE ROUPAS EIRELI,SAO PAULO,8,2012,Armazens Gerais Empresario
35600104191,ABG VARIEDADES EIRELI,SAO PAULO,8,2012,Armazens Gerais Empresario
35600104205,CLAYTON NASCIMENTO NEGOCIOS IMOBILIARIOS - ERIELI,SANTO ANDRE,8,2012,Armazens Gerais Empresario
35600104213,TSS PRODUCOES ARTISTICAS EIRELI,SAO PAULO,8,2012,Armazens Gerais Empresario
35600104221,CRISTINA D. C. CARNER EIRELI,JUNDIAI,8,2012,Armazens Gerais Empresario
35600104230,REGINA A RIBEIRO DESENVOLVIMENTO DO CAPITAL HUMANO E ALTAPERFOMANCE EMPRESARIAL EIRELI,SAO PAULO,8,2012,Armazens Gerais Empresario
35600107115,FMX CLINICA ODONTOLOGICA - EIRELI,FRANCISCO MORATO,8,2012,Armazens Gerais Empresario
35600107123,JOSE ALBIRAN DE LIMA EIRELI,BOM JESUS DOS PERDOES,8,2012,Armazens Gerais Empresario
35600107131,LUCMAK COMERCIO DE MAQUINAS E EQUIPAMENTOS DE GASTRONOMIA EIRELI,SAO PAULO,8,2012,Armazens Gerais Empresario
35600107158,IONICE CORREA GRUGNALE EIRELI,SAO PAULO,8,2012,Armazens Gerais Empresario
35600107166,ROBERTO V. TOSTA EIRELI,SAO PAULO,8,2012,Armazens Gerais Empresario
35600107174,T. A. DE OLIVEIRA EIRELI,BRAGANCA PAULISTA,8,2012,Armazens Gerais Empresario
35600107182,MARIA L DE ARAUJO TRANSPORTES EIRELI,SAO PAULO,8,2012,Armazens Gerais Empresario
35600107191,LAURINDO JOSE SOARES EIRELI,SAO PAULO,8,2012,Armazens Gerais Empresario
35600107204,SANDRO AFONSO AMARO EIRELI,SAO PAULO,8,2012,Armazens Gerais Empresario
35600108421,BMA COMERCIAL ELETRICA EIRELI,ARARAQUARA,8,2012,Armazens Gerais Empresario
35600108430,MARCOS CESAR SILVA VASCONCELOS - EIRELI,TAQUARITINGA,8,2012,Armazens Gerais Empresario
35600108448,POLIPISO BETON QUIMICA EIRELI,DESCALVADO,8,2012,Armazens Gerais Empresario
35600108456,POLIPISO ENGEMEV INDUSTRIA E COMERCIO DE PRODUTOS PARA CONSTRUCAO CIVIL - EIRELI,DESCALVADO,8,2012,Armazens Gerais Empresario
35600112577,ARAM & MESQUITA INDUSTRIA E COMERCIO DE ROUPAS EIRELI,SAO PAULO,8,2012,Armazens Gerais Empresario
35600112585,BELLA KIDS COMERCIO DE ROUPAS E ACESSORIOS EIRELI,SAO PAULO,8,2012,Armazens Gerais Empresario
35600112607,VERTICE ARQUITETURA E CONSULTORIA EIRELI,SAO PAULO,8,2012,Armazens Gerais Empresario
35600112615,NELIA C L ADMINISTRADORA DE BENS EIRELI,SAO PAULO,8,2012,Armazens Gerais Empresario
35600112623,OTTONI PROPAGANDA - EIRELI,SAO PAULO,8,2012,Armazens Gerais Empresario
35600112631,FABIO CHASCO REPRESENTACOES EIRELI,SAO PAULO,8,2012,Armazens Gerais Empresario
35600112640,"ADMINISTRADORA E INCORPORADORA ""ALFRANSA"" EIRELI.",SAO CAETANO DO SUL,8,2012,Armazens Gerais Empresario
35600112666,VS-FONO SERVICOS DE FONOAUDIOLOGIA EIRELI,SAO PAULO,8,2012,Armazens Gerais Empresario
35600112674,TTL ADMINISTRACAO IMOBILIARIA EIRELI,SAO PAULO,8,2012,Armazens Gerais Empresario
35600112682,ELIS REGINA VANELI SERVICOS ADMINISTRATIVOS EIRELI,SAO PAULO,8,2012,Armazens Gerais Empresario
35600112691,E S ENGENHARIA E CONSTRUCOES EIRELI,SAO PAULO,8,2012,Armazens Gerais Empresario
35600112704,EQUILOJA SPUR ARTIGOS DE COURO - EIRELI,SAO PAULO,8,2012,Armazens Gerais Empresario
35600112712,ALURI TRANSPORTES EIRELI,GUARULHOS,8,2012,Armazens Gerais Empresario
35600112721,PATRON ADMINISTRACAO E PARTICIPACOES - EIRELI,PIRACICABA,8,2012,Armazens Gerais Empresario
35600112739,ENGFIX - MANUTENCAO DE EQUIPAMENTOS MEDICOS - EIRELI,SAO PAULO,8,2012,Armazens Gerais Empresario
35600112747,LA DE CASA COMERCIO DE BOLOS CASEIROS EIRELI,SAO PAULO,8,2012,Armazens Gerais Empresario
35600112755,MGO CONSULTORIA E ADMINISTRACAO - EIRELI,SAO PAULO,8,2012,Armazens Gerais Empresario
35600112763,JCN DISTRIBUIDORA DE BATERIAS - EIRELI,SAO PAULO,8,2012,Armazens Gerais Empresario
35600112771,PORT LOUIS POUSADA - EIRELI,CARAGUATATUBA,8,2012,Armazens Gerais Empresario
35600112780,RM CONSTRUTORA - EIRELI,SAO PAULO,8,2012,Armazens Gerais Empresario
35600112798,ENERIETH AGUIRRE DE MOJICA EIRELI,SAO PAULO,8,2012,Armazens Gerais Empresario
35600112801,MIDIA TAPE AUDIO E VIDEO EIRELI,SAO PAULO,8,2012,Armazens Gerais Empresario
35600112810,SHOWA SERVICOS EMPRESARIAIS EIRELI,SAO PAULO,8,2012,Armazens Gerais Empresario
35600112828,GEF PRODUCOES EIRELI,SAO PAULO,8,2012,Armazens Gerais Empresario
35600112836,NIEBUS TRANSPORTE E LOCACAO EIRELI,SAO PAULO,8,2012,Armazens Gerais Empresario
35600112844,BME SERVICOS DE TECNOLOGIA EIRELI,SAO PAULO,8,2012,Armazens Gerais Empresario
35600112852,MARCO ANTONIO CAMPION EIRELI,ILHA COMPRIDA,8,2012,Armazens Gerais Empresario
35600112712,ALURI TRANSPORTES EIRELI,GUARULHOS,8,2012,Armazens Gerais Empresario
35600112721,PATRON ADMINISTRACAO E PARTICIPACOES - EIRELI,PIRACICABA,8,2012,Armazens Gerais Empresario
35600112739,ENGFIX - MANUTENCAO DE EQUIPAMENTOS MEDICOS - EIRELI,SAO PAULO,8,2012,Armazens Gerais Empresario
35600112747,LA DE CASA COMERCIO DE BOLOS CASEIROS EIRELI,SAO PAULO,8,2012,Armazens Gerais Empresario
35600112755,MGO CONSULTORIA E ADMINISTRACAO - EIRELI,SAO PAULO,8,2012,Armazens Gerais Empresario
35600112763,JCN DISTRIBUIDORA DE BATERIAS - EIRELI,SAO PAULO,8,2012,Armazens Gerais Empresario
35600112771,PORT LOUIS POUSADA - EIRELI,CARAGUATATUBA,8,2012,Armazens Gerais Empresario
35600112780,RM CONSTRUTORA - EIRELI,SAO PAULO,8,2012,Armazens Gerais Empresario
35600112798,ENERIETH AGUIRRE DE MOJICA EIRELI,SAO PAULO,8,2012,Armazens Gerais Empresario
35600112801,MIDIA TAPE AUDIO E VIDEO EIRELI,SAO PAULO,8,2012,Armazens Gerais Empresario
35600112810,SHOWA SERVICOS EMPRESARIAIS EIRELI,SAO PAULO,8,2012,Armazens Gerais Empresario
35600112828,GEF PRODUCOES EIRELI,SAO PAULO,8,2012,Armazens Gerais Empresario
35600112836,NIEBUS TRANSPORTE E LOCACAO EIRELI,SAO PAULO,8,2012,Armazens Gerais Empresario
35600112844,BME SERVICOS DE TECNOLOGIA EIRELI,SAO PAULO,8,2012,Armazens Gerais Empresario
35600112852,MARCO ANTONIO CAMPION EIRELI,ILHA COMPRIDA,8,2012,Armazens Gerais Empresario
35600112712,ALURI TRANSPORTES EIRELI,GUARULHOS,8,2012,Armazens Gerais Empresario
35600112721,PATRON ADMINISTRACAO E PARTICIPACOES - EIRELI,PIRACICABA,8,2012,Armazens Gerais Empresario
35600112739,ENGFIX - MANUTENCAO DE EQUIPAMENTOS MEDICOS - EIRELI,SAO PAULO,8,2012,Armazens Gerais Empresario
35600112747,LA DE CASA COMERCIO DE BOLOS CASEIROS EIRELI,SAO PAULO,8,2012,Armazens Gerais Empresario
35600112755,MGO CONSULTORIA E ADMINISTRACAO - EIRELI,SAO PAULO,8,2012,Armazens Gerais Empresario
35600112763,JCN DISTRIBUIDORA DE BATERIAS - EIRELI,SAO PAULO,8,2012,Armazens Gerais Empresario
35600112771,PORT LOUIS POUSADA - EIRELI,CARAGUATATUBA,8,2012,Armazens Gerais Empresario
35600112780,RM CONSTRUTORA - EIRELI,SAO PAULO,8,2012,Armazens Gerais Empresario
35600112798,ENERIETH AGUIRRE DE MOJICA EIRELI,SAO PAULO,8,2012,Armazens Gerais Empresario
35600112801,MIDIA TAPE AUDIO E VIDEO EIRELI,SAO PAULO,8,2012,Armazens Gerais Empresario
35600112810,SHOWA SERVICOS EMPRESARIAIS EIRELI,SAO PAULO,8,2012,Armazens Gerais Empresario
35600112828,GEF PRODUCOES EIRELI,SAO PAULO,8,2012,Armazens Gerais Empresario
35600112836,NIEBUS TRANSPORTE E LOCACAO EIRELI,SAO PAULO,8,2012,Armazens Gerais Empresario
35600112844,BME SERVICOS DE TECNOLOGIA EIRELI,SAO PAULO,8,2012,Armazens Gerais Empresario
35600112852,MARCO ANTONIO CAMPION EIRELI,ILHA COMPRIDA,8,2012,Armazens Gerais Empresario
35600112712,ALURI TRANSPORTES EIRELI,GUARULHOS,8,2012,Armazens Gerais Empresario
35600112721,PATRON ADMINISTRACAO E PARTICIPACOES - EIRELI,PIRACICABA,8,2012,Armazens Gerais Empresario
35600112739,ENGFIX - MANUTENCAO DE EQUIPAMENTOS MEDICOS - EIRELI,SAO PAULO,8,2012,Armazens Gerais Empresario
35600112747,LA DE CASA COMERCIO DE BOLOS CASEIROS EIRELI,SAO PAULO,8,2012,Armazens Gerais Empresario
35600112755,MGO CONSULTORIA E ADMINISTRACAO - EIRELI,SAO PAULO,8,2012,Armazens Gerais Empresario
35600112763,JCN DISTRIBUIDORA DE BATERIAS - EIRELI,SAO PAULO,8,2012,Armazens Gerais Empresario
35600112771,PORT LOUIS POUSADA - EIRELI,CARAGUATATUBA,8,2012,Armazens Gerais Empresario
35600112780,RM CONSTRUTORA - EIRELI,SAO PAULO,8,2012,Armazens Gerais Empresario
35600112798,ENERIETH AGUIRRE DE MOJICA EIRELI,SAO PAULO,8,2012,Armazens Gerais Empresario
35600112801,MIDIA TAPE AUDIO E VIDEO EIRELI,SAO PAULO,8,2012,Armazens Gerais Empresario
35600112810,SHOWA SERVICOS EMPRESARIAIS EIRELI,SAO PAULO,8,2012,Armazens Gerais Empresario
35600112828,GEF PRODUCOES EIRELI,SAO PAULO,8,2012,Armazens Gerais Empresario
35600112836,NIEBUS TRANSPORTE E LOCACAO EIRELI,SAO PAULO,8,2012,Armazens Gerais Empresario
35600112844,BME SERVICOS DE TECNOLOGIA EIRELI,SAO PAULO,8,2012,Armazens Gerais Empresario
35600112852,MARCO ANTONIO CAMPION EIRELI,ILHA COMPRIDA,8,2012,Armazens Gerais Empresario
35600112712,ALURI TRANSPORTES EIRELI,GUARULHOS,8,2012,Armazens Gerais Empresario
35600112721,PATRON ADMINISTRACAO E PARTICIPACOES - EIRELI,PIRACICABA,8,2012,Armazens Gerais Empresario
35600112739,ENGFIX - MANUTENCAO DE EQUIPAMENTOS MEDICOS - EIRELI,SAO PAULO,8,2012,Armazens Gerais Empresario
35600112747,LA DE CASA COMERCIO DE BOLOS CASEIROS EIRELI,SAO PAULO,8,2012,Armazens Gerais Empresario
35600112755,MGO CONSULTORIA E ADMINISTRACAO - EIRELI,SAO PAULO,8,2012,Armazens Gerais Empresario
35600112763,JCN DISTRIBUIDORA DE BATERIAS - EIRELI,SAO PAULO,8,2012,Armazens Gerais Empresario
35600112771,PORT LOUIS POUSADA - EIRELI,CARAGUATATUBA,8,2012,Armazens Gerais Empresario
35600112780,RM CONSTRUTORA - EIRELI,SAO PAULO,8,2012,Armazens Gerais Empresario
35600112798,ENERIETH AGUIRRE DE MOJICA EIRELI,SAO PAULO,8,2012,Armazens Gerais Empresario
35600112801,MIDIA TAPE AUDIO E VIDEO EIRELI,SAO PAULO,8,2012,Armazens Gerais Empresario
35600112810,SHOWA SERVICOS EMPRESARIAIS EIRELI,SAO PAULO,8,2012,Armazens Gerais Empresario
35600112828,GEF PRODUCOES EIRELI,SAO PAULO,8,2012,Armazens Gerais Empresario
35600112836,NIEBUS TRANSPORTE E LOCACAO EIRELI,SAO PAULO,8,2012,Armazens Gerais Empresario
35600112844,BME SERVICOS DE TECNOLOGIA EIRELI,SAO PAULO,8,2012,Armazens Gerais Empresario
35600112852,MARCO ANTONIO CAMPION EIRELI,ILHA COMPRIDA,8,2012,Armazens Gerais Empresario
35600112861,MY FROZEN FRUIT COMERCIO DE ALIMENTOS EIRELI,SAO PAULO,8,2012,Armazens Gerais Empresario
35600112879,INOPAR CONSULTORIA E PARTICIPACOES EIRELI,SAO PAULO,8,2012,Armazens Gerais Empresario
35600112887,TOMADATI-YA TEMAKERIA E RESTAURANTE EIRELI,SAO PAULO,8,2012,Armazens Gerais Empresario
35600112895,AJAIPAPO SOLUCOES EM MEIO AMBIENTE EIRELI,SAO PAULO,8,2012,Armazens Gerais Empresario
35600112909,SIGN WASH INDUSTRIA COMERCIO E SERVICOS EIRELI,SAO PAULO,8,2012,Armazens Gerais Empresario
35600112917,REVEST ART COMERCIO DE TINTAS - EIRELI,SAO PAULO,8,2012,Armazens Gerais Empresario
35600112925,WALCZAK TREINAMENTOS EMPRESARIAIS EIRELI,SAO PAULO,8,2012,Armazens Gerais Empresario
35600112933,R.R REPRESENTACAO E AGENCIAMENTO EIRELI,SAO PAULO,8,2012,Armazens Gerais Empresario
35600112941,BIOVITRO PRODUTOS PARA SAUDE - EIRELI,SAO CAETANO DO SUL,8,2012,Armazens Gerais Empresario
35600115967,GRIFFITH GRAY INDUSTRIA E COMERCIO DE CONFECCOES EIRELI,BARUERI,8,2012,Armazens Gerais Empresario
35600116084,MM-R CONSULTORIA EIRELI,SAO PAULO,8,2012,Armazens Gerais Empresario
35600116092,OVERCLUB CONSULTORIA DE INVESTIMENTOS E PLANEJAMENTO FINANCEIRO EIRELI,SAO PAULO,8,2012,Armazens Gerais Empresario
35600116106,REPRESENTACAO COMERCIAL RODOVALHO EIRELI,SAO PAULO,8,2012,Armazens Gerais Empresario
35600116114,KEYPO INDUSTRIA E COMERCIO EIRELI,SAO PAULO,8,2012,Armazens Gerais Empresario
35600116122,RESIMAD PLASTICOS E MADEIRAS INDUSTRIA E COMERCIO EIRELI,SAO PAULO,8,2012,Armazens Gerais Empresario
35600116131,GFMCF PARTICIPACOES - EIRELI,SAO PAULO,8,2012,Armazens Gerais Empresario
35600116157,VANDERLEI FERNANDES INFORMATICA EIRELI,SAO PAULO,8,2012,Armazens Gerais Empresario
35600116165,D. A. DA SILVA MERCADO EIRELI,UBATUBA,8,2012,Armazens Gerais Empresario
35600116173,LUCIANO MORAIS LIMA EIRELI,TAUBATE,8,2012,Armazens Gerais Empresario
35600116181,MISERCOL INDUSTRIA E COMERCIO EIRELI,SAO PAULO,8,2012,Armazens Gerais Empresario
35600116190,J. D. ALIANCA REPRESENTACAO COMERCIAL EIRELI,PIRACICABA,8,2012,Armazens Gerais Empresario
35600116203,ALAWARA CONSTRUCOES & REFORMAS EIRELI,SAO PAULO,8,2012,Armazens Gerais Empresario
35600116211,CABANA INVESTIMENTOS EIRELI,SAO PAULO,8,2012,Armazens Gerais Empresario
35600116220,DT AGENTE AUTONOMO DE INVESTIMENTO EIRELI,SAO PAULO,8,2012,Armazens Gerais Empresario
35600116238,QUALIBRAS EQUIPAMENTOS E SERVICOS EIRELI,TAUBATE,8,2012,Armazens Gerais Empresario
35600116246,NONADA EMPREENDIMENTOS IMOBILIARIOS EIRELI,SAO PAULO,8,2012,Armazens Gerais Empresario
35600116254,RIALBRI PARTICIPACOES EIRELI,SAO PAULO,8,2012,Armazens Gerais Empresario
35600116262,PAULO HUMBERTO SAPIO DE MORAIS AUTO POSTO EIRELI,PEDREGULHO,8,2012,Armazens Gerais Empresario
35600116271,G.H.A. FERNANDES PIZZARIA - EIRELI,OSASCO,8,2012,Armazens Gerais Empresario
35600116289,JOSE MARIANO FILHO COSMETICOS EIRELI,SAO PAULO,8,2012,Armazens Gerais Empresario
35600116297,FORFLEX PILATES STUDIO EIRELI,SAO PAULO,8,2012,Armazens Gerais Empresario
35600116301,MADINA ADMINISTRACAO DE BENS PROPRIOS - EIRELI,SAO PAULO,8,2012,Armazens Gerais Empresario
35600116319,"LUXUS PROPAGANDA, MERCHANDISE E TURISMO EIRELI",SAO PAULO,8,2012,Armazens Gerais Empresario
35600116327,VIVA COMERCIO E ADMINISTRACAO DE SERVICOS EIRELI,SAO PAULO,8,2012,Armazens Gerais Empresario
35600116335,EDUCA BRASIL EDUCACAO A DISTANCIA EIRELI,SAO PAULO,8,2012,Armazens Gerais Empresario
35600116343,ZONA DE CONFORTO AR CONDICIONADO EIRELI,SAO PAULO,8,2012,Armazens Gerais Empresario
35600116351,ERON MARCEL FORNER - PERICIAS E VISTORIAS AUTOMOTIVAS - EIRELI,VALINHOS,8,2012,Armazens Gerais Empresario
35600116360,J & L AUTOMOTIVE PRODUCTS EXPORTACAO E IMPORTACAO DE PECAS EIRELI,SAO BERNARDO DO CAMPO,8,2012,Armazens Gerais Empresario
35600116378,AUGUSTO CONSTRUCOES E INSTALACOES EIRELI,OSASCO,8,2012,Armazens Gerais Empresario
35600116386,UM PONTO CINCO COMERCIO DE ROUPAS E ACESSORIOS - EIRELI.,SAO PAULO,8,2012,Armazens Gerais Empresario
35600116394,TRANSAM TRANSPORTES EIRELI,CARAGUATATUBA,8,2012,Armazens Gerais Empresario
35600116408,FERNANDO OLIVEIRA PANNO AGENTE AUTONOMO DE INVESTIMENTOS - EIRELI,SAO PAULO,8,2012,Armazens Gerais Empresario
35600116416,AMRON SERVICOS RADIOLOGICOS EIRELI,SAO CAETANO DO SUL,8,2012,Armazens Gerais Empresario
35600116424,G&J IMOBILIARIA E ADMINISTRACAO EIRELI.,SAO PAULO,8,2012,Armazens Gerais Empresario
35600116432,RM - ASSESSORIA E CONSULTORIA DE INVESTIMENTOS - AGENTE AUTONOMO DE INVESTIMENTOS EIRELI,SAO PAULO,8,2012,Armazens Gerais Empresario
35600116441,MESA 4 MARKETING CULTURAL EIRELI,SAO PAULO,8,2012,Armazens Gerais Empresario
35600116459,TAPIS COMERCIO E CONFECCAO DE TAPETES EIRELLI - EPP,SAO PAULO,8,2012,Armazens Gerais Empresario
35600116467,ESTACAO DO CHOPP 2 EIRELI,SAO PAULO,8,2012,Armazens Gerais Empresario
35600116475,TEXFORT COMERCIO DE TECIDOS EIRELI,SAO PAULO,8,2012,Armazens Gerais Empresario
35600116483,PLANO ENGENHARIA - EIRELI,GUARULHOS,8,2012,Armazens Gerais Empresario
35600116491,LIZ PRODUCOES E EVENTOS EIRELI,SAO PAULO,8,2012,Armazens Gerais Empresario
35600116505,KAT BABY CONFECCOES EIRELI,SAO PAULO,8,2012,Armazens Gerais Empresario
35600116513,AJC CONFECCAO E COMERCIO EM GERAL EIRELI,SAO PAULO,8,2012,Armazens Gerais Empresario
35600116521,"CEZARSANTOS HOLDING, SERVICOS E PARTICIPACAO - EIRELI",SAO PAULO,8,2012,Armazens Gerais Empresario
35600116530,BARUCKH MASSOTERAPIA E SAUDE - EIRELI,SAO PAULO,8,2012,Armazens Gerais Empresario
35600116548,R S BRANCO APOIO ADMINISTRATIVO EIRELI,SAO PAULO,8,2012,Armazens Gerais Empresario
35600116556,FRANCISCO DAS CHAGAS ARAO DA SILVA NETO EIRELI,CAMPINAS,8,2012,Armazens Gerais Empresario
35600116564,"FFFERRARI HOLDING, SERVICOS E PARTICIPACAO - EIRELI",SAO PAULO,8,2012,Armazens Gerais Empresario
35600116572,MTH - CENTRO DE DISTRIBUICAO DE BIJOUTERIAS EIRELI,RIBEIRAO PRETO,8,2012,Armazens Gerais Empresario
35600116581,OIRAM COMERCIO DE PECAS AUTOMOTIVAS EIRELI,RIBEIRAO PIRES,8,2012,Armazens Gerais Empresario
35600116599,BAR DA ELY EIRELI,SAO PAULO,8,2012,Armazens Gerais Empresario
35600116602,INDUSTRIA DE ARTEFATOS DE FERRO E ACO TETAMANTI EIRELI,SAO PAULO,8,2012,Armazens Gerais Empresario
35600116611,ESCOLA DE EDUCACAO INFANTIL E FUNDAMENTAL MARIA DA ANUNCIACAO EIRELI,SAO JOSE DOS CAMPOS,8,2012,Armazens Gerais Empresario
35600116629,M. MARTINS LEMES EIRELI,SAO PAULO,8,2012,Armazens Gerais Empresario
35600116637,TECMIX CONCRETO EIRELI,GUARULHOS,8,2012,Armazens Gerais Empresario
35600116645,TALKATIVE PRODUCOES E EDITORA EIRELI,SARAPUI,8,2012,Armazens Gerais Empresario
35600116661,"BOARD-NET INDUSTRIA, COMERCIO, REPRESENTACAO E DISTRIBUICAO EIRELI",SANTO ANDRE,8,2012,Armazens Gerais Empresario
35600116670,TERRA SANTA COMERCIO DE MOVEIS EIRELI,MAUA,8,2012,Armazens Gerais Empresario
35600116688,JOCIMAR SABINO CRUZ - EIRELI,SAO PAULO,8,2012,Armazens Gerais Empresario
35600116696,PET MINGAL COMERCIO E SERVICOS PARA ANIMAIS EIRELI,SAO PAULO,8,2012,Armazens Gerais Empresario
35600116700,RADIOVISION EIRELI,SAO PAULO,8,2012,Armazens Gerais Empresario
35600116718,TABORDA CHAVEIRO E MATERIAIS PARA CONSTRUCAO EIRELI,SAO PAULO,8,2012,Armazens Gerais Empresario
35600116734,PKM RACING ESCOLA DE PILOTAGEM EIRELI,SAO PAULO,8,2012,Armazens Gerais Empresario
35600116769,CASA DA ALEGRIA ARTIGOS PARA FESTAS EIRELI,SAO PAULO,8,2012,Armazens Gerais Empresario
35600116777,ANA LUIZ REPRESENTACAO COMERCIAL EIRELI,SANTO ANDRE,8,2012,Armazens Gerais Empresario
35600116785,ALEMAR ADMINISTRADORA DE BENS E PARTICIPACOES - EIRELI,SANTANA DE PARNAIBA,8,2012,Armazens Gerais Empresario
35600116793,METALLIX APOIO ADMINISTRATIVO EIRELI,NOVA ODESSA,8,2012,Armazens Gerais Empresario
35600116807,"AWG CONSULTORIA COMERCIAL, FINANCEIRA E PARTICIPACOES LTDA",SAO PAULO,8,2012,Armazens Gerais Empresario
35600116823,SMS COMERCIO DE CONFECCOES EIRELI,SAO PAULO,8,2012,Armazens Gerais Empresario
35600116831,P.R.M. SERVICOS E MAO DE OBRA ESPECIALIZADA EIRELI,SAO PAULO,8,2012,Armazens Gerais Empresario
35600116840,CENTRO DE FORMACAO DE CONDUTORES B CACULA - EIRELI,ARARAS,8,2012,Armazens Gerais Empresario
35600116891,M S B TRANSPORTADORA - EIRELI,SAO JOSE DO RIO PRETO,8,2012,Armazens Gerais Empresario
35600116904,MASTER CHEF SERVICOS ADMINISTRATIVOS EIRELI,COTIA,8,2012,Armazens Gerais Empresario
35600116912,PL - AN COMERCIO E REPRESENTACOES EIRELI,SAO PAULO,8,2012,Armazens Gerais Empresario
35600116921,MAC THUO REPRESENTACAO E DISTRIBUIDORA EIRELI,BIRIGUI,8,2012,Armazens Gerais Empresario
35600116939,VIP CLASS CORRETORA DE SEGUROS EIRELI,SAO PAULO,8,2012,Armazens Gerais Empresario
35600116947,CONECT PECAS E ACESSORIOS INDUSTRIAIS EIRELI,SOROCABA,8,2012,Armazens Gerais Empresario
35600116955,CRIAR CLIQUES SOLUCOES EM TI EIRELI,SAO PAULO,8,2012,Armazens Gerais Empresario
35600116998,VINHOS DA AUSTRIA COMERCIO EIRELI,SAO PAULO,8,2012,Armazens Gerais Empresario
35600117005,EN CANTO SERVICOS COMERCIAIS - EIRELI,SAO PAULO,8,2012,Armazens Gerais Empresario
