NIRE,Empresa,Município,Month,Year,Type
35600113425,PMG ARTIGOS DO VESTUARIO EIRELI,SAO CAETANO DO SUL,8,2012,Armazens Gerais Empresario
35600113433,NIEE AGENTE AUTONOMO DE INVESTIMENTOS EIRELI,SAO PAULO,8,2012,Armazens Gerais Empresario
35600113441,MARC PRODUCOES GRAFICAS EIRELI,SAO BERNARDO DO CAMPO,8,2012,Armazens Gerais Empresario
35600113450,N. LOJA COMERCIO DE ROUPAS - EIRELI,SAO PAULO,8,2012,Armazens Gerais Empresario
35600113468,CR SERVICOS MUSICAIS EIRELI,SAO PAULO,8,2012,Armazens Gerais Empresario
35600113476,NEW CONCEPT - GALERIA DE ARTES EIRELI,SAO PAULO,8,2012,Armazens Gerais Empresario
35600118095,FGPAR - PARTICIPACOES EIRELI,SAO PAULO,8,2012,Armazens Gerais Empresario
35600118125,AMG REMOCOES EM AMBULANCIAS EIRELI,SAO PAULO,8,2012,Armazens Gerais Empresario
35600118141,NINAS E NINOS COMERCIO EIRELI,RIBEIRAO PRETO,8,2012,Armazens Gerais Empresario
35600118184,SOCIAL IMOVEIS EIRELI,OSASCO,8,2012,Armazens Gerais Empresario
35600118192,STORE SOUND COMERCIO E DISTRIBUIDORA DE ACESSORIOS AUTOMOTIVOS EIRELI,SAO PAULO,8,2012,Armazens Gerais Empresario
35600118231,ANDRADE ADMINISTRACAO E PARTICIPACOES EIRELI,RIBEIRAO PRETO,8,2012,Armazens Gerais Empresario
35600118249,HEGG ADMINISTRACAO E PARTICIPACOES EIRELI,SAO PAULO,8,2012,Armazens Gerais Empresario
35600118257,NOVAES ADMINISTRACAO E PARTICIPACOES EIRELI.,SAO PAULO,8,2012,Armazens Gerais Empresario
35600118265,ALESSANDRO COUTO FOTOGRAFIA EIRELI,SAO PAULO,8,2012,Armazens Gerais Empresario
35600118273,KETHER AQUECEDORES A GAS COMERCIO VAREJISTA EIRELI,SAO PAULO,8,2012,Armazens Gerais Empresario
35600118281,DASUPORT REPRESENTACAO COMERCIAL EIRELI,BIRIGUI,8,2012,Armazens Gerais Empresario
35600118290,ATIVIDADE AGENTE AUTONOMO DE INVESTIMENTO - EIRELI,SAO PAULO,8,2012,Armazens Gerais Empresario
35600118303,FERNANDO JORGE MOREIRA IMOVEIS - EIRELI,ITAPETININGA,8,2012,Armazens Gerais Empresario
35600118311,MOTEL NUAGE EIRELI,SANTO ANDRE,8,2012,Armazens Gerais Empresario
35600118320,"TOP S EMPREENDIMENTOS, OBRAS E GESTAO DE IMOVEIS EIRELI",SAO PAULO,8,2012,Armazens Gerais Empresario
35600118338,SANTA VIVIANE PARTICIPACOES EIRELI,SAO PAULO,8,2012,Armazens Gerais Empresario
35600118346,FARO MODEL'S AGENCIA EIRELI,SAO PAULO,8,2012,Armazens Gerais Empresario
35600118354,BEACHPLUS MODA PRAIA PLUS SIZE - EIRELI,SAO PAULO,8,2012,Armazens Gerais Empresario
35600118362,PODIUM SHOES ARTIGOS ESPORTIVOS - EIRELI,SAO BERNARDO DO CAMPO,8,2012,Armazens Gerais Empresario
35600118371,PODIUM ABC ARTIGOS ESPORTIVOS - EIRELI,SAO BERNARDO DO CAMPO,8,2012,Armazens Gerais Empresario
35600118389,ROTA TRANSPORTADORA EIRELI,OSASCO,8,2012,Armazens Gerais Empresario
35600118397,SILVANA APARECIDA DE OLIVEIRA CORREA EMPRESA SIMPLES DE CREDITO EIRELI,SAO PAULO,8,2012,Armazens Gerais Empresario
35600118401,MSMORAES PARTICIPACOES EIRELI,MAIRINQUE,8,2012,Armazens Gerais Empresario
35600120413,REBOLICO MODAS EIRELI,SAO PAULO,8,2012,Armazens Gerais Empresario
35600120421,RIDON EDUCACAO EIRELLI,SAO PAULO,8,2012,Armazens Gerais Empresario
35600120448,IMENSITTA - INFINITY CENARIOS ORGANIZACAO LOCACOES E EVENTOS EIRELI,SAO PAULO,8,2012,Armazens Gerais Empresario
35600120464,GELA GUELA ACAI - PRODUTOS ALIMENTICIOS EIRELI,SAO BERNARDO DO CAMPO,8,2012,Armazens Gerais Empresario
35600120472,A DOMENICO TELEATENDIMENTO EIRELI,SAO PAULO,8,2012,Armazens Gerais Empresario
35600120481,JAF APOIO ADMINISTRATIVO EMPRESARIAL EIRELI,SAO PAULO,8,2012,Armazens Gerais Empresario
35600120499,XMAS E DECORACAO EIRELI.,CAMPINAS,8,2012,Armazens Gerais Empresario
35600120502,FABIANA MANAIA MARTINS - EIRELI,SAO BERNARDO DO CAMPO,8,2012,Armazens Gerais Empresario
35600120511,MANTOVA COMERCIO DE ALIMENTOS E BEBIDAS EIRELI,SAO PAULO,8,2012,Armazens Gerais Empresario
35600120529,R. M COMERCIO DE MADEIRAS E ARTEFATOS EIRELI,SAO PAULO,8,2012,Armazens Gerais Empresario
35600120537,BANZAI COMERCIO E DECORACOES PARA FESTAS EIRELI,COTIA,8,2012,Armazens Gerais Empresario
35600120545,DIREKT CAR SERVICOS DE INTERMEDIACAO E COMERCIO DE VEICULOS EIRELI,CAMPINAS,8,2012,Armazens Gerais Empresario
35600120553,CEP CONSTRUCAO CIVIL EIRELI,MOGI DAS CRUZES,8,2012,Armazens Gerais Empresario
35600120561,PANNE E LATTE PANIFICADORA EIRELI,SAO CAETANO DO SUL,8,2012,Armazens Gerais Empresario
35600120570,PENSE PROJETOS ENGENHARIA E SERVICOS EIRELI,SAO PAULO,8,2012,Armazens Gerais Empresario
35600120588,CORPER FISHING COMERCIAL EIRELI,COTIA,8,2012,Armazens Gerais Empresario
35600120596,YE COMERCIO DE OCULOS - EIRELI,SAO PAULO,8,2012,Armazens Gerais Empresario
35600120600,CASASHOP COMERCIO - EIRELI,SAO PAULO,8,2012,Armazens Gerais Empresario
35600120618,LOS INSTALACOES E REFORMAS EIRELI,SAO PAULO,8,2012,Armazens Gerais Empresario
35600120626,RESTAURANTE E PIZZARIA NOVA SAO PAULO EIRELI,SAO PAULO,8,2012,Armazens Gerais Empresario
35600120634,GB MONITORAMENTO E PORTARIA - EIRELI,SAO PAULO,8,2012,Armazens Gerais Empresario
35600120642,STRATUS COMERCIAL IMPORTADORA E EXPORTADORA EIRELI,SAO PAULO,8,2012,Armazens Gerais Empresario
35600120651,"J.B TREINAMENTO, INSTALACAO E COMERCIO DE ELETRO E ELETRONICA EIRELI",MOGI DAS CRUZES,8,2012,Armazens Gerais Empresario
35600120669,SPORT KAR COMERCIO DE SOM E ACESSORIOS PARA VEICULOS EIRELI,SAO PAULO,8,2012,Armazens Gerais Empresario
35600120677,LANCHONETE E RESTAURANTE NOVO SABOR DO BRASIL - EIRELI,OSASCO,8,2012,Armazens Gerais Empresario
35600120685,MILAN EMPREITEIRA DE CONSTRUCAO EIRELI,SAO PAULO,8,2012,Armazens Gerais Empresario
35600120693,SOLDEX IMPORTACAO E EXPORTACAO EIRELI,SAO PAULO,8,2012,Armazens Gerais Empresario
35600120707,SENTIDOS COMERCIO DE BEBIDAS EIRELI,BARUERI,8,2012,Armazens Gerais Empresario
35600120715,MOMENTOS DOCES COMERCIO DE CHOCOLATES EIRELI,SAO PAULO,8,2012,Armazens Gerais Empresario
35600120723,BRASIL SELLERS EIRELI,SAO PAULO,8,2012,Armazens Gerais Empresario
35600120731,NOLETO'S MATERIAIS PARA CONSTRUCAO EIRELI,SAO PAULO,8,2012,Armazens Gerais Empresario
35600120740,SERGIO REGO SANTOS HSTORE ROUPAS EIRELI,GUARULHOS,8,2012,Armazens Gerais Empresario
35600120758,INDUCOMP INDUSTRIA E COMERCIO DE EQUIPTOS ELETRO-ELETRONICOS EIRELI,SAO PAULO,8,2012,Armazens Gerais Empresario
35600120774,ATAMODEL AUTOMODELISMO EIRELI,SAO PAULO,8,2012,Armazens Gerais Empresario
35600120782,ARS SERVICOS ESTETICOS EIRELI.,SAO PAULO,8,2012,Armazens Gerais Empresario
35600120791,DASILVA - INDUSTRIA E COMERCIO DE PRODUTOS PLASTICOS EIRELI,GUARULHOS,8,2012,Armazens Gerais Empresario
35600120804,LEAD VOX COMERCIO DE EQUIPAMENTOS DE TELECOMUNICACAO EIRELI,SOROCABA,8,2012,Armazens Gerais Empresario
35600120812,LUZ SOLUCOES VISUAIS - EIRELI,VALINHOS,8,2012,Armazens Gerais Empresario
35600120821,ADRIANA QUEIROZ GUIMARAES ROUPAS & ACESSORIOS EIRELI,ITAPIRA,8,2012,Armazens Gerais Empresario
35600120839,D. DA S. PEREIRA JUNIOR EIRELI,CAMPINAS,8,2012,Armazens Gerais Empresario
35600120847,GHG SAO PAULO COMERCIO DE BOLSAS EIRELI,CAMPINAS,8,2012,Armazens Gerais Empresario
35600124419,DEISAN - MATERIAIS PLASTICOS EM GERAL EIRELI,MAIRIPORA,8,2012,Armazens Gerais Empresario
35600124427,SANCHES ULTRA PURIFICADORES - EIRELI,SAO PAULO,8,2012,Armazens Gerais Empresario
35600124435,CONDORI FASHION MODAS EIRELI,SAO PAULO,8,2012,Armazens Gerais Empresario
35600124443,SERGO SERVICOS DE CONFECCAO E BORDADOS EIRELI,SAO PAULO,8,2012,Armazens Gerais Empresario
35600124451,MARCELO AUGUSTO GEDRA ALVAREZ - REPRODUCAO EQUIDEA EIRELI,IPEUNA,8,2012,Armazens Gerais Empresario
35600124460,COMERCIO DE VESTIDO DE FESTA EIRELI,SAO PAULO,8,2012,Armazens Gerais Empresario
35600124478,SILETRONIX COMPONENTES ELETRONICOS EIRELI,SAO PAULO,8,2012,Armazens Gerais Empresario
35600124486,RENATA FREITAS DA CONCEICAO IMPORTACAO E EXPORTACAO - EIRELI,SAO PAULO,8,2012,Armazens Gerais Empresario
35600124494,GARAGEM BLINDAGEM COMERCIO E SERVICOS AUTOMOTIVOS EIRELI,SAO PAULO,8,2012,Armazens Gerais Empresario
35600124508,CAMILA VIOLARO BATISTA DA SILVA PRODUCOES E COMERCIO ELETRONICO EIRELI,CAMPINAS,8,2012,Armazens Gerais Empresario
35600124516,R2 CONSULTORIA COMERCIAL E DE NEGOCIOS EIRELI,SAO PAULO,8,2012,Armazens Gerais Empresario
35600124524,GMUNDI ALIMENTACAO CORPORATIVA EIRELI,SAO PAULO,8,2012,Armazens Gerais Empresario
35600124532,VALE ENERGIA RESTAURANTE E EVENTOS EIRELI,SAO JOSE DOS CAMPOS,8,2012,Armazens Gerais Empresario
35600124541,BPX INFORMATICA EIRELI,SAO PAULO,8,2012,Armazens Gerais Empresario
35600124559,K L D FASHION MODAS EIRELI,SAO PAULO,8,2012,Armazens Gerais Empresario
35600124567,MEGA PORTAL VITA - COMERCIO DE COSMETICOS EIRELI,SAO PAULO,8,2012,Armazens Gerais Empresario
35600124575,BIA SEMI JOIAS COMERCIO DE BIJOUTERIAS EIRELI,SAO PAULO,8,2012,Armazens Gerais Empresario
35600124583,AW SPORTS EIRELI,SAO PAULO,8,2012,Armazens Gerais Empresario
35600124591,J C FELIX CONSTRUCOES EIRELI,SAO PAULO,8,2012,Armazens Gerais Empresario
35600124605,ECN - CONSTRUCOES E PARTICIPACOES EIRELI,SAO PAULO,8,2012,Armazens Gerais Empresario
35600124613,ESTRATEGIA PERFEITA GERENCIAMENTO E GESTAO DE RISCO EIRELI,SAO PAULO,8,2012,Armazens Gerais Empresario
35600124621,RICARDO GONCALVES LOTTI EIRELI,SAO PAULO,8,2012,Armazens Gerais Empresario
35600125610,ARGENTO INDUSTRIA E COMERCIO DE JOIAS E ACESSORIOS - EIRELI,SAO PAULO,8,2012,Armazens Gerais Empresario
35600125628,JBS AGENTE AUTONOMO DE INVESTIMENTOS EIRELI,SAO PAULO,8,2012,Armazens Gerais Empresario
35600125636,M AURELIUS REFORMAS EIRELI,POA,8,2012,Armazens Gerais Empresario
35600125644,M5 SERVICOS ADMINISTRATIVOS EIRELI,SAO PAULO,8,2012,Armazens Gerais Empresario
35600125652,"OFTSERVICE COMERCIO, IMPORTACAO E SERVICOS EIRELI",SAO PAULO,8,2012,Armazens Gerais Empresario
35600125661,LNS BAR & DRINK'S - EIRELI,SAO PAULO,8,2012,Armazens Gerais Empresario
35600134015,CAFE LA PLAZA DE MADRI - EIRELI,SAO CAETANO DO SUL,8,2012,Armazens Gerais Empresario
35600138428,IMPULSE FOMENTO MERCANTIL ADMINISTRACAO E SERVICOS EIRELI,SAO PAULO,8,2012,Armazens Gerais Empresario
35600138436,MHN COMERCIO DE COSMETICOS EIRELI,JARINU,8,2012,Armazens Gerais Empresario
35600138444,MAYERLING JABUR EIRELLI,SAO PAULO,8,2012,Armazens Gerais Empresario
35600138452,NOVA ABEGE SERVICOS DE MAO DE OBRA NA CONSTRUCAO CIVIL EIRELI,SAO BERNARDO DO CAMPO,8,2012,Armazens Gerais Empresario
35600138461,POWERPAC INDUSTRIA E COMERCIO DE EMBALAGENS FLEXIVEIS EIRELI,SAO PAULO,8,2012,Armazens Gerais Empresario
35600138479,JG RESTAURANTE DELIVERY EIRELI,SAO PAULO,8,2012,Armazens Gerais Empresario
35600138487,CLUBE NAUTICO BELAS ARTES EIRELI,VOTORANTIM,8,2012,Armazens Gerais Empresario
35600138495,PINHEIRO COMERCIO DE COSMETICOS EIRELI,JARINU,8,2012,Armazens Gerais Empresario
35600138509,FABIO ANTONINI MIDEA EIRELI,SAO PAULO,8,2012,Armazens Gerais Empresario
35600138517,VAGNER ROGERIO APARECIDO HESPANHOL DE OLIVEIRA EIRELI,SAO PAULO,8,2012,Armazens Gerais Empresario
35600138525,BELA VISTA STORE COMERCIO VAREJISTA DE ROUPAS EIRELI,SAO PAULO,8,2012,Armazens Gerais Empresario
35600138533,ROBSON REIS BISPO EIRELI,SAO PAULO,8,2012,Armazens Gerais Empresario
35600138541,CELESTE RIBEIRO CALCADOS EIRELI,PIRACAIA,8,2012,Armazens Gerais Empresario
35600138550,NOBRECAR LAVA-RAPIDO LTDA - EIRELI,SAO PAULO,8,2012,Armazens Gerais Empresario
35600138568,OLIVER CLEAN SERVICOS DE LIMPEZA EM GERAL EIRELI,SAO PAULO,8,2012,Armazens Gerais Empresario
35600138576,CLARA ELENA SOTO SHINMYO EIRELI,SAO ROQUE,8,2012,Armazens Gerais Empresario
35600138584,GENERAL COMERCIO DE MEDICAMENTOS E COSMETICOS EIRELI,SANTO ANDRE,8,2012,Armazens Gerais Empresario
35600138592,MOVEIS MORIAH - EIRELI,SAO PAULO,8,2012,Armazens Gerais Empresario
35600138606,LIRIUM MODAS EIRELI,SAO PAULO,8,2012,Armazens Gerais Empresario
35600138614,DAMARES DANIELA PEREIRA DA SILVA ALIMENTOS EIRELI,SAO PAULO,8,2012,Armazens Gerais Empresario
35600138622,PLATIN INFORMATICA EIRELI,SAO PAULO,8,2012,Armazens Gerais Empresario
35600138631,SILVIO FANTATO EIRELI,SAO PAULO,8,2012,Armazens Gerais Empresario
35600138649,BRASIL 52 - SERVICOS DE COBRANCAS - EIRELI,SAO PAULO,8,2012,Armazens Gerais Empresario
35600138657,PEDACOS PRODUTOS PARA ARTESANATO EIRELI,SAO PAULO,8,2012,Armazens Gerais Empresario
35600138665,ALDEIA DO MORUMBI EIRELI,SAO PAULO,8,2012,Armazens Gerais Empresario
35600138673,ROSA DOS VENTOS ADMINISTRACAO DE BENS EIRELI,COTIA,8,2012,Armazens Gerais Empresario
35600138681,WALTER RIZZO EIRELI,SAO PAULO,8,2012,Armazens Gerais Empresario
35600138690,KSK SERVICOS GERAIS - EIRELI,SANTO ANDRE,8,2012,Armazens Gerais Empresario
35600138703,AG SANTOS DISTRIBUIDORA DE ALIMENTOS EM GERAL EIRELI,GUARULHOS,8,2012,Armazens Gerais Empresario
35600138711,UNIBRINDES COMERCIAL IMPORTADORA E EXPORTADORA EIRELI,PRAIA GRANDE,8,2012,Armazens Gerais Empresario
35600138720,INFINITY SERVICOS DE PORTARIA EIRELI,SAO PAULO,8,2012,Armazens Gerais Empresario
35600138738,"LUXCOM COMERCIO, IMPORTACAO E EXPORTACAO EIRELI",VALINHOS,8,2012,Armazens Gerais Empresario
35600138746,SOLAR - INDUSTRIA E COMERCIO DE ARTEFATOS DE METAIS - EIRELI,SAO PAULO,8,2012,Armazens Gerais Empresario
35600138754,WEST POINT CONTINENTAL AGENCIA DE VIAGENS E TURISMO EIRELI,SAO PAULO,8,2012,Armazens Gerais Empresario
35600138762,ZILDA SILVA DOS SANTOS TRANSPORTES EIRELI,SAO PAULO,8,2012,Armazens Gerais Empresario
35600138771,LUZIA TOMAZELLI EIRELI,SAO PAULO,8,2012,Armazens Gerais Empresario
35600138789,FELDER ENGENHARIA CONSULTIVA EIRELI,SAO PAULO,8,2012,Armazens Gerais Empresario
35600138797,C.H. NUNES SODRE TREINAMENTOS - EIRELI,SAO PAULO,8,2012,Armazens Gerais Empresario
35600138801,LASER ARTE MICROFILMAGEM E FOTOCOPIAS EIRELI,SAO PAULO,8,2012,Armazens Gerais Empresario
35600138827,PECE COMERCIO DE EQUIPAMENTOS E SUPRIMENTOS DE INFORMATICA - EIRELI,SAO PAULO,8,2012,Armazens Gerais Empresario
35600138835,DANP COMERCIO DE PRODUTOS DE LIMPEZA EIRELI,SAO PAULO,8,2012,Armazens Gerais Empresario
35600138843,MASTROCCESARI MONTAGENS INDUSTRIAIS EIRELI,SAO PAULO,8,2012,Armazens Gerais Empresario
35600138851,SANTANA APOIO ADMINISTRATIVO EIRELI,SAO PAULO,8,2012,Armazens Gerais Empresario
35600138860,TORRES APOIO ADMINISTRATIVO EIRELI,SAO PAULO,8,2012,Armazens Gerais Empresario
35600138878,LEMOS E LIMA COMERCIO DE ALIMENTOS - EIRELI,SAO PAULO,8,2012,Armazens Gerais Empresario
35600138886,ALE 7 ASSESSORIA ADMINISTRATIVA EIRELI,BARUERI,8,2012,Armazens Gerais Empresario
35600138894,TECMOV - TECNOLOGIA EM MOVIMENTACAO DE MATERIAIS EIRELI,SAO BERNARDO DO CAMPO,8,2012,Armazens Gerais Empresario
35600138908,M.F.G. TEXTIL EIRELI,SAO PAULO,8,2012,Armazens Gerais Empresario
35600138754,WEST POINT CONTINENTAL AGENCIA DE VIAGENS E TURISMO EIRELI,SAO PAULO,8,2012,Armazens Gerais Empresario
35600138762,ZILDA SILVA DOS SANTOS TRANSPORTES EIRELI,SAO PAULO,8,2012,Armazens Gerais Empresario
35600138771,LUZIA TOMAZELLI EIRELI,SAO PAULO,8,2012,Armazens Gerais Empresario
35600138789,FELDER ENGENHARIA CONSULTIVA EIRELI,SAO PAULO,8,2012,Armazens Gerais Empresario
35600138797,C.H. NUNES SODRE TREINAMENTOS - EIRELI,SAO PAULO,8,2012,Armazens Gerais Empresario
35600138801,LASER ARTE MICROFILMAGEM E FOTOCOPIAS EIRELI,SAO PAULO,8,2012,Armazens Gerais Empresario
35600138827,PECE COMERCIO DE EQUIPAMENTOS E SUPRIMENTOS DE INFORMATICA - EIRELI,SAO PAULO,8,2012,Armazens Gerais Empresario
35600138835,DANP COMERCIO DE PRODUTOS DE LIMPEZA EIRELI,SAO PAULO,8,2012,Armazens Gerais Empresario
35600138843,MASTROCCESARI MONTAGENS INDUSTRIAIS EIRELI,SAO PAULO,8,2012,Armazens Gerais Empresario
35600138851,SANTANA APOIO ADMINISTRATIVO EIRELI,SAO PAULO,8,2012,Armazens Gerais Empresario
35600138860,TORRES APOIO ADMINISTRATIVO EIRELI,SAO PAULO,8,2012,Armazens Gerais Empresario
35600138878,LEMOS E LIMA COMERCIO DE ALIMENTOS - EIRELI,SAO PAULO,8,2012,Armazens Gerais Empresario
35600138886,ALE 7 ASSESSORIA ADMINISTRATIVA EIRELI,BARUERI,8,2012,Armazens Gerais Empresario
35600138894,TECMOV - TECNOLOGIA EM MOVIMENTACAO DE MATERIAIS EIRELI,SAO BERNARDO DO CAMPO,8,2012,Armazens Gerais Empresario
35600138908,M.F.G. TEXTIL EIRELI,SAO PAULO,8,2012,Armazens Gerais Empresario
35600138754,WEST POINT CONTINENTAL AGENCIA DE VIAGENS E TURISMO EIRELI,SAO PAULO,8,2012,Armazens Gerais Empresario
35600138762,ZILDA SILVA DOS SANTOS TRANSPORTES EIRELI,SAO PAULO,8,2012,Armazens Gerais Empresario
35600138771,LUZIA TOMAZELLI EIRELI,SAO PAULO,8,2012,Armazens Gerais Empresario
35600138789,FELDER ENGENHARIA CONSULTIVA EIRELI,SAO PAULO,8,2012,Armazens Gerais Empresario
35600138797,C.H. NUNES SODRE TREINAMENTOS - EIRELI,SAO PAULO,8,2012,Armazens Gerais Empresario
35600138801,LASER ARTE MICROFILMAGEM E FOTOCOPIAS EIRELI,SAO PAULO,8,2012,Armazens Gerais Empresario
35600138827,PECE COMERCIO DE EQUIPAMENTOS E SUPRIMENTOS DE INFORMATICA - EIRELI,SAO PAULO,8,2012,Armazens Gerais Empresario
35600138835,DANP COMERCIO DE PRODUTOS DE LIMPEZA EIRELI,SAO PAULO,8,2012,Armazens Gerais Empresario
35600138843,MASTROCCESARI MONTAGENS INDUSTRIAIS EIRELI,SAO PAULO,8,2012,Armazens Gerais Empresario
35600138851,SANTANA APOIO ADMINISTRATIVO EIRELI,SAO PAULO,8,2012,Armazens Gerais Empresario
35600138860,TORRES APOIO ADMINISTRATIVO EIRELI,SAO PAULO,8,2012,Armazens Gerais Empresario
35600138878,LEMOS E LIMA COMERCIO DE ALIMENTOS - EIRELI,SAO PAULO,8,2012,Armazens Gerais Empresario
35600138886,ALE 7 ASSESSORIA ADMINISTRATIVA EIRELI,BARUERI,8,2012,Armazens Gerais Empresario
35600138894,TECMOV - TECNOLOGIA EM MOVIMENTACAO DE MATERIAIS EIRELI,SAO BERNARDO DO CAMPO,8,2012,Armazens Gerais Empresario
35600138908,M.F.G. TEXTIL EIRELI,SAO PAULO,8,2012,Armazens Gerais Empresario
35600138924,ICA ASSESSORIA - EIRELI,SAO PAULO,8,2012,Armazens Gerais Empresario
35600138932,JP - EXPRESS TRANSPORTES - EIRELI,SAO PAULO,8,2012,Armazens Gerais Empresario
35600138959,R.R PLANEJADOS COMERCIO DE MOVEIS E DECORACOES - EIRELI,SAO PAULO,8,2012,Armazens Gerais Empresario
35600138967,JPF TERRAPLANAGEM - EIRELI,SAO PAULO,8,2012,Armazens Gerais Empresario
35600138975,ELOHIM SUPRIMENTOS DE INFORMATICA EIRELI,SAO PAULO,8,2012,Armazens Gerais Empresario
35600138983,CUMAMUE CINEMA EIRELI,SAO PAULO,8,2012,Armazens Gerais Empresario
35600138991,LAMANU REPRESENTACAO COMERCIAL EIRELI,SANTO ANDRE,8,2012,Armazens Gerais Empresario
35600139009,PRISCILIA DE OLIVEIRA PISSAIA TRANSPORTES EIRELI,SAO PAULO,8,2012,Armazens Gerais Empresario
35600139017,ANDERSON FERREIRA TRANSPORTES COLETIVO EIRELI,SAO PAULO,8,2012,Armazens Gerais Empresario
35600139025,FATIMA APARECIDA DE OLIVEIRA TRANSPORTE COLETIVO EIRELI,SAO PAULO,8,2012,Armazens Gerais Empresario
35600139033,CARLOS FRANCISCO CORREIA TRANSPORTES EIRELI,SAO PAULO,8,2012,Armazens Gerais Empresario
35600139041,GISLENE NIIMI DE OLIVEIRA EIRELI,SAO PAULO,8,2012,Armazens Gerais Empresario
35600139050,FERNANDO BATISTA DE FIGUEIREDO EIRELI,SAO PAULO,8,2012,Armazens Gerais Empresario
35600139068,JOAO AFONSO FLAMBO EIRELI,SAO PAULO,8,2012,Armazens Gerais Empresario
35600139076,KATIA BULFON VALDO EIRELI,SAO PAULO,8,2012,Armazens Gerais Empresario
35600139084,ADILSON BERTOLDO COSTA EIRELI,SAO PAULO,8,2012,Armazens Gerais Empresario
35600139092,CLAUDIA FERREIRA DI BONITO EIRELI,SAO PAULO,8,2012,Armazens Gerais Empresario
35600139106,RICARDO SIMOES TRANSPORTES EIRELI,SAO PAULO,8,2012,Armazens Gerais Empresario
35600139114,EVERSON DE MOURA AQUINO EIRELI,SAO PAULO,8,2012,Armazens Gerais Empresario
35600139122,ANTONIO SIMOES FILHO TRANSPORTES EIRELI,SAO PAULO,8,2012,Armazens Gerais Empresario
35600139131,KATIA CILENE ZUCCHINI PEREIRA EIRELI,SAO PAULO,8,2012,Armazens Gerais Empresario
35600139149,ELSON ADILSON VALDILEI DA SILVA EIRELI,SAO PAULO,8,2012,Armazens Gerais Empresario
35600139157,JOAO HECHT SOBRINHO EIRELI,SAO PAULO,8,2012,Armazens Gerais Empresario
35600139165,EDUARDO S.M TRANSPORTE - EIRELI,SAO PAULO,8,2012,Armazens Gerais Empresario
35600139173,SEPHERA TRUST AGENTES AUTONIMOS DE INVESTIMENTOS EIRELI,SAO PAULO,8,2012,Armazens Gerais Empresario
35600139181,"HORUS - EMPREITEIRA, PRESTADORA DE SERVICOS E COMERCIO DE MATERIAIS DE CONSTRUCAO EIRELI",SAO PAULO,8,2012,Armazens Gerais Empresario
35600139611,MAPERIN PARTICIPACOES EIRELI,MAIRINQUE,8,2012,Armazens Gerais Empresario
35600139629,ACM TRANSPORTE E ARMAZENAGEM EIRELI,AMERICANA,8,2012,Armazens Gerais Empresario
35600139637,PAULO ABDO EIRELI,SAO PAULO,8,2012,Armazens Gerais Empresario
35600139645,NOVO PRESTIGE EMPREENDIMENTOS HOTELEIRO EIRELI,SAO PAULO,8,2012,Armazens Gerais Empresario
35600139653,DJCG TRANSPORTES E EMPREENDIMENTOS EIRELI,INDAIATUBA,8,2012,Armazens Gerais Empresario
35600139661,AGAPE ADMINISTRADORA E CONSTRUTORA EIRELI,MOGI DAS CRUZES,8,2012,Armazens Gerais Empresario
35600139670,VOICE COMERCIO DE EQUIPAMENTOS DE TELEMATICA EIRELI,SAO PAULO,8,2012,Armazens Gerais Empresario
35600139688,"WS ETIQUETAS, ROTULOS & REPRESENTACAO COMERCIAL EIRELI",CRUZEIRO,8,2012,Armazens Gerais Empresario
35600139696,SP MEGA TEC SOLUCOES EIRELI,SAO PAULO,8,2012,Armazens Gerais Empresario
35600139700,LIMA & SILVA INSTALACAO DE AR CONDICIONADO EIRELI,SAO PAULO,8,2012,Armazens Gerais Empresario
35600139718,EMPORIO SALVADOR CARDOSO EIRELI,SAO PAULO,8,2012,Armazens Gerais Empresario
35600139726,"JB MEDRETAIL COMERCIO, IMPORTACAO E EXPORTACAO DE MATERIAIS MEDICOS - EIRELI",SAO PAULO,8,2012,Armazens Gerais Empresario
35600139734,P.R.A SOLUCOES EMPRESARIAIS EIRELI,SAO PAULO,8,2012,Armazens Gerais Empresario
35600139742,ASA MANUTENCAO AERONAUTICA - EIRELI,SAO PAULO,8,2012,Armazens Gerais Empresario
35600139751,MC 2 COMUNICACAO EIRELI,SAO PAULO,8,2012,Armazens Gerais Empresario
35600139769,S M B DE AGUIAR MOVEIS - EIRELI,SAO JOSE DO RIO PRETO,8,2012,Armazens Gerais Empresario
35600139777,ESTOFADOS RIVAIL EMPRESARIAL - EIRELI,SAO JOSE DO RIO PRETO,8,2012,Armazens Gerais Empresario
35600139785,313 BAZAR E COMERCIO DE MIUDEZAS EIRELI,SAO PAULO,8,2012,Armazens Gerais Empresario
35600139793,KITO VEICULOS EIRELI,RIBEIRAO PRETO,8,2012,Armazens Gerais Empresario
35600139807,PADOCA DI NAPOLI - EIRELI,SAO PAULO,8,2012,Armazens Gerais Empresario
35600139815,CHRIS BALDI RESTAURANTE EIRELI,JUNDIAI,8,2012,Armazens Gerais Empresario
35600139823,G.M MANUTENCAO DE MAQUINAS E PECAS EIRELI,TAUBATE,8,2012,Armazens Gerais Empresario
35600139831,EDUQUE ESCOLA DE EDUCACAO INFANTIL E ENSINO FUNDAMENTAL EIRELI,SAO PAULO,8,2012,Armazens Gerais Empresario
35600139840,G.F.H.G. PIZZA BAR EIRELI,ITAPECERICA DA SERRA,8,2012,Armazens Gerais Empresario
35600139858,PARISLUX EIRELI,MOGI-GUACU,8,2012,Armazens Gerais Empresario
35600141933,VISION COR - DIAGNOSTICOS CARDIOLOGICOS EIRELI,SAO PAULO,8,2012,Armazens Gerais Empresario
35600145343,JRC PRODUCOES FOTOGRAFICAS EIRELI,SAO PAULO,8,2012,Armazens Gerais Empresario
35600145351,RODRIGO MASON TELECOMUNICACOES EIRELI,SAO PAULO,8,2012,Armazens Gerais Empresario
35600145360,"MWH SISTEMAS DE ENERGIA, CONSTRUCAO E VENDA DE IMOVEIS EIRELI",ITAQUAQUECETUBA,8,2012,Armazens Gerais Empresario
35600145378,PLUART-SB COMERCIO DE ROUPAS E ACESSORIOS EIRELI,PIQUETE,8,2012,Armazens Gerais Empresario
35600145386,PADARIA JOAO MOURA EIRELI,SAO PAULO,8,2012,Armazens Gerais Empresario
35600145394,ANTONIO PEREIRA FEITOSA EIRELI,GUARULHOS,8,2012,Armazens Gerais Empresario
35600145408,SILVA & SANT'ANNA CONSULTORIA EMPRESARIAL EIRELI,SUZANO,8,2012,Armazens Gerais Empresario
35600145424,POINT DA GAROTADA MODA INFANTIL EIRELI,GUARULHOS,8,2012,Armazens Gerais Empresario
35600145432,FERDI INVEST ADMINITRACOES E PARTICIPACOES DE BENS EIRELI,MAIRIPORA,8,2012,Armazens Gerais Empresario
35600145441,EMPORIO SOGA EIRELI,GUARULHOS,8,2012,Armazens Gerais Empresario
35600145459,GUINATEX TECIDOS E RETALHOS EIRELI,PRAIA GRANDE,8,2012,Armazens Gerais Empresario
35600145467,L. A. COMERCIO DE ALIMENTOS - EIRELI.,POA,8,2012,Armazens Gerais Empresario
35600145475,ANA CAROLINA FRANCA MARQUES DE LIMA-EIRELI,TAUBATE,8,2012,Armazens Gerais Empresario
35600145483,MBAN EMERGENCIAS MEDICAS EIRELI,SAO PAULO,8,2012,Armazens Gerais Empresario
35600145491,MARROF COMERCIO E ASSISTENCIA TECNICA EIRELI,GUARULHOS,8,2012,Armazens Gerais Empresario
35600145505,ACF INFORMATICA REPRESENTACOES E SUPRIMENTOS EIRELI,SAO PAULO,8,2012,Armazens Gerais Empresario
35600145513,DROGARIA E PERFUMARIA BOLA EIRELI,SAO PAULO,8,2012,Armazens Gerais Empresario
35600145521,A. S. XAVIER DA SILVA FRETAMENTO EIRELI,GUARULHOS,8,2012,Armazens Gerais Empresario
35600145530,CDF CENTRO DE DESENVOLVIMENTO DE FRANQUIAS EIRELI,GUARULHOS,8,2012,Armazens Gerais Empresario
35600145548,DIOXSAN ESPECIALIDADES QUIMICAS EIRELI,GUARAREMA,8,2012,Armazens Gerais Empresario
35600145556,PIT STOP 91 ESTACIONAMENTO EIRELI,SAO PAULO,8,2012,Armazens Gerais Empresario
35600145564,COMERCIO DE BEBIDAS PINHA DO BREJO EIRELI,SAO PAULO,8,2012,Armazens Gerais Empresario
35600145572,FFS CARVALHO TRANSPORTES DE CARGAS EM GERAL EIRELI,GUARULHOS,8,2012,Armazens Gerais Empresario
35600145581,TRECEL CARGAS EIRELI,SAO PAULO,8,2012,Armazens Gerais Empresario
35600145599,BELLA COMERCIO E REPRESENTACAO DE METAIS EIRELI,ARUJA,8,2012,Armazens Gerais Empresario
35600145602,AGAPE ATUAL ADMINISTRACAO DE BENS IMOVEIS EIRELI,SAO PAULO,8,2012,Armazens Gerais Empresario
35127958061,DOUGLAS DA SILVA ROTISSERIE,INDAIATUBA,8,2012,Empresario
35127958079,BRUNA LAILA ROCHA,INDAIATUBA,8,2012,Empresario
35127958087,ROGÉRIO FRANCISCHINI,INDAIATUBA,8,2012,Empresario
35127958095,ADAMARIS BECHIS OLIVEIRA VENANCIO,SUMARÉ,8,2012,Empresario
35127958109,LUIS FELIPE TARCHIANI E COSTA,ELIAS FAUSTO,8,2012,Empresario
35127958117,LOHAN MICHELE ELIAS SILVA,INDAIATUBA,8,2012,Empresario
35127958125,EDIVALDO DOS SANTOS SILVA CONSTRUÇÕES,SUMARÉ,8,2012,Empresario
35127958133,OZIAS GRANADO,ELIAS FAUSTO,8,2012,Empresario
35127969801,C. GABRIELA PINHEIRO CONFECÇÕES,BOM JESUS DOS PERDÕES,8,2012,Empresario
35127969810,P. P. DE AGUIAR TRANSPORTADORA,AMPARO,8,2012,Empresario
35127969828,ESMERALDA NICOLINI,CAMPINAS,8,2012,Empresario
35127969836,DAIANE DUARTE DE MELO ALBUQUERQUE,PAULÍNIA,8,2012,Empresario
35127969844,PETERSON OLIVEIRA ASSIS,CAMPINAS,8,2012,Empresario
35127969852,ANDERSON JOSÉ BORGES TELECOMUNICAÇÕES,HORTOLÂNDIA,8,2012,Empresario
35127969861,JANDIRA LOPES DA SILVA,CAMPINAS,8,2012,Empresario
35127969879,RAFAEL PINA AGROPECUARIA,JAGUARIÚNA,8,2012,Empresario
35127969887,PAULO HENRIQUE TURQUETTI ANDRE INSTALAÇÃO,VINHEDO,8,2012,Empresario
