NIRE,Empresa,Município,Month,Year,Type
35813728419,LUANA DA MOTA PINTO 39716304803,SÃO PAULO,2,2015,Empresario
35813728427,EDSON DE SOUZA ELIAS 11358016810,ITAPEVI,2,2015,Empresario
35813728435,RICARDO JULIAO DA SILVA 15740081882,PIRAJU,2,2015,Empresario
35813728443,JOAO APARECIDO DE AVILA 30491357869,SANTA ISABEL,2,2015,Empresario
35813728451,TATIANE CRISTINA POVAGA 31535190809,RIBEIRÃO BONITO,2,2015,Empresario
35813728460,ELIANE PIRES DE ALMEIDA SOARES 17793167805,NOVO HORIZONTE,2,2015,Empresario
35813728478,FABIO OSCHVAT DE OLIVEIRA 41301356867,SÃO PAULO,2,2015,Empresario
35813728486,ANTONIO CARLOS BACCARO 00842424857,MAUÁ,2,2015,Empresario
35813728494,FRANCIELE DAYANE DE OLIVEIRA 38500440848,PRESIDENTE PRUDENTE,2,2015,Empresario
35813728508,JOYCE MAYARA BORGES MEIRA 42172954802,SÃO PAULO,2,2015,Empresario
35813728516,CAMILA BARBOSA MANCINI 40524519889,PRESIDENTE PRUDENTE,2,2015,Empresario
35813728524,LEONARDO BARROS PEDROSO 42419753801,PERUÍBE,2,2015,Empresario
35813728532,ALEXANDRO DA SILVA SANTOS 28698949886,ITANHAÉM,2,2015,Empresario
35813728541,GLEIDY MARIA EDUARDO PRADO ALCANTARA 15249601871,SÃO PAULO,2,2015,Empresario
35813728559,CELIA APARECIDA ROSA MOREIRA 17208059896,ITATIBA,2,2015,Empresario
35813728567,GILVAN SANTOS SOUZA 11543581862,PIRACICABA,2,2015,Empresario
35813728575,HUMBERTO CARLOS TEIXEIRA 06206650847,RANCHARIA,2,2015,Empresario
35813728583,ELISABETH APARECIDA DE OLIVEIRA 25131801869,TAUBATÉ,2,2015,Empresario
35813728591,RIVALDO ROSA DOS SANTOS 26587525806,BARRA DO CHAPÉU,2,2015,Empresario
35813728605,FLAVIO JACINTO SANTOS 29915943814,COTIA,2,2015,Empresario
35813728613,JOSE ROBERTO GRANADO DIAS 11231381841,SÃO PAULO,2,2015,Empresario
35813728621,PAULO ROBERTO CARDOSO 04070010858,LIMEIRA,2,2015,Empresario
35813728630,ELAINE YUKI IMAI 16465456800,TUPÃ,2,2015,Empresario
35813728648,VALDERLI ALMEIDA SIMAO 29198192833,SUMARÉ,2,2015,Empresario
35813728656,ROGERIO VIRGINELLI MARCHI 32781058858,CAMPINAS,2,2015,Empresario
35813728664,SIRLENE ROSA ALVES 58011935534,GUARULHOS,2,2015,Empresario
35813728672,RODRIGO DA SILVA CEZAR 30808538810,ANDRADINA,2,2015,Empresario
35813728681,VALDEMIR ANTONIO DE PROENCA 21744156824,ITAPETININGA,2,2015,Empresario
35813728699,FRANCYS OLIVEIRA MALTA 39252278818,FRANCA,2,2015,Empresario
35813728702,ROSANA MARIANA DE SOUZA 31445690896,SILVEIRAS,2,2015,Empresario
35813728711,MICHELLE ALVES LUPETI 43967820807,MAUÁ,2,2015,Empresario
35813728729,FABIANA DOS SANTOS MARCOLINO 34763250833,SÃO PAULO,2,2015,Empresario
35813728737,CAIRO FELIPE DIAS ANDRADE SANTOS 44853294880,SÃO PAULO,2,2015,Empresario
35813728745,JEFFERSON ABEL DOS SANTOS 33302144814,SÃO PAULO,2,2015,Empresario
35813728753,ANTONIO JOSE DOS SANTOS 28218157867,SÃO PAULO,2,2015,Empresario
35813728761,EDE CARLOS SANTOS DA SILVA 30541389840,SÃO PAULO,2,2015,Empresario
35813728770,LEANDRA SILMARA LEPERO DA SILVA 10131821890,MONTE ALTO,2,2015,Empresario
35813728788,JEFFERSON CAVENDISH MACIEL DA SILVA 21242398805,ILHABELA,2,2015,Empresario
35813728796,PEDRO AUGUSTO ALENCAR DE OLIVEIRA 43034584814,SÃO PAULO,2,2015,Empresario
35813728800,FRANCISCO DE ASSIS DE SOUZA 30921776810,MOGI MIRIM,2,2015,Empresario
35813728818,LAERCIO APARECIDO SETIN 08412968808,SÃO JOSÉ DO RIO PRETO,2,2015,Empresario
35813728826,NILSON RAMOS RODRIGUES 45415820159,SÃO PAULO,2,2015,Empresario
35813728834,MARTA LUZIA DE CARVALHO 07113837824,LORENA,2,2015,Empresario
35813728842,JOAO ESTEVES DA SILVA 85111686800,IRACEMÁPOLIS,2,2015,Empresario
35813728851,JOSEMAR BARBOSA DO CARMO 87010992487,GUARUJÁ,2,2015,Empresario
35813728869,UMBERTO DE JESUS DO CARMO 56991266515,SUZANO,2,2015,Empresario
35813728877,EDINA CARDOSO COELHO CELESTINO 17059670866,BAURU,2,2015,Empresario
35813728885,MONICA DOMINGUES LIMA,SÃO PAULO,2,2015,Empresario
35813728893,ANTONIO DONIZETI LOPES 15718288852,CESÁRIO LANGE,2,2015,Empresario
35813728907,MARCIO GOUVEA BARBOSA 33047699860,VOTORANTIM,2,2015,Empresario
35813728915,IVAN TAKAHASHI CARVALHO 40585150826,PILAR DO SUL,2,2015,Empresario
35813728923,DIANA FREITAS DE CARVALHO 22308110880,SÃO JOSÉ DOS CAMPOS,2,2015,Empresario
35813728931,ENILSA ROSA DE SOUSA LOPES 25229790865,SÃO PAULO,2,2015,Empresario
35813728940,ORACIO MARQUES 86644246834,DIVINOLÂNDIA,2,2015,Empresario
35813728958,PEDRO DONIZETE RUFINO 33380194832,SÃO JOSÉ DOS CAMPOS,2,2015,Empresario
35813728966,EDEMIR BENEDITO BELLOTTI 05400563830,PIRACICABA,2,2015,Empresario
35813728974,LUIZ NALON FILHO 79823653887,MARÍLIA,2,2015,Empresario
35813728982,FABIA PRADO FERREIRA 41509014810,TABOÃO DA SERRA,2,2015,Empresario
35813728991,MARCO RUI CARDOZO 21520304862,URUPÊS,2,2015,Empresario
35813729008,IRIS CARDOSO DE OLIVEIRA 28954543880,CASA BRANCA,2,2015,Empresario
35813729016,PRISCILA FERNANDA GOUVEIA GOMES 39227938869,MARTINÓPOLIS,2,2015,Empresario
35813729024,WILLIAM OLIVEIRA PRADO 22484236832,SÃO PAULO,2,2015,Empresario
35813729032,RAONNY FRANCISCO ALVES DA SILVA 39237075847,GUARULHOS,2,2015,Empresario
35813729041,CRISTIAN RAFAEL RODRIGUES 36060759874,VOTORANTIM,2,2015,Empresario
35813729059,JOSE DONIZETE DO NASCIMENTO 02919254804,CARAPICUÍBA,2,2015,Empresario
35813729067,MARCOS ALEXANDRE DOS SANTOS SILVA 45279717860,SUMARÉ,2,2015,Empresario
35813729075,NATAN SACCENTI LOPES 36507853828,JUNDIAÍ,2,2015,Empresario
35813729083,MARIO MARCOS PERONTI SASSO LABORATORIO,SUZANO,2,2015,Empresario
35813729091,CINTIA DENISE BERTONCELLO ARRUDA 27800029808,PIRACICABA,2,2015,Empresario
35813729105,SANDRAMAR FERREIRA DELATORRE 08158866832,BARRETOS,2,2015,Empresario
35813729113,MARCIO PAULO DA SILVA 31831798816,JANDIRA,2,2015,Empresario
35813729121,MARCIO AUGUSTO BRAGA 25573196863,PIRACICABA,2,2015,Empresario
35813729130,FATIMA TENANI FEITOSA 06300262898,MIRASSOL,2,2015,Empresario
35813729148,MARIA LUCIA SILVA DA ANUNCIACAO 22584704803,SÃO PAULO,2,2015,Empresario
35813729156,BARBARA CLARA GONCALVES,CRUZEIRO,2,2015,Empresario
35813729164,RAFAELA SANTOS DE GODOY 39492557886,JAÚ,2,2015,Empresario
35813729172,REBBECA SALAS DE LIMA 42704319898,SÃO ROQUE,2,2015,Empresario
35813729181,LINDINEI GOMES DA SILVA 34338655828,PRAIA GRANDE,2,2015,Empresario
35813729199,RODRIGO RIZZI 21426315848,AVAÍ,2,2015,Empresario
35813729202,PAULO LOBATO DE SOUZA 18168239881,SÃO PAULO,2,2015,Empresario
35813729211,NILVA APARECIDA DOMINGUES 06549451876,SÃO PAULO,2,2015,Empresario
35813729229,ELAINE APARECIDA KUHNE 04497216802,CAMPINAS,2,2015,Empresario
35813729237,DAIANY PRISCILA DE OLIVEIRA 37072128824,BERNARDINO DE CAMPOS,2,2015,Empresario
35813729245,JULIANA GOMIDE DE SOUZA 22386604888,SOROCABA,2,2015,Empresario
35813729253,CLAUDINEIA CAMILO CAVANHA 15634530881,OSASCO,2,2015,Empresario
35813729261,VALDEIR DANTAS DE ARAUJO 90266110649,VOTUPORANGA,2,2015,Empresario
35813729270,JOSE REYNALDO DEVITO FILHO,MOGI MIRIM,2,2015,Empresario
35813729288,MARIA ELISABETH ALVES DOS SANTOS PADILHA 00590132814,BOTUCATU,2,2015,Empresario
35813729296,PAULO FIRMINO FURTADO 12348458810,SANTA BÁRBARA D'OESTE,2,2015,Empresario
35813729300,PEDRO PEREIRA 25928800894,GUAPIARA,2,2015,Empresario
35813729318,OSVALDIR ANTONIO CRECHI 11341991806,SÃO PAULO,2,2015,Empresario
35813729326,PAULO HUMBERTO FARANHA BATISTA 36127962838,SÃO JOSÉ DO RIO PARDO,2,2015,Empresario
35813729334,FERNANDO MORAES SANT ANA RESTAURANTE,ELIAS FAUSTO,2,2015,Empresario
35813729342,RICHARD GONCALVES NOCCIOLI 38066198833,RIBEIRÃO PRETO,2,2015,Empresario
35813729351,JULIA MARTE DA SILVA 77301650310,SÃO PAULO,2,2015,Empresario
35813729369,JOAO MORENO 07920156815,PIRACICABA,2,2015,Empresario
35813729377,ALEXANDRA PEREIRA 14994272808,JARDINÓPOLIS,2,2015,Empresario
35813729385,FATIMA APARECIDA DA SILVA 09685026874,AMPARO,2,2015,Empresario
35813729393,ROBERTA BAPTISTA PESSOA 35169997809,ANDRADINA,2,2015,Empresario
35813729407,CLEUSA MOREIRA DIAS GONCALVES 26520871850,PORTO FELIZ,2,2015,Empresario
35813729415,MARCO ABRAAO CAVALCANTI 34546809808,AVARÉ,2,2015,Empresario
35813729423,ELTAIR ANTONIO ROSA 93615620100,SANTO ANDRÉ,2,2015,Empresario
35813729431,NADIM ALLE ASSEM 75955695834,PRAIA GRANDE,2,2015,Empresario
35813729440,CARLOS ALEXANDRE IOPE 27776928828,JAGUARIÚNA,2,2015,Empresario
35813729458,MARIA ETELVINA DE VASCONCELOS SHIBATA 85202088868,SÃO PAULO,2,2015,Empresario
35813729466,PRISCILA NUNES TEIXEIRA 17838524881,SANTO ANDRÉ,2,2015,Empresario
35813729474,GABRIELE COUTINHO DELPOIO 29024832870,MAUÁ,2,2015,Empresario
35813729482,LINDA DA CRUZ DA SILVA 09255703897,SERTÃOZINHO,2,2015,Empresario
35813729491,CLAUDEMIR DE JESUS CAMARINI 30698843851,JAGUARIÚNA,2,2015,Empresario
35813729504,DENILSON DO AMARAL 28693435825,SOROCABA,2,2015,Empresario
35813729512,FILADELFO FERNANDES DA CUNHA NETO 01527626806,BAURU,2,2015,Empresario
35813729521,GISELLE THOMAZ DE AQUINO SANTOS 26385844870,MOTUCA,2,2015,Empresario
35813729539,EDIVALDO FERREIRA DO NASCIMENTO 34322094368,SÃO PAULO,2,2015,Empresario
35813729547,SINVALDA MARIA DIAS DE SOUZA 18724138894,ARTUR NOGUEIRA,2,2015,Empresario
35813729555,MATHEUS ANTONIO LUCAS DOMINGOS 33959538820,MARÍLIA,2,2015,Empresario
35813729563,FABIO CARLOS 11494683865,BERTIOGA,2,2015,Empresario
35813729571,RODRIGO PINHEIRO 40949418862,MARTINÓPOLIS,2,2015,Empresario
35813729580,ROGERIO TENORIO LOPES DA SILVA 18741864808,SANTO ANDRÉ,2,2015,Empresario
35813729598,BRUNO MACEDO GOMES 33565388889,RIO CLARO,2,2015,Empresario
35813729601,SELMA FERREIRA DA SILVA 76456897491,SÃO PAULO,2,2015,Empresario
35813729610,MARIA MADALENA MESCIAS DA SILVA 15209671879,LINDÓIA,2,2015,Empresario
35813729628,EDISON AKIRA KUSAGARI 83191739904,SÃO PAULO,2,2015,Empresario
35813729636,GUILHERME HEIDI GOMI 45074016827,SOROCABA,2,2015,Empresario
35813729644,ALINE MEIRA TAVARES 35408258866,SOROCABA,2,2015,Empresario
35813729652,MAIARA APARECIDA GOMES SABOIA DE MELO 39940972822,AMPARO,2,2015,Empresario
35813729661,PAULO ROGERIO DELPHINO 36075508830,OSASCO,2,2015,Empresario
35813729679,CASSIA REGINA MARTINS SILVERIO 14442206830,SÃO CARLOS,2,2015,Empresario
35813729687,MARLENE MARIA DE MELO 28318851838,QUELUZ,2,2015,Empresario
35813729695,RICARDO SCARAMEL 08232264845,SÃO PAULO,2,2015,Empresario
35813729709,PAMELA FELIX DOS SANTOS 42599365813,AVARÉ,2,2015,Empresario
35813729717,CRISTIANE DE OLIVEIRA LIMA 04554932516,SÃO PAULO,2,2015,Empresario
35813729725,DANIELA CRISTINA DE OLIVEIRA DIAS 30497881861,JAÚ,2,2015,Empresario
35813729733,ADEMILTON CARDOSO RIBEIRO 58121943515,ARARAS,2,2015,Empresario
35813729741,LOURIVAL SILVA DE SOUSA 00108151808,ITARIRI,2,2015,Empresario
35813729750,JORGE DE JESUS BATISTA 37361555810,APIAÍ,2,2015,Empresario
35813729768,LUCIANA DA SILVA LIMA 28079422885,SÃO PAULO,2,2015,Empresario
35813729776,JOSILAINE FERREIRA DUMAS BERNARDIS 33402908816,JOSÉ BONIFÁCIO,2,2015,Empresario
35813729784,GLAUCO ALAN MORAES DE SOUSA 32337765865,PRESIDENTE PRUDENTE,2,2015,Empresario
35813729792,CARLOS ALBERTO DINIZ 08751851857,HERCULÂNDIA,2,2015,Empresario
35813729806,FABIO NORIKAZU KASHIWAGI 25016066809,SÃO PAULO,2,2015,Empresario
35813729814,VALERIA REGINA DE CAMPOS MATES 34032836825,PORTO FELIZ,2,2015,Empresario
35813729822,LUCIANA NOVAIS MEIRA 05147331522,ITATIBA,2,2015,Empresario
35813729831,CAROLINA LOPES MIRANDA 39338270866,PIRAPORA DO BOM JESUS,2,2015,Empresario
35813729849,MARCO ANTONIO KUBICA 12417261839,SANTO ANDRÉ,2,2015,Empresario
35813729857,ROBERTO KENNEDY OLIVEIRA LIRA 34438080851,SÃO PAULO,2,2015,Empresario
35813729865,MAURO VIANA DE SA 14402345820,SÃO PAULO,2,2015,Empresario
35813729873,JOSE MANOEL MARINHO 35709308404,SERRANA,2,2015,Empresario
35813729881,VANDERLI APARECIDA DE OLIVEIRA NASCIMENTO 05540876857,RIBEIRÃO PIRES,2,2015,Empresario
35813729890,MARCIO APARECIDO FERREIRA CORDEIRO 36365141807,RIBEIRÃO BRANCO,2,2015,Empresario
35813729903,ROSILENA APARECIDA FERREIRA DE OLIVEIRA 30813079888,CERQUEIRA CÉSAR,2,2015,Empresario
35813729911,MARCELINO ROCHA 38264713858,IBIRÁ,2,2015,Empresario
35813729920,ALEXSANDRA LIZIERO DIAS 45610552826,JARDINÓPOLIS,2,2015,Empresario
35813729938,FABIO LUIZ GONCALVES 36152045819,IGUAPE,2,2015,Empresario
35813729946,ROGERIO FERNANDES DO NASCIMENTO 17609018813,SÃO PAULO,2,2015,Empresario
35813729954,ELAINE CRISTINA FRANCISCO DA SILVA 35878563894,JUNDIAÍ,2,2015,Empresario
35813729962,MARIA ANTONIA DE MOURA CAMPOS LIBERALESSO 16434081863,LARANJAL PAULISTA,2,2015,Empresario
35813729971,SIDMAR APARECIDO VIEIRA 11019108878,CORDEIRÓPOLIS,2,2015,Empresario
35813729989,ALEXANDRE POPPE 30956794831,ANHUMAS,2,2015,Empresario
35813729997,ALINE MYSOCK BARREIROS 37980470818,SÃO VICENTE,2,2015,Empresario
35813730006,JOICE THAIS ALMEIDA DE ARAUJO 33176982844,CARAGUATATUBA,2,2015,Empresario
35813730014,DIEGO CRISTIANO CASAGRANDE 34110998875,BOTUCATU,2,2015,Empresario
35813730022,APARECIDA MARTINS TEODORO TOLEDO,VOTUPORANGA,2,2015,Empresario
35813730031,MARIA JOSE XIMENES 13798304866,JOANÓPOLIS,2,2015,Empresario
35813730049,ALINE ROBERTA PELEGRINO BOARATTI 21681307871,PIRACICABA,2,2015,Empresario
35813730057,DANILO DE MATOS,GUARULHOS,2,2015,Empresario
35813730065,LEONARDO JOAQUIM PRADO DE PAULA 45789680810,SUZANO,2,2015,Empresario
35813730073,JULIENE PAULA DE OLIVEIRA 07680967660,JUNDIAÍ,2,2015,Empresario
35813730081,MARIA APARECIDA DE LIMA REIS 04951048841,CAMPINAS,2,2015,Empresario
35813730090,TANIA ASEVEDO DA SILVA 10117009806,LINS,2,2015,Empresario
35813730103,JOSE ROMILDO DA SILVA 02455357481,GUARULHOS,2,2015,Empresario
35813730111,EDICLEIA OLIVEIRA DE ALMEIDA 11601149786,SUZANO,2,2015,Empresario
35813730120,MARCIO ROBERTO FAGANELLO 33967775810,CHARQUEADA,2,2015,Empresario
35813730138,NOEL NORBERTO RUSSANO 05925262832,ATIBAIA,2,2015,Empresario
35813730146,BRUNO VINICIUS BATISTA DE LIMA 43767609860,SÃO PAULO,2,2015,Empresario
35813730154,MAGALI MENDONCA SILVA VIEIRA 05332836805,EMBU DAS ARTES,2,2015,Empresario
35813730162,ZACARIAS CARDOSO DOS SANTOS 34924797820,JAGUARIÚNA,2,2015,Empresario
35813730171,GESIEL RIBEIRO ROCHA 08526986660,VALINHOS,2,2015,Empresario
35813730189,IDELFONSO LUIZ DE SOUZA 03184574660,SANTA ROSA DE VITERBO,2,2015,Empresario
35813730197,ELENICE FERREIRA SOLANGE 25131219884,SÃO PAULO,2,2015,Empresario
35813730201,MITAL FRANK 22948575850,SANTANA DE PARNAÍBA,2,2015,Empresario
35813730219,MARCOS BORGES MOREIRA 37835193817,SÃO PAULO,2,2015,Empresario
35813730227,JOSE CIRINEU ALVES CARNEIRO 06234846840,JALES,2,2015,Empresario
35813730235,LUIZ HENRIQUE APARECIDO DA SILVA DE SOUZA 28740820823,SERRANA,2,2015,Empresario
35813730243,PAULO EDUARDO DUARTE VALEO 28859336821,SÃO PAULO,2,2015,Empresario
35813730251,RUSLAN BURYGIN,SÃO PAULO,2,2015,Empresario
35813730260,JULIANO GONCALVES RUIZ 22211347886,BAURU,2,2015,Empresario
35813730278,MARCELO MESSIAS MACIEL 32710746824,COLINA,2,2015,Empresario
35813730286,RODRIGO DE JESUS SIMONI REZENDE 29320098859,RIBEIRÃO PRETO,2,2015,Empresario
35813730294,LUCIANA CARNEIRO 27517605895,ARARAQUARA,2,2015,Empresario
35813730308,EDSON ROBERTO DO NASCIMENTO 74513265949,VINHEDO,2,2015,Empresario
35813730316,PEDRO HENRIQUE FERRER LINO DA SILVA,AVARÉ,2,2015,Empresario
35813730324,SARA ALVES CARNEIRO 22050088892,LIMEIRA,2,2015,Empresario
35813730332,EDUARDO MARTINS GABRIEL 34847193890,TATUÍ,2,2015,Empresario
35813730341,PAULO JOSE DE SOUZA 10597715866,SOROCABA,2,2015,Empresario
35813730359,ALLINE ALVES SANTANA 38739369846,SÃO PAULO,2,2015,Empresario
35813730367,MYNNEYA DE ALENCAR OLIVEIRA 20593819837,COTIA,2,2015,Empresario
35813730375,ITAMAR CUNHA DE OLIVEIRA 28077505830,ITANHAÉM,2,2015,Empresario
35813730383,MARCIO JOSE DO AMARAL 34697652860,ITABERÁ,2,2015,Empresario
35813730391,SILVIO DALL OGLIO NETO 38355823800,SOROCABA,2,2015,Empresario
35813730405,HELIO HENRIQUE DOS SANTOS LIMA 43150769884,ITAQUAQUECETUBA,2,2015,Empresario
35813730413,FELIPE BRAGA SANTANA 35138278819,SÃO PAULO,2,2015,Empresario
35813730421,JESSICA APARECIDA BORSARINI VITAL,OSASCO,2,2015,Empresario
35813730430,FELIPE SOARES DE MENDONCA HENRIQUES 30167490842,RIBEIRÃO PRETO,2,2015,Empresario
35813730448,THIAGO FERREIRA GREIJO 39314857816,CÂNDIDO MOTA,2,2015,Empresario
35813730456,JAIR APARECIDO GRACIANO 06537202892,JOANÓPOLIS,2,2015,Empresario
35813730464,ROSEMERI APARECIDA DE CAMARGO ADELINO 09201647816,SÃO PAULO,2,2015,Empresario
35813730472,JOEL MOTA DA SILVA 06758846830,LIMEIRA,2,2015,Empresario
35813730481,GERALDO BARRETO DE OLIVEIRA 90016475453,MAIRIPORÃ,2,2015,Empresario
35813730499,BENEDITO MUNIZ DE MATOS 55257712849,PIRACICABA,2,2015,Empresario
35813730502,LAZARA DE OLIVEIRA CAMARA 77422589949,OSASCO,2,2015,Empresario
35813730511,FRANCINE BICALETO BUENO 36995225805,MARÍLIA,2,2015,Empresario
35813730529,ELIZABETE APARECIDA ALVES MEDINA SANCHES 28236620816,SANTO ANDRÉ,2,2015,Empresario
35813730537,MARIA SOLANGE DE CARVALHO LEAL 32852237822,PEDREIRA,2,2015,Empresario
35813730545,ANA FLAVIA ANGELO 34007496803,COLINA,2,2015,Empresario
35813730553,MARCOS AURELIO DA SILVA 16953672862,ITARIRI,2,2015,Empresario
35813730561,JOAO VALDIR RODRIGUES PEREIRA 01605758850,CASTILHO,2,2015,Empresario
35813730570,KAIQUE CAMAROTA DA SILVA 43783055857,SÃO PAULO,2,2015,Empresario
35813730588,MARIA APARECIDA BUENO 94087954820,SÃO PAULO,2,2015,Empresario
35813730596,ZAIRA HELENA GAZOTTI COSTA 06875239825,CAMPINAS,2,2015,Empresario
35813730600,PAULA VANESSA ALVES COSTA DA SILVA 21430205890,RIBEIRÃO PRETO,2,2015,Empresario
35813730618,MICAEL WESLEY SIQUEIRA ROSA 42282682858,CAIEIRAS,2,2015,Empresario
35813730626,ROMARIO MORAIS DA SILVA,SÃO PAULO,2,2015,Empresario
35813730634,ARILMA SANTOS DA SILVA 30885451830,CERQUILHO,2,2015,Empresario
35813730642,EDILSON DE ARAUJO CARVALHO 04240990807,RIO CLARO,2,2015,Empresario
35813730651,VALDINEI RODRIGUES DA SILVA 35497218890,ITAPEVA,2,2015,Empresario
35813730669,ADA CASTRO DOS SANTOS 50037072900,ITANHAÉM,2,2015,Empresario
35813730677,ODETE BARROS MARTINS DOS SANTOS 18752840875,SÃO PAULO,2,2015,Empresario
35813730685,JAIME SOUZA DE ASSIS 26582358871,BERTIOGA,2,2015,Empresario
35129526273,DARLEI SANDRIN BARBOSA,CATANDUVA,2,2015,Empresario
35129526281,JOSÉ APARECIDO DALLAPRIA,CATANDUVA,2,2015,Empresario
35129526290,TANIA REGINA GOMES DE BARROS,CATANDUVA,2,2015,Empresario
35129716552,CARLOS SERGIO RIBEIRO DA SILVA,FRANCA,2,2015,Empresario
35129716561,ANDRÉ L. GARCIA TRANSPORTES,FRANCA,2,2015,Empresario
35129716579,LAUDO DOS SANTOS SOUZA,ORLÂNDIA,2,2015,Empresario
35129716587,V. A. PELICIARI,FRANCA,2,2015,Empresario
35129716609,FRANCINILSON SOARES FERREIRA,ORLÂNDIA,2,2015,Empresario
35129716617,FABIANA FANAN EMBALAGENS,FRANCA,2,2015,Empresario
35129716625,ADRIANO VILMAR BARBOSA,IPUÃ,2,2015,Empresario
35129846545,REGINALDO GONÇALVES GUILHERME,PENÁPOLIS,2,2015,Empresario
35129846553,OSWALDO SERGIO CROZARIOLLI SEGUROS,PENÁPOLIS,2,2015,Empresario
35129846561,AMANDA CAROLINE TOME YAMAMOTO,ILHA SOLTEIRA,2,2015,Empresario
35129846570,CARMEN APARECIDA CORRÊA CORTEZ,COROADOS,2,2015,Empresario
35129846588,RUBENS SILVA JUNIOR COMERCIO DE GAS,ARAÇATUBA,2,2015,Empresario
35129846596,JAIME SEBASTIÃO DA SILVA AUTO ESCOLA,ARAÇATUBA,2,2015,Empresario
35129846600,D.C. PAPALI FERRAMENTAS,ARAÇATUBA,2,2015,Empresario
35129846618,CARLOS ALBERTO SPNOLA DE OLIVEIRA,ILHA SOLTEIRA,2,2015,Empresario
35129846626,JOSE FERNANDO DE MAGALHÃES LOURENÇÃO,ANDRADINA,2,2015,Empresario
35129846634,JAMES RODRIGUES BERDINAZZI,ARAÇATUBA,2,2015,Empresario
35129846642,S PEREIRA FLORICULTURA,BIRIGÜI,2,2015,Empresario
35129846651,ALEXANDRE DA CONCEIÇÃO FAVARO,ARAÇATUBA,2,2015,Empresario
35129846669,MV SOARES ATACADISTA,ARAÇATUBA,2,2015,Empresario
35129847771,MONICA LUCIA VALENTE,SÃO JOSÉ DOS CAMPOS,2,2015,Empresario
35129847797,FERNANDO RICARDO DE ARAUJO,SÃO JOSÉ DOS CAMPOS,2,2015,Empresario
35129847801,CLAYTON TEODORO CIRINO,SÃO JOSÉ DOS CAMPOS,2,2015,Empresario
35129847819,GUILHERME SALES CARNEIRO,CARAGUATATUBA,2,2015,Empresario
35129847827,L.A. DA CRUZ SANTOS,SÃO JOÃO DA BOA VISTA,2,2015,Empresario
35129847835,SUELLEN DE OLIVEIRA SOUZA GARCIA ENTREGA RAPIDA,SÃO JOSÉ DOS CAMPOS,2,2015,Empresario
35129847843,ADRIANA RAMOS DE PAULA E ALMEIDA,SÃO JOSÉ DOS CAMPOS,2,2015,Empresario
35129847851,JOSEFA DA CONCEIÇÃO DA COSTA,SÃO JOSÉ DOS CAMPOS,2,2015,Empresario
35129847860,A GUILHERME DE FARIAS,CAÇAPAVA,2,2015,Empresario
35129847878,A S DO NASCIMENTO TRANSPORTES,SÃO JOSÉ DOS CAMPOS,2,2015,Empresario
35129847886,G.S. OLIVEIRA AUTO PEÇAS,TAUBATÉ,2,2015,Empresario
35129847894,TANIA DE OLIVEIRA ARRUDA,SÃO JOSÉ DOS CAMPOS,2,2015,Empresario
35129847908,JEAN MICHAEL BARBOSA ANTUNES COMERCIAL,APARECIDA,2,2015,Empresario
35129867097,CLAUDIO MARCON,JUNDIAÍ,2,2015,Empresario
35129867127,A.GOMES DOS SANTOS CARPINTARIA,AMPARO,2,2015,Empresario
35129867135,GABRIEL MONTE CONSOLINE,ITATIBA,2,2015,Empresario
35129867143,ADRIANA CRISTINA CAETANO FERREIRA SERVICOS ADMINISTRATIVOS,VALINHOS,2,2015,Empresario
35129867160,SEBASTIAO ALVES DE SOUZA PIZZARIA,ARTUR NOGUEIRA,2,2015,Empresario
35129867178,M.S. MENDES BIANCHI,PEDREIRA,2,2015,Empresario
35129869782,JAIR ROBERTO DO NASCIMENTO,ARARAQUARA,2,2015,Empresario
35129869791,CARINA DONINI CHIAVALONI,RINCÃO,2,2015,Empresario
35129869804,DAISON ALESSANDRO COLIN,MATÃO,2,2015,Empresario
35129869812,RENATA APARECIDA DO CARMO LIMA,MATÃO,2,2015,Empresario
35129869821,MURILO FERREIRA MONTEIRO,ARARAQUARA,2,2015,Empresario
35129869839,SILVANIA MARIA NOGUEIRA CASEMIRO,TABATINGA,2,2015,Empresario
35129869847,PAULO HENRIQUE DE MATOS AVANZI,ITÁPOLIS,2,2015,Empresario
35129869855,MANOEL SABINO AMARO,ARARAQUARA,2,2015,Empresario
35129869863,CINTIA APARECIDA SOARES RACCO BEBIDAS,ARARAQUARA,2,2015,Empresario
35129876401,MARCEL MELO DE BRITO SERVIÇOS,SANTO ANDRÉ,2,2015,Empresario
35129876410,AJM DE AZEVEDO MANUTENÇÃO,RIBEIRÃO PIRES,2,2015,Empresario
35129876541,CLAYTON DA CONCEIÇÃO ALVES,SÃO BERNARDO DO CAMPO,2,2015,Empresario
35129876550,MARCELI ARAUJO POMPEU,OSASCO,2,2015,Empresario
35129876568,HÉLIO B. M. DO COUTO FILHO - CONSULTORIA,SANTO ANDRÉ,2,2015,Empresario
35129876584,GERALDO CORREA MOREIRA CONSTRUÇÕES,MAUÁ,2,2015,Empresario
35129876592,DEIVID SIERRA,SANTO ANDRÉ,2,2015,Empresario
35129876606,JESSICA CRISTYNE BRIANEZ,SANTO ANDRÉ,2,2015,Empresario
35129876614,REGISLAINE ROSA DA SILVA ALBOREDO,SÃO BERNARDO DO CAMPO,2,2015,Empresario
35129876622,JULIO CESAR BERTOLOTO REPRESENTAÇÃO,SÃO BERNARDO DO CAMPO,2,2015,Empresario
35129876631,CLAYTON SILVA FRANÇA AIRES SUPLEMENTOS ALIMENTARES,SÃO BERNARDO DO CAMPO,2,2015,Empresario
35129876649,G CASTANHA - CANTINA ESCOLAR,SANTO ANDRÉ,2,2015,Empresario
35129876657,FABIO ROBERTO MARTINS LOPES,SÃO BERNARDO DO CAMPO,2,2015,Empresario
35129876665,JOSE ANTONIO DIAZ NEIRO,SANTO ANDRÉ,2,2015,Empresario
35129876673,ADRIANA AMORIM DE MELO DROGARIA,SÃO BERNARDO DO CAMPO,2,2015,Empresario
35129876681,MILENE ALVES AZEVEDO,SÃO CAETANO DO SUL,2,2015,Empresario
35129885761,LUIZ CARLOS AIRES DOS SANTOS,SANTOS,2,2015,Empresario
35129885770,MARINA SAMPAIO,PEDRO DE TOLEDO,2,2015,Empresario
35129885788,SAMUEL SANTOS DE OLIVEIRA TRANSPORTES,GUARUJÁ,2,2015,Empresario
35129885796,P. R. DOS SANTOS - ADMINISTRAÇÃO,SÃO VICENTE,2,2015,Empresario
35129885800,ARIANE MENEZES DA SILVA,PRAIA GRANDE,2,2015,Empresario
35129885818,GISELE GUERRA,BERTIOGA,2,2015,Empresario
35129885826,LOURIVAL TEOFILO DE JESUS,PERUÍBE,2,2015,Empresario
35129885834,CAROLINA A. TEOBALDO MOGICA,CUBATÃO,2,2015,Empresario
35129885842,ERIVALDO CAVALCANTE,CUBATÃO,2,2015,Empresario
35129885869,MARA CRISTINA GOMES DA PAIXÃO AZEVEDO,GUARUJÁ,2,2015,Empresario
35129885877,CASSIANA DONIZETTE CHANTAL,SANTOS,2,2015,Empresario
35129885885,ANDRE PIPPO,SÃO VICENTE,2,2015,Empresario
35129897948,A P DA CUNHA TECNOLOGIA,SÃO PAULO,2,2015,Empresario
35129897956,SYLVIO FERREIRA MOYANO,MOGI DAS CRUZES,2,2015,Empresario
35129897964,IZAIAS DOMINGOS DA ROCHA,SÃO BERNARDO DO CAMPO,2,2015,Empresario
35129897972,JULIANA ESTRAMARO NUNES TRANSPORTES,SÃO PAULO,2,2015,Empresario
35129897981,YARA DA SILVA RIBEIRO CHAVES,COTIA,2,2015,Empresario
35129897999,EMANUELLE NEGREIROS LOPES,SÃO PAULO,2,2015,Empresario
35129898006,MARCOS VINICIUS PESSUTO CRUZ,SANTO ANDRÉ,2,2015,Empresario
35129900621,AXEL COBELO WEISZ,SÃO PAULO,2,2015,Empresario
35129900639,JOÃO CARLOS GOUVEIA - VEICULOS,LOUVEIRA,2,2015,Empresario
35129900647,DONGMEI GUO PRESENTES,SÃO PAULO,2,2015,Empresario
35129900655,MARIA APARECIDA DIAS MUNIZ,SÃO PAULO,2,2015,Empresario
35129900663,RICARDO MUNHOZ CONSULTORIA,SÃO PAULO,2,2015,Empresario
35129900671,FERNANDO L M DE SOUSA PRESTADORA DE SERVICO DE INFORMATICA,SÃO PAULO,2,2015,Empresario
35129900680,ADRIANA MIGUEL MOROTTI,SÃO PAULO,2,2015,Empresario
35129900698,R P DA SILVA DOS SANTOS COMERCIO DE COSMETICOS,SÃO PAULO,2,2015,Empresario
35129900701,LUIS ANDRE DO NASCIMENTO,SÃO PAULO,2,2015,Empresario
35129900710,JEFERSON VAGNER FRANCO ARRUDA,SÃO PAULO,2,2015,Empresario
35129900728,JOSE LUIZ BEIRÃO E SILVA TRANSPORTES,SÃO PAULO,2,2015,Empresario
35129900736,RONALDO BUENO SANT ANA - MERCEARIA,SÃO PAULO,2,2015,Empresario
35129900744,RENATO AUGUSTO DA SILVA SANTOS EVENTOS,SÃO PAULO,2,2015,Empresario
35129900752,DAVI BASI LUCIO,SÃO PAULO,2,2015,Empresario
35129900761,MARIA I.C.G. CLARENTINO,SÃO PAULO,2,2015,Empresario
35129900779,N. T. DOS SANTOS PARK VALLET,SÃO PAULO,2,2015,Empresario
35129901708,SUELI APARECIDA DE SOUZA GOTO,MOGI DAS CRUZES,2,2015,Empresario
35129904162,JAMILE CAZARIN LOZANO BIAZON,BAURU,2,2015,Empresario
35129904171,VINICIUS MARTINS TANAMACHI,BAURU,2,2015,Empresario
35129904189,ECV FUZINELLI,JAÚ,2,2015,Empresario
35129904197,RODRIGO AUGUSTO BARRIERO,BARRA BONITA,2,2015,Empresario
35129904201,R. H. DE SOUZA CARGAS,MINEIROS DO TIETÊ,2,2015,Empresario
35129904219,NADIR MANZATO USSUNA,BAURU,2,2015,Empresario
35129904227,DANIEL RODRIGUES SERRALHERIA,PIRATININGA,2,2015,Empresario
35129904235,LEMARCOS DE ARRUDA,BOTUCATU,2,2015,Empresario
35129904243,MARCELO APARECIDO DA COSTA DIAS,AVARÉ,2,2015,Empresario
35129922055,FABIO POLI ROSA DA CRUZ,INDAIATUBA,2,2015,Empresario
35129922063,DANILO MARTINEZ DEL ROY REPRESENTAÇÕES,JUNDIAÍ,2,2015,Empresario
35129922071,ANDRE SIA PET SHOP,ARTUR NOGUEIRA,2,2015,Empresario
