NIRE,Empresa,Município,Month,Year,Type
35600710181,SNTC SERVICOS EIRELLI,SAO CAETANO DO SUL,2,2015,Grupo
35600720763,CONSTRULAR LIMEIRA COMERCIO DE ESQUADRIAS EIRELI,LIMEIRA,2,2015,Grupo
35600749371,CASA & COLCHOES COMERCIO DE ARACATUBA EIRELI,ARACATUBA,2,2015,Grupo
35600749508,FABIO BATISTA DE SOUSA EIRELI,ILHA SOLTEIRA,2,2015,Grupo
35600783072,TANABI CACAU EIRELI,TANABI,2,2015,Grupo
35600807435,LHF SHOES EIRELI,JAU,2,2015,Grupo
35600816892,ROYAL JERSEY HOLDING EIRELI,SAO PAULO,2,2015,Grupo
35600816914,BATZLI SWISS HOLDING EIRELI,SAO PAULO,2,2015,Grupo
35600816973,OVERMED AMBULANCIAS EIRELI,CAMPO LIMPO PAULISTA,2,2015,Grupo
35600817244,TECHNICK COMERCIO IMPORTACAO & EXPORTACAO EIRELI,COSMORAMA,2,2015,Grupo
35600817384,PLANETA.COM COMERCIO DE PLASTICOS E ACO EIRELI,COSMORAMA,2,2015,Grupo
35600829684,BENATI CONTABILIDADE EIRELI,JAGUARIUNA,2,2015,Grupo
35600829706,EDCARLOS TRANSPORTES EIRELI,JAGUARIUNA,2,2015,Grupo
35600829722,EMBALAGENS CISILOTTO EIRELI.,LINDOIA,2,2015,Grupo
35600829749,ANJOFARMA FARMACEUTICA EIRELI,JAGUARIUNA,2,2015,Grupo
35600848565,MARCELA NOBREGA MACHADO EIRELI,AMERICANA,2,2015,Grupo
35600848620,"SAO CAETANO AUTO PECAS EIRELI ""INABILITADA PARA EXERCER ATIVIDADE EMPRESARIAL""",RIO CLARO,2,2015,Grupo
35600855421,INTELIGENCIA EM NEGOCIOS COMERCIO E REPRESENTACAO EIRELI,SAO ROQUE,2,2015,Grupo
35600855847,POLISINAL SINALIZACAO VIARIA EIRELI,SAO PAULO,2,2015,Grupo
35600856495,MANFERS INDUSTRIA E COMERCIO DE FIOS E CABOS ESPECIAIS EIRELI,SAO PAULO,2,2015,Grupo
35600857360,GLOBAL TRAVEL JOB TRAVEL EIRELI,SAO PAULO,2,2015,Grupo
35600857475,VEGGA MIDIA FILMES - PRODUCOES - EIRELI,SAO PAULO,2,2015,Grupo
35600860883,E.S. SILVA ALIMENTOS E BEBIDAS EIRELI,SAO PAULO,2,2015,Grupo
35600861189,"CANINDE EVENTOS E PROMOCOES - EIRELI - ""INABILITADA PARA EXERCER ATIVIDADE EMPRESARIAL""",SAO PAULO,2,2015,Grupo
35600863238,BITT BUSINESS INTELLIGENCE EM TECNOLOGIA PARA TELECOM - EIRELI,CAMPINAS,2,2015,Grupo
35600863505,GADDIEL CONFECCOES EIRELI,SAO PAULO,2,2015,Grupo
35600866491,MARTINUSSI LUMINOSOS EIRELI,AMERICANA,2,2015,Grupo
35600869520,H2O PURIFICADORES E REFIL DE AGUA EIRELI,SAO PAULO,2,2015,Grupo
35600869830,LYNCH AGENTE AUTONOMO DE INVESTIMENTOS EIRELI,SAO PAULO,2,2015,Grupo
35600871095,GOLDEN J AVIAMENTOS EIRELI,SAO PAULO,2,2015,Grupo
35600872482,CLICK DATA SOLUCOES INFORMATICA EIRELI,SAO PAULO,2,2015,Grupo
35600873586,BIG BREAD PADARIA E RESTAURANTE EIRELI,SAO PAULO,2,2015,Grupo
35600873683,AQUAJATO SERVICOS DE PINTURA PREDIAIS E INDUSTRIAIS EIRELI,SAO BERNARDO DO CAMPO,2,2015,Grupo
35600873721,MERCEARIA ITIRIKI EIRELI,SAO PAULO,2,2015,Grupo
35600873985,5 W CONSTRUTORA E INCORPORADORA EIRELI,SAO PAULO,2,2015,Grupo
35600874159,TERMOCOLOR COMERCIO DE TINTAS E VERNIZES EIRELI,TAUBATE,2,2015,Grupo
35600874451,PARKS MPS DIVERSOES EIRELI,MAUA,2,2015,Grupo
35600875163,FENIX EMPREENDIMENTOS E LOCACOES EIRELI,RIO CLARO,2,2015,Grupo
35600875368,MARCELO BIACCHI - TRANSPORTES 033 EIRELI,SAO PAULO,2,2015,Grupo
35600875767,ARANTES ASSESSORIA DESPORTIVA EIRELI,SAO PAULO,2,2015,Grupo
35600876097,"GUP IMPORTACOES EXPORTACOES EIRELI ""INABILITADA PARA EXERCER ATIVIDADE EMPRESARIAL""",SAO PAULO,2,2015,Grupo
35600876224,CLINICA DR. UBIRATAN OLIVEIRA EIRELI,ATIBAIA,2,2015,Grupo
35600876232,RIO PARDO ARMAZENS GERAIS EIRELI,SAO JOSE DO RIO PARDO,2,2015,Grupo
35600876542,ESTANTERIA COMERCIO DE MOVEIS E SISTEMAS DE ARMAZENAGEM EIRELI,MOGI-GUACU,2,2015,Grupo
35600877689,PIN PARTICIPACOES EIRELI,SAO PAULO,2,2015,Grupo
35600872482,CLICK DATA SOLUCOES INFORMATICA EIRELI,SAO PAULO,2,2015,Grupo
35600873586,BIG BREAD PADARIA E RESTAURANTE EIRELI,SAO PAULO,2,2015,Grupo
35600873683,AQUAJATO SERVICOS DE PINTURA PREDIAIS E INDUSTRIAIS EIRELI,SAO BERNARDO DO CAMPO,2,2015,Grupo
35600873721,MERCEARIA ITIRIKI EIRELI,SAO PAULO,2,2015,Grupo
35600873985,5 W CONSTRUTORA E INCORPORADORA EIRELI,SAO PAULO,2,2015,Grupo
35600874159,TERMOCOLOR COMERCIO DE TINTAS E VERNIZES EIRELI,TAUBATE,2,2015,Grupo
35600874451,PARKS MPS DIVERSOES EIRELI,MAUA,2,2015,Grupo
35600875163,FENIX EMPREENDIMENTOS E LOCACOES EIRELI,RIO CLARO,2,2015,Grupo
35600875368,MARCELO BIACCHI - TRANSPORTES 033 EIRELI,SAO PAULO,2,2015,Grupo
35600875767,ARANTES ASSESSORIA DESPORTIVA EIRELI,SAO PAULO,2,2015,Grupo
35600876097,"GUP IMPORTACOES EXPORTACOES EIRELI ""INABILITADA PARA EXERCER ATIVIDADE EMPRESARIAL""",SAO PAULO,2,2015,Grupo
35600876224,CLINICA DR. UBIRATAN OLIVEIRA EIRELI,ATIBAIA,2,2015,Grupo
35600876232,RIO PARDO ARMAZENS GERAIS EIRELI,SAO JOSE DO RIO PARDO,2,2015,Grupo
35600876542,ESTANTERIA COMERCIO DE MOVEIS E SISTEMAS DE ARMAZENAGEM EIRELI,MOGI-GUACU,2,2015,Grupo
35600877689,PIN PARTICIPACOES EIRELI,SAO PAULO,2,2015,Grupo
35600872482,CLICK DATA SOLUCOES INFORMATICA EIRELI,SAO PAULO,2,2015,Grupo
35600873586,BIG BREAD PADARIA E RESTAURANTE EIRELI,SAO PAULO,2,2015,Grupo
35600873683,AQUAJATO SERVICOS DE PINTURA PREDIAIS E INDUSTRIAIS EIRELI,SAO BERNARDO DO CAMPO,2,2015,Grupo
35600873721,MERCEARIA ITIRIKI EIRELI,SAO PAULO,2,2015,Grupo
35600873985,5 W CONSTRUTORA E INCORPORADORA EIRELI,SAO PAULO,2,2015,Grupo
35600874159,TERMOCOLOR COMERCIO DE TINTAS E VERNIZES EIRELI,TAUBATE,2,2015,Grupo
35600874451,PARKS MPS DIVERSOES EIRELI,MAUA,2,2015,Grupo
35600875163,FENIX EMPREENDIMENTOS E LOCACOES EIRELI,RIO CLARO,2,2015,Grupo
35600875368,MARCELO BIACCHI - TRANSPORTES 033 EIRELI,SAO PAULO,2,2015,Grupo
35600875767,ARANTES ASSESSORIA DESPORTIVA EIRELI,SAO PAULO,2,2015,Grupo
35600876097,"GUP IMPORTACOES EXPORTACOES EIRELI ""INABILITADA PARA EXERCER ATIVIDADE EMPRESARIAL""",SAO PAULO,2,2015,Grupo
35600876224,CLINICA DR. UBIRATAN OLIVEIRA EIRELI,ATIBAIA,2,2015,Grupo
35600876232,RIO PARDO ARMAZENS GERAIS EIRELI,SAO JOSE DO RIO PARDO,2,2015,Grupo
35600876542,ESTANTERIA COMERCIO DE MOVEIS E SISTEMAS DE ARMAZENAGEM EIRELI,MOGI-GUACU,2,2015,Grupo
35600877689,PIN PARTICIPACOES EIRELI,SAO PAULO,2,2015,Grupo
35600878944,WORLD LOG COMPLEXO LOGISTICO EIRELI,SAO PAULO,2,2015,Grupo
35600879177,LANNA PIZZARIA EIRELI,SAO BERNARDO DO CAMPO,2,2015,Grupo
35600879932,BRK BROKERS DO BRASIL EIRELI,CACAPAVA,2,2015,Grupo
35600879967,NUCLEO INDUSTRIA E COMERCIO DE FERROLIGAS EIRELI,GUARULHOS,2,2015,Grupo
35600880078,DUO VIAGENS E TURISMO EIRELI,SAO PAULO,2,2015,Grupo
35600880281,J E MOTORS INTERMEDIACAO DE NEGOCIOS - EIRELI,SAO PAULO,2,2015,Grupo
35600880353,SOLUTIONS GESTAO DE RESIDUOS - EIRELI,SAO PAULO,2,2015,Grupo
35600880400,TJ VALENTE COMERCIO DE VEICULOS AUTOMOTORES - EIRELI,SAO PAULO,2,2015,Grupo
35600880779,LLF PARTICIPACOES - EIRELI,SAO PAULO,2,2015,Grupo
35600881627,PADARIA E RESTAURANTE FERMENTO VIVO EIRELI,SAO PAULO,2,2015,Grupo
35600881635,BREAD SUN PADARIA E RESTAURANTE EIRELI,SAO PAULO,2,2015,Grupo
35600881643,PADARIA E RESTAURANTE NOVA JOIA EIRELI,SAO PAULO,2,2015,Grupo
35600881651,ROCAMBOLLE PADARIA E RESTAURANTE EIRELI,SAO PAULO,2,2015,Grupo
35600881660,LA REDONDA PIZZARIA E FAST FOOD EIRELI,SAO PAULO,2,2015,Grupo
35600881821,OSWCOR CORRETORA DE SEGUROS EIRELI,SAO PAULO,2,2015,Grupo
35600882160,TRITON ADMINISTRADORA E CORRETORA EIRELI,BARUERI,2,2015,Grupo
35600882208,NYK MOVEIS EIRELI,SAO PAULO,2,2015,Grupo
35600883778,"USHU INDUSTRIA E COMERCIO DE CONFECCOES EIRELI ""INABILITADA PARA EXERCER ATIVIDADE EMPRESARIAL""",SAO PAULO,2,2015,Grupo
35600885380,OASIS POINT SUPER LANCHES EIRELI,SOROCABA,2,2015,Grupo
35600885592,JTT SERVICOS MEDICOS E HOSPITALARES EIRELI,SANTANA DE PARNAIBA,2,2015,Grupo
35600885657,S DESIGN PROJETOS & OBRAS EIRELI,SAO PAULO,2,2015,Grupo
35600885908,ESCRITORIO DE CONTABILIDADE ISHIHARA EIRELI,COTIA,2,2015,Grupo
35600886025,HN COMERCIO DE TINTAS EIRELI,SAO PAULO,2,2015,Grupo
35600886262,A.N. COMERCIO DE TINTAS AUTOMOTIVAS E IMOBILIARIAS EIRELI,SAO PAULO,2,2015,Grupo
35600886777,AGNUS ENGENHARIA EIRELI,SANTOS,2,2015,Grupo
35600888141,K.F. INDUSTRIA E COMERCIO DE PECAS - EIRELI,ITAQUAQUECETUBA,2,2015,Grupo
35600888206,CIRURGICA ESTRELA IPIGUA PRODUTOS HOSPITALAR EIRELI,IPIGUA,2,2015,Grupo
35600888222,MANZANO COMERCIO DE PECAS AUTOMOTIVAS EIRELI,RIBEIRAO PRETO,2,2015,Grupo
35600888567,DINAMICA - INCORPORACAO DE EMPREENDIMENTOS IMOBILIARIOS EIRELI,SAO PAULO,2,2015,Grupo
35600888966,ARVOS DO BRASIL SERVICOS DE INFORMATICA EIRELI,BARUERI,2,2015,Grupo
35600889181,F NIX CONTABILIDADE E SERVICOS ADMINISTRATIVOS EIRELI,SAO PAULO,2,2015,Grupo
35600889199,RR PAPER DISTRIBUIDORA DE PAPEIS EIRELI,SAO PAULO,2,2015,Grupo
35600889202,STR ILUMINACAO EIRELI,GUARULHOS,2,2015,Grupo
35600889466,VALLE MENEZES SERVICOS ADMINISTRATIVOS EIRELI,VINHEDO,2,2015,Grupo
35600889741,MANZONI INTERMEDIACAO E REPRESENTACAO DE NEGOCIOS EIRELI,SAO PAULO,2,2015,Grupo
35600889881,EQSJR INFORMATICA - EIRELI,SAO PAULO,2,2015,Grupo
35600890260,YOSHI PARTICIPACOES SOCIETARIA EIRELI,SAO PAULO,2,2015,Grupo
35600890278,GO KATIOSTUR EIRELI,SAO PAULO,2,2015,Grupo
35600890472,NEW PRINTER - ATACADISTA E DISTRIBUIDORA EIRELI,SAO PAULO,2,2015,Grupo
35600890804,SPNORT TRANSPORTES EIRELI,SAO PAULO,2,2015,Grupo
35600890910,MINERACAO AGUA AMARELA - EIRELI,RIOLANDIA,2,2015,Grupo
35600891070,RGE EQUIPAMENTOS INDUSTRIAIS EIRELI,SERTAOZINHO,2,2015,Grupo
35600893251,SC DESIGN COMERCIO DE SAPATOS EIRELI,SAO PAULO,2,2015,Grupo
35600895237,FPP HOLDING E CONSULTORIA EMPRESARIAL EIRELI,SAO PAULO,2,2015,Grupo
35600895245,GSP HOLDING E CONSULTORIA EMPRESARIAL EIRELI,SAO PAULO,2,2015,Grupo
35600895415,GOLDEN WIND INDUSTRIA METALURGICA EIRELI,ITAQUAQUECETUBA,2,2015,Grupo
35600895504,LOOK FOR YOU COMERCIO DE VESTUARIO EIRELI,SAO BERNARDO DO CAMPO,2,2015,Grupo
35600896888,PROTSOL COMERCIO DE TOLDOS EIRELI,SAO PAULO,2,2015,Grupo
35600896900,SOLUTION CONSULTORIA EMPRESARIAL EIRELI,SAO PAULO,2,2015,Grupo
35600897281,OMNIPRO SOLUCOES INTEGRADAS DE AUTOMACAO EIRELI,SAO PAULO,2,2015,Grupo
35601328212,TRANSPORTADORA ABRAHAO EIRELI,SAO PAULO,2,2015,Grupo
35600895415,GOLDEN WIND INDUSTRIA METALURGICA EIRELI,ITAQUAQUECETUBA,2,2015,Grupo
35600895504,LOOK FOR YOU COMERCIO DE VESTUARIO EIRELI,SAO BERNARDO DO CAMPO,2,2015,Grupo
35600896888,PROTSOL COMERCIO DE TOLDOS EIRELI,SAO PAULO,2,2015,Grupo
35600896900,SOLUTION CONSULTORIA EMPRESARIAL EIRELI,SAO PAULO,2,2015,Grupo
35600897281,OMNIPRO SOLUCOES INTEGRADAS DE AUTOMACAO EIRELI,SAO PAULO,2,2015,Grupo
35601328212,TRANSPORTADORA ABRAHAO EIRELI,SAO PAULO,2,2015,Grupo
35300475186,MDR PARTICIPACOES S.A,SAO PAULO,2,2015,Sociedade por Acoes
35300475194,"PROSALV ADMINISTRACAO, EMPREENDIMENTOS E PARTICIPACOES S/A",SAO PAULO,2,2015,Sociedade por Acoes
35300475208,TWA ADMINISTRACAO E PARTICIPACOES S/A,SAO PAULO,2,2015,Sociedade por Acoes
35300475216,CONFIANET CERTIFICACOES S.A.,SAO PAULO,2,2015,Sociedade por Acoes
35300475224,NEOLOG CONSULTORIA E SISTEMAS S.A,SAO PAULO,2,2015,Sociedade por Acoes
35300475232,PALACIO TANGARA PARTICIPACOES S.A.,SAO PAULO,2,2015,Sociedade por Acoes
35300475241,PEAC IMOVEIS S.A.,SAO PAULO,2,2015,Sociedade por Acoes
35300475259,NIEPPE HOLDINGS S.A.,SAO PAULO,2,2015,Sociedade por Acoes
35300475267,NORVILLE HOLDINGS S.A.,SAO PAULO,2,2015,Sociedade por Acoes
35300475275,UNICOBA ILUMINACAO HOLDINGS S.A.,SAO PAULO,2,2015,Sociedade por Acoes
35300475283,NANCES HOLDINGS S.A.,SAO ROQUE,2,2015,Sociedade por Acoes
35300475291,NANGIS HOLDINGS S.A.,SAO PAULO,2,2015,Sociedade por Acoes
35300475305,NAMPONT HOLDINGS S.A.,SAO PAULO,2,2015,Sociedade por Acoes
35300475313,GBM - COMPANHIA SECURITIZADORA DE CREDITOS FINANCEIROS S.A.,SAO PAULO,2,2015,Sociedade por Acoes
35300475321,GOODMAN BRASIL LOGISTICA S.A.,SAO PAULO,2,2015,Sociedade por Acoes
35300475330,TAMAR PEQUENAS CENTRAIS HIDROLETRICAS S.A.,SAO PAULO,2,2015,Sociedade por Acoes
35300475348,ENERGIA DOS VENTOS II S.A,SAO PAULO,2,2015,Sociedade por Acoes
35300475356,ENERGIA DOS VENTOS IV S.A,SAO PAULO,2,2015,Sociedade por Acoes
35300475364,SUL AMERICA INVESTIMENTOS GESTORA DE RECURSOS S.A.,SAO PAULO,2,2015,Sociedade por Acoes
35300475372,LIQUITUDO COMERCIO E SERVICOS DE PRODUTOS ELETRONICOS E LOGISTICA REVERSA S.A.,ARACARIGUAMA,2,2015,Sociedade por Acoes
35300475381,OCA STUDIOS INVESTIMENTOS E PRODUCOES AUDIOVISUAIS S.A,SAO PAULO,2,2015,Sociedade por Acoes
35300475399,NAT NUTRE ALIMENTOS S/A,SAO PAULO,2,2015,Sociedade por Acoes
35300475402,PR-MJD ADMINISTRACAO DE BEM PROPRIO S.A.,BARUERI,2,2015,Sociedade por Acoes
35300475411,PONTONET LOGISTICA S/A,COTIA,2,2015,Sociedade por Acoes
35300475429,SERTECNICA EMPREENDIMENTOS E PARTICIPACOES S.A.,SAO PAULO,2,2015,Sociedade por Acoes
35300475437,ITAUSEG SEGURADORA S.A.,SAO PAULO,2,2015,Sociedade por Acoes
35300475445,BRAZAL - BRASIL ALIMENTOS S.A.,SAO PAULO,2,2015,Sociedade por Acoes
35300475453,LA ISLA PARTICIPACOES E EMPREENDIMENTOS IMOBILIARIOS S.A,SAO PAULO,2,2015,Sociedade por Acoes
35300475461,LHT PARTICIPACOES S.A.,SAO PAULO,2,2015,Sociedade por Acoes
35300475470,CENTO E UM PARTICIPACOES S.A.,SAO PAULO,2,2015,Sociedade por Acoes
35300475488,AFMSF PARTICIPACOES S.A.,SAO PAULO,2,2015,Sociedade por Acoes
35300475496,HRJE PARTICIPACOES S.A.,SAO PAULO,2,2015,Sociedade por Acoes
35300475500,SANTA THEREZA CONSULTORIA E GESTAO EMPRESARIAL S.A,BERTIOGA,2,2015,Sociedade por Acoes
35300475518,ROSE MOUNTAIN ADMINISTRACAO E PARTICIPACOES S/A,SAO PAULO,2,2015,Sociedade por Acoes
35300475526,"XD COMERCIAL, IMPORTACAO E EXPORTACAO S.A.",SAO PAULO,2,2015,Sociedade por Acoes
35300475534,OLIMPIA ADMINISTRACAO E PARTICIPACOES S/A,SAO PAULO,2,2015,Sociedade por Acoes
35300475542,JUBI PARTICIPACOES S/A,SANTO ANDRE,2,2015,Sociedade por Acoes
35300475551,INETX S/A,SAO PAULO,2,2015,Sociedade por Acoes
35300475569,"AHTILANTE EMPREENDIMENTOS S.A. ""EM LIQUIDACAO""",BARUERI,2,2015,Sociedade por Acoes
35300475577,DETMOLD RJ PARTICIPACOES S.A,SAO PAULO,2,2015,Sociedade por Acoes
35300475585,GRAN PARTNERS NEGOCIOS IMOBILIARIOSS.A,SAO PAULO,2,2015,Sociedade por Acoes
35300475593,SALUS HOLDING S.A.,SAO PAULO,2,2015,Sociedade por Acoes
35300475607,I MED SC S.A.,SAO PAULO,2,2015,Sociedade por Acoes
35300475615,LIBRA SECURITIZADORA DE CREDITOS S.A,SAO PAULO,2,2015,Sociedade por Acoes
35300475623,PPP HABITACIONAL SP LOTE 1 S/A,SAO PAULO,2,2015,Sociedade por Acoes
35300475631,CELENZA & CELENZA ADMINISTRADORA DE BENS PROPRIOS S/A,BAURU,2,2015,Sociedade por Acoes
35300475640,BTGI VII PARTICIPACOES S.A.,SAO PAULO,2,2015,Sociedade por Acoes
35300475658,FLUID SYSTEM DO BRASIL S/A,VINHEDO,2,2015,Sociedade por Acoes
35300475666,DEZKER EMPREENDIMENTOS E PARTICIPACOES S/A.,SAO PAULO,2,2015,Sociedade por Acoes
35300475682,RC CLINICA MEDICA S.A.,SAO PAULO,2,2015,Sociedade por Acoes
35300475691,BURUNDI EMPREENDIMENTOS IMOBILIARIOS S.A.,SAO PAULO,2,2015,Sociedade por Acoes
35300475704,PROMAX ENGENHARIA E PROJETOS S.A,SANTANA DE PARNAIBA,2,2015,Sociedade por Acoes
35300475712,PROPERTIES GRU EMPREENDIMENTOS IMOBILIARIOS S.A,SAO PAULO,2,2015,Sociedade por Acoes
35300475721,WIN PARTICIPACOES S.A,SAO PAULO,2,2015,Sociedade por Acoes
35300475739,NANAK RJ PARTICIPACOES S.A,SAO PAULO,2,2015,Sociedade por Acoes
35300475747,COMPAREX BRASIL S.A.,SAO PAULO,2,2015,Sociedade por Acoes
35300475763,"MOG ADMINISTRACAO E PARTICIPACOES S.A. ""EM LIQUIDACAO""",SANTO ANDRE,2,2015,Sociedade por Acoes
35300475771,SOCIEDADE COMERCIAL AJJ S.A,SANDOVALINA,2,2015,Sociedade por Acoes
35300475780,F2 ADMINISTRACAO DE IMOVEIS S.A.,SAO BERNARDO DO CAMPO,2,2015,Sociedade por Acoes
35300475798,CBFN PARTICIPACOES E INVESTIMENTOS S/A,SAO PAULO,2,2015,Sociedade por Acoes
35300475801,MYTHOLOGY EMPREENDIMENTOS E PARTICIPACOES S.A.,PARAGUACU PAULISTA,2,2015,Sociedade por Acoes
35300475810,GPR CAPITAL S/A,INDAIATUBA,2,2015,Sociedade por Acoes
35300475828,GUITTA S.A. CONSTRUTORA E INCORPORADORA E PARTICIPACOES,BERTIOGA,2,2015,Sociedade por Acoes
35300475836,VOID STUDIOS S/A,SAO PAULO,2,2015,Sociedade por Acoes
35300475844,GALLUC EMPREENDIMENTOS IMOBILIARIOS S.A.,SAO PAULO,2,2015,Sociedade por Acoes
35300475852,COLOGNE HOLDING DO BRASIL S/A,SAO PAULO,2,2015,Sociedade por Acoes
35300475861,FS4 ADMINISTRACAO E PARTICIPACAO S/A,SANTO ANDRE,2,2015,Sociedade por Acoes
35300475879,SVIAS SOLUCOES EM ELETRONICA E INFORMATICA S/A,PIRASSUNUNGA,2,2015,Sociedade por Acoes
35300475887,TELINVEST S.A,SAO PAULO,2,2015,Sociedade por Acoes
35300475895,VEGA BRASIL INVEST S/A,MARILIA,2,2015,Sociedade por Acoes
35300475909,VTR TRATAMENTO DE RESIDUOS S.A.,SAO PAULO,2,2015,Sociedade por Acoes
35300475917,LIV PESCADOS S.A,JALES,2,2015,Sociedade por Acoes
35300475925,WHITNEY DO BRASIL HOLDING S.A.,SAO PAULO,2,2015,Sociedade por Acoes
35300475933,VELLES DESENVOLVIMENTOIMOBILIARIO S.A.,SAO PAULO,2,2015,Sociedade por Acoes
35300475941,BABAA SERVICOS DE APLICATIVO E INTERMEDIACAO S.A.,SAO PAULO,2,2015,Sociedade por Acoes
35300475950,AEFO INVESTIMENTOS S/A,SOROCABA,2,2015,Sociedade por Acoes
35300475968,BS HOLDING S.A.,INDAIATUBA,2,2015,Sociedade por Acoes
35300475976,SORETTO FABRICA DE CABOS AUTOMOTIVOS S/A,SAO CARLOS,2,2015,Sociedade por Acoes
35300475984,ALLOY MIT GESTAO DE INFORMACOES TECNOLOGICAS S.A.,SAO PAULO,2,2015,Sociedade por Acoes
35300475992,"LIGA TECNOLOGIA E PARTICIPACOES S.A. - ""EM LIQUIDACAO""",SAO PAULO,2,2015,Sociedade por Acoes
35300476000,AGGYO ADMINISTRACAO DE BENS E PARTICIPACOES S.A.,EMBU DAS ARTES,2,2015,Sociedade por Acoes
35300476018,COMPLIANCE EMPREENDIMENTOS S/A,SAO PAULO,2,2015,Sociedade por Acoes
35300476026,COLTSVILLE PARTICIPACOES S/A,SAO PAULO,2,2015,Sociedade por Acoes
35300476034,HEXA INVESTIMENTOS S/A,SOROCABA,2,2015,Sociedade por Acoes
35300476042,FAN STORE ENTRETENIMENTO S.A.,BARRA BONITA,2,2015,Sociedade por Acoes
35300476051,STA DO BRASIL SISTEMAS DE INFORMCACAO S.A,SAO PAULO,2,2015,Sociedade por Acoes
35300476069,BTGI QUARTZO PARTICIPACOES S.A.,SAO PAULO,2,2015,Sociedade por Acoes
35300476077,JOPAR PARTICIPACOES S.A.,SAO PAULO,2,2015,Sociedade por Acoes
35300476085,EUROPECAS PARTICIPACOES S.A.,ITAQUAQUECETUBA,2,2015,Sociedade por Acoes
35300476093,ZIPAR PARTICIPACOES S.A.,SAO PAULO,2,2015,Sociedade por Acoes
35300476107,VET SMART SOFTWARE S.A,SAO PAULO,2,2015,Sociedade por Acoes
35300476115,FERRARI PARTICIPACOES SOCIETARIAS S/A,PIRASSUNUNGA,2,2015,Sociedade por Acoes
35400170972,COOPERJARI - COOPERATIVA DE TRANSPORTES E SERVICOS,JARINU,2,2015,Cooperativa
35400170981,COOPERATIVA DE TRABALHO DO PROFISSIONAL DE COZINHA - PAO E ARTE,SAO PAULO,2,2015,Cooperativa
35400171731,COOPFIRD COOPERATIVA DOS AGROPECUARISTAS FAMILIAR IRMA DOROTHY,BAURU,2,2015,Cooperativa
35400172495,DOM DIVINO COOPERATIVA DE TRANSPORTE E DOS CARREGADORES E DESCARREGADORES E LOGISTICA EM GERAL DO ESTADO DE SAO P,GUARULHOS,2,2015,Cooperativa
35400173068,COOPERATIVA HABITACIONAL COOHABITARE,LIMEIRA,2,2015,Cooperativa
35400174820,COAFASO - COOPERATIVA DOS AGRICULTORES FAMILIARES DO SUDOESTE - SP,BOTUCATU,2,2015,Cooperativa
35400174838,COOPERATIVA DOS AGRICULTORES FAMILIARES DE ITABERA - COOPERAFAI,ITABERA,2,2015,Cooperativa
35400170972,COOPERJARI - COOPERATIVA DE TRANSPORTES E SERVICOS,JARINU,2,2015,Cooperativa
35400170981,COOPERATIVA DE TRABALHO DO PROFISSIONAL DE COZINHA - PAO E ARTE,SAO PAULO,2,2015,Cooperativa
35400171731,COOPFIRD COOPERATIVA DOS AGROPECUARISTAS FAMILIAR IRMA DOROTHY,BAURU,2,2015,Cooperativa
35400172495,DOM DIVINO COOPERATIVA DE TRANSPORTE E DOS CARREGADORES E DESCARREGADORES E LOGISTICA EM GERAL DO ESTADO DE SAO P,GUARULHOS,2,2015,Cooperativa
35400173068,COOPERATIVA HABITACIONAL COOHABITARE,LIMEIRA,2,2015,Cooperativa
35400174820,COAFASO - COOPERATIVA DOS AGRICULTORES FAMILIARES DO SUDOESTE - SP,BOTUCATU,2,2015,Cooperativa
35400174838,COOPERATIVA DOS AGRICULTORES FAMILIARES DE ITABERA - COOPERAFAI,ITABERA,2,2015,Cooperativa
35500713480,CONSORCIO MHA-DJP,BARUERI,2,2015,Consorcio
35500713498,CONSORCIO FLUID-EDIZA,JUNDIAI,2,2015,Consorcio
35500713501,CONSORCIO MOTOROLA SOLUTIONS RIO DE JANEIRO,SAO PAULO,2,2015,Consorcio
35500713510,CONSORCIO CONSTRUTOR ARARAQUARA- TAUBATE- LOTE 4,BARUERI,2,2015,Consorcio
35500713528,CONSORCIO PLANSERVI/SSF/PARSONS,SAO PAULO,2,2015,Consorcio
35500713536,CONSORCIO CDN/CF,SAO PAULO,2,2015,Consorcio
35500713544,CONSORCIO SONDOTECNICA - GERIBELLO - ECR,SAO PAULO,2,2015,Consorcio
35500713552,CONSORCIO TTBS-ITAQUAQUECETUBA,SAO PAULO,2,2015,Consorcio
35500713561,CONSORCIO NOVA PONTAL,RESTINGA,2,2015,Consorcio
35500713587,CONSORCIO CAR BRASIL,SAO PAULO,2,2015,Consorcio
35500713595,CONSORCIO SUPERVISOR RIBEIRAO PRETO,SAO PAULO,2,2015,Consorcio
35500713609,CONSORCIO SUPERVISOR ITAPETININGA,RIBEIRAO PRETO,2,2015,Consorcio
35500713617,CONSORCIOSAN PEDRO,RIBEIRAO PRETO,2,2015,Consorcio
35500713625,CONSORCIO PRESERVA - EPT,COTIA,2,2015,Consorcio
35500713633,CONSORCIO HIDROCONSULT URBANIZA PROJEL,SAO PAULO,2,2015,Consorcio
35500713641,CONSORCIO SP 143,SAO PAULO,2,2015,Consorcio
35500713650,CONSORCIO BIGNARDI FORONI,JUNDIAI,2,2015,Consorcio
35500713668,CONSORCIO ACCENTURE-DYNATEST GRUPO 2,SAO PAULO,2,2015,Consorcio
35500713676,CONSORCIO ACCENTURE-DYNATEST GRUPO 5,SAO PAULO,2,2015,Consorcio
35500713684,CONSORCIO FARREL EMAIS,SAO JOSE DO RIO PRETO,2,2015,Consorcio
35500713692,CONSORCIO LOPES KALIL E ITAJAI - GRUPO 2,SAO PAULO,2,2015,Consorcio
35500713706,CONSORCIO SESC RIBEIRAO PRETO SIAA HASAA,SAO PAULO,2,2015,Consorcio
35500713714,CONSORCIO VIAS RJ II,OSASCO,2,2015,Consorcio
35500713722,CONSORCIO SP-306,SAO PAULO,2,2015,Consorcio
35500713731,CONSORCIO RENOVA MOINHOS DE VENTO 2,SAO PAULO,2,2015,Consorcio
35500713749,CONSORCIO SGS ENGER-JHE,BARUERI,2,2015,Consorcio
35500713757,CONSORCIO ARC SITRAN PRO - II,SAO PAULO,2,2015,Consorcio
35500713579,ASIANA AIRLINES INC,SAO PAULO,2,2015,Empresa Estrangeira
35500713579,ASIANA AIRLINES INC,SAO PAULO,2,2015,Empresa Estrangeira
35600591441,BRUNO CHRISTIANI SABINO EIRELI,CATANDUVA,2,2015,Armazens Gerais Empresario
35600591459,JOSE FERNANDO FEDOSSI - EIRELI,SAO PAULO,2,2015,Armazens Gerais Empresario
35600591467,HOREM CENTRO DE FORMACAO DE VIGILANTES EIRELI,RIBEIRAO PRETO,2,2015,Armazens Gerais Empresario
35600591475,JOAO CARLOS MINUTTI AR CONDICIONADO EIRELI,CATANDUVA,2,2015,Armazens Gerais Empresario
35600591483,T.I. TRANSPORTES EIRELI,CATANDUVA,2,2015,Armazens Gerais Empresario
35600654353,CAP - X - BIG BAG E SERVICOS ADMINISTRATIVOS EIRELI,AMERICANA,2,2015,Armazens Gerais Empresario
35600654361,R E D SERVICOS EIRELI,PIRACICABA,2,2015,Armazens Gerais Empresario
35600654370,"MARF LOCACAO, AUTOMACAO E MANUTENCAO ELETRICA EIRELI",PIRACICABA,2,2015,Armazens Gerais Empresario
35600654388,STYLO AUTOMOVEIS PIRACICABA EIRELI,PIRACICABA,2,2015,Armazens Gerais Empresario
35600654396,EAEP ENGENHARIA E PERICIA EIRELI,PIRACICABA,2,2015,Armazens Gerais Empresario
35600654400,"PHL COMERCIO, IMPORTACAO E EXPORTACAO DE AERONAVES EIRELI",PIRACICABA,2,2015,Armazens Gerais Empresario
35600654418,CENTRO DE ESTETICA CIDADE ALTA EIRELI,PIRACICABA,2,2015,Armazens Gerais Empresario
35600654426,RRM LOCACAO DE IMOVEIS EIRELI,PIRACICABA,2,2015,Armazens Gerais Empresario
35600654434,COELHO DIAS APOIO ADMINISTRATIVO EIRELI,PIRACICABA,2,2015,Armazens Gerais Empresario
35600654442,STENICO CONTABILIDADE EIRELI,PIRACICABA,2,2015,Armazens Gerais Empresario
35600654451,FOGO NA BRASA RESTAURANTE EIRELI,PIRACICABA,2,2015,Armazens Gerais Empresario
35600654469,AMBIENTE ELETRO MOVEIS EIRELI,PIRACICABA,2,2015,Armazens Gerais Empresario
35600654477,MEGAMASTER TINTAS EIRELI,PIRACICABA,2,2015,Armazens Gerais Empresario
35600654485,SMD - TELEFONIA E ELETRONICA EIRELI,PIRACICABA,2,2015,Armazens Gerais Empresario
35600654493,R&S ASSESSORIA CORRETORA DE SEGUROS - EIRELI,PIRACICABA,2,2015,Armazens Gerais Empresario
35600654507,DELICIAS DA GULA CONFEITARIA EIRELI,PIRACICABA,2,2015,Armazens Gerais Empresario
35600710199,RM VISION CONSULTORIA EMPRESARIAL EIRELI,SANTO ANDRE,2,2015,Armazens Gerais Empresario
35600710202,STAR COMERCIO DE LUMINARIAS - EIRELI,SAO CAETANO DO SUL,2,2015,Armazens Gerais Empresario
35600710211,ROTIEH SERVICOS DE LIMPEZA EIRELI,SAO CAETANO DO SUL,2,2015,Armazens Gerais Empresario
35600710229,QUALYPROD SERVICO DE APOIO ADMINISTRATIVO EIRELI,SAO CAETANO DO SUL,2,2015,Armazens Gerais Empresario
35600710237,GABIGUTO TRANSPORTES E DISTRIBUICAO EIRELI,SAO BERNARDO DO CAMPO,2,2015,Armazens Gerais Empresario
35600710245,ROTIEH SERVICOS DE APOIO A EMPRESAS EIRELI,SAO CAETANO DO SUL,2,2015,Armazens Gerais Empresario
35600710253,VERAS PIZZARIA E RESTAURANTE EIRELI,SAO CAETANO DO SUL,2,2015,Armazens Gerais Empresario
35600710261,DAM DISPLAYS INDUSTRIA E COMERCIO EIRELI,SAO CAETANO DO SUL,2,2015,Armazens Gerais Empresario
35600710270,SONEL SOLUCOES CORPORATIVAS EIRELI,SAO CAETANO DO SUL,2,2015,Armazens Gerais Empresario
35600710288,"PADEIRO INSTALACAO, MANUTENCAO E VENDA DE SISTEMAS DE REFRIGERACAO EIRELI",SAO CAETANO DO SUL,2,2015,Armazens Gerais Empresario
35600710296,MEDUSA BIJOUX INDUSTRIA E COMERCIO DE BIJOUTERIAS EIRELI,SAO CAETANO DO SUL,2,2015,Armazens Gerais Empresario
35600710300,PIETUR - AGENCIA DE VIAGENS E TURISMO - EIRELI,SAO CAETANO DO SUL,2,2015,Armazens Gerais Empresario
35600710318,MEZZO INDUSTRIA DE COSMETICOS EIRELI.,SAO CAETANO DO SUL,2,2015,Armazens Gerais Empresario
35600710326,ITALIA MARKETING EIRELI,SAO CAETANO DO SUL,2,2015,Armazens Gerais Empresario
35600710334,D.R.GIGANTE CONSULTORIA EM TECNOLOGIA EIRELI,SAO CAETANO DO SUL,2,2015,Armazens Gerais Empresario
35600710342,BITBEM TEC COMERCIO IMPORTACAO E EXPORTACAO DE ACESSORIOS EIRELI,SAO PAULO,2,2015,Armazens Gerais Empresario
35600720755,J.C.ARAUJO BORGES EIRELI,LIMEIRA,2,2015,Armazens Gerais Empresario
35600720771,ALEXANDRE RENATO DIBBERN JUNIOR EIRELI,LIMEIRA,2,2015,Armazens Gerais Empresario
35600720780,KUHNE EMPREENDIMENTOS IMOBILIARIOS EIRELI,LIMEIRA,2,2015,Armazens Gerais Empresario
35600720798,BRITOCON TERRAPLENAGEM E TRANSPORTES EIRELI,LIMEIRA,2,2015,Armazens Gerais Empresario
35600720801,LMR CORRETORA DE SEGUROS E ADMINISTRACAO EIRELI,LIMEIRA,2,2015,Armazens Gerais Empresario
35600740535,F & C SOLUCOES LOGISTICAS EIRELI,MOGI DAS CRUZES,2,2015,Armazens Gerais Empresario
35600740543,ALMEIDA - PADARIA E RESTAURANTE EIRELI,MOGI DAS CRUZES,2,2015,Armazens Gerais Empresario
35600740551,D'ANTIGARIA -EIRELI,MOGI DAS CRUZES,2,2015,Armazens Gerais Empresario
35600740560,CLAUDIA ALVES PIZZARIA EIRELI,MOGI DAS CRUZES,2,2015,Armazens Gerais Empresario
35600740578,HIPER ASSESSORIA ADMINISTRATIVA EIRELI,MOGI DAS CRUZES,2,2015,Armazens Gerais Empresario
