NIRE,Empresa,Município,Month,Year,Type
35601628453,GREPO TRANSPORTES EIRELI,PRESIDENTE PRUDENTE,8,2017,Grupo
35601776584,CONECTIUS DO BRASIL EIRELI,PRAIA GRANDE,8,2017,Grupo
35601818694,MARIA S DOS SANTOS EIRELI,ARACATUBA,8,2017,Grupo
35601835149,S M RALILE EIRELI,CARAGUATATUBA,8,2017,Grupo
35601861514,STAR ADMINISTRADORA DE BENS EIRELI,SAO PAULO,8,2017,Grupo
35601884999,L.S. DE CARVALHO MODAS EIRELI,JAGUARIUNA,8,2017,Grupo
35601889257,NOVA ITALIA RESTAURANTE EIRELI,SAO PAULO,8,2017,Grupo
35601943596,"LEIFER COMERCIO,IMPORTACAO E EXPORTACAO DE FERRAMENTAS EIRELI",SAO PAULO,8,2017,Grupo
35601943618,SONHERIA DULCA EIRELI,SAO PAULO,8,2017,Grupo
35601943669,SAO LUIZ HORTIFRUTI EIRELI,SAO PAULO,8,2017,Grupo
35601949641,MCL CHIQUIE HOLDING E ADMINISTRACAO DE BENS EIRELI,SANTO ANDRE,8,2017,Grupo
35601974017,RAYTTI PATRIMONIAL - EIRELI,SAO VICENTE,8,2017,Grupo
35601974327,"ONE DISTRIBUIDORA DE MEDICAMENTOS EIRELI ""EM RECUPERACAO JUDICIAL""",SAO PAULO,8,2017,Grupo
35601974378,VIDA NOVA MERCADO EIRELI,SAO PAULO,8,2017,Grupo
35601974581,ADAPT ENGENHARIA E CONSTRUCOES EIRELI,SAO PAULO,8,2017,Grupo
35601974629,EIXO CONFECCOES EIRELI,SAO PAULO,8,2017,Grupo
35601974785,FLY UP REPRESENTACOES VIAGENS E TURISMO - EIRELI,SAO PAULO,8,2017,Grupo
35601974815,JK YAMAMOTO - EIRELI,DIADEMA,8,2017,Grupo
35601975030,TORINO ADMINISTRACAO DE IMOVEIS EIRELI,SAO PAULO,8,2017,Grupo
35601975099,K.G. COMERCIO E SERVICOS DE TELECOMUNICACOES EIRELI,SAO PAULO,8,2017,Grupo
35601975242,"DAYSHOPPING COMERCIO, REPRESENTACOES & PARTICIPACOES EIRELI",SAO PAULO,8,2017,Grupo
35601975609,ROLLEGANS SERVICOS ADMINISTRATIVOS EIRELI,GUARUJA,8,2017,Grupo
35601975714,GINAST EQUIPAMENTOS MATALURGICOS EIRELI,NOVA ODESSA,8,2017,Grupo
35601983709,"CHARM CONFECCAO, COMERCIO, IMPORTACAO E EXPORTACAO DE ARTIGOS DO VESTUARIO, CALCADOS E ACESSORIOS EIRELI",CAMPOS DO JORDAO,8,2017,Grupo
35601983750,IMINCARDIO SERVICOS MEDICOS EIRELI,SAO BERNARDO DO CAMPO,8,2017,Grupo
35601983873,CONDAL CONTABILIDADE CONSULTORIA E AUDITORIA EIRELI,SAO PAULO,8,2017,Grupo
35630013291,E CAVICHIOLLI COMERCIO DE ROUPAS EIRELI,SAO PAULO,8,2017,Grupo
35630013470,SOLIDA COMERCIO E LOGISTICA EIRELI,SAO PAULO,8,2017,Grupo
35630013551,SUPER V COMERCIO DE PRODUTOS NAUTICOS EIRELI,GUARUJA,8,2017,Grupo
35630013844,CENTRO DE COMBUSTIVEIS VERONA EIRELI,SAO PAULO,8,2017,Grupo
35630013895,ESTANCIA RURAL EVENTOS EIRELI,SOROCABA,8,2017,Grupo
35630014018,ACADIA CONSULTORIA EM GESTAO EIRELI,SAO PAULO,8,2017,Grupo
35630014034,G 3 CONSULTORIA EMPRESARIAL EIRELI,SAO PAULO,8,2017,Grupo
35630014336,SECOND ROAD INVESTIMENTOS E PARTICIPACOES EIRELI,SAO PAULO,8,2017,Grupo
35630014450,TOPA ENGENHARIA E APOIO OPERACIONAL EIRELI,SAO PAULO,8,2017,Grupo
35630014514,LGG IMPERATORI ADMINISTRACAO DE BENS PROPRIOS E PARTICIPACOES EIRELI,IGARATA,8,2017,Grupo
35630014573,J. V. H. CAMURCA CLINICA MEDICA EIRELI,SAO PAULO,8,2017,Grupo
35630014603,NFC SERVICOS EMPRESARIAIS EIRELI,SAO PAULO,8,2017,Grupo
35630014701,PERDIZES CONSULTORIA E ARQUITETURA EIRELI,SAO PAULO,8,2017,Grupo
35630014727,BEST ICE INDUSTRIA E COMERCIO DE GELO EIRELI,SAO PAULO,8,2017,Grupo
35630014824,EDUARDO DE FREITAS SANCHES FEIRANTE EIRELI,SAO PAULO,8,2017,Grupo
35630014913,C.M CONSTRUTORA E LOCACAO DE EQUIPAMENTOS EIRELI,SAO PAULO,8,2017,Grupo
35630015243,ALEXANDRE PEREIRA DOS SANTOS EIRELI,SAO PAULO,8,2017,Grupo
35630015260,IUNGO COMUNICACAO E CONECTIVIDADE EIRELI,SANTO ANDRE,8,2017,Grupo
35630015278,G Z LUCCHESI EIRELI,SAO PAULO,8,2017,Grupo
35630015294,RODATRANS TRANSPORTES DO BRASIL EIRELI,JUNDIAI,8,2017,Grupo
35630015375,TATIANAARATA MARKETING EIRELI,SAO PAULO,8,2017,Grupo
35630015430,GLETEX MASSAS TINTAS EIRELI,SAO PAULO,8,2017,Grupo
35630015502,GCAV SERVICOS ADMNISTRATIVOS - EIRELI,SAO PAULO,8,2017,Grupo
35630015537,PKZ REPARACAO E MANUTENCAO DE COMPUTADORES E DE EQUIPAMENTOS PERIFERICOS EIRELI,SAO PAULO,8,2017,Grupo
35630015561,GSG SPORTS - COMUNICACAO VISUAL & ESPORTIVA - EIRELI,SAO PAULO,8,2017,Grupo
35630015634,MERCADAO DE CARNES BARBOSA DO PARI EIRELI,SAO PAULO,8,2017,Grupo
35630015669,MD INSTALACOES HIDRAULICA E ELETRICA EIRELI,SAO PAULO,8,2017,Grupo
35630015791,NLM SERVICOS DE SERRALHERIA EIRELI,SAO PAULO,8,2017,Grupo
35630015804,PIZZARIA SAGRADA FAMILIA EIRELI,SAO PAULO,8,2017,Grupo
35630015898,PIMENTA DE CHEIRO REFEICOES EIRELI,BERTIOGA,8,2017,Grupo
35630015979,HORUS CLINICA E CIRURGIA OCULAR EIRELI,SAO PAULO,8,2017,Grupo
35630016029,GESTRISK SERVICOS ADMINISTRATIVOS EIRELI,SAO PAULO,8,2017,Grupo
35630016037,REWORKED COMERCIO DE ROUPAS EIRELI,SAO PAULO,8,2017,Grupo
35630016053,MARCELO CARVALHAES DE ANDRADE COLCHOARIA EIRELI,SAO PAULO,8,2017,Grupo
35630016282,RTC SERVICOS ADMINISTRATIVOS EIRELI,SAO PAULO,8,2017,Grupo
35630016339,REGGERE APOIO ADMINISTRATIVO EIRELI,SAO CAETANO DO SUL,8,2017,Grupo
35630016495,CASTRO MONITORAMENTO E TERCEIRIZACOES EIRELI,SAO PAULO,8,2017,Grupo
35630016509,RODOLIMA EXPRESS EIRELI,SAO PAULO,8,2017,Grupo
35630016525,BRAS KOR INTERMEDIACAO EIRELI,SAO PAULO,8,2017,Grupo
35630016533,FRECN COMERCIO DE ACAI EIRELI,SAO PAULO,8,2017,Grupo
35630016746,DIVINO JS IMOVEIS EIRELI,GUARULHOS,8,2017,Grupo
35630016819,CRATOS SERVICOS DE APOIO ADMINISTRATIVO EIRELI,SAO PAULO,8,2017,Grupo
35630017033,A. L. RIBEIRO DA COSTA CONSULTORIA EM QUALIDADE EIRELI,SANTO ANDRE,8,2017,Grupo
35630017173,PARTIARIUS ASSESSORIA EMPRESARIAL EIRELI,PRESIDENTE PRUDENTE,8,2017,Grupo
35630017203,ORTOCASS CLINICA MEDICA EIRELI,SAO PAULO,8,2017,Grupo
35630017327,MMCTEC SOLUCOES EM TECNOLOGIA EIRELI,SAO PAULO,8,2017,Grupo
35630017386,ERHABENN PARTICIPACOES EIRELI,SAO PAULO,8,2017,Grupo
35630017441,MVL PROMOTORA DE VENDAS - EIRELI,SAO PAULO,8,2017,Grupo
35630017521,LAUS DEO EFRAIM SORVETERIA - EIRELI,SAO PAULO,8,2017,Grupo
35630017530,ESPIRAL MOBETA EIRELI,SAO PAULO,8,2017,Grupo
35630017572,ENVIPAT SERVICOS ADMINISTRATIVOS EIRELI,SAO PAULO,8,2017,Grupo
35630017611,ARTCHAN COMERCIO DE ACAI EIRELI,SAO PAULO,8,2017,Grupo
35601812246,PRESIDENTE AUDIO DESIGN - ACESSORIOS EIRELI,ARARAQUARA,8,2017,Grupo
35601880373,L F DARCADIA EIRELI,MOGI-GUACU,8,2017,Grupo
35601932144,REDEDROGALUZ DROGARIAS EIRELI,RIBEIRAO PRETO,8,2017,Grupo
35601935194,"PIRAMIDE CONSTRUCOES, SANEAMENTO E LOCACOES EIRELI",SOROCABA,8,2017,Grupo
35601939416,ROMULUS CORRETORA DE SEGUROS - EIRELI,SAO PAULO,8,2017,Grupo
35601944002,"RV COMERCIO DE ROUPAS,ACESSORIOS E PETSHOP EIRELI",SAO PAULO,8,2017,Grupo
35601948962,SANTANA GAZZITTO IMOVEIS EIRELI,JAGUARIUNA,8,2017,Grupo
35601976257,A GALINHEIRA ROTISSERIA EIRELI,SAO PAULO,8,2017,Grupo
35601976354,RRJ COMERCIO E SERVICOS DE VEICULOS EIRELI,SAO PAULO,8,2017,Grupo
35601976401,DROGARIA TIEZA EIRELI,SAO PAULO,8,2017,Grupo
35601976419,TSA GESTAO DE QUALIDADE - EIRELI,SAO PAULO,8,2017,Grupo
35601976532,AUTO POSTO JARDIM IMPERADOR EIRELI,SAO BERNARDO DO CAMPO,8,2017,Grupo
35601976605,HOXXIS - GESTAO DE SUPRIMENTOS E FABRICACAO DE EMBALAGENS EIRELI,SANTANA DE PARNAIBA,8,2017,Grupo
35601976982,CFF SERVICOS ADMINISTRATIVOS EIRELI.,BARUERI,8,2017,Grupo
35601977326,VIANNA DO BRASIL INDUSTRIA E COMERCIO DE PLASTICOS EIRELI,COTIA,8,2017,Grupo
35601977440,"RWR COMERCIO, INDUSTRIA E REPRESENTACOES DE FERRAMENTAS EIRELI",SAO PAULO,8,2017,Grupo
35601977474,NUCLEO BRASILEIRO DE OBRAS EIRELI,SAO PAULO,8,2017,Grupo
35601977709,VIDA EM PRIMEIRO LUGAR LAR DE IDOSOS EIRELI,SAO JOSE DOS CAMPOS,8,2017,Grupo
35601983938,AQUI TRAVEL AGENCIA DE VIAGENS LTDA.,SAO PAULO,8,2017,Grupo
35601983989,ILUMILUX COMERCIO DE ARTIGOS DE ILUMINACAO EIRELI,SAO PAULO,8,2017,Grupo
35601984047,COMERCIAL VICHIETTI EIRELI,POA,8,2017,Grupo
35601984080,RIE FASHION COMERCIO DE ROUPAS EIRELI,AMERICANA,8,2017,Grupo
35601984101,V. G. PIRES DROGARIA EIRELI,AMERICANA,8,2017,Grupo
35630017751,K.G. NOGUEIRA SOLUCOES ADMINISTRATIVAS EIRELI,SAO PAULO,8,2017,Grupo
35630017815,CONVENIENCIA CAIO MINEIRO EIRELI,SAO PAULO,8,2017,Grupo
35630018099,RM4 COSMETICOS EIRELI,SAO PAULO,8,2017,Grupo
35630018161,KORBAN CINETV EIRELI,SAO PAULO,8,2017,Grupo
35630018340,NOGUI CULINARIA JAPONESA EIRELI,SAO PAULO,8,2017,Grupo
35630018447,DORI ESTACIONAMENTO E LAVA RAPIDO EIRELI,SAO PAULO,8,2017,Grupo
35630018676,M.G. IOCCA SERVICOS EIRELI,SAO PAULO,8,2017,Grupo
35630018692,PESTANA COMERCIO E SERVICOS DE ALIMENTOS EIRELI,SAO PAULO,8,2017,Grupo
35630018714,ENPA PARTICIPACOES EIRELI,SAO PAULO,8,2017,Grupo
35630018722,BIJU DA MANU ACESSORIOS E ARTESANATOS EIRELI,SOROCABA,8,2017,Grupo
35630018749,MM PARTICIPACOES EIRELI,SAO PAULO,8,2017,Grupo
35630018811,LD SHOP COMERCIO DE REFRIGERACAO EIRELI,SAO PAULO,8,2017,Grupo
35630018838,MERCEARIA MEGAMASTER EIRELI,SAO PAULO,8,2017,Grupo
35630018889,EDSON ARIMURA PROMOCAO DE VENDAS EIRELI,BARUERI,8,2017,Grupo
35630018927,LAYARA JEANS EIRELI,SAO PAULO,8,2017,Grupo
35630018986,GHF COMERCIO DE TECIDOS E CONFECCOES EIRELI,SAO PAULO,8,2017,Grupo
35630019010,TDRINKS IMPORTACAO E EXPORTACAO EIRELI,SAO PAULO,8,2017,Grupo
35630019184,CALCIOLARI EMPREENDIMENTOS E PARTICIPACOES - EIRELI,SAO PAULO,8,2017,Grupo
35630019249,MEGA SIST COMERCIO E SERVICOS - EIRELI,SAO PAULO,8,2017,Grupo
35630019257,EUROFIRESHOP COMERCIO E SERVICOS CONTRA INCENDIO EIRELI,SAO PAULO,8,2017,Grupo
35630019460,ARPYIAR DESENVOLVIMENTO HUMANO - EIRELI,SAO PAULO,8,2017,Grupo
35630019486,RDB PARTICIPACOES EIRELI,SAO PAULO,8,2017,Grupo
35630019524,TRANS-SAL BRASIL TRANSPORTES EIRELI,SAO PAULO,8,2017,Grupo
35630019591,SABINO BIJUTERIAS E ACESSORIOS - EIRELI,SAO PAULO,8,2017,Grupo
35630019621,SCIENTIFICA PRODUTOS E COSMETICOS - EIRELI,SAO PAULO,8,2017,Grupo
35630019834,BDB COMERCIO DE RESINAS EIRELI,SAO PAULO,8,2017,Grupo
35630019842,LUMINIKS ILUMINACAO EIRELI,SAO PAULO,8,2017,Grupo
35630019851,CELESTE SERVICOS DE CONSULTORIA EMPRESARIAL EIRELI,SAO PAULO,8,2017,Grupo
35630019974,SORIZZO PRODUCOES ARTISTICAS EIRELI,SAO PAULO,8,2017,Grupo
35630019982,FHS SANTOS REPRESENTACAO COMERCIAL EIRELI,SAO PAULO,8,2017,Grupo
35630020018,RESTAURANTE E MERCEARIA BONI AVELAR - EIRELI,SAO PAULO,8,2017,Grupo
35630020077,FLASH MEDICAL - COMERCIO E SERVICOS DE EQUIPAMENTOS E TECNOLOGIAS EIRELI,SAO PAULO,8,2017,Grupo
35630020093,GRIMALDH EVENTOS EMPRESARIAIS EIRELI,SAO PAULO,8,2017,Grupo
35630020140,SENHOR PAO CONVENIENCIAS - EIRELI,SAO PAULO,8,2017,Grupo
35630020158,ESPACO GUARANI COMERCIO DE MOVEIS EIRELI,SAO PAULO,8,2017,Grupo
35630020581,APRINTBOX COMERCIO DE ACESSORIOS E ELETRONICOS EIRELI,SAO PAULO,8,2017,Grupo
35630020654,RESTAURANTE E MERCEARIA ESTRELA DA COLONIA EIRELI,SAO PAULO,8,2017,Grupo
35630020956,MACAU FOMENTO MERCANTIL - EIRELI,SANTANA DE PARNAIBA,8,2017,Grupo
35630020964,C.A.X.VAN PARTS IMPORTACAO E COMERCIO DE PECAS E ACESSORIOS EIRELI,SAO PAULO,8,2017,Grupo
35630020972,"PACK TUDO EMBALAGENS, REPRESENTACOES E COMERCIO - EIRELI",SAO PAULO,8,2017,Grupo
35630021006,F C B LANCHONETE EIRELI,SAO PAULO,8,2017,Grupo
35630021049,GR COMERCIO DE VEICULOS BATIDOS EIRELI,SAO PAULO,8,2017,Grupo
35630021103,MARA PARKING ESTACIONAMENTOS EIRELI,SAO PAULO,8,2017,Grupo
35630021111,MONTITEL TELECOM EIRELI,SAO PAULO,8,2017,Grupo
35630021341,DISRUPTIV TECHNOLOGIES SERVICOS DE INFORMACAO EIRELI,SAO PAULO,8,2017,Grupo
35630021405,LANCHONETE IBITIRAMA BURGUER EIRELI,SAO PAULO,8,2017,Grupo
35630021456,H. FUTEMA DROGARIA EIRELI,SAO PAULO,8,2017,Grupo
35630021464,RAMALHO ENTRETENIMENTO EIRELI,SAO PAULO,8,2017,Grupo
35630021499,BENITEZ STUDIO BEAUTY HAIR EIRELI,SAO PAULO,8,2017,Grupo
35630021511,"DOMANI - COMERCIO DE ALIMENTOS, EQUIPAMENTOS E ARTIGOS DE USO PESSOAL E DOMESTICO EIRELI",SAO PAULO,8,2017,Grupo
35630021529,CLINICA TORELLI MEDICINA ESTETICA EIRELI,SAO PAULO,8,2017,Grupo
35630021561,SNDS GESTAO DE CONTRATOS EIRELI,SAO PAULO,8,2017,Grupo
35630021596,INOXCON VALVULAS E CONEXOES - EIRELI,SAO PAULO,8,2017,Grupo
35630021600,THE BOX PRODUCOES & EVENTOS EIRELI,SAO PAULO,8,2017,Grupo
35630021626,MATIDA POLITI CINEMATOGRAFIA EIRELI,SAO PAULO,8,2017,Grupo
35630021634,CLINICA ODONTOLOGICA DANTIS EIRELI,COTIA,8,2017,Grupo
35630021651,TECTA CONSTRUCOES E COMERCIO EIRELI,SAO PAULO,8,2017,Grupo
35630021693,MANA REPRESENTACAO COMERCIAL EIRELI,SAO PAULO,8,2017,Grupo
35630021707,NOLASCO SERVICOS MEDICOS EIRELI,SAO PAULO,8,2017,Grupo
35630021910,DBRASIL CORRETORA DE SEGUROS EIRELI,SAO PAULO,8,2017,Grupo
35630022142,MARQUES & CASTILHO ASSESSORIA EMPRESARIAL EIRELI,SAO PAULO,8,2017,Grupo
35630022151,DIEGO JAVIER MARZAL HERNANDEZ EIRELI,SAO PAULO,8,2017,Grupo
35630022177,ARBO SERVICOS E LOCACOES EIRELI,SAO PAULO,8,2017,Grupo
35630022215,META TRANSPORTADORA E MANUTENCAO INDUSTRIAL EIRELI,SAO PAULO,8,2017,Grupo
35630022240,CEMENTO CONSULTORIA E SERVICOS DE OBRAS EIRELI,SAO PAULO,8,2017,Grupo
35630022282,ZAHAV ASSESSORIA EMPRESARIAL E ADMINISTRATIVA EIRELI,SAO PAULO,8,2017,Grupo
35630022355,DRUKEN PRINT SOLUCOES EM TECNOLOGIA EIRELI,SAO PAULO,8,2017,Grupo
35630022398,SINHA CAFETERIA EIRELI,SAO PAULO,8,2017,Grupo
35630079667,K.I.O. ENGENHARIA EIRELI,SAO PAULO,8,2017,Grupo
35601812301,KYTO TECNOLOGIA EIRELI,RIBEIRAO PRETO,8,2017,Grupo
35601818929,A G SERVICOS DE PORTARIA E LIMPEZA EIRELI,ARACATUBA,8,2017,Grupo
35601818988,HIDRAU AGRO PECAS HIDRAULICAS E AGRICOLAS EIRELI,ARACATUBA,8,2017,Grupo
35601847368,BRASIL LOGISTICA EIRELI,MOGI DAS CRUZES,8,2017,Grupo
35601885154,EMPREENDIMENTO IMOBILIARIO CAMARGO NETO - SPE - EIRELI,JAGUARIUNA,8,2017,Grupo
35601911546,REPLAST COMERCIO E REPRESENTACOES COMERCIAIS DE MATERIA PRIMA PLASTICA EIRELI,PIRACICABA,8,2017,Grupo
35601939726,"DMINNI REPRESENTACAO COMERCIAL EIRELI ""INABILITADA PARA EXERCER ATIVIDADE EMPRESARIAL""",BARUERI,8,2017,Grupo
35601944070,MBOARDS INFORMATICA - EIRELI,SAO PAULO,8,2017,Grupo
35601963015,"SIMEIRA PARTICIPACOES SOCIETARIAS EIRELI - ""EM RECUPERACAO JUDICIAL"".",ITU,8,2017,Grupo
35601977822,CONSUL QUADRAS COMERCIO E CONTRUCAO EIRELI,SAO PAULO,8,2017,Grupo
35601978063,3SC PRESTACAO DE SERVICOS DE MAO DE OBRA PARA ENSINO EIRELI,SAO CAETANO DO SUL,8,2017,Grupo
35601978217,RBO COMUNICACAO VISUAL - EIRELI,TABOAO DA SERRA,8,2017,Grupo
35601978241,S.E COMERCIO DE MOVEIS PLANEJADOS EXP. E IMP. ERELI,ITAPEVI,8,2017,Grupo
35601984284,STMBIT EXCHANGE SERVICOS DIGITAIS EIRELI,COTIA,8,2017,Grupo
35602008645,POSTO DE COMBUSTIVEIS ADVF EIRELI,SAO PAULO,8,2017,Grupo
35630022533,VIMANA CONSTRUCOES E INCORPORACOES EIRELI,SAO PAULO,8,2017,Grupo
35630022631,TRINITY COMERCIO DE VESTUARIOS EIRELI,SAO PAULO,8,2017,Grupo
35630022835,A3 COMERCIO DE SUPLEMENTOS EIRELI,SAO PAULO,8,2017,Grupo
35630022941,PEG COMERCIO DE PRODUTOS DE INFORMATICA E ELETRONICOS EM GERAL EIRELI,SAO PAULO,8,2017,Grupo
35630022991,GIANCARLO BASTOS FERNANDES EIRELI,SAO PAULO,8,2017,Grupo
35630023076,7 F2 SERVICOS DE CONSULTORIA EIRELI,SAO PAULO,8,2017,Grupo
35630023173,RECANTO DOS SABORES GRILL EIRELI,SAO PAULO,8,2017,Grupo
35630023190,ADEGA ARAUJO COMERCIAL DE BEBIDAS EIRELI,SAO PAULO,8,2017,Grupo
35630023203,PINGUA ADMINISTRACAO DE BENS E PARTICIPACOES EIRELI,SAO PAULO,8,2017,Grupo
35630023211,GIOLO CONSULTORIA CONTABIL EIRELI,SAO PAULO,8,2017,Grupo
35630023254,COIMBRA SP INDUSTRIA E COMERCIO EIRELI,SAO PAULO,8,2017,Grupo
35630023386,ELOVITA SUPLEMENTOS ALIMENTARES EIRELI,CAMPINAS,8,2017,Grupo
35630023394,NAMASTE SERRA DA CANASTRA GESTAO E INTERMEDIACAO DE NEGOCIOS EIRELI,SAO PAULO,8,2017,Grupo
35630023408,TRE AMICI CONFECCOES EIRELI,SAO PAULO,8,2017,Grupo
35630023467,RHGS SERVICOS MEDICOS - EIRELI,SAO PAULO,8,2017,Grupo
35630023653,M PEREIRA COMERCIAL EIRELI,SAO PAULO,8,2017,Grupo
35630023718,GLAUCO SANTOS CORRETORA DE SEGUROS EIRELI,SAO PAULO,8,2017,Grupo
35630023734,NM2 CONSULTORIA DE NEGOCIOS - EIRELI,SAO PAULO,8,2017,Grupo
35630023769,CADEO ODONTOLOGIA EIRELI,SAO PAULO,8,2017,Grupo
35630023831,AJS SILVEIRA TRANSPORTES EIRELI,OSASCO,8,2017,Grupo
35630023912,SH GUIMARAES MERCADO EIRELI,SAO PAULO,8,2017,Grupo
35630024056,HUMANIZONG SERVICOS E ATENDIMENTOS EIRELI,BARUERI,8,2017,Grupo
35630024081,DEAL HOLDING E PARTICIPACOES EIRELI,SAO PAULO,8,2017,Grupo
35630024102,DLMA SOLUCOES EM INFORMATICA EIRELI,SAO PAULO,8,2017,Grupo
35630024129,RUFINO INDUSTRIA DE EMBALAGENS EIRELI,SAO PAULO,8,2017,Grupo
35630024145,"MDX COMERCIO DE ARTIGOS DE VESTUARIO,COSMETICOS E ELETRONICOS EIRELI",MAUA,8,2017,Grupo
35630024218,ENCORE EVENTOS EIRELI,SAO PAULO,8,2017,Grupo
35630024331,LUANUIT ACESSORIOS EIRELI,SAO PAULO,8,2017,Grupo
35630024366,RODAS LL COMERCIO DE ACESSORIOS PARA VEICULOS EIRELI,SAO PAULO,8,2017,Grupo
35630024382,BLOMMA COSMETICOS EIRELI,GUARULHOS,8,2017,Grupo
35630024510,EXCALIBUR LOCACAO DE ESPACO E EQUIPAMENTOS PARA GINASTICA EIRELI,SAO PAULO,8,2017,Grupo
35630024544,C. HOBO BRAND EIRELI,SAO PAULO,8,2017,Grupo
35630024587,LEONARDO LOUSADA DE SOUZA - EIRELI,SOROCABA,8,2017,Grupo
35630024617,Z FANG EIRELI,SAO PAULO,8,2017,Grupo
35630024706,PLANETA BIG COMERCIAL EIRELI,SAO PAULO,8,2017,Grupo
35630024781,ELN9 BUSINESS CONSULTING - EIRELI,SAO PAULO,8,2017,Grupo
35630024820,AEJ VALE CONSTRUCOES EIRELI,SAO PAULO,8,2017,Grupo
35630024846,CONENS CONSULTORIA EDUCACIONAL EIRELI,SAO PAULO,8,2017,Grupo
35630024871,VALLOP COMERCIO DE PELUCIAS E SOUVENIRS - EIRELI,SAO PAULO,8,2017,Grupo
35630024919,SONOPLASTICO PRODUCAO DE AUDIO EIRELI,SAO PAULO,8,2017,Grupo
35630024927,TO GET CONVENIENCIA - EIRELI,SAO PAULO,8,2017,Grupo
35630024978,J K AUTOMOTIVE DISTRIBUIDORA DE AUTOPECAS EIRELI,SAO PAULO,8,2017,Grupo
35630025028,SAVE CAPITAL AGENTE AUTONOMO DE INVESTIMENTO - EIRELI,SAO PAULO,8,2017,Grupo
35630025117,ZZ CONSULTORIA E PROJETOS EIRELI,SAO PAULO,8,2017,Grupo
35630025125,CL BIOMEDICAL ATIVIDADES BIOMEDICAS EIRELI,SAO PAULO,8,2017,Grupo
35630025168,J.D. ASSESSORIA EM COMERCIO ELETRONICO EIRELI,SAO PAULO,8,2017,Grupo
35630025486,ATM CLIMATIZACAO & REFRIGERACAO EIRELI,SAO PAULO,8,2017,Grupo
35630025591,DISP COMERCIAL EIRELI,SAO PAULO,8,2017,Grupo
35630025613,DIAMONI MODAS EIRELI,SAO PAULO,8,2017,Grupo
35630025648,BINYAPI FOODS IMPORTACAO E EXPORTACAO DE PRODUTOS ALIMENTICIOS EIRELI,SAO PAULO,8,2017,Grupo
35630025702,SGI SECURITIZADORA E CONSULTORIA FINANCEIRA EIRELI,SAO PAULO,8,2017,Grupo
35630025800,BURGUERVILLE E BAR 741 EIRELI,SAO PAULO,8,2017,Grupo
35630025826,BURITI CONVENIENCIA EIRELI,SAO PAULO,8,2017,Grupo
35630025842,CATARINA DE LIMA SERVICOS DOSMETICOS EIRELI,SAO PAULO,8,2017,Grupo
35630025885,UP BUSINESS - HOLDING INVESTIMENTOS EIRELI.,SAO PAULO,8,2017,Grupo
35630025893,"WTS COMERCIO DE TRAJES EIRELI ""INABILITADA PARA EXERCER ATIVIDADE EMPRESARIAL""",SAO PAULO,8,2017,Grupo
35630025907,SZLEZ PARTICIPACOES EIRELI,SAO PAULO,8,2017,Grupo
35630025915,UDEINVENT COMERCIO E SERVICOS EIRELI,SAO PAULO,8,2017,Grupo
35630025923,NEW LINE TRANSPORTES INTERNACIONAIS EIRELI,SAO PAULO,8,2017,Grupo
35601812360,DPA ARARAQUARA EIRELI,ARARAQUARA,8,2017,Grupo
35601818988,HIDRAU AGRO PECAS HIDRAULICAS E AGRICOLAS EIRELI,ARACATUBA,8,2017,Grupo
35601861794,EMPREITEIRA DE OBRAS VALE DO RIO PARDO EIRELI,IBITINGA,8,2017,Grupo
35601963287,SCHIMING PROMOCAO DE VENDAS E TRANSPORTES EIRELI,SOROCABA,8,2017,Grupo
35602008645,POSTO DE COMBUSTIVEIS ADVF EIRELI,SAO PAULO,8,2017,Grupo
35602008955,WS DO BRASIL INDUSTRIA E COMERCIO EIRELI,SAO PAULO,8,2017,Grupo
35602009102,U.S.A. IMPORTS VARIEDADES EIRELI,ITAPORANGA,8,2017,Grupo
35630025486,ATM CLIMATIZACAO & REFRIGERACAO EIRELI,SAO PAULO,8,2017,Grupo
35630025591,DISP COMERCIAL EIRELI,SAO PAULO,8,2017,Grupo
35630025613,DIAMONI MODAS EIRELI,SAO PAULO,8,2017,Grupo
35630025648,BINYAPI FOODS IMPORTACAO E EXPORTACAO DE PRODUTOS ALIMENTICIOS EIRELI,SAO PAULO,8,2017,Grupo
35630025702,SGI SECURITIZADORA E CONSULTORIA FINANCEIRA EIRELI,SAO PAULO,8,2017,Grupo
35630025800,BURGUERVILLE E BAR 741 EIRELI,SAO PAULO,8,2017,Grupo
35630025826,BURITI CONVENIENCIA EIRELI,SAO PAULO,8,2017,Grupo
35630025842,CATARINA DE LIMA SERVICOS DOSMETICOS EIRELI,SAO PAULO,8,2017,Grupo
35630025885,UP BUSINESS - HOLDING INVESTIMENTOS EIRELI.,SAO PAULO,8,2017,Grupo
35630025893,"WTS COMERCIO DE TRAJES EIRELI ""INABILITADA PARA EXERCER ATIVIDADE EMPRESARIAL""",SAO PAULO,8,2017,Grupo
35630025907,SZLEZ PARTICIPACOES EIRELI,SAO PAULO,8,2017,Grupo
35630025915,UDEINVENT COMERCIO E SERVICOS EIRELI,SAO PAULO,8,2017,Grupo
35630025923,NEW LINE TRANSPORTES INTERNACIONAIS EIRELI,SAO PAULO,8,2017,Grupo
35630026202,SOUZA DISTRIBUIDORA DE AGUA MINERAL - EIRELI,GUARULHOS,8,2017,Grupo
35630026326,V S M MOVEIS EIRELI,SAO PAULO,8,2017,Grupo
35630026342,X-TUR VIAGENS E TURISMO EIRELI,SAO PAULO,8,2017,Grupo
35630026369,100% ATACADAO DO OLEO FILTROS E LUBRIFICANTES EIRELI,SAO PAULO,8,2017,Grupo
35630026377,NOVA DESTAKE SERVICOS EIRELI,MAIRIPORA,8,2017,Grupo
35630026423,PASTORE PARTICIPACAO EIRELI,SAO PAULO,8,2017,Grupo
35630026466,RNB E SOARES COMERCIAL EIRELI,SAO PAULO,8,2017,Grupo
35630026504,RCAC COMERCIO DE ALIMENTOS - EIRELI,DIADEMA,8,2017,Grupo
35630026547,VERIDIANA COSTA ANDRIOLI EIRELI,SAO PAULO,8,2017,Grupo
35630027900,FABRICA ACAI MAGNIFICO EIRELI,SAO PAULO,8,2017,Grupo
35601940589,MOVEIS TAUBATE EIRELI,TAUBATE,8,2017,Grupo
35601994590,WRJ TRANSPORTES E LOGISTICA EIRELI,GUARULHOS,8,2017,Grupo
35601994743,F.K. SILVA LOGISTICA E TRANSPORTE EIRELI,DIADEMA,8,2017,Grupo
35601999214,GODOI EDUCACIONAL PARTICIPACOES EIRELI,SAO PAULO,8,2017,Grupo
35602009331,MFH SERVICOS DE TRANSPORTES EIRELI,SAO BERNARDO DO CAMPO,8,2017,Grupo
35602009501,ENIR DE OLIVEIRA SODRE EIRELI,SAO PAULO,8,2017,Grupo
35602009544,LOCSOLO LOCADORA DE EQUIPAMENTOS EIRELI,CAMPINAS,8,2017,Grupo
35602009811,TRAD - COMERCIO E SERVICOS EIRELI,SAO PAULO,8,2017,Grupo
35602009846,DIEGO LOPES DROGARIAS EIRELI,URUPES,8,2017,Grupo
35602010038,R.R.B CONSULT EXPRESS EIRELI,SAO JOSE DO RIO PRETO,8,2017,Grupo
35602010143,"C.R.A. CAFERO EIRELI ""INABILITADA PARA EXERCER ATIVIDADE EMPRESARIAL""",SAO PAULO,8,2017,Grupo
35602010488,N. M. MARUTANI - CONSTRUCAO CIVIL - EIRELI,BRAGANCA PAULISTA,8,2017,Grupo
35602010691,NEW JOB COMUNICACAO - EIRELI,SAO PAULO,8,2017,Grupo
35602010798,"METALMAR COMERCIO,RECUPERACAO, MANUTENCAO E INSPECAO DE EQUIPAMENTOS EIRELI",SANTOS,8,2017,Grupo
35630026687,TTM COMERCIO VAREJISTA DE BOLSAS E SAPATOS - EIRELI,SAO PAULO,8,2017,Grupo
35630026920,FINE JOB SERVICOS ADMINISTRATIVOS EIRELI,SAO PAULO,8,2017,Grupo
35630026962,DECORAI FESTA - EIRELI,SAO PAULO,8,2017,Grupo
35630027136,MARQS TV MIDIA EIRELI,SAO PAULO,8,2017,Grupo
35630027144,SERRALHERIA FECH-INOX - SERVICOS DE INSTALACAO E MANUTENCAO - EIRELI,SAO PAULO,8,2017,Grupo
35630027195,RUSSO SERVICOS LIVRARIA PAPELARIA DISTRIBUIDORA EIRELI,SAO PAULO,8,2017,Grupo
35630027209,VILLAR CORRETORA DE SEGUROS - EIRELI,SAO PAULO,8,2017,Grupo
35630027217,TUCA FUCA EIRELI,SAO PAULO,8,2017,Grupo
35630027225,CLINICA STUDIO ORALL - EIRELI,SAO PAULO,8,2017,Grupo
35630027276,DAM DIGITAL PRINT - EIRELI,SAO PAULO,8,2017,Grupo
35630027438,TOTY BABY CONFECCOES E ACESSORIOS EIRELI,SAO PAULO,8,2017,Grupo
35630027560,NUCLEO DE ENSINO SAO MIGUEL PAULISTA EIRELI,SAO PAULO,8,2017,Grupo
35630027578,MHY EMPREENDIMENTOS E NEGOCIOS IMOBILIARIOS EIRELI,SAO PAULO,8,2017,Grupo
35630027594,POKAN MONTAGENS DE ESTRUTURAS PRE-FABRICADAS EIRELI,TABOAO DA SERRA,8,2017,Grupo
35630027641,PMX CONSULTORIA DE NEGOCIOS E CORRETORA DE SEGUROS - EIRELI,SAO CAETANO DO SUL,8,2017,Grupo
35630027667,SCL COMERCIO DE ARTIGOS DO VESTUARIO E ACESSORIOS EIRELI,SAO PAULO,8,2017,Grupo
35630027802,OW CONSULTORIA EIRELI,SAO PAULO,8,2017,Grupo
35630027811,GENA EMPORIO DE CARNES EIRELI,SAO PAULO,8,2017,Grupo
35630027951,SOARES PLASTICOS EIRELI,SAO PAULO,8,2017,Grupo
35630027993,TEFITE LANCHONETE RESTAURANTE E MERCEARIA COMERCIO DE ALIMENTOS EIRELI,SAO PAULO,8,2017,Grupo
35630028001,LTJ COMERCIO DE ARTIGOS RECREATIVOS EIRELI,SAO PAULO,8,2017,Grupo
35630028027,MOVIMENTO ESPECIAL EIRELI,SAO PAULO,8,2017,Grupo
35630028035,PRISCILA CORR A DA FONSECA ADMINISTRACAODE BENS EIRELI,SAO PAULO,8,2017,Grupo
35630028060,EPAVAO PARTICIPACOES - EIRELI,SAO PAULO,8,2017,Grupo
35630028094,ATMEN SOLUCOES EM GESTAO EMPRESARIAL EIRELI,SAO PAULO,8,2017,Grupo
35630028264,FIL CAMERON PROPAGANDA - EIRELI,SAO PAULO,8,2017,Grupo
35630028329,RS JUNHIOR SERVICOS MEDICOS - EIRELI,SAO PAULO,8,2017,Grupo
35630028400,BRAINS&BYTES CONSULTORIA DE TRANSFORMACAO EMPRESARIAL EIRELI,SAO PAULO,8,2017,Grupo
35630028426,COMERCIAL DE TINTAS VOTUPOCA EIRELI,SAO PAULO,8,2017,Grupo
35630028469,TCM CONSULTORIA EM GESTAO EMPRESARIAL - EIRELI,SAO PAULO,8,2017,Grupo
35630028477,BITTI ACESSORIOS PARA O VESTUARIO EIRELI,SAO PAULO,8,2017,Grupo
35630028515,SAT REPRESENTACOES COMERCIAIS EIRELI,SANTO ANDRE,8,2017,Grupo
35630028523,DRC LOCACOES DE MAQUINAS EIRELI,SAO PAULO,8,2017,Grupo
35630028744,MAMACA COMERCIO DE CHOCOLATES EIRELI,SAO PAULO,8,2017,Grupo
35630028850,LCF APOIO ADMINISTRATIVO E CONSULTORIA EMPRESARIAL EIRELI,SAO PAULO,8,2017,Grupo
35630028876,SUB RIVIEIRA EIRELI,SAO PAULO,8,2017,Grupo
35630028892,PARTNER ASSESSORIA E COBRANCA EMPRESARIAL EIRELI,SAO PAULO,8,2017,Grupo
35630029198,SANTORINI ELETRONICOS EIRELI,SAO PAULO,8,2017,Grupo
35630029341,C.R.L. COMERCIO DE METAIS EIRELI,BARUERI,8,2017,Grupo
35630029406,DANUBIO SISTEMAS INTEGRADOS EM TELECOMUNICACOES EIRELI,SAO PAULO,8,2017,Grupo
35630029422,GONCALVES EMPRESTIMOS E SOLUCOES FINANCEIRAS - EIRELI,SAO BERNARDO DO CAMPO,8,2017,Grupo
35630029686,GAZZ- MUNHOES COMERCIO DE ALIMENTOS EIRELI,SAO PAULO,8,2017,Grupo
35630029724,HUNDRED LIMIT EIRELI,SAO PAULO,8,2017,Grupo
35630029741,ENV SERVICOS E SOLUCOES EM INFORMATICA EIRELI,SAO PAULO,8,2017,Grupo
35630029821,LRG ADMINISTRACAO E PARTICIPACAO EIRELI,SAO PAULO,8,2017,Grupo
35630029899,NEWSERV GESTAO EM SERVICOS PREDIAIS EIRELI,SAO PAULO,8,2017,Grupo
35630030005,AA & DD REPRESENTACAO COMERCIAL EIRELI,SAO PAULO,8,2017,Grupo
35630030030,BV GRILL EIRELI,SAO PAULO,8,2017,Grupo
35630030081,H A M COMERCIO E CONFECCAO EIRELI,SAO PAULO,8,2017,Grupo
35630030099,PARAISO DA REPUBLICA COSMETICOS - EIRELI,SAO PAULO,8,2017,Grupo
35630030111,AMORE MIO PET SHOP EIRELI,SAO PAULO,8,2017,Grupo
35630030200,HORTIFRUTI VIEIRA DE MORAIS - EIRELI,SAO PAULO,8,2017,Grupo
35630030285,VANUBIA P. DA SILVA EIRELI,SAO PAULO,8,2017,Grupo
35630030331,CASA DO ELEFANTE COR DE ROSA EVENTOS EIRELI,SAO PAULO,8,2017,Grupo
35630030340,BEST ALIMENTOS - EIRELI,SAO PAULO,8,2017,Grupo
35630030382,TRANSCARGO BRASIL TRANSPORTES E LOGISTICA EIRELI,SAO PAULO,8,2017,Grupo
35630030391,PIZZARIA E HAMBURGUERIA PEICHIM EIRELI,SAO PAULO,8,2017,Grupo
35630030625,MURANO IMPORTADORA E EXPORTADORA DE CORRELATOS EIRELI,SAO PAULO,8,2017,Grupo
