NIRE,Empresa,Município,Month,Year,Type
35630017181,ELTEK NOBREKS E SISTEMAS DE ENERGIA - EIRELI,SAO PAULO,8,2017,Armazens Gerais Empresario
35630017211,ICE LUCY COMERCIO DE GELO E CARVAO EIRELI,SAO PAULO,8,2017,Armazens Gerais Empresario
35630017246,NSC SERVICOS ADMINISTRATIVOS - EIRELI,SAO PAULO,8,2017,Armazens Gerais Empresario
35630017254,HVGALLO ARMARINHOS E MARKETING EIRELI,SAO PAULO,8,2017,Armazens Gerais Empresario
35630017262,TOPPER SERVICOS EM TECNOLOGIA DA INFORMACAO EIRELI,SAO PAULO,8,2017,Armazens Gerais Empresario
35630017289,PEREIRA E GAMERO CENTRO DE ESTETICA CORPORAL FACIAL EIRELI,SAO PAULO,8,2017,Armazens Gerais Empresario
35630017297,FACE GABINETE DE ARTES LTDA EIRELI,SAO PAULO,8,2017,Armazens Gerais Empresario
35630017301,HOTEI SUSHI EIRELI,BARUERI,8,2017,Armazens Gerais Empresario
35630017343,NOVO HORIZONTE TERCEIRIZACAO DE SERVICOS EIRELI,SAO PAULO,8,2017,Armazens Gerais Empresario
35630017351,JPC COMERCIO DE UTILIDADES DOMESTICAS E CERTIFICADORA DIGITAL EIRELI,SAO PAULO,8,2017,Armazens Gerais Empresario
35630017360,LM COBRANCA E INFORMACOES CADASTRAIS EIRELI,SAO PAULO,8,2017,Armazens Gerais Empresario
35630017378,XIS IMPORTACAO E EXPORTACAO DE EMBALAGENS EIRELI,BARUERI,8,2017,Armazens Gerais Empresario
35630017408,SAMOS ARABIC FOOD EIRELI,SAO PAULO,8,2017,Armazens Gerais Empresario
35630017424,L & Z MODAS COMERCIO DE PRESENTES EIRELI,SAO PAULO,8,2017,Armazens Gerais Empresario
35630017513,C J TECNICA MANUTENCAO E SERVICOS EIRELI,ITUPEVA,8,2017,Armazens Gerais Empresario
35630017581,LOPES SOLUCOES EM CREDITO EIRELI,SAO PAULO,8,2017,Armazens Gerais Empresario
35630079462,LTR REPRESENTACOES EIRELI,SAO PAULO,8,2017,Armazens Gerais Empresario
35601196464,TITANIUM - COMERCIO DE MATERIAIS MEDICOS E CIRURGICOS EIRELI,SAO CAETANO DO SUL,8,2017,Armazens Gerais Empresario
35601196472,GDA GRAFICA & DESIGN EIRELI,SAO BERNARDO DO CAMPO,8,2017,Armazens Gerais Empresario
35601628470,L D COMERCIO DE PRODUTOS AGROPECUARIOS EIRELI,PRESIDENTE PRUDENTE,8,2017,Armazens Gerais Empresario
35601628488,CLINICA OTORRINO E FACE NAKATA EIRELI,PRESIDENTE VENCESLAU,8,2017,Armazens Gerais Empresario
35601630202,KLIGHT COMERCIO E IMPORTACAO EIRELI,PALMITAL,8,2017,Armazens Gerais Empresario
35601630211,SANTA MARTA CENTRO AUTOMOTIVO - EIRELI,GARCA,8,2017,Armazens Gerais Empresario
35601630229,CELIA HERMINIA MORCELLI DOS ANJOS EIRELI,TUPA,8,2017,Armazens Gerais Empresario
35601630237,ASIMAQ MANUTENCAO DE MAQUINAS INDUSTRIAIS EIRELI,MARILIA,8,2017,Armazens Gerais Empresario
35601630245,A. DALCIN JUNIOR CORRETORA DE SEGUROS EIRELI,TAGUAI,8,2017,Armazens Gerais Empresario
35601630253,SQUADRO SERVICOS DE REDES EIRELI,MARILIA,8,2017,Armazens Gerais Empresario
35601630261,ANTONIO MADE COMERCIO DE COSMETICOS EIRELI,SAO PAULO,8,2017,Armazens Gerais Empresario
35601630270,CEDNET PROVEDOR DE INTERNET EIRELI,CHAVANTES,8,2017,Armazens Gerais Empresario
35601630288,CEDNET SERVICOS DE INTERNET EIRELI,OURINHOS,8,2017,Armazens Gerais Empresario
35601642791,ULTRAPAN COMERCIO ATACADISTA DE PRODUTOS ALIMENTICIOS EIRELI,OURINHOS,8,2017,Armazens Gerais Empresario
35601745883,IDEAL MOVEIS PLANEJADOS EIRELI,PRESIDENTE PRUDENTE,8,2017,Armazens Gerais Empresario
35601776606,CONNECT PARTICIPACOES SOCIETARIAS E EMPREENDIMENTOS IMOBILIARIOS EIRELI,SANTOS,8,2017,Armazens Gerais Empresario
35601776614,FGS LOGISTICA ADUANEIRA EIRELI,SAO VICENTE,8,2017,Armazens Gerais Empresario
35601776622,TORRES CONSULTING - GESTAO EMPRESARIAL EIRELI,SANTOS,8,2017,Armazens Gerais Empresario
35601776631,M. MARQUES MATERIAIS PARA ACABAMENTO EIRELI,SANTOS,8,2017,Armazens Gerais Empresario
35601776649,VISION TWENTY THREE IMPORTACAO E EXPORTACAO EIRELI,CUBATAO,8,2017,Armazens Gerais Empresario
35601776657,REAL PROFIT COMERCIO E IMPORTACAO E EXPORTACAO GEMAS E METAIS PRECIOSOS,PRAIA GRANDE,8,2017,Armazens Gerais Empresario
35601776665,RESTAURANTE & SUSHI BAR PARCEL 27 EIRELI,BERTIOGA,8,2017,Armazens Gerais Empresario
35601776673,P.V.J. SANTOS COMERCIO LTDA,BERTIOGA,8,2017,Armazens Gerais Empresario
35601776681,SABOR DA ITALIA EIRELI,PRAIA GRANDE,8,2017,Armazens Gerais Empresario
35601776690,PORT IMPEX LOGISTICA INTEGRADA EIRELI,SANTOS,8,2017,Armazens Gerais Empresario
35601776703,JF RIBEIRO - EIRELI,SANTOS,8,2017,Armazens Gerais Empresario
35601776711,RTS INFORMATICA EIRELI,GUARUJA,8,2017,Armazens Gerais Empresario
35601776720,COUTINHO B&B - EIRELI,SANTOS,8,2017,Armazens Gerais Empresario
35601776738,JS CAMPOS CORRETORA DE SEGUROS - EIRELI,BERTIOGA,8,2017,Armazens Gerais Empresario
35601776746,MAJU SANTANA EIRELI,SANTOS,8,2017,Armazens Gerais Empresario
35601779010,MIVAN PARCERIA COMERCIO DE ROUPAS E ACESSORIOS - EIRELI,SANTOS,8,2017,Armazens Gerais Empresario
35601779028,BIOSINTESE LOCACAO DE SERVICOS HOSPITALARES E PRODUTOS MEDICOS - EIRELI,SANTOS,8,2017,Armazens Gerais Empresario
35601779036,MENDES PROMOCAO DE VENDAS EIRELI,SAO VICENTE,8,2017,Armazens Gerais Empresario
35601779044,F.C. DOS SANTOS ALMEIDA - LANCHES EIRELI,CUBATAO,8,2017,Armazens Gerais Empresario
35601779052,ZELAR CASA DE IDOSOS EIRELI,GUARUJA,8,2017,Armazens Gerais Empresario
35601779061,TOMBO GUINCHO AUTO SOCORRO EIRELI,GUARUJA,8,2017,Armazens Gerais Empresario
35601779079,SETTE ARMAZENAGEM E LOGISTICA EIRELI,SANTOS,8,2017,Armazens Gerais Empresario
35601807919,CARLOS TOSTI TRANSPORTES EIRELI,FRANCA,8,2017,Armazens Gerais Empresario
35601807927,LOGISTICA & TRANSPORTES SANTA MONICA EIRELI,FRANCA,8,2017,Armazens Gerais Empresario
35601807935,ZAGO EMPREENDIMENTOS IMOBILIARIOS EIRELI,FRANCA,8,2017,Armazens Gerais Empresario
35601807943,RODINEI DE SOUSA NASCIMENTO EIRELI,SAO JOAQUIM DA BARRA,8,2017,Armazens Gerais Empresario
35601807951,THR CORRETAGEM DE CONSORCIOS EIRELI,PATROCINIO PAULISTA,8,2017,Armazens Gerais Empresario
35601807960,WEBMIC COMERCIO E SERVICOS EIRELI,FRANCA,8,2017,Armazens Gerais Empresario
35601807978,FLAVIA F. BARBOSA - EIRELI,FRANCA,8,2017,Armazens Gerais Empresario
35601807986,PATRICIA TREM BAO RESTAURANTE EIRELI,FRANCA,8,2017,Armazens Gerais Empresario
35601807994,J B OZORIO EIRELI,ITAI,8,2017,Armazens Gerais Empresario
35601808001,RENATO JOSE DE CARVALHO EIRELI,MOGI-GUACU,8,2017,Armazens Gerais Empresario
35601808320,KOQUINI CALCADOS EIRELI,ARACATUBA,8,2017,Armazens Gerais Empresario
35601808338,COLEGIO CRISTAO SEMENTINHAS EIRELI,ARACATUBA,8,2017,Armazens Gerais Empresario
35601808346,TRANSCANAVIEIRO TRANSPORTES EIRELI,BARBOSA,8,2017,Armazens Gerais Empresario
35601808354,DIRECT COUNT CONSULTORIA ASSESSORIA E CONTABILIDADE EMPRESARIAL EIRELI,AURIFLAMA,8,2017,Armazens Gerais Empresario
35601808362,MARCIA REGINA ARAUJO ZAPATA EIRELI,LUIZIANIA,8,2017,Armazens Gerais Empresario
35601808371,C R GIMENEZ VEICULOS EIRELI,PENAPOLIS,8,2017,Armazens Gerais Empresario
35601808389,JOSE CARLOS B. CASTILHO EIRELI,ARACATUBA,8,2017,Armazens Gerais Empresario
35601808397,JOAO HENRIQUE ANDRADE DOS SANTOS EIRELI,PROMISSAO,8,2017,Armazens Gerais Empresario
35601808401,CAFE BLACK ARACATUBA EIRELI,ARACATUBA,8,2017,Armazens Gerais Empresario
35601812254,DAY BY DAY RESTAURANTS EIRELI,MATAO,8,2017,Armazens Gerais Empresario
35601812262,PAIOL DA TERRA PRODUTOS ALIMENTICIOS ORG NICOS EIRELI,IBITINGA,8,2017,Armazens Gerais Empresario
35601812271,MBG - TELECOM EIRELI,ITAPOLIS,8,2017,Armazens Gerais Empresario
35601812289,KM3 TRANSPORTES EIRELI,SAO CARLOS,8,2017,Armazens Gerais Empresario
35601812297,COLORALL BRA INDUSTRIA DE CORANTES NATURAIS EIRELI,MATAO,8,2017,Armazens Gerais Empresario
35601813277,BRUNO HENRIQUE SCORIZA FOSCHINE - EIRELI,ILHABELA,8,2017,Armazens Gerais Empresario
35601813285,SERVMEC SERVICOS INDUSTRIAIS EIRELI,AMERICANA,8,2017,Armazens Gerais Empresario
35601813293,SEMPREL - SERVICOS PARA APOIO E MONITORAMENTO EIRELI,RIO CLARO,8,2017,Armazens Gerais Empresario
35601813307,ALINHAMEC AUTO CENTER EIRELI,PIRACICABA,8,2017,Armazens Gerais Empresario
35601813315,A J S DE OLIVEIRA SERVICOS DE APOIO ADMINISTRATIVO EIRELI,LIMEIRA,8,2017,Armazens Gerais Empresario
35601813323,DEFAVERE CONFECCOES EIRELI,SANTA BARBARA D'OESTE,8,2017,Armazens Gerais Empresario
35601813331,A C DE SOUSA TABACARIA EIRELI,PIRACICABA,8,2017,Armazens Gerais Empresario
35601813340,A F BATISTA COMERCIO E REPRESENTACAO EIRELI,BORBOREMA,8,2017,Armazens Gerais Empresario
35601813358,"LIMERTECH AUTOMACAO COMERCIAL, IMPORTACAO E EXPORTACAO EIRELI",LIMEIRA,8,2017,Armazens Gerais Empresario
35601813366,ALBERGONI COMERCIO E SERVICOS EIRELI,ARTUR NOGUEIRA,8,2017,Armazens Gerais Empresario
35601813374,CLEUDINEIA A G ZAVARELLO EIRELI,RIO CLARO,8,2017,Armazens Gerais Empresario
35601818732,T GARCIA COMUNICAOES EIRELI,ADAMANTINA,8,2017,Armazens Gerais Empresario
35601818741,L C MARTINS TRANSPORTES EIRELI,OSVALDO CRUZ,8,2017,Armazens Gerais Empresario
35601818759,MB LOPES MATERIAIS DE CONSTRUCAO EIRELI,SAO JOSE DO RIO PRETO,8,2017,Armazens Gerais Empresario
35601818767,ELETRICA E HIDRAULICA BIRIGUI EIRELI,BIRIGUI,8,2017,Armazens Gerais Empresario
35601818775,AURIPELL EMBALAGENS EIRELI,AURIFLAMA,8,2017,Armazens Gerais Empresario
35601818783,ROMA TELECOMUNICACOES - EIRELI,ARACATUBA,8,2017,Armazens Gerais Empresario
35601818791,TOP FLY PARAMOTORES INDUSTRIA E COMERCIO EIRELI,IACRI,8,2017,Armazens Gerais Empresario
35601818805,CAMILA COLOMBO ANDREAZE MIRANDA EIRELI,BIRIGUI,8,2017,Armazens Gerais Empresario
35601818813,SUSPENCAR CENTRO AUTOMOTIVO EIRELI,ARACATUBA,8,2017,Armazens Gerais Empresario
35601818821,3JD REPRESENTACAO COMERCIAL EIRELI,SANTA ISABEL,8,2017,Armazens Gerais Empresario
35601818830,VH CELL COMERCIO E SERVICOS EIRELI,MARILIA,8,2017,Armazens Gerais Empresario
35601818848,EMERSON FLAVIO MANHANI EIRELI,ANDRADINA,8,2017,Armazens Gerais Empresario
35601818856,PIZZARIA DO JUSSARA EIRELI,ARACATUBA,8,2017,Armazens Gerais Empresario
35601818864,SHOPPING DAS BEBIDAS FERNANDOPOLIS EIRELI,FERNANDOPOLIS,8,2017,Armazens Gerais Empresario
35601818872,PELLUCINHAS BRINQUEDOS EIRELI,RIO CLARO,8,2017,Armazens Gerais Empresario
35601818881,THIAGO LIMA DA SILVA - EIRELI,PAULICEIA,8,2017,Armazens Gerais Empresario
35601818899,PSICULTURA SAO JOAO EIRELI,ILHA SOLTEIRA,8,2017,Armazens Gerais Empresario
35601818902,COMERCIAL FAZANO EIRELI,BIRIGUI,8,2017,Armazens Gerais Empresario
35601818911,C P N COMERCIO DE MATERIAIS DE CONSTRUCAO EIRELI,CASTILHO,8,2017,Armazens Gerais Empresario
35601835190,DELAI E QUESADA DOCERIA EIRELI,PINDAMONHANGABA,8,2017,Armazens Gerais Empresario
35601835203,GLOBAL TURIS LOCADORA DE VEICULOS EIRELI,JACAREI,8,2017,Armazens Gerais Empresario
35601843435,JL SERRANA TRANSPORTES EIRELI,SERRANA,8,2017,Armazens Gerais Empresario
35601843443,ASSIS-JP TRANSPORTES E LOGISTICA EIRELI,PARANAPANEMA,8,2017,Armazens Gerais Empresario
35601843451,SANTINI SERVICOS MEDICOS EIRELI,RIBEIRAO PRETO,8,2017,Armazens Gerais Empresario
35601843460,TEM COMUNICACAO E WEB DESIGN EIRELI,BATATAIS,8,2017,Armazens Gerais Empresario
35601843478,ZEUS CONFECCOES EIRELI,JARDINOPOLIS,8,2017,Armazens Gerais Empresario
35601843486,RHOSSE INSTRUMENTOS E EQUIPAMENTOS CIRURGICOS EIRELI,RIBEIRAO PRETO,8,2017,Armazens Gerais Empresario
35601843494,CENTRO AUTOMOTIVO MMB EIRELI,SERTAOZINHO,8,2017,Armazens Gerais Empresario
35601843508,TEMPO COMUNICACAO VISUAL EIRELI,SAO CARLOS,8,2017,Armazens Gerais Empresario
35601847295,M A DE SOUZA NEGOCIOS IMOBILIARIOS EIRELI,MOGI DAS CRUZES,8,2017,Armazens Gerais Empresario
35601847309,ALTO TIETE AMBIENTAL EIRELI,SUZANO,8,2017,Armazens Gerais Empresario
35601847317,P DA COSTA VERGA DISTRIBUIDORA DE AUTO PECAS E ACESSORIOS EIRELI,MOGI DAS CRUZES,8,2017,Armazens Gerais Empresario
35601847325,MONTBRAS MONTAGEM E MANUTENCAO INDUSTRIAL EIRELI,MOGI DAS CRUZES,8,2017,Armazens Gerais Empresario
35601847333,ARENA GBSTRONG EIRELI,MOGI DAS CRUZES,8,2017,Armazens Gerais Empresario
35601847341,GALAXY REPRESENTACOES E ASSESSORIA EIRELI,MOGI DAS CRUZES,8,2017,Armazens Gerais Empresario
35601847350,LUCAS DE CARVALHO REPRESENTACAO COMERCIAL EIRELI,MOGI DAS CRUZES,8,2017,Armazens Gerais Empresario
35601861573,MADREBELLA CALCADOS EIRELI,JAU,8,2017,Armazens Gerais Empresario
35601861581,PAULO LUIZ JULIANI REPRESENTACAO EIRELI,IBITINGA,8,2017,Armazens Gerais Empresario
35601861590,JO SERVICOS AGRICOLAS EIRELI,LENCOIS PAULISTA,8,2017,Armazens Gerais Empresario
35601861603,BLACK MELON ACESSORIOS DE BELEZA EIRELI,BARIRI,8,2017,Armazens Gerais Empresario
35601861611,3III COMERCIO E ATIVIDADES NA INTERNET EIRELI,BARUERI,8,2017,Armazens Gerais Empresario
35601861620,"MEIO AMBIENTE EDIFICACOES, COMERCIO E SERVICOS EIRELI",AVARE,8,2017,Armazens Gerais Empresario
35601861638,R. RITROVATTO PANIFICADORA EIRELI,DOIS CORREGOS,8,2017,Armazens Gerais Empresario
35601861646,E&F SERVICOS E PARTICIPACOES - EIRELI,SANTA CRUZ DO RIO PARDO,8,2017,Armazens Gerais Empresario
35601861654,PPRA PROPRIEDADES & PARTICIPACOES EIRELI,CESARIO LANGE,8,2017,Armazens Gerais Empresario
35601861662,RAMAZINI ARTIGOS DO VESTUARIO EIRELI,JAU,8,2017,Armazens Gerais Empresario
35601861671,EQUADOR COMERCIAL AUTO PECAS EIRELI,RIBEIRAO PRETO,8,2017,Armazens Gerais Empresario
35601861689,BEATRIZ GISELE DE SA EIRELI,BAURU,8,2017,Armazens Gerais Empresario
35601861697,CLINICA MEDICA SIACOR ESTIMULACAO CARDIACA ARTIFICIAL EIRELI,BAURU,8,2017,Armazens Gerais Empresario
35601861701,REFORT ESTAQUEAMENTOS PARA CONSTRUCOES EIRELI,BAURU,8,2017,Armazens Gerais Empresario
35601861719,CANADA COMERCIO DE PRODUTOS DE BELEZA EIRELI,RIBEIRAO PRETO,8,2017,Armazens Gerais Empresario
35601880381,DJR DE OLIVEIRA EIRELI,MOGI-MIRIM,8,2017,Armazens Gerais Empresario
35601880390,ANA LIVIA MENDES BAGATINI EIRELI,MOGI-GUACU,8,2017,Armazens Gerais Empresario
35601880403,WORLD EXPRESS RESTAURANTE E CHOPERIA EIRELI,MOGI-GUACU,8,2017,Armazens Gerais Empresario
35601880411,VAREJAO AMPARO EIRELI,BOM JESUS DOS PERDOES,8,2017,Armazens Gerais Empresario
35601880420,ADVANCE COMERCIO DE TRAILLER E REBOQUES EIRELI,ENGENHEIRO COELHO,8,2017,Armazens Gerais Empresario
35601885049,PIMENTA FRESCA RESTAURANTE - EIRELI,CAMPINAS,8,2017,Armazens Gerais Empresario
35601885057,TERRASSOS RESTAURANTE E COMERCIO EIRELI,AMPARO,8,2017,Armazens Gerais Empresario
35601885065,VALDIR GORGULHO ASSESSORIA E CONSULTORIA EM DESENVOLVIMENTO COMERCIAL EIRELI,INDAIATUBA,8,2017,Armazens Gerais Empresario
35601885073,FLAVIO MAIA ASSESSORIA E CONSULTORIA EM DESENVOLVIMENTO COMERCIAL EIRELI,INDAIATUBA,8,2017,Armazens Gerais Empresario
35601885081,TR AR CONDICIONADO EIRELI,PAULINIA,8,2017,Armazens Gerais Empresario
35601885090,MEDICAL LOG COMERCIO DE PRODUTOS MEDICOS EIRELI,HORTOLANDIA,8,2017,Armazens Gerais Empresario
35601885103,KRV CLINICA DE FISIOTERAPIA EIRELI,JAGUARIUNA,8,2017,Armazens Gerais Empresario
35601885111,MARI TREINAMENTO E CONTEUDO EIRELI,CAMPINAS,8,2017,Armazens Gerais Empresario
35601885120,TLZ TRANSPORTES EIRELI,CAMPINAS,8,2017,Armazens Gerais Empresario
35601885138,A. STUCHI CONSULTORIA EIRELI,HOLAMBRA,8,2017,Armazens Gerais Empresario
35601885146,HENRIQUE MILANI FERNANDES BRAGA EIRELI,CAMPINAS,8,2017,Armazens Gerais Empresario
35601887521,VIP BR TELECOM EIRELI,MAUA,8,2017,Armazens Gerais Empresario
35601887530,MENES EDUCACAO E TECNOLOGIA EIRELI,BARUERI,8,2017,Armazens Gerais Empresario
35601887548,TRANSIMOB IMOBILIARIA EIRELI,SAO PAULO,8,2017,Armazens Gerais Empresario
35601887556,ART LAGOS EIRELI,SAO PAULO,8,2017,Armazens Gerais Empresario
35601887564,LIZ STORE EIRELI,SANTANA DE PARNAIBA,8,2017,Armazens Gerais Empresario
35601887572,MELANNINOS MOVEIS E MAQUINAS PARA ESCRITORIO EIRELI,SAO CAETANO DO SUL,8,2017,Armazens Gerais Empresario
35601887581,MHC PRODUCOES E EVENTOS EIRELI,SAO PAULO,8,2017,Armazens Gerais Empresario
35601887599,SKILSER IMPORTACAO E EXPORTACAO EIRELI,SAO ROQUE,8,2017,Armazens Gerais Empresario
35601889320,MBM PECAS AUTOMOTIVAS EIRELI,SAO BERNARDO DO CAMPO,8,2017,Armazens Gerais Empresario
35601889338,ESFIHARIA E PIZZARIA ESTRELA DA PAZ EIRELI,SAO PAULO,8,2017,Armazens Gerais Empresario
35601889346,UNIVERSO PROPAGANDA E SERVICOS EIRELI,SAO PAULO,8,2017,Armazens Gerais Empresario
35601889354,IASPIS ARTE PERICIA EIRELI,SAO PAULO,8,2017,Armazens Gerais Empresario
35601889362,VIA PARIS COMERCIO E EXPORTACAO DE MOVEIS EIRELI,SAO PAULO,8,2017,Armazens Gerais Empresario
35601889371,RCS CESTAS BASICA EIRELI,SAO PAULO,8,2017,Armazens Gerais Empresario
35601889389,NAG LANCHONETE EIRELI,ATIBAIA,8,2017,Armazens Gerais Empresario
35601889397,CARDAN VEDACOES INDUSTRIAIS E COMERCIO EIRELI,SAO PAULO,8,2017,Armazens Gerais Empresario
35601889401,EB INOX EQUIPAMENTOS INDUSTRIAIS EIRELI,SAO PAULO,8,2017,Armazens Gerais Empresario
35601889419,CLINICA MEDICA ALCANTARA EIRELI,SANTO ANDRE,8,2017,Armazens Gerais Empresario
35601889427,RA GESTAO DE NEGOCIOS - EIRELI,BARUERI,8,2017,Armazens Gerais Empresario
35601889435,ESTUDIO KI PRODUCOES EIRELI,SAO PAULO,8,2017,Armazens Gerais Empresario
35601889443,MELLO FITNESS ACADEMIA EIRELI,SAO PAULO,8,2017,Armazens Gerais Empresario
35601889451,SAINT HORIZON - SYSTEM - EIRELI,INDAIATUBA,8,2017,Armazens Gerais Empresario
35601889460,MENTON EMPREENDIMENTOS E CONSTRUCOES EIRELI,SAO PAULO,8,2017,Armazens Gerais Empresario
35601889478,TUV SUD SFDK LABORATORIO DE ANALISE DE PRODUTOS EIRELI,SAO PAULO,8,2017,Armazens Gerais Empresario
35601889486,AGROPECUARIA STARLAND EIRELI,SAO PAULO,8,2017,Armazens Gerais Empresario
35601889494,M&DTRANSLOG SOLUCOES EM TRANSPORTE EIRELI,SAO PAULO,8,2017,Armazens Gerais Empresario
35601889508,VITUCIPINHO MARKETING EIRELI,CUBATAO,8,2017,Armazens Gerais Empresario
35601889516,ROHKUS TREINAMENTO EM DESENVOLVIMENTO PROFISSIONAL EIRELI,SAO BERNARDO DO CAMPO,8,2017,Armazens Gerais Empresario
35601889524,"M.R.C EMPREEMDIMENTOS, PARTICIPACOES E REPRESENTACAO EIRELI",SAO PAULO,8,2017,Armazens Gerais Empresario
35601889532,ROTHES ATACADISTA EIRELI,SAO CAETANO DO SUL,8,2017,Armazens Gerais Empresario
35601889541,PEDRO PAULO GATTI EIRELI,ATIBAIA,8,2017,Armazens Gerais Empresario
35601889559,MATHFER SERVICOS DE EMBALAGENS EIRELI,ARACATUBA,8,2017,Armazens Gerais Empresario
35601889567,COMERCIAL PERCON METAL SERVICOS DE EMBALAGENS EIRELI,ARACATUBA,8,2017,Armazens Gerais Empresario
35601893777,GABRIEL DO GESSO EIRELI,INDAIATUBA,8,2017,Armazens Gerais Empresario
35601893785,BOOBOO ARTE E DECORACAO - EIRELI,SANTA BARBARA D'OESTE,8,2017,Armazens Gerais Empresario
35601893793,KING FABRICACAO DE MOVEIS PLANEJADOS EIRELI,INDAIATUBA,8,2017,Armazens Gerais Empresario
35601893807,MARIANNA FERRAZ FIGUEIRA MEINBERG ACADEMIA - EIRELI,CAMPINAS,8,2017,Armazens Gerais Empresario
35601893815,MARINI CONSULTORIA EMPRESARIAL EIRELI,INDAIATUBA,8,2017,Armazens Gerais Empresario
35601893823,R J A COMERCIO DE PRODUTOS AGROPECUARIOS EIRELI,RIO CLARO,8,2017,Armazens Gerais Empresario
35601893831,GBX GLOBAL IMPORTACAO E EXPORTACAO DE BEBIDAS - EIRELI,INDAIATUBA,8,2017,Armazens Gerais Empresario
35601893840,ELDER DOS SANTOS EIRELI,CAMPINAS,8,2017,Armazens Gerais Empresario
35601893858,ANDERSON ALVES DOS SANTOS TRANSPORTES EIRELI,SUMARE,8,2017,Armazens Gerais Empresario
35601893866,OHMIC RESISTORES E REOSTATOS EIRELI,INDAIATUBA,8,2017,Armazens Gerais Empresario
35601893874,POLIAUTO MAQUINAS E SERVICOS EIRELI,INDAIATUBA,8,2017,Armazens Gerais Empresario
35601893882,AGROPECUARIA MONDINI EIRELI,SUMARE,8,2017,Armazens Gerais Empresario
35601893891,FURLAN & SILVA NETO RESTAURANTE EIRELI,INDAIATUBA,8,2017,Armazens Gerais Empresario
35601893904,BR ENVIRON EIRELI,CAMPO LIMPO PAULISTA,8,2017,Armazens Gerais Empresario
35601893912,GK'S LAVAGEM ECOLOGICA EIRELI,INDAIATUBA,8,2017,Armazens Gerais Empresario
35601893921,R3M ASSESSORIA EMPRESARIAL EIRELI,JUNDIAI,8,2017,Armazens Gerais Empresario
35601893939,"JR PRESTACAO DE SERVICOS DE LIMPEZA, PORTARIA E CONSERVACAO EIRELI",JUNDIAI,8,2017,Armazens Gerais Empresario
35601893947,CRED BIS BRASIL SERVICOS CADASTRAIS E DIGITACAO EIRELI,CAMPINAS,8,2017,Armazens Gerais Empresario
35601893955,ATLAS COMERCIO DE ROUPAS EIRELI,CAMPINAS,8,2017,Armazens Gerais Empresario
35601893963,V. O. MODA RESTAURANTE EIRELI,CAMPINAS,8,2017,Armazens Gerais Empresario
35601893971,FIVE POINTS CONSULTORIA E NEGOCIOS EIRELI,SAO PAULO,8,2017,Armazens Gerais Empresario
35601893980,CLINICA ODONTOLOGICA VARGAS EIRELI,CAMPO LIMPO PAULISTA,8,2017,Armazens Gerais Empresario
35601893998,PALMEIRA BONITA EIRELI,MONTE MOR,8,2017,Armazens Gerais Empresario
35601894706,GUSTAVO DE MORAES ENGENHARIA EIRELI,JUNDIAI,8,2017,Armazens Gerais Empresario
35601894714,SOLUCAO INTEGRADA COMERCIAL - EIRELI,SAO CARLOS,8,2017,Armazens Gerais Empresario
35601894722,JUNIFER FERRAGENS EIRELI,JUNDIAI,8,2017,Armazens Gerais Empresario
35601894731,URUCU PRODUCOES ARTISTICAS EIRELI,SAO PAULO,8,2017,Armazens Gerais Empresario
35601894749,"JDWG - MAQUINAS, EQUIPAMENTOS E SERVICOS EIRELI",IBATE,8,2017,Armazens Gerais Empresario
35601894757,SONIA MARIA DA SILVA TRANSPORTES EIRELI,JUNDIAI,8,2017,Armazens Gerais Empresario
35601899261,ESPACO BARROCO PARTICIPACOES EIRELI,LIMEIRA,8,2017,Armazens Gerais Empresario
35601899279,JBP ADMINISTRACAO DE IMOVEIS EIRELI,LIMEIRA,8,2017,Armazens Gerais Empresario
35601899287,OTACILIO GOMES DA SILVA REMOCOES DE VEICULOS EIRELI,LIMEIRA,8,2017,Armazens Gerais Empresario
35601911503,CRC ENCOPARTS SERVICOS DE APOIO ADMINISTRATIVO EIRELI,PIRACICABA,8,2017,Armazens Gerais Empresario
35601911511,RECOM ELETRODIESEL EIRELI,PIRACICABA,8,2017,Armazens Gerais Empresario
35601911520,SS LAVAGEM E FACILIDADES EIRELI,PIRACICABA,8,2017,Armazens Gerais Empresario
35601911538,A. SPALLINI ADMINISTRACAO DE BENS EIRELI,PIRACICABA,8,2017,Armazens Gerais Empresario
35601919008,VOGUE INDUSTRIA E COMERCIO DE ASSENTOS SANITARIOS EIRELI,TANABI,8,2017,Armazens Gerais Empresario
35601919016,IMOBILIARIA ALTO PADRAO EIRELI,SAO JOSE DO RIO PRETO,8,2017,Armazens Gerais Empresario
35601919024,FERREIRA LOCACOES E TRANSPORTES EIRELI,BADY BASSITT,8,2017,Armazens Gerais Empresario
35601919032,JIREH EMPREENDIMENTOS IMOBILIARIOS EIRELI,TANABI,8,2017,Armazens Gerais Empresario
35601919041,CALANDRIA SORVETERIA EIRELI,SAO JOSE DO RIO PRETO,8,2017,Armazens Gerais Empresario
35601919059,GLOBAL RIO PRETO DISTRIBUICAO E REPRESENTACAO EIRELI,SAO JOSE DO RIO PRETO,8,2017,Armazens Gerais Empresario
35601919067,MF DISTRIBUIDORA DE COSMETICOS RIO PRETO EIRELI,SAO JOSE DO RIO PRETO,8,2017,Armazens Gerais Empresario
35601919075,CRISTEL ENGENHARIA E COMERCIO - EIRELI,NEVES PAULISTA,8,2017,Armazens Gerais Empresario
35601919083,EXPRESSO SANTO GRAAL TRANSPORTES EIRELI,BARRETOS,8,2017,Armazens Gerais Empresario
35601919091,CHURRASCARIA BOA VISTA EIRELI,FERNANDOPOLIS,8,2017,Armazens Gerais Empresario
35601919105,PANIFICADORA E CONFEITARIA PAO DE LO - EIRELI,ARARAQUARA,8,2017,Armazens Gerais Empresario
35601919113,ESCRITORIO CONTABIL GOTAS EIRELI,SAO JOSE DO RIO PRETO,8,2017,Armazens Gerais Empresario
35601919121,SECCHES TRANSPORTES EIRELI,SAO JOSE DO RIO PRETO,8,2017,Armazens Gerais Empresario
35601919130,N. VERTONI COMERCIAL - EIRELI,SAO JOSE DO RIO PRETO,8,2017,Armazens Gerais Empresario
35601919148,CASA DE CARNES GALEAZZI - EIRELI,SAO JOSE DO RIO PRETO,8,2017,Armazens Gerais Empresario
35601919156,ESPATEC - SISTEMA DE AUTOMACAO E CONSTRUCAO - EIRELI,SAO JOSE DO RIO PRETO,8,2017,Armazens Gerais Empresario
35601919164,HEBELER TROVO TRANSPORTES E LOGISTICA EIRELI,SAO JOSE DO RIO PRETO,8,2017,Armazens Gerais Empresario
35601919172,GT COMERCIO DE PECAS VOTUPORANGA EIRELI,VOTUPORANGA,8,2017,Armazens Gerais Empresario
35601919181,ALTO LOCACAO DE EQUIPAMENTOS EIRELI,SAO JOSE DO RIO PRETO,8,2017,Armazens Gerais Empresario
35601919199,AMPLO ESPACO MOLDURAS E QUADROS EIRELI,SAO JOSE DO RIO PRETO,8,2017,Armazens Gerais Empresario
35601919202,AJB - COMERCIAL BADY EIRELI,BADY BASSITT,8,2017,Armazens Gerais Empresario
35601932152,ALUMIHELIO COMERCIO DE PERFILADOS DE ALUMINIO EIRELI,RIBEIRAO PRETO,8,2017,Armazens Gerais Empresario
35601932161,CENTER ARTS COMUNICACAO VISUAL EIRELI,RIBEIRAO PRETO,8,2017,Armazens Gerais Empresario
35601932179,SINTESE GESTORA DE ATIVOS EIRELI,RIBEIRAO PRETO,8,2017,Armazens Gerais Empresario
35601932187,PANIFICADORA ESTEVES NASCIMENTO EIRELI,RIBEIRAO PRETO,8,2017,Armazens Gerais Empresario
35601932195,VIEIRAS RP PARTICIPACOES EIRELI,RIBEIRAO PRETO,8,2017,Armazens Gerais Empresario
35601932209,VISORIUM FARMACIA DE MANIPULACAO EIRELI,RIBEIRAO PRETO,8,2017,Armazens Gerais Empresario
35601932217,YANSEN TECNOLOGIA DA INFORMACAO EIRELI,RIBEIRAO PRETO,8,2017,Armazens Gerais Empresario
35601932225,CRP SUPORTE ADMINISTRATIVO EIRELI.,BEBEDOURO,8,2017,Armazens Gerais Empresario
35601932233,RIOC ARTIGOS ESPORTIVOS - EIRELI,RIBEIRAO PRETO,8,2017,Armazens Gerais Empresario
35601932241,GIRO RAPIDO VARIEDADES EIRELI,BEBEDOURO,8,2017,Armazens Gerais Empresario
35601932250,INNOVA ASSESSORIA EM CREDITO IMOBILIARIO EIRELI,RIBEIRAO PRETO,8,2017,Armazens Gerais Empresario
35601932268,HIGIPRES COMERCIO E SERVICOS EIRELI,RIBEIRAO PRETO,8,2017,Armazens Gerais Empresario
35601932276,MERCADO M&M RIGON EIRELI,RIBEIRAO PRETO,8,2017,Armazens Gerais Empresario
35601932284,ADELINA MODA FEMININA EIRELI,RIBEIRAO PRETO,8,2017,Armazens Gerais Empresario
35601932292,R.W. VEICULOS MULTIMARCAS EIRELI,RIBEIRAO PRETO,8,2017,Armazens Gerais Empresario
35601932306,BIA EMPREENDIMENTOS IMOBILIARIOS EIRELI,RIBEIRAO PRETO,8,2017,Armazens Gerais Empresario
35601932314,TAVASA EMPREENDIMENTOS IMOBILIARIOS EIRELI,TERRA ROXA,8,2017,Armazens Gerais Empresario
35601935097,TERAPLAS INDUSTRIA E COMERCIO DE PLASTICOS EIRELI,BOITUVA,8,2017,Armazens Gerais Empresario
35601935101,LIGHT M. COMUNICACAO EIRELI,COTIA,8,2017,Armazens Gerais Empresario
35601935119,ALTERNATIVA SERVICOS ADMINISTRATIVOS EIRELI,SOROCABA,8,2017,Armazens Gerais Empresario
35601935127,AUGUSTO MOUCACHEN ADMINISTRADORA DE BENS E EMPREENDIMENTOS - EIRELI,ITAPETININGA,8,2017,Armazens Gerais Empresario
35601935135,"ACXER COMPRESSORES - INDUSTRIA, COMERCIO E SERVICOS EIRELI",SAO JOSE DO RIO PRETO,8,2017,Armazens Gerais Empresario
35601935143,ALD MONTAGENS INDUSTRIAIS EIRELI,SERTAOZINHO,8,2017,Armazens Gerais Empresario
35601935151,BARCEC CONSTRUCOES EIRELI,RIBEIRAO PRETO,8,2017,Armazens Gerais Empresario
35601935160,M. LIM SERVICOS TERCEIRIZADOS EIRELI,RIBEIRAO PRETO,8,2017,Armazens Gerais Empresario
