NIRE,Empresa,Município,Month,Year,Type
35602009927,J P RIO PRETO MADEIRAS EIRELI,SAO JOSE DO RIO PRETO,8,2017,Armazens Gerais Empresario
35602009935,PAULISTA EMBALAGENS EIRELI,SAO PAULO,8,2017,Armazens Gerais Empresario
35602009943,PADECA RESTAURANTE E LANCHONETE -EIRELI,SAO PAULO,8,2017,Armazens Gerais Empresario
35602009951,G.S.M. EQUIPAMENTOS EIRELI,SAO PAULO,8,2017,Armazens Gerais Empresario
35602009960,RLS COMERCIO DE ARTIGOS ESPORTIVOS - EIRELI,SAO PAULO,8,2017,Armazens Gerais Empresario
35602009978,ELEKTRO PROJEKT AUTOMACAO EIRELI,SAO BERNARDO DO CAMPO,8,2017,Armazens Gerais Empresario
35602009986,VIA RAPIDO TRANSPORTES EIRELI,PIRACICABA,8,2017,Armazens Gerais Empresario
35602009994,PROGLASS COMERCIO DE VIDROS TEMPERADOS E LAMINADOS EIRELI,SAO PAULO,8,2017,Armazens Gerais Empresario
35602010003,IAGO AMARAL BORDUCHI EVENTOS ESPORTIVOS EIRELI,SAO PAULO,8,2017,Armazens Gerais Empresario
35602010011,L&G ELETRONICOS EIRELI.,SAO PAULO,8,2017,Armazens Gerais Empresario
35602010020,NG CAR COMERCIO DE PECAS AUTOMOTIVAS EIRELI,SAO PAULO,8,2017,Armazens Gerais Empresario
35602010046,THUR EMPREENDIMENTOS E PARTICIPACOES EIRELI,SAO PAULO,8,2017,Armazens Gerais Empresario
35602010054,ROCKAFE ARRUDA BOTELHO EIRELI,SAO PAULO,8,2017,Armazens Gerais Empresario
35602010062,CASIMIRO SERVICOS DE APOIO ADMINISTRATIVOS - EIRELI,MONTE ALTO,8,2017,Armazens Gerais Empresario
35602010071,AG SERVICOS DE CALANDRAGEM EIRELI,SAO PAULO,8,2017,Armazens Gerais Empresario
35602010089,INTERCASH FOMENTO MERCANTIL EIRELI,SAO PAULO,8,2017,Armazens Gerais Empresario
35602010097,"PRIMICIAS VINHOS, CONSULTORIA E DEGUSTACAO DE VINHOS EIRELI.",SAO PAULO,8,2017,Armazens Gerais Empresario
35602010101,MONARA COMERCIAL EIRELI,TABOAO DA SERRA,8,2017,Armazens Gerais Empresario
35602010119,CENTRAL LOCADORA DE VEICULOS VAN24HORAS EIRELI,COTIA,8,2017,Armazens Gerais Empresario
35602010127,SANDRA REGINA DE ANDRADE EIRELI,LEME,8,2017,Armazens Gerais Empresario
35602010135,STUDIO LUG MODAS EIRELI,SAO PAULO,8,2017,Armazens Gerais Empresario
35602010151,CAFE HARMONIA COMERCIO DE ALIMENTOS EIRELI,SAO PAULO,8,2017,Armazens Gerais Empresario
35602010160,OWL COMMERCE SERVICOS E COMERCIO EIRELI,BARUERI,8,2017,Armazens Gerais Empresario
35602010178,LEATELIER SERVICOS DE COSTURA EIRELI,GUARULHOS,8,2017,Armazens Gerais Empresario
35602010186,ODONTOLUZ CLINICA ODONTOLOGICA EIRELI,BARUERI,8,2017,Armazens Gerais Empresario
35602010194,SAFE JOBS ASSESSORIA OCUPACIONAL EIRELI,TABOAO DA SERRA,8,2017,Armazens Gerais Empresario
35602010208,OSASCANDY COMERCIO DE DESCARTAVEIS E ALIMENTOS EIRELI,OSASCO,8,2017,Armazens Gerais Empresario
35602010216,CONCEITO LOCACAO MAQUINAS EIRELI,PIRACICABA,8,2017,Armazens Gerais Empresario
35602010224,MARCELA DA SILVA MORELATO - EIRELI,SAO JOSE DO RIO PRETO,8,2017,Armazens Gerais Empresario
35602010232,PREMIER COMERCIAL LTDA,ITAQUAQUECETUBA,8,2017,Armazens Gerais Empresario
35602010241,STUDIO OFFICE COMUNICACAO WORKING E LIVING - EIRELI,SAO PAULO,8,2017,Armazens Gerais Empresario
35602010259,OTB OTICA E LENTES OCULARES EIRELI,SANTOS,8,2017,Armazens Gerais Empresario
35602010267,CENTRO EDUCACIONAL PLATINA EIRELI,CAIEIRAS,8,2017,Armazens Gerais Empresario
35602010275,HOT CAR AUTO CENTER EIRELI,SAO PAULO,8,2017,Armazens Gerais Empresario
35602010283,ELETRONICA SANTANA EIRELI,SAO PAULO,8,2017,Armazens Gerais Empresario
35602010291,METALURGICA PARRA INDUSTRIA E COMERCIO DE MAQUINAS EIRELI,SAO PAULO,8,2017,Armazens Gerais Empresario
35602010305,AFFINIT SERVICOS DE APOIO E INDICACAO DE NEGOCIOS EIRELI,OSASCO,8,2017,Armazens Gerais Empresario
35602010313,ROMABEL ALIMENTOS EIRELI,SAO PAULO,8,2017,Armazens Gerais Empresario
35602010321,ANTUNES SERVICOS E INCORPORACOES EIRELI,INDAIATUBA,8,2017,Armazens Gerais Empresario
35602010330,CLINICA DE PSICOLOGIA E NEUROPSICOLOGIA NOVA AGAPE EIRELI,OSASCO,8,2017,Armazens Gerais Empresario
35602010348,CARRERA IT - INTELLIGENT TECHNOLOGY EIRELI,PIRANGI,8,2017,Armazens Gerais Empresario
35602010356,NEXUS CONSULTORIA EM TELECOMUNICACOES EIRELI,CAMPINAS,8,2017,Armazens Gerais Empresario
35602010364,DONA ROCA TEMPEROS CONDIMENTOS E MOLHOS EIRELI,POA,8,2017,Armazens Gerais Empresario
35602010372,MPTG ONLINE COMERCIO DE CALCADOS EIRELI,SAO PAULO,8,2017,Armazens Gerais Empresario
35602010381,MONTADORA MODELO COMERCIO DE MOVEIS E SERVICOS EIRELI,CAMPINAS,8,2017,Armazens Gerais Empresario
35602010399,NOVAC COMERCIAL IMPORTADORA EIRELI,SAO PAULO,8,2017,Armazens Gerais Empresario
35602010402,4 OHMS COMERCIO E DISTRIBUIDORA DE AUTO PECAS - EIRELI,SAO PAULO,8,2017,Armazens Gerais Empresario
35602010411,"AMERICAS SISTEMAS, CONSULTORIA EM GESTAO EMPRESARIAL EIRELI",SAO PAULO,8,2017,Armazens Gerais Empresario
35602010429,ZANGA FASHION MODAS - EIRELI,SAO PAULO,8,2017,Armazens Gerais Empresario
35602010437,ENOQUE JOSE PEREIRA TECIDOS,FRANCISCO MORATO,8,2017,Armazens Gerais Empresario
35602010445,DOIS AMIGOS - COMERCIO E FORNECIMENTO DE PIZZA EIRELI,VARGEM GRANDE PAULISTA,8,2017,Armazens Gerais Empresario
35602010453,EXCLUSIVA BRINQUEDOS E LIVROS PEDAGOGICOS - EIRELI,GUARULHOS,8,2017,Armazens Gerais Empresario
35602010461,POSIAGRO EVENTOS AGROPECUARIOS - EIRELI,SAO PAULO,8,2017,Armazens Gerais Empresario
35602010470,BROTHERS COMERCIO DE GAS EIRELI,EMBU DAS ARTES,8,2017,Armazens Gerais Empresario
35602010496,LK FOODS PRODUTOS ALIMENTICIOS EIRELI,SAO PAULO,8,2017,Armazens Gerais Empresario
35602010500,18 KILATEM CLINICA VETERINARIA EIRELI,COTIA,8,2017,Armazens Gerais Empresario
35602010518,MOREIRA DO VALLE DECORACOES E EVENTOS EIRELI,SAO PAULO,8,2017,Armazens Gerais Empresario
35602010526,GAMA 7 AUTOMACAO INDUSTRIA E COMERCIO EIRELI,DIADEMA,8,2017,Armazens Gerais Empresario
35602010534,PREMIUM DESCARTAVEIS DE PAPEL EIRELI,BARUERI,8,2017,Armazens Gerais Empresario
35602010542,INICIAR EVENTOS EIRELI,SAO PAULO,8,2017,Armazens Gerais Empresario
35602010551,MIRASSOL REFEICOES EIRELI,INDAIATUBA,8,2017,Armazens Gerais Empresario
35602010569,CONCEITO SERVICE EIRELI,SAO PAULO,8,2017,Armazens Gerais Empresario
35602010577,DM COMERCIO DE AREIA E TRANSPORTES EIRELI,SERRANA,8,2017,Armazens Gerais Empresario
35602010585,A.F.C. COMERCIO E SERVICOS EIRELI,JANDIRA,8,2017,Armazens Gerais Empresario
35602010593,MAGIC SMOKE NARGUERIA EIRELI,MONGAGUA,8,2017,Armazens Gerais Empresario
35602010607,L E B WEISS BORRACHARIA EIRELI,EMBU DAS ARTES,8,2017,Armazens Gerais Empresario
35602010615,PREMIUM MOVEIS E COLCHOES - EIRELI,SAO BERNARDO DO CAMPO,8,2017,Armazens Gerais Empresario
35602010623,MOVEMENT DISTRIBUIDORA E COMERCIO DE COSMETICOS EIRELI,JANDIRA,8,2017,Armazens Gerais Empresario
35602010631,"MMM+PLUS MESQUITA, MARKETING & MIDIA PLUS EIRELI",SAO PAULO,8,2017,Armazens Gerais Empresario
35602010640,LINS & SILVA NEGOCIOS IMOBILIARIOS EIRELI,SAO PAULO,8,2017,Armazens Gerais Empresario
35602010658,MAKISPIN FAST-FOOD COMERCIO DE ALIMENTOS EIRELI,SAO PAULO,8,2017,Armazens Gerais Empresario
35602010666,BOTELHO & BARROS TRANSPORTES E LOGISTICA EIRELI,SAO PAULO,8,2017,Armazens Gerais Empresario
35602010674,FROM THE GALLEY EIRELI,SAO PAULO,8,2017,Armazens Gerais Empresario
35602010682,EVENT CONTEUDO EIRELI,SAO PAULO,8,2017,Armazens Gerais Empresario
35602010704,MC DESIGN COMERCIO DE PECAS PARA ELEVADORES EIRELI,SAO PAULO,8,2017,Armazens Gerais Empresario
35602010712,NEO FIBER SERVICOS TECNOLOGIA E SOLUCOES - EIRELI,SAO PAULO,8,2017,Armazens Gerais Empresario
35602010721,AGUA TOTAL EIRELI,SAO PAULO,8,2017,Armazens Gerais Empresario
35602010739,ROGER DUARTE PINHEIRO EIRELI,CARAPICUIBA,8,2017,Armazens Gerais Empresario
35602010747,MNEO ENSINO E CONSULTORIA EIRELI,SAO PAULO,8,2017,Armazens Gerais Empresario
35602010755,"INDUSPAPER INDUSTRIA E COMERCIO DE PAPEIS, PLASTICOS E METAIS EIRELI",VARZEA PAULISTA,8,2017,Armazens Gerais Empresario
35602010763,M.B. ACESSORIOS COMERCIO E SERVICOS EIRELI,SAO PAULO,8,2017,Armazens Gerais Empresario
35602010771,MARECHAL PARK LAVA RAPIDO E ESTACIONAMENTO EIRELI,SAO PAULO,8,2017,Armazens Gerais Empresario
35602010780,EMPRESVI - SERVICOS DE PORTARIA E ZELADORIA EIRELI,SAO PAULO,8,2017,Armazens Gerais Empresario
35602010801,TERRA TOPOGRAPHY - SERVICOS DE TOPOGRAFIA E AGRIMENSSURA EIRELI,SAO PAULO,8,2017,Armazens Gerais Empresario
35602010810,ORLANDO NUNO FERNANDES ACESSORIOS - EIRELI,SAO PAULO,8,2017,Armazens Gerais Empresario
35602010828,D.R. SERVICOS REDIOLOGICOS EIRELI,GUARULHOS,8,2017,Armazens Gerais Empresario
35602010836,"FENGTOM FERNANDES ENGENHARIA,TOPOGRAFIA,OBRAS E MAQUINAS LTDA",SAO PAULO,8,2017,Armazens Gerais Empresario
35602010844,"SRG EVENTOS, SONORIZACAO E ILUMINACAO PROFISSIONAL EIRELI",SAO PAULO,8,2017,Armazens Gerais Empresario
35602010852,PIZZARIA TURIBA EIRELI,SAO PAULO,8,2017,Armazens Gerais Empresario
35602010861,A.L.M MATERIAIS DE CONSTRUCAO EIRELI,ITAQUAQUECETUBA,8,2017,Armazens Gerais Empresario
35602010879,A.M. CARVALHO APOIO ADMINISTRATIVO EIRELI,SAO BERNARDO DO CAMPO,8,2017,Armazens Gerais Empresario
35602010887,EMPORIO DOS ASSSADOS E ROTISSERIE EIRELI,SAO PAULO,8,2017,Armazens Gerais Empresario
35602010895,O.MOHOR FOMENTO MERCANTIL EIRELI,GUARULHOS,8,2017,Armazens Gerais Empresario
35602010909,ECO ITAPARK AUTO POSTO - EIRELI,MAUA,8,2017,Armazens Gerais Empresario
35602010917,AUTO POSTO PARADA XV EIRELI,SAO PAULO,8,2017,Armazens Gerais Empresario
35630026628,GRAZZY PISACANE ASSESSORIA DE IMPRENSA E COMUNICACAO EIRELI,SAO PAULO,8,2017,Armazens Gerais Empresario
35630026644,MP MESTRINER EIRELI,SAO PAULO,8,2017,Armazens Gerais Empresario
35630026652,DCZ ENGENHARIA EIRELI,SAO PAULO,8,2017,Armazens Gerais Empresario
35630026661,KADOSH PIZZAS EIRELI,SAO PAULO,8,2017,Armazens Gerais Empresario
35630026679,LOG SERVICOS DE APOIO ADMINISTRATIVOS EIRELI,POA,8,2017,Armazens Gerais Empresario
35630026695,COMERCIO DE ARTIGOS RELIGIOSOS REINO DE IFA EIRELI,SAO PAULO,8,2017,Armazens Gerais Empresario
35630026709,PODERSERV - SERVICOS OPERACIONAIS ESPECIALIZADOS EIRELI,SAO PAULO,8,2017,Armazens Gerais Empresario
35630026717,AKMUO SOLUCOES CORPORATIVAS EIRELI,SAO PAULO,8,2017,Armazens Gerais Empresario
35630026725,BARUCH PECAS AUTOMOTIVAS - EIRELI,SAO PAULO,8,2017,Armazens Gerais Empresario
35630026733,EKKO DECOR PROJETOS E DESIGN DE INTERIORES EIRELI,OSASCO,8,2017,Armazens Gerais Empresario
35630026741,OTH COMERCIO E ASSESSORIA EIRELI,SAO PAULO,8,2017,Armazens Gerais Empresario
35630026750,OLIVIA SUNGLASSES COMERCIO OTICO EIRELI,SAO PAULO,8,2017,Armazens Gerais Empresario
35630026768,TADMARG REPRESENTACAO COMERCIAL EIRELI,SAO PAULO,8,2017,Armazens Gerais Empresario
35630026776,MIRAFA MODAS COMERCIO DE ROUPAS E ACESSORIOS EIRELI,SAO PAULO,8,2017,Armazens Gerais Empresario
35630026784,BRUNO GIOVANNINI PROJETOS E SERVICOS ADMINISTRATIVOS - EIRELI,SAO PAULO,8,2017,Armazens Gerais Empresario
35630026792,FRANCIS PETRUCCI DESIGN EIRELI,SAO PAULO,8,2017,Armazens Gerais Empresario
35630026806,PPA CONSULTORIA E ASSESSORIA FINANCEIRA EIRELI,SAO PAULO,8,2017,Armazens Gerais Empresario
35630026814,AFN LANCHES NATURAIS EIRELI,SAO PAULO,8,2017,Armazens Gerais Empresario
35630026822,JEFFERSON TONG EIRELI,VINHEDO,8,2017,Armazens Gerais Empresario
35630026831,RAFAEL DIAS HENRIQUES EIRELI,SAO PAULO,8,2017,Armazens Gerais Empresario
35630026849,A.F.V BAR E LANCHES - EIRELI,SAO PAULO,8,2017,Armazens Gerais Empresario
35630026857,DESTAQUE COMERCIO E PRESTACAO DE SERVICOS EIRELI,SAO PAULO,8,2017,Armazens Gerais Empresario
35630026865,FLASH SERVICOS ADMINISTRATIVOS EIRELI,SAO PAULO,8,2017,Armazens Gerais Empresario
35630026873,DANPER ESTACIONAMENTO EIRELI,SAO BERNARDO DO CAMPO,8,2017,Armazens Gerais Empresario
35630026881,KAROLINE FERNANDA REPRESENTACOES EIRELI,SAO PAULO,8,2017,Armazens Gerais Empresario
35630026890,OPTICA-SERV COMERCIO E SERVICOS OPTICOS EIRELI,SAO PAULO,8,2017,Armazens Gerais Empresario
35630026903,ZE MARIO DESENVOLVIMENTO PESSOAL E PROFISSIONAL EIRELI,SAO PAULO,8,2017,Armazens Gerais Empresario
35630026911,D W INSTALACAO E MONTAGEM DE DIVISORIAS EIRELI,SAO PAULO,8,2017,Armazens Gerais Empresario
35630026938,SUPRAVISAO SERVICOS E SEGURANCA EIRELI,ITU,8,2017,Armazens Gerais Empresario
35630026946,AGS COMERCIO DE VEICULOS EIRELI,SAO PAULO,8,2017,Armazens Gerais Empresario
35630026954,PSIQUIATRIA CARVALHO EIRELI,SAO PAULO,8,2017,Armazens Gerais Empresario
35630026971,"A & A PRESENTES, VARIEDADES E ELETRONICOS EIRELI",SAO PAULO,8,2017,Armazens Gerais Empresario
35630026989,ELECTRONICS YUMI IMPORTACAO EIRELI,SAO PAULO,8,2017,Armazens Gerais Empresario
35630026997,TRADERMAX COMERCIO IMPORTACAO E EXPORTACAO EIRELI,COTIA,8,2017,Armazens Gerais Empresario
35630027004,MAZZA COMERCIO DE VEICULOS EIRELI,SAO PAULO,8,2017,Armazens Gerais Empresario
35630027012,INVIS APOIO ADMINISTRATIVO EIRELI,SAO PAULO,8,2017,Armazens Gerais Empresario
35630027021,CO-OP CONSULTORIA OPERACIONAL EIRELI,SAO PAULO,8,2017,Armazens Gerais Empresario
35630027039,JL AGREGADOS PARA CONSTRUCAO EIRELI,SAO PAULO,8,2017,Armazens Gerais Empresario
35630027047,REVISA GAS SERVICOS DE MANUTENCAO E INSTALACAO EIRELI,SAO PAULO,8,2017,Armazens Gerais Empresario
35630027055,LHGABAS CONSULTORIA FINANCEIRA E PARTICIPACOES EIRELI,SAO PAULO,8,2017,Armazens Gerais Empresario
35630027063,M.B MANUTENCAO E REFORMAS EIRELI,SAO PAULO,8,2017,Armazens Gerais Empresario
35630027071,IDEAL DISTRIBUICAO E COMERCIAL EIRELI,SAO PAULO,8,2017,Armazens Gerais Empresario
35630027080,FIFALIZE E-SPORTS PRODUCOES EIRELI,SAO PAULO,8,2017,Armazens Gerais Empresario
35630027098,ROSCOE ASSESSORIA EMPRESARIAL EIRELI,SAO PAULO,8,2017,Armazens Gerais Empresario
35630027110,INFINITU SERVICOS DE APOIO EMPRESARIAL EIRELI,SAO PAULO,8,2017,Armazens Gerais Empresario
35630027128,VISUALL AGENCY DESENVOLVIMENTO DE SOFTWARE EIRELI,SAO PAULO,8,2017,Armazens Gerais Empresario
35630027152,CROCOL BAR & RESTAURANTE EIRELI,SAO PAULO,8,2017,Armazens Gerais Empresario
35630027161,BAR TITANIC EIRELI,SAO PAULO,8,2017,Armazens Gerais Empresario
35630027179,CHEMICOLA COMERCIO E APLICACAO DE REVESTIMENTOS ADESIVOS EIRELI,SAO PAULO,8,2017,Armazens Gerais Empresario
35630027187,BELLINETTI REPRESENTACOES E COBRANCA EIRELI,SAO PAULO,8,2017,Armazens Gerais Empresario
35630027233,REGULARIZE CONSULTORIA ADMINISTRATIVA EIRELI,SAO PAULO,8,2017,Armazens Gerais Empresario
35630027250,SOL NASCENTE REPRESENTACOES COMERCIAIS EIRELI,SAO PAULO,8,2017,Armazens Gerais Empresario
35630027292,GAMMON CRIACAO EIRELI,SAO PAULO,8,2017,Armazens Gerais Empresario
35630027331,EMPRESA BRASILEIRA DE STANDS EIRELI,MAIRIPORA,8,2017,Armazens Gerais Empresario
35630027349,CHURRASCARIA RANCHO MISSIONEIRO EIRELI,SAO PAULO,8,2017,Armazens Gerais Empresario
35630027357,GN FUSCALDO PARTICIPACOES EIRELI,SAO PAULO,8,2017,Armazens Gerais Empresario
35630027365,CARFOR MOBILIDADE AGENCIAMENTO TURISTICO EIRELI,SAO PAULO,8,2017,Armazens Gerais Empresario
35630027373,"CNJ COMERCIO, CONSULTORIA E ASSESSORIA DE COMERCIO EXTERIOR EIRELI",SAO PAULO,8,2017,Armazens Gerais Empresario
35630027403,ATIVA FUNDACOES E CONSTRUCOES EIRELI,SAO PAULO,8,2017,Armazens Gerais Empresario
35630027446,JBR FIOS TEXTEIS REPRESENTACOES EIRELI,SAO PAULO,8,2017,Armazens Gerais Empresario
35630027462,GRS COMERCIO DE ALIMENTOS EIRELI,TABOAO DA SERRA,8,2017,Armazens Gerais Empresario
35630027471,VESTEM MORUMBI COMERCIO DE CONFECCOES EIRELI,SAO PAULO,8,2017,Armazens Gerais Empresario
35630027489,MRFC CLINICA DE SERVICOS MEDICOS EIRELI,SAO PAULO,8,2017,Armazens Gerais Empresario
35630027551,DAVQ SERVICOS MEDICOS - EIRELI,SAO PAULO,8,2017,Armazens Gerais Empresario
35630027624,MAHINA SOLUTIONS EM ILUMINACOES EIRELI,TABOAO DA SERRA,8,2017,Armazens Gerais Empresario
35630027632,PHILLIPPE OUTLET EIRELI,SAO PAULO,8,2017,Armazens Gerais Empresario
35630027659,MD2 JEANS COMERCIO DE CONFECCOES EIRELI,SAO PAULO,8,2017,Armazens Gerais Empresario
35630027705,FEHADDAD ENGENHARIA EIRELI,SAO PAULO,8,2017,Armazens Gerais Empresario
35630027713,FIRST CLASS EVENTOS CORPORATIVOS EIRELI,SAO PAULO,8,2017,Armazens Gerais Empresario
35630027730,ANDREA BORGES SERVICOS - EIRELI,SAO PAULO,8,2017,Armazens Gerais Empresario
35630027748,PWG PINTURAS EIRELI,SAO PAULO,8,2017,Armazens Gerais Empresario
35630027756,G5 COMERCIO DE PRODUTOS SIDERURGICOS EIRELI,SAO PAULO,8,2017,Armazens Gerais Empresario
35630027764,DB PARAFUSOS COMERCIAL EIRELI,SAO PAULO,8,2017,Armazens Gerais Empresario
35630027772,PRATACORP ADVISORY ASSESSORIA ADMINISTRATIVA EIRELI,SAO PAULO,8,2017,Armazens Gerais Empresario
35630027781,CASTRO & COSTA SERVICOS MEDICOS - EIRELI,SAO PAULO,8,2017,Armazens Gerais Empresario
35630027829,EQUIPE 10 PRIME CONSTRUCOES EIRELI,SAO PAULO,8,2017,Armazens Gerais Empresario
35630027837,CINTIA RAIANE SANTANA DA SILVA EIRELI,SAO PAULO,8,2017,Armazens Gerais Empresario
35630027845,IMPERIO AUTOMOTIVO EIRELI,SAO PAULO,8,2017,Armazens Gerais Empresario
35630027888,CARLA SERAFINI EIRELI,SAO PAULO,8,2017,Armazens Gerais Empresario
35630027896,NOBILIA SERVICOS EM MOVEIS EIRELI,POA,8,2017,Armazens Gerais Empresario
35630027918,BARBEARIA JM - EIRELI,SAO PAULO,8,2017,Armazens Gerais Empresario
35630027926,LIVORNO REPRESENTACOES DE MATERIAIS PLASTICOS EIRELI,SAO PAULO,8,2017,Armazens Gerais Empresario
35630027934,CAMILA & CARINA PRESENTES E ACESSORIOS EIRELI,SAO PAULO,8,2017,Armazens Gerais Empresario
35630027985,O.M.A. CLINICA ODONTOLOGICA EIRELI,SAO PAULO,8,2017,Armazens Gerais Empresario
35630028051,TRANSPORTES DE CARGAS ABSOLUTO EIRELI,GUARULHOS,8,2017,Armazens Gerais Empresario
35630028078,DLF APOIO EMPRESARIAL EIRELI,SAO PAULO,8,2017,Armazens Gerais Empresario
35630028086,ZIDOI & SANTOS LOG EIRELI,GUARULHOS,8,2017,Armazens Gerais Empresario
35630028108,JOAO VICENTE LENZA APOIO ADMINISTRATIVO EIRELI,SAO PAULO,8,2017,Armazens Gerais Empresario
35630028116,MARCIA SOUND - SOM E ACESSORIOS EIRELLI,SAO PAULO,8,2017,Armazens Gerais Empresario
35630028124,COMERCIAL MUNDI EIRELI,SAO PAULO,8,2017,Armazens Gerais Empresario
35630028132,PAX - ASSESSORIA AUXILIAR EM SERVICOS ADMINISTRATIVOS - EIRELI,SAO PAULO,8,2017,Armazens Gerais Empresario
35630028141,"EXPERT COMERCIO, SERVICOS E INTERMEDIACAO DE NEGOCIOS EIRELI",SAO PAULO,8,2017,Armazens Gerais Empresario
35630028159,CARMINHA DROGARIA E PERFUMARIA EIRELI,SAO PAULO,8,2017,Armazens Gerais Empresario
35630028167,NINETY STORE EIRELI,SAO PAULO,8,2017,Armazens Gerais Empresario
35630028175,EDUARDO RODRIGUES TACOGRAFOS EIRELI,SAO PAULO,8,2017,Armazens Gerais Empresario
35630028183,ARMAZENS BRASIL INTERMEDIACOES EM OPERACOES LOGISTICAS EIRELI,SAO PAULO,8,2017,Armazens Gerais Empresario
35630028191,LANA PADARIA EIRELI,SAO PAULO,8,2017,Armazens Gerais Empresario
35630028205,R.ULISSES LOPES PADARIA E MERCADINHO EIRELI,SAO PAULO,8,2017,Armazens Gerais Empresario
35630028221,PIMENTA ROSA COMUNICACAO EIRELI,SAO PAULO,8,2017,Armazens Gerais Empresario
35630028230,HAPPY SUN - CONFECCOES EIRELI,SAO PAULO,8,2017,Armazens Gerais Empresario
35630028248,GALIO ENGENHARIA - EIRELI,SAO PAULO,8,2017,Armazens Gerais Empresario
35630028256,P V DA SILVA PADARIA EIRELI,SAO PAULO,8,2017,Armazens Gerais Empresario
35630028272,STUDIO LE CISEAUX EIRELI,SAO PAULO,8,2017,Armazens Gerais Empresario
35630028281,LUMINOSITA CLINICA DE VACINACAO E ESTETICA EIRELI,SANTO ANDRE,8,2017,Armazens Gerais Empresario
35630028299,FUNNY FASHION FANTASIAS E ARTIGOS PARA FESTAS - EIRELI,SAO PAULO,8,2017,Armazens Gerais Empresario
35630028302,SALUA CONFECCOES EIRELI,SAO PAULO,8,2017,Armazens Gerais Empresario
35630028311,FERRAZ ADMINISTRACAO DE BENS PROPRIOS E PARTICIPACOES EIRELI,SAO PAULO,8,2017,Armazens Gerais Empresario
35630028337,FLOW COMERCIO DE PRODUTOS PARA DECORACAO DE INTERIORES EIRELI,SAO PAULO,8,2017,Armazens Gerais Empresario
35630028345,HUTO KOHI RESTAURANTE EIRELI,SAO PAULO,8,2017,Armazens Gerais Empresario
35630028353,OPORTUNITY MARKETING DIRETO EIRELI,DIADEMA,8,2017,Armazens Gerais Empresario
35630028361,KINGSTON PADARIA COMERCIO DE ALIMENTOS EIRELI,SAO PAULO,8,2017,Armazens Gerais Empresario
35630028370,MANFRINATO CORRETORA DE SEGUROS - EIRELI,SAO PAULO,8,2017,Armazens Gerais Empresario
35630028388,CONTROL PEST DETETIZADORA E DESENTUPIDORA EIRELI,SAO PAULO,8,2017,Armazens Gerais Empresario
35630028396,L.A GALDINO SERVICES EIRELI,SAO PAULO,8,2017,Armazens Gerais Empresario
35630028418,JR CONSTRUCOES E REFORMAS EIRELI,SAO PAULO,8,2017,Armazens Gerais Empresario
35630028434,BARREIRA GRANDE BAR RESTAURANTE MERCADINHO E COMERCIO DE ALIMENTOS EIRELI,SAO PAULO,8,2017,Armazens Gerais Empresario
35630028442,ANTONIO MANOEL DA SILVA EIRELI,SAO PAULO,8,2017,Armazens Gerais Empresario
35630028540,SR ALIANCAS EIRELI,SAO PAULO,8,2017,Armazens Gerais Empresario
35630028558,STEEL STYLE INDUSTRIA E COMERCIO DE MOVEIS E EQUIPAMENTOS INDUSTRIAIS EIRELI.,SAO PAULO,8,2017,Armazens Gerais Empresario
35630028574,X TEEL JOIAS EM ACO EIRELI,OSASCO,8,2017,Armazens Gerais Empresario
35630028591,LENAKANO NEGOCIOS EIRELI,SAO PAULO,8,2017,Armazens Gerais Empresario
35630028639,VICTOR E MARGARETE COMERCIO E SERVICOS - EIRELI,SAO PAULO,8,2017,Armazens Gerais Empresario
35630028655,PCBZ INVESTIMENTOS EIRELI,SAO PAULO,8,2017,Armazens Gerais Empresario
35630028698,RECANTO CAFE E COMERCIO DE ALIMENTOS EIRELI,SAO PAULO,8,2017,Armazens Gerais Empresario
35630028701,QUINTANA GESTAO EMPRESARIAL - EIRELI,SAO PAULO,8,2017,Armazens Gerais Empresario
35630028710,RBB COMERCIAL DE PAPELAO E METAIS EIRELI,SAO PAULO,8,2017,Armazens Gerais Empresario
35630028728,BRUNA MIRANDA MENEGHINI EIRELI,SAO PAULO,8,2017,Armazens Gerais Empresario
35630028736,TECNOMOLDES MANUTENCAO DE MAQUINAS E COMERCIO DE EMBALAGENS PLASTICAS EIRELI,SAO PAULO,8,2017,Armazens Gerais Empresario
35630028752,SACCAR - AC OBRAS DA CONSTRUCAO CIVIL EIRELI,SAO PAULO,8,2017,Armazens Gerais Empresario
35630028779,ESTACIONAMENTO E LAVA RAPIDO PORTINARI EIRELI,SAO PAULO,8,2017,Armazens Gerais Empresario
35630028787,PLASTICO ESTE COM. EMBALAGENS EIRELI,BRAGANCA PAULISTA,8,2017,Armazens Gerais Empresario
35630028795,"COMPANY INVESTIMENTOS, MULTICREDITOS E COBRANCAS EIRELI",SAO PAULO,8,2017,Armazens Gerais Empresario
35630028809,LELLO SERVICE SERVICOS DE MANUTENCAO E ASSESSORIA EIRELI,SAO PAULO,8,2017,Armazens Gerais Empresario
35630028817,DTNJ PARTICIPACOES EIRELI,SAO PAULO,8,2017,Armazens Gerais Empresario
35630028825,MSLLUCAS SOLUCOES EM TI EIRELI,SAO PAULO,8,2017,Armazens Gerais Empresario
35630028833,J CARRILLO CONSULTORIA EIRELI,SAO PAULO,8,2017,Armazens Gerais Empresario
35630028841,PBC ASSESSORIA ADMINISTRATIVA EIRELI,SAO PAULO,8,2017,Armazens Gerais Empresario
35630028868,INTEGRA ODONTO ODONTOLOGIA INTEGRADA EIRELI,SAO PAULO,8,2017,Armazens Gerais Empresario
35630028906,EMC2 CONSULTORIA EM PROJETOS EIRELI,SAO PAULO,8,2017,Armazens Gerais Empresario
35630028914,ESTRUTURACAO DO BRASIL SERVICOS ADMINISTRATIVOS EIRELI,SAO PAULO,8,2017,Armazens Gerais Empresario
35630028922,ESTRELA DE DAVI PAES E DOCES EIRELI,SAO PAULO,8,2017,Armazens Gerais Empresario
35630028931,CONFECCOES GR17 EIRELI,SAO PAULO,8,2017,Armazens Gerais Empresario
35630028949,PIZZARIA MAGOO EIRELI,SAO PAULO,8,2017,Armazens Gerais Empresario
35630028957,FELG - APOIO ADMINISTRATIVO - EIRELI,SAO PAULO,8,2017,Armazens Gerais Empresario
35630028965,OPINADATA COLETA E PROCESSAMENTO DE DADOS EIRELI,SAO PAULO,8,2017,Armazens Gerais Empresario
35630028973,SANTORINI PARTICIPACOES E NEGOCIOS EIRELI,SAO PAULO,8,2017,Armazens Gerais Empresario
35630029015,CASTELLO ADMINISTRACAO DE NEGOCIOS EIRELI,SAO PAULO,8,2017,Armazens Gerais Empresario
35630029031,J C DOS SANTOS REPRESENTACOES COMERCIAIS - EIRELI,SAO PAULO,8,2017,Armazens Gerais Empresario
35630029040,FCP - FAVERY COSTA PARTICIPACOES EIRELI,SAO PAULO,8,2017,Armazens Gerais Empresario
35630029066,LOOTY COMERCIO DE PERFUMES EIRELI,SAO PAULO,8,2017,Armazens Gerais Empresario
35630029091,BELA EMBALAGEM FLEXOGRAFICA - EIRELI,ITAQUAQUECETUBA,8,2017,Armazens Gerais Empresario
35630029104,ABS MONTAGENS E SERVICOS TECNICOS EIRELI,SAO PAULO,8,2017,Armazens Gerais Empresario
35630029112,ADR ETIQUETAS ADESIVAS - EIRELI,SAO PAULO,8,2017,Armazens Gerais Empresario
35630029121,ABR IMPRESSAO DIGITAL EIRELI,SAO PAULO,8,2017,Armazens Gerais Empresario
35630029147,TEMPO DE ANALISE CLINICA PSIQUIATRICA E PSICANALITICA EIRELI,SAO PAULO,8,2017,Armazens Gerais Empresario
35630029163,APB SERVICOS ADMINISTRATIVOS EIRELI,LEME,8,2017,Armazens Gerais Empresario
35630029201,ROC20 IMPORTS IMPORTACAO E COMERCIO EIRELI,CARAPICUIBA,8,2017,Armazens Gerais Empresario
35630029210,OPERACOES E NOVOS NEGOCIOS EIRELI,SAO PAULO,8,2017,Armazens Gerais Empresario
35630029228,ARMAZEM COZINHA DISTRIBUICAO DE UTENSILIOS DOMESTICOS EIRELI,SAO PAULO,8,2017,Armazens Gerais Empresario
35630029236,AQUARIAN COMERCIO DE PRODUTOS ALIMENTICIOS EIRELI,BARUERI,8,2017,Armazens Gerais Empresario
35630029244,JDO TRANSPORTES DE PASSAGEIRO E LOCACAO DE VEICULOS EIRELI,SAO PAULO,8,2017,Armazens Gerais Empresario
35630029279,CAMPOS JORGE INTERMEDIACAO DE NEGOCIOS EIRELI,MAIRIPORA,8,2017,Armazens Gerais Empresario
35630029287,ALLES ORGANIZACAOO DE EVENTOS EIRELI,SANTO ANDRE,8,2017,Armazens Gerais Empresario
35630029295,DS IABRUDE ASSESSORIA EMPRESARIAL EIRELI,SAO PAULO,8,2017,Armazens Gerais Empresario
35630029309,APC GASTRONOMIA & CONSULTORIA - EIRELI,SAO PAULO,8,2017,Armazens Gerais Empresario
35630029317,SAMECH ALEPH LAMED - EIRELI,SAO PAULO,8,2017,Armazens Gerais Empresario
35630029350,GOLD SP COMERCIO DE VEICULOS EIRELI,SAO PAULO,8,2017,Armazens Gerais Empresario
35630029368,TOP MAX TEXTIL COMERCIO DE ROUPAS E TECIDOS EIRELI,SAO PAULO,8,2017,Armazens Gerais Empresario
35630029376,MEU DR. PET EMBELEZAMENTO DE ANIMAIS EIRELI,SAO PAULO,8,2017,Armazens Gerais Empresario
35630029384,R T A INDUSTRIA E COMERCIO DE EMBALAGENS EIRELI,SAO PAULO,8,2017,Armazens Gerais Empresario
35630029392,HUGOLOG TRANSPORTES EIRELI,SAO PAULO,8,2017,Armazens Gerais Empresario
35630029414,EDU BITAR FILMES E PRODUCOES EIRELI,SAO PAULO,8,2017,Armazens Gerais Empresario
35630029431,LOJA DE CONVENIENCIAS ACLIMACAO EIRELI,SAO PAULO,8,2017,Armazens Gerais Empresario
35630029457,DDE REALIZACAO DE EVENTOS EIRELI,SAO PAULO,8,2017,Armazens Gerais Empresario
35630029473,J.W.R. EMPREENDIMENTOS E CONSTRUCAO CIVIL EIRELI,SAO PAULO,8,2017,Armazens Gerais Empresario
