NIRE,Empresa,Município,Month,Year,Type
35601963104,TDF RODRIGUES TRANSPORTES EIRELI,RIBEIRAO PRETO,8,2017,Armazens Gerais Empresario
35601963112,RE TRANSPORTES E MONTAGENS INDUSTRIAIS EIRELI,SERTAOZINHO,8,2017,Armazens Gerais Empresario
35601963121,IVO PAIFFER SOROCABA EIRELI,SOROCABA,8,2017,Armazens Gerais Empresario
35601963139,PEREIRA CESTAS BASICAS EIRELI,CERQUILHO,8,2017,Armazens Gerais Empresario
35601963147,CENTER MANUTENCAO MECANICA EIRELI,ITAPETININGA,8,2017,Armazens Gerais Empresario
35601963155,BY INFORMATION TECHNOLOGY SOLUTIONS EIRELI,VOTORANTIM,8,2017,Armazens Gerais Empresario
35601963163,SPORT CENTER - EIRELI,SOROCABA,8,2017,Armazens Gerais Empresario
35601963171,ELETROSIG ELETRICA EIRELI,SOROCABA,8,2017,Armazens Gerais Empresario
35601963180,CLINICA DE CARDIOLOGIA DAIRO BICUDO PIAI JUNIOR EIRELI,CERQUILHO,8,2017,Armazens Gerais Empresario
35601977806,ALSD PARTICIPACOES EIRELI,SAO PAULO,8,2017,Armazens Gerais Empresario
35601977814,GUILHERME AUGUSTO MACHADO - EIRELI,SAO JOSE DO RIO PRETO,8,2017,Armazens Gerais Empresario
35601977831,MARCOS DAVID TECCHIO,SAO ROQUE,8,2017,Armazens Gerais Empresario
35601977849,A L GIACOBELLI REPRESENTACOES COMERCIAIS EIRELI,SAO PAULO,8,2017,Armazens Gerais Empresario
35601977857,PROALCOL ACOLCHOADOS E ACESSORIOS P/ CONDOMINIOS EIRELI,SAO PAULO,8,2017,Armazens Gerais Empresario
35601977865,CEVINI COMERCIAL IMPORTACAO E EXPORTACAO EIRELI,SAO PAULO,8,2017,Armazens Gerais Empresario
35601977873,RAFAEL FRAGOSO CORREIA EIRELI,SAO PAULO,8,2017,Armazens Gerais Empresario
35601977881,EGC COMERCIO DE ALIMENTOS EIRELI,FRANCISCO MORATO,8,2017,Armazens Gerais Empresario
35601977890,MADEIRELLI COMERCIO DE MADEIRAS EIRELI,VARZEA PAULISTA,8,2017,Armazens Gerais Empresario
35601977903,CLOVIS DOS SANTOS HERNANDES TECNOLOGIA DA INFORMACAO EIRELI,SANTO ANDRE,8,2017,Armazens Gerais Empresario
35601977911,RVR NEGOCIOS EM TELEFONIA EIRELI,SAO PAULO,8,2017,Armazens Gerais Empresario
35601977920,APPERFIX FERRAMENTAS DE FIXACAO EIRELI,DIADEMA,8,2017,Armazens Gerais Empresario
35601977938,"CACAU DESIGN IMPORTACAO, EXPORTACAO, COMERCIO E SERVICOS EIRELI",SAO PAULO,8,2017,Armazens Gerais Empresario
35601977946,IMAMURA DESENVOLVIMENTO DE SOFTWARE - EIRELI,SAO PAULO,8,2017,Armazens Gerais Empresario
35601977954,ALMEIDAS TRUCK PECAS E SERVICOS EIRELI,SAO PAULO,8,2017,Armazens Gerais Empresario
35601977962,JPF GASTRONIMIA EIRELI,SAO PAULO,8,2017,Armazens Gerais Empresario
35601977971,GREAT COMERCIO DE PECAS AUTOMOTIVAS EIRELI,SAO PAULO,8,2017,Armazens Gerais Empresario
35601977989,E.P. COMERCIO DE SOQUETES - EIRELI,SAO PAULO,8,2017,Armazens Gerais Empresario
35601977997,BELLA CASA COMERCIO DE PISOS - EIRELI,SANTO ANDRE,8,2017,Armazens Gerais Empresario
35601978004,TUCO AR COMERCIO DE VEICULOS E ACESSORIOS EIRELI,OSASCO,8,2017,Armazens Gerais Empresario
35601978012,DALUCA ENGENHARIA PREVENCIONISTA EIRELI,OSASCO,8,2017,Armazens Gerais Empresario
35601978039,JS TRADING EIRELI,GUARULHOS,8,2017,Armazens Gerais Empresario
35601978047,SP GLASS VIDRACARIA EIRELI,OSASCO,8,2017,Armazens Gerais Empresario
35601978055,MORELATO IMPLEMENTOS AUTOMOTIVOS E IMPORTACAO EIRELI,ATIBAIA,8,2017,Armazens Gerais Empresario
35601978071,A C JUNIOR REPRESENTACOES COMERCIAIS - EIRELI,PIRACAIA,8,2017,Armazens Gerais Empresario
35601978080,NOVA MARDAN MANUTENCAO E SERVICOS TECNICOS EIRELI,SAO BERNARDO DO CAMPO,8,2017,Armazens Gerais Empresario
35601978098,CONSTRUTORA L.F. MARTINS EIRELI,SANTOS,8,2017,Armazens Gerais Empresario
35601978101,MINIJOY EIRELI,SANTA ISABEL,8,2017,Armazens Gerais Empresario
35601978110,BOMBARDI INDUSTRIA E COMERCIO DE MATERIAIS ELETRONICOS EIRELI,SAO PAULO,8,2017,Armazens Gerais Empresario
35601978128,LUKI SERVICOS ADMINISTRATIVOS EIRELI,SAO PAULO,8,2017,Armazens Gerais Empresario
35601978136,AGENCIA CELM EIRELI,SAO PAULO,8,2017,Armazens Gerais Empresario
35601978144,EL MALAK ALIMENTACAO EIRELI,SAO PAULO,8,2017,Armazens Gerais Empresario
35601978152,PC HELPER - SOLUCOES EM TI EIRELI,GUARULHOS,8,2017,Armazens Gerais Empresario
35601978161,ONE AUTOMACAO E COMERCIAL EIRELI,NOVA ODESSA,8,2017,Armazens Gerais Empresario
35601978179,UTONOMO TECNOLOGIA EIRELI,SAO PAULO,8,2017,Armazens Gerais Empresario
35601978187,EUROPAC MAQUINAS E EQUIPAMENTOS INDUSTRIAIS - EIRELI,SAO PAULO,8,2017,Armazens Gerais Empresario
35601978195,MATOS UTILIDADES DOMESTICAS EIRELI,GUARULHOS,8,2017,Armazens Gerais Empresario
35601978209,ELOIM SERVICOS ADMINISTRATIVOS EIRELI,SAO PAULO,8,2017,Armazens Gerais Empresario
35601978225,DFH SOM E ACESSORIOS AUTOMOTIVOS EIRELI,SAO PAULO,8,2017,Armazens Gerais Empresario
35601978233,A & R COMERCIO DE MOVEIS E DECORACAO - EIRELI,SAO PAULO,8,2017,Armazens Gerais Empresario
35601978250,YTAPILLARES GESTAO PATRIMONIAL - EIRELI,BRAGANCA PAULISTA,8,2017,Armazens Gerais Empresario
35601978268,ALIVALLE TRANSPORTES & LOGISTICA EIRELI,GUARULHOS,8,2017,Armazens Gerais Empresario
35601978276,M.O.R. TRANSPORTE RODOVIARIO EIRELI,SAO PAULO,8,2017,Armazens Gerais Empresario
35601978284,RE9 MANUTENCOES GERAIS EIRELI,SUMARE,8,2017,Armazens Gerais Empresario
35601978292,MOBILIARE ASSENTOS CORPORATIVOS EIRELI,SAO BERNARDO DO CAMPO,8,2017,Armazens Gerais Empresario
35601978306,PRATIKA SERVICOS DE COBRANCAS EIRELI,BARRETOS,8,2017,Armazens Gerais Empresario
35601978314,SOS DO PESO GESTAO E MARKETING - EIRELI,SAO PAULO,8,2017,Armazens Gerais Empresario
35601978322,BELLA VITTA COMERCIO DE FRUTAS EIRELI,SAO PAULO,8,2017,Armazens Gerais Empresario
35601978331,JD COMERCIO DE TINTAS E REVESTIMENTOS DE PISOS EIRELI,GUARULHOS,8,2017,Armazens Gerais Empresario
35601978349,COLCHOARIA PAULISTA RP - EIRELI,SAO JOSE DO RIO PRETO,8,2017,Armazens Gerais Empresario
35601978357,SOLO MOBILE INDUSTRIA E COMERCIO DE MOVEIS EIRELI,TABOAO DA SERRA,8,2017,Armazens Gerais Empresario
35601978365,ROFFER PECAS E PARTES AUTOMOTIVA EIRELI,TABOAO DA SERRA,8,2017,Armazens Gerais Empresario
35601978373,W & W SERVICOS DE INFORMATICA EIRELI,SANTA BRANCA,8,2017,Armazens Gerais Empresario
35601978381,AGROPECUARIA SAO PEDRO EIRELI,BARRETOS,8,2017,Armazens Gerais Empresario
35601978390,ESCOLA PEQUENO APRENDIZ - IEPA EIRELI,SAO PAULO,8,2017,Armazens Gerais Empresario
35601978403,INDIO TRANSPORTES E LOGISTICA EIRELI,SAO BERNARDO DO CAMPO,8,2017,Armazens Gerais Empresario
35601984144,ORTOFIBRAS CONFECCOES EIRELI,PORTO FELIZ,8,2017,Armazens Gerais Empresario
35601984161,LDM MANUTENCAO E REPARACAO DE PECAS EIRELI,BARUERI,8,2017,Armazens Gerais Empresario
35601984179,SSERRANO REPRESENTACOES - EIRELI,SANTANA DE PARNAIBA,8,2017,Armazens Gerais Empresario
35601984187,KEMILY TUR LOCADORA EIRELI,SAO PAULO,8,2017,Armazens Gerais Empresario
35601984195,SPEED PAPER SERVICOS DE DIVULGACAO EM GERAL - EIRELI,TABOAO DA SERRA,8,2017,Armazens Gerais Empresario
35601984209,MELIUS CONSULTORIA E CORRETORA DE SEGUROS EIRELI,SUZANO,8,2017,Armazens Gerais Empresario
35601984217,"""TUTTO MARMO"" MARMORES E GRANITO EIRELI",BARUERI,8,2017,Armazens Gerais Empresario
35601984225,BETA CONSULTORIA - EIRELI,SAO BERNARDO DO CAMPO,8,2017,Armazens Gerais Empresario
35601984233,TAVEIRA SERVICOS INDUSTRIAIS EIRELI,SUZANO,8,2017,Armazens Gerais Empresario
35601984241,TAVEIRA TECNOLOGIA ISOLAMENTO TERMICO EIRELI,SUZANO,8,2017,Armazens Gerais Empresario
35601984250,FPS COMERCIO DE ARTIGOS EM GERAL EIRELI,OSASCO,8,2017,Armazens Gerais Empresario
35601984268,REGIONAL AUTOMACAO EIRELI,AMERICANA,8,2017,Armazens Gerais Empresario
35601984276,CASAGRANDE & SAITO ADMINISTRACAO DE BENS EIRELI,SANTA BARBARA D'OESTE,8,2017,Armazens Gerais Empresario
35601984292,ALEXANDRE ANTUNES EMPREENDIMENTOS IMOBILIARIOS EIRELI,RIBEIRAO PRETO,8,2017,Armazens Gerais Empresario
35601984306,M D MONTAGENS ESPECIAIS - EIRELI,SUZANO,8,2017,Armazens Gerais Empresario
35601984314,VAPOR GARAGE COMERCIO E SERVICOS EIRELI,SAO PAULO,8,2017,Armazens Gerais Empresario
35601984322,MMDC SOLUCOES E SERVICOS EIRELI,SAO PAULO,8,2017,Armazens Gerais Empresario
35601984331,AGR TRANSPORTADORA EIRELI,OSASCO,8,2017,Armazens Gerais Empresario
35601984349,ILOG BRASIL EIRELI,BARUERI,8,2017,Armazens Gerais Empresario
35601984357,VRCA COMERCIO VAREJISTA DE ARTIGOS DO VESTUARIO E ACESSORIOS EIRELI,OSASCO,8,2017,Armazens Gerais Empresario
35601984365,KONTEN SERVICOS DE ENGENHARIA EIRELI,SAO PAULO,8,2017,Armazens Gerais Empresario
35601984373,SOKATS INFORMATICA EIRELLI,SAO PAULO,8,2017,Armazens Gerais Empresario
35601984381,SINGLE LIFE COMERCIAL EIRELI,SAO PAULO,8,2017,Armazens Gerais Empresario
35601984390,KADOSH GLASS VIDRACARIA EIRELI,SAO BERNARDO DO CAMPO,8,2017,Armazens Gerais Empresario
35601984403,MOBILITA ELEVADORES EIRELI,ATIBAIA,8,2017,Armazens Gerais Empresario
35601984411,POLO GUARAREMA IMOVEIS EIRELI,GUARAREMA,8,2017,Armazens Gerais Empresario
35601984420,AB BRINDES E PRESENTES CORPORATIVOS EIRELI,SANTO ANDRE,8,2017,Armazens Gerais Empresario
35601984438,CONTRACTUS ASSESSORIA E PLANEJAMENTO TRIBUTARIO EIRELI,SANTANA DE PARNAIBA,8,2017,Armazens Gerais Empresario
35601984446,ROWEN METALURGICA EIRELI,SANTA BARBARA D'OESTE,8,2017,Armazens Gerais Empresario
35601984454,CONSTRUSANTOS PAVIMENTACAO E TERRAPLANAGEM EIRELI,SAO PAULO,8,2017,Armazens Gerais Empresario
35601984462,EWS ENGENHARIA DE TRANSPORTES EIRELI,SAO PAULO,8,2017,Armazens Gerais Empresario
35601984471,LUCIANA LUIZ PEREIRA COMERCIO DE GAS EIRELI,FERRAZ DE VASCONCELOS,8,2017,Armazens Gerais Empresario
35601984489,DUBLIN INDUSTRIA TEXTIL EIRELI,PORTO FELIZ,8,2017,Armazens Gerais Empresario
35601984501,W.T.T. WORKING TECNOLOGY & TELECOM EIRELI,SAO PAULO,8,2017,Armazens Gerais Empresario
35601984519,MC POSTAL IMPRESSOES DIGITAIS EIRELI,SAO PAULO,8,2017,Armazens Gerais Empresario
35601984527,RENOVAR IMOVEIS MOGI EIRELI,MOGI DAS CRUZES,8,2017,Armazens Gerais Empresario
35601984535,DJE COMERCIO DE ESTRUTURAS METALICAS EIRELI,ITAQUAQUECETUBA,8,2017,Armazens Gerais Empresario
35601984543,MRT SERVICOS ADMINISTRATIVOS E COMERCIAIS EIRELI,JANDIRA,8,2017,Armazens Gerais Empresario
35601984551,KI-BARATO COMERCIAL EIRELI,SUZANO,8,2017,Armazens Gerais Empresario
35601984578,SHARK DEDETIZADORA EIRELI,CARAGUATATUBA,8,2017,Armazens Gerais Empresario
35601984586,W.R DOS SANTOS INSTALACOES E SERVICOS EIRELI,SUZANO,8,2017,Armazens Gerais Empresario
35601994441,"DALLAS BITENCOURT CONSTRUCOES, PROJETOS E CONSULTORIA EIRELI",OSASCO,8,2017,Armazens Gerais Empresario
35601994450,VICTORIA PADARIA E RESTAURANTE EIRELI,BARUERI,8,2017,Armazens Gerais Empresario
35601994468,BASIC CASE CONSULTORIA E ASSESSORIA EIRELI,COTIA,8,2017,Armazens Gerais Empresario
35601994476,MAKON ASSESSORIA EIRELI,BARUERI,8,2017,Armazens Gerais Empresario
35601994484,EMPARE - EMPRESA PAULISTA DE REFRIGERANTES EIRELI,BARUERI,8,2017,Armazens Gerais Empresario
35601994492,FERNANDO JACKSON DE LIMA EIRELI,OSASCO,8,2017,Armazens Gerais Empresario
35601994506,P&C VIRTUAL STORE EIRELI,BARUERI,8,2017,Armazens Gerais Empresario
35601994514,GRTL SERVICOS EIRELI,BARUERI,8,2017,Armazens Gerais Empresario
35601994522,AVIB SERVICOS EIRELI,BARUERI,8,2017,Armazens Gerais Empresario
35601994531,HOT CAFE CAFETERIA E LANCHES EIRELI,COTIA,8,2017,Armazens Gerais Empresario
35601994549,JAGUARE FERRAMENTAS E PARAFUSOS EIRELI,SAO PAULO,8,2017,Armazens Gerais Empresario
35601994557,MAXIMO SUEIRO ALIMENTOS EIRELI,SANTANA DE PARNAIBA,8,2017,Armazens Gerais Empresario
35602008017,GT&S ENERGY SERVICE EIRELI,BADY BASSITT,8,2017,Armazens Gerais Empresario
35602008025,JCS MULHER PODEROSA MULTIMARCAS EIRELI,OSASCO,8,2017,Armazens Gerais Empresario
35602008033,INTI ENGENHARIA EIRELI,VARGEM GRANDE PAULISTA,8,2017,Armazens Gerais Empresario
35602008041,EVRP SERVICOS E EVENTOS COMERCIAIS - EIRELI,SAO PAULO,8,2017,Armazens Gerais Empresario
35602008050,JPAR PARTICIPACOES E SERVICOS EIRELI,SAO PAULO,8,2017,Armazens Gerais Empresario
35602008068,TRANSBOAT TRANSPORTADORA ESPECIALIZADA EIRELI,ATIBAIA,8,2017,Armazens Gerais Empresario
35602008076,EI PECAS E ACESSORIOS AUTOMOTIVOS - EIRELI,SAO PAULO,8,2017,Armazens Gerais Empresario
35602008084,AVANTE ASSESSORIA EMPRESARIAL EIRELI,SAO PAULO,8,2017,Armazens Gerais Empresario
35602008092,SANEXP ASSESSORIA COMERCIAL EIRELI,SAO PAULO,8,2017,Armazens Gerais Empresario
35602008106,CONTEM TECNOLOGIA COMERCIO & SERVICOS - EIRELI,SAO MANUEL,8,2017,Armazens Gerais Empresario
35602008114,SIQUEIRA & SILVA FABRICACAO DE MOVEIS EIRELI,GUARAREMA,8,2017,Armazens Gerais Empresario
35602008122,NIK-COLOR CONFECCOES E BRINDES EIRELI,SAO PAULO,8,2017,Armazens Gerais Empresario
35602008131,BAZAR DE ROUPAS MARAJO EIRELI,SAO PAULO,8,2017,Armazens Gerais Empresario
35602008149,POPTEM COMERCIO ELETRONICO EIRELI,PIRACICABA,8,2017,Armazens Gerais Empresario
35602008157,LA FLORENZA PAES E DOCES EIRELI,SAO PAULO,8,2017,Armazens Gerais Empresario
35602008165,"PASSIONE - COMERCIO DE ARTIGOS DOVESTUARIO, ACESSORIOS E CALCADOS EIRELI",CAMPINAS,8,2017,Armazens Gerais Empresario
35602008173,GALERA DA CRUZ COMERCIO DE ALIMENTOS EIRELI,SAO SEBASTIAO,8,2017,Armazens Gerais Empresario
35602008181,TRANSFAED TRANSPORTES RODOVIARIOS EM GERAL EIRELI,JUNDIAI,8,2017,Armazens Gerais Empresario
35602008190,AY HOME DESIGN - EIRELI,SAO PAULO,8,2017,Armazens Gerais Empresario
35602008203,PASTELARIA E BAR OISHIYA EIRELI,SAO PAULO,8,2017,Armazens Gerais Empresario
35602008211,RJS JARDINAGEM E BONSAI EIRELI,SAO PAULO,8,2017,Armazens Gerais Empresario
35602008220,"CRUZEIRO'S CANINDE ""D"" BAR E RESTAURANTE EIRELI",SAO PAULO,8,2017,Armazens Gerais Empresario
35602008238,CRUZEIRO'S CARAPICUIBA BAR E RESTAURANTE EIRELI,CARAPICUIBA,8,2017,Armazens Gerais Empresario
35602008246,FT LOG TRANSPORTES E LOGISTICA EIRELI,OSASCO,8,2017,Armazens Gerais Empresario
35602008254,DUTOVER LOCACAO EIRELI,SAO PAULO,8,2017,Armazens Gerais Empresario
35602008262,EMPREITEIRA P. F. BENTO EIRELI,SAO BERNARDO DO CAMPO,8,2017,Armazens Gerais Empresario
35602008271,E.M.P DA C. L. SILVA VIAGENS E COMUNICACOES EIRELI,SAO PAULO,8,2017,Armazens Gerais Empresario
35602008289,NATURAL 7 PEIXES EIRELI,SAO PAULO,8,2017,Armazens Gerais Empresario
35602008297,AH COMERCIO E SERVICOS DE ELETRO ELETRONICO EIRELI,SAO PAULO,8,2017,Armazens Gerais Empresario
35602008301,LUCATELLI ENGENHARIA EIRELI,SAO PAULO,8,2017,Armazens Gerais Empresario
35602008319,FF SOLUCOES EIRELI,SAO PAULO,8,2017,Armazens Gerais Empresario
35602008327,INS - ENGENHARIA REFORMAS E CONSTRUCAO CIVIL - EIRELI,SAO PAULO,8,2017,Armazens Gerais Empresario
35602008335,HERA SOLUCOES EM CLIMATIZACAO E CONTROLE EIRELI,SAO CAETANO DO SUL,8,2017,Armazens Gerais Empresario
35602008343,BORELLI E FIGUEIREDO CONSTRUCOES E EMPREENDIMENTOS EIRELI,SAO PAULO,8,2017,Armazens Gerais Empresario
35602008351,LAZVAZPEL COMERCIO DE EMBALAGENS EIRELI,SAO PAULO,8,2017,Armazens Gerais Empresario
35602008360,CAMPO INFINITO EMPREENDIMENTOS E PARTICIPACOES EIRELI,SAO PAULO,8,2017,Armazens Gerais Empresario
35602008378,S FERNANDEZ EMPREENDIMENTOS E PARTICIPACOES - EIRELI,SAO PAULO,8,2017,Armazens Gerais Empresario
35602008386,PEREIRA REPRESENTACAO - EIRELI,MOGI-MIRIM,8,2017,Armazens Gerais Empresario
35602008394,MERCADO GANDOLA EIRELI,SAO BERNARDO DO CAMPO,8,2017,Armazens Gerais Empresario
35602008408,LARANJA LIMA ARQUITETURA EIRELI,SAO PAULO,8,2017,Armazens Gerais Empresario
35602008416,ESTILO GARDEN JARDINAGEM & PAISAGISMO EIRELI,SAO PAULO,8,2017,Armazens Gerais Empresario
35602008424,MERCEARIA E CASA DO NORTE PARAIBA EIRELI,SAO PAULO,8,2017,Armazens Gerais Empresario
35602008432,"R M K PROJETO, CONSTRUCAO & COMERCIO EIRELI",SAO PAULO,8,2017,Armazens Gerais Empresario
35602008441,MRT RESTAURANTE E PIZZARIA EIRELI,SAO PAULO,8,2017,Armazens Gerais Empresario
35602008459,VIVACITI ADMINISTRACAO DE BENS EIRELI,SAO PAULO,8,2017,Armazens Gerais Empresario
35602008467,BEST PRINT INDUSTRIA GRAFICA EIRELI,BARUERI,8,2017,Armazens Gerais Empresario
35602008475,RODOVICTORIA TRANSPORTES EIRELI,GUARUJA,8,2017,Armazens Gerais Empresario
35602008483,EVOLUCAO NEGOCIOS IMOBILIARIOS - EIRELI,SANTANA DE PARNAIBA,8,2017,Armazens Gerais Empresario
35602008491,J.PEREIRA NETTO INFORMATICA EIRELI,IBIUNA,8,2017,Armazens Gerais Empresario
35602008505,BIJU BIJU ACESSORIOS EIRELI,PEDREIRA,8,2017,Armazens Gerais Empresario
35602008513,ALJA BAR E COMERCIO DE BEBIDAS EIRELI,SANTO ANDRE,8,2017,Armazens Gerais Empresario
35602008521,PR FABRICACAO E COMERCIO DE CARROCERIAS PECAS E VEICULOS EIRELI,GUARULHOS,8,2017,Armazens Gerais Empresario
35602008530,PAULO LOMBARDI COMERCIO DE VESTUARIO EIRELI,VINHEDO,8,2017,Armazens Gerais Empresario
35602008548,GOLDEMN TIME VARIEDADES EIRELI,JACAREI,8,2017,Armazens Gerais Empresario
35602008556,"DBF E-COMMERCE DE ARTIGOS DE CACA, PESCA E CAMPING EIRELI",SAO JOSE DO RIO PRETO,8,2017,Armazens Gerais Empresario
35602008564,BT CLINICA ODONTOLOGICA EIRELI,SAO BERNARDO DO CAMPO,8,2017,Armazens Gerais Empresario
35602008572,WLG SINALIZACAO EIRELI,ITAPEVI,8,2017,Armazens Gerais Empresario
35602008581,MARANATA BABY REPRODUCOES FOTOGRAFICAS EIRELI,SAO PAULO,8,2017,Armazens Gerais Empresario
35602008599,BICE RESTAURANTES GOURMET EIRELI,SAO PAULO,8,2017,Armazens Gerais Empresario
35602008602,MAKEL CALCADOS E CONFECCOES EIRELI,CAMPINAS,8,2017,Armazens Gerais Empresario
35602008611,NX INCLUSAO E SERVICOS EIRELI,SUMARE,8,2017,Armazens Gerais Empresario
35602008629,G6 REPAROS AUTOMOTIVOS EIRELI,OSASCO,8,2017,Armazens Gerais Empresario
35602008637,NOVA RISTER SEGURANCA PATRIMONIAL EIRELI,GUARULHOS,8,2017,Armazens Gerais Empresario
35602008653,E.M.S. CONSTRUCOES E MANUTENCAO PREDIAL - EIRELI,GUARULHOS,8,2017,Armazens Gerais Empresario
35602008661,INTER TERRA TRANSPORTES E LOCACAO EIRELI,NOVA ODESSA,8,2017,Armazens Gerais Empresario
35602008670,"BORA ATACADISTA DE AVES, BOVINOS E SUINOS EIRELI",DIADEMA,8,2017,Armazens Gerais Empresario
35602008688,AGA INCORPORACAO DE EMPREENDIMENTOS IMOBILIARIOS EIRELI,MONTE AZUL PAULISTA,8,2017,Armazens Gerais Empresario
35602008696,ANA CLAUDIA JERONIMO DOS SANTOS TRANSPORTES - EIRELI,COTIA,8,2017,Armazens Gerais Empresario
35602008700,MFC INOXSERVICE MANUTENCAO FARMA E COSMETICA EIRELI,SANTA ISABEL,8,2017,Armazens Gerais Empresario
35602008718,REI DO MDF ARTESANATOS E ACESSORIOS EIRELI,SAO PAULO,8,2017,Armazens Gerais Empresario
35602008726,COOLPER CARGA E DESCARGA EIRELI,CARAPICUIBA,8,2017,Armazens Gerais Empresario
35602008734,MACUCO SAFARI EIRELI,SAO PAULO,8,2017,Armazens Gerais Empresario
35602008742,F.N. SONORIZACAO AUTOMOTIVA EIRELI,EMBU DAS ARTES,8,2017,Armazens Gerais Empresario
35602008751,R. BALDASSARI MATERIAL PARA CONSTRUCAO EIRELI,SAO PAULO,8,2017,Armazens Gerais Empresario
35602008769,PADARIA PEDROS JANDIRA EIRELI,JANDIRA,8,2017,Armazens Gerais Empresario
35602008777,IT VALUE SERVICOS DE TECNOLOGIA DA INFORMACAO EIRELI,SAO PAULO,8,2017,Armazens Gerais Empresario
35602008785,ACOCOM ACOS E METAIS EIRELI,SAO PAULO,8,2017,Armazens Gerais Empresario
35602008793,FARMACIA DE MANIPULACAO E DROGARIA MAJOR SERTORIO EIRELI,SAO PAULO,8,2017,Armazens Gerais Empresario
35602008807,TOP BRASIL CONSTRUCOES EIRELI,SAO PAULO,8,2017,Armazens Gerais Empresario
35602008815,AAP SERVICOS AUXILIARES EIRELI,SAO PAULO,8,2017,Armazens Gerais Empresario
35602008823,ACQUA BLU SERVICOS ADMINISTRATIVOS EIRELI,SAO CAETANO DO SUL,8,2017,Armazens Gerais Empresario
35602008831,BENDINI ASSESSORIA CONTABIL - EIRELI,COTIA,8,2017,Armazens Gerais Empresario
35602008840,CLONE PINTURAS E COMERCIO MATERIAIS CONSTRUCAO EIRELI,SAO PAULO,8,2017,Armazens Gerais Empresario
35602008858,"SPEED WHEEL, RODAS E PNEUS EIRELI",EMBU DAS ARTES,8,2017,Armazens Gerais Empresario
35602008866,PRECISAO MOOCA LAUDOS E VISTORIAS EIRELI,SAO PAULO,8,2017,Armazens Gerais Empresario
35602008874,"3 COLINAS COMBUSTIVEIS, PECAS E SERVICOS LTDA",FRANCA,8,2017,Armazens Gerais Empresario
35602008882,GUIMA ADMINISTRACAO E SERVICOS EIRELI,SAO PAULO,8,2017,Armazens Gerais Empresario
35602008939,ISVIT SERVICOS ADMINISTRATIVO EIRELI,SAO PAULO,8,2017,Armazens Gerais Empresario
35602008963,CAESCO SERVICOS CONTABEIS EIRELI,EMBU DAS ARTES,8,2017,Armazens Gerais Empresario
35602009056,BSG SERVICOS E SOLUCOES EIRELI,SAO PAULO,8,2017,Armazens Gerais Empresario
35602010992,EMPORIO ESSENZA MARILIA EIRELI,MARILIA,8,2017,Armazens Gerais Empresario
35602036444,GROS ENGENHARIA - EIRELI,SAO PAULO,8,2017,Armazens Gerais Empresario
35602038552,PROTECHNIE BRASIL PARTICIPACOES EIRELI,SAO PAULO,8,2017,Armazens Gerais Empresario
35630018587,DIALOGOS PRESTACAO DE SERVICOS EIRELI,SAO PAULO,8,2017,Armazens Gerais Empresario
35630022444,"3,1416 JSD PARTICIPACOES EIRELI",SAO PAULO,8,2017,Armazens Gerais Empresario
35630022452,DIRECIONA IMOVEIS EIRELI,SAO PAULO,8,2017,Armazens Gerais Empresario
35630022461,RESTAURANTE MAIS SABOR EIRELI,SAO PAULO,8,2017,Armazens Gerais Empresario
35630022479,HWM MODAS EIRELI,SAO PAULO,8,2017,Armazens Gerais Empresario
35630022487,MARINHO APOIO ADMINISTRATIVO EIRELI,SAO PAULO,8,2017,Armazens Gerais Empresario
35630022495,NARDELO REPRESENTACAO EIRELI,SAO PAULO,8,2017,Armazens Gerais Empresario
35630022517,LMP RESTAURANTE EIRELI,SAO PAULO,8,2017,Armazens Gerais Empresario
35630022525,NEMIAS MANUTENCAO PREDIAL EIRELI,SAO PAULO,8,2017,Armazens Gerais Empresario
35630022541,J. BERTIN 24HS.- BAR E RESTAURANTE EIRELI,SAO PAULO,8,2017,Armazens Gerais Empresario
35630022568,MDG MONTAGEM DE DIVISORIAS E STANDS - EIRELI,SAO PAULO,8,2017,Armazens Gerais Empresario
35630022576,TEXTIL DISTRIBUIDORA E TRANSPORTE EIRELI,SAO PAULO,8,2017,Armazens Gerais Empresario
35630022584,ALFA PROMOTORA DE VENDAS EIRELI,SAO PAULO,8,2017,Armazens Gerais Empresario
35630022606,L. C. DOS ANJOS EIRELI,SOROCABA,8,2017,Armazens Gerais Empresario
35630022614,A BRUXINHA E O ESPANTALHO PRODUTOS INFANTIS EIRELI,SAO PAULO,8,2017,Armazens Gerais Empresario
35630022622,OMNICORE SISTEMAS DE INFORMATICA - EIRELI,SAO PAULO,8,2017,Armazens Gerais Empresario
35630022649,R2M MULTIMARCAS COMERCIAL EIRELI,SAO PAULO,8,2017,Armazens Gerais Empresario
35630022657,VALQUIRIA QUITERIA DA SILVA PELLEGRINI EIRELI,SAO PAULO,8,2017,Armazens Gerais Empresario
35630022665,EDNALVA BATISTA DE SOUSA TRANSPORTE DE PASSAGEIROS EIRELI,SAO PAULO,8,2017,Armazens Gerais Empresario
35630022673,LAXMI - IMPORTACAO E COMERCIO EIRELI,SAO PAULO,8,2017,Armazens Gerais Empresario
35630022703,EXPANDYOU TREINAMENTO EIRELI,SAO PAULO,8,2017,Armazens Gerais Empresario
35630022711,TASTY FORNECIMENTO DE ALIMENTOS SAUDAVEIS EIRELI,SAO PAULO,8,2017,Armazens Gerais Empresario
35630022720,LIDER ARTIGOS PROMOCIONAIS E COMERCIO EIRELI,TABOAO DA SERRA,8,2017,Armazens Gerais Empresario
35630022738,F8 DO BRASIL EIRELI,SAO PAULO,8,2017,Armazens Gerais Empresario
35630022754,MAHDI MAHDI GAMES EIRELI,SAO PAULO,8,2017,Armazens Gerais Empresario
35630022762,MJPOLI ASSESSORIA ADMINISTRATIVA EIRELI,SAO PAULO,8,2017,Armazens Gerais Empresario
35630022771,ILE COMUNICACAO EIRELI,SAO PAULO,8,2017,Armazens Gerais Empresario
35630022797,DCASTALDELLI CONSULTORIA EIRELI,SAO PAULO,8,2017,Armazens Gerais Empresario
35630022801,"JOINT TECH COMERCIO, SERVICOS, IMPORTACAO E EXPORTACAO EIRELI",SAO PAULO,8,2017,Armazens Gerais Empresario
35630022819,FLAX REMOCAO DE ENTULHO EIRELI,SAO PAULO,8,2017,Armazens Gerais Empresario
35630022827,AGENCIA DE EMPREGO PLENITUDE EIRELI,JACAREI,8,2017,Armazens Gerais Empresario
35630022843,BEDONE SERVICOS ADMINISTRATIVOS EIRELI,SAO PAULO,8,2017,Armazens Gerais Empresario
35630022851,AGILIDEZ CONTABIL EIRELI,BARUERI,8,2017,Armazens Gerais Empresario
35630022860,CSL GERENCIAMENTO DE PROJETOS - EIRELI,SAO PAULO,8,2017,Armazens Gerais Empresario
35630022878,DRCOB ADMINISTRACAO E COBRANCA EIRELI,SAO BERNARDO DO CAMPO,8,2017,Armazens Gerais Empresario
35630022908,CCS COMERCIO DE CHOCOLATES E SOBREMESAS EIRELI,SAO PAULO,8,2017,Armazens Gerais Empresario
35630022916,JOSE CLAUDIO DA SILVA EIRELI,SAO PAULO,8,2017,Armazens Gerais Empresario
35630022924,CONECTTAR INFORMATICA E TECNOLOGIA EIRELI,SAO PAULO,8,2017,Armazens Gerais Empresario
35630022967,RINADER COMERCIO DE VESTUARIO EIRELI,SAO PAULO,8,2017,Armazens Gerais Empresario
35630022975,RKC3 COMERCIAL DE UTILIDADES DOMESTICAS EIRELI,SAO PAULO,8,2017,Armazens Gerais Empresario
35630023009,GUIDANCE SERVICOS ADMINISTRATIVOS - EIRELI,SAO PAULO,8,2017,Armazens Gerais Empresario
35630023017,PIZZARIA TURMA DA PIZZA EIRELI,SAO PAULO,8,2017,Armazens Gerais Empresario
35630023050,CARVID CONSTRUCAO CIVIL E PROJETOS EIRELI,SAO PAULO,8,2017,Armazens Gerais Empresario
35630023068,GASPAR & SONTACHI CORRETORA DE SEGUROS DE VIDA EIRELI,SAO PAULO,8,2017,Armazens Gerais Empresario
35630023084,FBS MARCENARIA E COMERCIO EIRELI,SAO PAULO,8,2017,Armazens Gerais Empresario
35630023092,VILLA ANDRADE LANCHONETE E PADARIA EIRELI,SAO PAULO,8,2017,Armazens Gerais Empresario
35630023106,PLUSFORYOU ROUPARIA EIRELI,SAO PAULO,8,2017,Armazens Gerais Empresario
35630023114,TEJO EVENTOS E REFEICOES EIRELI,SAO PAULO,8,2017,Armazens Gerais Empresario
35630023122,ARIZONA TRANSPORTES EIRELI,SAO PAULO,8,2017,Armazens Gerais Empresario
35630023131,GAL&VERO CONSULTORIA EM TREINAMENTO E DESENVOLVIMENTO DE PESSOAS EIRELI,SAO PAULO,8,2017,Armazens Gerais Empresario
35630023149,POWER SEVEN SERVICOS EMPRESARIAIS EIRELI,SAO PAULO,8,2017,Armazens Gerais Empresario
35630023157,FAZENDA BUTANTA RESTAURANTE EIRELI,SAO PAULO,8,2017,Armazens Gerais Empresario
35630023165,MULTTI GRAOS - APOIO ADMINISTRATIVO EIRELI,SAO PAULO,8,2017,Armazens Gerais Empresario
35630023181,J.A.S COMERCIAL IMPORTADORA E EXPORTADORA EIRELI,BOM JESUS DOS PERDOES,8,2017,Armazens Gerais Empresario
35630023220,GIL MARKETING DIRETO E EVENTOS EIRELI,SAO PAULO,8,2017,Armazens Gerais Empresario
35630023238,NOVA LANCHONETE E RESTAURANTE SAO MATEUS EIRELI,SAO PAULO,8,2017,Armazens Gerais Empresario
35630023246,NOVA ITALIA PANIFICACAO E CONFEITARIA EIRELI,SAO PAULO,8,2017,Armazens Gerais Empresario
35630023271,CAVAGNA CLINICA MEDICA EIRELI,SAO PAULO,8,2017,Armazens Gerais Empresario
35630023289,BERMUDARIA CONFECCOES EIRELI,SAO PAULO,8,2017,Armazens Gerais Empresario
35630023297,HAPPY HEALTH BRASIL DE APOIO OPERACIONAL EIRELI,SAO PAULO,8,2017,Armazens Gerais Empresario
35630023327,OLIVER COMERCIO DE MATERIAIS ELETRICOS - EIRELI,SAO PAULO,8,2017,Armazens Gerais Empresario
