NIRE,Empresa,Município,Month,Year,Type
35603100197,TECNOTOP ENGENHARIA GEOTECNIA E FUNDACOES EIRELI,SAO PAULO,3,2020,Armazens Gerais Empresario
35603100201,CONEXAO SAO PAULO MINAS GERAIS PIZZARIA EIRELI,OSASCO,3,2020,Armazens Gerais Empresario
35603100219,DCT - DREAMS COME TRUE AGENCIA DE VIAGENS E TURISMO EIRELI,SAO PAULO,3,2020,Armazens Gerais Empresario
35603100227,ABN PARK ESTACIONAMENTO EIRELI,OSASCO,3,2020,Armazens Gerais Empresario
35603104010,CLAUDIA BRITO THOMAZ EIRELI,SAO PAULO,3,2020,Armazens Gerais Empresario
35603104028,ADEGA E DISTRIBUIDORA SANTA TEREZINHA EIRELI,SAO PAULO,3,2020,Armazens Gerais Empresario
35603104044,FL TRANSPORTES E TURISMO EIRELI,GUARULHOS,3,2020,Armazens Gerais Empresario
35603104052,LARISSA DE BRITO DA SILVA EIRELI,COSMOPOLIS,3,2020,Armazens Gerais Empresario
35603104095,NORBERTO CITERO LOCACAO E TRANSPORTES EIRELI,SAO PAULO,3,2020,Armazens Gerais Empresario
35603104109,DIVA MODAS COMERCIO DE TECIDOS EIRELI,SAO PAULO,3,2020,Armazens Gerais Empresario
35603104117,JS TOUR EIRELI,SAO PAULO,3,2020,Armazens Gerais Empresario
35603104125,RED S LANCHES EIRELI,SAO PAULO,3,2020,Armazens Gerais Empresario
35603104133,"MED&TEST COMERCIO E SERVICOS, INDUSTRIA DE EQUIPAMENTOS PARA POSTOS - EIRELI",OSASCO,3,2020,Armazens Gerais Empresario
35603104141,KELLY CRISTIANE DARE DA SILVA FONOAUDIOLOGIA EIRELI.,SAO VICENTE,3,2020,Armazens Gerais Empresario
35603104150,ENTREMEIO INTERVENCAO COMPORTAMENTAL EIRELI,SAO PAULO,3,2020,Armazens Gerais Empresario
35603104168,D&N ASSISTENCIA DOMICILIAR ESPECIALIZADA EIRELI,SAO PAULO,3,2020,Armazens Gerais Empresario
35603104176,RALZE EMPREITEIRA DE SERVICOS COMERCIAL EIRELI,SAO PAULO,3,2020,Armazens Gerais Empresario
35603104184,TIAGO PIVELLO - EIRELI,GUARACI,3,2020,Armazens Gerais Empresario
35603104192,SAO CAETANO COMERCIO DE EQUIPAMENTOS HOSPITALARES EIRELI,SAO CAETANO DO SUL,3,2020,Armazens Gerais Empresario
35603104206,UNIC COMERCIO DE PRODUTOS HOSPITALAR EIRELI,SAO PAULO,3,2020,Armazens Gerais Empresario
35603104214,VIVA VIDA - COMERCIO - EIRELI,SAO PAULO,3,2020,Armazens Gerais Empresario
35603104222,RETORNO DA MODA CONFECCOES EIRELI,SAO PAULO,3,2020,Armazens Gerais Empresario
35603104231,B&M COMERCIO DE BOLSAS EIRELI,SAO PAULO,3,2020,Armazens Gerais Empresario
35603104249,RANGEL CENTER BOLSAS EIRELI,SAO PAULO,3,2020,Armazens Gerais Empresario
35603104257,ATENZI SOLUCOES EM SAUDE EIRELI,SAO PAULO,3,2020,Armazens Gerais Empresario
35603104265,J. A. MOTA TRANSPORTES EIRELI,SOROCABA,3,2020,Armazens Gerais Empresario
35603104281,N N TRANSPORTES EIRELI,SAO PAULO,3,2020,Armazens Gerais Empresario
35603104290,ADUANA CAMPINAS EIRELI,CAMPINAS,3,2020,Armazens Gerais Empresario
35603104303,AFC ENGENHARIA E SOLUCOES IMOBILIARIAS EIRELI,SAO PAULO,3,2020,Armazens Gerais Empresario
35603104311,WTC LEALL TRANSPORTES EIRELI,SAO PAULO,3,2020,Armazens Gerais Empresario
35603104320,ALEXANDRINA MELEIRO - CLINICA PSIQUIATRICA EIRELI,SAO PAULO,3,2020,Armazens Gerais Empresario
35603104338,RONALDO POIATTI RESTAURANTES EIRELI,SAO PAULO,3,2020,Armazens Gerais Empresario
35603104346,STUDIO RSC - INSTITUTO DE BELEZA EIRELI,SANTOS,3,2020,Armazens Gerais Empresario
35603104354,TWO BROTHERS LOJA E CONVENIENCIA EIRELI,SAO PAULO,3,2020,Armazens Gerais Empresario
35603104362,P.H.P. DE SANTI REPRESENTACAO COMERCIAL EIRELI,CRAVINHOS,3,2020,Armazens Gerais Empresario
35603104371,ADEGA SAIDEIRA EIRELI,SAO PAULO,3,2020,Armazens Gerais Empresario
35603104389,GREAT COMERCIO DE PRESENTES EIRELI,SANTO ANDRE,3,2020,Armazens Gerais Empresario
35603104397,MCL BAR E RESTAURANTE EIRELI,SAO PAULO,3,2020,Armazens Gerais Empresario
35603104401,TRANSPORTADORA RC - EIRELI,MORRO AGUDO,3,2020,Armazens Gerais Empresario
35603104419,"FUTURE DEVICES TECNOLOGIA EM SAUDE E ESTETICA, VENDA, LOCACAO E CURSOS DE CAPACITACAO EIRELI",CAMPINAS,3,2020,Armazens Gerais Empresario
35603104427,CARDCRED CORRESPONDENTE DE INSTITUICAO FINANCEIRA E ADMINISTRACAO DE CARTOES EIRELI,POA,3,2020,Armazens Gerais Empresario
35603104435,"""NIAMI SERVICOS MEDICOS EIRELI""",SANTANA DE PARNAIBA,3,2020,Armazens Gerais Empresario
35603104443,JGS GESTAO EMPRESARIAL EIRELI,COTIA,3,2020,Armazens Gerais Empresario
35603104460,"BUMPER MAGAZINE COMERCIO DE ELETRO ELETRONICOS, ARTIGOS ESPORTIVOS E VESTUARIO EIRELI",TABOAO DA SERRA,3,2020,Armazens Gerais Empresario
35603104478,JLS ASSESSORIA EIRELI,SAO PAULO,3,2020,Armazens Gerais Empresario
35603104486,MC TEC INFORMATICA EIRELI,SAO PAULO,3,2020,Armazens Gerais Empresario
35603104494,SANTHE COMERCIO E CONFECCOES EIRELI,SAO PAULO,3,2020,Armazens Gerais Empresario
35603104508,ACQUA SOLUM SOLUCOES HIDRICAS EIRELI,JACAREI,3,2020,Armazens Gerais Empresario
35603104516,ARKIPELAGO PRODUTOS ORTOPEDICOS E ESPORTIVOS EIRELI,SAO PAULO,3,2020,Armazens Gerais Empresario
35603104524,GAVI LOCACOES E SERVICOS EIRELI,ATIBAIA,3,2020,Armazens Gerais Empresario
35603104532,COMERCIAL FLS EMBALAGENS EIRELI,SAO PAULO,3,2020,Armazens Gerais Empresario
35603104559,CASA DE PAES SAO BENTO EIRELI,GUARULHOS,3,2020,Armazens Gerais Empresario
35603104575,MARIVALDO DA SILVA HORTA - EIRELI,SEBASTIANOPOLIS DO SUL,3,2020,Armazens Gerais Empresario
35603104583,RESTAURANTE KAM SUSHI EIRELI,SAO PAULO,3,2020,Armazens Gerais Empresario
35603104591,VADERS ASSESSORIA EIRELI,EMBU DAS ARTES,3,2020,Armazens Gerais Empresario
35603104605,MARGARETE CAMPOS - BUFFET EIRELI,SANTANA DE PARNAIBA,3,2020,Armazens Gerais Empresario
35603104613,FLYPRO SOLUCOES EM DRONES EIRELI,SAO CAETANO DO SUL,3,2020,Armazens Gerais Empresario
35603104621,Y MIDIAS AGENCIA DE PUBLICIDADE EIRELI,SAO PAULO,3,2020,Armazens Gerais Empresario
35603104630,SAG EXPRESS SERVICOS TERCEIRIZADOS EIRELI,SAO PAULO,3,2020,Armazens Gerais Empresario
35603104648,MATSUNAE PESCADOS EIRELI,SAO PAULO,3,2020,Armazens Gerais Empresario
35603104656,LAUD INDUSTRIA E COMERCIO DE ARAMES EIRELI,CAIEIRAS,3,2020,Armazens Gerais Empresario
35603104664,ERC ARTIGOS DE PERFUMARIA EIRELI,SAO PAULO,3,2020,Armazens Gerais Empresario
35603104672,FERRARI MECANIZACAO AGRICOLAS EIRELI,CAJURU,3,2020,Armazens Gerais Empresario
35603104681,OKAMURA CONSULTORIA E INVESTIMENTOS EIRELI,PIEDADE,3,2020,Armazens Gerais Empresario
35603104699,LAR CONNECT COMERCIO E SERVICO EIRELI,SAO PAULO,3,2020,Armazens Gerais Empresario
35603104702,AML LOPES PINTURAS EIRELI,OSASCO,3,2020,Armazens Gerais Empresario
35603104711,MOSAICO GESTAO E ADMINISTRACAO DE BENS EIRELI,SAO PAULO,3,2020,Armazens Gerais Empresario
35603104729,M.A. TRANSPORTES EIRELI,SAO PAULO,3,2020,Armazens Gerais Empresario
35603104737,SKY JABAQUARA ODONTOLOGIA EIRELI,SAO PAULO,3,2020,Armazens Gerais Empresario
35603104745,KMA TEMAKERIA EIRELI,SAO PAULO,3,2020,Armazens Gerais Empresario
35603104753,SIGMAECP SERVICOS EIRELI,SAO PAULO,3,2020,Armazens Gerais Empresario
35603104761,JOAO HENRIQUE SILVERIO EIRELI,GUARULHOS,3,2020,Armazens Gerais Empresario
35603104770,LANCHONETE SAIKOU EIRELI,SAO PAULO,3,2020,Armazens Gerais Empresario
35603104788,FREDWAL ASSESSORIA COLETA DE RESIDUOS SOLIDOS EIRELI,GUARULHOS,3,2020,Armazens Gerais Empresario
35603104796,CANTINHO DO AUMIGO ABRIGO PARA CAES EIRELI,SAO BERNARDO DO CAMPO,3,2020,Armazens Gerais Empresario
35603104800,J LOPES AGENCIAMENTO E TRANSPORTES EIRELI,INDAIATUBA,3,2020,Armazens Gerais Empresario
35603104818,CASA DE CARNES LORENZO EIRELI,SALTO,3,2020,Armazens Gerais Empresario
35603104826,OUTLET DO JEANS MORADA DO SOL EIRELI,INDAIATUBA,3,2020,Armazens Gerais Empresario
35603104834,CENTRAL MEGAS EIRELI,SAO PAULO,3,2020,Armazens Gerais Empresario
35603104842,DMACEDO COMERCIO E SERVICOS DE CONSTRUCAO CIVIL EIRELI,SAO PAULO,3,2020,Armazens Gerais Empresario
35603104851,LITTWIN PRODUCOES ARTISTICAS EIRELI,SAO CAETANO DO SUL,3,2020,Armazens Gerais Empresario
35603104869,JOAO VITOR GOMES LEITE EIRELI,SANTA CRUZ DA CONCEICAO,3,2020,Armazens Gerais Empresario
35603104877,JUSTENA APOIO ADMINISTRATIVO EIRELI,SAO PAULO,3,2020,Armazens Gerais Empresario
35603104885,APPTO NEGOCIACOES FINANCEIRAS EIRELI,SAO PAULO,3,2020,Armazens Gerais Empresario
35603104893,V M S SERVICOS TERCEIRIZADOS EIRELI,SAO PAULO,3,2020,Armazens Gerais Empresario
35603104907,HPM HOLDING EIRELI,GUARATINGUETA,3,2020,Armazens Gerais Empresario
35603104915,VESTTI COMERCIO DO VESTUARIO E ACESSORIOS EIRELI,SANTOS,3,2020,Armazens Gerais Empresario
35603104923,NOVO AMANHA ASSESSORIA IMOBILIARIA EIRELI,SAO PAULO,3,2020,Armazens Gerais Empresario
35603104931,PROTON COMERCIO DE GERADORES E ASSISTENCIA TECNICA EIRELI,SAO PAULO,3,2020,Armazens Gerais Empresario
35603104940,"CEZARSANTOS ASSESSORIA JURIDICA, PARTICIPACOES E SERVICOS - EIRELI",SAO PAULO,3,2020,Armazens Gerais Empresario
35603104958,LITNORTE ENGENHARIA E CONSTRUCAO EIRELI,SAO PAULO,3,2020,Armazens Gerais Empresario
35603104974,SOLUCAO COMERCIO E SERVICOS EIRELI,SAO PAULO,3,2020,Armazens Gerais Empresario
35603104991,T.C. GERALDO EIRELI,RIBEIRAO PRETO,3,2020,Armazens Gerais Empresario
35603105008,AUTO MECANICA PANDA EIRELI,SAO BERNARDO DO CAMPO,3,2020,Armazens Gerais Empresario
35603105024,A.D. SERVICOS DE COBRANCA EIRELI,GUARULHOS,3,2020,Armazens Gerais Empresario
35603105032,META DISTRIBUIDORA EIRELI,SAO PAULO,3,2020,Armazens Gerais Empresario
35603105041,ADELISE EVENTOS E PROMOCOES DE VENDAS EIRELI,SAO PAULO,3,2020,Armazens Gerais Empresario
35603105059,BITAR EMPREENDIMENTOS E PARTICIPACOES EIRELI,BARUERI,3,2020,Armazens Gerais Empresario
35603105067,PLATINE BRASIL COMERCIO DE BIJUTERIAS E TECIDOS EM GERAL EIRELI,SAO PAULO,3,2020,Armazens Gerais Empresario
35603105075,FUSONA COMERCIAL EIRELI,SAO PAULO,3,2020,Armazens Gerais Empresario
35603105083,TCG CENTRO AUTOMOTIVO E SERVICOS ADMINISTRATIVOS EIRELI,OSASCO,3,2020,Armazens Gerais Empresario
35603105091,COMMAIS COMERCIAL DE ALIMENTOS EIRELI,SAO BERNARDO DO CAMPO,3,2020,Armazens Gerais Empresario
35603105105,PALAZON ATIBAIA EMPREENDIMENTOS IMOBILIARIOS SPE EIRELI,ATIBAIA,3,2020,Armazens Gerais Empresario
35603105113,ANDERSON CALIXTO DOS SANTOS TRANSPORTES EIRELI,GUARULHOS,3,2020,Armazens Gerais Empresario
35603105121,4PONTOS DO BRASIL COMERCIAL EIRELI,SANTO ANDRE,3,2020,Armazens Gerais Empresario
35603105130,VITA COACHING EIRELI,AVARE,3,2020,Armazens Gerais Empresario
35603105148,BONANZA COMERCIO DE TECIDOS E CONFECCOES EIRELI,SAO PAULO,3,2020,Armazens Gerais Empresario
35603105156,MECY RESTAURANTE E LANCHONETE - EIRELI,SAO PAULO,3,2020,Armazens Gerais Empresario
35603105172,RENATO AGUIAR BUCCI EIRELI,INDAIATUBA,3,2020,Armazens Gerais Empresario
35603105199,LIBRUS CORRETORA DE SEGUROS EIRELI,JACAREI,3,2020,Armazens Gerais Empresario
35603105229,GGWC VAREJO & ATACADO SORVETES EIRELI,OSASCO,3,2020,Armazens Gerais Empresario
35603105237,A.A.D.G. ADMINISTRACAO E PARTICIPACOES - EIRELI,SAO PAULO,3,2020,Armazens Gerais Empresario
35603105245,K&R SHOP EIRELI,SAO PAULO,3,2020,Armazens Gerais Empresario
35603105253,HARBOR SEGUROS ADMINISTRADORA E CORRETORA DE SEGUROS EIRELI,GUARULHOS,3,2020,Armazens Gerais Empresario
35603105261,"METAL BLUE COMERCIO ATACADISTA DE METAIS, PAPELAO E PLASTICOS EIRELI",SAO PAULO,3,2020,Armazens Gerais Empresario
35603105270,GREENGIFTS COMERCIAL IMPORTACAO E EXPORTACAO EIRELI,SANTO ANDRE,3,2020,Armazens Gerais Empresario
35603105288,RENOVE OURIVESARIA E FOLHEACAO EIRELI,SAO PAULO,3,2020,Armazens Gerais Empresario
35603105296,OTICAS MILLER - EIRELI,SAO PAULO,3,2020,Armazens Gerais Empresario
35603105318,G&I EMBALAGENS EIRELI,SAO PAULO,3,2020,Armazens Gerais Empresario
35603105326,CLAQUE CORRETORA DE SEGUROS DE VIDA EIRELI,GUARULHOS,3,2020,Armazens Gerais Empresario
35603105334,COMERCIO DE RADIADORES XAVIER EIRELI,SAO PAULO,3,2020,Armazens Gerais Empresario
35603105342,ASSETEL - RECURSOS HUMANOS EIRELI,SERTAOZINHO,3,2020,Armazens Gerais Empresario
35603105351,OS MALUCOS PRODUCOES EIRELI,SAO PAULO,3,2020,Armazens Gerais Empresario
35603105377,"RM EDUCACAO, COMERCIO, INDUSTRIA E SERVICOS EIRELI",TAUBATE,3,2020,Armazens Gerais Empresario
35603105407,CARLOS ROBERTO FERNANDES GIL EIRELI,RIBEIRAO PRETO,3,2020,Armazens Gerais Empresario
35603105431,SAPORITO SERVICOS ADMINISTRATIVOS EIRELI,PRESIDENTE PRUDENTE,3,2020,Armazens Gerais Empresario
35603105440,POLILAMPS ILUMINACAO COMERCIO EIRELI,SAO PAULO,3,2020,Armazens Gerais Empresario
35603105458,R T ECOMMERCE TECNOLOGIA EIRELI,SAO PAULO,3,2020,Armazens Gerais Empresario
35603105466,DORIA DUE SERVICOS DE INFORMATICA EIRELI,SAO PAULO,3,2020,Armazens Gerais Empresario
35603105482,DISTRIBUIDORA E TRANSPORTADORA TRANS GOLD EIRELI,SAO PAULO,3,2020,Armazens Gerais Empresario
35603105491,SANGHATA COMERCIAL EIRELI,SAO PAULO,3,2020,Armazens Gerais Empresario
35603105504,MERCADO VR FILHO EIRELI,SAO PAULO,3,2020,Armazens Gerais Empresario
35603105512,MARCPLAST SACOLAS PLASTICAS PERSONALIZADAS EIRELI,SAO PAULO,3,2020,Armazens Gerais Empresario
35603105521,CONEXAO COMERCIO E SERVICOS EIRELI,SAO BERNARDO DO CAMPO,3,2020,Armazens Gerais Empresario
35603105539,MANDY COMERCIAL EIRELI,ITAQUAQUECETUBA,3,2020,Armazens Gerais Empresario
35603105547,MDFATO SOLUCOES EM MERCENARIA EIRELI,CARAPICUIBA,3,2020,Armazens Gerais Empresario
35603105555,K-ATIVA COMERCIAL EIRELI,SAO PAULO,3,2020,Armazens Gerais Empresario
35603105563,A M M DISTRIBUIDORA DE ALIMENTOS EIRELI,SAO PAULO,3,2020,Armazens Gerais Empresario
35603105571,AUTO NEVES SOCORRO E GUINCHO EIRELI,SAO PAULO,3,2020,Armazens Gerais Empresario
35603105598,FERNANDA RODRIGUES DESSIMONI CESARIO EIRELI,SANTO ANDRE,3,2020,Armazens Gerais Empresario
35603105601,START ELETROMOTORES SERVICOS DE MANUTENCAO EIRELI,RIBEIRAO PIRES,3,2020,Armazens Gerais Empresario
35603105610,THUNDER TOOLS COMERCIO DE MATERIAIS PARA CONSTRUCAO EIRELI,DIADEMA,3,2020,Armazens Gerais Empresario
35603105628,PITTA COMERCIO DE PRODUTOS MEDICOS EIRELI,GUARULHOS,3,2020,Armazens Gerais Empresario
35603105636,ZDL INDUSTRIA E COMERCIO DE PECAS INDUSTRIAIS EIRELI,SAO PAULO,3,2020,Armazens Gerais Empresario
35603105644,ALOE LINE DISTRIBUIDORA DE COSMETICOS EIRELI,GUARULHOS,3,2020,Armazens Gerais Empresario
35603105652,AMETISTA PISCINAS EIRELI,ATIBAIA,3,2020,Armazens Gerais Empresario
35603105661,DO BEN COMERCIO DE PECAS E ACESSORIOS PARA ELETROELETRONICOS EIRELI,GUARULHOS,3,2020,Armazens Gerais Empresario
35603105679,AMERICAN SERVICE - SERVICOS AEROPORTUARIOS EIRELI,GUARULHOS,3,2020,Armazens Gerais Empresario
35603105687,LUDICA MOVEIS PLANEJADOS EIRELI,SUZANO,3,2020,Armazens Gerais Empresario
35603105695,GUARUFLEX SERVICOS ADMINISTRATIVOS E GESTAO DE EMPRESAS EIRELI,GUARULHOS,3,2020,Armazens Gerais Empresario
35603105709,HOLDING ARENAVACHI EIRELI,SUZANO,3,2020,Armazens Gerais Empresario
35603105717,LIMMA AUTO CENTER EIRELI,GUARULHOS,3,2020,Armazens Gerais Empresario
35603105725,UNION CC ASSESSORIA EIRELI,GUARULHOS,3,2020,Armazens Gerais Empresario
35603105733,LMS SOUZA TRANSPORTES EIRELI,OSASCO,3,2020,Armazens Gerais Empresario
35603105741,PEDRAO MULTIMARCAS COMERCIO DE AUTOMOVEIS EIRELI,ATIBAIA,3,2020,Armazens Gerais Empresario
35603105750,LCCP COMERCIO DE OTICA EIRELI,GUARULHOS,3,2020,Armazens Gerais Empresario
35603105768,PGTT SOLUCOES EM T.I EIRELI,GUARULHOS,3,2020,Armazens Gerais Empresario
35603105776,CONSTRUTORA E EMPREITEIRA GUARU EIRELI,GUARULHOS,3,2020,Armazens Gerais Empresario
35603105784,HOME ELEGANCE COMERCIO DE MOVEIS EIRELI,GUARULHOS,3,2020,Armazens Gerais Empresario
35603105792,S&V COMERCIO E FABRICACAO DE BRINQUEDOS EIRELI,SAO PAULO,3,2020,Armazens Gerais Empresario
35603105806,ALEXANDRE LOURENCO DA SILVA EIRELI,GUARULHOS,3,2020,Armazens Gerais Empresario
35603105814,JSF TRANSPORTES SERVICOS E LOCACOES EIRELI,GUARULHOS,3,2020,Armazens Gerais Empresario
35603105822,OPTICA ESPLENDOR EIRELI,GUARULHOS,3,2020,Armazens Gerais Empresario
35603105831,SALUS MIX COMERCIO DE ARTIGOS DOMESTICOS EIRELI,GUARULHOS,3,2020,Armazens Gerais Empresario
35603105849,RPC MANUTENCOES EIRELI,GUARULHOS,3,2020,Armazens Gerais Empresario
35603105857,REISIL ISOLAMENTOS E SOLUCOES INDUSTRIAIS EIRELI,SAO PAULO,3,2020,Armazens Gerais Empresario
35603105865,AUTO ESCOLA NOVA MAIA EIRELI,GUARULHOS,3,2020,Armazens Gerais Empresario
35603105873,NUTRE NORTE COMERCIO DE OLEO E GORDURA EIRELI,OSASCO,3,2020,Armazens Gerais Empresario
35603105881,CAROL ISENCOES TRIBUTARIAS E SERVICOS ADMINISTRATIVOS - EIRELI,GUARULHOS,3,2020,Armazens Gerais Empresario
35603105890,STYLUS SOUND ACESSORIOS AUTOMOTIVOS EIRELI,SAO PAULO,3,2020,Armazens Gerais Empresario
35603107213,MAGAZINE ANDRIANI EIRELI,SAO JOAQUIM DA BARRA,3,2020,Armazens Gerais Empresario
35603108813,AUTOMATIZA ENGENHARIA EIRELI,CAMPINAS,3,2020,Armazens Gerais Empresario
35603108821,WILLIAM GESSO EIRELI,CAMPINAS,3,2020,Armazens Gerais Empresario
35603108830,PALLET & LOG COMERCIO DE PALETES EIRELI,SUMARE,3,2020,Armazens Gerais Empresario
35603108848,PORTO DI NUCCI EMPREENDIMENTOS IMOBILIARIOS EIRELI,CAMPINAS,3,2020,Armazens Gerais Empresario
35603108856,POTENCIAL TRANSPORTES EIRELI,PAULINIA,3,2020,Armazens Gerais Empresario
35603108864,FN LOG TRANSPORTES EIRELI,PAULINIA,3,2020,Armazens Gerais Empresario
35603108872,CASA DE RACAO SAN WILLY EIRELI,MONTE MOR,3,2020,Armazens Gerais Empresario
35603108881,RODISA IMPLEMENTOS RODOVIARIOS EIRELI,SUMARE,3,2020,Armazens Gerais Empresario
35603108899,MARQUEZINI ARTESANATO EM MADEIRA EIRELI,PEDREIRA,3,2020,Armazens Gerais Empresario
35603108902,GUSTAVO MARCOS DE OLIVEIRA EIRELI,PEDREIRA,3,2020,Armazens Gerais Empresario
35603108911,COMERCIO QUIMICO ANALITICO EIRELI,PAULINIA,3,2020,Armazens Gerais Empresario
35603108929,DOKINOS COMERCIO DE PRODUTOS ALIMENTICIOS - EIRELI,BRAGANCA PAULISTA,3,2020,Armazens Gerais Empresario
35603108937,ZERLOTTI GENETICS - SERVICOS VETERINARIOS EIRELI,JAGUARIUNA,3,2020,Armazens Gerais Empresario
35603108945,CRISTIANE DA SILVA EIRELI,CAMPINAS,3,2020,Armazens Gerais Empresario
35603108953,WALESKA ALVES DE LIMA EIRELI,SUMARE,3,2020,Armazens Gerais Empresario
35603108961,CAMARGO MOVEIS PLANEJADOS EIRELI,AMERICANA,3,2020,Armazens Gerais Empresario
35603108970,ROZA RAIZ COSMETICOS EIRELI,AMERICANA,3,2020,Armazens Gerais Empresario
35603108988,ELITTE REPRESENTACAO PORTAS E JANELAS EIRELI,CAMPINAS,3,2020,Armazens Gerais Empresario
35603108996,HIDROVALINHOS ASSISTENCIA TECNICA EIRELI,VALINHOS,3,2020,Armazens Gerais Empresario
35603109003,RENOVE CONSTRUTORA E GERENCIAMENTO EIRELI,CAMPINAS,3,2020,Armazens Gerais Empresario
35603109011,INSMEQ COMERCIO E INSTALACAO DE MAQUINAS E EQUIPAMENTOS - EIRELI.,CAMPINAS,3,2020,Armazens Gerais Empresario
35603109020,EDITORA MM COMUNICACAO INTEGRADA EIRELI,CAMPINAS,3,2020,Armazens Gerais Empresario
35603109038,A R C 3 COMUNICACAO EIRELI,CAMPINAS,3,2020,Armazens Gerais Empresario
35603109046,CHAVES ENGENHARIA E LOCACAO DE MAQUINAS EIRELI,CAMPINAS,3,2020,Armazens Gerais Empresario
35603115127,J.E.J. ENGENHARIA EIRELI,MAUA,3,2020,Armazens Gerais Empresario
35603115216,CONTEUDO A LA CARTE ASSESSORIA DE COMUNICACAO EIRELI,SAO PAULO,3,2020,Armazens Gerais Empresario
35603115224,3S ELETRONICOS E COMERCIO EIRELI,SAO PAULO,3,2020,Armazens Gerais Empresario
35603115232,ADEGA MOREIRAS DISTRIBUIDORA DE BEBIDAS EIRELI,SAO PAULO,3,2020,Armazens Gerais Empresario
35603115241,OFICIAL BRASIL SOLUCOES EM INFORMATICA EIRELI,SAO PAULO,3,2020,Armazens Gerais Empresario
35603115259,J SHOW PRODUCOES ARTISTICAS EIRELI,SAO PAULO,3,2020,Armazens Gerais Empresario
35603115267,HAC DISTRIBUIDORA DE PECAS PARA VEICULOS EIRELI,SAO CAETANO DO SUL,3,2020,Armazens Gerais Empresario
35603115275,ANA L DE S NOGUEIRA - EIRELI,MORRO AGUDO,3,2020,Armazens Gerais Empresario
35603115283,SYGMATEC INFORMATICA E SISTEMAS EIRELI,SAO PAULO,3,2020,Armazens Gerais Empresario
35603115291,F.P.A CONSULTORIA EMPRESARIAL EIRELI,SAO PAULO,3,2020,Armazens Gerais Empresario
35603115305,BRASIL PECAS EIRELI,POA,3,2020,Armazens Gerais Empresario
35603115321,AGROFERT SAO JUDAS EIRELI,BATATAIS,3,2020,Armazens Gerais Empresario
35603115330,MRG INDUSTRIA E COMERCIO DE MATERIAIS ISOLANTES EIRELI,JUNDIAI,3,2020,Armazens Gerais Empresario
35603115348,SINASERV SINALIZACAO E SERVICOS EIRELI,GUARULHOS,3,2020,Armazens Gerais Empresario
35603115356,MARTINS NUCLEO DE SERVICOS E ADMINISTRACAO DE OBRAS EIRELI,SAO BERNARDO DO CAMPO,3,2020,Armazens Gerais Empresario
35603115364,GIOVANELLI SERVICOS ADMINISTRATIVOS EIRELI,COTIA,3,2020,Armazens Gerais Empresario
35603115372,HUABO LEI & CIA - EIRELI,SANTO ANDRE,3,2020,Armazens Gerais Empresario
35603115402,IGOR SARINGER MARTIN EIRELI,SAO PAULO,3,2020,Armazens Gerais Empresario
35603115411,FCDOIS BRASIL METAIS EIRELI,ITUPEVA,3,2020,Armazens Gerais Empresario
35603115429,COMERCIAL EZB CONSTRUTORA E INCORPORADORA EIRELI,SAO PAULO,3,2020,Armazens Gerais Empresario
35603115437,PEREIRA SERVICOS ADMINISTRATIVOS E TREINAMENTOS PROFISSIONAIS E GERENCIAIS EIRELI,AMERICANA,3,2020,Armazens Gerais Empresario
35603115445,RAINHA DA PAZ PIZZARIA EIRELI,SANTOS,3,2020,Armazens Gerais Empresario
35603115453,CENTRO DE FORMACAO DO VIDRACEIRO E SERRALHEIRO LTDA,SAO PAULO,3,2020,Armazens Gerais Empresario
35603115461,NASCIMENTO TRANSPORTES & TURISMO EIRELI,MAIRINQUE,3,2020,Armazens Gerais Empresario
35603115488,GUODE COMERCIO IMPORTACAO E EXPORTACAO EIRELI,SAO PAULO,3,2020,Armazens Gerais Empresario
35603115496,VISION MUSIC PRODUCOES EIRELI,SAO PAULO,3,2020,Armazens Gerais Empresario
35603115518,"RECADE SERVICOS DE ALVENARIA, REFORMAS E MANUTENCAO EIRELI",SAO PAULO,3,2020,Armazens Gerais Empresario
35603115534,D&D REPRESENTACAO COMERCIAL - EIRELI,SAO PAULO,3,2020,Armazens Gerais Empresario
35603115542,PADARIA E CONFEITARIA AVIZ EIRELI,SAO PAULO,3,2020,Armazens Gerais Empresario
35603115551,E V V DE MENDONCA TRANSPORTES EIRELI,SAO PAULO,3,2020,Armazens Gerais Empresario
35603115569,EXACARD ADMINISTRADORA E MEIOS DE PAGAMENTOS EIRELI,TUPA,3,2020,Armazens Gerais Empresario
35603115577,NINATHEO COMERCIO E LOCACAO DE ARTIGOS DE FORMATURA EIRELI,SAO PAULO,3,2020,Armazens Gerais Empresario
35603115585,PINHEIRO & SILVA MERCADO EIRELI,SAO PAULO,3,2020,Armazens Gerais Empresario
35603115593,ANDRESSA MIRANDA GOMES EIRELI,SAO PAULO,3,2020,Armazens Gerais Empresario
35603115607,VILAPEL INDUSTRIA E COMERCIO DE EMBALAGENS E APARAS EIRELI,OSASCO,3,2020,Armazens Gerais Empresario
35603115615,ARB ACADEMIA EIRELI,EMBU DAS ARTES,3,2020,Armazens Gerais Empresario
35603115623,TABU UNIFORMES E VESTUARIOS EIRELI,ITAPECERICA DA SERRA,3,2020,Armazens Gerais Empresario
35603115631,AVG SOLUCOES EM ENGENHARIA E COMERCIO EIRELI,SAO BERNARDO DO CAMPO,3,2020,Armazens Gerais Empresario
35603115640,T7 COMERCIO DE MATERIAIS PROMOCIONAIS E SERVICOS GRAFICOS EIRELI,SAO PAULO,3,2020,Armazens Gerais Empresario
35603115658,ERICA A. DE LIMA SANTOS TRANSPORTE EIRELI,SUZANO,3,2020,Armazens Gerais Empresario
35603115666,WINE ALPHA COMERCIO DE BEBIDAS EIRELI,BARUERI,3,2020,Armazens Gerais Empresario
35603115674,CS CAVASSAN CONFECCAO EIRELI,INDAIATUBA,3,2020,Armazens Gerais Empresario
35603115682,"ADF SERVICOS, ASSESSORIA E COMERCIO EIRELI",SAO PAULO,3,2020,Armazens Gerais Empresario
35603115691,ASDEVELOPER SOFTWARE EIRELI,SAO PAULO,3,2020,Armazens Gerais Empresario
35603115704,ITX DO BRASIL LOCADORA DE EQUIPAMENTOS CUSTOMIZADOS EIRELI,SAO PAULO,3,2020,Armazens Gerais Empresario
35603115712,TURISMO DIVINEIA EIRELI,SAO PAULO,3,2020,Armazens Gerais Empresario
35603115721,BMM PROJETOS E CONSTRUCOES EIRELI,SUZANO,3,2020,Armazens Gerais Empresario
35603115739,PHV TRANSPORTES EIRELI,SAO PAULO,3,2020,Armazens Gerais Empresario
35603115747,VAR RESTAURANTE EIRELI,SAO JOSE DOS CAMPOS,3,2020,Armazens Gerais Empresario
35603115755,RADIANCE SERVICES TREINAMENTO EM DESENVOLVIMENTO PROFISSIONAL E GERENCIAL EIRELI,GUARUJA,3,2020,Armazens Gerais Empresario
35603115763,"BY APPOINTMENT IMPORTACAO, EXPORTACAO E COMERCIO - EIRELI",ITAPECERICA DA SERRA,3,2020,Armazens Gerais Empresario
35603115771,SD ADMINISTRACAO DE BENS EIRELI,SAO PAULO,3,2020,Armazens Gerais Empresario
35603115780,ADN TRANSMISSOES EIRELI,SERTAOZINHO,3,2020,Armazens Gerais Empresario
35603115798,PARADA DO PESCADOR COMERCIAL EIRELI,SAO PAULO,3,2020,Armazens Gerais Empresario
35603115801,DROGARIA MAIS POPULAR ARTUR ALVIM EIRELI,SAO PAULO,3,2020,Armazens Gerais Empresario
35603115836,DRY COMERCIO OTICO EIRELI,SERTAOZINHO,3,2020,Armazens Gerais Empresario
35603115844,RENATA AMICI CHANQUETI EIRELI,PRADOPOLIS,3,2020,Armazens Gerais Empresario
35603115852,IR COMUNICACAO VISUAL EIRELI,SAO PAULO,3,2020,Armazens Gerais Empresario
35603115861,CLEBERSON DE ARAUJO ZAMBONI COMERCIO ATACADISTA EIRELI,SAO PAULO,3,2020,Armazens Gerais Empresario
35603115887,JOSE EDUARDO DA CRUZ SILVA EIRELI,ITAPECERICA DA SERRA,3,2020,Armazens Gerais Empresario
35603115909,F. C. M FUNDACOES EIRELI,OSASCO,3,2020,Armazens Gerais Empresario
35603115917,SABOR ITALIANO COMERCIO DE ALIMENTOS EIRELI,SAO PAULO,3,2020,Armazens Gerais Empresario
35603115933,CONTATO ADMINISTRACAO DE BENS PROPRIOS EIRELI,AMERICANA,3,2020,Armazens Gerais Empresario
35603115941,C. E. F. COMERCIO DE ENERGIA FOTOVOLTAICA - EIRELI,SAO JOSE DO RIO PRETO,3,2020,Armazens Gerais Empresario
35603115950,MICO LEAO CONFECCOES EIRELI,DIADEMA,3,2020,Armazens Gerais Empresario
35603115968,CLOVIS COMERCIO DE SUCATAS & MATERIAIS USADOS EM GERAL EIRELI,CARAPICUIBA,3,2020,Armazens Gerais Empresario
35603115976,FARMA ALPHA MANIPULACAO EIRELI,BARUERI,3,2020,Armazens Gerais Empresario
35603115984,DPPET - DISTRIBUIDORA DE PRODUTOS PET EIRELI,SAO PAULO,3,2020,Armazens Gerais Empresario
35603116000,AGRO COMERCIAL BONFIM PAULISTA EIRELI,SAO PAULO,3,2020,Armazens Gerais Empresario
35603116018,DROGARIA C.I.L.P EIRELI,SAO PAULO,3,2020,Armazens Gerais Empresario
35603116026,LUAL INFORMATICA COMERCIO E SERVICOS EIRELI,OSASCO,3,2020,Armazens Gerais Empresario
35603116034,TAKASSI ODONTOLOGIA EIRELI,JANDIRA,3,2020,Armazens Gerais Empresario
35603116042,JGB DE SOUSA COMERCIO DE GAS EIRELI,ITAPECERICA DA SERRA,3,2020,Armazens Gerais Empresario
35603116051,GAC COMERCIO DE BEBIDAS EIRELI,CARAPICUIBA,3,2020,Armazens Gerais Empresario
35603116069,D.D.F. OLIVEIRA VEICULOS EIRELI,SERTAOZINHO,3,2020,Armazens Gerais Empresario
35603116077,MB RICK TREINAMENTO EIRELI,SAO PAULO,3,2020,Armazens Gerais Empresario
35603116093,MILL ORGANIZACAO DE EVENTOS EIRELI,SAO PAULO,3,2020,Armazens Gerais Empresario
