NIRE,Empresa,Município,Month,Year,Type
35630550301,JC DISTRIBUICAO COMERCIO DE PIMENTAS ARTESANAIS EIRELI,UBATUBA,3,2020,Armazens Gerais Empresario
35630550319,MEVIRI TRANSPORTES EIRELI,SAO PAULO,3,2020,Armazens Gerais Empresario
35630550327,COLISEU BRAGANCA VEICULOS EIRELI,BRAGANCA PAULISTA,3,2020,Armazens Gerais Empresario
35630550335,ARMANDI INSTALACOES E MONTAGENS EIRELI,SAO PAULO,3,2020,Armazens Gerais Empresario
35630550343,DEBSKI PROMOCOES E EVENTOS EIRELI,SAO PAULO,3,2020,Armazens Gerais Empresario
35630550351,FRAMILIO SERVICOS ADMINISTRATIVOS EIRELI,ITANHAEM,3,2020,Armazens Gerais Empresario
35630550360,JP COMPANY INFORMATICA - EIRELI,SAO PAULO,3,2020,Armazens Gerais Empresario
35630550378,NJNT CORRETORA DE SEGUROS - EIRELI,SAO PAULO,3,2020,Armazens Gerais Empresario
35630550386,GOLDEN LION BUSINESS SERVICOS ADMINISTRATIVOS - EIRELI,SAO PAULO,3,2020,Armazens Gerais Empresario
35630550394,REALIZE ENGENHARIA E CONSULTORIA EIRELI,SAO PAULO,3,2020,Armazens Gerais Empresario
35630550408,SB RODRIGUES TRANSPORTE E SERVICOS EIRELI,BARUERI,3,2020,Armazens Gerais Empresario
35630550416,HI ASSISTENCIA TECNICA EIRELI,SAO PAULO,3,2020,Armazens Gerais Empresario
35630550424,MARCELO MATERIAL PARA CONSTRUCAO EM GERAL EIRELI,PERUIBE,3,2020,Armazens Gerais Empresario
35630550432,VIDA EM HARMONIA QUALIDADE DE VIDA E BEM ESTAR EIRELI,SAO PAULO,3,2020,Armazens Gerais Empresario
35630550441,RESTAURANTE DOMUM - EIRELI,CAMPINAS,3,2020,Armazens Gerais Empresario
35630550459,J.G.S LISA INSTALACAO E MANUTENCAO EIRELI,SAO PAULO,3,2020,Armazens Gerais Empresario
35630550467,A. D. C. CONSTRUTORA EIRELI,SAO PAULO,3,2020,Armazens Gerais Empresario
35630550475,GT AUTOMOTIVE COMERCIO DE VEICULOS E EXPORTACAO EIRELI,SAO PAULO,3,2020,Armazens Gerais Empresario
35630550483,K. O. NUNES TECNOLOGIA E INFORMATICA EIRELI,SAO JOSE DOS CAMPOS,3,2020,Armazens Gerais Empresario
35630550491,EMOCIONAL COMERCIO E ACESSORIOS EIRELI,SAO PAULO,3,2020,Armazens Gerais Empresario
35630550505,ESCOLA DE MUSICA BOTTAI EIRELI,SAO PAULO,3,2020,Armazens Gerais Empresario
35630550513,SOUL DE BAR GASTROBAR EIRELI,SAO JOSE DOS CAMPOS,3,2020,Armazens Gerais Empresario
35630550521,RS CRED CONSIGNADO EIRELI,SAO PAULO,3,2020,Armazens Gerais Empresario
35630550530,VENTURINI CORRETORA DE SEGUROS EIRELI,SAO PAULO,3,2020,Armazens Gerais Empresario
35630550548,MERCOSUL EMPLACAMENTO VEICULAR EIRELI,SAO PAULO,3,2020,Armazens Gerais Empresario
35630550556,LML GESTAO DE NEGOCIOS EMPRESARIAIS EIRELI,SAO PAULO,3,2020,Armazens Gerais Empresario
35630550564,SACOLAO JL EIRELI,SAO PAULO,3,2020,Armazens Gerais Empresario
35630550572,PROTNEW COMERCIO DE EQUIPAMENTOS PARA CONDOMINIOS EIRELI,SAO PAULO,3,2020,Armazens Gerais Empresario
35630550581,VIDRO MANIA AMERICANA COMERCIO DE VIDROS E ESQUADRIAS EIRELI,AMERICANA,3,2020,Armazens Gerais Empresario
35630550599,PAULO IZA NAVAS EIRELI,SANTO ANDRE,3,2020,Armazens Gerais Empresario
35630550602,"MARIA AUGUSTA BAR, RESTAURANTE, LANCHONETE & CIA - EIRELI",SAO PAULO,3,2020,Armazens Gerais Empresario
35630550611,INTENSE LIVE TRANSPORTES E TECNOLOGIA EIRELI,SAO PAULO,3,2020,Armazens Gerais Empresario
35630550629,FOMO FILMES EIRELI,SAO PAULO,3,2020,Armazens Gerais Empresario
35630550637,PANIFICADORA NOVA IMPERATRIZ DO HERPLIN EIRELI,SAO PAULO,3,2020,Armazens Gerais Empresario
35630550645,ACOSTA & FERNANDES ADMINISTRACAO DE BENS EIRELI,SAO PAULO,3,2020,Armazens Gerais Empresario
35630550653,"OUTLET SUSPENSOES COMERCIAL , IMPORTACAO E EXPORTACAO DE PECAS E ACESSORIOS AUTOMOTIVOS EIRELI",SAO PAULO,3,2020,Armazens Gerais Empresario
35630550661,MEGA IMPORTS EQUIPAMENTOS ELETRONICOS EIRELI,SAO PAULO,3,2020,Armazens Gerais Empresario
35630550670,LOJA DE CONVENIENCIA START ARICANDUVA EIRELI,GUARULHOS,3,2020,Armazens Gerais Empresario
35630550688,CADU SERVICOS ADMINISTRATIVOS EIRELI,SAO PAULO,3,2020,Armazens Gerais Empresario
35630550696,P. L. S. COSTA EMPLACADORA EIRELI,SOROCABA,3,2020,Armazens Gerais Empresario
35630550700,AZUL ASSESSORIA CONTABIL EIRELI,SAO PAULO,3,2020,Armazens Gerais Empresario
35630550718,SERGIO ZIMERMAN PARTICIPACOES EIRELI,SAO PAULO,3,2020,Armazens Gerais Empresario
35630550726,ATACADAO ELETRO SHOP EIRELI,SAO PAULO,3,2020,Armazens Gerais Empresario
35630550734,PEEK PARTICIPACOES EIRELI,SAO PAULO,3,2020,Armazens Gerais Empresario
35630550742,IND COMERCIO DE FILTROS INDUSTRIAIS EIRELI,MOGI DAS CRUZES,3,2020,Armazens Gerais Empresario
35630550751,CASA DE CARNES NOVILHO DE OURO PIRITUBA EIRELI,SAO PAULO,3,2020,Armazens Gerais Empresario
35630550769,RS - SP COMERCIO DE SOM E ELETRONICOS EIRELI,SAO PAULO,3,2020,Armazens Gerais Empresario
35630550777,JSB TRANSPORTES DE CARGAS EIRELI,CARAPICUIBA,3,2020,Armazens Gerais Empresario
35630550785,LIDER ASFALTO RAPIDO EIRELI,SAO JOSE DO RIO PRETO,3,2020,Armazens Gerais Empresario
35630550793,BRANDINI SANCHES SERVICOS MEDICOS EIRELI,PIRACICABA,3,2020,Armazens Gerais Empresario
35630550807,SOLANGE AIRES DE OLIVEIRA SOUZA EIRELI,ITAI,3,2020,Armazens Gerais Empresario
35630550815,ODARA SERVICE SOLUCOES FINANCEIRAS E TERCEIRIZADOS EIRELI,PIRACICABA,3,2020,Armazens Gerais Empresario
35630550831,AGN DOCES EIRELI,EMBU DAS ARTES,3,2020,Armazens Gerais Empresario
35630550840,MARIA EDUARDA ROCHA MARUNO SERVICOS MEDICOS EIRELI,MORRO AGUDO,3,2020,Armazens Gerais Empresario
35630550858,ALTCOMP ELETRO ELETRONICA EIRELI,SAO PAULO,3,2020,Armazens Gerais Empresario
35630550866,NG COMERCIO DE EQUIPAMENTOS RECREATIVOS E MAQUINAS EIRELI,SAO PAULO,3,2020,Armazens Gerais Empresario
35630550874,GXS SERVICOS EM TI EIRELI,SAO PAULO,3,2020,Armazens Gerais Empresario
35630550882,GOL DEZ PUBLICIDADE E MARKETING EIRELI,SAO PAULO,3,2020,Armazens Gerais Empresario
35630550891,FORTALECER SAUDE EIRELI,SAO PAULO,3,2020,Armazens Gerais Empresario
35630550904,NUNES CONSTRUTORA EIRELI,RIBEIRAO PRETO,3,2020,Armazens Gerais Empresario
35630550912,BEVENUTO COMERCIO DE PEDRAS E SERVICOS EIRELI,IBIUNA,3,2020,Armazens Gerais Empresario
35630550921,JESSICA SILVA VIEIRA EIRELI,GUAIRA,3,2020,Armazens Gerais Empresario
35630550939,MOBILIZA PARTICIPACOES - EIRELI,SAO PAULO,3,2020,Armazens Gerais Empresario
35630550947,H E R ASSESSORIA E ADMINISTRACAO EMPRESARIAL EIRELI,OSASCO,3,2020,Armazens Gerais Empresario
35630550955,J. FERREIRA SERVICOS DE ENGENHARIA EIRELI,SAO PAULO,3,2020,Armazens Gerais Empresario
35630550963,UNIVERSO COMERCIO DE FRUTAS - EIRELI,SAO PAULO,3,2020,Armazens Gerais Empresario
35630550971,G3L ADMINISTRACAO & PARTICIPACOES - EIRELI,SAO PAULO,3,2020,Armazens Gerais Empresario
35630550980,MZ EDUCACAO EIRELI,SAO PAULO,3,2020,Armazens Gerais Empresario
35630550998,JWYL ASSESSORIA ADMINISTRATIVA E FINANCEIRA EIRELI,SAO JOSE DO RIO PRETO,3,2020,Armazens Gerais Empresario
35630551005,SANME METROLOGIA E SERVICOS EIRELI,SAO ROQUE,3,2020,Armazens Gerais Empresario
35630551013,FW PLACAS EIRELI,SAO BERNARDO DO CAMPO,3,2020,Armazens Gerais Empresario
35630551021,LEVEMENTE CLINICA DE PSICOLOGIA E SOLUCOES EM QUALIDADE DE VIDA EIRELI,PAULINIA,3,2020,Armazens Gerais Empresario
35630551030,BARBOSA SANEAMENTO EIRELI,ARARAS,3,2020,Armazens Gerais Empresario
35630551048,CINALLI REPRESENTACOES EIRELI,SAO PAULO,3,2020,Armazens Gerais Empresario
35630551056,UNIQUE MODA FEMININA EIRELI,COSMOPOLIS,3,2020,Armazens Gerais Empresario
35630551064,FIQUENE CONSULTORIA E TREINAMENTOS EM SEGURANCA NO TRABALHO EIRELI,SAO PAULO,3,2020,Armazens Gerais Empresario
35630551072,MENDES SERVICOS ADMINISTRATIVOS EIRELI,SAO BERNARDO DO CAMPO,3,2020,Armazens Gerais Empresario
35630551081,4PX CONSULTORIA E DESENVOLVIMENTO HUMANO EIRELI,SAO BERNARDO DO CAMPO,3,2020,Armazens Gerais Empresario
35630551099,HOT SNOOKER BAR DRINKS EIRELI,SAO PAULO,3,2020,Armazens Gerais Empresario
35630551102,H P ASSESSORIA E SERVICOS EIRELI,SAO PAULO,3,2020,Armazens Gerais Empresario
35630551111,BLP ADMINISTRACAO EIRELI,SAO PAULO,3,2020,Armazens Gerais Empresario
35630551129,ANDS - PROJETOS CONTRUCAO E REFORMAS EM GERAL EIRELI,SAO PAULO,3,2020,Armazens Gerais Empresario
35630551137,ROYAL VIDA CENTRO CLINICO II EIRELI,SAO PAULO,3,2020,Armazens Gerais Empresario
35630551145,"TCL TRANSPORTES, MUDANCAS E LOGISTICA EIRELI",SAO PAULO,3,2020,Armazens Gerais Empresario
35630551153,JAPA RECICLAGEM E COMERCIO DE SUCATA EIRELI,SAO PAULO,3,2020,Armazens Gerais Empresario
35630551161,BAUER MEDICAL EIRELI,SAO PAULO,3,2020,Armazens Gerais Empresario
35630551170,GENEVE INSTALACOES E SERVICOS EIRELI,SAO PAULO,3,2020,Armazens Gerais Empresario
35630551188,ILUSTRES COMERCIO DE ILUMINACAO EIRELI,SAO PAULO,3,2020,Armazens Gerais Empresario
35630551196,M&G COMERCIO E REPRESENTACOES EIRELI,SAO PAULO,3,2020,Armazens Gerais Empresario
35630551200,NET TEX PRODUCAO DE TECIDOS EIRELI,SAO PAULO,3,2020,Armazens Gerais Empresario
35630551218,ESTEVES MERCEARIA - COMERCIO DE PRODUTOS ALIMENTICIOS EIRELI,CAMPINAS,3,2020,Armazens Gerais Empresario
35630551226,TODA CHIQ ROUPAS E ACESSORIOS FEMININOS EIRELI,MOGI DAS CRUZES,3,2020,Armazens Gerais Empresario
35630551234,ZAKEL SERVICOS ADMINISTRATIVOS EIRELI,CAMPINAS,3,2020,Armazens Gerais Empresario
35630551242,CLUBE NATURAL COMERCIO DE PRODUTOS DE CONSUMO EIRELI,SAO PAULO,3,2020,Armazens Gerais Empresario
35630551251,NEW ESTILO COMERCIO DE BIJUTERIAIS EM GERAL EIRELI,LIMEIRA,3,2020,Armazens Gerais Empresario
35630551269,E.A. VILLELA GESTAO DE ATIVOS EIRELI,CAMPINAS,3,2020,Armazens Gerais Empresario
35630551277,A. M. P. CAPELLI REPRESENTACOES COMERCIAL EIRELI,SAO PAULO,3,2020,Armazens Gerais Empresario
35630551285,J FLORIDO ASSESSORIA E CONSULTORIA FINANCEIRA EIRELI,JALES,3,2020,Armazens Gerais Empresario
35630551293,MFC PARTICIPACOES EIRELI,SAO PAULO,3,2020,Armazens Gerais Empresario
35630551307,POOL FITNESS CORPO E MENTE EIRELI,SAO PAULO,3,2020,Armazens Gerais Empresario
35630551315,OZONO 3 FUSION COMERCIO E SERVICOS EIRELI,SAO PAULO,3,2020,Armazens Gerais Empresario
35630551323,BICHO BACANA VETERINARIOS - EIRELI,SAO SEBASTIAO,3,2020,Armazens Gerais Empresario
35630551331,MR LEONDARIDES SERVICOS DE APOIO ADMINISTRATIVO EIRELI,BARUERI,3,2020,Armazens Gerais Empresario
35630551340,G.A COMERCIO DE GESSO E SERVICOS EIRELI,SAO PAULO,3,2020,Armazens Gerais Empresario
35630551358,E. F. SITELLI CONSTRUTORA EIRELI,CONCHAL,3,2020,Armazens Gerais Empresario
35630551366,YOUYOU COSMETICOS EIRELI,SAO PAULO,3,2020,Armazens Gerais Empresario
35630551374,REI DAS CARNES COMERCIO DE ALIMENTOS E REFEICOES EIRELI,FRANCISCO MORATO,3,2020,Armazens Gerais Empresario
35630551382,DESPACHANTE CURIO EIRELI,SAO PAULO,3,2020,Armazens Gerais Empresario
35630551391,PIZZARIA SINHA EIRELI,ATIBAIA,3,2020,Armazens Gerais Empresario
35630551404,PLACAS MERCOSUL SAO BERNARDO EIRELI,SAO BERNARDO DO CAMPO,3,2020,Armazens Gerais Empresario
35630551412,RBR FRANCHISING BASKETBALL INTERNACIONAL EIRELI,GUARULHOS,3,2020,Armazens Gerais Empresario
35630551421,GOMES & FARIA COMERCIO DE SORVETES EIRELI,SAO PAULO,3,2020,Armazens Gerais Empresario
35630551439,LEV LOGISTICA E TRANSPORTES EIRELI,SAO PAULO,3,2020,Armazens Gerais Empresario
35630551447,AMC COMERCIO DE MATERIAIS ELETRO ELETRICOS E FERRAGENS EIRELI,SAO PAULO,3,2020,Armazens Gerais Empresario
35630551463,ANALICE DEL SANT EIRELI,RIBEIRAO PRETO,3,2020,Armazens Gerais Empresario
35630551471,EMPLACAR VEICULOS PLACAS AUTOMOTIVAS EIRELI,SERTAOZINHO,3,2020,Armazens Gerais Empresario
35630551480,LF DISTRIBUIDORA DE HORTFRUT EIRELI,SAO PAULO,3,2020,Armazens Gerais Empresario
35630551498,T S LOPES ENTREGA RAPIDA EIRELI,CARAPICUIBA,3,2020,Armazens Gerais Empresario
35630551501,AS COMERCIO DE ALIMENTOS EIRELI,SAO PAULO,3,2020,Armazens Gerais Empresario
35630551510,MARCENARIA MORATA EIRELI,ARUJA,3,2020,Armazens Gerais Empresario
35630551528,MENEMED COMERCIO DE ARTIGOS ESPORTIVOS EIRELI,SAO BERNARDO DO CAMPO,3,2020,Armazens Gerais Empresario
35630551536,BUFFET ADRENALINA EVENTOS EIRELI,SAO PAULO,3,2020,Armazens Gerais Empresario
35630551544,VELS TRANSPORTE EIRELI,SAO PAULO,3,2020,Armazens Gerais Empresario
35630551552,CASA DE CARNES E REFEICOES BOI NOVA DA VARZEA PAULISTA EIRELI,VARZEA PAULISTA,3,2020,Armazens Gerais Empresario
35630551561,"E.M.C. CONSULTING - FORMACAO E DESENVOLVIMENTO PROFISSIONAL, SOCIAL E PEDAGOGICO EIRELI",SAO PAULO,3,2020,Armazens Gerais Empresario
35630551579,MIS NEGOCIOS IMOBILIARIOS - EIRELI,SAO BERNARDO DO CAMPO,3,2020,Armazens Gerais Empresario
35630551587,NK PORT FACILITIES E TERCEIRIZACAO DE SERVICOS EIRELI,SAO PAULO,3,2020,Armazens Gerais Empresario
35630551595,A G S FEIRAS E EVENTOS EIRELI,SAO PAULO,3,2020,Armazens Gerais Empresario
35630551609,BELLE NOVEAU ASSESSORIA E CONSULTORIA EMPRESARIAL EIRELI,RIBEIRAO PRETO,3,2020,Armazens Gerais Empresario
35630551617,M B PSICOLOGIA EIRELI,BARUERI,3,2020,Armazens Gerais Empresario
35630551625,SANDRA REGINA BUENO CANAL - SERVICOS COMERCIAIS - EIRELI,SAO PAULO,3,2020,Armazens Gerais Empresario
35630551633,GD ENGENHARIA EIRELI,SAO PAULO,3,2020,Armazens Gerais Empresario
35630551641,LOPACK COMERCIO DE EMBALAGENS EIRELI,SAO PAULO,3,2020,Armazens Gerais Empresario
35630551650,MM FALCAO COMERCIO DE PECAS EIRELI,SAO PAULO,3,2020,Armazens Gerais Empresario
35630551668,M.A. CONFECCOES TAGUAI EIRELI,TAGUAI,3,2020,Armazens Gerais Empresario
35630551676,W 3 TRANSPORTADORA EIRELI,RIBEIRAO PRETO,3,2020,Armazens Gerais Empresario
35630551684,THERMOBRA'S AQUECIMENTOS DE AGUAS - EIRELI,SAO PAULO,3,2020,Armazens Gerais Empresario
35630551692,LEIRIA INDUSTRIA E COMERCIO DE ALIMENTOS EIRELI,SAO PAULO,3,2020,Armazens Gerais Empresario
35630551706,MOVA ROUPAS E ACESSORIOS EIRELI,SAO PAULO,3,2020,Armazens Gerais Empresario
35630551714,EAGLE ESPACOS E EVENTOS E SERVICOS - EIRELI,SAO PAULO,3,2020,Armazens Gerais Empresario
35630551722,GENESIS TERCEIRIZACAO DE SERVICOS EIRELI,SAO PAULO,3,2020,Armazens Gerais Empresario
35630551731,DELFINO CAMPOS RESTAURANTE EIRELI,SAO PAULO,3,2020,Armazens Gerais Empresario
35630551749,D SOUZA COMERCIO DE ROUPAS E ACESSORIOS EIRELI,LIMEIRA,3,2020,Armazens Gerais Empresario
35630551757,QUATRINI PLACAS AUTOMOTIVAS EIRELI,SAO PAULO,3,2020,Armazens Gerais Empresario
35630551765,CRAF GESTAO DE CLUBES - EIRELI,TABOAO DA SERRA,3,2020,Armazens Gerais Empresario
35630551773,TOLENIO TRANSPORTES DE CARGAS EIRELI,SAO PAULO,3,2020,Armazens Gerais Empresario
35630551781,BLESSING MIX COMERCIO DE PRESENTES E APOIO OPERACIONAL EIRELI,SAO PAULO,3,2020,Armazens Gerais Empresario
35630551790,COPLAST COMERCIO E DISTRIBUICAO EIRELI,SAO PAULO,3,2020,Armazens Gerais Empresario
35630551803,A L PEREIRA SUPERMERCADO EIRELI,BIRITIBA-MIRIM,3,2020,Armazens Gerais Empresario
35630551811,MACATUBA MRG NEGOCIOS E SERVICOS ADMINISTRATIVOS EIRELI,MACATUBA,3,2020,Armazens Gerais Empresario
35630551820,SPEED RACE MOTO BIKE COMERCIO DE PECAS E ACESSORIOS EIRELI,SAO JOSE DO RIO PRETO,3,2020,Armazens Gerais Empresario
35630551838,ENRIQUE FELIX DE SOUZA EIRELI,MONTE MOR,3,2020,Armazens Gerais Empresario
35630551846,L G ARMANI SERVICOS ADMINISTRATIVOS EIRELI,SAO PAULO,3,2020,Armazens Gerais Empresario
35630551854,EMERCASA CONSTRUTORA & EMPREENDIMENTOS EIRELI,SAO PAULO,3,2020,Armazens Gerais Empresario
35630551862,EW COSTA IMOVEIS EIRELI,SAO PAULO,3,2020,Armazens Gerais Empresario
35630551871,CARRAO DESMONTE & AUTO PECAS EIRELI,SAO CARLOS,3,2020,Armazens Gerais Empresario
35630551889,FOCUS RCP E PROVEDORES DE CONTEUDO EIRELI,SAO PAULO,3,2020,Armazens Gerais Empresario
35630551897,TDT ARMAZEM E COMERCIO DE VARIEDADES TIPICAS EIRELI,SANTA ISABEL,3,2020,Armazens Gerais Empresario
35630551901,D N BALUARTE COMERCIO E SERVICOS EIRELI,SUZANO,3,2020,Armazens Gerais Empresario
35630551919,M.T.G SILVA PLASTICOS EIRELI,ITAQUAQUECETUBA,3,2020,Armazens Gerais Empresario
35630551927,METAPAC MONTAGEM DE ESTRUTURAS METALICAS EIRELI,SOROCABA,3,2020,Armazens Gerais Empresario
35630551935,CRLB TRANSPORTES EIRELI,SAO PAULO,3,2020,Armazens Gerais Empresario
35630551943,BARBOSA EMPREITEIRA DE OBRAS EIRELI,OSASCO,3,2020,Armazens Gerais Empresario
35630551951,NIHON SUSHI RESTAURANTE E EVENTOS EIRELI,SAO PAULO,3,2020,Armazens Gerais Empresario
35630551960,MOVEIS ALTINO PLANEJADOS SOB MEDIDA EIRELI,OSASCO,3,2020,Armazens Gerais Empresario
35630551978,DISTRIBUIDORA QUEIROZ EIRELI,SANTO ANDRE,3,2020,Armazens Gerais Empresario
35630551986,AC PRO AUDIO EIRELI,SAO PAULO,3,2020,Armazens Gerais Empresario
35630551994,J. DAVIS SOLUCOES EMPRESARIAIS EIRELI,SAO PAULO,3,2020,Armazens Gerais Empresario
35630552001,BMY SERVICOS EIRELI,PRESIDENTE PRUDENTE,3,2020,Armazens Gerais Empresario
35630552010,DNS COMERCIO VAREJISTA DE ARTIGOS PARA ANIMAIS EIRELI,SAO PAULO,3,2020,Armazens Gerais Empresario
35630552028,MISSEL ODONTOLOGIA ESPECIALIZADA EIRELI,SAO PAULO,3,2020,Armazens Gerais Empresario
35630552036,AURB EMPREENDIMENTOS E PARTICIPACOES EIRELI,SAO PAULO,3,2020,Armazens Gerais Empresario
35630552044,JM BRAND ROUPAS E ACESSORIOS EIRELI,BARUERI,3,2020,Armazens Gerais Empresario
35630552052,LUMNITY BOX PAPELARIA EIRELI,SAO PAULO,3,2020,Armazens Gerais Empresario
35630552061,ODARA CORRETORA DE SEGUROS EIRELI,SAO PAULO,3,2020,Armazens Gerais Empresario
35630552079,ERICANUTRI CONSULTORIA E ASSESSORIA EM NUTRICAO EIRELI,SAO PAULO,3,2020,Armazens Gerais Empresario
35630552087,ATITUDE TERRA EDITORA E EDUCACAO EIRELI,SAO PAULO,3,2020,Armazens Gerais Empresario
35630552095,STOLER DESENVOLVIMENTO E COACHING EIRELI,SAO PAULO,3,2020,Armazens Gerais Empresario
35630552109,BR CIRURGICA EQUIPAMENTOS HOSPITALRES E LABORATORIAIS EIRELI,SAO PAULO,3,2020,Armazens Gerais Empresario
35630552117,R. LIMA AMBIENTAL EIRELI,SERTAOZINHO,3,2020,Armazens Gerais Empresario
35630552125,L &E CONSTRUTORA EIRELI,PONTAL,3,2020,Armazens Gerais Empresario
35630552133,IARA ADEGA EIRELI,JANDIRA,3,2020,Armazens Gerais Empresario
35630552141,INNOVE CB TREINAMENTOS E DESIGN EIRELI,SAO PAULO,3,2020,Armazens Gerais Empresario
35630552150,SS TREINAMENTO DE INFORMATICA E IDIOMAS EIRELI,JACAREI,3,2020,Armazens Gerais Empresario
35630552168,NANI ASSESSORIA EMPRESARIAL EIRELI,RIBEIRAO PRETO,3,2020,Armazens Gerais Empresario
35630552176,EVOLUTIVA CONSULTORIA E TECNOLOGIA GRAFICA EIRELI,SAO PAULO,3,2020,Armazens Gerais Empresario
35630552184,SUPER LANCHONETE SARAMANDAIA II EIRELI,SANTO ANDRE,3,2020,Armazens Gerais Empresario
35630552192,BEETHOVEN PET SHOP EIRELI,SAO PAULO,3,2020,Armazens Gerais Empresario
35630552206,CDD FROTA LOG EIRELI,GUARULHOS,3,2020,Armazens Gerais Empresario
35630552214,ATELIE SANLE ARTIGOS PARA BEBES E CRIANCAS - EIRELI,SAO PAULO,3,2020,Armazens Gerais Empresario
35630552222,LANCHONETE PADOOK EIRELI,SAO PAULO,3,2020,Armazens Gerais Empresario
35630552231,ART CONSTRUCAO CIVIL EIRELI,CARAGUATATUBA,3,2020,Armazens Gerais Empresario
35630552249,J.A SERVICE SERVICOS ESPECIALIZADOS EIRELI,JUNDIAI,3,2020,Armazens Gerais Empresario
35630552257,EMPORIO NOVA OPCAO MATERIAIS EM GERAL EIRELI,SAO PAULO,3,2020,Armazens Gerais Empresario
35630552265,OKK REFORMAS E MANUTENCAO EIRELI,DIADEMA,3,2020,Armazens Gerais Empresario
35630552273,IGTA 3D INFORMATICA EIRELI,SAO PAULO,3,2020,Armazens Gerais Empresario
35630552281,ABAD COMERCIO E CONFECCAO DE BOJOS E AVIAMENTOS EIRELI,SAO PAULO,3,2020,Armazens Gerais Empresario
35630552290,DONA BENEDITA HOSTEL EIRELI,UBATUBA,3,2020,Armazens Gerais Empresario
35630552303,CONSTRUMOVEIS - SERVICOS DE MONTAGEM EIRELI,SAO PAULO,3,2020,Armazens Gerais Empresario
35630552311,PHOENIX PARK ESTACIONAMENTO E ESTETICA AUTOMOTIVA EIRELI,SAO PAULO,3,2020,Armazens Gerais Empresario
35630552320,BRUTU S MOVEIS RUSTICOS DE PALETES EIRELI,SAO PAULO,3,2020,Armazens Gerais Empresario
35630552338,CRB SERVICOS DE ESCRITORIO E ADMINISTRATIVOS EIRELI,SAO PAULO,3,2020,Armazens Gerais Empresario
35630552346,PIZZARIA MOINHO EIRELI,SAO PAULO,3,2020,Armazens Gerais Empresario
35630552354,STILYCAR MINIATURAS BRINQUEDOS COMERCIO E ARTIGOS EM GERAL EIRELI,SAO PAULO,3,2020,Armazens Gerais Empresario
35630552362,RECTA VIA CULTURA E ESCOLA EIRELI,CAMPINAS,3,2020,Armazens Gerais Empresario
35630552371,R VINHOS IMPORTACAO E EXPORTACAO EIRELI,SAO PAULO,3,2020,Armazens Gerais Empresario
35630552389,MARIA DO CARMO CASSIA SOARES KFURI COMERCIO E ARTESANATOS EIRELI,SAO PAULO,3,2020,Armazens Gerais Empresario
35630552397,INOVAR CONSULTORIA EIRELI,SAO PAULO,3,2020,Armazens Gerais Empresario
35630552401,RODOLFO CONCURUTO PIRES EIRELI,BAURU,3,2020,Armazens Gerais Empresario
35630552419,LANCHONETE NOVA B.LAGOA EIRELI,SAO PAULO,3,2020,Armazens Gerais Empresario
35630552427,BIOX CAPITAL E PARTICIPACOES EIRELI,SAO PAULO,3,2020,Armazens Gerais Empresario
35630552435,ATKO CONSTRUTORA & ELEMENTOS DE CONCRETO EIRELI,SAO PAULO,3,2020,Armazens Gerais Empresario
35630552443,NANDA GAMA PRODUCOES EIRELI,SAO PAULO,3,2020,Armazens Gerais Empresario
35630552451,TAX NO RECUPERACAO DE ATIVOS EIRELI,SAO PAULO,3,2020,Armazens Gerais Empresario
35630552460,CRESCER CONSULTORIA EIRELI,SAO CAETANO DO SUL,3,2020,Armazens Gerais Empresario
35630552478,S.F.O ODONTOLOGIA EIRELI,SAO PAULO,3,2020,Armazens Gerais Empresario
35630552486,MALU PINHEIRO CONTEUDO E COMUNICACAO EIRELI,SAO PAULO,3,2020,Armazens Gerais Empresario
35630552494,L.M. GROSSI SERVICOS DE VETERINARIO EIRELI,SAO PAULO,3,2020,Armazens Gerais Empresario
35630552508,BS2 NEGOCIOS DIGIAIS EIRELI,SAO PAULO,3,2020,Armazens Gerais Empresario
35630552516,ZAPNEGOCIOS PROJETOS FINANCEIROS EIRELI,SAO BERNARDO DO CAMPO,3,2020,Armazens Gerais Empresario
35630552524,ALTAS HORAS BAR E RESTAURANTE EIRELI,SAO PAULO,3,2020,Armazens Gerais Empresario
35630552532,EMPRESTIMOS UNICK EIRELI,SAO PAULO,3,2020,Armazens Gerais Empresario
35630552541,R S CINTRA APOIO ADMINISTRATIVO EIRELI,SAO PAULO,3,2020,Armazens Gerais Empresario
35630552559,DM COMERCIO E CONFECCOES DE ROUPAS EIRELI,SAO PAULO,3,2020,Armazens Gerais Empresario
35630552567,CONSTRUTORA FOCCUS EIRELI,UBATUBA,3,2020,Armazens Gerais Empresario
35630552575,NORTRIGO SP COMERCIO E DISTRIBUICAO EIRELI,SAO PAULO,3,2020,Armazens Gerais Empresario
35630552583,EBF SUPORTE APOIO ADMINISTRATIVO EIRELI,SAO BERNARDO DO CAMPO,3,2020,Armazens Gerais Empresario
35630552591,JF PROMOTORA SERVICOS ADMINISTRATIVOS EIRELI,SAO PAULO,3,2020,Armazens Gerais Empresario
35630552605,ONORIO ESTETICA EIRELI,SAO PAULO,3,2020,Armazens Gerais Empresario
35630552613,STARTEC SERVICOS E COMERCIO DE MATERIAIS ELETRICOS E PARA-RAIOS EIRELI,SAO PAULO,3,2020,Armazens Gerais Empresario
35630552621,BM DE OLIVEIRA ESTACIONAMENTO EIRELI,GUARULHOS,3,2020,Armazens Gerais Empresario
35630552630,V.S.M COBRANCA EIRELI,SANTO ANDRE,3,2020,Armazens Gerais Empresario
35630552648,MORADE EMPREENDIMENTOS IMOBILIARIOS E LOCACAO DE EQUIPAMENTOS PARA CONSTRUCAO EIRELI,ATIBAIA,3,2020,Armazens Gerais Empresario
35630552656,DONA BONITA CABELEIREIROS EIRELI,BARUERI,3,2020,Armazens Gerais Empresario
35630552664,C NUNES COMERCIO DE PECAS EIRELI,SAO PAULO,3,2020,Armazens Gerais Empresario
35630552672,XPI CONTABILIDADE EIRELI,BARUERI,3,2020,Armazens Gerais Empresario
35630552681,NSA FUROS E LOCACOES EIRELI,SAO PAULO,3,2020,Armazens Gerais Empresario
35630552699,PRATA CONSTRUCOES EIRELI,SAO PAULO,3,2020,Armazens Gerais Empresario
35630552702,AN BAR E PIZZARIA NOVA ESPERANCA EIRELI,SAO PAULO,3,2020,Armazens Gerais Empresario
35630552711,LUCIANA M DE JESUS E SOUZA SERVICOS DE PSICOLOGIA EIRELI,SAO PAULO,3,2020,Armazens Gerais Empresario
35630552737,HGR COMERCIO E MANUTENCAO PREDIAL EIRELI,GUARULHOS,3,2020,Armazens Gerais Empresario
35630552745,TOP - CELL ACESSORIOS PARA CELULARES EIRELI,SAO PAULO,3,2020,Armazens Gerais Empresario
35630552753,CONSTRUTORA R RODRIGUES EIRELI,SANTO ANDRE,3,2020,Armazens Gerais Empresario
35630552761,R.M. OURA - IMPORTACAO E EXPORTACAO - EIRELI,SAO VICENTE,3,2020,Armazens Gerais Empresario
35630552770,CARIOONN NUCLEO DE TERAPIAS QUANTICAS EIRELI,SANTO ANDRE,3,2020,Armazens Gerais Empresario
35630552788,MARCOS LOURENCO SILVA EIRELI,SAO PAULO,3,2020,Armazens Gerais Empresario
35630552796,CICERO NETO DOS SANTOS - SERRALHERIA EIRELI,GUARULHOS,3,2020,Armazens Gerais Empresario
35630552800,MEHDI FASHION TEXTIL EIRELI,SAO PAULO,3,2020,Armazens Gerais Empresario
35630552818,PLW COMERCIO ATACADISTA DE COSMETICOS EIRELI,SAO PAULO,3,2020,Armazens Gerais Empresario
35630552826,CLS COMERCIO DE SUPLEMENTOS EIRELI,SAO PAULO,3,2020,Armazens Gerais Empresario
35630552834,PLAY GLASS FERRAGENS E FERRAMENTAS EIRELI,CARAPICUIBA,3,2020,Armazens Gerais Empresario
35630552842,ALAN KAPROSKI EIRELI,SAO PAULO,3,2020,Armazens Gerais Empresario
35630552851,MERCADO COQUEIRO EIRELI,SAO PAULO,3,2020,Armazens Gerais Empresario
35630552869,MK UTILIDADES DOMESTICAS E PRESENTE EIRELI,TABOAO DA SERRA,3,2020,Armazens Gerais Empresario
35630552877,D&R COMERCIO DE DOCES E ALIMENTOS EIRELI,SAO PAULO,3,2020,Armazens Gerais Empresario
35630552885,B.LS INDUSTRIA E COMERCIO DE ALIMENTOS EIRELI,SAO PAULO,3,2020,Armazens Gerais Empresario
35630552893,TONI SPITA PRIME IMOVEIS - EIRELI,BARUERI,3,2020,Armazens Gerais Empresario
35630552907,DC SERVICO ADMINISTRATIVOS EIRELI,BOM JESUS DOS PERDOES,3,2020,Armazens Gerais Empresario
35630552915,HENRIQUE COSTA ALIMENTOS EIRELI,SAO PAULO,3,2020,Armazens Gerais Empresario
35630552923,AVELAR TRAJANO COMERCIO DE ALIMENTOS EIRELI,TABOAO DA SERRA,3,2020,Armazens Gerais Empresario
35630552931,MBM REFORMAS EIRELI,SANTO ANDRE,3,2020,Armazens Gerais Empresario
35630552940,ARCHITETTO CAFE EIRELI,SAO PAULO,3,2020,Armazens Gerais Empresario
35630552958,SP CITY ARQUITETURA E ENGENHARIA EIRELI,SAO PAULO,3,2020,Armazens Gerais Empresario
35630552966,ELVIS DA COSTA SAMPAIO CONFECCAO E COMERCIO DE VESTUARIOS EIRELI,SAO PAULO,3,2020,Armazens Gerais Empresario
35630552974,COLORADO FASHION OPTICAL EIRELI,GUARULHOS,3,2020,Armazens Gerais Empresario
35630552982,THIAGO PRODUCAO CINEMATOGRAFICA EIRELI,SAO PAULO,3,2020,Armazens Gerais Empresario
35630552991,A SETE IMPORTACAO E DISTRIBUICAO DE PRODUTOS AUTOMOTIVOS - EIRELI,SAO PAULO,3,2020,Armazens Gerais Empresario
35630553008,PRIME AMERICA INVESTMENTS HOLDING EIRELI,SAO PAULO,3,2020,Armazens Gerais Empresario
35630553016,REAL CORREIA UTILIDADES EIRELI,MORUNGABA,3,2020,Armazens Gerais Empresario
35630553024,J. A - CONSULTORIA EMPRESARIAL EIRELI,SAO PAULO,3,2020,Armazens Gerais Empresario
