NIRE,Empresa,Município,Month,Year,Type
35602900882,JORGE ALEXANDRE JACONI EIRELI,ITAPIRA,3,2020,Grupo
35603022382,SUPER DOG LANCHONETE E RESTOBAR EIRELI,FRANCA,3,2020,Grupo
35603046141,TRANS RAW TRANSPORTADORA EIRELI,CAMPINAS,3,2020,Grupo
35603046184,JRS COMERCIO DE ALIMENTOS EIRELI,BOTUCATU,3,2020,Grupo
35603046290,ALUMIAR INDUSTRIA E COMERCIO DE ALUMINIO EIRELI,INDAIATUBA,3,2020,Grupo
35603065847,ROGERIO DE OLIVEIRA AROCA EIRELI,MIRANDOPOLIS,3,2020,Grupo
35603069079,PETHA INTEGRADORA DE SOLUCOES EIRELI,FERRAZ DE VASCONCELOS,3,2020,Grupo
35603070417,ARCTUROS EMPREENDIMENTOS IMOBILIARIOS EIRELI,SAO PAULO,3,2020,Grupo
35603086119,L.A.C. AZEVEDO HOTEIS RESTAURANTES EIRELI,SANTA CLARA D'OESTE,3,2020,Grupo
35603093182,POSITIVE CONSULTORIA FINANCEIRA EIRELI,SAO JOSE DOS CAMPOS,3,2020,Grupo
35603093280,C.C.G.M DE SOUZA RIBEIRO EIRELI,SAO JOSE DOS CAMPOS,3,2020,Grupo
35603096891,JNSA PARTICIPACOES EIRELI,SAO PAULO,3,2020,Grupo
35603097285,BASSO EXPORTACAO DE CEREAIS EIRELI,PARANAPANEMA,3,2020,Grupo
35603097331,PAULA DE TOLEDO BARBOSA EIRELI,SOROCABA,3,2020,Grupo
35603097455,EVO TRADING IMPORTACAO E EXPORTACAO EIRELI,PEDERNEIRAS,3,2020,Grupo
35603104036,MARINA DE OLIVEIRA ZOPELARO TRANSPORTE E LOCACAO EIRELI,SAO PAULO,3,2020,Grupo
35603104061,FINANZA PLANEJAMENTO FINANCEIRO EIRELI,SAO PAULO,3,2020,Grupo
35603104079,MARIA SALETE QUINTANA NUNES POUSADA EIRELI,SAO PAULO,3,2020,Grupo
35603104087,ITURAN REVITALIZACAO DE FACHADAS - EIRELI,FRANCISCO MORATO,3,2020,Grupo
35603104273,CASA DE CARNE CAMPESTRE - EIRELI,SAO JOSE DO RIO PRETO,3,2020,Grupo
35603104451,SUPORTE DA PRAIA EIRELI,SAO PAULO,3,2020,Grupo
35603104541,LABORATORIO INTERCLIN ANALISE CLINICAS E GESTAO EIRELI,SAO PAULO,3,2020,Grupo
35603104567,BRUNO PONTO DA PIZZA EIRELI,OSASCO,3,2020,Grupo
35603104966,GRU MATERIAIS DE CONSTRUCAO EIRELI,GUARULHOS,3,2020,Grupo
35603104982,D. C. ANDRIANI EIRELI,RIBEIRAO PRETO,3,2020,Grupo
35603105016,LINER BRASIL INDUSTRIA E COMERCIO EIRELI,BARUERI,3,2020,Grupo
35603105164,ROBERTO BLEIER FILHO QUIROPRAXIA EIRELI,COTIA,3,2020,Grupo
35603105181,E & A DEVELOPER INFORMATICA EIRELI,GUARULHOS,3,2020,Grupo
35603105202,PRO STONE INSTALACAO E PROTECAO DE REVESTIMENTOS EIRELI,EMBU DAS ARTES,3,2020,Grupo
35603105211,CALDENIT COMERCIAL EIRELI,SAO BERNARDO DO CAMPO,3,2020,Grupo
35603105300,M BRASIL SERVICE EXPRESS - EIRELI,SAO PAULO,3,2020,Grupo
35603105369,SPEED CRED SERVICOS FINANCEIROS EIRELI,SAO PAULO,3,2020,Grupo
35603105385,KATIA MIRANDA CAMPOS DIAS EIRELI,SAO JOSE DO RIO PRETO,3,2020,Grupo
35603105393,CRISTOQUITA ESTETICA EIRELI,SAO PAULO,3,2020,Grupo
35603105415,ESPACO DA MODA INFANTIL EIRELI,SAO PAULO,3,2020,Grupo
35603105423,"ATM APOIO - COMERCIO DE BEBIDAS, ALIMENTOS E SERVICOS EIRELI",SAO PAULO,3,2020,Grupo
35603105474,MERCADO E ROTISSERIA GONCALVES EIRELI,SAO PAULO,3,2020,Grupo
35603105580,TRANSMAX TRANSPORTES EIRELI,SAO PAULO,3,2020,Grupo
35603105903,A.R.FILHO INJECAO ELETRONICA E DIESEL EIRELI,SAO PAULO,3,2020,Grupo
35603115313,AXTECH COMERCIO DE ELETRONICOS E ACESSORIOS EIRELI,SAO PAULO,3,2020,Grupo
35603115381,ESFINGE CELL EIRELI,SAO PAULO,3,2020,Grupo
35603115399,JVR BRITTO SILVA MARMORARIA EIRELI,SAO PAULO,3,2020,Grupo
35603115470,AGENCIA WEBNAUTA DIGITAL EIRELI,SAO PAULO,3,2020,Grupo
35603115500,STRATTON TECNOLOGIA CRIATIVA - EIRELI,SAO PAULO,3,2020,Grupo
35603115526,CAPITAL JEANS COMERCIO DE ROUPAS EIRELI,SAO PAULO,3,2020,Grupo
35603115810,"PIZZAS, ESFIHAS E MASSAS CARVALHO EIRELI",ITAPEVI,3,2020,Grupo
35603115828,"ISOMETRICA - SOLUCOES EM SEGURANCA, SERVICOS E PROJETOS DE PROTECAO CONTRA INCENDIO - EIRELI",SAO PAULO,3,2020,Grupo
35603115879,FORCA PATRIMONIAL EIRELI,SAO PAULO,3,2020,Grupo
35603115895,MAX TOP CONSULTORIA E GESTAO EMPRESARIAL EIRELI.,GUARULHOS,3,2020,Grupo
35603115925,RMS ASSESSORIA EMPRESARIAL EIRELI,OSASCO,3,2020,Grupo
35603115992,W.M. IGUARIAS EIRELI,SAO PAULO,3,2020,Grupo
35603116085,STUDIO CELL FONE ELETRONICOS - EIRELI,SAO PAULO,3,2020,Grupo
35603116158,MRS EMPREITEIRA DE CONSTRUCAO CIVIL EIRELI,SAO PAULO,3,2020,Grupo
35603116191,JAVALEE IT CONSULTING INFORMATICA EIRELI,SANTO ANDRE,3,2020,Grupo
35603116395,EAG IMPORTACAO E EXPORTACAO EIRELI,SAO PAULO,3,2020,Grupo
35603116417,SJ CONFECCOES E ACESSORIOS EIRELI,SAO PAULO,3,2020,Grupo
35603116506,JONAS MARCOS DOS SANTOS EIRELI,BARUERI,3,2020,Grupo
35603116514,BURANI CLINICA DE PSICOLOGIA E DESENVOLVIMENTO HUMANO EIRELI,CERQUILHO,3,2020,Grupo
35603116671,MINIMERCADO SAO LUIZ EIRELI,GUARULHOS,3,2020,Grupo
35603116727,TEAM TIBERIO ACADEMIA DE ARTES MARCIAIS EIRELI,SAO PAULO,3,2020,Grupo
35603116930,TORRAO EQUIPAMENTOS EIRELI,SAO PAULO,3,2020,Grupo
35603117006,LOBANOVA CLINICA E SERVICOS MEDICOS EIRELI,SAO PAULO,3,2020,Grupo
35603117022,THIAGO SAMPIETRO UZAL EIRELI,SAO PAULO,3,2020,Grupo
35603117081,SUCO BAGACO LANCHES EIRELI,SAO PAULO,3,2020,Grupo
35603117120,F. TRACTOR'S COMERCIO DE PECAS PARA TRATORES EIRELI,SAO PAULO,3,2020,Grupo
35603117138,OUTLET TEM TUDO EIRELI,ITAPECERICA DA SERRA,3,2020,Grupo
35603117154,BGW PUBLICIDADE E GESTAO EMPRESARIAL - EIRELI,SAO PAULO,3,2020,Grupo
35603117189,CASA DAS CHAVES AUTOMOTIVAS EIRELI,ITAPEVI,3,2020,Grupo
35603117243,CAMILO DE LELIS GOMES BARBOSA - EIRELI,SAO JOSE DO RIO PRETO,3,2020,Grupo
35603117391,EVERTON FRANCISCO DA ROSA EIRELI,SAO PAULO,3,2020,Grupo
35603117596,AMH REPARACOES E ESTETICA AUTOMOTIVA EIRELI,TAUBATE,3,2020,Grupo
35603117600,SENHOR CAMBIO INTERMEDIACAO FINANCEIRA EIRELI,SAO PAULO,3,2020,Grupo
35603118410,C.C.X. REPRESENTACAO COMERCIAL DE EQUIPAMENTOS EIRELI,SANTA BARBARA D'OESTE,3,2020,Grupo
35603120813,MTRES ADMINISTRACAO DE BENS PROPRIOS EIRELI,SAO PAULO,3,2020,Grupo
35603124878,SHOPPING DAS PIZZARIAS DISTRIBUIDORA EIRELI,SAO PAULO,3,2020,Grupo
35603125513,JS JUNIOR COMERCIO DE ARTIGOS DE COLCHOARIA EIRELI,SAO PAULO,3,2020,Grupo
35603125742,LOGYSTEM LOGISTICA E SISTEMAS - EIRELI,OSASCO,3,2020,Grupo
35603125751,"AMERICA PARTICIPACAO, ADMINISTRACAO E CONSULTORIA EMPRESARIAL EIRELI",CAMPINAS,3,2020,Grupo
35630542880,JADY LEGRAMANDI TRANSPORTES EIRELI,JUNQUEIROPOLIS,3,2020,Grupo
35630544408,NONATO SOUSA CONSULTORIA EIRELI,SAO PAULO,3,2020,Grupo
35630545927,USE FIBER INTERNET BANDA LARGA EIRELI,CARAPICUIBA,3,2020,Grupo
35630547385,TRIART MOVEIS EIRELI,SAO PAULO,3,2020,Grupo
35630549361,"LIQUIDEZ SOLUCOES E NEGOCIOS, CONSULTORIA E COBRANCA EIRELI",SAO PAULO,3,2020,Grupo
35630549370,L.A.S CONVENIENCIA LAVAGEM & LUBRIFICACAO DE VEICULOS EIRELI,SAO PAULO,3,2020,Grupo
35630550823,UNIFLEX DIVISORIAS PARA AMBIENTES EIRELI,VOTORANTIM,3,2020,Grupo
35630551455,FAIR PLAY INTERMEDIACOES E COBRANCA EIRELI,SAO PAULO,3,2020,Grupo
35630553555,LELLUS RESTAURANTE E LANCHONETE EIRELI,SAO JOSE DOS CAMPOS,3,2020,Grupo
35630553750,ADEGA DO MAMAO EIRELI,SAO PAULO,3,2020,Grupo
35630553946,LAEVV TECNOLOGIA E INTERMEDIACAO DE NEGOCIOS EIRELI,SAO PAULO,3,2020,Grupo
35630554837,MUGARI ADMINISTRACAO E PARTICIPACOES EIRELI,SAO PAULO,3,2020,Grupo
35630557160,"FORCEMED COMERCIO, IMPORTACAO E EXPORTACAO EIRELI",SAO PAULO,3,2020,Grupo
35300549899,UPCON SPE 16 EMPREENDIMENTOS IMOBILIARIOS S.A.,SAO PAULO,3,2020,Sociedade por Acoes
35300549902,TRIPLICARE SECURITIZADORA S/A,GUARULHOS,3,2020,Sociedade por Acoes
35300549911,QUAD OF PROPERTY EMPREENDIMENTOS S.A,SAO PAULO,3,2020,Sociedade por Acoes
35300549929,SOUTH CAPITAL VENTURES PARTICIPACOES S.A.,SAO PAULO,3,2020,Sociedade por Acoes
35300549937,TFY TECNOLOGIA EM SAUDE S.A.,SAO CAETANO DO SUL,3,2020,Sociedade por Acoes
35300549945,NOVA GERACAO ADMINISTRACAO DE BENS S.A.,SAO CARLOS,3,2020,Sociedade por Acoes
35300549953,COLOMBO BIOENERGIA S.A. UTE 3,PALESTINA,3,2020,Sociedade por Acoes
35300549961,IALA SECURITIZADORA S/A,SAO PAULO,3,2020,Sociedade por Acoes
35300549970,ALMODOVAR PARTICIPACOES S.A,SAO PAULO,3,2020,Sociedade por Acoes
35300549988,ARBORE INVESTIMENTOS E PARTICIPACOES S.A.,SAO PAULO,3,2020,Sociedade por Acoes
35300549996,HCLINIC MEDICINA GERAL E ESPECIALIZADA S/A,SAO PAULO,3,2020,Sociedade por Acoes
35300550005,WP GG BRASIL HOLDCO S.A.,SAO PAULO,3,2020,Sociedade por Acoes
35300550013,ATLAS BRASIL ENERGIA HOLDING 1 S.A,SAO PAULO,3,2020,Sociedade por Acoes
35300550021,FIX REALTY S/A,SAO PAULO,3,2020,Sociedade por Acoes
35300550030,MATA VERDE PARTICIPACOES S.A.,SAO PAULO,3,2020,Sociedade por Acoes
35300550048,SERRA DO JAPI SECURITIZADORA S.A.,JUNDIAI,3,2020,Sociedade por Acoes
35300550056,DW BIOENERGIA S/A,JUNDIAI,3,2020,Sociedade por Acoes
35300550064,BANKOZAK SOCIEDADE ANONIMA,PRAIA GRANDE,3,2020,Sociedade por Acoes
35300550072,ICN ACADEMIAS DE GINASTICA S/A,SAO PAULO,3,2020,Sociedade por Acoes
35300550081,TRSP - TERMINAL DE REGASEIFICACAO DE GNL DE SAO PAULO S.A..,SAO PAULO,3,2020,Sociedade por Acoes
35300550099,DIGITAL HOUSE EDUCACAO S.A,OSASCO,3,2020,Sociedade por Acoes
35300550102,LI PARTICIPACOES S.A.,SAO PAULO,3,2020,Sociedade por Acoes
35300550111,DIMESO S.A.,SOROCABA,3,2020,Sociedade por Acoes
35300550129,LOCALIZA VEICULOS ESPECIAIS S.A.,SAO PAULO,3,2020,Sociedade por Acoes
35300550137,RLAA ADMINISTRACAO DE BENS S/A,SAO PAULO,3,2020,Sociedade por Acoes
35300550145,ATLAS BRASIL ENERGIA HOLDING 2 S.A.,SAO PAULO,3,2020,Sociedade por Acoes
35300550153,UMANIZZA RETAGUARDA E TRANSICAO S/A.,SANTO ANDRE,3,2020,Sociedade por Acoes
35300550170,N.Q.H.S.P.E. EMPREENDIMENTOS E PARTICIPACOES S.A.,SAO PAULO,3,2020,Sociedade por Acoes
35300550188,FOCUS ENERGIA HOLDING PARTICIPACOES S.A.,SAO PAULO,3,2020,Sociedade por Acoes
35300550196,BPG MORUMBI EMPREENDIMENTOS E PARTICIPACOES S.A.,SAO PAULO,3,2020,Sociedade por Acoes
35300550200,EB FIBRA NORDESTE S.A.,SAO PAULO,3,2020,Sociedade por Acoes
35300550218,2W COMERCIALIZADORA VAREJISTA DE ENERGIA S.A.,SAO PAULO,3,2020,Sociedade por Acoes
35300550226,LIONS TRUST PARTICIPACOES S.A.,SAO PAULO,3,2020,Sociedade por Acoes
35300550234,IDID INVESTIMENTOS E PARTICIPACOES S.A.,SAO PAULO,3,2020,Sociedade por Acoes
35300550242,"FC FINANCEIRA S.A. - CREDITO, FINANCIAMENTO E INVESTIMENTO",SAO PAULO,3,2020,Sociedade por Acoes
35300550251,10B BIO PARTICIPACOES S.A.,SAO PAULO,3,2020,Sociedade por Acoes
35300550269,COLOMBO BIOENERGIA S.A. UTE 4,SANTA ALBERTINA,3,2020,Sociedade por Acoes
35300550277,KTY PARTICIPACOES SOCIETARIAS S/A,VINHEDO,3,2020,Sociedade por Acoes
35300550285,CARTMEL PARTICIPACOES S.A.,SAO PAULO,3,2020,Sociedade por Acoes
35300550293,SF 187 PARTICIPACOES SOCIETARIAS S.A.,SAO PAULO,3,2020,Sociedade por Acoes
35300550307,CRESCERA HOME CARE PARTICIPACOES S.A.,SAO PAULO,3,2020,Sociedade por Acoes
35300550315,FULL CREDIT SECURITIZADORA S.A.,FRANCA,3,2020,Sociedade por Acoes
35300550323,GESTAO DE SERVICOS FINANCEIROS S.A.,SAO PAULO,3,2020,Sociedade por Acoes
35300550331,GIOX PARTICIPACOES S.A.,SAO PAULO,3,2020,Sociedade por Acoes
35300550340,BR SURGERY GESTAO IMOBILIARIA S.A.,SAO PAULO,3,2020,Sociedade por Acoes
35300550358,N.Q.L.S.P.E. EMPREENDIMENTOS E PARTICIPACOES S.A.,BARUERI,3,2020,Sociedade por Acoes
35300550366,MILLBODY DESENVOLVIMENTO DE SISTEMAS S.A,SAO PAULO,3,2020,Sociedade por Acoes
35300550374,JARDIM BOTANICO II EMPREENDIMENTOS SPE S.A.,MARILIA,3,2020,Sociedade por Acoes
35300550382,MWD SOLUCOES EM DESINFECCAO S.A.,SAO PAULO,3,2020,Sociedade por Acoes
35300550391,FIT RECURSOS HUMANOS S.A.,SAO PAULO,3,2020,Sociedade por Acoes
35300550404,PIF INVESTIMENTOS E PARTICIPACOES S.A.,SAO PAULO,3,2020,Sociedade por Acoes
35300550412,CONCEPT FC HOLDING S.A.,SAO PAULO,3,2020,Sociedade por Acoes
35300550421,2W COMERCIALIZADORA DE ENERGIA S.A.,SAO PAULO,3,2020,Sociedade por Acoes
35300550439,FIBRASIL INFRAESTRUTURA E FIBRA OTICA S.A.,SAO PAULO,3,2020,Sociedade por Acoes
35300550447,NK 077 EMPREENDIMENTOS E PARTICIPACOES S.A.,SAO PAULO,3,2020,Sociedade por Acoes
35300550455,ATVOS BIOENERGIA S.A.,SAO PAULO,3,2020,Sociedade por Acoes
35300550463,PERSEUS EMPREENDIMENTOS E PARTICIPACOES S.A.,SAO PAULO,3,2020,Sociedade por Acoes
35300550471,PAYFAC PARTICIPACOES S.A.,SAO PAULO,3,2020,Sociedade por Acoes
35300550480,CABANA BURGER S.A.,BARUERI,3,2020,Sociedade por Acoes
35300550498,CHOU PARTICIPACOES S/A,SAO PAULO,3,2020,Sociedade por Acoes
35300550501,KEEGGO TECHNOLOGY BRASIL S/A,OSASCO,3,2020,Sociedade por Acoes
35300550510,MONTE OLIMPO PARTICIPACOES S.A.,SAO PAULO,3,2020,Sociedade por Acoes
35300550528,AGRO REI COMERCIALIZACAO DE COMMODITIES AGRICOLAS S/A,INDAIATUBA,3,2020,Sociedade por Acoes
35300550536,BIG RENTAL NEGOCIOS E PARTICIPACOES S.A.,SAO JOSE DO RIO PRETO,3,2020,Sociedade por Acoes
35300550544,BANCO SG NACIONAL DE GARANTIAS E CREDITO IMOBILIARIO E PARTICIPACOES SA,SAO PAULO,3,2020,Sociedade por Acoes
35300550552,NOI HOLDING S/A,RIBEIRAO PRETO,3,2020,Sociedade por Acoes
35300550561,NOVO TEMPO PARTICIPACOES S/A,RIBEIRAO PRETO,3,2020,Sociedade por Acoes
35300550579,VERCER VERIFICACAO E CERTIFICACAO S.A.,SAO PAULO,3,2020,Sociedade por Acoes
35300550587,NORTIS INCORPORADORA E CONSTRUTORA S.A.,SAO PAULO,3,2020,Sociedade por Acoes
35300550595,PRIME CATER COMERCIAL DE PRODUTOS ALIMENTICIOS S.A.,LOUVEIRA,3,2020,Sociedade por Acoes
35300550609,USINA DE ENERGIA FOTOVOLTAICA PEDRANOPOLIS S.A,PEDRANOPOLIS,3,2020,Sociedade por Acoes
35300550617,REC RIBEIRAO PIRES S.A.,SAO PAULO,3,2020,Sociedade por Acoes
35300550625,ARARA AZUL GESTAO DE BENS E DIREITOS S.A.,SAO PAULO,3,2020,Sociedade por Acoes
35300550633,AUSTA PARTICIPACOES S A,SAO JOSE DO RIO PRETO,3,2020,Sociedade por Acoes
35300550641,COLOMBO BIOENERGIA S.A. UTE 2,ARIRANHA,3,2020,Sociedade por Acoes
35300550650,NOVA ALIANCA GERACAO DE ENERGIA S/A,BOITUVA,3,2020,Sociedade por Acoes
35300550668,TGSP 1 EMPREENDIMENTOS IMOBILIARIOS S.A.,SAO PAULO,3,2020,Sociedade por Acoes
35300550676,TEGRA INCORPORADORA S.A.,SAO PAULO,3,2020,Sociedade por Acoes
35300550684,COMPANHIA SECURITIZADORA DE CREDITOS FINANCEIROS VERT-LEVE CAPITAL,SAO PAULO,3,2020,Sociedade por Acoes
35300550692,TRAVESSIA SECURITIZADORA DE CREDITOS FINANCEIROS VIII S.A.,SAO PAULO,3,2020,Sociedade por Acoes
35300550706,CASALE PARTICIPACOES S.A.,JUNDIAI,3,2020,Sociedade por Acoes
35300550714,APP PRE MOLDADOS S/A,BARUERI,3,2020,Sociedade por Acoes
35300550722,E.R.P. PARTICIPACOES S.A,JUNDIAI,3,2020,Sociedade por Acoes
35300550731,S3 PAY SOLUCOES DE PAGAMENTOS S.A.,SAO PAULO,3,2020,Sociedade por Acoes
35300550749,VENTOS DE SANTO ESTEVAO HOLDING S/A,SAO PAULO,3,2020,Sociedade por Acoes
35300550757,TAG ENGENHARIA E SISTEMAS S.A.,SAO PAULO,3,2020,Sociedade por Acoes
35300550765,RJJR1 GESTORA PATRIMONIAL S/A.,SAO JOSE DOS CAMPOS,3,2020,Sociedade por Acoes
35300550773,"XIPP ADMINISTRACAO, CONSULTORIA E CORRETORA DE SEGUROS S.A.",SAO PAULO,3,2020,Sociedade por Acoes
35300550781,RED HOUSE PARTICIPACOES S.A.,SAO PAULO,3,2020,Sociedade por Acoes
35300550790,SQUARE 77 PARTICIPACOES S.A.,SAO PAULO,3,2020,Sociedade por Acoes
35300550803,SET SOLUCOES EMPRESARIAIS SERVICOS E COMERCIO S.A.,SAO PAULO,3,2020,Sociedade por Acoes
35300550811,ROZENDO VT&F PARTICIPACOES S/A,SAO PAULO,3,2020,Sociedade por Acoes
35300550820,PLUTAO BRANDS MARCAS E PATENTES S.A,SAO PAULO,3,2020,Sociedade por Acoes
35300550838,2BS SECURITIZADORA DE CREDITOS S/A,ARACATUBA,3,2020,Sociedade por Acoes
35300550846,VVR1 EMPREENDIMENTOS E PARTICIPACOES S/A,SAO PAULO,3,2020,Sociedade por Acoes
35300550854,ORGANICO OFFICES E SERVICOS S/A,BARUERI,3,2020,Sociedade por Acoes
35300550862,GLI SOLUCOES E NEGOCIOS S/A.,SAO PAULO,3,2020,Sociedade por Acoes
35300550871,SP LAVANDERIA DOMESTICA S/A,CAMPINAS,3,2020,Sociedade por Acoes
35300550897,TENDA COMERCIAL EXPORTADORA S.A.,GUARULHOS,3,2020,Sociedade por Acoes
35300550901,ESHER BANK SECURITIZADORA S.A.,VINHEDO,3,2020,Sociedade por Acoes
35300550919,SAU SECURITIZADORA DE CREDITOS FINANCEIROS S.A.,SAO PAULO,3,2020,Sociedade por Acoes
35300550927,DIGNIFY INTERMEDIACAO E DESENVOLVIMENTO S.A.,SAO PAULO,3,2020,Sociedade por Acoes
35300550935,EMBRAMACO EMPRESA BRASILEIRA DE MATERIAIS PARA CONSTRUCAO S.A.,SANTA GERTRUDES,3,2020,Sociedade por Acoes
35300550943,NARLU PATRIMONIAL PARTICIPACOES E ADMINISTRACAO DE BENS S/A,SAO PAULO,3,2020,Sociedade por Acoes
35300550951,BR NEW FIT ADMINISTRACAO DE BENS E SERVICOS S.A,SAO PAULO,3,2020,Sociedade por Acoes
35300550960,TRACK & FIELD CO S.A.,SAO PAULO,3,2020,Sociedade por Acoes
35300550978,RMD SECURITIZADORA S.A.,SAO PAULO,3,2020,Sociedade por Acoes
35300550986,BANKOK SECURITIZADORA S.A.,JUNDIAI,3,2020,Sociedade por Acoes
35300550994,GOLDEN GREEN PARTICIPACOES S.A.,SAO PAULO,3,2020,Sociedade por Acoes
35300551001,COMPANHIA SECURITIZADORA DE CREDITOS FINANCEIROS VERT- PROVI II,SAO PAULO,3,2020,Sociedade por Acoes
35300551010,PARAISO TRANSMISSORA DE ENERGIA S/A.,ARARAQUARA,3,2020,Sociedade por Acoes
35300551028,STUDOTEC PARTICIPACOES S.A.,SAO PAULO,3,2020,Sociedade por Acoes
35300551036,AGM BANK S.A.,CATANDUVA,3,2020,Sociedade por Acoes
35300551044,STRATUS CAPITAL S.A.,SAO PAULO,3,2020,Sociedade por Acoes
35300551052,SYDEX BRASIL S/A,GUARULHOS,3,2020,Sociedade por Acoes
35300551061,CLUBECORP SAUDE E BEM ESTAR S.A,SAO PAULO,3,2020,Sociedade por Acoes
35300551079,TOLL PARTICIPACOES S.A.,SAO PAULO,3,2020,Sociedade por Acoes
35300551087,N.R.A.S.P.E. EMPREENDIMENTOS E PARTICIPACOES S.A.,SAO PAULO,3,2020,Sociedade por Acoes
35300551095,DB ADMINISTRACAO E LOCACAO DE IMOVEIS S/A,SERRANA,3,2020,Sociedade por Acoes
35300551109,RINO DIGITAL S/A,SAO PAULO,3,2020,Sociedade por Acoes
35300553560,MATR - ATIVIDADES AUXILIARES DOS SERVICOS FINANCEIROS S/A,SANTANA DE PARNAIBA,3,2020,Sociedade por Acoes
35400189223,COOPER FLEET COOPERATIVA DOS PRESTADORES DE SERVICOS NA AREA DE TRANSPORTES EM GERAL,GUARULHOS,3,2020,Cooperativa
35400191791,CORIPA - COOPERATIVA CONVENCIONAL ORGANICA E AGROECOLOGICA DE ITABERA,ITABERA,3,2020,Cooperativa
35400189223,COOPER FLEET COOPERATIVA DOS PRESTADORES DE SERVICOS NA AREA DE TRANSPORTES EM GERAL,GUARULHOS,3,2020,Cooperativa
35400191791,CORIPA - COOPERATIVA CONVENCIONAL ORGANICA E AGROECOLOGICA DE ITABERA,ITABERA,3,2020,Cooperativa
35500734568,CONSORCIO CORREGO CORDEIRO,BARUERI,3,2020,Consorcio
35500734576,CONSORCIO RIBEIRAO JAGUARE,BARUERI,3,2020,Consorcio
35500734584,CONSORCIO TRAIL - SANIT - SANEJETS,SAO PAULO,3,2020,Consorcio
35500734592,GRANT THORNTON MEDIACOES E RECUPERACOES,SAO PAULO,3,2020,Consorcio
35500734606,CTVI- CENTRO DE TESTES VEICULARES DE IRACEMAPOLIS,IRACEMAPOLIS,3,2020,Consorcio
35500734614,CONSORCIO CT PERFORMANCE SUL,SAO PAULO,3,2020,Consorcio
35500734622,CONSORCIO SP-070,SANTOS,3,2020,Consorcio
35500734631,CONSORCIO PERFORMANCE CIDADE TIRADENTES,SAO PAULO,3,2020,Consorcio
35500734649,CONSORCIO PERFORMANCE CIDADE JARDIM E MORUMBI,SAO PAULO,3,2020,Consorcio
35500734657,CONSORCIO ETEL ENGECORPS,SAO PAULO,3,2020,Consorcio
35500734665,CONSORCIO TSEA-ENGESP,SAO PAULO,3,2020,Consorcio
35500734673,CONSORCIO AMF-CONSTRUVAP,SAO PAULO,3,2020,Consorcio
35500734681,CONSORCIO TCM ENERGIA ATIVA,SAO PAULO,3,2020,Consorcio
35500734690,CONSORCIO LH SUDESTE,SAO PAULO,3,2020,Consorcio
35500734703,CONSORCIO TIS-ADDAX-POLO,SAO PAULO,3,2020,Consorcio
35500734711,CONSORCIO LTDAT_ENGEMAP/AVALICON,ASSIS,3,2020,Consorcio
35500734720,CONSORCIO TP ENGENHARIA,SAO PAULO,3,2020,Consorcio
35500734738,CONSORCIO EGIS - TCRE - PLANAL,COTIA,3,2020,Consorcio
35500734746,CONSORCIO TYPSA-ENGECORPS-AZIMUTE,BARUERI,3,2020,Consorcio
35500734762,CONSORCIO OSCAR FREIRE,SAO PAULO,3,2020,Consorcio
35500734771,CONSORCIO NOVO GUARUJA,SAO PAULO,3,2020,Consorcio
35500734789,CONSORCIO RECUPERA,SAO PAULO,3,2020,Consorcio
35500734797,CONSORCIO YOU MOEMA,SAO PAULO,3,2020,Consorcio
35500734801,CONSORCIO ZUMM-ATLAS,SAO PAULO,3,2020,Consorcio
35500734819,CONSORCIO YOU AIMBERE,SAO PAULO,3,2020,Consorcio
35500734827,CONSORCIO SAUDE INTELIGENTE,SAO PAULO,3,2020,Consorcio
35500734835,CONSORCIO NIPPON KOEI LAC - INCIBRA ENGEBIO (4P017),SAO PAULO,3,2020,Consorcio
35602684250,ENZOCAR VEICULOS EIRELI,SAO CARLOS,3,2020,Armazens Gerais Empresario
35602684268,LUCAS MARCEL BRONCA EIRELI,MANDURI,3,2020,Armazens Gerais Empresario
35602684276,SAULO GOMES GATTI EIRELI,SAO CARLOS,3,2020,Armazens Gerais Empresario
35602684284,FABIANA CRISTINA PEREIRA EIRELI,DESCALVADO,3,2020,Armazens Gerais Empresario
35602684292,PEREZ & PEREZ ACESSORIOS AUTOMOTIVOS EIRELI,DESCALVADO,3,2020,Armazens Gerais Empresario
35602684306,AOLLINS CULTURA E ENSINO EIRELI,LINS,3,2020,Armazens Gerais Empresario
35602684314,K.2 COMERCIO DE AUTOMOVEIS EIRELI,SAO CARLOS,3,2020,Armazens Gerais Empresario
35602775930,SEMINATE GARDEN CENTER JARDINAGEM EIRELI,SALTO GRANDE,3,2020,Armazens Gerais Empresario
35602775948,COMERCIO VAREJISTA DE MATERIAIS DE CONSTRUCAO SAO JORGE EIRELI,MARILIA,3,2020,Armazens Gerais Empresario
35602775956,RECYCLE-COMERCIO DE SUCATAS PLASTICAS E TRANSPORTES EIRELI,GUAIMBE,3,2020,Armazens Gerais Empresario
35602775964,DIGITALXPRESS PAINEIS EIRELI,MARILIA,3,2020,Armazens Gerais Empresario
35602775972,SUNLIGHT ENERGY SISTEMAS FOTOVOLTAICOS EIRELI,POMPEIA,3,2020,Armazens Gerais Empresario
35602775981,TECELAGEM REGENTE EIRELI,BOTUCATU,3,2020,Armazens Gerais Empresario
35602867664,MOISES FERNANDO ZARZENON EIRELI,SANTA FE DO SUL,3,2020,Armazens Gerais Empresario
35602867672,MEGA SOLL ENERGIA SOLAR EIRELI,FERNANDOPOLIS,3,2020,Armazens Gerais Empresario
35602867681,BETEL PROJETOS E CONSTRUCOES EIRELI,FERNANDOPOLIS,3,2020,Armazens Gerais Empresario
35602867699,TATINHO VEICULOS EIRELI,JALES,3,2020,Armazens Gerais Empresario
35602867702,CARLOS CELSO GARCIA EIRELI,MESOPOLIS,3,2020,Armazens Gerais Empresario
35602867711,BRO ACTION ACADEMIA EIRELI,VOTUPORANGA,3,2020,Armazens Gerais Empresario
35602867729,STAR ENERGY FOTOVOLTAICA EIRELI,SANTA FE DO SUL,3,2020,Armazens Gerais Empresario
35602891981,SERTRANSP TERRAPLANAGEM - EIRELI,BARRINHA,3,2020,Armazens Gerais Empresario
35602891999,MULTI TERMICA - ISOLAMENTOS TERMICOS - EIRELI,BARRINHA,3,2020,Armazens Gerais Empresario
35602892006,ISMAR AUTO PECAS E MECANICA - EIRELI,BARRINHA,3,2020,Armazens Gerais Empresario
35602892626,S. A. C. COMERCIO VAREJISTA DE UTILIDADES EIRELI,PALMITAL,3,2020,Armazens Gerais Empresario
35602892634,WMI SERVICOS E APOIO ADMINISTRATIVO - EIRELI,IPAUSSU,3,2020,Armazens Gerais Empresario
35602892642,GUIDIO CONSTRUCOES EIRELI,IPAUSSU,3,2020,Armazens Gerais Empresario
35602892651,B. C. BISPO BRINQUEDOS EIRELI,OURINHOS,3,2020,Armazens Gerais Empresario
35602892669,ALVIM LOGISTICA EIRELI,OURINHOS,3,2020,Armazens Gerais Empresario
35602892677,2SG PROJETOS E ENGENHARIA EIRELI,ASSIS,3,2020,Armazens Gerais Empresario
35602900513,EXTINTORES BARREFOGO EIRELI,BARRETOS,3,2020,Armazens Gerais Empresario
35602900521,MARCOS ALBERTO TRUCULO - EIRELI,BARRETOS,3,2020,Armazens Gerais Empresario
35602900530,BAZAR JULINHA EIRELI,BARRETOS,3,2020,Armazens Gerais Empresario
35602900548,N2N GESTAO IMOBILIARIA EIRELI,GUAIRA,3,2020,Armazens Gerais Empresario
35602900556,CRPO ENGENHARIA EIRELI,BARRETOS,3,2020,Armazens Gerais Empresario
35602900564,BARRETOS VIDROS E ACESSORIOS EIRELI,BARRETOS,3,2020,Armazens Gerais Empresario
35602900572,COMERCIAL SANTO ANTONIO DE GUAIRA ALIMENTOS EIRELI,GUAIRA,3,2020,Armazens Gerais Empresario
35602900581,RETIFICA DE MOTORES RODEIO EIRELI,BARRETOS,3,2020,Armazens Gerais Empresario
35602900599,TORC BUSINESS NEGOCIOS IMOBILIARIOS EIRELI,COLOMBIA,3,2020,Armazens Gerais Empresario
35602900602,ALVORADA ASSESSORIA CONTABIL DE GUAIRA EIRELI,GUAIRA,3,2020,Armazens Gerais Empresario
35602900858,C H S FERREIRA TRANSPORTE EIRELI,MOGI-MIRIM,3,2020,Armazens Gerais Empresario
35602900866,ATHENA INTERMEDIACOES E TRANSPORTES EIRELI,BAURU,3,2020,Armazens Gerais Empresario
35602900874,J. L. DA SILVA CAMPOS EIRELI,JAGUARIUNA,3,2020,Armazens Gerais Empresario
35602900891,TENNESSEE COMERCIO ATACADISTA DE CAFE EIRELI,ESPIRITO SANTO DO PINHAL,3,2020,Armazens Gerais Empresario
35602903776,P. A. S. SANTOS COMERCIO DE BEBIDAS EIRELI,PRESIDENTE PRUDENTE,3,2020,Armazens Gerais Empresario
35602903784,C. G. AGRO REPRESENTACAO COMERCIAL EIRELI,BAURU,3,2020,Armazens Gerais Empresario
35602903792,OSVALDO GONCALVES DE ASSIS EIRELI,PIRAPOZINHO,3,2020,Armazens Gerais Empresario
35602903806,SOUZA REFRIGERACAO CLIMATIZACAO E CONSTRUCAO EIRELI,PRESIDENTE PRUDENTE,3,2020,Armazens Gerais Empresario
35602903814,VALDECIR ANTONIO QUISSI EIRELI,PRESIDENTE PRUDENTE,3,2020,Armazens Gerais Empresario
35602903822,PARDINI TRANSPORTES RODOVIARIOS EIRELI,PRESIDENTE VENCESLAU,3,2020,Armazens Gerais Empresario
35602903831,EVANILDA GIMENES GONCALVES EIRELI,TEODORO SAMPAIO,3,2020,Armazens Gerais Empresario
35602903849,EAGLE BUSINESS - PRESTADORA DE SERVICOS EIRELI,ROSANA,3,2020,Armazens Gerais Empresario
35602903857,IGG INFORMATICA - EIRELI,PRESIDENTE PRUDENTE,3,2020,Armazens Gerais Empresario
35602903865,LEANDRO B. RAIMUNDO EIRELI,TUPI PAULISTA,3,2020,Armazens Gerais Empresario
35602903873,"GDI - TRANSPORTE, TERRAPLENAGEM E CONSTRUCAO CIVIL EIRELI",TEODORO SAMPAIO,3,2020,Armazens Gerais Empresario
35602903881,DOC EXPORT BRASIL IMPORTACAO E EXPORTACAO EIRELI,REGENTE FEIJO,3,2020,Armazens Gerais Empresario
35602905116,AUGUSTO SERVICOS EMPRESARIAIS - EIRELI,SAO CAETANO DO SUL,3,2020,Armazens Gerais Empresario
35602905124,FTBOSSO MANUTENCAO E SERVICOS DE INFORMATICA EIRELI,SAO CAETANO DO SUL,3,2020,Armazens Gerais Empresario
35602934540,MONTELEONE PRODUTOS ODONTOLOGICOS EIRELI,CATANDUVA,3,2020,Armazens Gerais Empresario
35602934558,PARENTE COMERCIO DE METAIS EIRELI,CATANDUVA,3,2020,Armazens Gerais Empresario
35602934566,EMPORIO AVENIDA CATANDUVA - EIRELI,CATANDUVA,3,2020,Armazens Gerais Empresario
35602977605,SUPER PONTO DA CONSTRUCAO EIRELI,SAO JOAO DA BOA VISTA,3,2020,Armazens Gerais Empresario
35602981882,EDSON MARCON EIRELI,LIMEIRA,3,2020,Armazens Gerais Empresario
35602981891,J. L. G. COMERCIO DE VEICULOS SEMI NOVOS EIRELI,LIMEIRA,3,2020,Armazens Gerais Empresario
35602981904,DEKOR ART INDUSTRIA E COMERCIO DE TELAS E QUADROS DECORATIVOS EIRELI,LIMEIRA,3,2020,Armazens Gerais Empresario
35602981912,GABRIEL SORG CARNEIRO EIRELI,LIMEIRA,3,2020,Armazens Gerais Empresario
35602981921,ELETRO FOR INDUSTRIA DE FOLHEADOS EIRELI,LIMEIRA,3,2020,Armazens Gerais Empresario
35602981939,ELEVE PROJETOS E EDIFICACOES EIRELI,LIMEIRA,3,2020,Armazens Gerais Empresario
35602981947,CLIMA FORTE COMERCIO DE AR CONDICIONADO EIRELI,LIMEIRA,3,2020,Armazens Gerais Empresario
35602981955,DIAS E DIAS COMERCIO DE ARTIGOS RELIGIOSOS EIRELI,LIMEIRA,3,2020,Armazens Gerais Empresario
