NIRE,Empresa,Município,Month,Year,Type
35842696716,LUCIANA BUFFONI 25191466802,PINHALZINHO,3,2020,Empresario
35842696741,CRISTIANO DO NASCIMENTO ALVES 39973850840,RIBEIRÃO PRETO,3,2020,Empresario
35842696775,CAROLINE SILVESTRE DE OLIVEIRA 35072797899,PINDAMONHANGABA,3,2020,Empresario
35842696783,TANIA CRISTINA LIMA DE ALMEIDA 17601928802,SÃO CAETANO DO SUL,3,2020,Empresario
35842696805,TIAGO DA SILVA MORAIS 36232362845,ARAÇATUBA,3,2020,Empresario
35842696821,GCV COMERCIO DE RECICLAVEIS,SÃO PAULO,3,2020,Empresario
35842696830,CAROLINA ARRUDA FORMAGGIO 33744712850,CAMPO LIMPO PAULISTA,3,2020,Empresario
35842696848,REGIANE SOUZA GARCIA LEAL PINHO 05678044532,SANTO ANDRÉ,3,2020,Empresario
35842696856,MARKUS VINICIUS DA SILVA 37621499842,SANTO ANDRÉ,3,2020,Empresario
35842696872,HENRY MARCEL OLIVEIRA DOS SANTOS 39907896861,ARARAQUARA,3,2020,Empresario
35842696899,BRUNO RIBEIRO FERNANDES 42875117866,BOM JESUS DOS PERDÕES,3,2020,Empresario
35842696929,ROSENI ACLINA DAS VIRGENS 02132047545,BAURU,3,2020,Empresario
35842696937,MICHAEL COLDIBELI CAMPOS 27541565857,AMERICANA,3,2020,Empresario
35842696945,JULIO CESAR DOS SANTOS 23128248842,ATIBAIA,3,2020,Empresario
35842696953,EDSON JOSE DA SILVA SILVINO 31021145807,SÃO PAULO,3,2020,Empresario
35842696988,JUVERCINO DE BENEDITO 83359249887,FRANCA,3,2020,Empresario
35842697003,ADRIANA ROSA DE OLIVEIRA 42488791822,OSASCO,3,2020,Empresario
35842697038,POLIANA MONTEIRO DOS REIS 51848217838,SÃO JOSÉ DO BARREIRO,3,2020,Empresario
35842697046,EDUARDO SILVERIO 17374350805,SANTO ANDRÉ,3,2020,Empresario
35842697054,MARIA LEIDE SOUZA OLIVEIRA 16123063812,DIADEMA,3,2020,Empresario
35842697062,HAISLAN LOURENCO 37104143858,BARUERI,3,2020,Empresario
35842697071,SUELI BARBOSA DA SILVA 04500577394,SANTO ANDRÉ,3,2020,Empresario
35842697101,GUILHERME ALVES DA SILVA 46087347844,CUBATÃO,3,2020,Empresario
35842697127,VANESSA NUNES PEREIRA SOUSA 33956080858,PORANGABA,3,2020,Empresario
35842697135,JOSE GILVAN SOARES DA SILVA 33780518848,SÃO PAULO,3,2020,Empresario
35842697160,BRENDON DA COSTA INACIO 39097207819,SÃO PAULO,3,2020,Empresario
35842697178,AYSLAN MYKAEL DA SILVA 07293795408,CAMPINAS,3,2020,Empresario
35842697186,PAOLA REZENDE MAZZELLA VENNER 30680954848,GUARATINGUETÁ,3,2020,Empresario
35842697194,SIDNEI FARIA ALVES 25983161857,JANDIRA,3,2020,Empresario
35842697208,WELLINGTON RODRIGO SANCHES BUENO 30882138812,SÃO PAULO,3,2020,Empresario
35842697216,VALERIA DIAS CAMARGO DOS SANTOS 34210650803,CAFELÂNDIA,3,2020,Empresario
35842697232,GILDEAN DIAS DE FREITAS SIRQUEIRA 40640749801,ITAQUAQUECETUBA,3,2020,Empresario
35842697259,GUILHERME GOMES DE ALMEIDA 45480655809,SÃO PAULO,3,2020,Empresario
35842697267,RENALDO FERNANDES GUIMARAES 37295173846,CAMPINAS,3,2020,Empresario
35842697275,WESLEY DIAS DA SILVA 46177435882,ITAQUAQUECETUBA,3,2020,Empresario
35842697283,CEDRI MEDINA 00305653830,SÃO PAULO,3,2020,Empresario
35842697291,JOSE CARLOS DA SILVA MELO 33926848804,SÃO PAULO,3,2020,Empresario
35842697313,ARNALDO VIEIRA RODRIGUES 33877058833,MAIRINQUE,3,2020,Empresario
35842697321,TAMIRES VITOR DE CARVALHO 43257121865,CAÇAPAVA,3,2020,Empresario
35842697348,ALISSON ROMAO GONCALVES DE SOUSA 41152500899,SÃO JOSÉ DOS CAMPOS,3,2020,Empresario
35842697372,RAFAEL ANDREOLLI PROCHNOW 46998906870,RIO CLARO,3,2020,Empresario
35842697399,MARIANA DUARTE CATTAE 38736744832,SANTA GERTRUDES,3,2020,Empresario
35842697445,RAYDANE FRANCIELE DE OLIVEIRA 40772008817,AGUAÍ,3,2020,Empresario
35842697461,EDUARDO AUGUSTO NUNES DA COSTA 08770926808,SÃO PAULO,3,2020,Empresario
35842697488,KAUE FREGOLON DE CAMPOS 44995912878,SÃO PAULO,3,2020,Empresario
35842697496,LARYSSA FERREIRA DOS SANTOS COSTA 01651813205,SÃO JOSÉ DOS CAMPOS,3,2020,Empresario
35842697534,ROSEMEIRE APARECIDA DE OLIVEIRA 29597246821,SÃO PAULO,3,2020,Empresario
35842697542,VANESSA DOS SANTOS OLIVEIRA 33457467862,NARANDIBA,3,2020,Empresario
35842697569,LUIZ MIGUEL MORAES 40487175883,SÃO PAULO,3,2020,Empresario
35842697593,ISABELA DA CONCEICAO 38614619863,SÃO PAULO,3,2020,Empresario
35842697607,JEFFERSON JESUS DA SILVA 38911106852,MONGAGUÁ,3,2020,Empresario
35842697640,RODOLFO LUIS JANUARIO 34020070881,PIRACICABA,3,2020,Empresario
35842697658,LUCI XAVIER DE OLIVEIRA 32869796862,CRUZEIRO,3,2020,Empresario
35842697666,DENILSON MENEZ DE OLIVEIRA,MIRASSOL,3,2020,Empresario
35842697704,JUCELIA COSTA MOTA 02373536447,SANTANA DE PARNAÍBA,3,2020,Empresario
35842697712,GRAZIELE PEREIRA RIBEIRO MASSARO 39492262819,SÃO PAULO,3,2020,Empresario
35842697747,HELEN JACQUELINE SOARES RODRIGUES 25525694808,FRANCA,3,2020,Empresario
35842697780,MARTA HELENA DE OLIVEIRA CASTRO CALISTINI 26969010821,SÃO PAULO,3,2020,Empresario
35842697798,MOAB DOS SANTOS LUZ 36081437850,SÃO PAULO,3,2020,Empresario
35842697801,MAURICIO KLEBER DE FREITAS 14858808823,SÃO PAULO,3,2020,Empresario
35842697828,CINTIA DA SILVA QUEIROZ 26806742866,SÃO PAULO,3,2020,Empresario
35842697844,ROGERIO GUMERCINDO MANOEL 37238945851,TATUÍ,3,2020,Empresario
35842697852,GABRIEL DE CARVALHO FERNANDES 42128286859,SÃO PEDRO,3,2020,Empresario
35842697861,LALESKA MARQUES ANDRE 22827228840,SÃO PAULO,3,2020,Empresario
35842697879,EVERSON OLIVEIRA DE JESUS 32128368812,CARAPICUÍBA,3,2020,Empresario
35842697887,MARCEL LEITE SANTOS 18297326845,SÃO PAULO,3,2020,Empresario
35842697909,RAFAEL MONTEIRO DA SILVA 39406462885,PENÁPOLIS,3,2020,Empresario
35842697917,MARCELO CAVALCANTE DE ARAUJO 31448137888,SÃO PAULO,3,2020,Empresario
35842697933,PENHA REGINA CONCEICAO DIAS 10108346811,SÃO PAULO,3,2020,Empresario
35842697941,MARILIA RAMOS 36832638817,SÃO PAULO,3,2020,Empresario
35842697950,ADEILZA SANTOS MACENA SERRAO 05878444429,DIADEMA,3,2020,Empresario
35842697984,RODRIGO MITSUO MONTEIRO 36423611882,MOGI DAS CRUZES,3,2020,Empresario
35842698018,MAGDA VENANCIO LEITE 41303320827,GUARULHOS,3,2020,Empresario
35842698042,THIAGO VITOR DE SOUZA 44703672812,SANTO ANDRÉ,3,2020,Empresario
35842698069,HEITOR DE SOUZA DUQUE BORGES 38496395847,AMERICANA,3,2020,Empresario
35842698115,JEIVISON JOSE DA SILVA SANTOS 38298249801,SÃO PAULO,3,2020,Empresario
35842698131,UBIRAJARA MATOS SENA 03542875597,SÃO PAULO,3,2020,Empresario
35842698140,TALIA CRISTINA COSTA SOUZA 45700381826,CAMPINAS,3,2020,Empresario
35842698158,ADRIANA RIBEIRO DE MEIRA 42811274880,GUARULHOS,3,2020,Empresario
35842698182,FRANCINI OLIVEIRA BERNACCHI 36743418838,SÃO PAULO,3,2020,Empresario
35842698204,THIAGO PEREIRA RODRIGUES 35955119809,SÃO PAULO,3,2020,Empresario
35842698239,ROBERTO MILLER DA SILVA 24971392882,SÃO BERNARDO DO CAMPO,3,2020,Empresario
35842698247,MATEUS NOGUEIRA DE SOUZA 42429867850,SÃO PAULO,3,2020,Empresario
35842698255,MARIANA LIMA CANNA BRASIL 04081745528,SÃO PAULO,3,2020,Empresario
35842698263,FELIPE MARTINEZ COSTA 43761945817,GUARULHOS,3,2020,Empresario
35842698280,RINALDO EVANGELISTA 26174811824,SANTOS,3,2020,Empresario
35842698301,LUIZA SALGADO ESTEVES 48519347851,SÃO PAULO,3,2020,Empresario
35842698336,HELLEN SOARES BARBOSA 37033584830,SÃO PAULO,3,2020,Empresario
35842698379,FELIPE CARVALHO DE BRITO 40775408875,GUARULHOS,3,2020,Empresario
35842698387,PAULO VICTOR COSTA DA FONSECA 41201170818,FRANCO DA ROCHA,3,2020,Empresario
35842698395,RENATA DE ANDRADE FERREIRA DIAS 28821841820,TABOÃO DA SERRA,3,2020,Empresario
35842698409,RENATO ANDRADE REIS 31435568893,SÃO BERNARDO DO CAMPO,3,2020,Empresario
35842698450,DAVID CESAR NASCIMENTO 33521744825,SÃO PAULO,3,2020,Empresario
35842698492,SERGIO SHIGUERO TUSTUMI 03221988877,CAMPINAS,3,2020,Empresario
35842698506,VINICIUS GUILHERME PINNA 41234414830,SÃO PAULO,3,2020,Empresario
35842698514,LEONARDO KELVIN BATISTA SCANDELAI 45194305850,DIADEMA,3,2020,Empresario
35842698531,MAGNALDA PEREIRA DA SILVA 05033096800,SÃO PAULO,3,2020,Empresario
35842698573,FELIPE REBELLES GONCALVES 37157508800,SÃO PAULO,3,2020,Empresario
35842698581,AMANDHA PEREIRA GANDRA CAETANO 36407517877,SANTOS,3,2020,Empresario
35842698590,EDUARDO RAMOS DE MORAIS 42497106886,TAUBATÉ,3,2020,Empresario
35842698620,MAURICIO HENRIQUE SOUZA VOLPATI 38169430801,SANTO ANDRÉ,3,2020,Empresario
35842698646,ANA PAULA DE SOUZA MOREIRA 31332705839,BARUERI,3,2020,Empresario
35842698662,WASHINGTON LUIZ DE OLIVEIRA 37220790805,SÃO PAULO,3,2020,Empresario
35842698671,THIAGO DOS SANTOS MANINI 22344715835,SÃO PAULO,3,2020,Empresario
35842698689,JOAEL OLIVEIRA COSTA DA SILVA 39511686844,ITAQUAQUECETUBA,3,2020,Empresario
35842698697,MARIA HELENA HENRIQUE MOREIRA 30947703802,LIMEIRA,3,2020,Empresario
35842698727,ROSANA BRAGA MACHADO SANTOS PEREIRA 21820065839,SÃO JOSÉ DOS CAMPOS,3,2020,Empresario
35842698760,SAMARA MONZEM 23003161881,SÃO PAULO,3,2020,Empresario
35842698778,RAYSSA MACEDO ALVES TEIXEIRA 48109628818,SÃO PAULO,3,2020,Empresario
35842698841,JULIANA DE CASSIA CARVALHO MARQUES 40510802850,CAMPINAS,3,2020,Empresario
35842698875,MARCELA COSTA LIMA KUHN 34940967832,SÃO PAULO,3,2020,Empresario
35842698913,KARINA AIRES DA SILVA 32818340861,SÃO PAULO,3,2020,Empresario
35842698921,BRUNA DA SILVA JOAQUIM 38436683889,PRAIA GRANDE,3,2020,Empresario
35842698948,CESAR AUGUSTO BARREIRO 31796647896,OSASCO,3,2020,Empresario
35842698956,DANIELA ANDRADE SANTOS 02752968574,SÃO PAULO,3,2020,Empresario
35842698964,GUILHERME ARAUJO DOS SANTOS 40677244894,SANTO ANDRÉ,3,2020,Empresario
35842699014,DIEGO DE OLIVEIRA RAMOS 38390271877,GUARATINGUETÁ,3,2020,Empresario
35842699022,KATIA CILENE SILVA GASPAR 10148900801,SANTO ANDRÉ,3,2020,Empresario
35842699049,ANTONIA MARCIA ALVES DE FREITAS 05416918306,SANTO ANDRÉ,3,2020,Empresario
35842699057,ROGERIO MINODA GOTO 25104581837,SÃO PAULO,3,2020,Empresario
35842699065,MARIA DO SOCORRO DOS SANTOS SILVA 10719400821,SÃO PAULO,3,2020,Empresario
35842699090,FABIO DE OLIVEIRA LIMONE 28221952850,SANTO ANDRÉ,3,2020,Empresario
35842699154,ELIANA DE SOUZA JARCEN 14939624854,DIADEMA,3,2020,Empresario
35842699189,WAGNER LEME DE OLIVEIRA 32417651807,BAURU,3,2020,Empresario
35842699197,ANA CAMILA FERREIRA DE SOUZA 33274389862,SÃO VICENTE,3,2020,Empresario
35842699201,ELSON BEZERRA SILVA DA MOTA 39205382850,CAMPINAS,3,2020,Empresario
35842699251,VALTER BUZZO DUARTE 26713973809,SÃO BERNARDO DO CAMPO,3,2020,Empresario
35842699286,DEBORA TEIXEIRA SANTOS BARBOSA 26551864864,SÃO PAULO,3,2020,Empresario
35842699308,MARCIA CRISTINA RAMOS RODRIGUES 37751884878,SOCORRO,3,2020,Empresario
35842699324,REGINALDO EMANUEL DA SILVA SOUZA 15500961845,SUMARÉ,3,2020,Empresario
35842699375,EVILENE CATUREBA MACEDO 06578627545,SÃO PAULO,3,2020,Empresario
35842699383,LADY JANE PEREIRA DOS SANTOS 39924277813,SÃO PAULO,3,2020,Empresario
35842699413,KLEBER ALEXANDRE PINTO 28048221845,SANTO ANDRÉ,3,2020,Empresario
35842699430,DOUGLAS PEREIRA DOS SANTOS 13035992878,GUARULHOS,3,2020,Empresario
35842699464,SARAH CRISTINA TAVARES SILVA DOS SANTOS 44740445840,SÃO PAULO,3,2020,Empresario
35842699472,ANTONIO SAKUVANGO SALUMBONGO 23821458895,SÃO PAULO,3,2020,Empresario
35842699481,PAULO GABRIEL FELIX DE AZEVEDO 38732899890,SÃO CARLOS,3,2020,Empresario
35842699502,ALANIS DE LIMA QUEIROZ SOARES 46702642814,BAURU,3,2020,Empresario
35842699529,CAMILLA SANTOS BONFIM 39331697805,GUARUJÁ,3,2020,Empresario
35842699537,ADRIANO FRANCISCO DE SOUZA 07337252609,GUARUJÁ,3,2020,Empresario
35842699545,CAIQUE OLIVEIRA DOS SANTOS 44550724897,SÃO PAULO,3,2020,Empresario
35842699570,EDERSON RIBEIRO BARBOSA 33373751896,VINHEDO,3,2020,Empresario
35842699588,PEDRO CEZAR PESAROGLO DE OLIVEIRA 23574413807,SÃO PAULO,3,2020,Empresario
35842699600,FABIO LIBERATO DA SILVA KAZIMARA 34041957877,LIMEIRA,3,2020,Empresario
35842699626,ROBISON VITOR DE LISBOA 30475208870,GUARUJÁ,3,2020,Empresario
35842699642,EVANDI GOMES TEODOZIO 05808137462,SÃO JOSÉ DOS CAMPOS,3,2020,Empresario
35842699651,MIKAELLY KAUANE DA SILVA CAVALCANTE 43150191866,DIADEMA,3,2020,Empresario
35842699707,GILBERTO PEREIRA DE BARROS JUNIOR 48228851863,SÃO PAULO,3,2020,Empresario
35842699715,AMANDA REBECA BELMIRO VIANA PERETTA 33266286847,GUARULHOS,3,2020,Empresario
35842699766,KAREN LUIZA CHECCHIA ALVES 32817919807,ITATIBA,3,2020,Empresario
35842699774,LUCIANO SOZZA DA SILVA 25421376842,SÃO PAULO,3,2020,Empresario
35842699804,ADRIANA BATISTA DE OLIVEIRA 31790308879,GUARULHOS,3,2020,Empresario
35842699821,CELSO HERCULANO DA SILVA 27165365893,SÃO PAULO,3,2020,Empresario
35842699839,FABIANA DA SILVA TEIXEIRA DE JESUS 30621961817,SÃO VICENTE,3,2020,Empresario
35842699847,YNGRID BARBOSA DA SILVA 49023773810,SÃO VICENTE,3,2020,Empresario
35842699863,FLAVIA MURILO MONTEIRO 22863604805,PINDAMONHANGABA,3,2020,Empresario
35842699901,ALLAN GABRIEL GONCALVES DA LUZ GOMES 42583975803,SÃO PAULO,3,2020,Empresario
35842699910,ALEXANDRE TIBURCIO DA CONCEICAO 11749023881,LEME,3,2020,Empresario
35842699995,ANDERSON COSTA CAMPOS 29888813838,SÃO PAULO,3,2020,Empresario
35842700004,RODRIGO ROSA GOMES 35646549841,SANTOS,3,2020,Empresario
35842700012,LUCAS SILVA DE LIMA 40833587854,SÃO PAULO,3,2020,Empresario
35842700047,DJALMA DE ARAUJO OLIVEIRA 21743368801,CAIEIRAS,3,2020,Empresario
35842700055,ALINE RITA FERREIRA DO NASCIMENTO 36939007873,MOCOCA,3,2020,Empresario
35842700071,CARLOS ALBERTO DA COSTA LEITE 30801475880,SÃO PAULO,3,2020,Empresario
35842700080,ROSILENE APARECIDA DE SOUZA LUZANA 30758729898,PRESIDENTE PRUDENTE,3,2020,Empresario
35842700098,JOAO BATISTA MARTINS 87411997820,JUNDIAÍ,3,2020,Empresario
35842700101,MONAH LAYSLA DA SILVA JACOB 35367592899,SÃO PAULO,3,2020,Empresario
35842700136,TATIANE SILVERIO 29895009879,GUARULHOS,3,2020,Empresario
35842700144,CLAYTON FRANCISCO TRINDADE OLIVEIRA 43589949899,SERTÃOZINHO,3,2020,Empresario
35842700161,MILTON SOUZA DA SILVA 33955404803,SÃO PAULO,3,2020,Empresario
35842700179,ANDERSON CARDOSO DE MELO 29291888800,COTIA,3,2020,Empresario
35842700187,JOSEFA SELMA DA SILVA 39358577487,ARUJÁ,3,2020,Empresario
35842700209,FABIANA DA CONCEICAO GUARNIERI 30173691889,CARAPICUÍBA,3,2020,Empresario
35842700217,JAIR APARECIDO RODRIGUES DA SILVA 25913062817,TIETÊ,3,2020,Empresario
35842700225,BRUNA ELISA DA SILVA 33008130852,LIMEIRA,3,2020,Empresario
35842700233,SOLANGE CRISTINA DE FARIAS FERRAZ 22347169858,VOTUPORANGA,3,2020,Empresario
35842700241,ELIVANIA DOS SANTOS ANDRADE 62159102369,CAMPINAS,3,2020,Empresario
35842700250,RONALDO GONCALVES DE SOUZA 25334957863,CAMPINAS,3,2020,Empresario
35842700276,ELISETE DE JESUS DOS SANTOS CORREA 08124767866,SÃO JOSÉ DOS CAMPOS,3,2020,Empresario
35842700306,EDILA MURIEL DANTAS DE ALMEIDA 35753312861,GUARULHOS,3,2020,Empresario
35842700322,BRUNO CESAR ALVES COELHO 75609630134,SÃO PAULO,3,2020,Empresario
35842700331,EDIMAR AMARO DE ARRUDA 36522012804,SÃO CARLOS,3,2020,Empresario
35842700349,MARCELO RODRIGUES DA SILVA 29318136803,CAJAMAR,3,2020,Empresario
35842700357,RONEY DA SILVA GUALBERTO 48131175898,SÃO PAULO,3,2020,Empresario
35842700365,FABIO ROGERIO MACHADO 65267516104,ITAPEVA,3,2020,Empresario
35842700403,SEBASTIAO DE OLIVEIRA CARDOZO 16899496860,ARTUR NOGUEIRA,3,2020,Empresario
35842700420,ALDREY THOMAZ GIGLIOLI 28856356813,LENÇÓIS PAULISTA,3,2020,Empresario
35842700438,ISAIAS SILVA DOS SANTOS 76840654249,JOSÉ BONIFÁCIO,3,2020,Empresario
35842700454,THAISA AUGUSTO TEIXEIRA 44254959850,LENÇÓIS PAULISTA,3,2020,Empresario
35842700489,RODRIGO APARECIDO MAIA 48557928882,FRANCO DA ROCHA,3,2020,Empresario
35842700497,BRUNA CARNEIRO NUNES GUSMAO 39247711894,SÃO PAULO,3,2020,Empresario
35842700527,IGOR JOSE NAZIAZENO DOS SANTOS SILVA 43754227858,SÃO PAULO,3,2020,Empresario
35842700543,MARCO TORRALBO GARCIA 25362438859,SÃO PAULO,3,2020,Empresario
35842700551,DARTANHAM VINICIUS LIMA CORDEIRO 39477176877,SÃO PAULO,3,2020,Empresario
35842700560,GUILHERME HENRIQUE PALMA 46940940847,SANTA BÁRBARA D'OESTE,3,2020,Empresario
35842700608,VIVIAN BAHYJA ARUK 00664975828,SÃO PAULO,3,2020,Empresario
35842700641,LUCIA HELENA LORENZON CIOCCA 30166287830,BAURU,3,2020,Empresario
35842700675,VERA LUCIA DE AGUIAR BRANDAO 17855657886,ITU,3,2020,Empresario
35842700683,EDINEIA DA SILVA MARTINS 34860122828,IEPÊ,3,2020,Empresario
35842700730,PAULO HENRIQUE MARCONDES DELFINO 39779074848,ITAPIRA,3,2020,Empresario
35842700764,PAULO HENRIQUE LOPES 41309074844,LENÇÓIS PAULISTA,3,2020,Empresario
35842700772,JOSE OSMAR PAINA 04248901862,MOGI MIRIM,3,2020,Empresario
35842700781,ADRIANA ALVES SANTA ROSA 31763452832,SÃO PAULO,3,2020,Empresario
35842700799,MARINHO ALVES FLAVIO 08067543895,SÃO JOSÉ DO RIO PRETO,3,2020,Empresario
35842700811,RICARDO RODRIGUES DE OLIVEIRA 35010203847,TUIUTI,3,2020,Empresario
35842700853,NATHALIA FERREIRA PALMIERI 41884241840,SÃO PAULO,3,2020,Empresario
35842700870,MILEIDE APARECIDA SANCHES PEDREIRA 13279080851,SÃO PAULO,3,2020,Empresario
35842700888,RENATA CIOTTI FUGITA 35019300896,SÃO PAULO,3,2020,Empresario
35842700900,JOAO VITOR NICODEMUS GRACIANO 17034458723,SÃO PAULO,3,2020,Empresario
35842700926,VANESSA APARECIDA BARBOSA 21410698823,OSASCO,3,2020,Empresario
35842700934,BRENDA LUANY VINHA 42414227800,SÃO JOSÉ DO RIO PRETO,3,2020,Empresario
35842700942,CARLOS EDUARDO DE OLIVEIRA SILVA 30572225873,BOITUVA,3,2020,Empresario
35842700977,ALINE DE SOUZA CAMPOS 49213312865,SÃO PAULO,3,2020,Empresario
35842700993,BRUNO DANTAS DE AZEVEDO 22775725864,ARAÇATUBA,3,2020,Empresario
35842701019,MATEUS DE JESUS MACEDO 48339336835,SOROCABA,3,2020,Empresario
35842701035,SUZANA GIANINI 27487918866,RUBINÉIA,3,2020,Empresario
35842701060,CELINA LUCIO 38895817818,SOROCABA,3,2020,Empresario
35842701086,MARIA LAZARA DE PAULA E SILVA EVARISTO 01643047892,SANTA BÁRBARA D'OESTE,3,2020,Empresario
35842701094,EZEQUIEL ZANETI PESSOA 08307551870,AMERICANA,3,2020,Empresario
35842701132,JOSETE MONTEIRO DA SILVA E SILVA 29671191487,COTIA,3,2020,Empresario
35842701141,MARIANE BARCELLOS DA SILVA OLIVEIRA 35270858827,SÃO PAULO,3,2020,Empresario
35842701183,SANDRA GONCALVES ROCHA 39336730894,ITU,3,2020,Empresario
35842701191,MIZAEL GUALBERTO TEIXEIRA 22555946845,SÃO JOSÉ DO RIO PRETO,3,2020,Empresario
35842701205,MARCILIO CLARO NETO 23715009845,SÃO JOSÉ DOS CAMPOS,3,2020,Empresario
35842701213,RICARDO FERREIRA RODRIGUES 97122157504,PRAIA GRANDE,3,2020,Empresario
35842701230,EXPEDITO DE JESUS VIEIRA 05225186564,SÃO PAULO,3,2020,Empresario
35842701281,ALADIR JOVITA DA SILVA 05067963883,GUARULHOS,3,2020,Empresario
35842701302,JAMES TEIXEIRA DIAS 43006122852,ITAPEVI,3,2020,Empresario
35842701311,MARIVALDA APARECIDA DOS SANTOS 32350054802,PRESIDENTE EPITÁCIO,3,2020,Empresario
35842701329,JULIO CESAR CORCINI DE MEDEIROS 45127535831,GUARULHOS,3,2020,Empresario
35842701337,VAGNER SOUZA DOS SANTOS 22806944848,ITAQUAQUECETUBA,3,2020,Empresario
35842701353,MARIA DE LURDES PIMPINATO ELIAS 17562891826,PIRACICABA,3,2020,Empresario
35842701370,AILTON DOS SANTOS 00987536575,SÃO PAULO,3,2020,Empresario
35842701396,MARIA APARECIDA ROSA DE JESUS 13980444821,MONTE MOR,3,2020,Empresario
35842701400,WILLIAM DE CARVALHO COSTA 44950919806,GUARULHOS,3,2020,Empresario
35842701418,PAOLA SILVA DE SOUZA 40014382830,SÃO PAULO,3,2020,Empresario
35842701426,MARLENE NEVES ARAUJO DE CARVALHO 04364505854,TREMEMBÉ,3,2020,Empresario
35842701442,ANDREA MEDINA RIGA 30298381885,PRESIDENTE PRUDENTE,3,2020,Empresario
35842701451,PAULO SERGIO DA SILVA 17363424870,PALMARES PAULISTA,3,2020,Empresario
35842701469,ROSILEIA VICTORIA DA SILVA 40420744568,CAMPINAS,3,2020,Empresario
35842701485,MARIO MASANORI OIKAWA 00697007880,PRESIDENTE PRUDENTE,3,2020,Empresario
35842701493,JOAO CARLOS BACAROV 05594523812,SANTO ANDRÉ,3,2020,Empresario
35842701515,MARIANE GARCIA NASCIMENTO 39776724876,PRESIDENTE PRUDENTE,3,2020,Empresario
35842701523,ERIKA FERNANDES DE SOUZA 22613132841,SÃO PAULO,3,2020,Empresario
35842701531,MARIA GORETTE DE OLIVEIRA 10821739832,SÃO BERNARDO DO CAMPO,3,2020,Empresario
35842701540,JESSICA CRISTINA LIMA DA SILVA 41098545800,RINÓPOLIS,3,2020,Empresario
35842701566,MILENE SANTOS MORAES,VALENTIM GENTIL,3,2020,Empresario
35842701574,MARCELA GUIMARAES MEDEIROS PAIVA 09069407612,SÃO JOSÉ DO RIO PRETO,3,2020,Empresario
35842701582,LEANDRO FERREIRA DE SOUZA 38811885841,PAULÍNIA,3,2020,Empresario
35842701621,RENATO CIPULLA RODRIGUES 19597284820,SÃO PAULO,3,2020,Empresario
35842701639,OLEGARIO JUNIO MOREIRA DA SILVA 41498998860,JUNDIAÍ,3,2020,Empresario
35842701655,ANTONIETA DE GODOY 14755699800,LIMEIRA,3,2020,Empresario
35842701663,EDVALDO CARDOSO DE OLIVEIRA 14671101831,SÃO PAULO,3,2020,Empresario
35842701671,REGINA APARECIDA DOS SANTOS RIBEIRO 25424176879,GUZOLÂNDIA,3,2020,Empresario
35842701680,LUCILENA DE OLIVEIRA RICCI 02825012823,ARARAQUARA,3,2020,Empresario
35842701698,CRISTIAN DE FREITAS PAULINO 41716902851,VARGEM GRANDE DO SUL,3,2020,Empresario
35842701701,FERNANDO BEZERRA PAIVA 61509783385,ARAÇATUBA,3,2020,Empresario
35842701728,FABIO CESAR RIBEIRO PINTO 29425281840,CRUZEIRO,3,2020,Empresario
35842701809,RODRIGO ALVES DOS SANTOS 16367825827,TATUÍ,3,2020,Empresario
35842701850,ROGERIO PEREIRA DOS SANTOS 26236430837,INDAIATUBA,3,2020,Empresario
35842701868,RONALDO VALERIANO DE OLIVEIRA 30293996806,PENÁPOLIS,3,2020,Empresario
35842701876,DEJAILSON DA SILVA QUEIROZ 66295106153,BAURU,3,2020,Empresario
35842701884,ANALICIA FIORAVANTI GRANER 22206065894,ORLÂNDIA,3,2020,Empresario
35842701906,WAGNER MARTINS FRUDELLES 49493641899,CONCHAS,3,2020,Empresario
35842701914,EUNICE APARECIDA MEDEIROS DE LIMA 20281416893,SÃO JOSÉ DO RIO PRETO,3,2020,Empresario
35842701922,FABIANA COSTA DOS SANTOS 22785433858,SÃO PAULO,3,2020,Empresario
35842701931,LEONARDO HENRIQUE OLIVEIRA LEMOS 42241934852,SÃO PAULO,3,2020,Empresario
35842701949,BEATRIS NICOLLI CELIMA DE LARA 47398058802,ITAPECERICA DA SERRA,3,2020,Empresario
35842702007,MARCELO DE MELO SOUZA 30407151869,FRANCA,3,2020,Empresario
35842702015,ANTONIO ALEXANDRE IGNACIO 27832707810,PIRASSUNUNGA,3,2020,Empresario
35842702031,DEBORA APARECIDA CAETANO PIMENTEL 27971593813,SÃO PAULO,3,2020,Empresario
35842702040,DAVISON DO NASCIMENTO SOUSA 41755583818,SÃO JOSÉ DO RIO PRETO,3,2020,Empresario
35842702066,THIAGO VILELA RENO 08412888600,SÃO PAULO,3,2020,Empresario
35842702074,EDINALVA CARDOSO SOARES 04823684621,SÃO PAULO,3,2020,Empresario
35842702091,PALOMA CRISTINA MOREIRA CLEMENTE 48191971852,TAUBATÉ,3,2020,Empresario
35842702104,WESLEY AUGUSTO PEREIRA 11638348669,GUARULHOS,3,2020,Empresario
35842702155,EMILY DE CASSIA ALVES PEREIRA 48508836805,SÃO PAULO,3,2020,Empresario
35842702163,ANTONIA NOLASCO DOS SANTOS 01697268510,SANTO ANDRÉ,3,2020,Empresario
35842702180,DJALMA SANTO RIBEIRO JUNIOR 39691115875,BAURU,3,2020,Empresario
35842702198,FRANKLIN FALCON MACIEL SILVA 40382865847,JUNDIAÍ,3,2020,Empresario
35842702210,RAQUEL CONCEICAO DE SA LUIZ 45169444800,SÃO PAULO,3,2020,Empresario
35842702228,MIRIAN DE FRANCA MARCIANO 07261630829,SALTO,3,2020,Empresario
35842702236,TARZO LUCAS DOS SANTOS 43825910822,SÃO PAULO,3,2020,Empresario
35842702252,VALERIA MACHADO DE ALMEIDA ALLEVATO 06076242809,SÃO PAULO,3,2020,Empresario
35842702261,ELLEN BUENO SANTOS 33776026820,SOROCABA,3,2020,Empresario
35842702279,ROSA MARIA FOGANHOLI 01524781835,BOTUCATU,3,2020,Empresario
35842702287,DONIZETE APARECIDA MARTELLI 05638599894,ITÁPOLIS,3,2020,Empresario
35842702295,CARLA FERNANDA DE ALMEIDA PENHA 34582700861,TEODORO SAMPAIO,3,2020,Empresario
35842702309,ANNE BEATRIZ LOPES MARTINS DE AGUIAR 09082058995,JACUPIRANGA,3,2020,Empresario
35842702317,ALEXANDRE CESAR DE ABREU 16032029867,AMERICANA,3,2020,Empresario
35842702333,CHESLEY LOURENCO DIAS 33707370860,ITAPEVA,3,2020,Empresario
35842702341,LUZIA FREITAS SALES 28935593877,NAZARÉ PAULISTA,3,2020,Empresario
35842702384,VAGNER REIS MIAN JUNIOR 41609324870,MERIDIANO,3,2020,Empresario
35842702392,NATALIA SAETTINI 34356260899,SÃO PAULO,3,2020,Empresario
35842702422,THIELLY MORETTI BARRETO FELICIO 42533654850,SÃO PAULO,3,2020,Empresario
35842702449,MARIA PASCIANE DE JESUS PASSOS 03571111176,SANTOS,3,2020,Empresario
35842702481,LAISE VENINA DOMINGUES ZANARDI 31328203859,ARAÇATUBA,3,2020,Empresario
35842702490,WAGNER DUARTE DA SILVA 33964885800,MONTE MOR,3,2020,Empresario
35842702520,IVONE SALGADO 03066411869,CAMPINAS,3,2020,Empresario
35842702538,EDINA APARECIDA DA SILVA BRITO 25311462884,ITAPEVA,3,2020,Empresario
35842702546,RODRIGO GIANCOLI BUSNARDO 31615462880,BAURU,3,2020,Empresario
35842702571,LUIZ FERNANDO VENTURA 30495554839,JAÚ,3,2020,Empresario
35842702643,BEATRIZ ROCHA BERNARDES 46752918805,SÃO PAULO,3,2020,Empresario
35842702651,MARILENE FERREIRA DOS SANTOS 06496207631,LIMEIRA,3,2020,Empresario
35842702678,LUIZ CARLOS SGALLA,SOROCABA,3,2020,Empresario
35842702686,NADIA ALCALDE PROCIUNCLA 43988941875,SOROCABA,3,2020,Empresario
35842702694,JOSE GUSTAVO DA ANUNCIACAO 42189520860,SÃO PAULO,3,2020,Empresario
35842702708,AMANDA SANT ANA 43853211836,SÃO PAULO,3,2020,Empresario
35842702724,VAGNER APARECIDO ALVES 04448027899,VOTUPORANGA,3,2020,Empresario
35842702732,GORETI DE CASSIA RODRIGUES TOMAZ PEDRO 20185867855,GUARATINGUETÁ,3,2020,Empresario
35842702783,LUISA BALANIUC NAHAS 40933866844,RIBEIRÃO PRETO,3,2020,Empresario
35842702813,RAIMUNDO DOS SANTOS 55262830382,SÃO PAULO,3,2020,Empresario
35842702821,OSMAR OLIVIERI 11089572859,BAURU,3,2020,Empresario
35842702830,LUCAS GONCALVES MEGA 41325002844,PAULÍNIA,3,2020,Empresario
35842702856,JOZI FERREIRA DE SANT ANA 31362771805,SÃO PAULO,3,2020,Empresario
35842702911,LEANDRO DE OLIVEIRA 22117413803,PIEDADE,3,2020,Empresario
35842702937,RODRIGO OLIVEIRA DA SILVA 33322976866,ARAÇATUBA,3,2020,Empresario
35842702945,ALEX DOUGLAS SOARES OLIRA 13479152651,SÃO PAULO,3,2020,Empresario
35842702953,NIVALDO DE ARAUJO TORRES 13908584809,ITAPEVA,3,2020,Empresario
35842702970,ANA CLAUDIA DE SOUZA 10078768403,GUARULHOS,3,2020,Empresario
35842702996,ELEN CRISTINA DE BARROS ARAUJO 28472873889,SÃO PAULO,3,2020,Empresario
35842703003,APARECIDO DELA COLECTA 10707665850,BEBEDOURO,3,2020,Empresario
35842703097,CAMILO DE LELIS THOMAZELLA 01084516829,CONCHAS,3,2020,Empresario
35842703160,SILMARA DE LACERDA OLIVEIRA 17589687880,SÃO CAETANO DO SUL,3,2020,Empresario
35842703208,ANDREI LUCIANO ALEIXO 17542832840,RIBEIRÃO PRETO,3,2020,Empresario
