NIRE,Empresa,Município,Month,Year,Type
35102044928,MANOEL PENTEADO,TAIÚVA,6,1983,Empresario
35102045258,SEBASTIAO APARECIDO NABA,,6,1983,Empresario
35102045266,ANA FERNANDES DE AGUIAR,,6,1983,Empresario
35102045321,DAGOBERTO MIGUEL BELIZARIO MACHADO,RIOLÂNDIA,6,1983,Empresario
35102045380,NIVALDA TAVARES DE JESUS,TAUBATÉ,6,1983,Empresario
35102045509,LEVINA EGEN,ITARARÉ,6,1983,Empresario
35102045568,ORLANDO SANTARELLI,,6,1983,Empresario
35102045614,EDUARDO R. SOUZA USINAGEM,SÃO PAULO,6,1983,Empresario
35102045657,ATAIDE PEREIRA PARDINHO,PENÁPOLIS,6,1983,Empresario
35102045711,MOISES DONIZETE SIMONAGIO,,6,1983,Empresario
35102045720,MARIA CAROLINA COLOMBO,SÃO PAULO,6,1983,Empresario
35102045754,JOSE EDERALDO FERNANDES,AVARÉ,6,1983,Empresario
35102045932,ELVIO R OLIVEIRA,SÃO PAULO,6,1983,Empresario
35102046165,RAUL ADIL ALVES,APIAÍ,6,1983,Empresario
35102046246,CELSO ROBERTO SISTI,PRESIDENTE BERNARDES,6,1983,Empresario
35102046335,BENEDITO DE CASTRO IBITINGA,IBITINGA,6,1983,Empresario
35102046556,CILCE DE OLIVEIRA CAMPANATI,ÁGUAS DE SANTA BÁRBARA,6,1983,Empresario
35102046718,CARMEM SILVA,,6,1983,Empresario
35102046904,JOSE CORREIA CEBOLA,,6,1983,Empresario
35102046955,CORNELIO PEREIRA DA SILVA LOUVEIRA,LOUVEIRA,6,1983,Empresario
35102047072,SERGIO SHIGUEO EKEDA,SÃO PAULO,6,1983,Empresario
35102047188,J. NASCIMENTO OLIVEIRA,QUELUZ,6,1983,Empresario
35102047234,SIDNEI DA SILVA AMBULANTE,SÃO PAULO,6,1983,Empresario
35102047323,LUCY PISSIQUELO COLOMBO,MOGI GUAÇU,6,1983,Empresario
35102047358,BERNADETE APARECIDA DA SILVA,,6,1983,Empresario
35102047374,EDSON LOPES ARMAZEM,PIRAJU,6,1983,Empresario
35102047439,AUGUSTO APARECIDO REINALDI,,6,1983,Empresario
35102047471,BENEDITO JOEL ALVARENGA,PARAIBUNA,6,1983,Empresario
35102047480,MARIA APARECIDA DA SILVA CARVALHO BAR,SÃO BERNARDO DO CAMPO,6,1983,Empresario
35102047561,JAELSON JORGE DOS SANTOS,SÃO PAULO,6,1983,Empresario
35102047587,SEVERINO VICENTE DA SILVA CASA DE UMBANDA,SANTO ANDRÉ,6,1983,Empresario
35102047609,DANIEL BUENO DE GOUVEA,,6,1983,Empresario
35102047765,REGINA DE SOUZA MARILIA,MARÍLIA,6,1983,Empresario
35102047838,FRANCISCO TERRA DE SIQUEIRA,,6,1983,Empresario
35102047862,JOSE ALVES GALINDO,POÁ,6,1983,Empresario
35102047889,ANTONIO TSUTOMU KOBATA,,6,1983,Empresario
35102047951,M. BARBOSA DOS SANTOS,SÃO PAULO,6,1983,Empresario
35102047978,V.A.O. CASTRO,PINDAMONHANGABA,6,1983,Empresario
35102048079,ILDA PIRES FERNANDES,,6,1983,Empresario
35102048176,OSVALDO RICCI,MATÃO,6,1983,Empresario
35102048206,NELSON OLIVEIRA SEABRA,SUZANO,6,1983,Empresario
35102048371,CLARICIO DE JESUS,PIRACICABA,6,1983,Empresario
35102048486,SANTA PAULA GARCIA DA SILVA,,6,1983,Empresario
35102048508,IVO JOSE DE OLIVEIRA,,6,1983,Empresario
35102048681,SIDNEY MORAES KELLER,BOTUCATU,6,1983,Empresario
35102048702,MOUNIF HANNA MURAD,SÃO JOAQUIM DA BARRA,6,1983,Empresario
35102048842,ELZA HIROMI MARISHIMA,SÃO PAULO,6,1983,Empresario
35102048940,SAULO BENEDITO SANTOS OLIVEIRA,,6,1983,Empresario
35102049113,CLAUDEMIR JOSE FRANZINI,SÃO PAULO,6,1983,Empresario
35102049318,VALMICIO DE SOUZA BRANDAO,SÃO PAULO,6,1983,Empresario
35102049440,HERBERT DE OLIVEIRA,SÃO PAULO,6,1983,Empresario
35102049466,MAURO MARQUES DE ARAUJO,SUZANÁPOLIS,6,1983,Empresario
35102049580,JOSE RAFAEL CATALAN PARRA,PALMITAL,6,1983,Empresario
35102049725,CLARA ANGELINA SANT'ANA FERREIRA GASPARDO,SÃO PAULO,6,1983,Empresario
35102050103,JUARES JOSE BAZZO,LARANJAL PAULISTA,6,1983,Empresario
35102050138,JOSE ALDERNE BARROSO BRAGA,SÃO PAULO,6,1983,Empresario
35102050421,OLIDIO GRANEIRO,GUAPIAÇU,6,1983,Empresario
35102050499,HIDEAKI NAGATOMO,BASTOS,6,1983,Empresario
35102050529,JOSE LUIZ NOVATO,,6,1983,Empresario
35102050570,URANDI DE OLIVEIRA,,6,1983,Empresario
35102050588,JOAO LUIZ PIRES DE CARVALHO,SÃO JOSÉ DOS CAMPOS,6,1983,Empresario
35102050910,TEREZA EDUARDO DA COSTA,,6,1983,Empresario
35102051185,ASSANORI NISHIMURA,,6,1983,Empresario
35102051215,PEDRO MENDES PEREIRA.,SÃO BERNARDO DO CAMPO,6,1983,Empresario
35102051231,AMAURI CONTI,SALTO,6,1983,Empresario
35102051258,JOSE FRANCISCO DE SAMPAIO,GUARATINGUETÁ,6,1983,Empresario
35102051444,JOSE DOS REIS BALDIM,SÃO PAULO,6,1983,Empresario
35102051487,ALECIO PARECIDO PAVANI,FLÓRIDA PAULISTA,6,1983,Empresario
35102051509,EGISTO GESU VIEL,VALINHOS,6,1983,Empresario
35102051631,EUNICE MARIA DE SOUZA PITANGUEIRAS,PITANGUEIRAS,6,1983,Empresario
35102051746,CARLOS LUCAS TEIXEIRA MENDES SOROCABA,SOROCABA,6,1983,Empresario
35102051789,SIDNEI HERNANDES DA SILVA,SÃO PAULO,6,1983,Empresario
35102051843,DIONISIA MARIA NAGATANI,,6,1983,Empresario
35102051967,JOSE EVANGELISTA BEZERRA DOS SANTOS,,6,1983,Empresario
35102051983,RAIMUNDO DE SOUSA REGO,SÃO PAULO,6,1983,Empresario
35102052009,AIRTON DONIZETE JULIANI,UBATUBA,6,1983,Empresario
35102052076,ROSA KIMIYO KIKUCHI,CAMPINAS,6,1983,Empresario
35102052181,J. TAVARES FILHO EDIFICACOES,MOGI MIRIM,6,1983,Empresario
35102052211,MANUEL CLAURE IRIARTE,CAMPINAS,6,1983,Empresario
35102052254,FATIMA DONIZETE SIGO DE CAMARGO,ELIAS FAUSTO,6,1983,Empresario
35102052441,WALMIR CANDIDO NUNES APARELHO,SÃO JOSÉ DOS CAMPOS,6,1983,Empresario
35102052548,NATAL DE CARVALHO SANCHES,SÃO PAULO,6,1983,Empresario
35102052564,EURIPEDES GALVAO DE MIRANDA,FRANCA,6,1983,Empresario
35102052742,EISAKO NAKAZONI,,6,1983,Empresario
35102052785,ARMANDO MASTROPAULO,SÃO PAULO,6,1983,Empresario
35102052807,LONZITO JOSE DE BRITO,AMERICANA,6,1983,Empresario
35102052831,FRANCISCO DE ASSIS SILVA SERVIÇOS,SÃO CAETANO DO SUL,6,1983,Empresario
35102052866,ADEMAR MUSSI,BARRETOS,6,1983,Empresario
35102052874,TSUNEO SHINTANI TUPA,TUPÃ,6,1983,Empresario
35102052904,V. DONIZETI VIEIRA,,6,1983,Empresario
35102053170,ANTONIO LINO RAMALHO SOARES,SÃO PAULO,6,1983,Empresario
35102079829,J. PEREIRA FILHO ARMARINHOS,LUÍS ANTÔNIO,6,1983,Empresario
35129206007,ARIANE FERNANDES MACHADO,SÃO PAULO,6,1983,Empresario
35102053170,ANTONIO LINO RAMALHO SOARES,SÃO PAULO,6,1983,Empresario
35102079829,J. PEREIRA FILHO ARMARINHOS,LUÍS ANTÔNIO,6,1983,Empresario
35129206007,ARIANE FERNANDES MACHADO,SÃO PAULO,6,1983,Empresario
35300094611,FOZ DO MOGI AGRICOLA S.A.,PONTAL,6,1983,Sociedade por Acoes
35300094646,SAFRA PREVIDENCIA PRIVADA S.A.,SAO PAULO,6,1983,Sociedade por Acoes
35300094662,M.P.M. PROPAGANDA SAO PAULO S.A.,SAO PAULO,6,1983,Sociedade por Acoes
35300094611,FOZ DO MOGI AGRICOLA S.A.,PONTAL,6,1983,Sociedade por Acoes
35300094646,SAFRA PREVIDENCIA PRIVADA S.A.,SAO PAULO,6,1983,Sociedade por Acoes
35300094662,M.P.M. PROPAGANDA SAO PAULO S.A.,SAO PAULO,6,1983,Sociedade por Acoes
35400001593,COOPERATIVA DE CREDITO RURAL DOS PLANTADORES DE CANA DA REGIAO DE IGARAPAVA,IGARAPAVA,6,1983,Cooperativa
35400001593,COOPERATIVA DE CREDITO RURAL DOS PLANTADORES DE CANA DA REGIAO DE IGARAPAVA,IGARAPAVA,6,1983,Cooperativa
24200575449,,SAO PAULO,6,1983,Sociedade Limitada
32201531140,,IPERO,6,1983,Sociedade Limitada
33200527018,,SAO PAULO,6,1983,Sociedade Limitada
33207634049,,DIADEMA,6,1983,Sociedade Limitada
35200143602,CASA MARINO COMERCIO DE MATERIAIS PARA CONSTRUCAO LTDA.,DIADEMA,6,1983,Sociedade Limitada
35200229175,GENIVAL DOS SANTOS & CIA LTDA,SANTOS,6,1983,Sociedade Limitada
35200230475,MINUTTI CANALLI E CIA. LTDA.,MONTE ALTO,6,1983,Sociedade Limitada
35200275444,MESTRA CONSTRUTORA E INCORPORADORA LTDA. - M.E.,CAMPINAS,6,1983,Sociedade Limitada
35200278397,MINEL COMERCIO DE MADEIRAS LTDA,SAO JOSE DOS CAMPOS,6,1983,Sociedade Limitada
35200384294,M.G.N. RESTAURANTES LTDA.,BAURU,6,1983,Sociedade Limitada
35200402632,MOTORBOAT TRANSPORTES EM GERAL E SERVICOS NAUTICOS LTDA.,SAO PAULO,6,1983,Sociedade Limitada
35200421866,PAISANO ARTIGOS PARA PRESENTES LTDA.,SAO PAULO,6,1983,Sociedade Limitada
35200660950,SIMOES SERGIO E PEREIRA LTDA.,BROTAS,6,1983,Sociedade Limitada
35200680900,DHARMA ENGENHARIA LTDA.,SAO PAULO,6,1983,Sociedade Limitada
35200774670,KOMABA COMERCIO E SERVICOS DE ESQUADRIAS LTDA,MOGI DAS CRUZES,6,1983,Sociedade Limitada
35200776800,VOTTA EDITORES LIMITADA,SAO PAULO,6,1983,Sociedade Limitada
35200875000,O.E.M. COMERCIO EXTERIOR LTDA.,SAO PAULO,6,1983,Sociedade Limitada
35200882006,UNIPORT ASSESSORIA DE COMERCIO EXTERIOR LTDA.,SANTOS,6,1983,Sociedade Limitada
35200887857,CASA PERIN COMERCIO DE ARTIGOS DOMESTICOS LTDA. - M.E.,SAO PAULO,6,1983,Sociedade Limitada
35200932461,DUQUE E CIA. LTDA.,SAO PAULO,6,1983,Sociedade Limitada
35200957341,CONSTRUTORA E ADMINISTRADORA DE IMOVEIS ARAPONGAS LTDA,SAO PAULO,6,1983,Sociedade Limitada
35200977279,DEMARCAS DISTRIBUIORA DE PRODUTOS ESPECIAIS LTDA. ME,SAO PAULO,6,1983,Sociedade Limitada
35201020911,BAR A.B.C. HOUSE LTDA.,SANTOS,6,1983,Sociedade Limitada
35201091843,SERVICOS TECNICOS EM VEICULOS TUNE UP LTDA.,SAO PAULO,6,1983,Sociedade Limitada
35201125713,MOTEL SOL DE VERAO LTDA. - M.E.,ITAPECERICA DA SERRA,6,1983,Sociedade Limitada
35201213728,ABAETE COMERCIAL LTDA.,SAO PAULO,6,1983,Sociedade Limitada
35201243104,CARBALLO SEGUROS LTDA,BARUERI,6,1983,Sociedade Limitada
35201431334,CARIMBOS E CLICHES HELO LTDA. - M.E.,SAO PAULO,6,1983,Sociedade Limitada
35201457414,ALADIM PORCELANAS LTDA.,SANTO ANDRE,6,1983,Sociedade Limitada
35201516909,LOJEPA INSTALACOES COMERCIO E REPRESENTACOES LTDA. - M.E.,SAO PAULO,6,1983,Sociedade Limitada
35201673478,AVICOLA E MERCEARIA CERCADO GRANDE LTDA. - M.E.,EMBU,6,1983,Sociedade Limitada
35201678593,MARTINTECNICA INDUSTRIAL LTDA. - M.E.,SAO JOSE DO RIO PRETO,6,1983,Sociedade Limitada
35201745088,BENITO JOSE DEMARCHI SACONI E CIA. LTDA.,TIETE,6,1983,Sociedade Limitada
35201749865,ZEMUNER ZEMUNER INDUSTRIA E COMERCIO DE PRODUTOS QUIMICOS LTDA.,SAO PAULO,6,1983,Sociedade Limitada
35201846364,COMETA CRIACOES DE BORDADOS ELETRONICOS LTDA.,SAO PAULO,6,1983,Sociedade Limitada
35201848685,EAM MANUTENCAO E REPARACAO EM MAQUINAS PARA ESCRITORIO LTDA,JUNDIAI,6,1983,Sociedade Limitada
35201861215,LOTERICA VAMOS NESSA LTDA.,SAO PAULO,6,1983,Sociedade Limitada
35201887672,INDUSTRIA E COMERCIO DE RACOES SARAIVA LTDA.,SANTA BRANCA,6,1983,Sociedade Limitada
35201906561,DAGOBERTO TERCIOTTI & CIA LTDA,RIO CLARO,6,1983,Sociedade Limitada
35201915269,VERMLHO'S LANCHONETE LTDA.,VALINHOS,6,1983,Sociedade Limitada
35201958545,GERMANO & ELY LTDA.,SAO PAULO,6,1983,Sociedade Limitada
35201987693,LANCHONETE E PIZZARIA GRALITON LTDA.,JACAREI,6,1983,Sociedade Limitada
35202031780,BAZAR C. MORIWAKI LTDA.,SAO PAULO,6,1983,Sociedade Limitada
35202210846,BEMEL BEBIDAS MENOSSI LTDA.,OSVALDO CRUZ,6,1983,Sociedade Limitada
35202222470,ARTBEL PAINEIS ELETRICOS LTDA,CAMPINAS,6,1983,Sociedade Limitada
35202222631,BAR MERCEARIA E QUITANDA MARILEINE LTDA.,SAO PAULO,6,1983,Sociedade Limitada
35202222771,ROMANO & LAZANHA LTDA.,CAMPINAS,6,1983,Sociedade Limitada
35202223174,LOJA NINA LTDA.,SAO PAULO,6,1983,Sociedade Limitada
35202224090,PANIFICADORA PALMA LTDA.,SANTO ANDRE,6,1983,Sociedade Limitada
35202224863,ACOUGUE FRANCISCA DE PAULA LTDA.,SAO PAULO,6,1983,Sociedade Limitada
35202255980,AUTO POSTO AGUIA DO VALE LTDA.,SAO JOSE DOS CAMPOS,6,1983,Sociedade Limitada
35202269891,RADIABARRA RADIADORES E SERVICOS LTDA. - M.E.,BARRA BONITA,6,1983,Sociedade Limitada
35202282600,RAFESA COMERCIO DE CALHAS LTDA. - M.E.,SUZANO,6,1983,Sociedade Limitada
35202349119,EDITORA ABRACADABRA LTDA.,SAO PAULO,6,1983,Sociedade Limitada
35202381276,SALOMAO E PRADO LTDA.,RIBEIRAO PRETO,6,1983,Sociedade Limitada
35202410021,AUTO POSTO TITAN DE OURINHOS LTDA.,OURINHOS,6,1983,Sociedade Limitada
35202419478,BAR E MERCEARIA CRIULI LTDA.,SAO BERNARDO DO CAMPO,6,1983,Sociedade Limitada
35202419664,APEU COMERCIO DE MADEIRAS LTDA,SAO PAULO,6,1983,Sociedade Limitada
35202419770,COMDARPE CONSTRUCOES E TERRAPLENAGEM LTDA,BARUERI,6,1983,Sociedade Limitada
35202419788,MANTELLO E FILHO LTDA.,SANTA RITA DO PASSA QUATRO,6,1983,Sociedade Limitada
35202419885,MARK PNEUS LTDA. - M.E.,CARAGUATATUBA,6,1983,Sociedade Limitada
35202419893,DELTA DEUSA ELETRO PECAS LTDA. - M.E.,ARARAQUARA,6,1983,Sociedade Limitada
35202419907,DI BELLA CONFECCOES LTDA,SAO PAULO,6,1983,Sociedade Limitada
35202419915,INLUMAR-CONSTRUTORA LTDA,SAO PAULO,6,1983,Sociedade Limitada
35202419958,SHAFT VEICULOS LTDA.,ILHA COMPRIDA,6,1983,Sociedade Limitada
35202419974,GRENZEBACH DO BRASIL LTDA.,SAO PAULO,6,1983,Sociedade Limitada
35202419982,NOVA GUARANI PAES E DOCES LTDA.,SAO PAULO,6,1983,Sociedade Limitada
35202420034,BACCAR E SUAIDEM LTDA. - M.E.,PEDERNEIRAS,6,1983,Sociedade Limitada
35202420123,KATRACA CHURRASCARIA LTDA,CAMPINAS,6,1983,Sociedade Limitada
35202420247,EDITORA TIETE LTDA. - M.E.,TIETE,6,1983,Sociedade Limitada
35202420255,TRANSPORTADORA GINJO LTDA.,VOTUPORANGA,6,1983,Sociedade Limitada
35202420301,RAMOS C BEZERRA LTDA,BIRIGUI,6,1983,Sociedade Limitada
35202420328,BAZAR E PAPELARIA ADAUANA LTDA,DIADEMA,6,1983,Sociedade Limitada
35202420344,MOTOPPAR - INDUSTRIA E COMERCIO DE AUTOMATIZADORES LTDA,GARCA,6,1983,Sociedade Limitada
35202420522,MEMBI LIVROS LTDA.,TIETE,6,1983,Sociedade Limitada
35202420565,P.V.B. ENGENHARIA E CONSTRUCOES LTDA.,SAO PAULO,6,1983,Sociedade Limitada
35202420573,BAR E LANCHES CURUZU LIMITADA,SAO PAULO,6,1983,Sociedade Limitada
35202420590,HOTEL TORIBA LTDA.,CAMPOS DO JORDAO,6,1983,Sociedade Limitada
35202420603,GIUFER EQUIPAMENTOS LTDA.,CAMPINAS,6,1983,Sociedade Limitada
35202420662,COOPER STANDARD AUTOMOTIVE BRASIL FLUID SYSTEMS LTDA.,OSASCO,6,1983,Sociedade Limitada
35202420697,COMERCIAL FARIAS LTDA.,PIRACICABA,6,1983,Sociedade Limitada
35202420727,ROGERIO AMARAL PAPAROTTI E CIA. LTDA. - M.E.,AMERICANA,6,1983,Sociedade Limitada
35202420735,BAR E LANCHES GANDULA LTDA,GUARULHOS,6,1983,Sociedade Limitada
35202420786,ALUMINIO SANTOS INDUSTRIAE COMERCIO LTDA,JUNDIAI,6,1983,Sociedade Limitada
35202420794,M. INES'S MODAS LTDA.,SAO PAULO,6,1983,Sociedade Limitada
35202420824,TRILHO GRAFICA LTDA.,SAO PAULO,6,1983,Sociedade Limitada
35202420859,BANZAI COMERCIO DE VEICULOS LTDA. - M.E.,MAIRINQUE,6,1983,Sociedade Limitada
35202420905,J. M. MAZZA SERVICO DE INFORMACAO E IMPRESSAO DOCUMENTOS LTDA.,TANABI,6,1983,Sociedade Limitada
35202420948,CJM TRADE & CONSULTORIA EMPRESARIAL LTDA,SAO PAULO,6,1983,Sociedade Limitada
35202421006,CEREALISTA FERREIRA FILHO LTDA.,LENCOIS PAULISTA,6,1983,Sociedade Limitada
35202421031,PIZZARIA SAO JOSE LTDA.,SAO PAULO,6,1983,Sociedade Limitada
35202421081,LANCHONETE DA ANA LTDA.,SANTO ANDRE,6,1983,Sociedade Limitada
35202421090,EMPRESA JORNALISTICA CORREIO DE LINS LTDA.,LINS,6,1983,Sociedade Limitada
35202421111,CONSTRUTORA SANCHES ANGELO LTDA.,PRAIA GRANDE,6,1983,Sociedade Limitada
35202421120,PANIFICADORA E CONFEITARIA JARDIM ROSEMARY LTDA.,ITYAPEVI,6,1983,Sociedade Limitada
35202421171,RESTAURANTE BIGATON LTDA.,PIRACICABA,6,1983,Sociedade Limitada
35202421219,PANIFICADORA PAO & DOCE DE BAURU LTDA.,BAURU,6,1983,Sociedade Limitada
35202421235,SERRALHERIA METAL ARTES DOIS IRMAOS LTDA. - M.E.,APIAI,6,1983,Sociedade Limitada
35202421243,F.G.S. ENGENHARIA E CONSTRUCOES LTDA,SAO PAULO,6,1983,Sociedade Limitada
35202421278,TRANSPORTADORA OTAVIANA LTDA.,CAMPINAS,6,1983,Sociedade Limitada
35202421294,"EDITORA PESQUISA E INDUSTRIA LTDA. ""INABILITADA PARA EXERCER ATIVIDADE EMPRESARIAL""",SAO PAULO,6,1983,Sociedade Limitada
35202421332,D.B.M.G. COMERCIO DE MATERIAIS DE CONSTRUCAO LTDA.,SAO PAULO,6,1983,Sociedade Limitada
35202421341,FORMIA EQUIPE INDUSTRIA DE EQUIPAMENTOS CONTRA INCENDIO LTDA.,GUARULHOS,6,1983,Sociedade Limitada
35202421383,C.V. BRASIL COMERCIO DE BOLETINS INFORMATIVOS LTDA. - M.E.,SAO PAULO,6,1983,Sociedade Limitada
35202421391,SOL BENEFICIADORA TEXTIL LTDA.,SANTO ANDRE,6,1983,Sociedade Limitada
35202421405,PASTELARIA GOYA LTDA.,SAO PAULO,6,1983,Sociedade Limitada
35202421421,BAR E MERCEARIA TALES LTDA. - M.E.,SAO PAULO,6,1983,Sociedade Limitada
35202421430,W.R.F. INDUSTRIA DE PECAS ELETRICAS LTDA.,SAO JOSE DO RIO PRETO,6,1983,Sociedade Limitada
35202421448,SERGIO PASSARINI & CIA LTDA,SAO JOSE DO RIO PRETO,6,1983,Sociedade Limitada
35202421499,COSTA E DOMINGOS LTDA. - M.E.,SUMARE,6,1983,Sociedade Limitada
35202421529,CASA DE CARNES M'BOY LTDA.,EMBU,6,1983,Sociedade Limitada
35202421537,ZAINA E DRUMONT LTDA. - M.E.,OURINHOS,6,1983,Sociedade Limitada
35202421545,F.Z. JOIAS LTDA. - M.E.,RIO CLARO,6,1983,Sociedade Limitada
35202421561,IGNEZ APARECIDA DE ANDRADE BAPTISTA E CIA. LTDA. - M.E.,ARARAS,6,1983,Sociedade Limitada
35202421600,ELETROMAD COMERCIO DE MATERIAIS PARA CONSTRUCAO LTDA.,CAMPINAS,6,1983,Sociedade Limitada
35202421626,TIBERTO & REZENDE LTDA,PRESIDENTE PRUDENTE,6,1983,Sociedade Limitada
35202421669,TAGO & TAGO LAVAGEM DE AUTOS LTDA,IPERO,6,1983,Sociedade Limitada
35202421677,V. C. INDUSTRIA E COMERCIO DE VARISTORES E RESISTORES CERAMICOS LTDA,AVARE,6,1983,Sociedade Limitada
35202421693,J.C. REGAZZO E CIA. LTDA.,TUPA,6,1983,Sociedade Limitada
35202421723,ARCLAN SERVICOS TRANSPORTES E COMERCIO LTDA.,SAO CAETANO DO SUL,6,1983,Sociedade Limitada
35202421821,RONDONIA AUTO PECAS LTDA.,SAO PAULO,6,1983,Sociedade Limitada
35202421847,DE FRANCESCHI E CIA. LTDA.,SANTA RITA DO PASSA QUATR,6,1983,Sociedade Limitada
35202421855,FALK DO BRASIL EQUIPAMENTOS INDUSTRIAIS LTDA.,SAO PAULO,6,1983,Sociedade Limitada
35202421863,HOTEL CABECA DE BOI LTDA.,SAO PAULO,6,1983,Sociedade Limitada
35202421871,COMERCIO DE PECAS E POLIMENTO TEIXEIRA LTDA.,SAO PAULO,6,1983,Sociedade Limitada
35202421898,EDE BIJOUTERIAS LTDA. - M.E.,SAO PAULO,6,1983,Sociedade Limitada
35202421901,ACACIA PLANEJAMENTO ENGENHARIA E CONSTRUCOES LTDA.,S PAULO,6,1983,Sociedade Limitada
35202422061,A LESTE DO EDEN COMERCIO E EMPREENDIMENTOS LTDA.,LINDOIA,6,1983,Sociedade Limitada
35202422169,BAR E MERCEARIA FIFA LTDA. - M.E.,CAMPINAS,6,1983,Sociedade Limitada
35202422193,CARRANCA PRESTACAO DE SERVICOS EM VEICULOS LTDA,SOROCABA,6,1983,Sociedade Limitada
35202422223,VITOR COMERCIAL LTDA. - M.E.,SAO PAULO,6,1983,Sociedade Limitada
35202422258,ELETROMOVEIS JABOTICABAL LTDA. - M.E.,JABOTICABAL,6,1983,Sociedade Limitada
35202422282,ATIMO TRANSPORTES E REPRESENTACOES LTDA. - M.E.,SAO PAULO,6,1983,Sociedade Limitada
35202422321,SCALICE E POLETTI LTDA. - M.E.,ITAPOLIS,6,1983,Sociedade Limitada
35202422339,BAR E MERCEARIA ORDONHES LTDA.,SAO PAULO,6,1983,Sociedade Limitada
35202422363,BAR E EMPORIO LIK LTDA. - M.E.,SAO PAULO,6,1983,Sociedade Limitada
35202422380,PEDREIRA LUMAN LTDA.,SANTA ISABEL,6,1983,Sociedade Limitada
35202422436,MERCEARIA E AVICOLA MARTINS E ALVES LTDA. - M.E.,SAO PAULO,6,1983,Sociedade Limitada
35202422479,A TEMPO MODAS LTDA. - M.E.,SAO PAULO,6,1983,Sociedade Limitada
35202422525,CONSTRUTORA ROBERTO MARTINS LTDA.,CAMPINAS,6,1983,Sociedade Limitada
35202422533,MONTAR CONGRESSOS FEIRAS E CONVENCOES LTDA.,SAO PAULO,6,1983,Sociedade Limitada
35202422614,DROGARIA BRASILEIRA DE ARTUR NOGUEIRA LTDA,ARTUR NOGUEIRA,6,1983,Sociedade Limitada
35202422622,MERCADINHO POUSO ALEGRE MINEIRO LTDA.,DIADEMA,6,1983,Sociedade Limitada
35202422673,VIDEIRA TRANSPORTES RODOVIARIOS LTDA.,SAO BERNARDO DO CAMPO,6,1983,Sociedade Limitada
35202422690,A.B. COMERCIO E REPRESENTACOES LTDA.,PIRASSUNUNGA,6,1983,Sociedade Limitada
35202422754,J.V.R. IMOVEIS E REPRESENTACOES LTDA.,BARUERI,6,1983,Sociedade Limitada
35202422789,MATERIAIS DE CONSTRUCAO BATISTA LTDA,ITAPEVI,6,1983,Sociedade Limitada
35202422860,TRANSMATIOLI TRANSPORTES E COMERCIO LTDA.,SAO JOSE DO RIO PRETO,6,1983,Sociedade Limitada
35202422894,BUZINARI E CIA. LTDA.,SAO PAULO,6,1983,Sociedade Limitada
35202422959,"CONSTRUPAN ADMINISTRACAO, CONSTRUCAO E COMERCIO LTDA",CAMPINAS,6,1983,Sociedade Limitada
35202422991,EMPRESA LIDER DE CONSERVACAO LTDA.,BAURU,6,1983,Sociedade Limitada
35202423068,CREFINOX COMERCIAL LTDA.,CAMPINAS,6,1983,Sociedade Limitada
35202423106,REAL CYCLE INDUSTRIA E COMERCIO LTDA.,SAO PAULO,6,1983,Sociedade Limitada
35202423114,PINHO VIEIRA E CIA LTDA.,SANTOS,6,1983,Sociedade Limitada
35202423149,A LUMINOPTICA LTDA. - M.E.,SAO PAULO,6,1983,Sociedade Limitada
35202423190,ABEL E VALDECIR LTDA. - M.E.,ARARAQUARA,6,1983,Sociedade Limitada
35202423238,MARISA DIAS RODRIGUES & CIA LTDA,ITAPEVA,6,1983,Sociedade Limitada
35202423246,TROLLINOX FERRAGENS LTDA,SANTOS,6,1983,Sociedade Limitada
35202423360,CHARTER EMBALAGENS SERVICOS INDUSTRIA E COMERCIO LTDA.,SALTO,6,1983,Sociedade Limitada
35202423378,SOMUNCK TRANSPORTES LTDA.,SAO PAULO,6,1983,Sociedade Limitada
35202423386,TERMO FIBRA COMERCIO E REPRESENTACOES LTDA.,VINHEDO,6,1983,Sociedade Limitada
35202423416,MERCADO TA KI TA LTDA.,SAO PAULO,6,1983,Sociedade Limitada
35202423467,MARIA BERNADETE CANCIAM DO NASCIMENTO & CIA LIMITADA,TIETE,6,1983,Sociedade Limitada
35202423483,ACOUGUE BARROSAO LTDA. - M.E.,SAO PAULO,6,1983,Sociedade Limitada
35202423513,REFA CAR RECUPERADORA DE AUTO PECAS LTDA ME.,SAO PAULO,6,1983,Sociedade Limitada
35202423637,Z A MOREIRA & CIA LTDA.,SAO VICENTE,6,1983,Sociedade Limitada
35202423645,O BANANAO LTDA. - M.E.,SAO VICENTE,6,1983,Sociedade Limitada
35202423696,LANCHONETE PEPOS LTDA.,MAUA,6,1983,Sociedade Limitada
35202423769,KAZUMI NAKAMURA & CIA LTDA.,UBATUBA,6,1983,Sociedade Limitada
35202423785,ENGEMIG ENGENHARIA E MONTAGENS LTDA.,SANTO AMARO,6,1983,Sociedade Limitada
35202423807,TRAVIATA COMERCIAL LTDA,SAO JOSE DOS CAMPOS,6,1983,Sociedade Limitada
35202423891,OFICINA PRECIOSA LTDA.,FERNANDOPOLIS,6,1983,Sociedade Limitada
35202423904,SENNAGUA AGUAS MINERAIS LTDA. - M.E.,ATIBAIA,6,1983,Sociedade Limitada
35202423939,A.B. COPIAS LTDA. - M.E.,SANTO ANDRE,6,1983,Sociedade Limitada
35202423955,CONFECCOES TEODORO LTDA.,SAO PAULO,6,1983,Sociedade Limitada
35202424005,ORLANDO GUARNIERI FILHO & CIA LTDA.,MOGI-MIRIM,6,1983,Sociedade Limitada
35202424021,ARTEZANATOS DUDINHA LTDA. - M.E.,SAO PAULO,6,1983,Sociedade Limitada
35202424030,AGUILLAR & LUCCA LTDA,BAURU,6,1983,Sociedade Limitada
35202424048,ROBERTO P. DO PRADO E CIA. LTDA.,GUARIBA,6,1983,Sociedade Limitada
35202424056,DISTRIBUIDORA DE PRODUTOS ALIMENTICIOS PAZOTTI LTDA.,MOCOCA,6,1983,Sociedade Limitada
35202424072,HENRIQUE E FERREIRA LTDA. - M.E.,SANTOS,6,1983,Sociedade Limitada
35202424081,A.G. PINHO E XAVIER LTDA. - M.E.,SANTOS,6,1983,Sociedade Limitada
35202424111,TOLDOS MOBEL INDUSTRIA E COMERCIO LTDA.,SAO PAULO,6,1983,Sociedade Limitada
35202424218,ADRO DECORACOES INDUSTRIA E COMERCIO DE MOVEIS DE ESTILO LTDA.,SAO PAULO,6,1983,Sociedade Limitada
35202424226,KARMEL CONFECCOES LTDA.,SAO JOSE DO RIO PRETO,6,1983,Sociedade Limitada
35202424234,CONSTRUTORA TELHADELA LTDA,MONGUAGUA,6,1983,Sociedade Limitada
35202424251,ZHM REPRESENTACOES E PARTICIPACOES LTDA,SAO PAULO,6,1983,Sociedade Limitada
35202424277,ROTISSERIE BELA PIZZA LTDA.,SAO PAULO,6,1983,Sociedade Limitada
35202424307,J.L.G. INDUSTRIA E COMERCIO DE ARTEFATOS DE CIMENTO LTDA.,EMBU,6,1983,Sociedade Limitada
35202424315,VOLKER CONSULTORIA E ASSESSORIA CONTABIL LTDA,SAO PAULO,6,1983,Sociedade Limitada
35202424366,INDUSTRIA DE MOVEIS ESTOFADOS MESIQ LTDA.,LIMEIRA,6,1983,Sociedade Limitada
35202424374,FARMACIA E PERFUMARIA SANTO ANTONINHO LTDA. - M.E.,SAO PAULO,6,1983,Sociedade Limitada
35202424391,CONVERPLAST EMBALAGENS LTDA.,GUARULHOS,6,1983,Sociedade Limitada
35202424447,ROYAL RUBBER INDUSTRIA E COMERCIO LTDA.,SAO PAULO,6,1983,Sociedade Limitada
35202424471,ELIFER REPRESENTACOES LTDA. - M.E.,SAO PAULO,6,1983,Sociedade Limitada
35202424501,CERAMICA LOPES LTDA.,CONCHAS,6,1983,Sociedade Limitada
35202424510,BAR E LANCHES MIYAGI LTDA. - M.E.,SAO PAULO,6,1983,Sociedade Limitada
35202424536,MARCO E JOSE ROBERTO MARCAL LTDA. - M.E.,CAMPINAS,6,1983,Sociedade Limitada
35202424595,GUIZZETTI E PIORELLI LTDA. - M.E.,SAO PAULO,6,1983,Sociedade Limitada
35202424650,LAZZARI ENGENHARIA E CONSTRUCOES LTDA.,SAO PAULO,6,1983,Sociedade Limitada
35202424714,DROGA DEZ DE CAMPINAS LTDA. - M.E.,CAMPINAS,6,1983,Sociedade Limitada
35202424757,A EXKISITA MODAS E BAZAR LTDA.,SAO PAULO,6,1983,Sociedade Limitada
35202424790,PAPELARIA QUIRININHO LTDA,ITAQUAQUECETUBA,6,1983,Sociedade Limitada
35202424803,BAR E LANCHES CYPRIANO LTDA.,SAO PAULO,6,1983,Sociedade Limitada
35202424862,SELGI ENGENHARIA LTDA,SAO PAULO,6,1983,Sociedade Limitada
35202424871,GVEL REPRESENTACOES E TRANSPORTES ESPECIALIZADOS LTDA.,GUARULHOS,6,1983,Sociedade Limitada
35202424897,COMERCIAL IRACRAM LTDA.,VERA CRUZ,6,1983,Sociedade Limitada
35202424935,"PLUS - REPRESENTACOES, COMERCIO E EXPORTACAO LTDA",RIBEIRAO PRETO,6,1983,Sociedade Limitada
35202424951,CHAVEIRO BONFIM & MARQUES LTDA,SAO BERNARDO DO CAMPO,6,1983,Sociedade Limitada
35202424960,BUMMLER CONFECCOES LTDA.,SAO PAULO,6,1983,Sociedade Limitada
35202424986,AVICOLA E MERCEARIA JELO LTDA. - M.E.,SAO PAULO,6,1983,Sociedade Limitada
35202424994,ALICE'S LANCHES LTDA. - M.E.,MOGI DAS CRUZES,6,1983,Sociedade Limitada
35202425052,PADARIA SAO CARLOS LTDA.,PORTO FERREIRA,6,1983,Sociedade Limitada
35202425133,ARTUR BARIONI NETO E CIA. LTDA.,STA RITA DO PASSA QUATRO,6,1983,Sociedade Limitada
35202425150,BAR E CAFE I'FRIERE LTDA. - M.E.,SAO PAULO,6,1983,Sociedade Limitada
35202425222,INDUSTRIA E COMERCIO DE MADEIRA TEMA LTDA. - M.E.,BANANAL,6,1983,Sociedade Limitada
35202425249,COMERCIAL AL MONJOLINO OVOS E AVES LTDA.,MONTE MOR,6,1983,Sociedade Limitada
35202425273,"MOVEIS, ENXOVAIS E COLCHOES SULTAN LTDA.",PINDAMONHANGABA,6,1983,Sociedade Limitada
35202425320,RIOCAMP COMERCIO E REPRESENTACOES LTDA.,CAMPINAS,6,1983,Sociedade Limitada
35202425401,KAPRI COMERCIO DE ALIMENTOS LTDA. - M.E.,SAO PAULO,6,1983,Sociedade Limitada
35202425419,L S TRANSPORTES E MATERIAIS DE CONSTRUCAO LTDA.,+BRODOWSKI,6,1983,Sociedade Limitada
35202425427,"SPECFORT - INFOMOVEIS, COMERCIO E SERVICOS LTDA.",JUNDIAI,6,1983,Sociedade Limitada
35202425460,EMBRACEL ELETROMAGAZINE LTDA,SAO PAULO,6,1983,Sociedade Limitada
35202425494,COMERCIO E REPRESENTACOES MARJANE LTDA,GUARATINGUETA,6,1983,Sociedade Limitada
35202425575,BAR E LANCHES PETISCAO DE GUARULHOS - M.E.,GUARULHOS,6,1983,Sociedade Limitada
35202425591,BAR O PONTO SANTO ANTONIO AMPARO LTDA.,AMPARO,6,1983,Sociedade Limitada
35202425605,BAR E EMPORIO FRANCISNETO LTDA. - M.E.,GUARULHOS,6,1983,Sociedade Limitada
35202425613,BEL KOGETH INDUSTRIA E COMERCIO DE COSMETICOS LTDA,SAO PAULO,6,1983,Sociedade Limitada
35202425621,W. VUOLO & CIA. LTDA.,ESPIRITO SANTO DO PINHAL,6,1983,Sociedade Limitada
