NIRE,Empresa,Município,Month,Year,Type
35202431257,AGRO SOLO COMERCIO DE CEREAIS E REPRESENTACOES LTDA. - M.E.,SAO CARLOS,6,1983,Sociedade Limitada
35202431273,PANIFICADORA E CONFEITARIA ATLANTE LTDA.,SAO PAULO,6,1983,Sociedade Limitada
35202431303,TAKUMI KAKEYA E ELZA KAME KAKEYA LTDA. - M.E.,SAO PAULO,6,1983,Sociedade Limitada
35202431311,SINUCA PROMOCOES E PUBLICIDADE LTDA.,SAO PAULO,6,1983,Sociedade Limitada
35202431346,ELEVADORES ESQUEMA LTDA. - M.E.,PRAIA GRANDE,6,1983,Sociedade Limitada
35202431397,FRIGOESTRELA FRIGORIFICO ESTRELA D'OESTE LTDA.,SAO PAULO,6,1983,Sociedade Limitada
35202431427,TORREFACAO E MOAGEM CAFE FLOR DA MATA LTDA.,VOTUPORANGA,6,1983,Sociedade Limitada
35202431435,COMERCIO DE CALCADOS OSWALDO BUZOLIN LTDA.,ARARAS,6,1983,Sociedade Limitada
35202431567,CHARQUEADA MADEIRAL LTDA.,SAO PAULO,6,1983,Sociedade Limitada
35202431575,PIVOTTO E PIVOTTO LTDA.,SAO JOSE DO RIO PRETO,6,1983,Sociedade Limitada
35202431591,ZUCHINI & MACHADO LTDA,NOVO HORIZONTE,6,1983,Sociedade Limitada
35202431605,LIMA E MARIN LTDA. - M.E.,BEBEDOURO,6,1983,Sociedade Limitada
35202431702,MAGAZINE MISS ELEGAN LTDA.,SAO PAULO,6,1983,Sociedade Limitada
35202431711,STTILU'S COMERCIO E REPRESENTACOES LTDA.,NOVO HORIZONTE,6,1983,Sociedade Limitada
35202431745,AGROPECUARIA NARDO LTDA.,SANTA CRUZ DO RIO PARDO,6,1983,Sociedade Limitada
35202431753,SEMATEC LTDA.,LORENA,6,1983,Sociedade Limitada
35202431761,G. N. MAIA & CIA LTDA.,FARTURA,6,1983,Sociedade Limitada
35202431788,FRAGATA SOLDAS COMERCIO E REPRESENTACOES LTDA.,SAO BERNARDO DO CAMPO,6,1983,Sociedade Limitada
35202431800,CANDEIAS SERVICOS ADMINISTRATIVOS LTDA,SAO PAULO,6,1983,Sociedade Limitada
35202431851,R.T.A EDITORES E SERVICOS LTDA,SAO PAULO,6,1983,Sociedade Limitada
35202431885,ROVEL COMERCIAL ELETRICA LTDA. - M.E.,SAO PAULO,6,1983,Sociedade Limitada
35202431893,SUPER PORTAS DE ACO SAO PAULO COMERCIO DE ARTIGOS PARA SERRALHEIRA LTDA.,SAO PAULO,6,1983,Sociedade Limitada
35202431966,CARYBE COMERCIO DE METAIS LTDA.,ARACARIGUAMA,6,1983,Sociedade Limitada
35202432024,ACENGE ENGENHARIA E CONSTRUCOES LTDA.,SAO PAULO,6,1983,Sociedade Limitada
35202432075,ADALVETE B. FERREIRA E CIA. LTDA. - M.E.,MARILIA,6,1983,Sociedade Limitada
35202432121,ROSSI & SOLLA LTDA.,JUNDIAI,6,1983,Sociedade Limitada
35202432130,MERCEARIA CLEIDALVO LTDA.,SAO PAULO,6,1983,Sociedade Limitada
35202432288,CONSTRUEL INDUSTRIA E COMERCIO LTDA.,SAO JOSE DOS CAMPOS,6,1983,Sociedade Limitada
35202432318,DISTRIBUIDORA DE BEBIDAS NOVA ODESSA LTDA.,NOVA ODESSA,6,1983,Sociedade Limitada
35202432326,COMERCIO DE SORVETES NOVARRO LTDA,SANTA BARBARA D'OESTE,6,1983,Sociedade Limitada
35202432334,TECNOMETALLIC INDUSTRIA E COMERCIO LTDA.,SAO PAULO,6,1983,Sociedade Limitada
35202432351,J. J. VIOTTO LIMEIRA COMERCIAL LTDA.,LIMEIRA,6,1983,Sociedade Limitada
35202432458,QUITANDA E MERCEARIA TAKETA LTDA.,GUARULHOS,6,1983,Sociedade Limitada
35202432491,UBIMAT COMERCIO DE MATERIAIS PARA CONSTRUCAO LTDA,SAO PAULO,6,1983,Sociedade Limitada
35202432571,BAR E MERCEARIA RIBEIRO NEGRETTI LTDA.,SAO JOSE DOS CAMPOS,6,1983,Sociedade Limitada
35202432598,AUTO MECANICA CRUZ & MAGARO LTDA.,SAO VICENTE,6,1983,Sociedade Limitada
35202432687,DERBY COMERCIO E DECORACOES LTDA. - M.E.,SAO PAULO,6,1983,Sociedade Limitada
35202432717,MERCADINHO VILA RIO LTDA.,GUARULHOS,6,1983,Sociedade Limitada
35202432750,DE'SCHAGAS COMERCIO DE MATERIAL ELETRICO LTDA,SAO PAULO,6,1983,Sociedade Limitada
35202432768,PADARIA E LANCHONETE JOMAA LTDA,PEREQUE,6,1983,Sociedade Limitada
35202432806,TAO ARTESANATO DE CERAMICA ARTISTICA LTDA. - M.E.,SAO PAULO,6,1983,Sociedade Limitada
35202432822,JOTALVES COMERCIO DE TECIDOS LTDA.,SAO PAULO,6,1983,Sociedade Limitada
35202432831,NEI-BRAS CONFECCAO DE ROUPAS LTDA,SAO PAULO,6,1983,Sociedade Limitada
35202432849,COMERCIO DE METAIS ROWAG LTDA.,SAO PAULO,6,1983,Sociedade Limitada
35202432857,LANCHES FLOREN LTDA. - M.E.,SAO PAULO,6,1983,Sociedade Limitada
35202432881,TEL-GAL CONSULTORIA EM COSMETICOS LTDA,SAO PAULO,6,1983,Sociedade Limitada
35202432911,"ENLUZ COMERCIO DE FERRO E ACO LTDA. ""CANCELADA POR INATIVIDADE""",SAO PAULO,6,1983,Sociedade Limitada
35202432946,A.G. OLIVEIRA E RODRIGUES LTDA. - M.E.,UBATUBA,6,1983,Sociedade Limitada
35202433004,MARENY INDUSTRIA E COMERCIO DE VIES LTDA.,SAO PAULO,6,1983,Sociedade Limitada
35202433071,A.C. MANENTI E CIA. LTDA. - M.E.,SAO VICENTE,6,1983,Sociedade Limitada
35202433098,BAR E EMPORIO CASQUINHA LTDA.,SAO APULO,6,1983,Sociedade Limitada
35202433101,BAR E LANCHES JOCEL LTDA,SAO PAULO,6,1983,Sociedade Limitada
35202433128,TRANSPORTADORA PROCER LTDA.,SAO PAULO,6,1983,Sociedade Limitada
35202433144,LIGEIRO MOVEIS LTDA.,ITAJOBI,6,1983,Sociedade Limitada
35202433161,DEPOSITO DE FERRO VELHO GODOY LTDA. - M.E.,RIO CLARO,6,1983,Sociedade Limitada
35202433209,MUXOXO ROUPAS E CALCADOS LTDA. - M.E.,IBIUNA,6,1983,Sociedade Limitada
35202433284,RADIO AURIFLAMA DE COMUNICACAO LTDA.,AURIFLAMA,6,1983,Sociedade Limitada
35202433322,PAO PAO PANIFICACAO E CONFEITARIA LTDA.,SAO PAULO,6,1983,Sociedade Limitada
35202433349,PRO CORPO COSMETICA E TERAPEUTICA LTDA.,SAO PAULO,6,1983,Sociedade Limitada
35202433365,COMERCIO DE DOCES GUARALDO LTDA.,SAO PAULO,6,1983,Sociedade Limitada
35202433381,PAULISTA PRODUCOES FOTOGRAFICAS LTDA,JUNDIAI,6,1983,Sociedade Limitada
35202433403,ITAGUARE AGRO NEGOCIOS LTDA,GUARULHOS,6,1983,Sociedade Limitada
35202433420,COMERCIAL E DISTRIBUIDORA MAURICIO LTDA. - M.E.,SAO PAULO,6,1983,Sociedade Limitada
35202433471,BAZAR TUDO FACIL ITARIRI LTDA,ITARIRI,6,1983,Sociedade Limitada
35202433497,SKINA BOM GOSTO RESTAURANTE E LANCHONETE LTDA,SAO PAULO,6,1983,Sociedade Limitada
35202433594,A.S.F. MODAS LTDA.,SAO PAULO,6,1983,Sociedade Limitada
35202433624,MATIAS E REIS LTDA.,CATANDUVA,6,1983,Sociedade Limitada
35202433632,BAR GALINDO LTDA. - M.E.,SAO PAULO,6,1983,Sociedade Limitada
35202433667,"ELETROPIRA ASSESSORIA, PROJETOS E COMERCIO DE EQUIPAMENTOS ELETRO-ELETRONIOS LTDA.",PIRACICABA,6,1983,Sociedade Limitada
35202433675,R. MULLER INDUSTRIA COMERCIO IMPORTACAO E EXPORTACAO DE CHAPEUS LTDA,MARILIA,6,1983,Sociedade Limitada
35202433691,LO SGARRO CONFECCOES LTDA. - M.E.,RIBEIRAO PRETO,6,1983,Sociedade Limitada
35202433705,"SILVA, FERRARI & CIA LTDA",CATANDUVA,6,1983,Sociedade Limitada
35202433713,NICO FRANCO COMERCIO DE VERDURAS LTDA,ATIBAIA,6,1983,Sociedade Limitada
35202433748,MERCHIOR & MELCHIOR LTDA.,RIBEIRAO PRETO,6,1983,Sociedade Limitada
35202433772,LIVRARIA E PAPELARIA COELHO LTDA.,SAO PAULO,6,1983,Sociedade Limitada
35202433829,GIMENEZ COMERCIO DE PISOS E AZULEJOS LTDA,SAO PAULO,6,1983,Sociedade Limitada
35202433845,ART STYL MOVEIS E DECORACOES LTDA.,SAO PAULO,6,1983,Sociedade Limitada
35202433853,GROGARIA NOVA PLANALTO LTDA.,SAO PAULO,6,1983,Sociedade Limitada
35202433926,LANCHONETE CITY BURGER LTDA. - M.E.,SAO PAULO,6,1983,Sociedade Limitada
35202434035,SANTANA E BRATFISCH LTDA.,HORTOLANDIA,6,1983,Sociedade Limitada
35202434086,REMIC REFRATARIOS LTDA.,SAO CAETANO DO SUL,6,1983,Sociedade Limitada
35202434094,BRIENZA COMERCIAL LTDA,SAO PAULO,6,1983,Sociedade Limitada
35202434167,MEM MAQUINAS DE TERRAPLENAGEM E CONSTRUCOES LTDA.,MOGI DAS CRUZES,6,1983,Sociedade Limitada
35202434205,FIFO COMERCIO DE ALIMENTOS LTDA,SAO PAULO,6,1983,Sociedade Limitada
35202434256,BALLUFF CONTROLES ELETRICOS LTDA.,INDAIATUBA,6,1983,Sociedade Limitada
35202434353,RENEWER COMERCIO E REPRESENTACOES LTDA. - M.E.,SAO PAULO,6,1983,Sociedade Limitada
35202434400,WINGS AGENCIA DE VIAGENS E TURISMO LTDA.,RIO CLARO,6,1983,Sociedade Limitada
35202434442,BEMMIKER SUCOS E LANCHES LTDA,BAURU,6,1983,Sociedade Limitada
35202434451,COMERCIAL PEREIRA DE CAMARGO SACARIAS E RACOES LTDA. - M.E.,SUMARE,6,1983,Sociedade Limitada
35202434477,FIMAC COMERCIO DE MADEIRAS LTDA. - M.E.,SAO PAULO,6,1983,Sociedade Limitada
35202434540,INSTALACOES ELETRICAS E HIDRAULICAS GHELFI LTDA.,SAO PAULO,6,1983,Sociedade Limitada
35202434566,P.P.C. MAQUINAS REPROGRAFICAS LTDA. - M.E.,RIBEIRAO PRETO,6,1983,Sociedade Limitada
35202434591,BAR E LANCHES SORO LTDA. - M.E.,SAO PAULO,6,1983,Sociedade Limitada
35202434604,OTICA TUIUTI LTDA,SAO PAULO,6,1983,Sociedade Limitada
35202434621,DUMBO PINTURAS TECNICAS OBJETIVAS LTDA,DIADEMA,6,1983,Sociedade Limitada
35202434647,TAVARES COMERCIO DE VIDROS LTDA.,SAO PAULO,6,1983,Sociedade Limitada
35202434655,DETROIT EDITORACAO ELETRONICA LTDA.,SAO PAULO,6,1983,Sociedade Limitada
35202434671,CENTER CARNES ITAQUA LTDA,ITAQUAQUECETUBA,6,1983,Sociedade Limitada
35202434698,A.D.G. ENGENHARIA E CONSTRUCOES LTDA.,RIBEIRAO PRETO,6,1983,Sociedade Limitada
35202434701,CREDI MARS MODAS LTDA-ME.,MOGI DAS CRUZES,6,1983,Sociedade Limitada
35202434728,DUTRA OLIVEIRA E CIA LTDA,CAJURU,6,1983,Sociedade Limitada
35202434744,ACOUGUE DOM PEDRITO LTDA.,CAMPINAS,6,1983,Sociedade Limitada
35202434752,KANASHIRO & CIA LTDA.,CAMPINAS,6,1983,Sociedade Limitada
35202434795,SORVETERIA KI-MEL DE CRAVINHOS LTDA,CRAVINHOS,6,1983,Sociedade Limitada
35202434833,GARK ENGENHARIA E CONSTRUCOES LTDA.,SAO PAULO,6,1983,Sociedade Limitada
35202434876,N.R. COMERCIO DE PECAS E ESTRUTURAS DE MADEIRAS LTDA,ILHA COMPRIDA,6,1983,Sociedade Limitada
35202434922,VL COMERCIO DE CARNES LTDA,JALES,6,1983,Sociedade Limitada
35202434931,IMPERIO DAS TINTAS LTDA.,SAO PAULO,6,1983,Sociedade Limitada
35202434957,COMERCIO DE FERROS E ALUMINIOS LONDRIMAR LTDA. - M.E.,SAO PAULO,6,1983,Sociedade Limitada
35202434965,MIYOCO SENO E CIA. LTDA.,OURINHOS,6,1983,Sociedade Limitada
35202434990,MARIA ANTONIETA VOLPATO E CIA. LTDA. - M.E.,JAU,6,1983,Sociedade Limitada
35202435015,GIRON & GIRON LTDA,ARACATUBA,6,1983,Sociedade Limitada
35202435040,CATANEU MATERIAIS PARA CONSTRUCAO LTDA.,ARARAQUARA,6,1983,Sociedade Limitada
35202435121,NOVA TRILHA PROPAGANDA LTDA.,SAO PAULO,6,1983,Sociedade Limitada
35202435163,E.T. EXTRATERRESTRE LANCHES LTDA. - M.E.,SAO PAULO,6,1983,Sociedade Limitada
35202435201,BAR E LANCHES ARRUDAO LTDA. - M.E.,SAO PAULO,6,1983,Sociedade Limitada
35202435244,IRMAOS SANTOS COMERCIO DE ACESSORIOS PARA SERRALHERIA LTDA,SAO PAULO,6,1983,Sociedade Limitada
35202435261,PONTO CERTO DE ADAMANTINA COMERCIO DE ROUPAS LTDA.,ADAMANTINA,6,1983,Sociedade Limitada
35202435287,AO REI DAS CADEIRAS PLASTICAS LTDA - M.E.,SAO PAULO,6,1983,Sociedade Limitada
35202435295,PROGNUS DO BRASIL PESQUISA E PUBLICIDADE LTDA.,SAO PAULO,6,1983,Sociedade Limitada
35202435317,B. COSTA COMERCIAL LTDA.,SAO PAULO,6,1983,Sociedade Limitada
35202435325,ASTRO MONTAGENS INDUSTRIAIS LTDA.,SERTAOZINHO,6,1983,Sociedade Limitada
35202435350,COMERCIO DE BEBIDAS CENTER DUTRA LTDA.,SAO PAULO,6,1983,Sociedade Limitada
35202435368,FORTE MAQUINAS AGRICOLAS LTDA.,QUINTANA,6,1983,Sociedade Limitada
35202435384,ARLINDO RODRIGUES DA SILVA E CIA. LTDA. - M.E.,SOROCABA,6,1983,Sociedade Limitada
35202435392,FORTEX COMERCIO E EXPORTACAO DE PAPEIS LTDA,BOITUVA,6,1983,Sociedade Limitada
35202435422,ROBERTO DE GODOY TRANSPORTES LTDA,SAO PAULO,6,1983,Sociedade Limitada
35202435465,HOUSE OF VISION COMERCIO E REPRESENTACOES LTDA.,SAO PAULO,6,1983,Sociedade Limitada
35202435473,TROPICAL RADIODIFUSAO LTDA,SAO PAULO,6,1983,Sociedade Limitada
35202435481,MOVEIS E DECORACOES JAVANELI LTDA. - M.E.,CAMPINAS,6,1983,Sociedade Limitada
35202435520,DESIDERA & DESIDERA DE ITU LTDA,ITU,6,1983,Sociedade Limitada
35202435538,NAVAKOSKI E NAVAKOSKI LTDA. - M.E.,CAMPINAS,6,1983,Sociedade Limitada
35202435619,GLICERIO CALCADOS E BOLSAS LTDA. - M.E.,CAMPINAS,6,1983,Sociedade Limitada
35202435627,ENXOVAIS CHILA LTDA.,IBITINGA,6,1983,Sociedade Limitada
35202435651,PORTAL DA MANTIQUEIRA PADARIA LTDA,MONTEIRO LOBATO,6,1983,Sociedade Limitada
35202435732,GRANDIESEL MOTORES BOMBAS INJETORAS E TURBINAS LTDA.,RIBEIRAO PRETO,6,1983,Sociedade Limitada
35202435767,LOPES COMERCIAL DE ALIMENTOS LTDA,SAO PAULO,6,1983,Sociedade Limitada
35202435821,ALTO PARAIBA INDUSTRIA COMERCIO E AGRO PECUARIA LTDA.,SANTA BRANCA,6,1983,Sociedade Limitada
35202435830,COTAVE COMERCIAL TARRAFF DE VEICULOS LTDA.,SAO JOSE DO RIO PRETO,6,1983,Sociedade Limitada
35202435864,MONALISA TAPETES ORIENTAIS LTDA.,SAO PAULO,6,1983,Sociedade Limitada
35202435929,SPIR INDUSTRIA E COMERCIO LTDA.,SANTANA DE PARNAIBA,6,1983,Sociedade Limitada
35202435953,COMERCIO DE ARTEFATOS DE MADEIRA AMAZONENSE LTDA,SAO CAETANO DO SUL,6,1983,Sociedade Limitada
35202436089,CASA DE CARNES GIZA LTDA. - M.E.,SAO PAULO,6,1983,Sociedade Limitada
35202436178,FITAMAR INDUSTRIA E COMERCIO LTDA.,AMERICANA,6,1983,Sociedade Limitada
35202436194,MERCEARIA JOBAL LTDA. - M.E.,SAO PAULO,6,1983,Sociedade Limitada
35202436208,LOTERICA ATRATIVA LTDA. - M.E.,SAO PAULO,6,1983,Sociedade Limitada
35202436330,PAPELARIA P.B. LTDA. - M.E.,SAO PAULO,6,1983,Sociedade Limitada
35202436364,A. ROSSI NETO CONSTRUTORA LTDA.,LIMEIRA,6,1983,Sociedade Limitada
35202436381,PINOQUI BRINQUEDOS E BAZAR LTDA.,LIMEIRA,6,1983,Sociedade Limitada
35202436429,PRODUTOS ALIMENTICIOS STELLYS LTDA.,SAO PAULO,6,1983,Sociedade Limitada
35202436437,PANAVIDEO COMERCIO DE FITAS E SERVICOS LTDA.,SAO PAULO,6,1983,Sociedade Limitada
35202436496,DON ZILDONE - BAR E LANCHONETE LTDA,MAIRIPORA,6,1983,Sociedade Limitada
35202436631,RENON GRILL LTDA.,OSASCO,6,1983,Sociedade Limitada
35202436640,CRIGG COMERCIAL DE BEBIDAS LTDA.,GUARULHOS,6,1983,Sociedade Limitada
35202436658,ALFA FERRO ACO E METAIS LTDA.,SAO CAETANO DO SUL,6,1983,Sociedade Limitada
35202436704,BAZAR CAPRI LTDA.,BARUERI,6,1983,Sociedade Limitada
35202436721,VICIOUS COMERCIO DE BIJOUTERIAS LTDA,SAO PAULO,6,1983,Sociedade Limitada
35202436771,CASA DE CARNES NOVA ITAQUERA LTDA.,SAO PAULO,6,1983,Sociedade Limitada
35202436798,FURAYAMA E OLIVEIRA LTDA.,ILHA SOLTEIRA,6,1983,Sociedade Limitada
35202436801,LUIZ ANSELMO E FILHOS LTDA.,RIO CLARO,6,1983,Sociedade Limitada
35202436844,MULTI COPIADORAS E SISTEMAS DIGITAIS LTDA,SOROCABA,6,1983,Sociedade Limitada
35202436879,GARPEDRAS GARCA COMERCIO DE PEDRAS LTDA,GARCA,6,1983,Sociedade Limitada
35202436887,ROCHA E ETO COMERCIO DE PRODUTOS FARMACEUTICOS DE MOGI DAS CRUZES LTDA.,MOGI DAS CRUZES,6,1983,Sociedade Limitada
35202436909,BASCULAREIA DISTRIBUIDORA DE AREIA E PEDRA LTDA.,GUARULHOS,6,1983,Sociedade Limitada
35202436925,BRAGA & GALINA LTDA.,HERCULANDIA,6,1983,Sociedade Limitada
35202436933,BAR TREZENTOS E SETE LTDA. - M.E.,ARACATUBA,6,1983,Sociedade Limitada
35202436941,ARTIGOS RELIGIOSOS SETE ESTRELAS LTDA. - M.E.,TAUBATE,6,1983,Sociedade Limitada
35202436968,YAKO MIKA COMERCIO E INDUSTRIA DE CONFECCOES LTDA.,SAO PAULO,6,1983,Sociedade Limitada
35202437085,JRM COMERCIO E MANUTENCAO DE MOTORES ELETRICOS LTDA.,SAO CAETANO DO SUL,6,1983,Sociedade Limitada
35202437093,EUMAK COMERCIO DE MADEIRAS LTDA. - M.E.,SAO PAULO,6,1983,Sociedade Limitada
35202437191,LOJA ESMERALDA LTDA. - M.E.,SAO PAULO,6,1983,Sociedade Limitada
35202437212,CASA DE CARNES KANSAS LTDA.,SAO PAULO,6,1983,Sociedade Limitada
35202437239,FERDINANDO COBRANCAS E REPRESENTACOES LTDA,RIBEIRAO PRETO,6,1983,Sociedade Limitada
35202437255,INTEGRADO DISTRIBUIDOR FRIGORIFICO LTDA,RIBEIRAO PRETO,6,1983,Sociedade Limitada
35202437271,RADIO CATORZE DE ABRIL LTDA.,CATANDUVA,6,1983,Sociedade Limitada
35202437280,MONELL ENGENHARIA LTDA.,SAO PAULO,6,1983,Sociedade Limitada
35202437301,OPESTE MODAS LTDA.,SANTO ANDRE,6,1983,Sociedade Limitada
35202437310,DISKOTOKA COMERCIO DE DISCOS LTDA. - M.E.,GARCA,6,1983,Sociedade Limitada
35202437336,CALCADOS IDAMAR LTDA.,SAO PAULO,6,1983,Sociedade Limitada
35202437344,TEXTIL BERETTA ROSSI LTDA.,SANTA BARBARA D'OESTE,6,1983,Sociedade Limitada
35202437379,CASA DE CARNES HES LTDA.,OSASCO,6,1983,Sociedade Limitada
35202437433,SUPERMERCADO BELTRAO LTDA.,EMBU,6,1983,Sociedade Limitada
35202437441,BY APPOINTMENT MODAS LTDA.,SAO PAULO,6,1983,Sociedade Limitada
35202437506,NATURAQUARIO AQUARIOFILIA E AVICULTURA LTDA.,SAO CAETANO DO SUL,6,1983,Sociedade Limitada
35202437522,BAR E MERCEARIA NOVA AMERICANA LTDA. - M.E.,AMERICANA,6,1983,Sociedade Limitada
35202437557,NINA COMERCIO DE AUTOMOVEIS LTDA.,SAO BERNARDO DO CAMPO,6,1983,Sociedade Limitada
35202437573,AGRO COMERCIAL PERETTI DE FRUTAS E VERDURAS LTDA.,PRESIDENTE PRUDENTE,6,1983,Sociedade Limitada
35202437581,FERREIRA MAQUINAS OPERATRIZES LTDA.,DIADEMA,6,1983,Sociedade Limitada
35202437603,W.M. ACESSORIOS ELETRICOS LTDA.,CAMPINAS,6,1983,Sociedade Limitada
35202437611,PANIFICADORA VANESSA DE CUBATAO LTDA.,CUBATAO,6,1983,Sociedade Limitada
35202437646,MOVEIS E DECORACOES RAMALHO LTDA.,SAO PAULO,6,1983,Sociedade Limitada
35202437689,MAGAZINE IRMAOS CHAWICHE LTDA. - M.E.,SAO PAULO,6,1983,Sociedade Limitada
35202437697,MOTO KEY LTDA.,SANTO ANDRE,6,1983,Sociedade Limitada
35202437701,ANTONIO CORREIA DOS SANTOS E FILHO LTDA.,GUARUJA,6,1983,Sociedade Limitada
35202437727,CASA DE CARNES ESTREITO LTDA.,PRAIA GRANDE,6,1983,Sociedade Limitada
35202437743,CITYGRAFICA ARTES GRAFICAS E EDITORA LTDA.,CAMPINAS,6,1983,Sociedade Limitada
35202437786,OLIVEIRA PREVIATTI BAZAR LTDA. - M.E.,JUNDIAI,6,1983,Sociedade Limitada
35202437841,VIRMA NICOLAU PUCCI & FILHA LTDA.,ITAPETININGA,6,1983,Sociedade Limitada
35202437867,WAL-SOY COMERCIO DE PRODUTOS ALIMENTICIOS E TRANSPORTES LTDA,SANTO ANDRE,6,1983,Sociedade Limitada
35202437875,CARNEIRO & VACCARI DE ITU LTDA,ITU,6,1983,Sociedade Limitada
35202437891,AGRO-MOTTA - COMERCIO DE RACOES LTDA,ITAPIRA,6,1983,Sociedade Limitada
35202437921,OTICA E FLORICULTURA MILE LTDA.,SAO PAULO,6,1983,Sociedade Limitada
35202437956,RESINDUS TRANSPORTES DE RESIDUOS INDUSTRIAIS LTDA.,ARUJA,6,1983,Sociedade Limitada
35202438006,EIFFEL SERRALHERIA INDUSTRIAL LTDA. - M.E.,SAO PAULO,6,1983,Sociedade Limitada
35202438014,A.C.G. DISTRIBUIDORA DE PRODUTOS DE LIMPEZA LTDA.,SUZANO,6,1983,Sociedade Limitada
35202438031,CONFECCOES MIKA-LADY LTDA,SAO PAULO,6,1983,Sociedade Limitada
35202438057,"UNIAO COMERCIO DE BORRACHAS E AUTO PECAS LTDA. ""INABILITADA PARA EXERCER ATIVIDADE EMPRESARIAL""",SAO PAULO,6,1983,Sociedade Limitada
35202438120,CONSTRUTORA TOFANO LTDA.,RIBEIRAO PRETO,6,1983,Sociedade Limitada
35202438189,LIOBRAS PRODUTOS LIOFILIZADOS BRASILEIROS LTDA.,SAO PAULO,6,1983,Sociedade Limitada
35202438294,COMERCIAL DE PRODUTOS ALIMENTICIOS NOVA ESPERANCA LTDA.,SAO PAULO,6,1983,Sociedade Limitada
35202438359,DENTAL ATLANTICA LTDA. - M.E.,SAO PAULO,6,1983,Sociedade Limitada
35202438375,FLUXO COMERCIO DE MATERIAIS ELETRICOS E HIDRAULICOS LTDA.,SAO PAULO,6,1983,Sociedade Limitada
35202438421,COMERCIO DE CARVAO TROPERO LTDA. - M.E.,SALESOPOLIS,6,1983,Sociedade Limitada
35202438448,BAZAR E PAPELARIA ISA LTDA. - M.E.,SAO PAULO,6,1983,Sociedade Limitada
35202438499,COMERCIAL LENCOENSE DE SUCATAS LTDA.,LENCOIS PAULISTA,6,1983,Sociedade Limitada
35202438502,SUPER PAO PEDERNEIRAS LTDA.,PEDERNEIRAS,6,1983,Sociedade Limitada
35202438511,HASEGAWA UTILIDADES DOMESTICAS LTDA,PENAPOLIS,6,1983,Sociedade Limitada
35202438529,MAKI E YAGONE LTDA.,ARACATUBA,6,1983,Sociedade Limitada
35202438600,DOCELANDIA ROSELY LTDA.,SAO PAULO,6,1983,Sociedade Limitada
35202438634,SPORT AUTOS E SERVICOS LTDA.,SAO PAULO,6,1983,Sociedade Limitada
35202438642,ANA COMERCIO VAREJISTA DE VASOS E FLORES LTDA.,SAO PAULO,6,1983,Sociedade Limitada
35202438669,BAZAR POUSADA DO VALE LTDA.,SAO JOSE DOS CAMPOS,6,1983,Sociedade Limitada
35202438693,LEISA PUBLICIDADE LTDA.,SAO PAULO,6,1983,Sociedade Limitada
35202438715,GALERIA FABULOSA LTDA.,ITAPEVA,6,1983,Sociedade Limitada
35202438766,RESTAURANTE E CHURRASCARIA GONZAGA E MOURA LTDA. - M.E.,SAO PAULO,6,1983,Sociedade Limitada
35202438804,TUCUNARE REFEICOES LTDA.,BARUERI,6,1983,Sociedade Limitada
35202438847,PORTAL MEDITERRANEO MOTEL LTDA.,SAO PAULO,6,1983,Sociedade Limitada
35202438952,BAR E LANCHES JABUCA LTDA,SANTOS,6,1983,Sociedade Limitada
35202439037,SANTA RITA VALINHOS REPRESENTACOES LTDA.,VALINHOS,6,1983,Sociedade Limitada
35202439151,TRANSGOMA TRANSPORTES LTDA.,ANGATUBA,6,1983,Sociedade Limitada
35202439193,STOP SHOK COMERCIO DE PARACHOQUES LTDA. - M.E.,SAO PAULO,6,1983,Sociedade Limitada
35202439231,E. VICENZO INDUSTRIA E COMERCIO DE ACESSORIOS E MOTOCICLETAS LTDA.,SAO PAULO,6,1983,Sociedade Limitada
35202439240,JOSE JOAQUIM CYPRIANO E CIA. LTDA. - M.E.,SANTOS,6,1983,Sociedade Limitada
35202439282,CONSTRUTORA NATALI LTDA.,SAO PAULO,6,1983,Sociedade Limitada
35202439291,FELTRIN E CARDAMONE COMERCIO DE VEICULOS E SERVICOS LTDA.,SAO PAULO,6,1983,Sociedade Limitada
35202439355,FLORICULTURA SHANGRI LA LTDA. - M.E.,LIMEIRA,6,1983,Sociedade Limitada
35202439398,BAR E LANCHONETE PINHEIRO DE ITARIRI LTDA.,ITARIRI,6,1983,Sociedade Limitada
35202439401,A.F.M. SILVA E CIA. LTDA.,JUNDIAI,6,1983,Sociedade Limitada
35202439410,AYRTON VANINI E CIA. LTDA. - M.E.,JUNDIAI,6,1983,Sociedade Limitada
35202439428,RIEL ARTIGOS DO VESTUARIO LTDA,RIBEIRAO PRETO,6,1983,Sociedade Limitada
35202439461,MOVEIS E DECORACOES LINEA NOVA LTDA,SANTOS,6,1983,Sociedade Limitada
35202439495,PAES E DOCES TRIGONELA LTDA,SAO PAULO,6,1983,Sociedade Limitada
35202439517,SOUZA E CAVALARI LTDA. - M.E.,SAO JOSE DO RIO PRETO,6,1983,Sociedade Limitada
35202439533,J.M. COMERCIO DE CONFECCOES LTDA.,CATANDUVA,6,1983,Sociedade Limitada
35202439622,TRANSPORTADORA PEZAO LTDA.,SAO JOSE DOS CAMPOS,6,1983,Sociedade Limitada
35202439720,ASTA ASSESSORIA TECNICA ADUANEIRA LTDA.,SAO PAULO,6,1983,Sociedade Limitada
35202439746,GESSO CLAY INDUSTRIA E COMERCIO LTDA.,SAO PAULO,6,1983,Sociedade Limitada
35202439754,AMARAL & BRAGALHA LTDA,PIRACICABA,6,1983,Sociedade Limitada
35202439771,PIANTOLA & STOGO LTDA. - M.E.,PIRACICABA,6,1983,Sociedade Limitada
35202439797,MODAS TUA E MIA LTDA.,SOROCABA,6,1983,Sociedade Limitada
35202439801,LIMPINHA MATERIAIS DE LIMPESA E ESCRITORIO LTDA.,SAO PAULO,6,1983,Sociedade Limitada
35202439878,CARVALHO & DONA LTDA,SUMARE,6,1983,Sociedade Limitada
35202439916,COMERCIO DE CARNES G.O. LTDA.,SAO JOSE DOS CAMPOS,6,1983,Sociedade Limitada
35202439991,AUTO MECANICA S.S. CAR LTDA.,SAO PAULO,6,1983,Sociedade Limitada
35202440035,BAR E EMPORIO GASTAO LTDA. - M.E.,SAO PAULO,6,1983,Sociedade Limitada
35202440108,MECANICA RANIELO LTDA. - M.E.,SANTA CRUZ DO RIO PARDO,6,1983,Sociedade Limitada
35202440124,COMERCIAL MOTORAMA DE VEICULOS DE BATATAIS LTDA. - M.E.,BATATAIS,6,1983,Sociedade Limitada
35202440132,TRANSPORTADORA RISSO LTDA.,BARUERI,6,1983,Sociedade Limitada
35202440159,FTM EMPREENDIMENTOS LTDA.,SAO PAULO,6,1983,Sociedade Limitada
35202440230,DRACAR VEICULOS E PECAS LTDA.,DRACENA,6,1983,Sociedade Limitada
35202440299,PAULO RODRIGUES ALVES E CIA. LTDA.,PINDAMONHANGABA,6,1983,Sociedade Limitada
35202440302,NOLF EMPREENDIMENTOS E PARTICIPACOES LTDA.,SAO PAULO,6,1983,Sociedade Limitada
35202440345,METALDENTE LTDA.,SAO PAULO,6,1983,Sociedade Limitada
35202440361,APEX DO BRASIL LTDA.,SANTANA DE PARNAIBA,6,1983,Sociedade Limitada
35202440370,ACOUGUE CRUZ DE MALTA LTDA. - M.E.,SAO PAULO,6,1983,Sociedade Limitada
35202440400,CONFECCOES LUFRAN'S INDUSTRIA E COMERCIO LTDA.,PEDREIRA,6,1983,Sociedade Limitada
35202440418,COMERCIO DE MATERIAL PARA CONSTRUCAO MARIANO & FILHO LTDA.,SAO PAULO,6,1983,Sociedade Limitada
35202440451,GONCALVES INDUSTRIA E COMERCIO DE VIDROS LTDA. - M.E.,JAGUARIUNA,6,1983,Sociedade Limitada
35202440477,BAR E LANCHES STRAUBEL E GONCALVES LTDA.,EMBU,6,1983,Sociedade Limitada
35202440493,POSTO DE SERVICOS CCS LTDA,SAO PAULO,6,1983,Sociedade Limitada
35202440515,SOPLAC MADEIRAS LTDA.,SAO PAULO,6,1983,Sociedade Limitada
35202440531,BENNY FEIRA PERMANENTE DE MICROCOMPUTADORES LTDA.,SAO PAULO,6,1983,Sociedade Limitada
35202440574,ESTORIL INDUSTRIA E COMERCIO DE PRODUTOS DO TOUCADOR LTDA. - M.E.,GUARULHOS,6,1983,Sociedade Limitada
35202440663,COMERCIAL SALA DE MAQUINAS E MOVEIS LTDA,SAO PAULO,6,1983,Sociedade Limitada
35202440680,UP INDUSTRIA DE PRODUTOS PLASTICOS LTDA.,SAO PAULO,6,1983,Sociedade Limitada
35202440710,HOT SOUND INDUSTRIA E COMERCIO DE EQUIPAMENTOS ELETRONICOS LTDA. - M.E.,VALINHOS,6,1983,Sociedade Limitada
35202440744,ASPID INDUSTRIA COMECIO E IMPORTACAO LTDA.,IBATE,6,1983,Sociedade Limitada
35202440752,HOTEL VILA REAL LTDA. - M.E.,ARACATUBA,6,1983,Sociedade Limitada
35202440841,CHIK'S CENTER MODAS LTDA.,SAO PAULO,6,1983,Sociedade Limitada
35202440850,L M PARAFUSOS LTDA.,SAO PAULO,6,1983,Sociedade Limitada
35202440973,DOCES MELARE TIETE LTDA.,TIETE,6,1983,Sociedade Limitada
35202440990,LOTERICA APOSTA DA SORTE LTDA,SAO PAULO,6,1983,Sociedade Limitada
35202441058,COBRASMAQ MAQUINAS INDUSTRIAS LTDA.,SAO PAULO,6,1983,Sociedade Limitada
35202441112,AUTO MECANICA MERCES LTDA.,SAO PAULO,6,1983,Sociedade Limitada
35202441171,DIVEL VIDROS E ESPELHOS LTDA.,SAO PAULO,6,1983,Sociedade Limitada
35202441261,PATLARI INDUSTRIA E COMERCIO DE ACESSORIOS PARA MOVEIS LTDA.,DOIS CORREGOS,6,1983,Sociedade Limitada
35202441279,COMERCIAL VALINO LTDA. - M.E.,BRAGANCA PAULISTA,6,1983,Sociedade Limitada
35202441295,MINAS REPRESENTACOES LTDA.,SAO CARLOS,6,1983,Sociedade Limitada
35202441309,AZF COMERCIAL LIMITADA,SAO PAULO,6,1983,Sociedade Limitada
35202441350,BRUNIN EMPACOTADORA DE PRODUTOS ALIMENTICIOS LTDA.,CAPIVARI,6,1983,Sociedade Limitada
35202441376,RUDGEFER COMERCIO DE FERRO LTDA.,SAO BERNARDO DO CAMPO,6,1983,Sociedade Limitada
35202441414,SUNDRY - COMERCIO LTDA.,SAO PAULO,6,1983,Sociedade Limitada
35202441422,V.C.C. COMERCIO DE BRINDES LTDA.,SAO PAULO,6,1983,Sociedade Limitada
35202441457,BAR E LANCHONETE FLOR DE JAMBO LTDA-ME,SAO PAULO,6,1983,Sociedade Limitada
35202441465,"ENERGETICA COMERCIAL ELETRICA LTDA. ""EM LIQUIDACAO""",SAO PAULO,6,1983,Sociedade Limitada
35202441759,BAR E LANCHES JANAIRA DE SAO VICENTE LTDA.,SAO VICENTE,6,1983,Sociedade Limitada
35202442178,CHURRASCARIA RIO PRETO LTDA.,SAO JOSE DO RIO PRETO,6,1983,Sociedade Limitada
35202442186,EMILIA L. PRANCHA E CIA. LTDA. - M.E.,TANABI,6,1983,Sociedade Limitada
35202442194,BIO COLLECT RECUPERACAO LTDA.,VIRADOURO,6,1983,Sociedade Limitada
35202442208,APRAZIVEL LOTERICA LTDA.,MONTE APRAZIVEL,6,1983,Sociedade Limitada
35202442305,W. BURGER VALVULAS DE SEGURANCA E ALIVIO LTDA.,SAO PAULO,6,1983,Sociedade Limitada
35202442836,MECBRASIL COMERCIO DE MAQUINAS INDUSTRIAIS LTDA,POMPEIA,6,1983,Sociedade Limitada
35202450391,JATOBA PARTICIPACOES E REPRESENTACOES LTDA.,SAO PAULO,6,1983,Sociedade Limitada
35202452955,KROL COMERCIO DE MAQUINAS DE COSTURA LTDA. - M.E.,RIO CLARO,6,1983,Sociedade Limitada
