NIRE,Empresa,Município,Month,Year,Type
35111468115,LUIZ ANTONIO RABESCO,BARIRI,11,1991,Empresario
35111468123,CARLOS ANTONIO DE BARROS PRAIA GRANDE,PRAIA GRANDE,11,1991,Empresario
35111468166,RUTH H.P.M. DOS SANTOS,,11,1991,Empresario
35111468174,EVANGELINA DE OLIVEIRA GARCIA,SÃO CAETANO DO SUL,11,1991,Empresario
35111468182,THEREZINHA DE JESUS CHRIST BALLESTRERI,,11,1991,Empresario
35111468204,HELCIO DE ALMEIDA FERREIRA JUNIOR,ATIBAIA,11,1991,Empresario
35111468247,CESAR R F DOS REIS,LORENA,11,1991,Empresario
35111468255,IRENE DE LIMA LORENA,LORENA,11,1991,Empresario
35111468310,ESMERALDA MOTA E SILVA TEIXEIRA,SÃO PAULO,11,1991,Empresario
35111468328,VICENTINA M FERREIRA DOS SANTOS PILAR,,11,1991,Empresario
35111468344,ERCIAS GOMES DE OLIVEIRA,VERA CRUZ,11,1991,Empresario
35111468361,MARIA APARECIDA GIMENES PEREZ,SOROCABA,11,1991,Empresario
35111468379,GERSON PROENCA BUENO,,11,1991,Empresario
35111468387,GERALDO APARECIDO DA SILVA SOROCABA,SOROCABA,11,1991,Empresario
35111468425,REGINALDO GONÇALVES,HORTOLÂNDIA,11,1991,Empresario
35111468433,JUDITH F.MACHADO BAZAR,JACAREÍ,11,1991,Empresario
35111468441,ELISA DOS SANTOS BAR E LANCHES,SÃO PAULO,11,1991,Empresario
35111468450,ORLANDO PEREIRA INDAIATUBA,,11,1991,Empresario
35111468476,VANDERLEI PLINIO DE OLIVEIRA,AVARÉ,11,1991,Empresario
35111468531,CARLOS EDUARDO PALOMBELLO,,11,1991,Empresario
35111468557,MARIA HELENA MICHELIN MOGI MIRIM,MOGI MIRIM,11,1991,Empresario
35111468638,TEREZINHA APARECIDA BISCO MARAES,,11,1991,Empresario
35111468662,LEONTINA RODRIGUES SILVA,GUARULHOS,11,1991,Empresario
35111468689,AGILDO DA SILVA OLIVEIRA,,11,1991,Empresario
35111468697,ANTONIO AUGUSTO DA SILVA CASARINI,SUMARÉ,11,1991,Empresario
35111468719,AURINO RODRIGUES PEREIRA,,11,1991,Empresario
35111468727,SUELI P. FERNANDES BOMBONIERE,,11,1991,Empresario
35111468735,F.S. PEREIRA,MOGI DAS CRUZES,11,1991,Empresario
35111468760,JOSE TOBIAS DA SILVA,GUARULHOS,11,1991,Empresario
35111468778,IRENE BORGES,,11,1991,Empresario
35111468808,SUELI CRISTINA POLACHINI BATISTA,JABOTICABAL,11,1991,Empresario
35111468859,RICARDO PEREIRA PEDRO,SÃO PAULO,11,1991,Empresario
35111468875,ANTONIO PROENCA,SÃO PAULO,11,1991,Empresario
35111468891,IRACEMA MARQUES SALVINO BAR,,11,1991,Empresario
35111468956,JORGE NUNES GUIMARAES,,11,1991,Empresario
35111468981,M G BRANDAO DE JESUS,,11,1991,Empresario
35111468999,NEUSA LOOES DE SOUZA FERRAZ,SOROCABA,11,1991,Empresario
35111469031,APARECIDA LOURDES TROPEA VALVERDE,JUNDIAÍ,11,1991,Empresario
35111469081,JOSE CARLOS PIAIA GUILHERME,,11,1991,Empresario
35111469090,ROBERTO TADEU SANTOS MONTORO,,11,1991,Empresario
35111469103,TOSHIO TAKASU,PEREIRA BARRETO,11,1991,Empresario
35111469146,ALEXANDRE DONIZETE DE LIMA FRANCA,,11,1991,Empresario
35111469162,PEDRO OSMAR DE QUEIROZ RIB. PIRES,RIBEIRÃO PIRES,11,1991,Empresario
35111469197,PAULO SERGIO CARVALHO DA SILVA ITARARE,ITARARÉ,11,1991,Empresario
35111469219,ELIZUR SANCHES,LENÇÓIS PAULISTA,11,1991,Empresario
35111469243,REGINA CELIA SILVA OLIVEIRA,SANTOS,11,1991,Empresario
35111469260,F A DE SOUSA.,,11,1991,Empresario
35111468875,ANTONIO PROENCA,SÃO PAULO,11,1991,Empresario
35111468891,IRACEMA MARQUES SALVINO BAR,,11,1991,Empresario
35111468956,JORGE NUNES GUIMARAES,,11,1991,Empresario
35111468981,M G BRANDAO DE JESUS,,11,1991,Empresario
35111468999,NEUSA LOOES DE SOUZA FERRAZ,SOROCABA,11,1991,Empresario
35111469031,APARECIDA LOURDES TROPEA VALVERDE,JUNDIAÍ,11,1991,Empresario
35111469081,JOSE CARLOS PIAIA GUILHERME,,11,1991,Empresario
35111469090,ROBERTO TADEU SANTOS MONTORO,,11,1991,Empresario
35111469103,TOSHIO TAKASU,PEREIRA BARRETO,11,1991,Empresario
35111469146,ALEXANDRE DONIZETE DE LIMA FRANCA,,11,1991,Empresario
35111469162,PEDRO OSMAR DE QUEIROZ RIB. PIRES,RIBEIRÃO PIRES,11,1991,Empresario
35111469197,PAULO SERGIO CARVALHO DA SILVA ITARARE,ITARARÉ,11,1991,Empresario
35111469219,ELIZUR SANCHES,LENÇÓIS PAULISTA,11,1991,Empresario
35111469243,REGINA CELIA SILVA OLIVEIRA,SANTOS,11,1991,Empresario
35111469260,F A DE SOUSA.,,11,1991,Empresario
35111468875,ANTONIO PROENCA,SÃO PAULO,11,1991,Empresario
35111468891,IRACEMA MARQUES SALVINO BAR,,11,1991,Empresario
35111468956,JORGE NUNES GUIMARAES,,11,1991,Empresario
35111468981,M G BRANDAO DE JESUS,,11,1991,Empresario
35111468999,NEUSA LOOES DE SOUZA FERRAZ,SOROCABA,11,1991,Empresario
35111469031,APARECIDA LOURDES TROPEA VALVERDE,JUNDIAÍ,11,1991,Empresario
35111469081,JOSE CARLOS PIAIA GUILHERME,,11,1991,Empresario
35111469090,ROBERTO TADEU SANTOS MONTORO,,11,1991,Empresario
35111469103,TOSHIO TAKASU,PEREIRA BARRETO,11,1991,Empresario
35111469146,ALEXANDRE DONIZETE DE LIMA FRANCA,,11,1991,Empresario
35111469162,PEDRO OSMAR DE QUEIROZ RIB. PIRES,RIBEIRÃO PIRES,11,1991,Empresario
35111469197,PAULO SERGIO CARVALHO DA SILVA ITARARE,ITARARÉ,11,1991,Empresario
35111469219,ELIZUR SANCHES,LENÇÓIS PAULISTA,11,1991,Empresario
35111469243,REGINA CELIA SILVA OLIVEIRA,SANTOS,11,1991,Empresario
35111469260,F A DE SOUSA.,,11,1991,Empresario
35111468875,ANTONIO PROENCA,SÃO PAULO,11,1991,Empresario
35111468891,IRACEMA MARQUES SALVINO BAR,,11,1991,Empresario
35111468956,JORGE NUNES GUIMARAES,,11,1991,Empresario
35111468981,M G BRANDAO DE JESUS,,11,1991,Empresario
35111468999,NEUSA LOOES DE SOUZA FERRAZ,SOROCABA,11,1991,Empresario
35111469031,APARECIDA LOURDES TROPEA VALVERDE,JUNDIAÍ,11,1991,Empresario
35111469081,JOSE CARLOS PIAIA GUILHERME,,11,1991,Empresario
35111469090,ROBERTO TADEU SANTOS MONTORO,,11,1991,Empresario
35111469103,TOSHIO TAKASU,PEREIRA BARRETO,11,1991,Empresario
35111469146,ALEXANDRE DONIZETE DE LIMA FRANCA,,11,1991,Empresario
35111469162,PEDRO OSMAR DE QUEIROZ RIB. PIRES,RIBEIRÃO PIRES,11,1991,Empresario
35111469197,PAULO SERGIO CARVALHO DA SILVA ITARARE,ITARARÉ,11,1991,Empresario
35111469219,ELIZUR SANCHES,LENÇÓIS PAULISTA,11,1991,Empresario
35111469243,REGINA CELIA SILVA OLIVEIRA,SANTOS,11,1991,Empresario
35111469260,F A DE SOUSA.,,11,1991,Empresario
35111468875,ANTONIO PROENCA,SÃO PAULO,11,1991,Empresario
35111468891,IRACEMA MARQUES SALVINO BAR,,11,1991,Empresario
35111468956,JORGE NUNES GUIMARAES,,11,1991,Empresario
35111468981,M G BRANDAO DE JESUS,,11,1991,Empresario
35111468999,NEUSA LOOES DE SOUZA FERRAZ,SOROCABA,11,1991,Empresario
35111469031,APARECIDA LOURDES TROPEA VALVERDE,JUNDIAÍ,11,1991,Empresario
35111469081,JOSE CARLOS PIAIA GUILHERME,,11,1991,Empresario
35111469090,ROBERTO TADEU SANTOS MONTORO,,11,1991,Empresario
35111469103,TOSHIO TAKASU,PEREIRA BARRETO,11,1991,Empresario
35111469146,ALEXANDRE DONIZETE DE LIMA FRANCA,,11,1991,Empresario
35111469162,PEDRO OSMAR DE QUEIROZ RIB. PIRES,RIBEIRÃO PIRES,11,1991,Empresario
35111469197,PAULO SERGIO CARVALHO DA SILVA ITARARE,ITARARÉ,11,1991,Empresario
35111469219,ELIZUR SANCHES,LENÇÓIS PAULISTA,11,1991,Empresario
35111469243,REGINA CELIA SILVA OLIVEIRA,SANTOS,11,1991,Empresario
35111469260,F A DE SOUSA.,,11,1991,Empresario
35111468875,ANTONIO PROENCA,SÃO PAULO,11,1991,Empresario
35111468891,IRACEMA MARQUES SALVINO BAR,,11,1991,Empresario
35111468956,JORGE NUNES GUIMARAES,,11,1991,Empresario
35111468981,M G BRANDAO DE JESUS,,11,1991,Empresario
35111468999,NEUSA LOOES DE SOUZA FERRAZ,SOROCABA,11,1991,Empresario
35111469031,APARECIDA LOURDES TROPEA VALVERDE,JUNDIAÍ,11,1991,Empresario
35111469081,JOSE CARLOS PIAIA GUILHERME,,11,1991,Empresario
35111469090,ROBERTO TADEU SANTOS MONTORO,,11,1991,Empresario
35111469103,TOSHIO TAKASU,PEREIRA BARRETO,11,1991,Empresario
35111469146,ALEXANDRE DONIZETE DE LIMA FRANCA,,11,1991,Empresario
35111469162,PEDRO OSMAR DE QUEIROZ RIB. PIRES,RIBEIRÃO PIRES,11,1991,Empresario
35111469197,PAULO SERGIO CARVALHO DA SILVA ITARARE,ITARARÉ,11,1991,Empresario
35111469219,ELIZUR SANCHES,LENÇÓIS PAULISTA,11,1991,Empresario
35111469243,REGINA CELIA SILVA OLIVEIRA,SANTOS,11,1991,Empresario
35111469260,F A DE SOUSA.,,11,1991,Empresario
35111469278,JOSE CLAUDIO FELISBERTO-LEME,LEME,11,1991,Empresario
35111469286,MOACYR DE OLIVEIRA JUNIOR,,11,1991,Empresario
35111469294,WANDERLEY JESUS MARQUES DE MELLO,,11,1991,Empresario
35111469308,JR DA SILVA TREINAMENTO DE PESSOAL,CAMPINAS,11,1991,Empresario
35111469324,JOSE HIRAO TOKIDA.,BAURU,11,1991,Empresario
35111469341,BENEDITA DA CONCEICAO MARIANO.,GUARUJÁ,11,1991,Empresario
35111469375,CREUSA TOMEI,SÃO PAULO,11,1991,Empresario
35111469405,L.J. PASCOA NETO,,11,1991,Empresario
35111469413,NARA SATO PIRES,,11,1991,Empresario
35111469421,PEDRO MOREIRA FILHO,TAUBATÉ,11,1991,Empresario
35111469430,WAGNER VIQUECI AMERICANA,,11,1991,Empresario
35111469448,ALCIDES PIAI BAR,AMERICANA,11,1991,Empresario
35111469464,VALDIR MARTINS GILO,MOGI GUAÇU,11,1991,Empresario
35111469481,GILBERTO DOS SANTOS ESPETINHOS,MOGI GUAÇU,11,1991,Empresario
35111469561,NILDES RIBEIRO DOS SANTOS,SÃO PAULO,11,1991,Empresario
35111469596,OTAVIO DE OLIVEIRA VIDEO LOCADORA,SÃO PAULO,11,1991,Empresario
35111469618,SONIA MARIA FAZAN,SÃO CARLOS,11,1991,Empresario
35111469626,ANTONIO BATISTA REZENDE,SÃO CARLOS,11,1991,Empresario
35111469642,EPAMINONDAS TRIVELATO ACOUGUE,SANTA FÉ DO SUL,11,1991,Empresario
35111469651,MARIA CARDOSO SALVATE,,11,1991,Empresario
35111469693,ALBERTO ALVES DE SOUZA SERRALHERIA,PEDREIRA,11,1991,Empresario
35111469715,NEUSA SANCHEZ PRETTE,PARIQUERA-AÇU,11,1991,Empresario
35111469723,CARLOS BARTOLOMEU SAO MIGUEL ARCANJO,SÃO MIGUEL ARCANJO,11,1991,Empresario
35111469731,BENEDITA GALVAO LEITE PEREIRA APARECIDA,,11,1991,Empresario
35111469740,RICARDO DONIZETE DA SILVA BRAGA,FRANCA,11,1991,Empresario
35111469766,N F DE SOUZA-MOGI GUACU,MOGI GUAÇU,11,1991,Empresario
35111469774,MARIA DE LOURDES VIANA FUCHI,PRESIDENTE PRUDENTE,11,1991,Empresario
35111469855,JOSE APARECIDO MARTINS FRANCISCO,NOVA ODESSA,11,1991,Empresario
35111469871,ARISTEU ROSA,SÃO PAULO,11,1991,Empresario
35111469880,JOSE CARLOS MEDEIROS-AVICOLA,SÃO PAULO,11,1991,Empresario
35111469901,CICERO R. DOS SANTOS PENAPOLIS,PENÁPOLIS,11,1991,Empresario
35111469928,IVAN DA SILVA REIS,SANTOS,11,1991,Empresario
35111469936,MOACIR ALVES CAMARGO,,11,1991,Empresario
35111469952,ELIZABETH MARIA FUZARO TESSARI,,11,1991,Empresario
35111469979,GERLANDIA DOS SANTOS PEREIRA SOUZA,DIADEMA,11,1991,Empresario
35111470021,EXPEDITO PIRES DE ALMEIDA FILHO RIO GRANDE DA SERRA,RIO GRANDE DA SERRA,11,1991,Empresario
35111470039,CHRISTIANE CARLINO LANCHES.,SÃO PAULO,11,1991,Empresario
35111470055,OLGA YENIKOMSHIAN,,11,1991,Empresario
35111470063,ARLINDO PEREIRA DOS SANTOS-SAO PAULO,SÃO PAULO,11,1991,Empresario
35111470080,JOSE EDUARDO BELMONTE,,11,1991,Empresario
35111470101,FERNANDO LOURENCO GARCA,,11,1991,Empresario
35111470110,APARECIDO SERGIO PIRES,SÃO PAULO,11,1991,Empresario
35111470128,SEVERINO JULIO OLIVEIRA CALCADOS,OSASCO,11,1991,Empresario
35111470136,JOAO GOULART DE JESUS,MAUÁ,11,1991,Empresario
35111470144,HELIO LOURENCO DE OLIVEIRA,SOROCABA,11,1991,Empresario
35111470179,MARIA APARECIDA GOMES JOSE,SANTA CRUZ DAS PALMEIRAS,11,1991,Empresario
35111470209,MARIA DE FATIMA PAULINO,TAUBATÉ,11,1991,Empresario
35111470250,OSVALDO AMAURI GOMES DE MORAES,MAIRIPORÃ,11,1991,Empresario
35111470276,MARIA APARECIDA PASCHOA,,11,1991,Empresario
35111470322,MARIA JOSE DA ROCHA NICHIO,,11,1991,Empresario
35111470349,EDINALDO DANTAS,SÃO PAULO,11,1991,Empresario
35111470365,ALEXANDRE PICCOLOMINI,MOGI DAS CRUZES,11,1991,Empresario
35111470403,MARIA FERREIRA PALMEIRA,SÃO JOSÉ DO RIO PRETO,11,1991,Empresario
35111470420,RUBENS SANTANA RIO CLARO,,11,1991,Empresario
35111470446,DANIEL VAZ FREITAS,NOVA ALIANÇA,11,1991,Empresario
35111470454,ADELIA MACHADO SEMENZIN,SÃO JOSÉ DO RIO PRETO,11,1991,Empresario
35111470578,AMBROSIA IZABEL SILVA DE LIMA ARTIGO RELIGIOSOS,SÃO PAULO,11,1991,Empresario
35111470586,JOAO MARINHO DISTRIBUIDORA,,11,1991,Empresario
35111470624,JOSE ESTIMA DOS SANTOS,GUARULHOS,11,1991,Empresario
35111470705,CLEBER ALVES FERNANDES STA. FE,,11,1991,Empresario
35111470730,MARIA SALETE PEREIRA FERNANDES BAR,ARTUR NOGUEIRA,11,1991,Empresario
35111470781,IVANIR LOPES SERRALHERIA,,11,1991,Empresario
35111470811,LAERCIO APARECIDO DE CASTRO,,11,1991,Empresario
35111470853,JOSINA DE ANDRADE PINHO,,11,1991,Empresario
35111470888,CLARICE RIBEIRO DE SOUZA NORONHA,LINS,11,1991,Empresario
35111470942,EUSTAQUIO C. DOS SANTOS MATERIAIS PARA CONSTRUCAO,SÃO PAULO,11,1991,Empresario
35111470969,TEOFRANIO DE OLIVEIRA,,11,1991,Empresario
35111471027,ZULMIRO PEREIRA DOS SANTOS,IBITINGA,11,1991,Empresario
35111471094,ANDRE LUIZ FONSECA,PIRACICABA,11,1991,Empresario
35111471159,DENIS BAUDUCCI DE MOURA,CAMPINAS,11,1991,Empresario
35111471191,ERONIDIO RODRIGUES SANTOS,CARAPICUÍBA,11,1991,Empresario
35111471205,CLAUDINA ROCCIA,DIADEMA,11,1991,Empresario
35111471256,MARA RIATTO,MAUÁ,11,1991,Empresario
35111471281,ELISABETE C. DE SOUZA BAZAR,,11,1991,Empresario
35111471299,NILZA THEREZINHA RODRIGUES PELLEGRINO,PIRACICABA,11,1991,Empresario
35111471302,JOSE SOARES PUGAS,,11,1991,Empresario
35111471337,HELENA APARECIDA ALVES STA. R. DE VITERBO,,11,1991,Empresario
35111471361,GILBERTO DA SILVA MESQUITA,SÃO JOSÉ DO RIO PRETO,11,1991,Empresario
35111471388,JOVELINA BARBOSA DA SILVA,,11,1991,Empresario
35111471400,RICARDO VIEIRA ASSESSORIA EM INFORMATICA,ITATIBA,11,1991,Empresario
35111471418,MARIA DE FATIMA DA SILVA - CONFECCOES,SÃO PAULO,11,1991,Empresario
35111471434,CHRISTIANE BUSSING,SÃO PAULO,11,1991,Empresario
35111471451,ADEILDE MARIA DE OLIVEIRA GARCIA,SÃO PAULO,11,1991,Empresario
35111471469,VERA LUZIA TICIANELLI GABAS,BAURU,11,1991,Empresario
35111471477,VALDOMIRO SANCHES SARRO,,11,1991,Empresario
35111471485,NILZA DIAS DA SILVA,CABREÚVA,11,1991,Empresario
35111471493,MARIA DE LOURDES TEIXEIRA GAMBINI,AVARÉ,11,1991,Empresario
35111471507,MARGARETH APARECIDA FERRUCI,,11,1991,Empresario
35111471540,LUIZ CARLOS DOS SANTOS ADAMANTINA,,11,1991,Empresario
35111471582,PASCHOAL SCOFANO LOTERIA,CAMPOS DO JORDÃO,11,1991,Empresario
35111471604,TANIA MARA CALVITTI PEREIRA,SÃO PAULO,11,1991,Empresario
35111471639,JOSE DA SILVA CHAGAS,SÃO PAULO,11,1991,Empresario
35111471663,M.O.C. DA VANZO ARMARINHOS,BRAGANÇA PAULISTA,11,1991,Empresario
35111471698,J AMARANTE GUARUJA,GUARUJÁ,11,1991,Empresario
35111471701,M. J. S. RAMOS GUARUJA,GUARUJÁ,11,1991,Empresario
35111471728,SEBASTIAO LIMA DA COSTA,,11,1991,Empresario
35111471736,SUELY STRUBE,,11,1991,Empresario
35111471779,JOSE APARECIDO ALVES CONFECCOES,BOITUVA,11,1991,Empresario
35111471795,MAURO DE SOUZA FERREIRA,MOGI DAS CRUZES,11,1991,Empresario
35111471817,J.A. DE FREITAS FILHO,,11,1991,Empresario
35111471833,ANTONIO APARECIDO BOZINARO,GUAPIAÇU,11,1991,Empresario
35111471850,JOSE MARIA DA SILVA BAR GUARULHOS,,11,1991,Empresario
35111471892,RENATO GOMES ANTONIO,JUNDIAÍ,11,1991,Empresario
35111471922,JOSE RAIMUNDO DA SILVA VIDRACARIA,SÃO PAULO,11,1991,Empresario
35111471931,ABDIAS VIEIRA DE SOUZA,MAUÁ,11,1991,Empresario
35111471957,WILSON PEDROSO DE CASTRO,GUARATINGUETÁ,11,1991,Empresario
35111471973,AGNALDO JOSE AMARAL,UBARANA,11,1991,Empresario
35111472040,MARIA AUGUSTA DE ALMEIDA ABREU CACAPAVA,,11,1991,Empresario
35111472058,LUIZ ADALBERTO RIVOLTA,,11,1991,Empresario
35111472074,SERGIO RICARDO FONTES MAIA PRESENTES,SANTOS,11,1991,Empresario
35111472082,RUBENS DO NASCIMENTO PACHECO REPRESENTACOES,SÃO PAULO,11,1991,Empresario
35111472091,JOSE JORGE BUENO GUARIBA,GUARIBA,11,1991,Empresario
35111472121,ANTONIO LEITE DA SILVA,LIMEIRA,11,1991,Empresario
35111472155,JANDYRA CARUZO SERRA NEGRA,SERRA NEGRA,11,1991,Empresario
35111472163,LUIZ ENRIQUE DE SOUZA IKEDA,SÃO PAULO,11,1991,Empresario
35111472171,LUCINEIDE MAGALI BELLINI PESTANA,,11,1991,Empresario
35111472198,RENATA MARQUES DE OLIVEIRA,AMERICANA,11,1991,Empresario
35111472228,CARMEN SILVIA PEREIRA CASTILHO,CASA BRANCA,11,1991,Empresario
35111472236,JOSE VITOR FERREIRA RIO PARDO,,11,1991,Empresario
35111472287,JOSE AFONSO LOPES DE MACEDO,,11,1991,Empresario
35111472309,MARIA ANTONIA DEVIDES,JALES,11,1991,Empresario
35111472368,CLARICE P BOTURA,SANTO ANDRÉ,11,1991,Empresario
35111472414,SIDNEI MARIANO,RIBEIRÃO PRETO,11,1991,Empresario
35111472431,ORIVALDO MAUCH MILANEZI,AGUAÍ,11,1991,Empresario
35111472457,LENISE ALVES,DOURADO,11,1991,Empresario
35111472473,OLINDA MARIA DOS SANTOS,,11,1991,Empresario
35111472490,ANTONIO LUIZ VIGATTO,,11,1991,Empresario
35111472546,V. B. DE SOUZA MOGI GUACU,MOGI GUAÇU,11,1991,Empresario
35111472571,IVANILDO MENDES DE OLIVEIRA,SÃO ROQUE,11,1991,Empresario
35111472589,CARLOS GOMES CARNEIRO JÚNIOR SERVIÇOS GRÁFICOS,SÃO PAULO,11,1991,Empresario
35111472635,LENIR SALVA DOS SANTOS,,11,1991,Empresario
35111472643,ANGELO GONCALVES CAMPOS CAMPINAS,,11,1991,Empresario
35111472651,ISMAEL BENEDICTO SAO CARLOS,SÃO CARLOS,11,1991,Empresario
35111472678,SIU KOK TI,BOTUCATU,11,1991,Empresario
35111472686,WLADIMIR WIAZOWSKI,SÃO PAULO,11,1991,Empresario
35111472694,ADALTO SOUZA LIMA GUARUJA,,11,1991,Empresario
35111472716,LAERCIO BALDUINO DE SOUZA,BAURU,11,1991,Empresario
35111472775,JULIO A.A. GOUVEIA NETO,,11,1991,Empresario
35111472805,MASAHARU WATANABE MAQUINAS,SÃO PAULO,11,1991,Empresario
35111472813,JOSE LUIZ OLIVEIRA DE SOUZA DOCES,SÃO PAULO,11,1991,Empresario
35111472830,MAURO GARCIA AVANHANDAVA,,11,1991,Empresario
35111472856,MARIZA TEREZA DOS SANTOS FLORES,SÃO PAULO,11,1991,Empresario
35111472864,ANTONIO BARBOSA DA SILVA BAR,SÃO PAULO,11,1991,Empresario
35111472899,ALCIDES PIOVESANA IEPE,IEPÊ,11,1991,Empresario
35111472929,EDUARDO MACIEL COELHO,,11,1991,Empresario
35111473020,ELIO ZELLI FILHO,CAJOBI,11,1991,Empresario
35111473062,EDIVALDO NUNES PEREIRA,,11,1991,Empresario
35111473089,ODAIR JOSE DE PAULA,SÃO PAULO,11,1991,Empresario
35111473097,RENATA PACHECO E CHAVES DOMINICI CONFECCOES,,11,1991,Empresario
35111473143,DAGMAR BATISTA MONTEIRO,,11,1991,Empresario
31209541356,,SAO PAULO,11,1991,Sociedade Limitada
31210010911,,SUMARE,11,1991,Sociedade Limitada
35201676191,MERCEARIA MANDE VIR LTDA.,SOROCABA,11,1991,Sociedade Limitada
35207995515,OCIDENTAL PARTICIPACOES LTDA,SAO PAULO,11,1991,Sociedade Limitada
35207995531,MOVEIS LUNGARNO INDUSTRIA E COMERCIO LTDA,SAO PAULO,11,1991,Sociedade Limitada
35207995540,SILA INDUSTRIA E COMERCIO LTDA,SAO PAULO,11,1991,Sociedade Limitada
35207995558,EXPRESSO FRANCO BRASILEIRO LTDA,SAO PAULO,11,1991,Sociedade Limitada
35207995574,TRANSPORTADORA DE LEITE CAVALLINI LTDA.,FRANCO DA ROCHA,11,1991,Sociedade Limitada
35209768141,CONSTRUTORA ITAPUA LTDA.,SAO PAULO,11,1991,Sociedade Limitada
35209768494,GASALDI COMERCIO E REPRESENTACAO LTDA.,SANTANA DE PARNAIBA,11,1991,Sociedade Limitada
35209768753,CASA DE CARNES BRASILIA DE JUNDIAI LTDA. - M.E.,ITUPEVA,11,1991,Sociedade Limitada
35209770995,JOSE M.JORGE & CIA LTDA.,SAO PAULO,11,1991,Sociedade Limitada
35209814984,LEAO DA TRIBO DE JUDA COMERCIO DE CONFECCOES E CALCADOS LTDA,PENAPOLIS,11,1991,Sociedade Limitada
35209819811,MADEIRALIS LAMINADOS E ACESSORIOS LTDA.,AMERICANA,11,1991,Sociedade Limitada
35210532482,DE ANGELIS INFORMATICA LTDA,CAMPINAS,11,1991,Sociedade Limitada
35210536046,BAVESA VEICULOS E PECAS LTDA.,SAO PAULO,11,1991,Sociedade Limitada
35210537191,EDITUDO COMERCIO E TRANSPORTES LTDA,CARAPICUIBA,11,1991,Sociedade Limitada
35210547340,MAX ALUM ESQUADRIAS DE ALUMINIO LTDA. - M.E.,CAMPINAS,11,1991,Sociedade Limitada
35210549822,AGENCIA INFO BRASIL ASSESSORIA DE IMPRENSA E CONSULTORIA LTDA,SAO PAULO,11,1991,Sociedade Limitada
35210549831,GOTTARDO SILVA E CIA. LTDA.,JAGUARIUNA,11,1991,Sociedade Limitada
35210549857,M.E. SILVA CHAIN E CIA. LTDA. - M.E.,GUARATINGUETA,11,1991,Sociedade Limitada
35210549865,C.M.S. ADMINISTRADORA E CORRETORA DE SEGUROS LTDA.,SAO PAULO,11,1991,Sociedade Limitada
35210549881,ARMENTO'S BAR LTDA. - M.E.,OSASCO,11,1991,Sociedade Limitada
35210549890,BERTHA AUTOMOVEIS LTDA. - M.E.,ITAQUAQUECETUBA,11,1991,Sociedade Limitada
35210549911,HOMEL CONFECCOES LTDA.,SAO PAULO,11,1991,Sociedade Limitada
35210551835,BAR E LANCHES CANTINHO DO AMOR LTDA. - M.E.,GUARULHOS,11,1991,Sociedade Limitada
35210551851,CASA DE LANCHES E REFEICOES ALEANDRA LTDA.,SAO PAULO,11,1991,Sociedade Limitada
35210551878,YUBEPLAN - COMERCIO DE ARTIGOS PARA PRESENTES LTDA,SAO PAULO,11,1991,Sociedade Limitada
35210551886,EDAL COMERCIO E SERVICOS DE ALIMENTACAO LTDA.,SAO PAULO,11,1991,Sociedade Limitada
35210552157,POLEN COMERCIO DE PAPEIS LTDA.,DIADEMA,11,1991,Sociedade Limitada
35210552173,AEROLINK DO BRASIL TECNOLOGIAS LTDA,SAO JOSE DOS CAMPOS,11,1991,Sociedade Limitada
35210552203,BENITO & ALMEIDA LTDA.,ITU,11,1991,Sociedade Limitada
35210552211,EXPRESSO OLIVEIRA CAMPOS LTDA. - M.E.,SAO PAULO,11,1991,Sociedade Limitada
35210552246,BARI COFFEE SHOP COMERCIAL LTDA. - M.E.,SAO PAULO,11,1991,Sociedade Limitada
35210552254,IMADA E BARBOSA LTDA.,JUNDIAI,11,1991,Sociedade Limitada
35210552262,GALVAO E SANTOS LTDA.,JUNDIAI,11,1991,Sociedade Limitada
35210552301,PITUCHA COMERCIO DE CONFECCOES DE FRANCA LTDA. - M.E.,FRANCA,11,1991,Sociedade Limitada
35210552327,EDEGAR ALVES & CIA LTDA,ITAPETININGA,11,1991,Sociedade Limitada
35210552335,AVICOLA E FRIOS TAINA LTDA. - M.E.,PIRAJUI,11,1991,Sociedade Limitada
35210552351,TAGAMI & TAGAMI LTDA.,PIEDADE,11,1991,Sociedade Limitada
35210552360,AUTO MECANICA TONHAO SOROCABA LTDA.,SOROCABA,11,1991,Sociedade Limitada
35210552378,LAUDO CONSTRUTORA LTDA,SAO BERNARDO DO CAMPO,11,1991,Sociedade Limitada
35210552408,MAIA SOROCABA COMPUTADORES & SERVICOS LTDA,SOROCABA,11,1991,Sociedade Limitada
35210552416,C.F. DISTRIBUIDORA DE BEBIDAS LTDA.,SAO PAULO,11,1991,Sociedade Limitada
35210552432,RECAR FUNILARIA E PINTURA LTDA,GUARULHOS,11,1991,Sociedade Limitada
35210552441,BAR E MERCEARIA IRIS GARDEN LTDA.,SAO PAULO,11,1991,Sociedade Limitada
35210552483,MARE MANSA RESTAURANTE E CHOPERIA LTDA. - M.E.,SAO SEBASTIAO,11,1991,Sociedade Limitada
35210552491,MACPAM REPRESENTACAO IMPORTACAO E EXPORTACAO LTDA.,SAO PAULO,11,1991,Sociedade Limitada
35210552521,TRANS BLOCOS E LAJES LTDA,ITARIRI,11,1991,Sociedade Limitada
35210552530,AP E P TELECOMUNICACOES LTDA.,SAO PEDRO,11,1991,Sociedade Limitada
35210552548,TOLEDO GOMES COMERCIO DE TECIDOS LTDA.,SAO PAULO,11,1991,Sociedade Limitada
35210552564,ARROYO AUTOMOVEIS LTDA.,SAO PAULO,11,1991,Sociedade Limitada
35210552602,BORRACHARIA NASCIMENTO GUARUJA LTDA.,GUARUJA,11,1991,Sociedade Limitada
35210552726,COMERCIO DE GENEROS ALIMENTICIOS DEIA LTDA,SAO PAULO,11,1991,Sociedade Limitada
35210552734,COMERCIAL ANTONINI LTDA.,SAO PAULO,11,1991,Sociedade Limitada
35210552769,SERRALHERIA PARKS LTDA. - M.E.,SAO PAULO,11,1991,Sociedade Limitada
35210552793,R.W.D. INSTALADORA E COMERCIO LTDA.,SAO PAULO,11,1991,Sociedade Limitada
35210552807,RESTAURANTE E PIZZARIA BOKABERTA LTDA.,SAO PAULO,11,1991,Sociedade Limitada
35210552815,MOVEIS E DECORACOES BALUARTE LTDA.ME,SAO PAULO,11,1991,Sociedade Limitada
35210552882,COMERCIO DE SORVETES E BOMBONIERI SAMUCA LTDA. - M.E.,SAO PAULO,11,1991,Sociedade Limitada
35210553013,ESPACO RACIONAL COMERCIO DE DIVISORIAS E FORROS LTDA.,SAO PAULO,11,1991,Sociedade Limitada
35210553021,CANTINA CARMEM MIRANDA LTDA,SAO PAULO,11,1991,Sociedade Limitada
35210553030,ANASER INDUSTRIAL E COMERCIAL LTDA.,LORENA,11,1991,Sociedade Limitada
35210553463,MARCENARIA P.B. LTDA.,SAO PAULO,11,1991,Sociedade Limitada
35210553480,AXIOM TECNOLOGIA EM INFORMATICA LTDA.,BARUERI,11,1991,Sociedade Limitada
35210553510,COMERCIO DE PECAS E ASSISTENCIA TECNICA ELETROTEMA LTDA.,OSASCO,11,1991,Sociedade Limitada
35210553552,R.M. LANCE LIVRE REPRESENTACOES E VENDAS LTDA.,SAO PAULO,11,1991,Sociedade Limitada
35210553561,POSSANI E MORALES LTDA.,BIRIGUI,11,1991,Sociedade Limitada
35210553587,CROSS FAST FOOD COMERCIO DE ALIMENTOS LTDA.,SAO PAULO,11,1991,Sociedade Limitada
35210553617,STYLLOS TAPECARIA PARA AUTOS LTDA.,SAO PAULO,11,1991,Sociedade Limitada
35210553625,STAR SHINE BELESA E MODA LTDA. - M.E.,SAO PAULO,11,1991,Sociedade Limitada
35210553633,MONOLU CONFECCOES LTDA,SAO PAULO,11,1991,Sociedade Limitada
35210553641,FLORITELA COMERCIO E DECORACOES LTDA. - M.E.,SAO PAULO,11,1991,Sociedade Limitada
35210553684,COPAD COMERCIO PAULISTA DE DISTRIBUICAO DE HORTIFRUTI LTDA.,SAO PAULO,11,1991,Sociedade Limitada
35210553722,GALVE COMERCIAL LTDA.,SANTO ANDRE,11,1991,Sociedade Limitada
35210553749,DEPOSITO DE MATERIAL PARA CONSTRUCAO MONCOES LTDA.ME,SAO PAULO,11,1991,Sociedade Limitada
35210553757,VGT MODAS E MAGAZINE LTDA ME,SAO PAULO,11,1991,Sociedade Limitada
35210553781,ESPUMATEC INDUSTRIA E COMERCIO SAO CARLOS LTDA. - M.E.,SAO CARLOS,11,1991,Sociedade Limitada
35210553790,PLAFORT COMERCIO E INDUSTRIA DE AUTO PECAS LTDA.,SAO PAULO,11,1991,Sociedade Limitada
35210553803,AGUA FURTADA RESTAURANTE E PROMENADE LTDA.,SANTANA DE PARNAIBA,11,1991,Sociedade Limitada
35210553811,MARIO SERGIO MARCONDES E CIA. LTDA. - M.E.,PORTO FERREIRA,11,1991,Sociedade Limitada
35210553846,BENEDITO CAPPA E CIA. LTDA. - M.E.,IGARACU DO TIETE,11,1991,Sociedade Limitada
35210553862,START-UP CONTROLE AMBIENTAL INDUSTRIA E COMERCIO LTDA,SANTO ANDRE,11,1991,Sociedade Limitada
35210553889,BAR E MERCEARIA A VONA LTDA.,ITAPECERICA DA SERRA,11,1991,Sociedade Limitada
35210553897,AUTO PECAS NOVA YORQUE LTDA.,SANTO ANDRE,11,1991,Sociedade Limitada
35210553919,ECOLOGIA COMERCIO E REPRESENTACAO DE PRODUTOS MECANICOS LTDA.,SAO PAULO,11,1991,Sociedade Limitada
35210553927,DROGARIA PEDREIRA DE STO. AMARO LTDA. - M.E.,SAO PAULO,11,1991,Sociedade Limitada
35210553935,HADA OFICINA DE COSTURA LTDA.,SAO PAULO,11,1991,Sociedade Limitada
35210553943,CANES TRANSPORTES E LOGISTICA EXPRESS LTDA.,SOROCABA,11,1991,Sociedade Limitada
35210553994,NEGA COMERCIO E RECUPERACAO DE AUTOS LTDA,FRANCO DA ROCHA,11,1991,Sociedade Limitada
35210554001,TR SHOES ATACADISTA DE CALCADOS LTDA,FRANCA,11,1991,Sociedade Limitada
35210554010,SELMA NADIA GRAHL CATOZZI DEL RIO E CIA. LTDA.,CAMPINAS,11,1991,Sociedade Limitada
35210554036,CASA DE MATERIAIS PARA CONSTRUCAO DIAS & DIAS LTDA,IPERO,11,1991,Sociedade Limitada
35210554044,DATA FROTA COMERCIO CONSULTORIA E SERVICOS LTDA.,SANTOS,11,1991,Sociedade Limitada
35210554052,VIDA E BENS ADMINISTRADORA E CORRETORA DE SEGUROS LTDA.,SAO PAULO,11,1991,Sociedade Limitada
