NIRE,Empresa,Município,Month,Year,Type
35210561229,DAL PACK EMBALAGENS LTDA,SAO PAULO,11,1991,Sociedade Limitada
35210561237,DARMAR REFEICOES LTDA,SAO PAULO,11,1991,Sociedade Limitada
35210561296,OGURA COMERCIO DE GENEROS ALIMENTICIOS LTDA.,ITU,11,1991,Sociedade Limitada
35210561318,QUITANDA E MERCEARIA SETE ESTRELA LTDA.,SANTA IZABEL,11,1991,Sociedade Limitada
35210561369,GARANT COMERCIO E REPRESENTACOES DE PRODUTOS ALIMENTICIOS LTDA.,SAO JOSE DO RIO PRETO,11,1991,Sociedade Limitada
35210561385,PAO DE QUEIJO E LANCHES P.M.M. LTDA.,SAO PAULO,11,1991,Sociedade Limitada
35210561407,CON & SULCOMERCIO E SERVICOS LTDA.,SANTOS,11,1991,Sociedade Limitada
35210561440,CLINICA DR RAPHAEL LTDA,OSASCO,11,1991,Sociedade Limitada
35210561466,TRATOROMA RECUPERADORA DE TRATORES LTDA. - M.E.,PIRACICABA,11,1991,Sociedade Limitada
35210561482,FRANGUITTOS ET PEIXITTOS COMERCIO DE ALIMENTOS LTDA.,SAO CAETANO DO SUL,11,1991,Sociedade Limitada
35210561491,MERCADINHO VEREDAS LTDA.,SAO PAULO,11,1991,Sociedade Limitada
35210561504,JOTA CARVALHO ELETRONICA LTDA. - M.E.,SAO PAULO,11,1991,Sociedade Limitada
35210561521,JOAO MARCOS CONSULTORIA E ASSESSORIA EM INFORMATICA LTDA,CAMPINAS,11,1991,Sociedade Limitada
35210561555,DISTRIBUIDORA DE FRIOS NILOPOLIS LTDA.,CAMPINAS,11,1991,Sociedade Limitada
35210561563,ARKA COMERCIO DE FERRAMENTAS LTDA,CAMPINAS,11,1991,Sociedade Limitada
35210561571,B.K.P. CALCADOS E CONFECCOES LTDA.,CAMPINAS,11,1991,Sociedade Limitada
35210561628,YACH INDUSTRIA E COMERCIO DE ROUPAS LTDA.,SAO PAULO,11,1991,Sociedade Limitada
35210561636,LA FLEUR BLANCHE COMERCIO DE ROUPAS LTDA.,TAUBATE,11,1991,Sociedade Limitada
35210561644,COMERCIAL R.G. DE PIRACICABA LTDA.,PIRACICABA,11,1991,Sociedade Limitada
35210561661,J. ROVAL INDUSTRIA E COMERCIO DE MOVEIS LTDA. - M.E.,VOTUPORANGA,11,1991,Sociedade Limitada
35210561679,DEL'RENTE SISTEMAS DE TELECOMUNICACOES E COMERCIO LTDA.,SAO PAULO,11,1991,Sociedade Limitada
35210561687,COMANDO COMERCIO DE MATERIAIS ELETRICOS LTDA.,CAMPINAS,11,1991,Sociedade Limitada
35210561695,RELOJOARIA YONG LTDA - M.E.,CAMPINAS,11,1991,Sociedade Limitada
35210561733,SENSUS INFORMATICA LTDA.,GUARULHOS,11,1991,Sociedade Limitada
35210561741,T.S. COMERCIO DE CONFECCOES LTDA.,SAO JOSE DO RIO PRETO,11,1991,Sociedade Limitada
35210561750,CHEIRO DA TERRA COMERCIO DE PLANTAS E PAISAGISMO LTDA. - M.E.,SAO PAULO,11,1991,Sociedade Limitada
35210561784,FALZONI SERVICOS DE APOIO ADMINISTRATIVO LTDA,SAO PAULO,11,1991,Sociedade Limitada
35210561792,ZUKEN MODAS LTDA,SAO PAULO,11,1991,Sociedade Limitada
35210561806,AVICOLA CAMPOS ELISIOS LTDA.,SAO PAULO,11,1991,Sociedade Limitada
35210561814,HOLLERBACH INDUSTRIA E COMERCIO DE MAQUINAS LTDA.,VALINHOS,11,1991,Sociedade Limitada
35210561831,"BRASTEK COMERCIO DE ELETRODOMESTICOS E PECAS LTDA ""REGISTRO SUSPENSO POR ORDEM JUDICIAL""",SAO PAULO,11,1991,Sociedade Limitada
35210561857,TEKLA COMERCIO DE INSTRUMENTOS MUSICAIS E PROMOCOES ARTISTICAS LTDA,TATUI,11,1991,Sociedade Limitada
35210561865,TALIS COMERCIO DE MOVEIS LTDA - ME,SAO PAULO,11,1991,Sociedade Limitada
35210561903,VIANCAR AUTO PECAS LTDA.,OSASCO,11,1991,Sociedade Limitada
35210561920,WANIA SOARES DA COSTA CARVALHO & CIA LTDA,SAO PEDRO,11,1991,Sociedade Limitada
35210561938,MERCADINHO ELISA MARIA LTDA.,SAO PAULO,11,1991,Sociedade Limitada
35210561962,LUNA COMERCIO DE AUTO PECAS LTDA.,PIRACICABA,11,1991,Sociedade Limitada
35210561971,SORRISO DO BELEM BAR E RESTAURANTE LTDA. - M.E.,SAO PAULO,11,1991,Sociedade Limitada
35210561989,VICTOR- COMERCIO DE VESTUARIO LTDA ME,COTIA,11,1991,Sociedade Limitada
35210562004,DECLIC COMERCIO DE EQUIPAMENTOS ELETRONICOS E SERVICOS LTDA.,SAO PAULO,11,1991,Sociedade Limitada
35210562012,JORNAIS TRP IMPORTACAO E EXPORTACAO DE MAQUINAS GRAFICAS EM GERAL LTDA.,PIRACICABA,11,1991,Sociedade Limitada
35210562021,GUARUBOLL SPORTS E LANCHONETE LTDA.,GUARULHOS,11,1991,Sociedade Limitada
35210562047,ADANLEX BAZAR E PAPELARIA LTDA.,GUARULHOS,11,1991,Sociedade Limitada
35210562055,WALK DOOR PUBLICIDADE LTDA.,SAO PAULO,11,1991,Sociedade Limitada
35210562136,EMITEL COMERCIO MONTAGENS E INSTALACOES ELETRICAS LTDA.,JUNDIAI,11,1991,Sociedade Limitada
35210562144,IN HOUSE EDITORA E GRAFICA LTDA,JUNDIAI,11,1991,Sociedade Limitada
35210562161,AMERICAN WAY INDUSTRIA E COMERCIO DE CONFECCOES LTDA.,SAO PAULO,11,1991,Sociedade Limitada
35210562195,BAR E BOATE RIB SIL LTDA. - M.E.,SAO PAULO,11,1991,Sociedade Limitada
35210562209,LOS QUERANDIES TRANSPORTES COMERCIO E REPRESENTACAO LTDA.,SAO PAULO,11,1991,Sociedade Limitada
35210562225,PAULISTATEC COMERCIO E SERVICOS LTDA.,SAO PAULO,11,1991,Sociedade Limitada
35210562241,PERATELLI COMERCIO E REPRESENTACOES DE PRODUTOS AGROPECUARIOS LTDA.,LEME,11,1991,Sociedade Limitada
35210562250,MARISOL ARTESANATOS E PRESENTES LTDA.,ARACATUBA DA SERRA,11,1991,Sociedade Limitada
35210562268,BAZAR SOGO LTDA.,SAO PAULO,11,1991,Sociedade Limitada
35210562276,CYMES VIAGENS E TURISMO LTDA.,SAO PAULO,11,1991,Sociedade Limitada
35210562284,BAR E LANCHES 671 LTDA.,SAO CAETANO DO SUL,11,1991,Sociedade Limitada
35210562292,T. OFFICIAL JEANS CONFECCOES LTDA.,SAO PAULO,11,1991,Sociedade Limitada
35210562314,OSWALDO'S TRANSPORTES LTDA.,SANTOS,11,1991,Sociedade Limitada
35210562331,NISHIMURA COMERCIO DE CALCADOS LTDA.,MOGI DAS CRUZES,11,1991,Sociedade Limitada
35210562349,WJM COMERCIO DE ALIMENTOS LTDA - M.E.,SANTO ANDRE,11,1991,Sociedade Limitada
35210562357,DISTRIBUIDORA DE BEBIDAS A.B.C. LTDA.,MAUA,11,1991,Sociedade Limitada
35210562365,N.R. VIEIRA COMERCIO E ARTEFATOS DE MADEIRA LTDA.,SAO PAULO,11,1991,Sociedade Limitada
35210562403,TRANS PAN AMERICANO TRANSPORTES LTDA.,SAO PAULO,11,1991,Sociedade Limitada
35210562446,S.B.E.P. SISTEMA BRASILEIRO DE EVENTOS E PROPAGANDA LTDA.,SAO PAULO,11,1991,Sociedade Limitada
35210562462,ROCHA E SANTOS RACOES LTDA.,SAO PAULO,11,1991,Sociedade Limitada
35210562489,KLAREAR SISTEMAS DE ILUMINACAO LTDA,VOTUPORANGA,11,1991,Sociedade Limitada
35210562519,PEREIRA LOPES CORRETORA DE SEGUROS LTDA.,SAO PAULO,11,1991,Sociedade Limitada
35210562543,HIELEBE HIDRAULICA E ELETRICA LTDA. - M.E.,VINHEDO,11,1991,Sociedade Limitada
35210562560,ASTECA PRESENTES LTDA. - M.E.,PEDREIRA,11,1991,Sociedade Limitada
35210562594,SESSENTA MINUTOS INDUSTRIA E COMERCIO DE MODAS LTDA.,SAO PAULO,11,1991,Sociedade Limitada
35210562608,CELI ASSESSORIA E COMERCIAL EM INFORMATICA LTDA. - M.E.,SAO PAULO,11,1991,Sociedade Limitada
35210562624,BAR E MERCEARIA CAIPIRA LTDA.,SAO SEBASTIAO,11,1991,Sociedade Limitada
35210562632,WALK TRAVEL VIAGENS E TURISMO LTDA.,SAO PAULO,11,1991,Sociedade Limitada
35210562641,ATORAMA COMERCIO DE FERRAMENTAS PARA MADEIRAS LTDA. - M.E.,SAO PAULO,11,1991,Sociedade Limitada
35210562659,MEPA'S ABASTECIMENTO COMERCIAL LTDA,RIO CLARO,11,1991,Sociedade Limitada
35210562667,JERSI JORGE DA COSTA MUBBACHE E CIA. LTDA.,SANTA BARBARA D'OESTE,11,1991,Sociedade Limitada
35210562683,COMERCIO DE CEREAIS CAMARGO DA SILVA LTDA,ARACOIABADA SERRA,11,1991,Sociedade Limitada
35210562705,EXPAND MOVEIS E DECORACOES LTDA.,SAO PAULO,11,1991,Sociedade Limitada
35210562721,LAVORE CONSTRUTORA LTDA.,OSASCO,11,1991,Sociedade Limitada
35210562730,TECNOART INDUSTRIA COMERCIO E DECORACOES LTDA. - M.E.,SAO PAULO,11,1991,Sociedade Limitada
35210562748,PEDRO MAR COMERCIAL LTDA,DIADEMA,11,1991,Sociedade Limitada
35210562756,DISTRIBUIDORA DO VALLE LTDA.,GUARATINGUETA,11,1991,Sociedade Limitada
35210562764,ESPACO LUMIAR PRODUCOES ARTISTICAS LTDA,SAO PAULO,11,1991,Sociedade Limitada
35210562772,CONFECCOES LUICCI LTDA.,CAIEIRAS,11,1991,Sociedade Limitada
35210562781,AUTO ELETRICO E ACESSORIOS TAYNA LTDA,SAO PAULO,11,1991,Sociedade Limitada
35210562799,O ACARAJE SUCOS E LANCHES LTDA.,SAO PAULO,11,1991,Sociedade Limitada
35210562811,TRANSPORTADORA TRANSKAUAN LTDA.,MAUA,11,1991,Sociedade Limitada
35210562861,TRATO COMERCIO FRANCHISING E PARTICIPACOES LTDA.,SAO JOSE DOS CAMPOS,11,1991,Sociedade Limitada
35210562870,LIVRARIA E PAPELARIA SAO JOSE LTDA.,PONTAL,11,1991,Sociedade Limitada
35210562900,C. PERINI E PERINI LTDA. - M.E.,BARRETOS,11,1991,Sociedade Limitada
35210562918,DIAS & VIEIRA LTDA.,DOIS CORREGOS,11,1991,Sociedade Limitada
35210562926,CELLERECO COMERCIO E REPRESENTACOES LTDA.,CAMPINAS,11,1991,Sociedade Limitada
35210562934,"GONCALVES, CUNHA & CIA LTDA",CAMPINAS,11,1991,Sociedade Limitada
35210562942,ROSA & BERTONI AUTO PECAS LTDA,CAMPINAS,11,1991,Sociedade Limitada
35210562951,CANE E GATTO COMERCIO DE RACOES LTDA. - M.E.,CAMPINAS,11,1991,Sociedade Limitada
35210562969,LOURENCE & LOURENCE COMERCIAL E REPRESENTACOES LTDA.,SAO PAULO,11,1991,Sociedade Limitada
35210562993,A.M.C. AUTOMECANICA E COMERCIO LTDA.,SAO PAULO,11,1991,Sociedade Limitada
35210563027,VILELLA E GIRONI REPRESENTACOES COMERCIAL LTDA.,SAO PAULO,11,1991,Sociedade Limitada
35210563060,JOSITEL COMERCIO DE PECAS E APARELHOS TELEFONICOS LTDA. - M.E.,ITAPIRA,11,1991,Sociedade Limitada
35210563078,MAGAZINE GOLD RIVER LTDA. - M.E.,ITAPETININGA,11,1991,Sociedade Limitada
35210563094,CENTER SUL VEICULOS LTDA.,SAO PAULO,11,1991,Sociedade Limitada
35210563116,DELIRIOS MOTEL LTDA. - M.E.,PRAIA GRANDE,11,1991,Sociedade Limitada
35210563124,MADEIREIRA CERCA VIVA LTDA.,TUPA,11,1991,Sociedade Limitada
35210563132,MATELASSE EDREDON E CIA. LTDA.,TIETE,11,1991,Sociedade Limitada
35210563141,AJR COMERCIO E JATEAMENTO LTDA,CACAPAVA,11,1991,Sociedade Limitada
35210563159,VASCONCELOS COMERCIAL DE BEBIDAS E DOCES LTDA,ITAPECERICA DA SERRA,11,1991,Sociedade Limitada
35210563183,PROJEMAQ COMERCIO DE AUTO PECAS E SERVICOS DE USINAGEM LTDA,CARAPICUIBA,11,1991,Sociedade Limitada
35210563213,A.A.D. CONFECCOES LTDA.,SAO PAULO,11,1991,Sociedade Limitada
35210563230,PADARIA CONFEITARIA E LANCHONETE CLEOCLEI LTDA. - M.E.,SANTA BARBARA D'OESTE,11,1991,Sociedade Limitada
35210563248,CAVIL COMERCIO E CONSTRUCOES LTDA.,AMERICANA,11,1991,Sociedade Limitada
35210563281,SILBRAZ REFORMAS E COMERCIO DE PECAS E MAQUINAS AGRICOLAS LTDA.,CAJOBI,11,1991,Sociedade Limitada
35210563370,ROSEMIR APARECIDO VITTI E CIA. LTDA.,RIO CLARO,11,1991,Sociedade Limitada
35210563388,PEDROSO E PAGNAN COMERCIO E REPRESENTACOES LTDA.,SAO PAULO,11,1991,Sociedade Limitada
35210563396,TYLLA'S RESTAURANTE LTDA. - M.E.,TAUBATE,11,1991,Sociedade Limitada
35210563400,SIMILAR ARTES GRAFICAS LTDA.,SAO PAULO,11,1991,Sociedade Limitada
35210563426,LUIZ CARLOS MININEL E CIA. LTDA.,SAO CARLOS,11,1991,Sociedade Limitada
35210563442,KORAGE CONFECCOES LTDA. - M.E.,LIMEIRA,11,1991,Sociedade Limitada
35210563469,FREEWAY - SERVICOS DE COBRANCAS S/S LTDA,PRESIDENTE PRUDENTE,11,1991,Sociedade Limitada
35210563485,ELETRONICA COTIA LTDA. - M.E.,COTIA,11,1991,Sociedade Limitada
35210563493,FORBRALI FORNECEDORA BRASILEIRA DE ALIMENTOS LTDA,GUARULHOS,11,1991,Sociedade Limitada
35210563507,A.B.L. SISTEMAS E AUTOMOCAO COMERCIAL LTDA.,SAO PAULO,11,1991,Sociedade Limitada
35210563566,CAMILO E PEDROCHI LTDA,BEBEDOURO,11,1991,Sociedade Limitada
35210563574,COMERCIAL CARDOSO POCOS ARTESIANOS LTDA,MONCOES,11,1991,Sociedade Limitada
35210563612,PULICI COMERCIO E REPRESENTACAO LTDA.,CAMPINAS,11,1991,Sociedade Limitada
35210563621,HOSPEDARIA RCD LTDA.,ITU,11,1991,Sociedade Limitada
35210563639,TRANSPORTADORA E DISTRIBUIDORA DE CARNES E LATICINIO NEVES LTDA,SAO ROQUE,11,1991,Sociedade Limitada
35210563647,ART N SURFING INDUSTRIA E COMERCIO DE CONFECCOES LTDA.,SAO PAULO,11,1991,Sociedade Limitada
35210563655,AUGUSTU'S COMERCIO DE CIGARROS LTDA.,SAO PAULO,11,1991,Sociedade Limitada
35210563663,CASA DE CARNES M.J. CACEZES LTDA.,JUNDIAI,11,1991,Sociedade Limitada
35210563671,V.E. COR COMERCIO DE TINTAS LTDA.,SAO PAULO,11,1991,Sociedade Limitada
35210563698,RADIAL PARTICIPACOES LTDA.,SAO PAULO,11,1991,Sociedade Limitada
35210563710,PANIFICADORA SAO JUDAS TADEU LTDA. - M.E.,BRAGANCA PAULISTA,11,1991,Sociedade Limitada
35210563728,LOCACAO DE CAMINHOES E TRANSPORTES CONFIANCA LTDA.,SAO PAULO,11,1991,Sociedade Limitada
35210563736,ARTE FINAL COMERCIO E INDUSTRIA DE BRINDES LTDA,SAO PAULO,11,1991,Sociedade Limitada
35210563744,ANALEN MATERIAL HOSPITALAR LTDA.,SAO PAULO,11,1991,Sociedade Limitada
35210563809,SERCOM SERVICOS E COMERCIO DE INFORMATICA LTDA,SAO PAULO,11,1991,Sociedade Limitada
35210563817,HENRIBOR COMERCIO E REPRESENTACAO DE ARTEFATOS DE BORRACHA,SANTO ANDRE,11,1991,Sociedade Limitada
35210563833,BAVARIAN TINTAS E FERRAGENS LTDA.,RIBEIRAO PIRES,11,1991,Sociedade Limitada
35210563841,DONY ARTES GRAFICAS LTDA,SAO PAULO,11,1991,Sociedade Limitada
35210563876,FRANCELINO FERREIRA DOS SANTOS & CIA. LTDA,SAO JOAQUIM DA BARRA,11,1991,Sociedade Limitada
35210563884,MF TRES COMERCIO E PARTICIPACOES LTDA.,SAO PAULO,11,1991,Sociedade Limitada
35210563892,CAR HOLIC COMERCIO DE AUTOMOVEIS LTDA.,SAO PAULO,11,1991,Sociedade Limitada
35210563914,START TRANSPORTES LTDA.,GUARULHOS,11,1991,Sociedade Limitada
35210563931,JAMBLOCO INDUSTRIA E COMERCIO LTDA. - M.E.,CAMPINAS,11,1991,Sociedade Limitada
35210563973,TORI YA AVICOLA E ROTISSERIE LTDA. - M.E.,SAO JOSE DOS CAMPOS,11,1991,Sociedade Limitada
35210563981,DROGARIA PEREIRA'S LTDA.,BRAGANCA PAULISTA,11,1991,Sociedade Limitada
35210563990,CESICON CONFECCAO LTDA.,CAMPINAS,11,1991,Sociedade Limitada
35210564007,C SOARES & F ZANGLA LTDA.,GARCA,11,1991,Sociedade Limitada
35210564023,STAMP STEEL INDUSTRIA E COMERCIO LTDA.,SAO PAULO,11,1991,Sociedade Limitada
35210564091,VENTILUSTRE UTILIDADES DOMESTICAS LTDA. - M.E.,CATANDUVA,11,1991,Sociedade Limitada
35210564104,MGR FUNILARIA E PINTURA LTDA.,SAO PAULO,11,1991,Sociedade Limitada
35210564112,LAJES UNIAO LTDA.,SAO MANUEL,11,1991,Sociedade Limitada
35210564121,RJ DE SOUZA & SOUZA LTDA,CAMPINAS,11,1991,Sociedade Limitada
35210564139,ELETRO MOVEIS YPE LTDA. - M.E.,CAPIVARI,11,1991,Sociedade Limitada
35210564147,VILLA FLORI INDUSTRIA E COMERCIO DE CONFECCOES LTDA.,SAO PAULO,11,1991,Sociedade Limitada
35210564155,BAKERY INDUSTRIA METALURGICA LTDA,SAO PAULO,11,1991,Sociedade Limitada
35210564163,TINHOS RESTAURANTE LTDA,INDAIATUBA,11,1991,Sociedade Limitada
35210564171,M.P.N. MATERIAL PARA CONSTRUCAO LTDA,INDAIATUBA,11,1991,Sociedade Limitada
35210564236,F. HAUPTMANN ADMINISTRACAO E CORRETAGEM DE SEGUROS LTDA.,EMBU,11,1991,Sociedade Limitada
35210564244,A.R. SONTINI E MENDONCA LTDA. - M.E.,FRANCA,11,1991,Sociedade Limitada
35210564252,A. RENADI FLORES LTDA. - M.E.,JUNDIAI,11,1991,Sociedade Limitada
35210564261,MERCIA & MARISA COMERCIO DO VESTUARIO LTDA.,SAO PAULO,11,1991,Sociedade Limitada
35210564279,MAZZEO COMERCIAL E DISTRIBUIDORA LTDA.,SAO PAULO,11,1991,Sociedade Limitada
35210564287,STELCO - MERCANTIL LTDA,SAO PAULO,11,1991,Sociedade Limitada
35210564295,ATHAYDE INDUSTRIA E COMERCIO DE ARTEFATOS DE MADEIRA LTDA.,GUARATINGUETA,11,1991,Sociedade Limitada
35210564309,MY FLOWER'S COMERCIO E DECORACOES LTDA.,SAO PAULO,11,1991,Sociedade Limitada
35210564317,CHOCOLATES COSME E DAMIAO LTDA.,AMPARO,11,1991,Sociedade Limitada
35210564325,EREALDO FRANCISCO MORELLI E CIA. LTDA.,AMPARO,11,1991,Sociedade Limitada
35210564350,GALO PSITA COMERCIO E REPRESENTACOES LTDA.,SAO PAULO,11,1991,Sociedade Limitada
35210564392,A.C. COGHI COMERCIO E SERVICOS GRAFICOS LTDA. - M.E.,CARAPICUIBA,11,1991,Sociedade Limitada
35210564406,BOMBINI COMERCIO DE CONFECCOES LTDA. - M.E.,PRESIDENTE PRUDENTE,11,1991,Sociedade Limitada
35210564414,FERUNO COMERCIAL LTDA.,SAO PAULO,11,1991,Sociedade Limitada
35210564422,AUTO MECANICA NUNES E MELO LTDA.,SANTOS,11,1991,Sociedade Limitada
35210564449,ADELAIDE INDUSTRIA E COMERCIO DE PRODUTOS ALIMENTICIOS LTDA. - M.E.,SAO PAULO,11,1991,Sociedade Limitada
35210564457,BETARA NYMO COMERCIO E REPRESENTACOES LTDA,SAO PAULO,11,1991,Sociedade Limitada
35210564465,MULTITELA CAROLA LTDA.,ANALANDIA,11,1991,Sociedade Limitada
35210564473,SNEBUR LTDA.,SAO PAULO,11,1991,Sociedade Limitada
35210564481,CASA DO JARDINEIRO PAISAGISMO LTDA,SAO PAULO,11,1991,Sociedade Limitada
35210564490,"CR - PARTICIPACOES, IMPORTACAO E EXPORTACAO LTDA",SAO PAULO,11,1991,Sociedade Limitada
35210564511,PANIFICADORA PAN NATURA LTDA. - M.E.,LIMEIRA,11,1991,Sociedade Limitada
35210564520,B.J. VEICULOS LTDA.,LIMEIRA,11,1991,Sociedade Limitada
35210564554,LECANO & LESCANO LTDA.,GUARACAI,11,1991,Sociedade Limitada
35210564562,OLIVIERI BONILHA & CIA LTDA,SAO PAULO,11,1991,Sociedade Limitada
35210564571,COMERCIO ARTEZANAL INCA LTDA. - M.E.,COTIA,11,1991,Sociedade Limitada
35210564589,MODAS CASA COREIA LTDA. - M.E.,APARECIDA,11,1991,Sociedade Limitada
35210564627,AZUMA & CIA LTDA,CACAPAVA,11,1991,Sociedade Limitada
35210564635,CAPACITEC COMERCIO DE MATERIAIS E SEGURANCA ELETRONICA LTDA,SAO PAULO,11,1991,Sociedade Limitada
35210564643,UNIPRES IMPORTACAO E EXPORTACAO LTDA.,CURITIBA,11,1991,Sociedade Limitada
35210564651,COUTINHO ACESSORIOS PARA CHURRASQUEIRA LTDA,SAO PAULO,11,1991,Sociedade Limitada
35210564660,ALEXIO FOSCHINI E CIA. LTDA.,DOURADO,11,1991,Sociedade Limitada
35210564678,CONSMAR PECAS E SERVICOS LTDA.,SAO PAULO,11,1991,Sociedade Limitada
35210564686,MARGOT PICCHI VIAGENS E TURISMO LTDA,SAO PAULO,11,1991,Sociedade Limitada
35210564724,CASA DE RACOES CASTELLI LTDA,GUARULHOS,11,1991,Sociedade Limitada
35210564732,OMINI SPORT CENTER LTDA.,SAO PAULO,11,1991,Sociedade Limitada
35210564741,H.L. COMERICO DE ARTEZANATOS LTDA.,SAO PAULO,11,1991,Sociedade Limitada
35210564775,BANANIKA COMERCIO E INDUSTRIA DE PRODUTOS ALIMENTICIOS LTDA.,SAO PAULO,11,1991,Sociedade Limitada
35210564791,JAC ADMINISTRACAO DE BENS E PARTICIPACOES LTDA,SAO VICENTE,11,1991,Sociedade Limitada
35210564813,DROGARIA ARTHFARMA LTDA. - M.E.,COTIA,11,1991,Sociedade Limitada
35210564821,LUIZ C. GENTINA LTDA,AMPARO,11,1991,Sociedade Limitada
35210564830,ACARA NATACAO E COMERCIO LTDA. - M.E.,ITAPETININGA,11,1991,Sociedade Limitada
35210564848,"SEDULUS, ENGENHARIA E REPRESENTACOES LTDA.",SANTO ANDRE,11,1991,Sociedade Limitada
35210564872,TRANSPORTADORA DOMENINO LTDA.,CARAPICUIBA,11,1991,Sociedade Limitada
35210564929,FALCONARA EDITORACAO GRAFICA LTDA,SAO PAULO,11,1991,Sociedade Limitada
35210564937,DREAM SELLERS PRODUCOES COMERCIAIS E ARTISTICAS LTDA.,SAO PAULO,11,1991,Sociedade Limitada
35210564953,FONSECA E FONSECA LTDA.,LIMEIRA,11,1991,Sociedade Limitada
35210564970,DIAS E CARVALHO COMERCIAL LTDA. - M.E.,VOTUPORANGA,11,1991,Sociedade Limitada
35210564988,LIM BAP MERCEARIA LTDA.,VOTUPORANGA,11,1991,Sociedade Limitada
35210564996,ASSEPLAM COMERCIO E MONTAGENS ELETRICAS LTDA.,JUNDIAI,11,1991,Sociedade Limitada
35210565011,RENOIR TEXTIL COMERCIO DE BIJUTERIAS LTDA,GUARULHOS,11,1991,Sociedade Limitada
35210565046,LAVA RAPIDO E LANCHONETE ITUPEVA LTDA. - M.E.,ITUPEVA,11,1991,Sociedade Limitada
35210565054,PEZZOLITO & PEREIRA LTDA.,CATANDUVA,11,1991,Sociedade Limitada
35210565062,LNS REPRESENTACOES DE EMBALAGENS LTDA,SOROCABA,11,1991,Sociedade Limitada
35210565071,TROPICAL COMERCIO DE DERIVADOS DE PETROLEO LTDA.,MONTE MOR,11,1991,Sociedade Limitada
35210565097,MILLY INDUSTRIA E COMERCIO LTDA.,SAO PAULO,11,1991,Sociedade Limitada
35210565101,TRANSPORTES RODOVIARIOS J.F.F. LTDA.,SAO PAULO,11,1991,Sociedade Limitada
35210565178,VULCOTEX VULCANIZACAO DE CORREIAS LTDA. - M.E.,ARARAQUARA,11,1991,Sociedade Limitada
35210565186,COMERCIAL SANTOS E BONIFACIO LTDA.,SOROCABA,11,1991,Sociedade Limitada
35210565216,PRESENTES MARINA DE IPERO LTDA.,IPERO,11,1991,Sociedade Limitada
35210565267,SANCHEZ & SANCHEZ COMERCIO DE MATERIAIS DE CONSTRUCAO E LIMPEZA LTDA,SAO PAULO,11,1991,Sociedade Limitada
35210565305,FRENTE E VERSO ARTE EM CONFECCOES LTDA.,SAO PAULO,11,1991,Sociedade Limitada
35210565313,INDUSTRIA DE MOVEIS CIDADE JARDIM LTDA. - M.E.,SOROCABA,11,1991,Sociedade Limitada
35210565356,CARDINALLI COMERCO DE PRESENTES LTDA.,PIRACICABA,11,1991,Sociedade Limitada
35210565372,DAKHLA DO BRASIL COMERCIAL IMPORTACAO EXPORTACAO LTDA.,SAO PAULO,11,1991,Sociedade Limitada
35210565402,CONCREPIRES INDUSTRIA E COMERCIO DE ARTEFATOS DE CIMENTO LTDA.,ARUJA,11,1991,Sociedade Limitada
35210565411,L.A.C.F. COMERCIO DE FERRAGENS LTDA. - M.E.,SAO BERNARDO DO CAMPO,11,1991,Sociedade Limitada
35210565445,DADALTO CALDEIRARIA E MECANICA LTDA. - M.E.,JAU,11,1991,Sociedade Limitada
35210565488,MINIMERCADO PARATY CUBATAO LTDA.,CUBATAO,11,1991,Sociedade Limitada
35210565518,A.M.F.P. COMERCIO DE ROUPAS E ACESSORIOS LTDA,CAMPINAS,11,1991,Sociedade Limitada
35210565526,KOMAD COMERCIO DE MADEIRAS LTDA. - M.E.,CAMPINAS,11,1991,Sociedade Limitada
35210565542,SQF REPRESENTACAO COMERCIAL LTDA.,SAO PAULO,11,1991,Sociedade Limitada
35210565551,C.B.C COMERCIO DE ARTEFATOS DE ARAME LTDA,SAO PAULO,11,1991,Sociedade Limitada
35210565569,COSTA CARVALHO COMERCIO E CONSTRUCOES LTDA.,SAO PAULO,11,1991,Sociedade Limitada
35210565577,L.P. MANUTENCAO E COMERCIO DE EQUIPAMENTOS TELEFONICOS LTDA. - M.E.,SAO PAULO,11,1991,Sociedade Limitada
35210565585,MEDRADO PROMOCOES ESPORTIVAS LTDA,SAO PAULO,11,1991,Sociedade Limitada
35210565593,S.N.D. INFORMATICA COMERCIO IMPORTACAO E EXPORTACAO LTDA.,SAO PAULO,11,1991,Sociedade Limitada
35210565631,COBERSAN CONSTRUCOES METALICAS LTDA.,SAO VICENTE,11,1991,Sociedade Limitada
35210565658,LANCHEMANIA LANCHONETE E SORVETERIA LTDA.,ATIBAIA,11,1991,Sociedade Limitada
35210565674,CREMASCO E BERTIPAGLIA LTDA. - M.E.,INDAIATUBA,11,1991,Sociedade Limitada
35210565691,ALFREDO CARNICELLI & CIA LTDA,BAURU,11,1991,Sociedade Limitada
35210565704,SICCA & SICCA LTDA.ME,ASSIS,11,1991,Sociedade Limitada
35210565712,MADEIREIRA YPE LTDA.,SAO PAULO,11,1991,Sociedade Limitada
35210565721,TEK GAMES COMERCIAL LTDA,SAO PAULO,11,1991,Sociedade Limitada
35210565739,JOSIL EMPREITEIRA DE MAO DE OBRA LTDA,DIADEMA,11,1991,Sociedade Limitada
35210565747,RIBEIRAO METAL ESTRUTURAS METALICAS LTDA.,RIBEIRAO PIRES,11,1991,Sociedade Limitada
35210565771,LAMPE MATERIAIS ELETRICOS LTDA.,SAO PAULO,11,1991,Sociedade Limitada
35210565801,DISTRIBUIDORA DE BEBIDAS NOVA CANAA LTDA.,SAO PAULO,11,1991,Sociedade Limitada
35210565810,MERCEARIA E EMPORIO SALVI LTDA. - M.E.,ORLANDIA,11,1991,Sociedade Limitada
35210565828,"P.R.E. COMERCIO, INSTALACAO E MANUTENCAO TELEFONICO LTDA",SAO PAULO,11,1991,Sociedade Limitada
35210565836,DOCEU'S MODAS LTDA.,SANTOS,11,1991,Sociedade Limitada
35210565852,A.Z.P. DESIGN E COMERCIO LTDA.,SAO PAULO,11,1991,Sociedade Limitada
35210565861,EMBRAMEDICA COMERCIO DE MATERIAL HOSPITALAR LTDA.,OURINHOS,11,1991,Sociedade Limitada
35210565879,MATERIAL DE CONSTRUCAO CIDA LTDA,SAO PAULO,11,1991,Sociedade Limitada
35210565887,BAR ARTE MODERNA LTDA,SAO PAULO,11,1991,Sociedade Limitada
35210565895,JOSYLVI COMERCIO DE MATERIAIS PARA CONSTRUCAO LTDA,SAO JOSE DOS CAMPOS,11,1991,Sociedade Limitada
35210565909,TIE DYE TINTURARIA E ESTAMPARIA LTDA.,SAO PAULO,11,1991,Sociedade Limitada
35210565917,NOSSA SORVETERIA LTDA. - M.E.,AMERICANA,11,1991,Sociedade Limitada
35210565925,SYSPEC INFORMATICA LTDA.,RIBEIRAO PRETO,11,1991,Sociedade Limitada
35210565933,EMPMAQ COMERCIO DE PECAS E SERVICOS LTDA.,RIBEIRAO PRETO,11,1991,Sociedade Limitada
35210565941,"MAR-CLEAN COMERCIO, SERVICOS E REPRESENTACOES LTDA",RIBEIRAO PRETO,11,1991,Sociedade Limitada
35210565950,FERREIRA & BALDINI LTDA.,RIBEIRAO PRETO,11,1991,Sociedade Limitada
35210566018,A.M. COMERCIO E IMPORTACAO LTDA.,FRANCA,11,1991,Sociedade Limitada
35210566034,S.D.A BORRACHA E ACESSORIOS LTDA-ME.,MAUA,11,1991,Sociedade Limitada
35210566051,R.V. MANUSTRAL COMERCIO DE MATERIAIS ELETRICOS E PRESTADORA DE SERVICOS LTDA. - M.E.,SANTO ANDRE,11,1991,Sociedade Limitada
35210566077,JOSINO & CIA.,BAURU,11,1991,Sociedade Limitada
35210566085,INTACT COMERCIO DE METAIS LTDA.,CAMPINAS,11,1991,Sociedade Limitada
35210566093,MAECHLER E CIA LTDA.,SAO PAULO,11,1991,Sociedade Limitada
35210566107,ALDEIA DAS ARTES COMERCIO E DIAGRAMACAO LTDA. - M.E.,MORUNGABA,11,1991,Sociedade Limitada
35210566115,CONTRUTORA DEL CASTILHO LTDA.,SAO PAULO,11,1991,Sociedade Limitada
35210566123,CENTER CAR COQUEIRAO COMERCIO E SERVICOS LTDA.,RIBEIRAO PIRES,11,1991,Sociedade Limitada
35210566140,ART PANTA INDUSTRIA E COMERCIO LTDA.,VALENTIM GENTIL,11,1991,Sociedade Limitada
35210566158,COMERCIO DE VERDURAS FERNANDES GUIMARAES LTDA.,SAO PAULO,11,1991,Sociedade Limitada
35210566174,JUSSARA FREIRE PRODUCOES ARTISTICAS LTDA.,SAO PAULO,11,1991,Sociedade Limitada
35210566191,SEBASTIAO MENDES SERRALHERIA LTDA. - M.E.,SAO PAULO,11,1991,Sociedade Limitada
35210566221,S.G.J. INFORMATICA LTDA.,JARDINOPOLIS,11,1991,Sociedade Limitada
35210566239,KORT FRIOS ALLISON INDUSTRIA E COMERCIO LTDA.,SAO CAETANO DO SUL,11,1991,Sociedade Limitada
35210566271,EMENDAO LANCHES LTDA.,SAO PAULO,11,1991,Sociedade Limitada
35210566280,TRANSPRINT TRANSPORTES LTDA.,DIADEMA,11,1991,Sociedade Limitada
35210566298,TREVISO DECORACOES LTDA.,SAO BERNARDO DO CAMPO,11,1991,Sociedade Limitada
35210566301,BAR E LANCHONETE IRMAOS DIOGENES LTDA,SAO PAULO,11,1991,Sociedade Limitada
35210566328,VISOR REPRESENTACOES E PARTICIPACOES LTDA.,SAO PAULO,11,1991,Sociedade Limitada
35210566344,COMERCIO E FERRAGENS SANTA EUDOXIA LTDA.,SAO PAULO,11,1991,Sociedade Limitada
35210566352,J.G. COMERCIO E MECANICA LTDA.,SAO PAULO,11,1991,Sociedade Limitada
35210566361,DROGARIA POIARES LTDA. - M.E.,CARAGUATATUBA,11,1991,Sociedade Limitada
35210566395,PAKATO AUTO MOTO PECAS LTDA. - M.E.,SANTO ANDRE,11,1991,Sociedade Limitada
35210566409,VISUAL BOOK VIDEO PRODUCOES LTDA.,SAO PAULO,11,1991,Sociedade Limitada
35210566417,MIDIN PERFUMARIA LTDA,SANTOS,11,1991,Sociedade Limitada
35210566425,TERRAPLENAGEM E COMERCIAL SUDANO LTDA.,MONTE ALTO,11,1991,Sociedade Limitada
35210566433,MASSAROPPI ARTIGOS DE CACA E PESCA LTDA,SAO PAULO,11,1991,Sociedade Limitada
35210566441,A.R.V. COMERCIO IMPORTACAO E EXPORTACAO LTDA.,SAO PAULO,11,1991,Sociedade Limitada
35210566450,KIM TECNA ADEREX INDUSTRIAL LTDA.,LEME,11,1991,Sociedade Limitada
35210566484,AAPC PARTICPACOES LTDA.,NATIVIDADE DA SERRA,11,1991,Sociedade Limitada
35210566492,INCOLI INDUSTRIA E COMERCIO LIMEIRENSE LTDA.,LIMEIRA,11,1991,Sociedade Limitada
35210566506,BERMAR E IRMAOS LTDA.,SAO JOAO DA BOA VISTA,11,1991,Sociedade Limitada
35210566522,ODONTO CARMO REPRESENTACOES COMERCIAIS LTDA.,SAO PAULO,11,1991,Sociedade Limitada
35210566531,CONFECCOES E MODAS SAN RED LTDA.,ITAPECERICA DA SERRA,11,1991,Sociedade Limitada
35210566344,COMERCIO E FERRAGENS SANTA EUDOXIA LTDA.,SAO PAULO,11,1991,Sociedade Limitada
