NIRE,Empresa,Município,Month,Year,Type
35212703489,ESTOFADOS J.G.G. INDUSTRIA E COMERCIO LTDA,ANGATUBA,12,1994,Sociedade Limitada
35212703501,LOPES & SILVA - UBARAMA LTDA.,UBARANA,12,1994,Sociedade Limitada
35212703519,INFO-PAPER COMERCIO DE MATERIAIS PARA ESCRITORIO LTDA.,SAO PAULO,12,1994,Sociedade Limitada
35212703527,S. O. MADEIRAS LTDA.,ITAPEVA,12,1994,Sociedade Limitada
35212703535,MADEIREIRA J. G. LTDA.,RIBEIRAO BRANCO,12,1994,Sociedade Limitada
35212703543,M.B. COMERCIO DE REFRIGERACAO LTDA,SAO PAULO,12,1994,Sociedade Limitada
35212703551,IGLESIAS PARTICIPACOES LTDA,ITAPEVA,12,1994,Sociedade Limitada
35212703560,R.C.L. CONFECCOES LTDA,MAUA,12,1994,Sociedade Limitada
35212703578,MAX QUALITY COMERCIO DE ALIMENTOS LTDA.,SAO PAULO,12,1994,Sociedade Limitada
35212703586,MAF FIBER CAPOTAS LTDA,BAURU,12,1994,Sociedade Limitada
35212703594,VIP HIGIENIZACAO E CONSERVACAO DE IMOVEIS LTDA,EMBU,12,1994,Sociedade Limitada
35212703608,LINEMARI LANCHONETE E CONFEITARIA LTDA.,SAO PAULO,12,1994,Sociedade Limitada
35212703616,CASA BELA VISTA COMERCIO DE PRODUTOS ALIMENTICIOS LTDA,SAO PAULO,12,1994,Sociedade Limitada
35212703624,MONTAP INDUSTRIA E COMERCIO DE EQUIPAMENTOS ELETRONICOS LTDA,SAO PAULO,12,1994,Sociedade Limitada
35212703632,HENRIQUE DESIGN INDUSTRIA E COMERCIO LTDA.,SAO PAULO,12,1994,Sociedade Limitada
35212703641,THIDA AND TED FASHION CONFECCOES LTDA.,SAO PAULO,12,1994,Sociedade Limitada
35212703659,COFFEE HOUSE COMERCIO DE ALIMENTOS LTDA.,SAO PAULO,12,1994,Sociedade Limitada
35212703667,JOCRIS PEIXARIA LTDA.,SAO PAULO,12,1994,Sociedade Limitada
35212703675,RIGON TELEFONES LTDA,SAO PAULO,12,1994,Sociedade Limitada
35212703683,BRASLUM TELEFONES LTDA.,SAO PAULO,12,1994,Sociedade Limitada
35212703691,DEPOSITO EXITO LTDA,SAO PAULO,12,1994,Sociedade Limitada
35212703705,BABY E VIDA COMERCIAL LTDA,AMERICANA,12,1994,Sociedade Limitada
35212703713,COMERCIAL DE PRODUTOS ALIMENTICIOS LUCCA E HUMPHREYS LTDA,CARAGUATATUBA,12,1994,Sociedade Limitada
35212703721,BIOSLEMER ASSISTENCIA TECNICA S/C LTDA,SAO PAULO,12,1994,Sociedade Limitada
35212703730,SANTO IGNACIO TRANSPORTADORA E PRESTACAO DE SERVICOS LTDA,IGARAPAVA,12,1994,Sociedade Limitada
35212703748,ESTOFADOS FORNAZARE CUSTODIO LTDA,AURIFLAMA,12,1994,Sociedade Limitada
35212703756,DROGARIA NOEMIA FRANCA LTDA,FRANCA,12,1994,Sociedade Limitada
35212703764,ROTAKO TELEFONES LTDA,SAO PAULO,12,1994,Sociedade Limitada
35212703772,GARCEZ E CARNEIRO LTDA.,UBATUBA,12,1994,Sociedade Limitada
35212703781,HETAGRI TELEFONES LTDA.,SAO PAULO,12,1994,Sociedade Limitada
35212703799,PLATIZER TELEFONES LTDA.,SAO PAULO,12,1994,Sociedade Limitada
35212703802,BOMBONIERE RELU LTDA.,DIADEMA,12,1994,Sociedade Limitada
35212703811,R. MONTEIRO INDUSTRIA E COMERCIO DE MOVEIS LTDA,SAO PAULO,12,1994,Sociedade Limitada
35212703829,AUTO MECANICA E FUNILARIA HISSAMURA LTDA.,SAO PAULO,12,1994,Sociedade Limitada
35212703837,BAZAR MA-LU DE OSASCO LTDA,OSASCO,12,1994,Sociedade Limitada
35212703845,MA Q DELICIA ROTISSERIE LTDA,SAO PAULO,12,1994,Sociedade Limitada
35212703853,CARMONA BRAGA COMERCIO DE FERRAMENTAS FERRAGENS LTDA,SAO PAULO,12,1994,Sociedade Limitada
35212703861,RWR SERVICOS EM INFORMATICA LTDA.,SANTANA DE PARNAIBA,12,1994,Sociedade Limitada
35212703870,SAMPA SOFT - COMERCIO DE PRODUTOS DE INFORMATICA LTDA.,SAO PAULO,12,1994,Sociedade Limitada
35212703888,EMPORIO TEXTIL COMERCIO E MANUFATURA DE TAPETES TECIDOS LTDA.,SAO PAULO,12,1994,Sociedade Limitada
35212703896,LIGAPLAST INDUSTRIA E COMERCIO DE PLASTICO LTDA,SAO PAULO,12,1994,Sociedade Limitada
35212703900,PLATANUS INFORMATICA LTDA.,INDAIATUBA,12,1994,Sociedade Limitada
35212703918,MERCANTIL A.L. LTDA.,SAO PAULO,12,1994,Sociedade Limitada
35212703926,ECLIPSE ADMINISTRACAO E CORRETORA DE SEGUROS LTDA.,SANTANA DE PARNAIBA,12,1994,Sociedade Limitada
35212703934,MEGA SHIRT'S INFORMATICA E COMERCIO LTDA.,SAO PAULO,12,1994,Sociedade Limitada
35212703942,EQUIPHI EQUIPAMENTOS E MAQUINAS LTDA.,SAO PAULO,12,1994,Sociedade Limitada
35212703951,BONATEC INDUSTRIA E COMERCIO LTDA.,VARGEM,12,1994,Sociedade Limitada
35212703969,DOUGHNUTS COMERCIO DE PAES E MASSAS EM GERAL LTDA.,SAO PAULO,12,1994,Sociedade Limitada
35212703977,BOMBONIERE E MERCEARIA SERDAN'S LTDA.,CARAPICUIBA,12,1994,Sociedade Limitada
35212703985,NATALIO & RONALD LTDA.,JACAREI,12,1994,Sociedade Limitada
35212703993,TRANSILVA TRANSPORTES COLETIVOS LTDA,JACAREI,12,1994,Sociedade Limitada
35212704001,ARFCO ALIMENTOS LTDA,BARUERI,12,1994,Sociedade Limitada
35212704019,FERRO COMERCIO DE BIJOUTERIAS LTDA.,SANTOS,12,1994,Sociedade Limitada
35212704027,STEFWEL MATERIAL DE CONSTRUCAO LTDA,BEBEDOURO,12,1994,Sociedade Limitada
35212704035,FAVILLA E FELISBINO COMERCIAL DE FOGOES LTDA.,MOGI MIRIM,12,1994,Sociedade Limitada
35212704043,TWOT'S COMERCIALLTDA.,SAO PAULO,12,1994,Sociedade Limitada
35212704051,DICAL COMERCIO DE CONEXOES E SERVICOS LTDA.,SAO PAULO,12,1994,Sociedade Limitada
35212704060,MASTERTEX - COMERCIO E REPRESENTACAO DE VESTUARIO LTDA.,GUARULHOS,12,1994,Sociedade Limitada
35212704078,REGES DONATTI E CIA. LTDA.,JUNDIAI,12,1994,Sociedade Limitada
35212704086,RIBAS D=AVILA COMERCIAL LTDA,CAMPINAS,12,1994,Sociedade Limitada
35212704094,J. G. MONTECINO REPRESENTACOES LTDA.,COSMOPOLIS,12,1994,Sociedade Limitada
35212704108,CHIANG MAR ATACADISTA DE PRODUTOS ALIMENTICIOS LTDA.,SAO PAULO,12,1994,Sociedade Limitada
35212704116,OSCA COMERCIO E TECNOLOGIA EM MICROFILTRAGEM DE OLEO LTDA.,JUNDIAI,12,1994,Sociedade Limitada
35212704124,VELLUDO ARACATUBA & CIA LTDA.,ARACATUBA,12,1994,Sociedade Limitada
35212704132,SPINOLA JORNAIS E REVISTAS LTDA,SAO PAULO,12,1994,Sociedade Limitada
35212704141,JG COMERCIAL LTDA.,SAO PAULO,12,1994,Sociedade Limitada
35212704159,AVICOLA LA PLUMA D'OURO LTDA,SAO PAULO,12,1994,Sociedade Limitada
35212704167,ULTIMA MORADA DE SERVICOS PARA SEPULTAMENTO LTDA,CAMPINAS,12,1994,Sociedade Limitada
35212704175,MALHARIA MAHEN LTDA,ITATIBA,12,1994,Sociedade Limitada
35212704183,BAR E LANCHES VEGRE LTDA.,SAO PAULO,12,1994,Sociedade Limitada
35212704191,PHOENIX COMERCIO E APOIO NAVAL LTDA,SANTOS,12,1994,Sociedade Limitada
35212704205,ESCOLA DE EDUCACAO INFANTIL E ENSINO FUNDAMENTAL CRIANCA FELIZ LTDA,CUBATAO,12,1994,Sociedade Limitada
35212704213,DALFRAN COMERCIO DE PRODUTOS HORTIGRANGEIROS LTDA.,SAO VICENTE,12,1994,Sociedade Limitada
35212704221,VAN CAR AUTOMOVEIS LTDA.,SAO PAULO,12,1994,Sociedade Limitada
35212704230,SMD COMERCIO DE BALOES LTDA.,SANTO ANDRE,12,1994,Sociedade Limitada
35212704248,RADIANTE MARKETING PROMOCOES E EVENTOS LTDA.,SANTO ANDRE,12,1994,Sociedade Limitada
35212704256,PAES E DOCES ALVES & SOUZA LTDA.,SAO JOSE DOS CAMPOS,12,1994,Sociedade Limitada
35212704264,SANTI E ROSSI COMERCIAL LTDA.,SAO JOSE DOS CAMPOS,12,1994,Sociedade Limitada
35212704272,SOUZA E PACOLA EQUIPAMENTOS DE INFORMATICA LTDA,SAO JOSE DOS CAMPOS,12,1994,Sociedade Limitada
35212704281,NOTADO COMERCIAL LTDA,CARAGUATATUBA,12,1994,Sociedade Limitada
35212704299,A.J. GUIMARAES CORREA E CIA LTDA,MIRASSOL,12,1994,Sociedade Limitada
35212704302,TELEGOLD LTDA.,SAO JOSE DO RIO PRETO,12,1994,Sociedade Limitada
35212704311,SR3 COMERCIO PROMOCOES E REPRESENTACOES LTDA.,SAO PAULO,12,1994,Sociedade Limitada
35212704329,DENIMES COMERCIO E IMPORTACAO LTDA,JUQUITIBA,12,1994,Sociedade Limitada
35212704337,HAMPTONS MULTI COMERCIO LTDA.,POTIM,12,1994,Sociedade Limitada
35212704345,PRESTA'LL COMERCIAL LTDA,SAO PAULO,12,1994,Sociedade Limitada
35212704353,MAREAR ASSESSORIA ADUANEIRA LTDA,SAO PAULO,12,1994,Sociedade Limitada
35212704361,ALCOBACA COMERCIO E REPRESENTACOES LTDA.,OSASCO,12,1994,Sociedade Limitada
35212704370,FIX IMPORT COMERCIO E INDUSTRIA DE PECAS PARA FIXACAO LTDA,SAO PAULO,12,1994,Sociedade Limitada
35212704388,PRIMATE-CONSTRUTORA LTDA.,SOROCABA,12,1994,Sociedade Limitada
35212704396,COMERCIO E REPRESENTACOES J. R. F. LTDA.,SAO JOAO DA BOA VISTA,12,1994,Sociedade Limitada
35212704400,SIDMAR COMERCIO DE COUROS LTDA,SAO JOAO DA BOA VISTA,12,1994,Sociedade Limitada
35212704418,RUBINI E SILVA LTDA,SAO JOAO DA BOA VISTA,12,1994,Sociedade Limitada
35212704426,PAU BRASIL VEICULOS LTDA.,SAO PAULO,12,1994,Sociedade Limitada
35212704434,CHERRY INDUSTRIAL E COMERCIO DE PRODUTOS TEXTEIS LTDA.,SAO PAULO,12,1994,Sociedade Limitada
35212704442,JESUS E VEIGA LTDA,TAQUARITUBA,12,1994,Sociedade Limitada
35212704451,AGRO SOLUCAO COMERCIO E ASSESSORIA ADMINISTRATIVA LTDA,ASSIS,12,1994,Sociedade Limitada
35212704469,PLANNU'S TAQUARITINGA TURISMO LTDA.,TAQUARITINGA,12,1994,Sociedade Limitada
35212704477,R.A. COMERCIO DE PECAS PARA VEICULOS LTDA,SUMARE,12,1994,Sociedade Limitada
35212704485,COMERCIAL AGRICOLA IRMAOS BAPTISTELLA LTDA.,SAO PAULO,12,1994,Sociedade Limitada
35212704493,KL ESPETARIA FERNANDOPOLIS LTDA,FERNANDOPOLIS,12,1994,Sociedade Limitada
35212704507,APASEG INDUSTRIA E COMERCIO DE EQUIPAMENTOS DE SEGURANCA LTDA,SAO PAULO,12,1994,Sociedade Limitada
35212704515,INSTELCMAN INSTALACOES ELETRICAS COMERCIO E MANUTENCAO LTDA,SAO PAULO,12,1994,Sociedade Limitada
35212704523,ROMERO'S INFORMATICA LTDA,GUARULHOS,12,1994,Sociedade Limitada
35212704531,FRANTEC COMERCIO E PRESTACAO DE SERVICOS LTDA,SAO PAULO,12,1994,Sociedade Limitada
35212704540,TROPIKUM COMERCIO INTERNACIONAL LTDA,SAO PAULO,12,1994,Sociedade Limitada
35212704558,ARINA TRANSPORTES RODOVIARIOS LTDA,BEBEDOURO,12,1994,Sociedade Limitada
35212704566,JEDALLE INDUSTRIA E COMERCIO DE MOVEIS LTDA,VOTUPORANGA,12,1994,Sociedade Limitada
35212704574,EVA PRODUTOS POS CIRURGICOS LTDA.,SAO PAULO,12,1994,Sociedade Limitada
35212704582,HUMAITA CONSTRUCOES E ADMINISTRACAO LTDA,SAO PAULO,12,1994,Sociedade Limitada
35212704591,BAZAR E BOMBONIERI ANA E MARIA LTDA,SAO PAULO,12,1994,Sociedade Limitada
35212704604,BAZAR E PAPELARIA NELCITA LTDA,SAO PAULO,12,1994,Sociedade Limitada
35212704612,BRUTO S AUTO SOCORRO E LAVAGEM LTDA,GUARULHOS,12,1994,Sociedade Limitada
35212704621,TRANSMILHAS EXPRESS TRANSPORTES LTDA,MOGI DAS CRUZES,12,1994,Sociedade Limitada
35212704639,DI SANTO E ALKIMIM LTDA,LORENA,12,1994,Sociedade Limitada
35212704647,EXPORT PORTAS E JANELAS LTDA.,SAO PAULO,12,1994,Sociedade Limitada
35212704655,BRUDALU COMERCIO E REPRESENTACAO LTDA,CAMPINAS,12,1994,Sociedade Limitada
35212704663,KAIZEN COMPONENTES E REDES ELETRICAS LTDA,RIO CLARO,12,1994,Sociedade Limitada
35212704671,SUPER 40 VIDEOS E GAMES LTDA.,RIO CLARO,12,1994,Sociedade Limitada
35212704680,S. R. MASSINI & CIA LTDA,RIO CLARO,12,1994,Sociedade Limitada
35212704698,F. C. T. REPRESENTACOES LTDA,VARGEM GRANDE PAULISTA,12,1994,Sociedade Limitada
35212704701,LUN TELE CHINESE REFEICOES LTDA,SAO PAULO,12,1994,Sociedade Limitada
35212704710,LUIZ E EDNA LANCHES LTDA,SAO PAULO,12,1994,Sociedade Limitada
35212704728,MUSA LINGERIE LTDA,SAO PAULO,12,1994,Sociedade Limitada
35212704736,SPEED POWER COMERCIO DE PECAS E ACESSORIOS PARA BICICLETAS LTDA,SAO PAULO,12,1994,Sociedade Limitada
35212704744,ANNARY COMERCIO DE ROUPAS NOVAS E SEMI-NOVAS LTDA,SAO PAULO,12,1994,Sociedade Limitada
35212704752,SABOX COMERCIO E RECONDICIONADORA DE AUTO PECAS LTDA,SAO PAULO,12,1994,Sociedade Limitada
35212704761,DOCES DO PORTUGA COMERCIO ATACADISTA E VAREJISTA LTDA,SANTO ANDRE,12,1994,Sociedade Limitada
35212704779,DOSERRES PRESENTES E ARTESANATOS LTDA.,SAO PAULO,12,1994,Sociedade Limitada
35212704787,R.D. COMERCIO DE SOM E ACESSORIOS LTDA.,SAO PAULO,12,1994,Sociedade Limitada
35212704795,LANCHONETE E RESTAURANTE CHABOCAO GRILL LTDA.,SAO BERNARDO DO CAMPO,12,1994,Sociedade Limitada
35212704809,LOZANO & CIA LTDA.,FRANCISCO MORATO,12,1994,Sociedade Limitada
35212704817,BUENO & BUENO COMERCIAL IMPORTADORA E EXPORTADORA LTDA.,SAO PAULO,12,1994,Sociedade Limitada
35212704825,ALBRAENG ENGENHARIA E CONSTRUCOES LTDA,CAMPO LIMPO PAULISTA,12,1994,Sociedade Limitada
35212704833,PERSIANAS GLOBO LTDA.,OSASCO,12,1994,Sociedade Limitada
35212704841,VI-VIENA COMERCIO DE VEICULOS LTDA,SAO PAULO,12,1994,Sociedade Limitada
35212704850,FACAS VIN INDUSTRIA E COMERCIO LTDA.,VINHEDO,12,1994,Sociedade Limitada
35212704868,REBEKA AMERICAN BAR LTDA.,SAO PAULO,12,1994,Sociedade Limitada
35212704876,AVAMA BAR,SAO PAULO,12,1994,Sociedade Limitada
35212704884,METALURGICA SAO GERALDO LTDA.,DIADEMA,12,1994,Sociedade Limitada
35212704892,SS SPORT COMERCIAL LTDA.,BEBEDOURO,12,1994,Sociedade Limitada
35212704906,NAPPYN COMERCIO DE MOVEIS LTDA.,ARARAQUARA,12,1994,Sociedade Limitada
35212704914,LOJAS BRASMEL LTDA,PONTAL,12,1994,Sociedade Limitada
35212704922,PANIFICADORA E CONFEITARIA RAINHA DA SALGUEIRO,PORTO FERREIRA,12,1994,Sociedade Limitada
35212704931,PRACABOR REPRESENTACOES COMERCIAIS LTDA,SAO ROQUE,12,1994,Sociedade Limitada
35212704949,CAFE & LANCHETERIA CHERRY LTDA.,SAO PAULO,12,1994,Sociedade Limitada
35212704957,GIRALUAGIRASOL FLORICULTURA DECORACOES E PRESENTES LTDA,SAO PAULO,12,1994,Sociedade Limitada
35212704965,LANCHONETE BOSSA NOVA LTDA.,SAO PAULO,12,1994,Sociedade Limitada
35212704973,MARROM ACESSORIOS LTDA,ARARAS,12,1994,Sociedade Limitada
35212704981,SPORTFEST RECREACOES E LAZER LTDA.,SAO PAULO,12,1994,Sociedade Limitada
35212704990,LEONSAGE COMERCIO E CONFECCOES LTDA,SAO PAULO,12,1994,Sociedade Limitada
35212705007,DECKLINE COMERCIO DE PRODUTOS DE LIMPEZA LTDA,SOROCABA,12,1994,Sociedade Limitada
35212705015,MERCEARIA DO PACHECO LTDA,SAO PAULO,12,1994,Sociedade Limitada
35212705023,ANN MOORE COMERCIO REPRESENTACAO IMPORTACAO E EXPORTACAO LTDA,SAO PAULO,12,1994,Sociedade Limitada
35212705031,COMERCIAL CELEIRO PAULISTA LTDA,GUARULHOS,12,1994,Sociedade Limitada
35212705040,MODENA INDUSTRIA E COMERCIO DE MOVEIS LTDA,SAO PAULO,12,1994,Sociedade Limitada
35212705058,NOVA UNIAO COMERCIO DE EMBALAGENS LTDA,SAO PAULO,12,1994,Sociedade Limitada
35212705066,A.J. PINHEIRO REPRESENTACOES LTDA.,SAO CAETANO DO SUL,12,1994,Sociedade Limitada
35212705074,RESTAURANTE RAPOSA LTDA.,OSASCO,12,1994,Sociedade Limitada
35212705082,TV-72 PRODUCOES E MONTAGEM LTDA.,SANTANA DE PARNAIBA,12,1994,Sociedade Limitada
35212705091,AGROTON COMERCIO E REPRESENTACOES LTDA,SAO PAULO,12,1994,Sociedade Limitada
35212705104,CONDORTEX INDUSTRIA COMERCIO IMPORTACAO E EXPORTACAO LTDA.,SAO PAULO,12,1994,Sociedade Limitada
35212705112,GYPSY BARRETOS LTDA.,BARRETOS,12,1994,Sociedade Limitada
35212705121,GONCALVES & M GONCALVES LTDA.,ARARAQUARA,12,1994,Sociedade Limitada
35212705139,SCAN PAPER COMERCIO E REPRESENTACAO LTDA.,ESPIRITO SANTO DO PINHAL,12,1994,Sociedade Limitada
35212705147,FLORIAN E TORREZAN LTDA.,TIETE,12,1994,Sociedade Limitada
35212705155,MARCELO DONIZETE DUARTE E IRMAO LTDA.,SAO CARLOS,12,1994,Sociedade Limitada
35212705163,ADRIANO DONIZETE PIRONDI E CIA LTDA,PORTO FERREIRA,12,1994,Sociedade Limitada
35212705171,REMAR CONFECCOES LTDA.,PRESIDENTE PRUDENTE,12,1994,Sociedade Limitada
35212705180,SOUZA'S E ARAUJO LTDA,PRAIA GRANDE,12,1994,Sociedade Limitada
35212705198,BAURU JET SPEED COMERCIO DE MOTOS E VEICULOS LTDA,BAURU,12,1994,Sociedade Limitada
35212705201,COMERCIAL VITAL LTDA.,MONTE ALTO,12,1994,Sociedade Limitada
35212705210,KMS SISTEMAS DE SEGURANCA LTDA,SAO PAULO,12,1994,Sociedade Limitada
35212705228,MERCEARIA MAURIMAR LTDA,SAO PAULO,12,1994,Sociedade Limitada
35212705236,ELLU'SS PRESENTES COMERCIO EM GERAL LTDA,SAO PAULO,12,1994,Sociedade Limitada
35212705244,MERCADINHO SUACUI LTDA,SAO PAULO,12,1994,Sociedade Limitada
35212705252,NACIONAL CAR PECAS AUTOMOTIVAS LTDA,SAO PAULO,12,1994,Sociedade Limitada
35212705261,LW - MATERIAIS ELETRICOS LTDA.,CAMPINAS,12,1994,Sociedade Limitada
35212705279,AMERICAN'S CONFECCOES LTDA,AMERICANA,12,1994,Sociedade Limitada
35212705287,PAULISTA CELULAR LTDA.,MOGI DAS CRUZES,12,1994,Sociedade Limitada
35212705295,YELLON POINT COMERCIO DE DIVERSOES LTDA,SAO PAULO,12,1994,Sociedade Limitada
35212705309,SIMIAO TRANSPORTES LTDA,SAO PAULO,12,1994,Sociedade Limitada
35212705317,SELLER-CONSULTORIA IMOBILIARIA E REPRESENTACOES LTDA,SAO PAULO,12,1994,Sociedade Limitada
35212705325,VIA JAPAN LTDA.,PRESIDENTE PRUDENTE,12,1994,Sociedade Limitada
35212705333,COMERCIO DE GENEROS ALIMENTICIOS KROLL LTDA.,OSASCO,12,1994,Sociedade Limitada
35212705341,VANESSA COMERCIO DE VASSOURAS LTDA.,ILHA SOLTEIRA,12,1994,Sociedade Limitada
35212705350,HELP NOW TECNOLOGIA INFORMATICA E COMERCIO LTDA,SAO PAULO,12,1994,Sociedade Limitada
35212705368,ORGANIZACAO GPC DE SERVICOS LTDA,SAO PAULO,12,1994,Sociedade Limitada
35212705376,RWS ENGENHARIA DE SISTEMAS E SOFTWARE LTDA.,BAURU,12,1994,Sociedade Limitada
35212705384,CREDENCIAL FOMENTO COMERCIAL LTDA,SERTAOZINHO,12,1994,Sociedade Limitada
35212705392,COMERCIAL TAURUS DE BAURU LTDA.,BAURU,12,1994,Sociedade Limitada
35212705406,MADERIDE COMERCIO DE MADEIRAS LTDA,OSASCO,12,1994,Sociedade Limitada
35212705414,MOVEIS HONDA LTDA,BARUERI,12,1994,Sociedade Limitada
35212705422,DI-LU BAZARE PAPELARIA LTDA,FRANCO DA ROCHA,12,1994,Sociedade Limitada
35212705431,CSR COMERCIO E MANUTENCAO DE EQUIPAMENTOS INDUSTRIAIS LTDA,GUARULHOS,12,1994,Sociedade Limitada
35212705449,BAZAR AYAKO LTDA,SAO PAULO,12,1994,Sociedade Limitada
35212705457,RAMANA COMERCIO DE COSMETICOS LTDA,SAO PAULO,12,1994,Sociedade Limitada
35212705465,ALARD SISTEMA DE SEGURANCA LTDA.,SAO PAULO,12,1994,Sociedade Limitada
35212705473,RIBERMASSA COMERCIO E INDUSTRIA LTDA.,RIBEIRAO PRETO,12,1994,Sociedade Limitada
35212705481,SASA AGROFLORESTAL LTDA.,MARTINOPOLIS,12,1994,Sociedade Limitada
35212705490,TRIGUEIRINHO & NASCIMENTO LTDA.,TAUBATE,12,1994,Sociedade Limitada
35212705503,GAMM MERCEARIA E QUITANDA LTDA.,TAUBATE,12,1994,Sociedade Limitada
35212705511,VILLA DELLA PIETRA COMERCIO DE PEDRAS ORNAMENTAIS LTDA,SAO JOSE DO RIO PRETO,12,1994,Sociedade Limitada
35212705520,MASTEGRAPH GRAFICA E EDITORA LTDA,SAO JOSE DOS CAMPOS,12,1994,Sociedade Limitada
35212705538,HE MONTAGEM E CALDEIRARIA LTDA.,JACAREI,12,1994,Sociedade Limitada
35212705546,LANCHONETE PANIFICADORA E CONFEITARIA JOIA LTDA,SAO JOSE DOS CAMPOS,12,1994,Sociedade Limitada
35212705554,DELIRIOS E DELICIAS DOCES E SALGADOS LTDA.,SAO PAULO,12,1994,Sociedade Limitada
35212705562,BAR GRACA LTDA,SAO PAULO,12,1994,Sociedade Limitada
35212705571,MAVEDI ARTIGOS DE COUROS E VARIEDADES LTDA.,BARUERI,12,1994,Sociedade Limitada
35212705589,COMERCIAL E EMPREITEIRA MENDES RIBEIRO LTDA.,CAMPO LIMPO PAULISTA,12,1994,Sociedade Limitada
35212705597,FF COMERCIO DE COUROS E COMPONENTES LTDA,SAO PAULO,12,1994,Sociedade Limitada
35212705601,YAZFECCOM COMERCIAL IMPORTADORA LTDA.,SAO PAULO,12,1994,Sociedade Limitada
35212705619,TERERE FASHION MODAS CONFECCOES LTDA.,SAO PAULO,12,1994,Sociedade Limitada
35212705627,MATOPA COMERCIO DE MADEIRAS LTDA.,SAO PAULO,12,1994,Sociedade Limitada
35212705635,MANUPRED MANUTENCAO PREDIAL E COMERCIO LTDA,CARAGUATATUBA,12,1994,Sociedade Limitada
35212705643,NILO MIGUEL DA FONSECA E CIA LTDA,RIBEIRAO PRETO,12,1994,Sociedade Limitada
35212705651,VIDROCASA COMERCIO DE SUCATAS LTDA.,PORTO FERREIRA,12,1994,Sociedade Limitada
35212705660,MARQUES E ALMEIDA COMERCIO DE BEBIDAS LTDA.,GUAIRA,12,1994,Sociedade Limitada
35212705678,MOLL MANUTENCAO INDUSTRIAL LTDA,MAUA,12,1994,Sociedade Limitada
35212705686,CASA DE CARNES ITAIPU DE PRAIA GRANDE LTDA.,PRAIA GRANDE,12,1994,Sociedade Limitada
35212705694,BRASIMEC ELETROMECANICA LTDA,SAO CAETANO DO SUL,12,1994,Sociedade Limitada
35212705708,EMPORIO ARABE MN LTDA,BARRETOS,12,1994,Sociedade Limitada
35212705716,GRACINO E VALDEVINO LTDA.,MARILIA,12,1994,Sociedade Limitada
35212705724,LANCHONETE ZUNTINE LTDA.,PRESIDENTE PRUDENTE,12,1994,Sociedade Limitada
35212705732,H.P.P. HIDRAULICA DE P. PRUDENTE LTDA.,PRESIDENTE PRUDENTE,12,1994,Sociedade Limitada
35212705741,MASSA SOLDA COMERCIO E INSTALACOES HIDRAULICAS LTDA,BAURU,12,1994,Sociedade Limitada
35212705759,ENCENHA & LANZA LTDA.,PRESIDENTE PRUDENTE,12,1994,Sociedade Limitada
35212705767,ADAMAR COMERCIO E REPRESENTACOES LTDA.,RIBEIRAO PRETO,12,1994,Sociedade Limitada
35212705775,HVG COMERCIAL IMPORTADORA LTDA.,RIBEIRAO PRETO,12,1994,Sociedade Limitada
35212705783,PROCET PROJETOS EM CIENCIAS EDUCACAO E TECNOLOGIA E COMERCIO LTDA.,SAO CARLOS,12,1994,Sociedade Limitada
35212705791,A S TERAPIA CORPORAL LTDA,SAO JOSE DO RIO PRETO,12,1994,Sociedade Limitada
35212705805,FEMSTEL ALIMENTOS LTDA,SAO JOSE DO RIO PRETO,12,1994,Sociedade Limitada
35212705813,KOLAKA REPRESENTACAO COMERCIAL LTDA,SAO JOSE DO RIO PRETO,12,1994,Sociedade Limitada
35212705821,RECIPEL COMERCIO DE PAPEIS E SUCATAS LTDA,SAO JOSE DO RIO PRETO,12,1994,Sociedade Limitada
35212705830,SI TRANSPORTES LTDA,SAO PAULO,12,1994,Sociedade Limitada
35212705848,MODAS NA-SAN LTDA.,SAO PAULO,12,1994,Sociedade Limitada
35212705856,ZNEWFER TRANSPORTES LTDA.,SAO PAULO,12,1994,Sociedade Limitada
35212705864,A.J.T. TRANSPORTES LTDA,OSASCO,12,1994,Sociedade Limitada
35212705872,BOOK COLLECTION COMERCIO IMPORTACAO E EXPORTACAO LTDA.,SAO PAULO,12,1994,Sociedade Limitada
35212705881,PERIMETRO URBANO MODAS E ACESSORIOS LTDA.,SAO PAULO,12,1994,Sociedade Limitada
35212705899,RESTAURANTE COMIDA CASEIRA DONANA LTDA,SOROCABA,12,1994,Sociedade Limitada
35212705902,EXPRESSO SADINI TRANSPORTES LTDA,DIADEMA,12,1994,Sociedade Limitada
35212705911,COMERCIO DE DOCES DOCE VIDA LTDA,TABOAO DA SERRA,12,1994,Sociedade Limitada
35212705929,RTP JORNAIS E REVISTAS LTDA,SAO PAULO,12,1994,Sociedade Limitada
35212705937,JS TRANSPORTE DE JORNAIS E REVISTAS LTDA,SAO PAULO,12,1994,Sociedade Limitada
35212705945,CENTER CARNES JULIANA CRUZ LTDA,OSASCO,12,1994,Sociedade Limitada
35212705953,MINI-MERCADO E AVICOLA CANGAIBA LTDA.,SAO PAULO,12,1994,Sociedade Limitada
35212705961,RENASCER SERVICOS TEMPORARIOS LTDA.,SAO PAULO,12,1994,Sociedade Limitada
35212705970,BUY BY NT MODAS LTDA.,COTIA,12,1994,Sociedade Limitada
35212705988,MAP COMERCIO DE MADEIRAS LTDA,ARACOIABA DA SERRA,12,1994,Sociedade Limitada
35212705996,MAYRO COMERCIO IMPORTACAO E EXPORTACAO LTDA.,SAO PAULO,12,1994,Sociedade Limitada
35212706003,ZURIQUE CAFFE EXPRESSO LTDA.,CAMPINAS,12,1994,Sociedade Limitada
35212706011,GLIMPSE VESTUARIO E ACESSORIOS EM GERAL LTDA.,SAO PAULO,12,1994,Sociedade Limitada
35212706020,EXTRA TAXI AEREO E LOCACAO DE AERONAVES LTDA.,SAO PAULO,12,1994,Sociedade Limitada
35212706038,IZU E IZU COMERCIO DE FRUTAS E LEGUMES LTDA,SAO JOSE DOS CAMPOS,12,1994,Sociedade Limitada
35212706046,RESTAURANTE BELLA PASTA DE CAMPINAS LTDA,CAMPINAS,12,1994,Sociedade Limitada
35212706054,ROSELI & DEUSA CALCADOS LTDA.,CAMPINAS,12,1994,Sociedade Limitada
35212706062,TRANSFORMADORES CAV LTDA.,BATATAIS,12,1994,Sociedade Limitada
35212706071,VASSALO AUTO MECANICA LTDA.,SANTA BARBARA D'OESTE,12,1994,Sociedade Limitada
35212706089,CARONE COMERCIO DE ALIMENTOS LTDA.,SAO PAULO,12,1994,Sociedade Limitada
35212706097,D. E M. SCARPELLI REPRESENTACOES LTDA,SANTO ANDRE,12,1994,Sociedade Limitada
35212706101,OOIM-FASHION MODAS LTDA.,SAO CAETANO DO SUL,12,1994,Sociedade Limitada
35212706119,AGRO-RIVA COMERCIO E REPRESENTAÇOES LTDA,ITAPOLIS,12,1994,Sociedade Limitada
35212706127,MARTINS & MARTINS INDUSTRIA E COMERCIO DE CAIXA PARA EMBALAGENS LTDA.,SETE BARRAS,12,1994,Sociedade Limitada
35212706135,BARSOTTI E XAVIER LTDA.,IBITINGA,12,1994,Sociedade Limitada
35212706143,VERZOLA E PORTO LTDA,FRANCA,12,1994,Sociedade Limitada
35212706151,EMAD INDUSTRIA E COMERCIO DE EMBALAGENS LTDA.,SERTAOZINHO,12,1994,Sociedade Limitada
35212706160,SUPER-SACOLAO DA VILA GALVAO LTDA,GUARULHOS,12,1994,Sociedade Limitada
35212706178,SEAWAY CONFECCOES LTDA,SANTOS,12,1994,Sociedade Limitada
35212706186,PRIMOS FESTAS DOCES E SALGADOS LTDA,SANTOS,12,1994,Sociedade Limitada
35212706194,ANLEX ELETRODEPOSICAO LTDA,SAO PAULO,12,1994,Sociedade Limitada
35212706208,NWANGO LANCHES LTDA.,SAO PAULO,12,1994,Sociedade Limitada
35212706216,TATUAPE GARDEN PAISAGISMO LTDA,SAO PAULO,12,1994,Sociedade Limitada
35212706224,BAR E LANCHES CHICO-LA LTDA,SAO PAULO,12,1994,Sociedade Limitada
35212706232,TEMPERO COMERCIO DE ALIMENTO LTDA.,SAO PAULO,12,1994,Sociedade Limitada
35212706241,SOCIETY INFORMATICA COMERCIAL LTDA.,SAO PAULO,12,1994,Sociedade Limitada
35212706259,ELIAS & DELEFRATE LTDA.,ORLANDIA,12,1994,Sociedade Limitada
35212706267,JOAO CARLOS LOPES & CIA LTDA,CAMPINAS,12,1994,Sociedade Limitada
35212706275,DIDA'S LANCHES RIBEIRAO PRETO LTDA.,RIBEIRAO PRETO,12,1994,Sociedade Limitada
35212706283,PASSOS E BUCCINI LTDA.,RIBEIRAO PRETO,12,1994,Sociedade Limitada
35212706291,LA GAMBA E JACOMINI LTDA,RIBEIRAO PRETO,12,1994,Sociedade Limitada
35212706305,C.Z.P. INDUSTRIA DE CONFECCOES LTDA.,JARDINOPOLIS,12,1994,Sociedade Limitada
35212706313,ZIERI E COLOZI INDUSTRIA E COMERCIO DE RACOES LTDA,PITANGUEIRAS,12,1994,Sociedade Limitada
35212706321,NATHER COMERCIO CONSULTORIA E REPRESENTACOES LTDA.,RIBEIRAO PRETO,12,1994,Sociedade Limitada
35212706330,REPRESENTACOES EMANUEL LTDA.,MOCOCA,12,1994,Sociedade Limitada
35212706348,VICTOR MANUEL NUNES VIEIRA E CIA. LTDA,RIBEIRAO PRETO,12,1994,Sociedade Limitada
35212706356,KISSNER REPRESENTACOES LTDA,VIRADOURO,12,1994,Sociedade Limitada
35212706364,CAVALCANTI REPRESENTACOES LTDA.,RIBEIRAO PRETO,12,1994,Sociedade Limitada
35212706372,DELTA COMERCIO DE ACESSORIOS INDUSTRIAIS LTDA.,RIBEIRAO PRETO,12,1994,Sociedade Limitada
35212706381,MERCEARIA LIMA E COIMBRA LTDA.,BATATAIS,12,1994,Sociedade Limitada
35212706399,LAND CAR SOM E ACESSORIOS LTDA,SAO PAULO,12,1994,Sociedade Limitada
35212706402,"RESTAUPARTS COMERCIO, IMPORTACAO E SERVICOS LTDA",SAO PAULO,12,1994,Sociedade Limitada
35212706411,NEW PORT DISTRIBUIDORA DE PECAS LTDA.,SAO PAULO,12,1994,Sociedade Limitada
35212706429,COMERCIO DE LATICINIOS MOURA E MOURA LTDA,RIO CLARO,12,1994,Sociedade Limitada
35212706437,PULBITEX COMUNICACOES VISUAIS LTDA,SAO PAULO,12,1994,Sociedade Limitada
35212706445,ESKILO RESTAURANTE LTDA.,SAO PAULO,12,1994,Sociedade Limitada
35212706453,HIMAR ARTIGOS PARA PRESENTES LTDA,SAO PAULO,12,1994,Sociedade Limitada
35212706461,TENNIS SHOES COMERCIAL LTDA,SAO PAULO,12,1994,Sociedade Limitada
35212706470,PURA VAIDADE COSMETICOS E PRESENTES LTDA.,SANTOS,12,1994,Sociedade Limitada
35212706488,GARBIATIMODAS LTDA.,SANTOS,12,1994,Sociedade Limitada
35212706496,CURTICO CHOPERIA LTDA.,SAO PAULO,12,1994,Sociedade Limitada
35212706500,VISUALL BEACH E PARK INDUSTRIA E COMERCIO LTDA,SAO PAULO,12,1994,Sociedade Limitada
