NIRE,Empresa,Município,Month,Year,Type
35212715525,RESTAURANTE CHADE ARARAQUARA LTDA.,ARARAQUARA,12,1994,Sociedade Limitada
35212715533,NELISE COMERCIO E REPRESENTACOES LTDA,SAO PAULO,12,1994,Sociedade Limitada
35212715541,VIPPER COMERCIO E REPRESENTACOES LTDA.,PRAIA GRANDE,12,1994,Sociedade Limitada
35212715550,PIER SETE COMERCIO E ADMINISTRACAO LTDA.,PRAIA GRANDE,12,1994,Sociedade Limitada
35212715568,DEGAL COMERCIO DE BICICLETAS LTDA.,SAO PAULO,12,1994,Sociedade Limitada
35212715576,OTOCLIN CLINICA DE DIAGNOSTICO AUDIOLOGICO E ASSESSORIA E EMPRESA LTDA.,ITU,12,1994,Sociedade Limitada
35212715584,BICICLETARIA MERCADO LTDA.,SAO PAULO,12,1994,Sociedade Limitada
35212715592,LOGAUT SERVCOM LOGISTICA AUTOMACAO SERVICOS E COMERCIO LTDA,MOGI DAS CRUZES,12,1994,Sociedade Limitada
35212715606,FINE DRESS COMERCIAL LTDA.,SAO PAULO,12,1994,Sociedade Limitada
35212715614,"RRV PRESTACAO DE SERVICOS, PECAS, EQUIPAMENTOS INDUSTRIAIS E COMERCIO LTDA",SANTO ANDRE,12,1994,Sociedade Limitada
35212715622,BIOESSENS LIMITADA,SAO PAULO,12,1994,Sociedade Limitada
35212715631,SANCETT ARTES GRAFICAS LTDA.,SAO PAULO,12,1994,Sociedade Limitada
35212715649,METALURGICA JAMIL LTDA.,IACRI,12,1994,Sociedade Limitada
35212715657,BAZAR E PAPELARIA SONHO COR-DE-ROSA LTDA.,SAO PAULO,12,1994,Sociedade Limitada
35212715665,TOK FINAL COMERCIO DE CORTINAS E ACESSORIOS LTDA,SAO PAULO,12,1994,Sociedade Limitada
35212715673,RETIFICA DE MOTORES OBJETIVA LTDA.,SAO PAULO,12,1994,Sociedade Limitada
35212715681,AVOCAR DISTRIBUIDORA DE AUTOPECAS SOROCABA LTDA.,SOROCABA,12,1994,Sociedade Limitada
35212715690,KAEFY DO BRASIL LTDA.,OSASCO,12,1994,Sociedade Limitada
35212715703,BINAS COMERCIO DE PNEUS LTDA.,SAO PAULO,12,1994,Sociedade Limitada
35212715720,QUENTES E FRIOS MINIMERCADO E MERCEARIA LTDA,ITAPECERICA DA SERRA,12,1994,Sociedade Limitada
35212715738,SALUTIS CENTRO NAUTICO E CIRCUITO INTEGRADO LTDA,SUZANO,12,1994,Sociedade Limitada
35212715746,L B N COMERCIO E REPRESENTACOES LTDA.,IPAUCU,12,1994,Sociedade Limitada
35212715754,TRIANGULO HOTEIS E LAZER LTDA.,CAMPOS DO JORDAO,12,1994,Sociedade Limitada
35212715762,GEL BARRA COMERCIO DE BEBIDAS LTDA,BARRA BONITA,12,1994,Sociedade Limitada
35212715771,VALE DO ITAPETI COMERCIO E CONSTRUCAO LTDA,SAO PAULO,12,1994,Sociedade Limitada
35212715789,SIMAO COMERCIO E REPRESENTACOES COMERCIAIS LTDA.,ESPIRITO SANTO DO PINHAL,12,1994,Sociedade Limitada
35212715797,MILLEU E PARZIALE LTDA,ESPIRITO SANTO DO PINHAL,12,1994,Sociedade Limitada
35212715801,OVERTECH ADVANCED COMPONENTES ELETRONICOS LTDA,GUARULHOS,12,1994,Sociedade Limitada
35212715827,SHOW COSTURA SISTEMAC COMERCIO IMPORTACAO E EXPORTACAO LTDA.,SAO PAULO,12,1994,Sociedade Limitada
35212715835,CARNES NA TABUA RESTAURANTE LTDA,MAUA,12,1994,Sociedade Limitada
35212715843,OXIGEN PROPAGANDA LTDA.,JOANOPOLIS,12,1994,Sociedade Limitada
35212715851,MAGAZINE GALFIERI LTDA.,SAO PAULO,12,1994,Sociedade Limitada
35212715860,NUTRI-DIET COMERCIO DE PRODUTOS DIETETICOS LTDA.,SAO PAULO,12,1994,Sociedade Limitada
35212715878,FREIO BOM ITATIBA COMERCIO DE PECAS E SERVICOS LTDA.,ITATIBA,12,1994,Sociedade Limitada
35212715886,H.T.R. COMERCIO DE PRODUTOS PLASTICOS LTDA.,SAO JOSE DOS CAMPOS,12,1994,Sociedade Limitada
35212715894,DAWAILIBI LIMITADA,SAO JOSE DOS CAMPOS,12,1994,Sociedade Limitada
35212715908,ARTES UHEDA E PAPELARIA LTDA.,CACAPAVA,12,1994,Sociedade Limitada
35212715916,INFOR CELL TRADE CENTER COMERCIAL LTDA,SAO JOSE DOS CAMPOS,12,1994,Sociedade Limitada
35212715924,CATENA COMERCIO E SERVICOS DE INFORMATICA LTDA.,POA,12,1994,Sociedade Limitada
35212715932,COMERCIO E REPRESENTACAO J. KUTTY KUTTY LTDA.,MIRASSOL,12,1994,Sociedade Limitada
35212715941,OSVAN COMERCIO DE PRODUTOS AGROPECUARIOS LTDA.,SAO JOSE DO RIO PRETO,12,1994,Sociedade Limitada
35212715959,MARSON E CARNEVALE LTDA,MIRASSOL,12,1994,Sociedade Limitada
35212715967,MATHAIS & CAMARGO LTDA,SAO JOSE DO RIO PRETO,12,1994,Sociedade Limitada
35212715975,CAPATO & MARIOTTI COMERCIO E REPRESENTACAO LTDA,GUAPIACU,12,1994,Sociedade Limitada
35212715983,COMERCIAL OLIVEIRA CACULA DE BEBIDAS LTDA.,MONTE APRAZIVEL,12,1994,Sociedade Limitada
35212715991,NIBBLE ASSESSORIA E COMERCIO DE INFORMATICA LTDA.,SAO BERNARDO DO CAMPO,12,1994,Sociedade Limitada
35212716009,MINI MAGAZINE MARINETE LTDA.,SAO BERNARDO DO CAMPO,12,1994,Sociedade Limitada
35212716017,JOSE TELMO R. DE SIQUEIRA E CIA LTDA.,NATIVIDADE DA SERRA,12,1994,Sociedade Limitada
35212716025,CASA SIMAO COMERCIO DE MOVEIS LTDA.,CACAPAVA,12,1994,Sociedade Limitada
35212716033,ELAINE RICARDO FRANGUARA LTDA.,GUARATINGUETA,12,1994,Sociedade Limitada
35212716041,FERRAZ E PICOLO LTDA.,SANTO ANDRE,12,1994,Sociedade Limitada
35212716050,BARAO COMERCIALIZACAO E PRESTACAO DE SERVICOS EM EQUIPAMENTOS ELETRO-ELETRONICOS LTDA,MAUA,12,1994,Sociedade Limitada
35212716068,FROMA COMERCIO DE MASSAS E LANCHES LTDA,GUARUJA,12,1994,Sociedade Limitada
35212716076,SOUZA E CARELLA LTDA,SANTOS,12,1994,Sociedade Limitada
35212716084,COMERCIO E CONFECCOES KONIDIS E KONIDIS LTDA.,MAIRIPORA,12,1994,Sociedade Limitada
35212716092,FLYON ARTIGOS DO VESTUARIO LTDA.,CAMPO LIMPO PAULISTA,12,1994,Sociedade Limitada
35212716106,JACAREZINHO TRANSPORTES DE JACAREI LTDA.,JACAREI,12,1994,Sociedade Limitada
35212716114,OKAWARA E SANTOS CREACOES LTDA.,SAO PAULO,12,1994,Sociedade Limitada
35212716122,"VELCAR SERVICOS, IMPORTACAO DE VEICULOS E PECAS LTDA.",SAO PAULO,12,1994,Sociedade Limitada
35212716131,S.J-PAZ LANCHONETE E LOCACAO LTDA.,SAO PAULO,12,1994,Sociedade Limitada
35212716149,SIRIUS PROCESSAMENTO DE DADOS LTDA,SAO BERNARDO DO CAMPO,12,1994,Sociedade Limitada
35212716157,SORVETERIA E DOCERIA VILANGEL LTDA.,SAO PAULO,12,1994,Sociedade Limitada
35212716165,J.V.C. EMPREENDIMENTOS E PARTICIPACOES LTDA,CAMPINAS,12,1994,Sociedade Limitada
35212716173,ACOUSTIC CAIXAS PROFISSIONAIS LTDA.,CAMPINAS,12,1994,Sociedade Limitada
35212716181,FACHINI COMERCIO DE AUTO PECAS E ACESSORIOS LTDA,CAMPINAS,12,1994,Sociedade Limitada
35212716190,KETHER PRESTACAO E TERCERIZACAO DE SERVICOS EMPRESARIAIS LTDA.,MORUNGABA,12,1994,Sociedade Limitada
35212716203,NIVEL COMERCIO E ASSESSORIA AGROPECUARIA LTDA.,JUNDIAI,12,1994,Sociedade Limitada
35212716211,SEMAN MANUTENCOES LTDA.,CAMPO LIMPO PAULISTA,12,1994,Sociedade Limitada
35212716220,DELUXE TURISMO LTDA.,CAMPINAS,12,1994,Sociedade Limitada
35212716238,A ENCANABEM SERVICOS URGENTES LTDA.,CAMPINAS,12,1994,Sociedade Limitada
35212716246,CLINIC OF ENGLISH MATERIAL DIDATICO E IDIOMAS LTDA.,CAMPINAS,12,1994,Sociedade Limitada
35212716254,PRIMA VITA - FARMACIA DE MANIPULACAO LTDA,SAO PAULO,12,1994,Sociedade Limitada
35212716262,K.Y.S. COMERCIO DE ALIMENTOS LTDA.,SAO PAULO,12,1994,Sociedade Limitada
35212716271,WAVE QUIMICA INDUSTRIA E COMERCIO LTDA.,SAO PAULO,12,1994,Sociedade Limitada
35212716289,BUG A BOO CONFECCOES LTDA.,SAO PAULO,12,1994,Sociedade Limitada
35212716297,LILA ATELIER LTDA.,SAO BERNARDO DO CAMPO,12,1994,Sociedade Limitada
35212716301,MIRANA EMBALAGENS LTDA,SAO PAULO,12,1994,Sociedade Limitada
35212716319,ESPACO D VILLE PAES E CONVENIENCIAS LTDA,SAO PAULO,12,1994,Sociedade Limitada
35212716327,CRIALE LINGERIE LTDA,SANTO ANDRE,12,1994,Sociedade Limitada
35212716335,M.A.H. DISTRIBUIDORA DE HORTIFRUTIGRANJEIROS LTDA.,SAO PAULO,12,1994,Sociedade Limitada
35212716343,CLEAN HOUSE VICENTINO BAZAR E PRODUTOS DE LIMPEZA LTDA,SAO VICENTE,12,1994,Sociedade Limitada
35212716351,TRADE IMPORTS COMERCIO IMPORTACAO E EXPORTACAO LTDA.,SAO PAULO,12,1994,Sociedade Limitada
35212716360,BRU-NAT BAZAR E PAPELARIA EM GERAL LTDA.,SAO PAULO,12,1994,Sociedade Limitada
35212716378,VALESTEEL PRODUTOS SIDERURGICOS LTDA,SAO PAULO,12,1994,Sociedade Limitada
35212716386,J. HERNANDES COMERCIO DE FITAS LTDA,VOTUPORANGA,12,1994,Sociedade Limitada
35212716394,HOSPEDARIA ARCO IRIS DO ITARARE LTDA.,SAO VICENTE,12,1994,Sociedade Limitada
35212716408,LEANDRO NEME MONTORO E CIA LTDA.,SOROCABA,12,1994,Sociedade Limitada
35212716416,TRANSGLOBAL COMMUNICATIONS GROUP DO BRASIL SERVICOS E PARTICIPACOES LTDA,SAO PAULO,12,1994,Sociedade Limitada
35212716424,MARCELO MARPE COMERCIO DE MATERIAIS DE INFORMATICA E SERVICOS LTDA.,SAO BERNARDO DO CAMPO,12,1994,Sociedade Limitada
35212716432,PODE CONSULTORIA EMPRESARIAL LTDA,SAO PAULO,12,1994,Sociedade Limitada
35212716441,SILSOM COMERCIAL LTDA.,SAO PAULO,12,1994,Sociedade Limitada
35212716459,NOVA-HANDLING PRESTADORA DE SERVICOS AERONAUTICOS LTDA.,SAO PAULO,12,1994,Sociedade Limitada
35212716467,TTI DO BRASIL IMPORTACAO E EXPORTACAO COMERCIO E SERVICOS LTDA.,SAO PAULO,12,1994,Sociedade Limitada
35212716475,BELISCOS E PETISCOS DO GUARUJA COMERCIO DE BEBIDAS LTDA.,GUARUJA,12,1994,Sociedade Limitada
35212716483,AMOREIRAS INDUSTRIA E COMERCIO DE PLASTICOS LTDA.,DIADEMA,12,1994,Sociedade Limitada
35212716491,NEW JOB CONSTRUCOES E SERVICOS LTDA.,ROSANA,12,1994,Sociedade Limitada
35212716505,TEREZA DO NASCIMENTO SCOMPARIM & CIA. LTDA.,MONTE ALTO,12,1994,Sociedade Limitada
35212716513,MERCADINHO DEFESA DO POVO LTDA.,DIADEMA,12,1994,Sociedade Limitada
35212716521,SCALA EMPRESA JORNALISTICA LTDA.,PONTAL,12,1994,Sociedade Limitada
35212716530,CYNT'XU MODAS LTDA,SAO PAULO,12,1994,Sociedade Limitada
35212716548,ESTIBRAS METAL ESTIRADO LTDA.,SAO BERNARDO DO CAMPO,12,1994,Sociedade Limitada
35212716556,MULTICORTE CENTRO DE SERVICOS DE ACO LTDA,SAO PAULO,12,1994,Sociedade Limitada
35212716564,SACOMA COLCHOES LTDA.,SAO PAULO,12,1994,Sociedade Limitada
35212716572,DROGARIA GBL DE DOURADO LTDA,DOURADO,12,1994,Sociedade Limitada
35212716581,D E E SISTEMAS DE INFORMACAO LTDA,CAMPINA DO MONTE ALEGRE,12,1994,Sociedade Limitada
35212716599,TELETEC DE LINS COMERCIO DE APARELHOS ELETRONICOS LTDA.,LINS,12,1994,Sociedade Limitada
35212716602,MARCIO DOMINGUES VIEIRA E CIA LTDA,ITAPETININGA,12,1994,Sociedade Limitada
35212716611,REFRIJALES INDUSTRIA COMERCIO E REFRIGERACAO LTDA,JALES,12,1994,Sociedade Limitada
35212716629,BELMACO DISTRIBUIDORA LTDA.,SAO PAULO,12,1994,Sociedade Limitada
35212716637,A.B.A. INDUSTRIA E COMERCIO DE ARTEFATOS DE CIMENTO E ARTEFATOS DE CIMENTO E MATERIAIS PARA CONSTRUCAO LTDA,SANTA ISABEL,12,1994,Sociedade Limitada
35212716645,J. D. LUA NOVA RESTAURANTE LTDA.,SAO PAULO,12,1994,Sociedade Limitada
35212716653,A.M. COMERCIO E PRESTACAO DE SERVICOS LTDA,SAO PAULO,12,1994,Sociedade Limitada
35212716661,ART STOK INDUSTRIA E COMERCIO DE ESTOFADOS LTDA.,SOROCABA,12,1994,Sociedade Limitada
35212716670,FUTURO DO AMANHA CONFECCOES LTDA,SAO PAULO,12,1994,Sociedade Limitada
35212716688,COMERCIAL MIGLIACCIO LTDA.,SAO PAULO,12,1994,Sociedade Limitada
35212716696,PEACOCK IMPORTACAO E COMERCIO LTDA.,SAO PAULO,12,1994,Sociedade Limitada
35212716700,AA AQUECEDORES ACESSORIOS E ASSISTENCIA LTDA.,CAMPINAS,12,1994,Sociedade Limitada
35212716718,RESTAURANTE RECANTO MARIAL LTDA.,SANTA CRUZ DO RIO PARDO,12,1994,Sociedade Limitada
35212716726,A. T. P. G. ARANHA E CIA LTDA,ANDRADINA,12,1994,Sociedade Limitada
35212716734,CAMARGO E BIANCO LTDA,ARARAQUARA,12,1994,Sociedade Limitada
35212716742,CONFECCOES DALA PRIA,SUMARE,12,1994,Sociedade Limitada
35212716751,COMERCIAL PEREIRA E ZALNIERUKYNAS LTDA.,GUARATINGUETA,12,1994,Sociedade Limitada
35212716769,JORNAL NEGOCIOS CLASSIFICADOS LTDA.,ITANHAEM,12,1994,Sociedade Limitada
35212716777,"SQUADRUS MOV INDUSTRIA E COMERCIO DE MOVEIS LTDA. ""EM LIQUIDACAO""",BARRETOS,12,1994,Sociedade Limitada
35212716785,TERRA AZUL TURISMO LTDA,MONTE AZUL PAULISTA,12,1994,Sociedade Limitada
35212716793,CASA DE CARNES CONFIANCA CATANDUVA LTDA.,CATANDUVA,12,1994,Sociedade Limitada
35212716807,ANDRE LUIS CASTELO BRANCO FRANK & CIA LTDA,AMERICO BRASILIENSE,12,1994,Sociedade Limitada
35212716815,MINI MERCADO REAL ASSIS LTDA.,ASSIS,12,1994,Sociedade Limitada
35212716823,OSVALDO LUCENTE & CIA. LTDA.,PITANGUEIRAS,12,1994,Sociedade Limitada
35212716831,SILVA E DRESSADOR LTDA.,RIO CLARO,12,1994,Sociedade Limitada
35212716840,"TF TRANSPORTES, CONSTRUCOES E COMERCIO LTDA",SAO PAULO,12,1994,Sociedade Limitada
35212716858,CONSTRUWORLD CONSTRUTORA E INCORPORADORA LTDA,PRAIA GRANDE,12,1994,Sociedade Limitada
35212716866,V. D. COSTA E CIA LTDA.,AMERICANA,12,1994,Sociedade Limitada
35212716874,SORVETERIA E ALIMENTOS PITTA LTDA.,AMERICANA,12,1994,Sociedade Limitada
35212716882,CENTER MUSIC CD LTDA.,ITATIBA,12,1994,Sociedade Limitada
35212716891,PREMOLDART INDUSTRIA E COMERCIO LTDA,EMBU,12,1994,Sociedade Limitada
35212716904,OURIVES COMERCIO E CONFECCOES LTDA.,SAO ROQUE,12,1994,Sociedade Limitada
35212716912,DISTRIBUIDORA DE BEBIDAS ITATIBA LTDA.,ITATIBA,12,1994,Sociedade Limitada
35212716921,PAULI-MIXTA MODAS LTDA.,SAO PAULO,12,1994,Sociedade Limitada
35212716939,P.P.C. COMERCIO DE MATERIAL DE CONSTRUCAO LTDA.,EMBU,12,1994,Sociedade Limitada
35212716947,STUDIO PAULISTA CASUAL WEAR MODAS LTDA,SAO PAULO,12,1994,Sociedade Limitada
35212716955,LA BELLO ESTATE COMERCIO E CONFECCOES LTDA.,NOVA ODESSA,12,1994,Sociedade Limitada
35212716971,CADEDO COMERCIO IMPORTACAO E EXPORTACAO LTDA.,OSASCO,12,1994,Sociedade Limitada
35212716980,RBR PAULISTA ENGENHARIA E COMERCIO LTDA.,SAO PAULO,12,1994,Sociedade Limitada
35212716998,PAULO AKIO MIZUTA & CIA LTDA.,SAO PAULO,12,1994,Sociedade Limitada
35212717005,FABBY VIDEO LOCADORA LTDA,SAO PAULO,12,1994,Sociedade Limitada
35212717013,COPYMASTER COPIADORA LTDA,SAO PAULO,12,1994,Sociedade Limitada
35212717021,MAZO COMERCIO DE VEICULOS LTDA,SAO PAULO,12,1994,Sociedade Limitada
35212717030,PASSOS & COMPASSOSLTDA,SAO PAULO,12,1994,Sociedade Limitada
35212717048,COMUNICATIVA ESCRITORIO DE COMUNICACAO E COMERCIO DE BRINDES LTDA,SAO PAULO,12,1994,Sociedade Limitada
35212717056,MODO NOVO COMERCIAL LTDA,FERRAZ DE VASCONCELOS,12,1994,Sociedade Limitada
35212717064,MARCENARIA E REFRIGERACAO RENASCER LTDA.,GUARULHOS,12,1994,Sociedade Limitada
35212717072,OCEANO COMERCIO E INTERMEDIACOES LTDA.,SAO PAULO,12,1994,Sociedade Limitada
35212717081,RESTAURANTE PINEDO LTDA.,SAO PAULO,12,1994,Sociedade Limitada
35212717099,CONSTRUTORA NICAL LTDA,SAO CAETANO DO SUL,12,1994,Sociedade Limitada
35212717102,EXPRESS SISTEMS INFORMATICA SE TERCEIRIZACAO LTDA,SAO PAULO,12,1994,Sociedade Limitada
35212717111,BAZAR AMALLY LTDA.,DIADEMA,12,1994,Sociedade Limitada
35212717129,RASERA COMERCIO DE UTILIDADES DOMESTICAS LTDA,EMBU,12,1994,Sociedade Limitada
35212717137,BAR AR E MAR LTDA.,SAO PAULO,12,1994,Sociedade Limitada
35212717145,JOTA BELLO INDUSTRIA E COMERCIO LTDA,LIMEIRA,12,1994,Sociedade Limitada
35212717153,HBS COMERCIO E REPRESENTACOES LTDA,SUZANO,12,1994,Sociedade Limitada
35212717161,D.G. TRANSPORTES E SERVICOS LTDA.,BARUERI,12,1994,Sociedade Limitada
35212717170,L. S. CORPUM INDUSTRIA E COMERCIO DE IDENTIFICACOES E ESMALTACAO LTDA.,SAO PAULO,12,1994,Sociedade Limitada
35212717188,AGROCAMPESTRE COMERCIAL LTDA.,SAO PAULO,12,1994,Sociedade Limitada
35212717196,NASCER DO SOL AUTO POSTO LTDA.,PRESIDENTE PRUDENTE,12,1994,Sociedade Limitada
35212717200,TIRADENTES COMERCIO DE PNEUS LTDA,GUARULHOS,12,1994,Sociedade Limitada
35212717218,JLV REPRESENTACOES COMERCIAIS LTDA.,BARUERI,12,1994,Sociedade Limitada
35212717226,B. RAMOS TENENTE & CIA LTDA.,SANTOS,12,1994,Sociedade Limitada
35212717234,CASA BINO MATERIAIS PARA CONSTRUCAO LTDA.,SANTOS,12,1994,Sociedade Limitada
35212717242,ATALHO NATURAL QUITANDA E MERCEARIA LTDA.,SAO PAULO,12,1994,Sociedade Limitada
35212717251,G. T. A. COMERCIAL DE ABRASIVOS LTDA.,SAO PAULO,12,1994,Sociedade Limitada
35212717269,FRAMA TRANSPORTES LTDA.,SAO PAULO,12,1994,Sociedade Limitada
35212717277,CEGECAR RODIZIOS E COMPONENTES LTDA.,SAO PAULO,12,1994,Sociedade Limitada
35212717285,U.T.S.COMERCIAL DE COSMETICOS LTDA,SAO PAULO,12,1994,Sociedade Limitada
35212717293,COMERCIAL KABARDA LTDA,GUARULHOS,12,1994,Sociedade Limitada
35212717307,HUANG E CIA. COMERCIO E IMPORTACAO LTDA.,SAO PAULO,12,1994,Sociedade Limitada
35212717315,SABOR DO MAR COMERCIO DE PESCADO LTDA.,SAO SEBASTIAO,12,1994,Sociedade Limitada
35212717323,DE VINK IMPORTACAO E EXPORTACAO LTDA.,SAO PAULO,12,1994,Sociedade Limitada
35212717331,M.A. PARTICIPACOES INDUSTRIA E COMERCIO LTDA.,ARARAQUARA,12,1994,Sociedade Limitada
35212717340,DIMAWI COMERCIO E REPRESENTACOES LTDA.,SAO PAULO,12,1994,Sociedade Limitada
35212717358,EXATEL TELECOMUNICACOES LTDA.,SAO PAULO,12,1994,Sociedade Limitada
35212717366,LTR RETIFIVA AUTO MECANICA E COMERCIO LTDA.,SAO CAETANO DO SUL,12,1994,Sociedade Limitada
35212717374,J.V.M. CONSTRUCOES LTDA.,SAO PAULO,12,1994,Sociedade Limitada
35212717382,PANIFICADORA SHOPPING PAO DOIS LTDA.,PIEDADE,12,1994,Sociedade Limitada
35212717391,PAULISTA TRIBE URBAN BOOT MODAS LTDA.,SAO PAULO,12,1994,Sociedade Limitada
35212717404,AFFONSO COMERCIO DE ALIMENTOS LTDA.,GUARULHOS,12,1994,Sociedade Limitada
35212717412,COLE PARMER INSTRUMENTOS LTDA,SAO PAULO,12,1994,Sociedade Limitada
35212717421,PETERNELLA COMERCIO DE ALIMENTACAO LTDA,SAO PAULO,12,1994,Sociedade Limitada
35212717439,H.P.V.CONSTRUTORA LTDA,SAO PAULO,12,1994,Sociedade Limitada
35212717447,JANE FLORES E PLANTAS LTDA.,MARILIA,12,1994,Sociedade Limitada
35212717455,BAR E MERCEARIA DOIS SOCIOS DE MARILIA LTDA,MARILIA,12,1994,Sociedade Limitada
35212717463,INDUSTRIA E COMERCIO DE PECAS DE BICICLETAS WAHUANE BIKE SHOW LTDA.,MARILIA,12,1994,Sociedade Limitada
35212717471,MONICAR AUTOMOVEIS LTDA,SAO PAULO,12,1994,Sociedade Limitada
35212717480,ORLANDI & FERRO LTDA,PEDREIRA,12,1994,Sociedade Limitada
35212717498,SILVA E SCAPIN LTDA.,CASA BRANCA,12,1994,Sociedade Limitada
35212717501,MONTEIRO E DURAN LTDA.,PALMITAL,12,1994,Sociedade Limitada
35212717510,FOCUSPORT SERVICOS E EQUIPAMENTOS DE SEGURANCA LTDA,SAO PAULO,12,1994,Sociedade Limitada
35212717528,COMFILM - INDUSTRIAL E COMERCIAL DE FILMES E EMBALAGENS LTDA.,BARUERI,12,1994,Sociedade Limitada
35212717536,M.B.B. VASCONCELOS DESPACHOS ADUANEIROS LTDA.,SANTOS,12,1994,Sociedade Limitada
35212717544,FAMILIA MODAS LTDA,SAO VICENTE,12,1994,Sociedade Limitada
35212717552,LGF COMERCIO E MANUTENCAO EM CONSTRUCAO CIVIL LTDA,GUARUJA,12,1994,Sociedade Limitada
35212717561,SKINA CAR SANTISTA COMERCIO DE VEICULOS LTDA.,SANTOS,12,1994,Sociedade Limitada
35212717579,VISION TOUR AGENCIA DE VIAGENS TURISMO LTDA,SANTOS,12,1994,Sociedade Limitada
35212717587,AMERICA IMPORT COMERCIAL EXPORTADORA E IMPORTADORA LTDA.,SAO PAULO,12,1994,Sociedade Limitada
35212717595,MCI INDUSTRIA E COMERCIO DE PRODUTOS ELETRONICOS LTDA.,TABOAO DA SERRA,12,1994,Sociedade Limitada
35212717609,NOR MACHINE GAME LOCACOES E COMERCIO LTDA.,SANTA ISABEL,12,1994,Sociedade Limitada
35212717617,LUFT TECH ENGENHARIA E COMERCIO LTDA,SAO PAULO,12,1994,Sociedade Limitada
35212717625,M.C. INTERMEDIACOES E CORRETAGENS LTDA.,SAO PAULO,12,1994,Sociedade Limitada
35212717633,OCTO PLUS BUREAU DE COMUNICACAO E EDITORA LTDA,CARAPICUIBA,12,1994,Sociedade Limitada
35212717641,ECMA COMERCIO E SERVICOS LTDA.,POA,12,1994,Sociedade Limitada
35212717650,LAJES MENDES INDUSTRIA E COMERCIO LTDA.,GUARULHOS,12,1994,Sociedade Limitada
35212717668,ELETROEROSAO TOTUS LTDA.,SAO PAULO,12,1994,Sociedade Limitada
35212717676,SANTOS INDUSTRIA E COMERCIO DE BEBIDAS LTDA.,SANTOS,12,1994,Sociedade Limitada
35212717684,ECO SUR SERVICOS DE INFORMATICA LTDA,SAO PAULO,12,1994,Sociedade Limitada
35212717692,ROTISSERIE E LANCHONETE SAVI-SERVI LTDA,BAURU,12,1994,Sociedade Limitada
35212717706,CASA DE CARNES CHARLEAUX E CASTRO LTDA,TAUBATE,12,1994,Sociedade Limitada
35212717714,SILUZ COMERCIO E INDUSTRIA DE BOLSAS LTDA,TAUBATE,12,1994,Sociedade Limitada
35212717722,AMORIN DOS SANTOS E SANTOS LTDA,TREMEMBE,12,1994,Sociedade Limitada
35212717731,SORVETERIA FRAZILI GUARA LTDA,GUARATINGUETA,12,1994,Sociedade Limitada
35212717749,DOMINGOS MAROTTA E CIA. LTDA.,PINDAMONHANGABA,12,1994,Sociedade Limitada
35212717757,SANTOS E CEZARO LTDA.,GUARATINGUETA,12,1994,Sociedade Limitada
35212717765,PINTA E BORDA COMERCIO DE LAS E LINHAS LTDA.,SANTO ANDRE,12,1994,Sociedade Limitada
35212717773,ESFIHA CHOPP LANCHONETE LTDA.,EMBU,12,1994,Sociedade Limitada
35212717781,RENIE CONTIER CORRETORA DE SEGUROS LTDA.,SAO PAULO,12,1994,Sociedade Limitada
35212717790,R.V. COMERCIALIZACAO DE PRODUTOS GRAFICOS LTDA.,SANTANA DE PARNAIBA,12,1994,Sociedade Limitada
35212717803,LARANGU'S COMERCIO DE REFEICOES LTDA.,SAO PAULO,12,1994,Sociedade Limitada
35212717811,CAB COMERCIO DE AGUAS LTDA,SAO PAULO,12,1994,Sociedade Limitada
35212717820,NOVA ANHANGUERA BAR E LANCHES LTDA,SAO PAULO,12,1994,Sociedade Limitada
35212717838,LIBER COMERCIO E SERVICOS LTDA.,SAO PAULO,12,1994,Sociedade Limitada
35212717846,INTERNATIONAL PNEUS E SERVICOS LTDA,SAO PAULO,12,1994,Sociedade Limitada
35212717854,P.R. PEREIRA E PEREIRA SERTAOZINHO LTDA,SERTAOZINHO,12,1994,Sociedade Limitada
35212717862,ALICE E MANOEL FECHADURAS LTDA,ARARAS,12,1994,Sociedade Limitada
35212717871,FRUTARIA PARQUE CONTINENTAL LTDA,SAO PAULO,12,1994,Sociedade Limitada
35212717889,SERGIO AMADEO DECORACOES LTDA,LINS,12,1994,Sociedade Limitada
35212717897,PHOENIX VIDEO CLUB PRAIA GRANDE LTDA,PRAIA GRANDE,12,1994,Sociedade Limitada
35212717901,PIZZARIA TIO ZECA LTDA,SAO PAULO,12,1994,Sociedade Limitada
35212717919,LACE BORDADOS MODAS E ARTESANATOS LTDA,SAO PAULO,12,1994,Sociedade Limitada
35212717927,TELECEL COMERCIO DE TELEFONIA LTDA.,ASSIS,12,1994,Sociedade Limitada
35212717935,KAMMAROS COMERCIO DE ALIMENTOS CONGELADOS LTDA,SANTO ANDRE,12,1994,Sociedade Limitada
35212717943,KELLY FRANGOS E MERCEARIA LTDA.,MARILIA,12,1994,Sociedade Limitada
35212717951,MANSOLELLI & RAMOS LTDA.,MARILIA,12,1994,Sociedade Limitada
35212717960,FABRICA DE SORVETES WYLLIAN LTDA.,PRESIDENTE PRUDENTE,12,1994,Sociedade Limitada
35212717978,MARJANE COMERCIO E CONFECCOES LTDA,PRESIDENTE PRUDENTE,12,1994,Sociedade Limitada
35212717986,JULIA E OLGA VIDRACARIA LTDA.,SAO BERNARDO DO CAMPO,12,1994,Sociedade Limitada
35212717994,COMERCIO E RECUPERADORA DE CABINES TRES IRMAOS LTDA.,SAO PAULO,12,1994,Sociedade Limitada
35212718001,FACE MARINHA CONFECCOES E PRESENTES LTDA,SAO PAULO,12,1994,Sociedade Limitada
35212718010,ERA NOVA REPRESENTACAO COMERCIAL LTDA.,SAO PAULO,12,1994,Sociedade Limitada
35212718028,WANELI PRODUTOS DE LIMPEZA LTDA,SAO PAULO,12,1994,Sociedade Limitada
35212718036,CMS CAPAS MOVEIS E SUPRIMENTOS CONFECCAO E COMERCIO LTDA,SAO PAULO,12,1994,Sociedade Limitada
35212718044,LUCA'S BABY COMERCIO DE ROUPAS LTDA,BARUERI,12,1994,Sociedade Limitada
35212718052,NOVA TROPICAL ACOUGUE LTDA,SAO PAULO,12,1994,Sociedade Limitada
35212718061,SEMERARO INDUSTRIA E COMERCIO DE PLASTICOS PARA EMBALAGENS LTDA.,SAO PAULO,12,1994,Sociedade Limitada
35212718079,COMERCIAL NACIONAL DE ABASTECIMENTO DOMICILIAR LTDA.,SAO PAULO,12,1994,Sociedade Limitada
35212718087,ROSOL INDUSTRIA E COMERCIO DE COMPONENTES DE CALCADOS LTDA.,DIADEMA,12,1994,Sociedade Limitada
35212718095,FAREGUS CONFECCOES E COMERCIO LTDA.,SAO BERNARDO DO CAMPO,12,1994,Sociedade Limitada
35212718109,MAX-QUALI COMERCIO DE PRODUTOS DE LIMPEZA LTDA,SAO PAULO,12,1994,Sociedade Limitada
35212718117,PORTO MARBELLA LANCHONETE LTDA.,ITANHAEM,12,1994,Sociedade Limitada
35212718125,ORTHOLINE PRODUTOS MEDICOS LTDA.,SAO PAULO,12,1994,Sociedade Limitada
35212718133,RICAL VEICULOS LTDA.,MOGI DAS CRUZES,12,1994,Sociedade Limitada
35212718141,ZANETI E MINUSSI LTDA.,SAO JOSE DO RIO PARDO,12,1994,Sociedade Limitada
35212718150,COMERCIO DE BORRACHAS OURINHOS LTDA.,OURINHOS,12,1994,Sociedade Limitada
35212718168,J.A. LUBRIFICANTES E PECAS LTDA.,SAO PAULO,12,1994,Sociedade Limitada
35212718176,ADEGA IDEAL LTDA.,DIADEMA,12,1994,Sociedade Limitada
35212718184,PRAIS E VALERA LTDA.,CATANDUVA,12,1994,Sociedade Limitada
35212718192,BAZAR DA TURMA LTDA.,SANTO ANDRE,12,1994,Sociedade Limitada
35212718206,"ITAL CONSTRUTORA,ENGENHARIA,INCORPORADORA E EMPREENDIMENTOS IMOBILIARIOS LTDA",SAO PAULO,12,1994,Sociedade Limitada
35212718214,BAR CAMILO & AGUIAR LTDA,SAO PAULO,12,1994,Sociedade Limitada
35212718222,DESTAK MERCADINHO LTDA,GUARULHOS,12,1994,Sociedade Limitada
35212718231,EDITORA N.G.G. COMUNICACOES LTDA,GUARULHOS,12,1994,Sociedade Limitada
35212718249,J.A. DE GUARULHOS MATERIAIS ELETRICOS E HIDRAULICOS LTDA,GUARULHOS,12,1994,Sociedade Limitada
35212718257,FJF COMERCIO DE VEICULOS LTDA.,SAO PAULO,12,1994,Sociedade Limitada
35212718265,LANCHONETE TRES MIL E UM LTDA.,SAO PAULO,12,1994,Sociedade Limitada
35212718273,FORTES SALZANO EMPREENDIMENTOS IMOBILIARIOS E PARTICIPACOES LTDA.,SAO PAULO,12,1994,Sociedade Limitada
35212718281,VIDEO GONNER COMERCIO E LOCADORA LTDA.,SAO PAULO,12,1994,Sociedade Limitada
35212718290,DIMAR COMERCIO DE MOVEIS E MARCENARIA LTDA.,GUARULHOS,12,1994,Sociedade Limitada
35212718303,THEMAS VIDEO CLUBE LTDA.,SAO PAULO,12,1994,Sociedade Limitada
35212718311,SALSAS E CHEIROS PRODUTOS NATURAIS LTDA,SAO PAULO,12,1994,Sociedade Limitada
35212718320,SPEED MANAGE COMERCIO E SERVICOS DE MALA DIRETA LTDA.,SAO PAULO,12,1994,Sociedade Limitada
35212718338,SPEED WORK INFORMATICA LTDA.,SAO PAULO,12,1994,Sociedade Limitada
35212718346,CASA DE CARNES PRISCILA VIEIRA LTDA.,GUARULHOS,12,1994,Sociedade Limitada
35212718354,NATO SOFTWARE DO BRASIL LTDA.,SAO PAULO,12,1994,Sociedade Limitada
35212718362,DISIGLASS DISTRIBUIDORA E MERCHANDISING LTDA.,SAO PAULO,12,1994,Sociedade Limitada
35212718371,ASTRO ASSESSORIA E COMERCIO DE MATERIAIS PARA ESCRITORIO LTDA.,OSASCO,12,1994,Sociedade Limitada
35212718389,MATTERIK INFORMATICA LTDA.,SAO PAULO,12,1994,Sociedade Limitada
35212718397,DESENTUPIDORA E DEDETIZADORA LITORIAL SUL LTDA.,PRAIA GRANDE,12,1994,Sociedade Limitada
35212718401,ORTECON PARTICIPACOES E EMPREENDIMENTOS ASSESSORIA E ADMINISTRACAO LTDA.,SANTOS,12,1994,Sociedade Limitada
35212718419,COLLA & LIMA LTDA,JABOTICABAL,12,1994,Sociedade Limitada
35212718427,HOTEL VALE VERDE LTDA.,SAO PAULO,12,1994,Sociedade Limitada
35212718435,LADUNA TRANSPORTE LTDA.,CARAPICUIBA,12,1994,Sociedade Limitada
35212718443,R.P.A. INTERNATIONAL TRADING COMERCIO IMPORTACAO E EXPORTACAO LTDA.,SAO PAULO,12,1994,Sociedade Limitada
35212718451,CASA DAS POLPAS COMERCIAL DE FRUTAS LTDA.,SAO JOSE DO RIO PRETO,12,1994,Sociedade Limitada
35212718460,KIGULA DOCES E SALGADOS LTDA.,SAO PAULO,12,1994,Sociedade Limitada
35212718478,SCARPIONI ARTES GRAFICAS LTDA.,SAO PAULO,12,1994,Sociedade Limitada
35212718486,R.BORGHESE - CONFECCOES BORDADOS EM GERAL LTDA.,SAO PAULO,12,1994,Sociedade Limitada
