NIRE,Empresa,Município,Month,Year,Type
35113501870,GILMAR CURVELO CALCADOS,VARGEM GRANDE PAULISTA,12,1994,Empresario
35113501888,JOSE SERGIO DE LACERDA CALCADOS,TABOÃO DA SERRA,12,1994,Empresario
35113501896,ALMERINA GARCIA DE OLIVEIRA,ITAPEVA,12,1994,Empresario
35113501900,TEODORO OLIVEIRA DE LIMA FILHO,APIAÍ,12,1994,Empresario
35113501918,M C MARTINELI PIO,AMERICANA,12,1994,Empresario
35113501926,GERSON PEREIRA SUMARE,CAMPINAS,12,1994,Empresario
35113501934,WILSON EDUARDO SILVA,TAUBATÉ,12,1994,Empresario
35113501942,DARIO FREDERICO DA SILVA,MARÍLIA,12,1994,Empresario
35113501951,RONALDO ALVES DOS SANTOS-CONFECCOES,SANTO ANDRÉ,12,1994,Empresario
35113501969,A. C. CARDOSO RAÇÕES,BEBEDOURO,12,1994,Empresario
35113501977,ANTONIO CLAUDIO BRASIL,SÃO PAULO,12,1994,Empresario
35113501985,GISLEINE CONTIERO VILA CASTILHO,JALES,12,1994,Empresario
35113501993,JOAO PAULO NETTO,ITAPETININGA,12,1994,Empresario
35113502001,JUVENAL VIEIRA SORVETERIA,GUARÁ,12,1994,Empresario
35113502019,L.S. ALVES PANORAMA,PANORAMA,12,1994,Empresario
35113502027,SILVIO DA VEIGA OSASCO,OSASCO,12,1994,Empresario
35113502035,FRANCISCO CLIMERIO MUNIZ,OSASCO,12,1994,Empresario
35113502043,LAIR VITALINO DE ARAUJO,SÃO FRANCISCO,12,1994,Empresario
35113502051,M H JACINTO DE SOUSA,SALESÓPOLIS,12,1994,Empresario
35113502060,LUCIANO JOSE RAMOS SILVESTRIN,NOVO HORIZONTE,12,1994,Empresario
35113502078,MARIA AUGUSTA MOSSIN,SERTÃOZINHO,12,1994,Empresario
35113502086,FABIANO TOLEDO TOMAZ,MOGI DAS CRUZES,12,1994,Empresario
35113502094,WILSON NICOLA,VÁRZEA PAULISTA,12,1994,Empresario
35113502108,ADILSON MORENO NHOATO,JOSÉ BONIFÁCIO,12,1994,Empresario
35113502116,CLAUDIA CRISTINA CHIOZZINI BELLINI,MATÃO,12,1994,Empresario
35113502124,ROSA MONICA VICTORINO,,12,1994,Empresario
35113502132,GETER ANDREOTTI TOLEDO,PALMITAL,12,1994,Empresario
35113502141,MARILDA MASSUCATTO BRAGA,SÃO SEBASTIÃO,12,1994,Empresario
35113502159,JOSE RICARDO AZZOLIN,VINHEDO,12,1994,Empresario
35113502167,M.A.MANTOVANI,VOTUPORANGA,12,1994,Empresario
35113502175,ELEANDRO CRISTOVAO ORMENESE,VINHEDO,12,1994,Empresario
35113502183,MARCIO CARNEIRO ANDRE,JUNDIAÍ,12,1994,Empresario
35113502191,JOSE DE OLIVEIRA E SILVA AURIFLAMA,AURIFLAMA,12,1994,Empresario
35113502205,W.L. VALENTE,SÃO ROQUE,12,1994,Empresario
35113502213,VIVIANE ANGELINO DE ALMEIDA,SÃO CARLOS,12,1994,Empresario
35113502221,EGIDIO JOSE PERRI TABATINGA,TABATINGA,12,1994,Empresario
35113502230,LUIZ CARLOS CAMPOLIM DA CRUZ ITAPEVA,ITAPEVA,12,1994,Empresario
35113502248,MANOEL M DA SILVA SANTA GERTRUDES,SANTA GERTRUDES,12,1994,Empresario
35113502256,CLEIDE MARIA SILVA DOS SANTOS,SÃO JOÃO DA BOA VISTA,12,1994,Empresario
35113502264,GENI PEREIRA VASCONCELOS ARARAQUARA,ARARAQUARA,12,1994,Empresario
35113502272,SERGIO KLIGER,SÃO PAULO,12,1994,Empresario
35113502281,WILIAM MARQUES ANDRADE LANCHONETE,MAUÁ,12,1994,Empresario
35113502299,DULCINEIA DIVINA FERIGATO AVICOLA,SÃO PAULO,12,1994,Empresario
35113502302,EGIDIO FAGOTTI OSASCO,OSASCO,12,1994,Empresario
35113502311,MARIA SUZETE P M SALES,SÃO PAULO,12,1994,Empresario
35113502329,MARCIO PEREIRA DA SILVA LANCHES E SUCOS,SÃO PAULO,12,1994,Empresario
35113502337,MAURILIO PIERINI DE ALBUQUERQUE,CAMPINAS,12,1994,Empresario
35113502345,ALCINDO JONAS,OSASCO,12,1994,Empresario
35113502353,SIMAO CORDEIRO DE ARAUJO BAR,AMERICANA,12,1994,Empresario
35113502361,MARINES MORENO DE OLIVEIRA,GUARULHOS,12,1994,Empresario
35113502370,MARIA JOSE DE ANDRADE BAZAR SANTA RITA,GUARULHOS,12,1994,Empresario
35113502388,LUIZ CARLOS ROMANHA BAR E LANCHONETE,SÃO PAULO,12,1994,Empresario
35113502396,SILVANA PEREIRA CRUZ,FERRAZ DE VASCONCELOS,12,1994,Empresario
35113502400,ADAO LUIZ FERREIRA MAUA,MAUÁ,12,1994,Empresario
35113502418,EVILASIO RUFINO DE ARAUJO,MAUÁ,12,1994,Empresario
35113502426,L GOMES ACOUGUE,SÃO PAULO,12,1994,Empresario
35113502434,MARCIA RAMOS BOTUCATU,BOTUCATU,12,1994,Empresario
35113502442,GEISA MARIA BATISTA MOTERANI,BIRIGÜI,12,1994,Empresario
35113502451,MATHEUS SOARES FILHO MERCEARIA,GUARIBA,12,1994,Empresario
35113502469,JOSE ALVES FERNANDES G DO ALTO,CAPELA DO ALTO,12,1994,Empresario
35113502477,AILTON MIGUEL RODRIGUES SOROCABA,SOROCABA,12,1994,Empresario
35113502485,BERNADETE ABIGAIL DA MOTA MODESTO,CAPELA DO ALTO,12,1994,Empresario
35113502493,MARCIA TONELLI DE SOUZA,TUPÃ,12,1994,Empresario
35113502507,ANA PAULA ZINEZZI ALVES DE ALBUQUERQUE LIMA,PRESIDENTE EPITÁCIO,12,1994,Empresario
35113502515,NIVALDO POLIDORO,INDAIATUBA,12,1994,Empresario
35113502523,MIRTES REGINA GONCALVES RODRIGUES GUARUJA,GUARUJÁ,12,1994,Empresario
35113502531,SANDRA GOMES DA NOBREGA,POÁ,12,1994,Empresario
35113502540,OSMAR C. DE JESUS BARBOSA REPARAÇÃO,POÁ,12,1994,Empresario
35113502558,E F DA SILVA PADARIA,ILHA COMPRIDA,12,1994,Empresario
35113502566,CARMEM GOMES CANATO,SÃO PAULO,12,1994,Empresario
35113502574,R GUEDES DA SILVA-EMPREITEIRA,POÁ,12,1994,Empresario
35113502582,JORGE WENCESLAU SHINODA MOVEIS,ITAQUAQUECETUBA,12,1994,Empresario
35113502591,LENIO FERNANDES VIEIRA DE MORAES VESTUARIO,SOROCABA,12,1994,Empresario
35113502604,ALBERTO CARLOS ANGEOLINI,SOROCABA,12,1994,Empresario
35113502612,S DOS SANTOS JUNIOR JACAREI,JACAREÍ,12,1994,Empresario
35113502621,GISLENE BASLER MELIM LATINICIO,SÃO PAULO,12,1994,Empresario
35113502639,WANDERLEI ZUTIN,SANTO ANDRÉ,12,1994,Empresario
35113502647,MARCELO CAVALCANTI ALVES,PERUÍBE,12,1994,Empresario
35113502655,CLAUDIO LUIZ GRECCO PERUIBE,PERUÍBE,12,1994,Empresario
35113502663,JAIR PALOTA,ITAJOBI,12,1994,Empresario
35113502671,AGNALDO MARCILIO GUARUJA,GUARUJÁ,12,1994,Empresario
35113502680,CARLOS EDUARDO MONTEIRO-BAR,SANTOS,12,1994,Empresario
35113502698,ANDERSON HERNANDES DO NASCIMENTO,GUARUJÁ,12,1994,Empresario
35113502701,E.S. VIRTUOSO,SANTOS,12,1994,Empresario
35113502710,LUIZ SILVA DE MORAES,MIRANTE DO PARANAPANEMA,12,1994,Empresario
35113502728,HOMERO CLEMENCIO SOUZA SANTOS,SANTOS,12,1994,Empresario
35113502736,MARIA IZILDA DOS SANTOS ARACATUBA,ARAÇATUBA,12,1994,Empresario
35113502744,MARIA LUCIA PINTO DE ARAUJO,PRESIDENTE PRUDENTE,12,1994,Empresario
35113502752,PEDRO J DE SOUZA ANDRADINA,ANDRADINA,12,1994,Empresario
35113502761,SANDRA APARECIDA GULKE MAIRIPORA,MAIRIPORÃ,12,1994,Empresario
35113502779,JULIA AKEMI SHOJI-IGUAPE,IGUAPE,12,1994,Empresario
35113502795,JOSE MARIO MONTEVERDE,FLÓRIDA PAULISTA,12,1994,Empresario
35113502809,EMILIA TANAKA WATANABE,SÃO PAULO,12,1994,Empresario
35113502817,VALERIA ROMERA PELLEGRINO,SOROCABA,12,1994,Empresario
35113502825,ELISABETE VASCONCELLOS POTIOLLI MARQUES MERCEARIA,SÃO PAULO,12,1994,Empresario
35113502833,NELSON DAVID SOBRINHO,OSASCO,12,1994,Empresario
35113502841,LORETA GUANCIALE,SÃO PAULO,12,1994,Empresario
35113502850,LUCIA HELENA DE SOUZA CARDOSO,MARÍLIA,12,1994,Empresario
35113502868,WILIAM BRANDAO,MARÍLIA,12,1994,Empresario
35113502876,ANGELO PIVA,OSCAR BRESSANE,12,1994,Empresario
35113502884,HAMILTON SERGIO GARCIA FRANCA,FRANCA,12,1994,Empresario
35113502892,WILSON ANTONIO DE MORAES FRANCA,FRANCA,12,1994,Empresario
35113502914,S C DE SOUZA FRANCA,FRANCA,12,1994,Empresario
35113502922,JOSE BONIFACIO DA SILVA SOBRINHO FRANCA,FRANCA,12,1994,Empresario
35113502931,AMAURI VICENTE VIEIRA REPRESENTACOES,FRANCA,12,1994,Empresario
35113502949,CLEBER ONEI DE OLIVEIRA FRANCA,FRANCA,12,1994,Empresario
35113502957,REGINALDO PAULINO DA SILVA,PEDREGULHO,12,1994,Empresario
35113502965,WILLIAN DAL SASSO,FRANCA,12,1994,Empresario
35113502973,P ROBERTO DA SILVA BAR,FRANCA,12,1994,Empresario
35113502981,D FERREIRA DA SILVA MERCEARIA,OURINHOS,12,1994,Empresario
35113502990,D SIGOLO MAROSTICA OURINHOS,OURINHOS,12,1994,Empresario
35113503007,JOSE HESCKO,SÃO PAULO,12,1994,Empresario
35113503015,JULIETA MAURICIO DA CUNHA,SÃO PAULO,12,1994,Empresario
35113503023,JOSE RICARDO RODRIGUES CAETANO,GUARATINGUETÁ,12,1994,Empresario
35113503031,SYLVIO FERRAZ GALIA,GÁLIA,12,1994,Empresario
35113503040,ADELCIO EUCLYDES PIETROBON JUNIOR,NOVAIS,12,1994,Empresario
35113503058,JOSE FERNANDO COSTA BOTUCATU,BOTUCATU,12,1994,Empresario
35113503066,SONIA MARIA NICOLAU,OURINHOS,12,1994,Empresario
35113503074,EUGENIO MIGUEL VIEIRA SCATENA,DRACENA,12,1994,Empresario
35113503082,ELAINE CRISTINA CAVALARO BIANCHI,SÃO CARLOS,12,1994,Empresario
35113503091,SERGIO XAVIER DO NASCIMENTO,TERRA ROXA,12,1994,Empresario
35113503104,GERALDO VANDRE DE MORAIS,GUAREÍ,12,1994,Empresario
35113503112,CLAUDETE RIBEIRO,SÃO PAULO,12,1994,Empresario
35113503121,VERA AFFONSO DO NASCIMENTO,ITAQUAQUECETUBA,12,1994,Empresario
35113503139,MARCO EDUARDO NUNES BOTUCATU,BOTUCATU,12,1994,Empresario
35113503147,PAULO EDUARDO FUZEL BAURU,BAURU,12,1994,Empresario
35113503155,RIVALDO REGAZZO REBOQUES,OSASCO,12,1994,Empresario
35113503163,MARCOS ROGERIO HARITOV DE ALMEIDA SAO SEBASTIAO,SÃO SEBASTIÃO,12,1994,Empresario
35113503171,ROGERIO DE ARAUJO CARVALHO MATERIAL DE LIMPEZA,SÃO PAULO,12,1994,Empresario
35113503180,GERALDO CAETANO DE FRANCA,GUARULHOS,12,1994,Empresario
35113503198,ANTONIO CARLOS DA RESSUREICAO MANUTENCAO INDUSTRIAL,GUARULHOS,12,1994,Empresario
35113503201,OSVALDO FRANCISCO DE OLIVEIRA VESTUARIO,GUARULHOS,12,1994,Empresario
35113503210,BERNADETE FLORENCIO FRANCISCO BAZAR,FERRAZ DE VASCONCELOS,12,1994,Empresario
35113503228,REGINALDO PEREIRA DE LUCENA INFORMATICA,PIRAPORA DO BOM JESUS,12,1994,Empresario
35113503236,CLEONICE BRANCO OSASCO,OSASCO,12,1994,Empresario
35113503244,MARINALVA DE OLIVEIRA LIMA SORVETERIA,SUZANO,12,1994,Empresario
35113503252,SELMA FEITOSA PIANCO DOS SANTOS VERDURAS,SÃO PAULO,12,1994,Empresario
35113503261,MARIA APARECIDA SANTANA MACHADO ROSA,SÃO SEBASTIÃO,12,1994,Empresario
35113503279,MARCO ANTONIO DE MELO NASCIMENTO,BATATAIS,12,1994,Empresario
35113503287,GILDETE DE ALCANTARA NASCIMENTO,ITAQUAQUECETUBA,12,1994,Empresario
35113503295,ELAINE CESSERO DA SILVA,SÃO CAETANO DO SUL,12,1994,Empresario
35113503309,SUELI APARECIDA DOS SANTOS FRANCO DA ROCHA,FRANCO DA ROCHA,12,1994,Empresario
35113503317,JOANA MARIA DE JESUS OSASCO,OSASCO,12,1994,Empresario
35113503325,JOSE LUCIO CORDEIRO,OSASCO,12,1994,Empresario
35113503333,MARIA DAS GRACAS SANTOS DA SILVA RIO GRANDE,RIO GRANDE DA SERRA,12,1994,Empresario
35113503341,MARIA DA SILVA VELOSO RIBEIRAO PIRES,RIBEIRÃO PIRES,12,1994,Empresario
35113503350,MARIO TEODORO LINO RIBEIRAO PIRES,RIBEIRÃO PIRES,12,1994,Empresario
35113503376,CLAUDETE ROSA DAMASCENO MONTOAN,SÃO PAULO,12,1994,Empresario
35113503392,ROSANGELA ALVES MANGABEIRA DE AQUINO,SÃO PAULO,12,1994,Empresario
35113503406,MARIA DA PENHA SANTOS - DECORACOES,SÃO PAULO,12,1994,Empresario
35113503414,JOSE FRANCISCO BRAZIL,SÃO PAULO,12,1994,Empresario
35113503422,JOAO RUFINO DE SOUZA NETO MATERIAIS PARA CONSTRUCAO,SÃO PAULO,12,1994,Empresario
35113503431,F A DE PAULA CAMPO LIMPO PAULISTA,CAMPO LIMPO PAULISTA,12,1994,Empresario
35113503449,P LUIZ DA SILVA CONFECCAO,GUARULHOS,12,1994,Empresario
35113503457,MARIA LUCIA TOMA,SÃO PAULO,12,1994,Empresario
35113503465,JOSE CARLOS MAIA,SÃO PAULO,12,1994,Empresario
35113503473,OSEIAS GOMES DA SILVA,SÃO PAULO,12,1994,Empresario
35113503481,P B DUARTE AVICOLA,ITAQUAQUECETUBA,12,1994,Empresario
35113503490,HILDA ZELINDA BELLINI BAURU,BAURU,12,1994,Empresario
35113503503,ANTONIO TAVARES DE OLIVEIRA - PERUIBE,PERUÍBE,12,1994,Empresario
35113503511,ALCENI BARBOSA FLORES CUSTODIO,IPUÃ,12,1994,Empresario
35113503520,BENEDITO MONTEIRO ITAI,ITAÍ,12,1994,Empresario
35113503538,LUIZ CARLOS DE MORAIS-MANDURI,MANDURI,12,1994,Empresario
35113503546,RAQUEL BERNARDINO DE ARAUJO,CARAGUATATUBA,12,1994,Empresario
35113503554,VANDA PEREIRA LOPES,CRAVINHOS,12,1994,Empresario
35113503562,WASHINGTON JESUS MONTEIRO-GETULINA,GETULINA,12,1994,Empresario
35113503571,ELIANO ANTUNES DE OLIVEIRA-CEREAIS,TAQUARITUBA,12,1994,Empresario
35113503589,CARMO APARECIDO DE OLIVEIRA - BAURU,BAURU,12,1994,Empresario
35113503597,CARLOS ALBERTO FERREIRA - EMBALAGENS,BANANAL,12,1994,Empresario
35113503601,ROBERTO CANHISARES,COTIA,12,1994,Empresario
35113503619,VICENTINA DA G SIQUEIRA CRUZEIRO,CRUZEIRO,12,1994,Empresario
35113503627,MARCIO ALEXANDRE DA CUNHA CRUZEIRO,CRUZEIRO,12,1994,Empresario
35113503635,VALDEVINO BARREIRA PECAS,SÃO PAULO,12,1994,Empresario
35113503643,ROBERTO LUIZ DA SILVA RODRIGUES,SÃO PAULO,12,1994,Empresario
35113503651,SILVIA MEIRA CHEUNG,SÃO PAULO,12,1994,Empresario
35113503660,MILTON APARECIDO DE OLIVEIRA-ACOUGUE,,12,1994,Empresario
35113503678,FRANCISCO SANCHEZ-IGUAPE,ILHA COMPRIDA,12,1994,Empresario
35113503686,ADRIANA APARECIDA COLLA TRENCH,CANANÉIA,12,1994,Empresario
35113503694,MARIA JOSE CORACAO SILVEIRA,TORRE DE PEDRA,12,1994,Empresario
35113503708,RUBENS GAVIOLI ITAPETININGA,ITAPETININGA,12,1994,Empresario
35113503716,MARIA APARECIDA FERREIRA ITAPOLIS,ITÁPOLIS,12,1994,Empresario
35113503724,SEBASTIAO FERREIRA DA SILVA BEBEDOURO,RIBEIRÃO PRETO,12,1994,Empresario
35113503732,DURVALINA FERRI PRADO,ITUVERAVA,12,1994,Empresario
35113503741,MARIA PIEDADE DE SOUZA STA FE,SANTA FÉ DO SUL,12,1994,Empresario
35113503759,ELINA MARCIANO DA SILVA-PRESIDENTE PRUDENTE,PRESIDENTE PRUDENTE,12,1994,Empresario
35113503767,CLAUDINEI LUIZ DA SILVA MATERIAL PARA CONSTRUCAO,SERTÃOZINHO,12,1994,Empresario
35113503775,ANTONIO DE PADUA LIMA,SOCORRO,12,1994,Empresario
35113503783,ADEMILSON SOUZA CARVALHO,EUCLIDES DA CUNHA PAULISTA,12,1994,Empresario
35113503791,JOAO B DOS SANTOS TANABI,TANABI,12,1994,Empresario
35113503805,ISAURA DE OLIVEIRA FEITOZA,VOTUPORANGA,12,1994,Empresario
35113503813,ESTEVOM BEZERRA EVANGELISTA,VOTUPORANGA,12,1994,Empresario
35113503821,RUBENS BEZERRA CAVALCANTI,SÃO PAULO,12,1994,Empresario
35113503830,CONCEICAO AUGUSTA VIEIRA,SÃO PAULO,12,1994,Empresario
35113503848,MARIA ANDRELINA DOS SANTOS,SÃO PAULO,12,1994,Empresario
35113503856,RENATO ALVES DOS SANTOS-DESENHOS,SÃO PAULO,12,1994,Empresario
35113503864,ULISSES GOMES DE LIMA,SÃO PAULO,12,1994,Empresario
35113503872,IRENE DE JESUS PEREIRA-PIEDADE,PIEDADE,12,1994,Empresario
35113503881,DAVID DA SILVA MOLINA,ITARARÉ,12,1994,Empresario
35113503899,NORTHON CELIO REGO DE OLIVEIRA,FERRAZ DE VASCONCELOS,12,1994,Empresario
35113503902,PAULO ARTHUR LANDGRAF,BERTIOGA,12,1994,Empresario
35113503911,JARBAS LUIS MONTEIRO NEO,ESPÍRITO SANTO DO PINHAL,12,1994,Empresario
35113503929,PAULO TESSARINI LOPES,ESPÍRITO SANTO DO PINHAL,12,1994,Empresario
35113503937,JOAO EDUARDO EDINGER,TABOÃO DA SERRA,12,1994,Empresario
35113503945,ESTER DO AMARAL VALADAO,SÃO PAULO,12,1994,Empresario
35113503953,ELAINE M P CALTABIANO,GUARATINGUETÁ,12,1994,Empresario
35113503961,RONALDO RIBEIRO DA SILVA INFORMATICA,SÃO PAULO,12,1994,Empresario
35113503970,DAGOBERTO VERSTANDIG PEREIRA LIMA,INDAIATUBA,12,1994,Empresario
35113503988,ROSANGELA JABUR MACIEL,SÃO PAULO,12,1994,Empresario
35113503996,MARIA JOSE DE LIMA E SILVA HIDRAULICA,SÃO PAULO,12,1994,Empresario
35113504003,APARECIDA DE FATIMA RODRIGUES,GUARULHOS,12,1994,Empresario
35113504011,SON DEUK KIM KIL,SÃO PAULO,12,1994,Empresario
35113504020,CARLOS ALBERTO LUCAS-FEIRANTE,SÃO PAULO,12,1994,Empresario
35113504038,PEDRO ALVES DOS REIS-BAR,TABOÃO DA SERRA,12,1994,Empresario
35113504046,MARIA OLGA DE GODOY POLLI,OSASCO,12,1994,Empresario
35113504054,PATRICIA HELENA RONCONI,TAUBATÉ,12,1994,Empresario
35113504062,JOAO PEREIRA LOPES BAR,RIBEIRÃO PIRES,12,1994,Empresario
35113504071,SILMARA ELAINE GIL MALANGA,MAIRIPORÃ,12,1994,Empresario
35113504089,MARCIO ANTONIO MARTORELLI,MAIRIPORÃ,12,1994,Empresario
35113504097,NILSON MARTINS SANTA CRUZ,SANTA CRUZ DO RIO PARDO,12,1994,Empresario
35113504101,DEBORA APARECIDA SBRAGIA CONVENTO,CONCHAS,12,1994,Empresario
35113504119,MARLY SARTORELO MARQUES TIZATTO,CATANDUVA,12,1994,Empresario
35113504127,MARIO APARECIDO FERREIRA MERCEARIA,CARAGUATATUBA,12,1994,Empresario
35113504135,CILAS FERREIRA,RIO DAS PEDRAS,12,1994,Empresario
35113504143,SUELI CRISTINA FRANCHITO PIRACICABA,PIRACICABA,12,1994,Empresario
35113504151,KATIA APARECIDA DE ALMEIDA,PIRACICABA,12,1994,Empresario
35113504160,MARIA DE LOURDES LUPPI PACHIONE,BOCAINA,12,1994,Empresario
35113504178,LAERTE SIGOLI,,12,1994,Empresario
35113504186,MARCO ANTONIO PEREIRA NOVAES PEREIRAS,PEREIRAS,12,1994,Empresario
35113504194,CONCEICAO APARECIDA HILARIO DA SILVA,BARRETOS,12,1994,Empresario
35113504208,NEIDE TIETZ DE OLIVEIRA,TUPI PAULISTA,12,1994,Empresario
35113504216,NEUSA DOS SANTOS LIMA,ASSIS,12,1994,Empresario
35113504224,REINALDO JOSE FURLANETO,ITAPETININGA,12,1994,Empresario
35113504232,U. L. PEREIRA FARTURA,FARTURA,12,1994,Empresario
35113504241,VALTER AP AFONSO,JUNQUEIRÓPOLIS,12,1994,Empresario
35113504259,ANTONIO LECHUGO RUBIO ITAPETININGA,ITAPETININGA,12,1994,Empresario
35113504267,FLAVIO SILVEIRA LIMA PORCELANAS,PEDREIRA,12,1994,Empresario
35113504275,ELAINE CRISTINA GARCIA PACHECO,GUAPIARA,12,1994,Empresario
35113504283,DIVAIR DE CASTRO PRADOPOLIS,PRADÓPOLIS,12,1994,Empresario
35113504291,ERNESTINA BERNARDES DE OLIVEIRA,PONTAL,12,1994,Empresario
35113504305,CARLOS HENRIQUE D'AGOSTINI,RIBEIRÃO PRETO,12,1994,Empresario
35113504313,APARECIDA DOS SANTOS MAFRIM,PONTAL,12,1994,Empresario
35113504321,MARIA HELENA GUERRA DE CAMARGO,ORLÂNDIA,12,1994,Empresario
35113504330,SARA DE OLIVEIRA GONCALVES,NOVA ODESSA,12,1994,Empresario
35113504348,MARLI APARECIDA PONGILUPPI SARABANDO,SÃO PAULO,12,1994,Empresario
35113504356,MOACIR ANTONIO PEIXOTO,ARAÇATUBA,12,1994,Empresario
35113504364,CLAUDIA CARDONA,,12,1994,Empresario
35113504372,WAGNER TADEU DE SOUZA,SÃO PAULO,12,1994,Empresario
35113504381,FULVIA HELENA RODRIGUES SOZIM,ITAPEVA,12,1994,Empresario
35113504399,SINDI MIASHIRO,GUARULHOS,12,1994,Empresario
35113504402,LUCIANA YURI MIASHIRO,SOCORRO,12,1994,Empresario
35113504411,JEHOVAH ALVES CARDOSO,BRAGANÇA PAULISTA,12,1994,Empresario
35113504429,C. A. P. DA SILVA,MINEIROS DO TIETÊ,12,1994,Empresario
35113504437,I S SOUSA COMBUSTIVEIS,IEPÊ,12,1994,Empresario
35113504445,PASQUALE DELORENZO,GUARULHOS,12,1994,Empresario
35113504453,LORINETE MENEZES DA SILVA ABOUD,OSASCO,12,1994,Empresario
35113504461,MARIA LUCIA RAMOS DE SOUZA,OSASCO,12,1994,Empresario
35113504470,CARLOS ALBERTO NOBRE SAFADI,SÃO PAULO,12,1994,Empresario
35113504488,BENEDITA APARECIDA DE TOLEDO MODAS,SÃO BERNARDO DO CAMPO,12,1994,Empresario
35113504496,A J MORAIS MECANICA,MONGAGUÁ,12,1994,Empresario
35113504500,SILVIO CESAR EVANGELISTA BAR,MOGI DAS CRUZES,12,1994,Empresario
35113504518,MAURICIO BARBANO LAGE TAPECARIA,SÃO PAULO,12,1994,Empresario
35113504526,JULIA SAYURI KOGA,SÃO PAULO,12,1994,Empresario
35113504534,EDNA MARIA MOREIRA DA SILVA,DIADEMA,12,1994,Empresario
35113504542,EVALDO PATRICIO DA SILVA,SÃO PAULO,12,1994,Empresario
35113504551,MARLENE BOREGGIO RODRIGUES,BIRIGÜI,12,1994,Empresario
35113504569,DORIVAL SALERNO VALENTIM,SÃO PAULO,12,1994,Empresario
35113504577,MARIA FRANCISCA SANTOS DA SILVA BOLSAS,SÃO PAULO,12,1994,Empresario
35113504585,HELIO ANTONIO CARVALHO CONFECCOES,SÃO PAULO,12,1994,Empresario
35113504593,IVONE BATISTA DE SOUZA,SÃO PAULO,12,1994,Empresario
35113504607,VITAL RICO RENO,JACAREÍ,12,1994,Empresario
35113504615,R.C.MARTINS-CONFECCOES,SÃO JOSÉ DO RIO PRETO,12,1994,Empresario
35113504623,SUELI DE CARVALHO PINA-SAO JOSE DO RIO PRETO,SÃO JOSÉ DO RIO PRETO,12,1994,Empresario
35113504631,CLAUDIO MARCOS JACO,EMBU DAS ARTES,12,1994,Empresario
35113504640,MARCIA REGINA DA ROCHA,CAMPINAS,12,1994,Empresario
35113504658,MARIA INEZ GROSSELI BENEDETTI,INDAIATUBA,12,1994,Empresario
35113504666,MARYVONI ANDRADE DA SILVA-CECAP SALTO,SALTO,12,1994,Empresario
35113504674,APARECIDO ROSA-ITUPEVA,ITUPEVA,12,1994,Empresario
35113504682,MARIA DULCINEI PAVANI PAROLIN,SÃO JOÃO DA BOA VISTA,12,1994,Empresario
35113504691,ANA R. F. TICON-MATERIAIS DE CONSTRUCAO.,SÃO PAULO,12,1994,Empresario
35113504704,MARCIA T F BORNIA GIATTI,AREALVA,12,1994,Empresario
35113504712,CLAUDIO APARECIDO SPADIM-BOTUCATU,BOTUCATU,12,1994,Empresario
35113504721,DIORGES ALVES DOS SANTOS,BAURU,12,1994,Empresario
35113504739,FATIMA A DE F CANELLA,SERTÃOZINHO,12,1994,Empresario
35113504747,GILBERTO GOMES DA SILVA JAU,JAÚ,12,1994,Empresario
35113504755,JOAO B DA SILVA ARARAQUARA,ARARAQUARA,12,1994,Empresario
35113504763,LUIZ CARLOS DEI AGNOLI,DIVINOLÂNDIA,12,1994,Empresario
35113504771,CELIRA CAMILLOS DA CUNHA MARILIA,MARÍLIA,12,1994,Empresario
35113504780,CLAUDEMIR DO CARMO SANTOS,SÃO CARLOS,12,1994,Empresario
35113504798,ADELAIDE APARECIDA VITTI SILVA,PANORAMA,12,1994,Empresario
35113504801,NEUSA MARIA PARO DIAS,GUARULHOS,12,1994,Empresario
35113504810,MARTA RODRIGUES DOS SANTOS,ASSIS,12,1994,Empresario
35113504828,ROBERTO HORA HARRIS,SÃO SEBASTIÃO,12,1994,Empresario
35113504836,JOAO CARLOS SILVA DE FREITAS,SANTO ANDRÉ,12,1994,Empresario
35113504844,VALDEIR JOSE RIBEIRO,SANTA ISABEL,12,1994,Empresario
35113504852,ELIANA DE LUCCA SCHIMEK,SANTA ISABEL,12,1994,Empresario
35113504861,JOAO PEDRO DA SILVA AMBULANTE,SÃO PAULO,12,1994,Empresario
35113504879,VICENTINA BIZERRA DE SAMPAIO,SÃO PAULO,12,1994,Empresario
35113504887,FRANCISCO PORFIRIO DOS SANTOS,GUARULHOS,12,1994,Empresario
35113504895,TANIA MARIA OLIVEIRA CONTI,CARAPICUÍBA,12,1994,Empresario
35113504909,JOAO LUIZ DA SILVA TABOAO DA SERRA,TABOÃO DA SERRA,12,1994,Empresario
35113504917,ANTONIO GOMES DE CARVALHO CONCHAL,CONCHAL,12,1994,Empresario
35113504925,MARIA JOSE CIRIACO DOS SANTOS,SÃO PAULO,12,1994,Empresario
35113504933,M ALICE FERREIRA,SÃO SEBASTIÃO,12,1994,Empresario
35113504941,V.L.C.SOARES CAMPINAS,CAMPINAS,12,1994,Empresario
35113504950,JOSE AGOSTINHO LUZ SOUZA,SÃO PAULO,12,1994,Empresario
35113504968,LOUDMIR MOREIRA JACAREI,JACAREÍ,12,1994,Empresario
35113504976,REGINA CELIA ZEOTTI BARBOZA,SÃO PAULO,12,1994,Empresario
35113504984,ARLENE APARECIDA MENEZES MARTINS,MAIRIPORÃ,12,1994,Empresario
35113504992,LUIZ CARLOS FELIPE COMERCIO DE PRODUTOS,SÃO BERNARDO DO CAMPO,12,1994,Empresario
35113505000,SEBASTIAO DE PAULA INDAIATUBA,INDAIATUBA,12,1994,Empresario
35113505018,MARIO ASLEI TOZONI,ASSIS,12,1994,Empresario
35113505026,EDILENE NANTES COSTA IBITINGA,IBITINGA,12,1994,Empresario
35113505034,EDNA GONCALVES GUARA,GUARÁ,12,1994,Empresario
35113505042,EDINO FACHINI,CATANDUVA,12,1994,Empresario
35113505051,BENEDITO MORENO GUARA,GUARÁ,12,1994,Empresario
35113505069,CARLOS AUGUSTO ALVES JAU,JAÚ,12,1994,Empresario
35113505077,ORLANDO SILVESTRE DE MORAES,PALMITAL,12,1994,Empresario
35113505085,ROSANGELA HELENA FERNANDES GARCIA BARRA BONITA,BARRA BONITA,12,1994,Empresario
35113505093,GILLIAN CRISTINA CARNEIRO LENCOIS PAULISTA,LENÇÓIS PAULISTA,12,1994,Empresario
35113505107,EDSON DA SILVA PERFURAÇÕES,SANTA CRUZ DO RIO PARDO,12,1994,Empresario
35113505115,APARECIDA DE FATIMA COCOLETI,BASTOS,12,1994,Empresario
35113505123,JOYCILEIA SCANTABULE BENINE,PIRASSUNUNGA,12,1994,Empresario
35113505131,CASSIA RITA PEREIRA,NOVO HORIZONTE,12,1994,Empresario
35113505140,MARIA LUIZA J VAZ,ASSIS,12,1994,Empresario
35113505158,SIRLENE ZIA DO NASCIMENTO,SOCORRO,12,1994,Empresario
35113505166,NAIRTHON TEIXEIRA DOS SANTOS,ITAPIRA,12,1994,Empresario
35113505174,AMAURI APARECIDO BENICIO,MOCOCA,12,1994,Empresario
35113505182,ANTONIO DE VITERBO BELTRAMINI,PEDERNEIRAS,12,1994,Empresario
35113505191,ALFREDO WANDERLEY DE BRANCO FEIRANTE,SÃO PAULO,12,1994,Empresario
35113505204,ROSEMEIRE PEREIRA CASTINO FEITOSA,SÃO PAULO,12,1994,Empresario
35113505212,JOSE MILTON P DE MIRANDA VERDURAS,SÃO PAULO,12,1994,Empresario
35113505221,N. B. ALVES CORREIA PAES,CESÁRIO LANGE,12,1994,Empresario
35113505239,PAULO CESAR CAETANO DA SILVA,SÃO PAULO,12,1994,Empresario
35113505247,EDILENE ALEIXO MACHADO,CAMPINA DO MONTE ALEGRE,12,1994,Empresario
35113505255,PEDRO LUIZ MAIO SILVA,FERRAZ DE VASCONCELOS,12,1994,Empresario
35113505263,WASHINGTON A DOS SANTOS,SÃO PAULO,12,1994,Empresario
35113505271,IEDA PEREIRA FRAGA GUARULHOS,GUARULHOS,12,1994,Empresario
35113505280,ANEDITE DA SILVA MENDES,BARUERI,12,1994,Empresario
35113505298,C. A. C. DE LIMA,SÃO JOÃO DA BOA VISTA,12,1994,Empresario
35113505301,J O DA SILVA AREIA,SÃO JOÃO DA BOA VISTA,12,1994,Empresario
35113505310,ANA MARIA DE MEDEIROS,ASSIS,12,1994,Empresario
35113505328,EDMAR MODESTO DA SILVA,OLÍMPIA,12,1994,Empresario
35113505336,EDVALDO RODRIGUES DA SILVA BASTOS,BASTOS,12,1994,Empresario
35113505344,AMARILDO GON ALVES DA SILVA DEDETIZADORA - ME,ITU,12,1994,Empresario
35113505352,NAIR APARECIDA MANGINELLI,ITÁPOLIS,12,1994,Empresario
35113505361,ANA MARIA ALVES DA SILVA BAZAR,GUARATINGUETÁ,12,1994,Empresario
35113505379,JB OLIVEIRA PEIXARIA,DIVINOLÂNDIA,12,1994,Empresario
35113505387,VITORIO SCAGNOLATO NETO,SÃO PEDRO,12,1994,Empresario
35113505395,MARIA ALVES RIBEIRO JACAREI,JACAREÍ,12,1994,Empresario
35113505409,VANDERLEY DIAS DOS SANTOS AÇOUGUE,GUARULHOS,12,1994,Empresario
35113505417,JOSEFA QUINTAS DOS SANTOS TARABAI,TARABAI,12,1994,Empresario
35113505425,CLEMILSON ALVES DE MORAIS TARABAI,TARABAI,12,1994,Empresario
35113505433,MARCIA APARECIDA BLASQUES CAMPOS OSASCO,PIRAPORA DO BOM JESUS,12,1994,Empresario
35113505441,LUCILIA TEIXEIRA DOS SANTOS AMARAL,OSASCO,12,1994,Empresario
35113505450,MANOEL MESSIAS DE LIMA-ITU,ITU,12,1994,Empresario
35113505468,CHEN ZUYONG,SÃO JOSÉ DOS CAMPOS,12,1994,Empresario
35113505476,DILMA MARIA RIBEIRO ARMARINHOS,GUARULHOS,12,1994,Empresario
35113505484,ROSDALTO SANCHES,SUZANO,12,1994,Empresario
35113505492,M.J. DA CUNHA LICO,SUZANO,12,1994,Empresario
35113505506,DIMAS JOSE DE SOUZA,SÃO PAULO,12,1994,Empresario
35113505514,ADILSON DONISETI DE OLIVEIRA,OSASCO,12,1994,Empresario
35113505522,LUIZ CARLOS FABIO ACOUGUE,BARUERI,12,1994,Empresario
35113505531,TSUTOMU KAMINISHIKAWAHARA - SUZANO,SUZANO,12,1994,Empresario
35113505549,LILIAN RODRIGUES GOMES LANCHONETE,SÃO BERNARDO DO CAMPO,12,1994,Empresario
35113505557,MARILIA DE FATIMA MATTOS PEREIRA SAO PAULO,SÃO PAULO,12,1994,Empresario
35113505565,SEBASTIAO FELIX DA SILVA FERRAZ DE VASCONCELOS,FERRAZ DE VASCONCELOS,12,1994,Empresario
35113505573,VALDECIR SETTO PIEDADE,PIEDADE,12,1994,Empresario
35113505581,ODILA CENZI,TEODORO SAMPAIO,12,1994,Empresario
35113505590,MARIA DE SOUZA FERNANDES,CAMPINAS,12,1994,Empresario
35113505603,N. M. PRAMIO,LENÇÓIS PAULISTA,12,1994,Empresario
