NIRE,Empresa,Município,Month,Year,Type
35214536342,IN ITALIA VIVA INSTITUTO DE IDIOMAS LTDA.,SAO PAULO,7,1997,Sociedade Limitada
35214536351,FACTOR DE SOLUCAO CONSULTORIA E PARTICIPACOES LTDA,SAO PAULO,7,1997,Sociedade Limitada
35214536369,K.S.D.C TRANSPORTES LTDA.,OSASCO,7,1997,Sociedade Limitada
35214536377,L.G.F. COMERCIO REPRESENTACOES LTDA.,SAO PAULO,7,1997,Sociedade Limitada
35214536385,CONFECCOES FAIR LADY JAU LTDA,JAU,7,1997,Sociedade Limitada
35214536393,RAMOS & LIMA COMERCIO DE ESTOFADOS LTDA,PRESIDENTE PRUDENTE,7,1997,Sociedade Limitada
35214536407,JOELCIO BISCA JUNIOR & CIA LTDA,GUARARAPES,7,1997,Sociedade Limitada
35214536415,E. S. SANTOS TECIDOS LTDA,GUARARAPES,7,1997,Sociedade Limitada
35214536423,M. H. PRESENTES E BRINQUEDOS LTDA.,HORTOLANDIA,7,1997,Sociedade Limitada
35214536431,RESOUFANT COMERCIO E RESTAURACAO AUTOMOBILISTICA LTDA,CAMPINAS,7,1997,Sociedade Limitada
35214536440,TRANSPORTES BENEMAR LTDA,SAO PAULO,7,1997,Sociedade Limitada
35214536458,EZEQUIEL MATHEUS HAIR STYLE CABELEIREIRO LTDA,BARUERI,7,1997,Sociedade Limitada
35214536466,GARDEN FOODS DISTRIBUIDORA DE ALIMENTOS LTDA,VOTORANTIM,7,1997,Sociedade Limitada
35214536474,ESCOLA DE EDUCACAO INFANTIL MUNDO DA LUA LTDA,CAMPINAS,7,1997,Sociedade Limitada
35214536482,ELETROLOJA DE FRANCA LTDA.,FRANCA,7,1997,Sociedade Limitada
35214536491,ASTRA - LAVA - RAPIDO E ESTACIONAMENTO LTDA.,SOROCABA,7,1997,Sociedade Limitada
35214536504,REISALVO CONFECCOES LTDA.,PIRAJU,7,1997,Sociedade Limitada
35214536512,SERGIO RICARDO BATAIOTE & CIA LTDA,IGARAPAVA,7,1997,Sociedade Limitada
35214536521,ESTACIONAMENTO RBS LTDA.,CAMPINAS,7,1997,Sociedade Limitada
35214536539,TERRA INDUSTRIA E COMERCIO DE SOLADOS LTDA,FRANCA,7,1997,Sociedade Limitada
35214536547,PUNTO-VERO INDUSTRIA E COMERCIO DE CALCADOS LTDA.,FRANCA,7,1997,Sociedade Limitada
35214536555,SANTO ANTONIO COMERCIO E DISTRIBUIDORA DE MATERIAIS PARA CONSTRUCAO LTDA.,AGUAS DA PRATA,7,1997,Sociedade Limitada
35214536563,FAZZION ARTIGOS DE DECORACAO LTDA.,PIEDADE,7,1997,Sociedade Limitada
35214536571,LAR EM LACOS COMERCIAL LTDA.,COSMOPOLIS,7,1997,Sociedade Limitada
35214536580,VISUARQ ASSESSORIA E PROJETOS LTDA.,SANTOS,7,1997,Sociedade Limitada
35214536598,CAROLE REPRESENTACOES DE PRODUTOS ALIMENTICIOS LTDA.,SANTOS,7,1997,Sociedade Limitada
35214536601,EDINHOSOFT & SISI COMERCIO E CONSULTORIA DE INFORMATICA LTDA.,SANTANA DE PARNAIBA,7,1997,Sociedade Limitada
35214536610,OTHERWISE COMERCIO E CONSULTORIA DE INFORMATICA LTDA.,POA,7,1997,Sociedade Limitada
35214536628,TS&O - SYS CONSULTORIA E COMERCIO DE INFORMATICA LTDA.,POA,7,1997,Sociedade Limitada
35214536636,N. M. T. COMERCIO E CONSULTORIA DE INFORMATICA LTDA.,POA,7,1997,Sociedade Limitada
35214536644,MERCEARIA CARNEIRO SILVEIRA LTDA,GUARULHOS,7,1997,Sociedade Limitada
35214536652,RHEMADIS DISTRIBUIDORA E ATACADO DE BEBIDAS E AFINS LTDA,ITAQUAQUECETUBA,7,1997,Sociedade Limitada
35214536661,PLANETEVENTOS VIAGENS & TURISMO LTDA.,SAO PAULO,7,1997,Sociedade Limitada
35214536679,AGROCOMERCIAL TRIUNFO LTDA,JAU,7,1997,Sociedade Limitada
35214536687,PROJEL TELECOMUNICACOES LTDA,OSASCO,7,1997,Sociedade Limitada
35214536709,ISTO E LIMPEZA LTDA,SAO PAULO,7,1997,Sociedade Limitada
35214536717,GRADUAL TRANSPORTES E SERVICOS LTDA,SAO JOSE DOS CAMPOS,7,1997,Sociedade Limitada
35214536725,BAR & LANCHES RIO TORTO LTDA,SAO PAULO,7,1997,Sociedade Limitada
35214536733,IMPORTE COMECIO E REPRESENTACAO LTDA.,SAO PAULO,7,1997,Sociedade Limitada
35214536741,TRANSNIPPO TRANSPORTES E CONSERVACAO LTDA,SAO PAULO,7,1997,Sociedade Limitada
35214536750,ALPAMAR ADMINISTRACAO DE HOTEIS LTDA.,CAMPINAS,7,1997,Sociedade Limitada
35214536768,MIGUEL MARTINS JUNIOR REPRESENTACAO COMERCIAL LTDA,DESCALVADO,7,1997,Sociedade Limitada
35214536776,TIMBER COMERCIAL LTDA.,SAO PAULO,7,1997,Sociedade Limitada
35214536784,"APENGE - ASSESSORIA, PARTICIPACOES E ENGENHARIA LTDA.",SAO PAULO,7,1997,Sociedade Limitada
35214536792,TRANSPORTADORA PUPIN LTDA.,SAO JOSE DO RIO PRETO,7,1997,Sociedade Limitada
35214536806,ASSUNCAO & SILVA REPRESENTACOES LTDA,SAO JOSE DO RIO PRETO,7,1997,Sociedade Limitada
35214536814,GUAPIFERTIL COMERCIO E REPRESENTACOES DE PRODUTOS AGRICOLAS LTDA,GUAPIACU,7,1997,Sociedade Limitada
35214536822,NOVA FASE TRANSPORTES E TURISMO LTDA,OURINHOS,7,1997,Sociedade Limitada
35214536831,ARAVAN ESTRUTURAS METALICAS LTDA,ARARAQUARA,7,1997,Sociedade Limitada
35214536849,ASTECH COMERCIO E ASSISTENCIA TECNICA DE APARELHOS MEDICOS E ODONTOLOGICOS LTDA,ARARAQUARA,7,1997,Sociedade Limitada
35214536857,AVS CONFECCOES OF BAG'S LTDA,ARARAQUARA,7,1997,Sociedade Limitada
35214536865,CARLOS EDUARDO LEITE & CIA LTDA,MOGI DAS CRUZES,7,1997,Sociedade Limitada
35214536873,"MEDLIFE - DISTRIBUIDORA E REPRESENTACAO DE PRODUTOS MEDICOS, HOSPITALAR E ODONTOLOGICOS LTDA.",RIBEIRAO PRETO,7,1997,Sociedade Limitada
35214536881,SILVA & SILVEIRA COMERCIAL LTDA,RIBEIRAO PRETO,7,1997,Sociedade Limitada
35214536890,VACOTEC TERMOFORMACAO TECNICAS EM FIBRAS DE VIDRO LTDA.,SAO ROQUE,7,1997,Sociedade Limitada
35214536903,LANCHONETE D;CAPELA LTDA.,SAO PAULO,7,1997,Sociedade Limitada
35214536911,COSTA E SILVA CONSTRUCOES E INCORPORACOES MONGAGUA LTDA.,MONGAGUA,7,1997,Sociedade Limitada
35214536920,SCHOCK SOUND ACESSORIOS PARA AUTOS LTDA,AMERICANA,7,1997,Sociedade Limitada
35214536938,M. CARRICO REPRESENTACOES COMERCIAIS LTDA.,SAO PAULO,7,1997,Sociedade Limitada
35214536946,C.R.V.REPRESENTACOES COMERCIAIS LTDA.,COTIA,7,1997,Sociedade Limitada
35214536954,PEREIRA BARREIROS BAURU LTDA-ME,BAURU,7,1997,Sociedade Limitada
35214536962,SERV FESTAS DE RANCHARIA LTDA.,RANCHARIA,7,1997,Sociedade Limitada
35214536971,M_POWER MARKETING COMUNICACAO E EVENTOS LTDA.,PAULINIA,7,1997,Sociedade Limitada
35214536989,COMERCIAL CARLI LTDA.,SAO PAULO,7,1997,Sociedade Limitada
35214536997,FLORENTIN & NASCIMENTO LTDA.,SANTOS,7,1997,Sociedade Limitada
35214537004,CONFECCOES GIDA LTDA.,CERQUILHO,7,1997,Sociedade Limitada
35214537012,DI ROMA INDUSTRIA E COMERCIO DE CHOCOLATES LTDA,SAO PAULO,7,1997,Sociedade Limitada
35214537021,TRES PODERES REPRESENTACOES COMERCIAIS LTDA.,ITAQUAQUECETUBA,7,1997,Sociedade Limitada
35214537039,MOEMA EXPRESS SERVICOS MOTORIZADOS LTDA.,SAO PAULO,7,1997,Sociedade Limitada
35214537047,MAISON DAIPRE EVENTOS LTDA.,SAO PAULO,7,1997,Sociedade Limitada
35214537055,COMERCIAL KAWAI-ITU LTDA.,ITU,7,1997,Sociedade Limitada
35214537063,BONI IMOVEIS E COMERCIO LTDA.,SAO PAULO,7,1997,Sociedade Limitada
35214537071,HF SPEED-WAY ENTREGAS EXPRESSAS LTDA.,SOROCABA,7,1997,Sociedade Limitada
35214537080,SORRENTINO EDITORACAO GRAFICA LTDA.,SANTANA DE PARNAIBA,7,1997,Sociedade Limitada
35214537098,BORGES & MACEDO REPRESENTACOES COMERCIAIS LTDA,SAO PAULO,7,1997,Sociedade Limitada
35214537101,METALOTEC COMERCIAL E TECNICA LTDA.,SANTA GERTRUDES,7,1997,Sociedade Limitada
35214537110,OLIVEIRA & PEREIRA PAES E DOCES LTDA.,SAO JOSE DOS CAMPOS,7,1997,Sociedade Limitada
35214537128,LIMA TORNEARIA LTDA.,FERRAZ DE VASCONCELOS,7,1997,Sociedade Limitada
35214537136,MEGSTAR VIAGENS LTDA,SAO BERNARDO DO CAMPO,7,1997,Sociedade Limitada
35214537144,PAGANI MOVEIS PARA ESCRITORIO LTDA.,SUZANO,7,1997,Sociedade Limitada
35214537152,PENSIONATO NOSSA SENHORA APARECIDA DE ITAPIRA LTDA.,ITAPIRA,7,1997,Sociedade Limitada
35214537161,STRUDER-BR INDUSTRIA E COMERCIO LTDA.,ITU,7,1997,Sociedade Limitada
35214537179,DIALETTO DISTRIBUIDORA DE VEICULOS LTDA.,OSASCO,7,1997,Sociedade Limitada
35214537187,MDM - MANUTENCAO DE MOTORES LTDA,GARCA,7,1997,Sociedade Limitada
35214537195,MERCADO GASPAR DE LARANJAL PAULISTA LTDA,LARANJAL PAULISTA,7,1997,Sociedade Limitada
35214537209,ALT PLAN PROJETOS E CONSTRUCOES LTDA,SAO PAULO,7,1997,Sociedade Limitada
35214537217,DIET GESTAO EMPRESARIAL LTDA,GUARULHOS,7,1997,Sociedade Limitada
35214537225,COMERCIO E SERVICO ELETRIC BARRETO LTDA,SAO PAULO,7,1997,Sociedade Limitada
35214537233,CHRISTINA LUCAS BENASSE & CIA LTDA.,VINHEDO,7,1997,Sociedade Limitada
35214537241,NC COMERCIO E REPRESENTACAO LTDA,SAO PAULO,7,1997,Sociedade Limitada
35214537250,HADASSA & PENIEL LOJA DE CONVENIENCIAS LTDA.,OSASCO,7,1997,Sociedade Limitada
35214537268,MARCELO GONCALVES AUTO MECANICA LTDA.,SAO PAULO,7,1997,Sociedade Limitada
35214537276,POSTO DE ESCAPAMENTOS TABOAO LTDA.,SAO BERNARDO DO CAMPO,7,1997,Sociedade Limitada
35214537284,B & B EXPRESS E EMPREITEIRA LTDA.,SAO PAULO,7,1997,Sociedade Limitada
35214537292,ALL LINKS INFORMATICA LTDA.,FRANCISCO MORATO,7,1997,Sociedade Limitada
35214537306,REGIS MASSAS LTDA,SAO PAULO,7,1997,Sociedade Limitada
35214537314,IBARAKI FLORES LTDA.,SAO PAULO,7,1997,Sociedade Limitada
35214537322,SENA REVESTIMENTOS INDUSTRIA E COMERCIO LTDA.,MAUA,7,1997,Sociedade Limitada
35214537331,SOZIGAN & VOLTARELLI LTDA.,PORTO FERREIRA,7,1997,Sociedade Limitada
35214537349,MERCEARIA NOVO ISRAEL DE VOTUPORANGA LTDA.,VOTUPORANGA,7,1997,Sociedade Limitada
35214537357,SOUTHEAN LADY COMERCIAL LTDA.,SAO PAULO,7,1997,Sociedade Limitada
35214537365,SOUTH POLE COMERCIAL LTDA.,SAO PAULO,7,1997,Sociedade Limitada
35214537373,CREDGEL FACTORING E FINANCIAMENTOS PROPRIOS LTDA,SAO PAULO,7,1997,Sociedade Limitada
35214537381,SILVA & UCCELI LTDA,PORTO FERREIRA,7,1997,Sociedade Limitada
35214537390,J.C. COMERCIO DE CHOCOLATES LTDA,CRUZEIRO,7,1997,Sociedade Limitada
35214537403,CENTER CARNES LOIDE E LAZARETTI LTDA,VOTUPORANGA,7,1997,Sociedade Limitada
35214537411,M. SARTOR COMERCIO DO VESTUARIO E ACESSORIOS LTDA,BOTUCATU,7,1997,Sociedade Limitada
35214537420,C.G.E. COMERCIAL LTDA.,AMERICANA,7,1997,Sociedade Limitada
35214537438,2M CLINICA E COMERCIO ARARAQUARA LTDA.,ARARAQUARA,7,1997,Sociedade Limitada
35214537446,SIMOCAR CALCADOS FRANCA LTDA.,FRANCA,7,1997,Sociedade Limitada
35214537454,J. S. COMERCIO E INSTALACOES LTDA.,PARAIBUNA,7,1997,Sociedade Limitada
35214537462,CAMARGO & LUZ - SAO JOSE DO RIO PRETO LTDA.,SAO JOSE DO RIO PRETO,7,1997,Sociedade Limitada
35214537471,CCN COMERCIO DE FERROS E METAIS LTDA.,SAO JOSE DO RIO PRETO,7,1997,Sociedade Limitada
35214537489,"CORDOBI - CORDOES, CADARCOS E CONFECCOES LTDA.",BIRIGUI,7,1997,Sociedade Limitada
35214537497,LELISBYTE-COMERCIO DE INFORMATICA E PAPELARIA LTDA.,JACAREI,7,1997,Sociedade Limitada
35214537501,MAGALHAES E CACHICHI TRANSPORTE DE PASSAGEIROS LTDA.,SANTO ANDRE,7,1997,Sociedade Limitada
35214537519,INCORPORADORA SANT'ANNA LTDA.,SANTA CRUZ DO RIO PARDO,7,1997,Sociedade Limitada
35214537527,T H COMERCIO DE GAS LTDA.,ASSIS,7,1997,Sociedade Limitada
35214537535,PODIUM TECNOLOGIA LTDA,RIBEIRAO PRETO,7,1997,Sociedade Limitada
35214537543,GHIOTO COMERCIO DE PECAS E ACESSORIOS LTDA.,PITANGUEIRAS,7,1997,Sociedade Limitada
35214537551,OLIVEIRA SILVA - TAXI AEREO LTDA.,BARUERI,7,1997,Sociedade Limitada
35214537560,CAR FACE WASH SERVICE LTDA.,SAO PAULO,7,1997,Sociedade Limitada
35214537578,MICRO JUNDIAI EDICOES CULTURAIS LTDA.,JUNDIAI,7,1997,Sociedade Limitada
35214537586,W T SERVICOS DE INFORMATICA LTDA,SAO PAULO,7,1997,Sociedade Limitada
35214537594,L.C.M. ENGENHARIA PARTICIPACOES E CONSTRUCOES LTDA.,SAO PAULO,7,1997,Sociedade Limitada
35214537608,"BORTOLATO ARQUITETURA, COMERCIO E PINTURAS LTDA.",SAO PAULO,7,1997,Sociedade Limitada
35214537616,ELETRONICA ULTRA GAMES LTDA,SAO PAULO,7,1997,Sociedade Limitada
35214537624,MILLENNIUN CONSULTORIA EM INFORMATICA LTDA.,SAO PAULO,7,1997,Sociedade Limitada
35214537632,MERCEARIA FERNANDES LTDA.,FERRAZ DE VASCONCELOS,7,1997,Sociedade Limitada
35214537641,MAX MERCADO LTDA.,SAO PAULO,7,1997,Sociedade Limitada
35214537659,FERREIRA REVESTIMENTOS LTDA.,SAO PAULO,7,1997,Sociedade Limitada
35214537667,MORETO & SILVA DE MARILIA LTDA.,MARILIA,7,1997,Sociedade Limitada
35214537675,BOMBONIERE GABRIEL & BARRETO LTDA.,SAO PAULO,7,1997,Sociedade Limitada
35214537683,MERCADINHO LIONS LTDA,TABOAO DA SERRA,7,1997,Sociedade Limitada
35214537691,S.M.C CONSTRUTORA LTDA.,SAO PAULO,7,1997,Sociedade Limitada
35214537705,OURO BELO GRILL LTDA.,SAO PAULO,7,1997,Sociedade Limitada
35214537713,MARLI APARECIDA STACKFLETH BASSI & CIA LTDA.,ITATIBA,7,1997,Sociedade Limitada
35214537721,CANALTEC INDUSTRIA E COMERCIO DE FERRAMENTAS LTDA,ATIBAIA,7,1997,Sociedade Limitada
35214537730,DEGATTI LIVRARIA PAPELARIA E PRESENTES LTDA.,SAO JOSE DOS CAMPOS,7,1997,Sociedade Limitada
35214537748,CPA EDITORA LTDA.,SAO PAULO,7,1997,Sociedade Limitada
35214537756,SIFICO SISTEMA FIBRIT DE CONSTRUCAO LTDA,SALTO DE PIRAPORA,7,1997,Sociedade Limitada
35214537764,BRAZMARC FACAS PARA CORTE E VINCO LTDA.,CAMPINAS,7,1997,Sociedade Limitada
35214537772,PRO TRANS COMERCIO REPRESENTACAO SERVICOS IMPORTACAO E EXPORTACAO LTDA.,CAMPINAS,7,1997,Sociedade Limitada
35214537781,NOVA ITALIA REPAROS AUTOMOBILISTICOS LTDA.,CAMPINAS,7,1997,Sociedade Limitada
35214537799,NITROGAS - TRATAMENTOS TERMICOS LTDA.,JUNDIAI,7,1997,Sociedade Limitada
35214537802,METROTECNICA CALIBRACAO E COMERCIO DE INSTRUMENTOS DE MEDICAO LTDA.,VARZEA PAULISTA,7,1997,Sociedade Limitada
35214537811,USINAGEM SANTA LUZIA INDUSTRIA E COMERCIO LTDA-ME,SAO PAULO,7,1997,Sociedade Limitada
35214537829,"TRANSLENOS COMERCIO, IMPORTACAO E EXPORTACAO LTDA",SAO PAULO,7,1997,Sociedade Limitada
35214537837,BAZAR E PAPELARIA LACHI LTDA.,SAO PAULO,7,1997,Sociedade Limitada
35214537845,CENTER CARNES UIRAPURU LTDA.,SAO PAULO,7,1997,Sociedade Limitada
35214537853,TRENTI & TRENTI COMERCIO E CONSULTORIA EM INFORMATICA LTDA.,SAO PAULO,7,1997,Sociedade Limitada
35214537861,RANK TRANSPORTE & COMERCIAL LTDA.,CAMPINAS,7,1997,Sociedade Limitada
35214537870,NETWAY EQUIPAMENTOS E ASSESSORIA DE INFORMATICA,SAO PAULO,7,1997,Sociedade Limitada
35214537888,E3C CONSULTORIA LTDA.,SAO PAULO,7,1997,Sociedade Limitada
35214537896,BOA NOVA COMERCIO E SERVICOS LTDA.,BARRETOS,7,1997,Sociedade Limitada
35214537900,DESIGN INFORMATICA LTDA.,SAO PAULO,7,1997,Sociedade Limitada
35214537918,SERRALHERIA FONTE DE AGUA VIVA LTDA,SAO PAULO,7,1997,Sociedade Limitada
35214537926,MR CONSTRUTORA E ARQUITETURA LTDA.,SAO PAULO,7,1997,Sociedade Limitada
35214537934,CEPAM COMERCIO E CONSUTORIA EM PLANEJAMENTO AMBIENTAL LTDA.,CAJAMAR,7,1997,Sociedade Limitada
35214537942,GODOY & LIMA LTDA.,TIETE,7,1997,Sociedade Limitada
35214537951,PAES E DOCES SAI DE BAIXO LTDA.,SAO PAULO,7,1997,Sociedade Limitada
35214537969,MT PROMOCOES E EVENTOS LTDA.,SAO PAULO,7,1997,Sociedade Limitada
35214537977,LIMA E ARAUJO LTDA.,PRAIA GRANDE,7,1997,Sociedade Limitada
35214537985,TRANSPORTADORA LEVI LTDA.,CAMPINAS,7,1997,Sociedade Limitada
35214537993,REZENDE & SOUZA COMERCIO DE PORTOES LTDA.,CAMPINAS,7,1997,Sociedade Limitada
35214538001,FUNDICAO TAIUVA LTDA,TAIUVA,7,1997,Sociedade Limitada
35214538019,K F C COMERCIO DE BEBIDAS LTDA,SERTAOZINHO,7,1997,Sociedade Limitada
35214538027,NETH COMPUTADORES E SISTEMAS LTDA.,RIBEIRAO PRETO,7,1997,Sociedade Limitada
35214538035,BELAIS COMERCIO DE COSMETICOS LTDA.,SAO ROQUE,7,1997,Sociedade Limitada
35214538043,AUTO POSTO LOBO DE ARARAQUARA LTDA.,ARARAQUARA,7,1997,Sociedade Limitada
35214538051,M. J. S. DOS SANTOS & FILHO LTDA.,NUPORANGA,7,1997,Sociedade Limitada
35214538060,BOLOGNA - AGENCIA DE TURISMO E PASSAGENS LTDA,CAMPINAS,7,1997,Sociedade Limitada
35214538078,S.N. COLCHOES E DECORACOES LTDA.,VARZEA PAULISTA,7,1997,Sociedade Limitada
35214538086,LOPAGS REPRESENTACOES LTDA.,JUNDIAI,7,1997,Sociedade Limitada
35214538094,ANDE COMERCIO E ASSESSORIA LTDA.,CAMPINAS,7,1997,Sociedade Limitada
35214538108,ART PORTAS - ARTEFATOS DE MADEIRAS LTDA.,CAMPINAS,7,1997,Sociedade Limitada
35214538116,SISTEMA BRASILEIRO DE HABITACAO POPULAR LTDA,CAMPINAS,7,1997,Sociedade Limitada
35214538124,"MILAN - COMERCIO DE GRAMAS, TRANSPORTES E MATERIAIS PARA CONSTRUCAO LTDA",BATATAIS,7,1997,Sociedade Limitada
35214538132,NASTECH COMERCIAL TECNICA LTDA,RIBEIRAO PRETO,7,1997,Sociedade Limitada
35214538141,PAULO ROBERTO STAMBOWSKI & CIA. LTDA.,RIBEIRAO PRETO,7,1997,Sociedade Limitada
35214538159,WHITE HOUSE EVENTOS E BUFFET LTDA,RIBEIRAO PRETO,7,1997,Sociedade Limitada
35214538167,SABOR DE BEIJO BAR E LANCHONETE LTDA,SAO PAULO,7,1997,Sociedade Limitada
35214538175,DCS INFORMATICA LTDA.,SAO PAULO,7,1997,Sociedade Limitada
35214538183,CLEAN TEC SANEAMENTO E CONTROLE DE PRAGAS INDUSTRIA E COMERCIO DE INSETICIDAS LTDA.,RIO CLARO,7,1997,Sociedade Limitada
35214538191,UNICORT - STEEL COMERCIO DE CHAPAS DE ACO LTDA.,CAIEIRAS,7,1997,Sociedade Limitada
35214538205,LUCENA PUPPO - COMERCIO DE COSMETICOS LTDA.,GUARULHOS,7,1997,Sociedade Limitada
35214538213,COMAIS COMERCIO DE MATERIAIS INDUSTRIAIS E SIDERURGICOS LTDA.,GUARULHOS,7,1997,Sociedade Limitada
35214538221,ELETRON INDUSTRIA E ARTEFATOS ELETRICOS LTDA.,SAO PAULO,7,1997,Sociedade Limitada
35214538230,LABONNA PIZZARIA LTDA.,SAO PAULO,7,1997,Sociedade Limitada
35214538248,RTS-SERVICOS EM INFORMATICA LTDA.,POA,7,1997,Sociedade Limitada
35214538256,ETISA TECNOLOGIAS LTDA.,SANTA BARBARA D'OESTE,7,1997,Sociedade Limitada
35214538264,J.V. CONSTRUTORA DE PRUDENTE LTDA.,PRESIDENTE VENCESLAU,7,1997,Sociedade Limitada
35214538272,LANCHONETE E RESTAURANTE DO AURELIO LTDA,SAO PAULO,7,1997,Sociedade Limitada
35214538281,JUMPI SOUND SYSTEM LTDA.,SAO PAULO,7,1997,Sociedade Limitada
35214538299,BLUE ICE CONFEITARIA E SORVETERIA LTDA.,SAO PAULO,7,1997,Sociedade Limitada
35214538302,GENTILE E CHAUD LTDA.,MOCOCA,7,1997,Sociedade Limitada
35214538311,SERVIPAS ESTRUTURA METALICA LTDA.,SAO PAULO,7,1997,Sociedade Limitada
35214538329,NAPOLITANO TEAM LTDA.,SAO PAULO,7,1997,Sociedade Limitada
35214538337,BEAUTY BRASIL DISTRIBUICAO IMPORTACAO E EXPORTACAO DE COSMETICOS LTDA.,SAO PAULO,7,1997,Sociedade Limitada
35214538345,MONTERREY EMPREENDIMENTOS LTDA.,SAO PAULO,7,1997,Sociedade Limitada
35214538353,TIKINHA INDUSTRIA E COMERCIO DE CONFECCOES LTDA.,SAO PAULO,7,1997,Sociedade Limitada
35214538361,SPRING WORK INDUSTRIA E COMERCIO LTDA.,TABOAO DA SERRA,7,1997,Sociedade Limitada
35214538370,NOVA IMPERIAL TELECOMUNICACOES LTDA.,SAO PAULO,7,1997,Sociedade Limitada
35214538388,MOVEIS B LTDA,ATIBAIA,7,1997,Sociedade Limitada
35214538396,JUPITER ADMINISTRADORA DE BENS E PARTICIPACOES LTDA.,AMERICANA,7,1997,Sociedade Limitada
35214538400,BARSOTTI & BARSOTTI LTDA.,RIO CLARO,7,1997,Sociedade Limitada
35214538418,BAR E LANCHONETE CASA BRANCA LTDA.,SANTOS,7,1997,Sociedade Limitada
35214538426,PANIFICADORA EDIFRAN LTDA.,OSASCO,7,1997,Sociedade Limitada
35214538434,CONFECCAO CARDILOES RIO CLARO LTDA.,RIO CLARO,7,1997,Sociedade Limitada
35214538442,CAVARZAN INFORMATICA LTDA.,POA,7,1997,Sociedade Limitada
35214538451,R & V - COMERCIO DE PRODUTOS ALIMENTICIOS LTDA.,SANTA BARBARA D'OESTE,7,1997,Sociedade Limitada
35214538469,VICENTE SERTORIO INDUSTRIA E COMERCIO DE MOVEIS LTDA.,SUZANO,7,1997,Sociedade Limitada
35214538477,DEPOSITO DE MATERIAIS DE CONSTRUCAO JARDIM MARCELINO LTDA.,CAIEIRAS,7,1997,Sociedade Limitada
35214538485,TRHEINO CONSULTORIA EM RECURSOS HUMANOS LTDA.,SANTO ANDRE,7,1997,Sociedade Limitada
35214538493,J. MONTEIRO P. BARRETO LTDA.,PEREIRA BARRETO,7,1997,Sociedade Limitada
35214538507,CASA MAGICA BUFFET INFANTIL LTDA.,SANTOS,7,1997,Sociedade Limitada
35214568180,REGO'S RESTAURANTE E LANCHONETE LTDA.,SAO PAULO,7,1997,Sociedade Limitada
35214568201,INOVARE SERVICOS DE COBRANCAS SJRIO PRETO LTDA,SAO JOSE DO RIO PRETO,7,1997,Sociedade Limitada
35214568210,ALLONSO KOMATSU REPRESENTACAO COMERCIAL LTDA.,SAO BERNARDO DO CAMPO,7,1997,Sociedade Limitada
35214568228,CALFRI MONTAGENS INDUSTRIAIS LTDA.,MAUA,7,1997,Sociedade Limitada
35214568236,KIZOMBA PRODUCOES ARTISTICAS DE EVENTOS E ASSESSORIA CARNAVALESCA LTDA.,SAO PAULO,7,1997,Sociedade Limitada
35214568244,SIQUEIRA & PALAZZI INDUSTRIA E COMERCIO LTDA,JACAREI,7,1997,Sociedade Limitada
35214568252,SUPER BRASIL - INSTRUMENTOS MUSICAIS LTDA,SAO PAULO,7,1997,Sociedade Limitada
35214568261,GRRR CONFECCOES E COMERCIO LTDA.,JACAREI,7,1997,Sociedade Limitada
35214568279,SZARNOBAY & ZANCHETA LTDA.,AVARE,7,1997,Sociedade Limitada
35214568287,SOON LEE DISTRIBUIDORA COMERCIO E IMPORTACAO LTDA.,SAO JOSE DOS CAMPOS,7,1997,Sociedade Limitada
35214568295,HDA ENGENHARIA LTDA.,SAO PAULO,7,1997,Sociedade Limitada
35214568309,MAXX...ORAL SISTEMAS E SOLUCOES PARA SAUDE BUCAL LTDA.,SAO PAULO,7,1997,Sociedade Limitada
35214568317,CONAPUB DESENVOLVIMENTO DE COMUNICACAO LTDA,SAO PAULO,7,1997,Sociedade Limitada
35214568325,TETTINY CONFECCAO LTDA.,PIRAJU,7,1997,Sociedade Limitada
35214568333,CRESPO E LISO CABELEIREIROS LTDA.,SAO PAULO,7,1997,Sociedade Limitada
35214568341,MARTINS & PAULA UBATUBA LTDA.,UBATUBA,7,1997,Sociedade Limitada
35214568350,TELE WORLD COMERCIO E TELEMARKETING LTDA.,SAO PAULO,7,1997,Sociedade Limitada
35214568368,FAZENDA HOTEL VALE VERDE LTDA.,TORRINHA,7,1997,Sociedade Limitada
35214568376,CDT-REPRESENTACAO COMERCIAL LTDA,BAURU,7,1997,Sociedade Limitada
35214568384,MARQUEZANI COMERCIO DE PRODUTOS PARA INFORMATICA LTDA,SAO PAULO,7,1997,Sociedade Limitada
35214568392,HINOXLINE INDUSTRIA METALURGICA LTDA,PIRAJU,7,1997,Sociedade Limitada
35214568406,J.A. SARDINHA TRANSPORTES LTDA.,BAURU,7,1997,Sociedade Limitada
35214568414,LM PETROLEO LTDA.,PAULINIA,7,1997,Sociedade Limitada
35214568422,L.S.E. CALDEIRARIA E FUNILARIA INDUSTRIAL LTDA.,SAO PAULO,7,1997,Sociedade Limitada
35214568449,QUATRO ESTRELAS COMERCIO E CONFECCOES LTDA.,SAO PAULO,7,1997,Sociedade Limitada
35214568457,A P MANUTENCAO DE CALDEIRAS LTDA.,SAO PAULO,7,1997,Sociedade Limitada
35214568465,NOVAFOR DISTRIBUIDORA DE VEICULOS LTDA.,MOCOCA,7,1997,Sociedade Limitada
35214568473,HERB SHOP - INDUSTRIA E COMERCIO LTDA.,GUARULHOS,7,1997,Sociedade Limitada
35214568481,FRIGOMOR REPRESENTACOES COMERCIAIS LTDA,SAO CARLOS,7,1997,Sociedade Limitada
35214568490,CONSTRUTORA EVOLUCAO LTDA,VARZEA PAULISTA,7,1997,Sociedade Limitada
35214568503,OMEGA SEGURANCA PARTICULAR EXECUTIVA LTDA.,POA,7,1997,Sociedade Limitada
35214568511,MARCENARIA BIG HOUSE LTDA.,GUARULHOS,7,1997,Sociedade Limitada
35214568520,RIBEIRO & RIBEIRO CAMPINAS LTDA.,CAMPINAS,7,1997,Sociedade Limitada
35214568538,OCEAN TRONIC COMERCIO IMPORTACAO EXPORTACAO LTDA.,SAO PAULO,7,1997,Sociedade Limitada
35214568546,SANSON INDUSTRIA QUIMICA LTDA.,SAO PAULO,7,1997,Sociedade Limitada
35214568554,SOFTWAY SOFTWARES PARA COMERCIO EXTERIORLTDA.,CAMPINAS,7,1997,Sociedade Limitada
35214568562,LA'MISS MOVEIS E DECORACOES LTDA.,SAO BERNARDO DO CAMPO,7,1997,Sociedade Limitada
35214568571,MM MARCENARIA SJCAMPOS LTDA,SAO JOSE DOS CAMPOS,7,1997,Sociedade Limitada
35214568589,HARBEX - ENGENHARIA E IMPERMEABILIZACAO LTDA,SAO PAULO,7,1997,Sociedade Limitada
35214568597,MINART COMERCIO DE VESTUARIO E ACESSORIOS LTDA.,SAO PAULO,7,1997,Sociedade Limitada
35214568601,NUCLEO DE DANCA STELLA AGUIAR LTDA.,SAO PAULO,7,1997,Sociedade Limitada
35214568619,BY LILLY CONFECCOES LTDA.,SAO PAULO,7,1997,Sociedade Limitada
35214568627,CREIMER TRADING CONNECTION LTDA.,SAO PAULO,7,1997,Sociedade Limitada
35214568635,MILLENIUM VIDEO _ CONVENIENCIAS COMERCIAL LTDA.,PIRACICABA,7,1997,Sociedade Limitada
35214568643,FREMITEC _ USINAGEM TECNICA DE PRECISAO LTDA,PIRACICABA,7,1997,Sociedade Limitada
35214568651,DROGA YHASMIM LTDA,SAO PAULO,7,1997,Sociedade Limitada
35214568660,POP REPRESENTACOES COMERCIAIS LTDA.,SAO BERNARDO DO CAMPO,7,1997,Sociedade Limitada
35214568678,T.J. TRANSPORTES E CARGAS LTDA.,SAO PAULO,7,1997,Sociedade Limitada
35214568686,KYOSEKI IMPORTACAO E EXPORTACAO LTDA.,SAO PAULO,7,1997,Sociedade Limitada
35214568694,ARQMETALIC _ ESTRUTURAS METALICAS LTDA.,MARILIA,7,1997,Sociedade Limitada
35214568708,AGCAD INFORMATICA LTDA.,SAO PAULO,7,1997,Sociedade Limitada
35214568716,M.J.R. COMERCIO DE IMPORTADOS LTDA.,SAO PAULO,7,1997,Sociedade Limitada
35214568724,REX-SAN MATERIAIS PARA SANEAMENTO LTDA.,PIRACICABA,7,1997,Sociedade Limitada
35214568732,CLAUMAR DE INDAIATUBA COMERCIO DE VEICULOS USADOS LTDA.,INDAIATUBA,7,1997,Sociedade Limitada
35214568741,CENTRO AUTOMOTIVO AUTO GIL LTDA.,OSASCO,7,1997,Sociedade Limitada
35214568759,CASA DE CARNES ANTONINI REIS LTDA.,SAO PAULO,7,1997,Sociedade Limitada
35214568767,ARILO & ALDENOR COMERCIO E INSTALADORA DE ESQUADRIAS LTDA.,SAO PAULO,7,1997,Sociedade Limitada
35214568775,TRI-EME SERVICOS DE PORTARIA S/S LTDA,SAO PAULO,7,1997,Sociedade Limitada
35214568783,SIEMENS AUTOMOTIVE SYSTEMS LTDA.,SALTO,7,1997,Sociedade Limitada
35214568791,INDUSTRIA E COMERCIO BERCOT S. BARROS LTDA.,SAO ROQUE,7,1997,Sociedade Limitada
35214568805,COMERCIAL ELETRICA CENTER LUZ LTDA.,SAO PAULO,7,1997,Sociedade Limitada
35214568813,CONSTANTINO & BOTELHO LTDA.,OURINHOS,7,1997,Sociedade Limitada
35214568821,VIAZUP COMERCIAL DE ALIMENTOS LTDA.,SANTOS,7,1997,Sociedade Limitada
35214568830,MR KING COMERCIO DE CONFECCOES LTDA.,SAO PAULO,7,1997,Sociedade Limitada
35214568848,SILVIO DE PAULA SANTOS & CIA LTDA.,JACAREI,7,1997,Sociedade Limitada
35214568856,ANCIFER COMERCIO E IMPORTACAO LTDA.,SAO JOSE DOS CAMPOS,7,1997,Sociedade Limitada
35214568864,ELEGANCE CAFE E CONVENIENCIA LTDA.,SANTO ANDRE,7,1997,Sociedade Limitada
35214568872,AGATA DE FOGO - TRANSPORTES LTDA.,ELIAS FAUSTO,7,1997,Sociedade Limitada
35214568881,RICARDO MATHEUS COMERCIO DE ARTIGOS ESPORTIVOS E SERVICOS LTDA,AVARE,7,1997,Sociedade Limitada
35214568899,DABI TRANSPORTES LTDA.,SAO PAULO,7,1997,Sociedade Limitada
35214568902,DANIEL OLIVEIRA RIBEIRO CONFECCAO LTDA,CAMPINAS,7,1997,Sociedade Limitada
35214568911,PAIVA & PAIVA INDUSTRIA COMERCIO E MANUTENCAO LTDA.,BARUERI,7,1997,Sociedade Limitada
35214568929,R & C CARPINELLI LTDA.,SERRA NEGRA,7,1997,Sociedade Limitada
35214568937,FJT COMERCIAL LTDA.,SAO PAULO,7,1997,Sociedade Limitada
35214568945,FRATELLI MODAS E DECORACOES LTDA.,SAO PAULO,7,1997,Sociedade Limitada
35214568953,GALORO & GALORO DE MARILIA LTDA.,MARILIA,7,1997,Sociedade Limitada
35214568961,JJS - LANCHONETE E COMERCIO DE BEBIDAS LTDA.,PRESIDENTE PRUDENTE,7,1997,Sociedade Limitada
35214568970,RADIADORES VASSOURINHA LTDA.,SOROCABA,7,1997,Sociedade Limitada
35214568988,SOCEAN COMERCIO DE ROUPAS E ACESSORIOS LTDA.,RIBEIRAO PRETO,7,1997,Sociedade Limitada
35214568996,ROMANICA DECORACOES LTDA,RIBEIRAO PRETO,7,1997,Sociedade Limitada
35214569003,FIL AUTO POSTO RP LTDA,RIBEIRAO PRETO,7,1997,Sociedade Limitada
35214569011,NACIONAL COMERCIAL TEXTIL LTDA,RIBEIRAO PRETO,7,1997,Sociedade Limitada
35214569020,3S COMERCIO E SERVICOS INDUSTRIAIS DE EQUIPAMENTOS DOMESTICOS E LAZER LTDA,ITATIBA,7,1997,Sociedade Limitada
