NIRE,Empresa,Município,Month,Year,Type
35214576999,NZ INTERMEDIACOES LTDA.,SAO PAULO,7,1997,Sociedade Limitada
35214577006,HYER - ASSESSORIA ESTRATEGICA LTDA,SAO PAULO,7,1997,Sociedade Limitada
35214577014,ICOBIT IMPERMEABILIZANTES LTDA,SAO PAULO,7,1997,Sociedade Limitada
35214577022,MONTE SINAI ARTIGOS EVANGELICOS AGUAI LTDA.,AGUAI,7,1997,Sociedade Limitada
35214577031,VICI COMERCIAL LTDA.,SAO PAULO,7,1997,Sociedade Limitada
35214577049,N. O. SERRALHERIA LTDA.,SAO PAULO,7,1997,Sociedade Limitada
35214577057,DUO INSTRUMENTACAO E CONTROLE LTDA.,AMERICANA,7,1997,Sociedade Limitada
35214577065,T.C.R. FLEX LIFE LTDA,ATIBAIA,7,1997,Sociedade Limitada
35214577073,VISAO & SOLUCAO MARKETING PROMOCIONAL LTDA.,SAO PAULO,7,1997,Sociedade Limitada
35214577081,SEDUCAO MODAS DE ITAPIRA LTDA.,ITAPIRA,7,1997,Sociedade Limitada
35214577090,ANTONIO CARLOS MASSATOSHI SEKINE & CIA LTDA.,ROSANA,7,1997,Sociedade Limitada
35214577103,BAZAR E MAGAZINE MOJAMBI LTDA.,SAO PAULO,7,1997,Sociedade Limitada
35214577111,AUTO ELETRICO E ACESSORIOS CAMYZET LTDA,OSASCO,7,1997,Sociedade Limitada
35214577120,RESTAURANTE SELF SERVICE GIDEAO LTDA,GUARULHOS,7,1997,Sociedade Limitada
35214577138,MATRA BIJOUX - COMERCIO DE BIJOUTERIAS LTDA,SAO PAULO,7,1997,Sociedade Limitada
35214577146,PERINA & JACOB INFORMATICA LTDA,SAO PAULO,7,1997,Sociedade Limitada
35214577154,POLI FINISH - POLIMENTOS E TEXTURIZACAO LTDA,SAO PAULO,7,1997,Sociedade Limitada
35214577162,PORTELLA COMERCIO DE ROUPAS LTDA,SAO PAULO,7,1997,Sociedade Limitada
35214577171,LITEC COMERCIAL LTDA.,SAO PAULO,7,1997,Sociedade Limitada
35214577189,TAIMARU COMERCIO IMPORTACAO E VEICULOS LTDA.,SAO PAULO,7,1997,Sociedade Limitada
35214577197,ESPECTO TELEFONIA COMERCIAL LTDA.,CAMPINAS,7,1997,Sociedade Limitada
35214577201,EPAR PARTICIPACOES LTDA,SAO PAULO,7,1997,Sociedade Limitada
35214577219,AOC DO BRASIL MONITORES LTDA.,SAO PAULO,7,1997,Sociedade Limitada
35214577227,COIM BRASIL LTDA.,SAO PAULO,7,1997,Sociedade Limitada
35214577235,MALHARRIA R.V. LTDA,SOCORRO,7,1997,Sociedade Limitada
35214577243,MACORDE LAVA-RAPIDO E LANCHONETE LTDA,GUARULHOS,7,1997,Sociedade Limitada
35214577251,MARCAL & RODRIGUES DE UBATUBA LTDA.,UBATUBA,7,1997,Sociedade Limitada
35214577260,"PORTICO COMERCIO DE PEDRAS, MARMORES E GRANITOS LTDA.",SAO PAULO,7,1997,Sociedade Limitada
35214577278,ANDRADE & ZAMBINI LTDA.,PEREIRA BARRETO,7,1997,Sociedade Limitada
35214577286,OTICA VISION MARTINOPOLIS LTDA.,MARTINOPOLIS,7,1997,Sociedade Limitada
35214577294,CARPECAS COMERCIO E MONTAGEM DE PARAFUSOS LTDA.,DIADEMA,7,1997,Sociedade Limitada
35214577308,TRANSPORTES TAVARES E FILHOS LTDA.,SAO PAULO,7,1997,Sociedade Limitada
35214577316,LILIRESA COMERCIO IMPORTACAO E EXPORTACAO LTDA.,SAO PAULO,7,1997,Sociedade Limitada
35214577324,SORRILLO SERVICOS LTDA.,SAO PAULO,7,1997,Sociedade Limitada
35214577332,BAR E LANCHES UEHARA LTDA,SAO PAULO,7,1997,Sociedade Limitada
35214577341,PRODUTOS ALIMENTICIOS JURUK E BOM LTDA.,SAO PAULO,7,1997,Sociedade Limitada
35214577359,AUTO POSTO ESCALIBUR LTDA,SAO PAULO,7,1997,Sociedade Limitada
35214577367,AUTO POSTO UNIAO DE FERNANDOPOLIS LTDA,FERNANDOPOLIS,7,1997,Sociedade Limitada
35214577375,HIGIENIC CONTROL & SERVICE COMERCIO IMPORTACAO E EXPORTACAO LTDA,SAO PAULO,7,1997,Sociedade Limitada
35214577383,MERCADO E ACOUGUE BARBOSA E CASEMIRO LTDA.,SAO BERNARDO DO CAMPO,7,1997,Sociedade Limitada
35214577391,TLOUS MODA MASCULINA E FEMININA LTDA,SAO BERNARDO DO CAMPO,7,1997,Sociedade Limitada
35214577405,SOLDEIRA COMERCIO DE PRODUTOS PARA ANIMAIS DOMESTICOS LTDA.,SAO PAULO,7,1997,Sociedade Limitada
35214577413,C.B.L. COMERCIO E INSTALACAO LTDA.,TAUBATE,7,1997,Sociedade Limitada
35214577421,ODONTO-CIR COMERCIAL LTDA.,SAO PAULO,7,1997,Sociedade Limitada
35214577430,MOSAIC CAFE LTDA.,SAO PAULO,7,1997,Sociedade Limitada
35214577448,DZART COMERCIO DE BRINDES LTDA.,SAO PAULO,7,1997,Sociedade Limitada
35214577456,M.SIAO COMERCIO DE INFORMATICA LTDA.,SAO PAULO,7,1997,Sociedade Limitada
35214577464,BAR E MERCEARIA PENZE RODRIGUES LTDA.,GUARULHOS,7,1997,Sociedade Limitada
35214577472,R. CLAUDINO ARTIGOS INFANTIS LTDA,SAO PAULO,7,1997,Sociedade Limitada
35214577481,BEDUINO'S ESFIHA LTDA.,SAO PAULO,7,1997,Sociedade Limitada
35214577499,JOCONSTRUS CONSTRUCOES LTDA.,COTIA,7,1997,Sociedade Limitada
35214577502,AUTO POSTO HUCK LTDA,CATANDUVA,7,1997,Sociedade Limitada
35214577511,NEXT SISTEMAS LTDA.,SAO PAULO,7,1997,Sociedade Limitada
35214577529,VALE VERDE FLORES E DECORACOES LTDA,ITATIBA,7,1997,Sociedade Limitada
35214577537,EPC PROFISSIONAIS EM COMPUTACAO CONSULTORIA E COMERCIO LTDA,EMBU,7,1997,Sociedade Limitada
35214577545,AUTO PECAS PARACONCO LTDA.,DIADEMA,7,1997,Sociedade Limitada
35214577553,MULTI CEREAIS PAULISTA COMERCIO E REPRESENTACOES LTDA.,VARZEA PAULISTA,7,1997,Sociedade Limitada
35214577561,CMG REPRESENTACAO E COMERCIO LTDA.,JUNDIAI,7,1997,Sociedade Limitada
35214577570,COMERCIO JAMAR LTDA.,SAO PAULO,7,1997,Sociedade Limitada
35214577588,TRANSPORTES MARILTON LTDA.,BOITUVA,7,1997,Sociedade Limitada
35214577596,POLYPERFIL INDUSTRIA E COMERCIO DE PLASTICO LTDA,SAO BERNARDO DO CAMPO,7,1997,Sociedade Limitada
35214577600,S & C PIZZARIA LTDA.,GUARULHOS,7,1997,Sociedade Limitada
35214577618,MJT COMERCIO DE JOIAS LTDA.,SAO PAULO,7,1997,Sociedade Limitada
35214577626,ATUAL ASSESSORIA E CONSULTORIA EM SERVICOS DE ALIMENTACAO LTDA.,SAO BERNARDO DO CAMPO,7,1997,Sociedade Limitada
35214577634,CASTRO & MORAES MATERIAL ELETRICOS LTDA.,BURITAMA,7,1997,Sociedade Limitada
35214577642,JC NEW-CAR COMERCIO DE SOM E ACESSORIOS PARA VEICULOS E PRESTACAO SERVICOS DE RECUPERACAO DE PINTURAS LTDA.,GUARULHOS,7,1997,Sociedade Limitada
35214577651,TEZE COMERCIO E REPRESENTACOES LTDA,SAO PAULO,7,1997,Sociedade Limitada
35214577669,VID'AGUA DISTRIBUIDORA DE AGUA LTDA.,SAO PAULO,7,1997,Sociedade Limitada
35214577677,SOARES & RUSSI LTDA.,ITAPEVA,7,1997,Sociedade Limitada
35214577685,FIGUEIREDO & TOMIAZZI LTDA,PRESIDENTE PRUDENTE,7,1997,Sociedade Limitada
35214577693,TC DISTRIBUIDORA LTDA,CAMPINAS,7,1997,Sociedade Limitada
35214577707,INDUSTRIA DE MOVEIS DE MADEIRA PETRONI E COMERCIO LTDA.,SAO BERNARDO DO CAMPO,7,1997,Sociedade Limitada
35214577715,PATTY ARTIGO DE FESTA LTDA.,SAO PAULO,7,1997,Sociedade Limitada
35214577723,OTICA SHOPPING TATUAPE LTDA.,SAO PAULO,7,1997,Sociedade Limitada
35214577731,SANTO ANGELO TRANSPORTES E LOCACAO DE VEICULOS LTDA.,SAO PAULO,7,1997,Sociedade Limitada
35214577740,LIMA E FANTIN-PADARIA E CONFEITARIA LTDA.,LIMEIRA,7,1997,Sociedade Limitada
35214577758,ADEGA NOVO TRIUNFO LTDA.,SAO PAULO,7,1997,Sociedade Limitada
35214577766,EXPRESSO RG TRANSPORTES LTDA.,SAO PAULO,7,1997,Sociedade Limitada
35214577782,ANGELINI COMERCIO DE ALIMENTOS LTDA.,SAO PAULO,7,1997,Sociedade Limitada
35214577791,FAF RESTAURANTE INDUSTRIAL LTDA.,SAO ROQUE,7,1997,Sociedade Limitada
35214577804,COMERCIAL OSHIMA LTDA.,OURINHOS,7,1997,Sociedade Limitada
35214577812,NASA REPRESENTACAO E TRANSPORTES LTDA.,ALUMINIO,7,1997,Sociedade Limitada
35214577821,BAR E EMPORIO FAVITA LTDA.,SAO PAULO,7,1997,Sociedade Limitada
35214577839,PENHA CRISTAIS E VIDROS TEMPERADOS LTDA,SAO PAULO,7,1997,Sociedade Limitada
35214577847,PROAGRI - PLANEJAMENTO AGRICOLA LTDA,SANTA CRUZ DAS PALMEIRAS,7,1997,Sociedade Limitada
35214577855,KALIMERA EDITORA E DISTRIBUIDORA DE LIVROS LTDA.,SAO PAULO,7,1997,Sociedade Limitada
35214577863,WILDE & BARROS REPRESENTACOES COMERCIAIS LTDA,SAO PAULO,7,1997,Sociedade Limitada
35214577871,RESTAURANTE PORTA AGUIAR LTDA.,SANTO ANDRE,7,1997,Sociedade Limitada
35214577880,MARLICHI INDUSTRIA E COMERCIO DE PESCADOS SALGADOS LTDA.,SAO PAULO,7,1997,Sociedade Limitada
35214577898,DORIVAL HONORIO DE OLIVEIRA & CIA LTDA.,OLIMPIA,7,1997,Sociedade Limitada
35214577901,ALCANI - COMERCIO ATACADISTA LTDA,SANTA CRUZ DO RIO PARDO,7,1997,Sociedade Limitada
35214577910,C.R.LION COMERCIO DE FILTROS LTDA,SAO CAETANO DO SUL,7,1997,Sociedade Limitada
35214577928,RTM PARTICIPACOES LTDA.,SAO PAULO,7,1997,Sociedade Limitada
35214577936,LECACE COMERCIO DE CONFECCOES LTDA.,SAO PAULO,7,1997,Sociedade Limitada
35214577944,CIRRUS REPRESENTACOES COMERCIAIS LTDA.,SAO PAULO,7,1997,Sociedade Limitada
35214577952,CASA DE CARNES GROTTI LTDA.,JUNDIAI,7,1997,Sociedade Limitada
35214577961,ZOROVICH ENGENHARIA SOCIEDADE SIMPLES LTDA.,SAO PAULO,7,1997,Sociedade Limitada
35214577979,TOCO SOL COMERCIO DE ROUPAS LTDA.,SAO PAULO,7,1997,Sociedade Limitada
35214577987,DENY DESCARTAVEIS LTDA.,MOGI-MIRIM,7,1997,Sociedade Limitada
35214577995,CONVER-MAQ MANUTENCAO E COMERCIO DE PECAS EM GERAL LTDA.,SAO PAULO,7,1997,Sociedade Limitada
35214578002,DEYVSCREEN COMERCIO SERIGRAFO LTDA.,SAO PAULO,7,1997,Sociedade Limitada
35214578011,RONDIARTE COMERCIO E EMBALAGNS LTDA.,SAO BERNARDO DO CAMPO,7,1997,Sociedade Limitada
35214578029,RETAGUARDA COMERCIO DE SALGADOS E DOCES LTDA.,SAO PAULO,7,1997,Sociedade Limitada
35214578037,TOQUE DE CLASSE CONFEITARIA LTDA,SAO PAULO,7,1997,Sociedade Limitada
35214578045,INJEFLEX INDUSTRIA E COMERCIO DE DISPOSITIVOS E PRODUTOS MEDICOS LTDA,SAO PAULO,7,1997,Sociedade Limitada
35214578053,DELTA OUTDOOR MEDIA DO BRASIL LTDA.,SAO PAULO,7,1997,Sociedade Limitada
35214578061,PAGANELLI & SOUZA LTDA.,JUNDIAI,7,1997,Sociedade Limitada
35214578070,TCHU TCHU'S PIZZARIA LTDA,SAO PAULO,7,1997,Sociedade Limitada
35214578088,CARMONA & OCANA LTDA.,MOCOCA,7,1997,Sociedade Limitada
35214578096,SKINJET _ POLIURETANO LTDA.,SAO PAULO,7,1997,Sociedade Limitada
35214578118,BRANDAO & SOUZA SERVICOS DE APOIO ADMINISTRATIVO LTDA,SAO PAULO,7,1997,Sociedade Limitada
35214578126,METAL FERRO ESQUADRIAS DE FERRO LTDA.,SAO PAULO,7,1997,Sociedade Limitada
35214578134,CANETEIRA COMERCIO E REPRESENTACAO LTDA.,SAO PAULO,7,1997,Sociedade Limitada
35214578142,F.P. NAMU CONFECCOES LTDA.,SAO PAULO,7,1997,Sociedade Limitada
35214578151,NORTE RACING AUTO CENTRO LTDA.,SAO PAULO,7,1997,Sociedade Limitada
35214578169,ACAMPAMENTO TIETE NOSSO RIO LTDA,SALESOPOLIS,7,1997,Sociedade Limitada
35214578177,MENDES & COELHO DE IGUAPE LTDA.,IGUAPE,7,1997,Sociedade Limitada
35214578185,MIR EDITORA COMERCIAL E IMPORTADORA LTDA.,SAO PAULO,7,1997,Sociedade Limitada
35214578193,R.T.W. INCORPORACAO E CONSTRUCAO LTDA.,OSASCO,7,1997,Sociedade Limitada
35214578207,MERCEARIA ESTRELA FAMOSA COMERCIO DE ALIMENTACAO LTDA.,SAO PAULO,7,1997,Sociedade Limitada
35214578215,RUYCE GRAF LTDA.,DIADEMA,7,1997,Sociedade Limitada
35214578223,EL CICLON LIVRARIA E PAPELARIA LTDA,SAO BERNARDO DO CAMPO,7,1997,Sociedade Limitada
35214578231,"FEEDER - MOLAS PESADAS, INDUSTRIA E COMERCIO LTDA.",SAO PAULO,7,1997,Sociedade Limitada
35214578240,FERREIRA CAMARGO REPRESENTACOES LTDA,SAO BERNARDO DO CAMPO,7,1997,Sociedade Limitada
35214578258,TIBERIO COELHO & COELHO DA SILVA TARUMA LTDA.,TARUMA,7,1997,Sociedade Limitada
35214578266,AVANCO COMERCIO E SERVICOS LTDA,SAO PAULO,7,1997,Sociedade Limitada
35214578274,COMERCIO DE GESSOS BRASAO LTDA,SAO PAULO,7,1997,Sociedade Limitada
35214578282,INOVE PRODUCOES E EVENTOS LTDA,SAO PAULO,7,1997,Sociedade Limitada
35214578291,TIM JEANS CONFECCOES LTDA,TIMBURI,7,1997,Sociedade Limitada
35214578304,ROBINSON E BARROS SERVICOS ADMINISTRATIVOS LTDA,JUNDIAI,7,1997,Sociedade Limitada
35214578312,"DEL VECCHIO, MAZZER & CIA LTDA",TAQUARITINGA,7,1997,Sociedade Limitada
35214578321,CONSEG COMERCIO E SERVICOS DE SEGURANCA LTDA,CACAPAVA,7,1997,Sociedade Limitada
35214578339,SONHO VERDE COMERCIO DE ALIMENTOS LTDA,SAO PAULO,7,1997,Sociedade Limitada
35214578347,DILEIA COMERCIO LTDA. ME.,SAO PAULO,7,1997,Sociedade Limitada
35214578355,MARIA SANTISSIMA CONFECCAO E COMERCIO DE ROUPAS E ACESSORIOS LTDA,PERUIBE,7,1997,Sociedade Limitada
35214578363,VALERIA EQUIPAMENTOS INDUSTRIAIS LTDA,SAO PAULO,7,1997,Sociedade Limitada
35214578371,EXTENSAO DE SAO BERNARDO MATERIAIS PARA CONSTRUCOES LTDA.,SAO BERNARDO DO CAMPO,7,1997,Sociedade Limitada
35214578380,MOTO FLASH TRANSPORTE DE DOCUMENTOS LTDA.,SAO PAULO,7,1997,Sociedade Limitada
35214578398,BELLI COMERCIO IMPORTACAO E EXPORTACAO LTDA EPP,SAO PAULO,7,1997,Sociedade Limitada
35214578401,RT EMPREENDIMENTOS IMOBILIARIOS LTDA,SAO PAULO,7,1997,Sociedade Limitada
35214578410,NEW RESORT EMPRENDIMENTOS COMERCIAS TURISTICOS E PARTICIPACOES LTDA.,SALTO,7,1997,Sociedade Limitada
35214578428,POSITIVO COMERCIO DE VEICULOS LTDA.,SAO PAULO,7,1997,Sociedade Limitada
35214578436,TRANSPORTADORA CM LTDA.,OSASCO,7,1997,Sociedade Limitada
35214578444,M E W MARTINS TRANSPORTES LTDA.,DIADEMA,7,1997,Sociedade Limitada
35214578452,ELIBE AGROPECUARIA LTDA.,VALINHOS,7,1997,Sociedade Limitada
35214578461,MARCENARIA EFICAZ LTDA.,DIADEMA,7,1997,Sociedade Limitada
35214578479,YES BRAZIL EXPRESS CARGAS LTDA,CARAPICUIBA,7,1997,Sociedade Limitada
35214578487,ACAI ALIMENTOS LTDA.,SAO PAULO,7,1997,Sociedade Limitada
35214578495,M. V. EXPRESS MATERIAIS DE CONSTRUCAO LTDA,FRANCA,7,1997,Sociedade Limitada
35214578509,J.K MOVEIS E RESTAURACAO LTDA,PIRAJU,7,1997,Sociedade Limitada
35214578517,CATANDUVA TRANSPORTES E SERVICOS AGRICOLAS LTDA,CATANDUVA,7,1997,Sociedade Limitada
35214578525,AUTO SOCORRO SAO JOAO DE AVARE LTDA,AVARE,7,1997,Sociedade Limitada
35214578533,UNDERBID RADIO-COMUNICACAO SERVICOS E COMERCIO LTDA,SAO PAULO,7,1997,Sociedade Limitada
35214578541,SEIBEL & OLIVEIRA BAZAR E PAPELARIA LTDA,SANTA ISABEL,7,1997,Sociedade Limitada
35214578550,SUCEL ASSESSORIA REPRESENTACAO E COMERCIO LTDA.,SAO PAULO,7,1997,Sociedade Limitada
35214578568,MARCENARIA DO BAPTISTETI LTDA,SAO BERNARDO DO CAMPO,7,1997,Sociedade Limitada
35214578576,CONFECCOES ANAI MARIE LTDA,SAO PAULO,7,1997,Sociedade Limitada
35214578584,CENTRO AUTOMOTIVO J.C. LTDA,OSASCO,7,1997,Sociedade Limitada
35214578592,H.D. HIDRAULICA E FERRAGENS LTDA,AGUAS DE LINDOIA,7,1997,Sociedade Limitada
35214578606,MCF COMERCIO VAREJISTA DE EQUIPAMENTOS DE INFORMATICA LTDA,SAO PAULO,7,1997,Sociedade Limitada
35214578614,PALMA TECNOLOGIA EM INFORMATICA LTDA,SAO PAULO,7,1997,Sociedade Limitada
35214578622,SECULUS INFORMATICA LTDA,SAO PAULO,7,1997,Sociedade Limitada
35214578631,BRAZIL PARTES REPRESENTACAO IMPORTACAO E EXPORTACAO LTDA,SAO PAULO,7,1997,Sociedade Limitada
35214578657,STELLER PECAS E ACESSORIOS AUTOMOTIVOS LTDA,SAO PAULO,7,1997,Sociedade Limitada
35214578665,CASTELO BRANCO TRANSPORTES E LOGISTICA LTDA,CAMPINAS,7,1997,Sociedade Limitada
35214578673,DE PAULA VEICULOS LTDA,SAO PAULO,7,1997,Sociedade Limitada
35214578681,J.C. COMERCIO DE MATERIAIS MEDICO ODONTOLOGICOS LTDA,SAO PAULO,7,1997,Sociedade Limitada
35214578690,MARCONDES BASSI-INDUSTRIA E COMERCIO DE ARTEFATOS DE CONCRETO LTDA.,OSASCO,7,1997,Sociedade Limitada
35214578703,BAZAR D & Z LTDA.,TAUBATE,7,1997,Sociedade Limitada
35214578711,OBVIO COMERCIO DE ROUPAS CALCADOS E BOLSAS LTDA.,SAO PAULO,7,1997,Sociedade Limitada
35214578720,SYSTENGE PARTICIPACOES LTDA.,SAO PAULO,7,1997,Sociedade Limitada
35214578738,SOFRIGO SERVICOS DE CARGA E DESCARGA LTDA,SAO PAULO,7,1997,Sociedade Limitada
35214578746,TOTAL - PROTECAO COMERCIO DE EQUIPAMENTOS DE SEGURANCA PESSOAL LTDA.,SAO PAULO,7,1997,Sociedade Limitada
35214578754,NEW DELFIM COMERCIO DE SOM E IMAGEM LTDA.,SAO PAULO,7,1997,Sociedade Limitada
35214578762,CASA NOVA COMERCIAL LTDA.,SAO JOSE DOS CAMPOS,7,1997,Sociedade Limitada
35214578771,OLIVEIRA & DA SILVA COMERCIO DE VEICULOS LTDA.,SAO JOSE DOS CAMPOS,7,1997,Sociedade Limitada
35214578789,BAR E RESTAURANTE JM TEMPEIRO DO BEXIGA LTDA.,SAO PAULO,7,1997,Sociedade Limitada
35214578797,BARAO DE IJUI LTDA.,SAO PAULO,7,1997,Sociedade Limitada
35214578801,AUTO MECANICA AGS LTDA.,SAO PAULO,7,1997,Sociedade Limitada
35214578819,DPL PRODUCOES EM VIDEO LTDA,SAO PAULO,7,1997,Sociedade Limitada
35214578827,W.M. ELOI COMERCIO DE PRODUTOS FARMACEUTICOS LTDA.,SAO PAULO,7,1997,Sociedade Limitada
35214578835,PSICOTRIP - COMERCIO E CONFECCAO DE ROUPAS E ACESSORIOS LTDA,SAO PAULO,7,1997,Sociedade Limitada
35214578843,MICELANIA ARTIGOS EM GERAL LTDA.,JACAREI,7,1997,Sociedade Limitada
35214578851,BLOCOS E LAJES N.P. LTDA.,SUMARE,7,1997,Sociedade Limitada
35214578860,LUMINOSOS ARCO-IRISINDUSTRIA E COMERCIO LTDA.,SUMARE,7,1997,Sociedade Limitada
35214578878,MAIS GRAFICA E EDITORA LTDA.,ARTUR NOGUEIRA,7,1997,Sociedade Limitada
35214578886,VALMIR MARQUES DA SILVA & CIA LTDA,ENGENHEIRO COELHO,7,1997,Sociedade Limitada
35214578894,MUNDIAL TELECON COMERCIAL LTDA.,SAO PAULO,7,1997,Sociedade Limitada
35214578908,EC & QTC SERVICOS LTDA.,SANTO ANDRE,7,1997,Sociedade Limitada
35214578916,ZIK CONSULTORIA REPRESENTACOES E COMERCIO LTDA.,SAO PAULO,7,1997,Sociedade Limitada
35214578924,HUMBERTO GUIA JORNAIS E REVISTAS LTDA.,SAO PAULO,7,1997,Sociedade Limitada
35214578932,CLEONICE - SERVICOS DE BUFFET E RECEPCOES LTDA,OSASCO,7,1997,Sociedade Limitada
35214578941,VIDRACARIA LIDIANE LTDA.,CUBATAO,7,1997,Sociedade Limitada
35214578959,MARI & MARA CONFECCOES LTDA.,SAO PAULO,7,1997,Sociedade Limitada
35214578967,RAMSES SPEED RACING & COMERCIO DE BRINQUEDOS EM GERAL LTDA.,OSASCO,7,1997,Sociedade Limitada
35214578975,DO NONO & DA NONA ALIMENTOS E BEBIDAS LTDA.,RIBEIRAO PIRES,7,1997,Sociedade Limitada
35214578983,SWEET PAN COMERCIO E REPRESENTACOES LTDA.,SANTO ANDRE,7,1997,Sociedade Limitada
35214578991,LA BELLA MASSAS ALIMENTICIAS SJCAMPOS LTDA.,SAO JOSE DOS CAMPOS,7,1997,Sociedade Limitada
35214579009,PRIMEIRA ESTACAO COMERCIO DE ARMARINHOS EM GERAL LTDA.,SAO PAULO,7,1997,Sociedade Limitada
35214579017,LAVANDERIAS LCA LTDA.,SAO PAULO,7,1997,Sociedade Limitada
35214579025,TRANSPORTADORA SANTANA & GOMES LTDA,COSMOPOLIS,7,1997,Sociedade Limitada
35214579033,MARCHI & MARSON LTDA.,COSMOPOLIS,7,1997,Sociedade Limitada
35214579041,WATTCRON RESISTENCIAS ELETRICAS LTDA.,SAO PAULO,7,1997,Sociedade Limitada
35214579050,LUDEBECA DISTRIBUIDORA DE PRODUTOS ALIMENTICIOS LTDA.,SAO PAULO,7,1997,Sociedade Limitada
35214579068,BIG CINE E VIDEO LTDA,SAO PAULO,7,1997,Sociedade Limitada
35214579076,BUDPLAS - MOLDES E INJECAO DE TERMOPLASTICOS LTDA.,SAO PAULO,7,1997,Sociedade Limitada
35214579084,N. M. S. WORLD COMERCIO EXTERIOR LTDA,BARUERI,7,1997,Sociedade Limitada
35214579092,SORAIA & GUSTAVO DIVERSOES ELETRONICAS LTDA,SAO PAULO,7,1997,Sociedade Limitada
35214579106,FAST-WORK-ENTREGAS RAPIDAS LTDA,DIADEMA,7,1997,Sociedade Limitada
35214579114,DEUSDEDITH SANCHES & CIA LTDA.,ILHA SOLTEIRA,7,1997,Sociedade Limitada
35214579122,J.M. CONFECCOES LTDA.,DOLCINOPOLIS,7,1997,Sociedade Limitada
35214579131,MAZZEI CAYRES & LACERDA LTDA,PARAGUACU PAULISTA,7,1997,Sociedade Limitada
35214579149,BRUELLIKE INDUSTRIA E COMERCIO DE CONFECCOES LTDA.,CONCHAS,7,1997,Sociedade Limitada
35214579157,SERRARIA PIRAMIDE BEBEDOURO LTDA,BEBEDOURO,7,1997,Sociedade Limitada
35214579165,BAZAR THITHA LTDA,POA,7,1997,Sociedade Limitada
35214579173,NAGOYA PLASTICOS LTDA,SAO BERNARDO DO CAMPO,7,1997,Sociedade Limitada
35214579181,BREGA MOTOS LTDA,MOGI-MIRIM,7,1997,Sociedade Limitada
35214579190,UP AND DOWN COMERCIO IMPORTACAO E EXPORTACAO LTDA,SAO PAULO,7,1997,Sociedade Limitada
35214579203,SANCOM COMERCIO DE MATERIAIS ELETRICOS LTDA.,SAO CAETANO DO SUL,7,1997,Sociedade Limitada
35214579211,MAK - PECAS - COMERCIO E SERVICOS LTDA.,SOROCABA,7,1997,Sociedade Limitada
35214579220,CASA DO NORTE JD LTDA.,GUARULHOS,7,1997,Sociedade Limitada
35214579238,ORLANCAR AUTO MECANICA FUNILARIA E PINTURA LTDA.,GUARULHOS,7,1997,Sociedade Limitada
35214579246,RODRIGUES & MARIOTI LTDA.,TUPA,7,1997,Sociedade Limitada
35214579254,W. M. BARBAROTO REPRESENTACOES COMERCIAIS LTDA.,ADAMANTINA,7,1997,Sociedade Limitada
35214579262,PROFILE RECRUTAMENTO E PESQUISAS LTDA,SAO PAULO,7,1997,Sociedade Limitada
35214579271,TCR EAGLE CONSULTORIA E SERVICOS LTDA,SANTANA DE PARNAIBA,7,1997,Sociedade Limitada
35214579289,VICENTE DE CARVALHO PNEUS LTDA,SAO PAULO,7,1997,Sociedade Limitada
35214579297,MARI ANA FLORES E PLANTAS LTDA,SANTO ANTONIO DE POSSE,7,1997,Sociedade Limitada
35214579301,O KM DISTRIBUIDORA DE AUTO PECAS LTDA,SAO PAULO,7,1997,Sociedade Limitada
35214579319,PLANET TOY - COMERCIO DE ARTIGOS PARA FESTAS LTDA,SANTO ANDRE,7,1997,Sociedade Limitada
35214579327,TRADEFAC FOMENTO MERCANTIL LTDA.,SAO PAULO,7,1997,Sociedade Limitada
35214579335,CASA DE CARNES TORQUATO LTDA.,SAO PAULO,7,1997,Sociedade Limitada
35214579343,EDSON MULINA E CIA LTDA,SAO JOSE DO RIO PARDO,7,1997,Sociedade Limitada
35214579351,LODDI INFORMATICALTDA,SANTO ANDRE,7,1997,Sociedade Limitada
35214579360,JWA. K CONSTRUTORA E INCORPORADORA LTDA.,DIADEMA,7,1997,Sociedade Limitada
35214579378,ALEXANDRIA & DAMASCENO ARTIGOS RECREATIVOS LTDA,RIBEIRAO PRETO,7,1997,Sociedade Limitada
35214579386,L. BRITE ENGENHARIA LTDA.,SAO PAULO,7,1997,Sociedade Limitada
35214579394,ABRABOM DISTRIBUIDORA DE PRODUTOS ALIMENTICIOS LTDA.,RIBEIRAO PRETO,7,1997,Sociedade Limitada
35214579408,ANTONIO CARLOS PERINA DE VASCONCELOS & CIA LTDA.,AGUAI,7,1997,Sociedade Limitada
35214579416,LETIPE INDUSTRIA COMERCIO DE CALCADOS LTDA.,BIRIGUI,7,1997,Sociedade Limitada
35214579424,MIMO'S CAFE LTDA.,SAO PAULO,7,1997,Sociedade Limitada
35214579432,SINBRAS INTERNET & TELECOM LTDA,SANTANA DE PARNAIBA,7,1997,Sociedade Limitada
35214579441,BRASIL LOCACOES E COMERCIO LTDA.,CAMPINAS,7,1997,Sociedade Limitada
35214579459,MOLDURAS NOBRE QUADROS E OBRAS DE ARTE LTDA.,SAO PAULO,7,1997,Sociedade Limitada
35214579467,M3 REPRESENTACOES EM VENDAS LTDA,SAO PAULO,7,1997,Sociedade Limitada
35214579327,TRADEFAC FOMENTO MERCANTIL LTDA.,SAO PAULO,7,1997,Sociedade Limitada
35214579335,CASA DE CARNES TORQUATO LTDA.,SAO PAULO,7,1997,Sociedade Limitada
35214579343,EDSON MULINA E CIA LTDA,SAO JOSE DO RIO PARDO,7,1997,Sociedade Limitada
35214579351,LODDI INFORMATICALTDA,SANTO ANDRE,7,1997,Sociedade Limitada
35214579360,JWA. K CONSTRUTORA E INCORPORADORA LTDA.,DIADEMA,7,1997,Sociedade Limitada
35214579378,ALEXANDRIA & DAMASCENO ARTIGOS RECREATIVOS LTDA,RIBEIRAO PRETO,7,1997,Sociedade Limitada
35214579386,L. BRITE ENGENHARIA LTDA.,SAO PAULO,7,1997,Sociedade Limitada
35214579394,ABRABOM DISTRIBUIDORA DE PRODUTOS ALIMENTICIOS LTDA.,RIBEIRAO PRETO,7,1997,Sociedade Limitada
35214579408,ANTONIO CARLOS PERINA DE VASCONCELOS & CIA LTDA.,AGUAI,7,1997,Sociedade Limitada
35214579416,LETIPE INDUSTRIA COMERCIO DE CALCADOS LTDA.,BIRIGUI,7,1997,Sociedade Limitada
35214579424,MIMO'S CAFE LTDA.,SAO PAULO,7,1997,Sociedade Limitada
35214579432,SINBRAS INTERNET & TELECOM LTDA,SANTANA DE PARNAIBA,7,1997,Sociedade Limitada
35214579441,BRASIL LOCACOES E COMERCIO LTDA.,CAMPINAS,7,1997,Sociedade Limitada
35214579459,MOLDURAS NOBRE QUADROS E OBRAS DE ARTE LTDA.,SAO PAULO,7,1997,Sociedade Limitada
35214579467,M3 REPRESENTACOES EM VENDAS LTDA,SAO PAULO,7,1997,Sociedade Limitada
35214579327,TRADEFAC FOMENTO MERCANTIL LTDA.,SAO PAULO,7,1997,Sociedade Limitada
35214579335,CASA DE CARNES TORQUATO LTDA.,SAO PAULO,7,1997,Sociedade Limitada
35214579343,EDSON MULINA E CIA LTDA,SAO JOSE DO RIO PARDO,7,1997,Sociedade Limitada
35214579351,LODDI INFORMATICALTDA,SANTO ANDRE,7,1997,Sociedade Limitada
35214579360,JWA. K CONSTRUTORA E INCORPORADORA LTDA.,DIADEMA,7,1997,Sociedade Limitada
35214579378,ALEXANDRIA & DAMASCENO ARTIGOS RECREATIVOS LTDA,RIBEIRAO PRETO,7,1997,Sociedade Limitada
35214579386,L. BRITE ENGENHARIA LTDA.,SAO PAULO,7,1997,Sociedade Limitada
35214579394,ABRABOM DISTRIBUIDORA DE PRODUTOS ALIMENTICIOS LTDA.,RIBEIRAO PRETO,7,1997,Sociedade Limitada
35214579408,ANTONIO CARLOS PERINA DE VASCONCELOS & CIA LTDA.,AGUAI,7,1997,Sociedade Limitada
35214579416,LETIPE INDUSTRIA COMERCIO DE CALCADOS LTDA.,BIRIGUI,7,1997,Sociedade Limitada
35214579424,MIMO'S CAFE LTDA.,SAO PAULO,7,1997,Sociedade Limitada
35214579432,SINBRAS INTERNET & TELECOM LTDA,SANTANA DE PARNAIBA,7,1997,Sociedade Limitada
35214579441,BRASIL LOCACOES E COMERCIO LTDA.,CAMPINAS,7,1997,Sociedade Limitada
35214579459,MOLDURAS NOBRE QUADROS E OBRAS DE ARTE LTDA.,SAO PAULO,7,1997,Sociedade Limitada
35214579467,M3 REPRESENTACOES EM VENDAS LTDA,SAO PAULO,7,1997,Sociedade Limitada
35214579327,TRADEFAC FOMENTO MERCANTIL LTDA.,SAO PAULO,7,1997,Sociedade Limitada
35214579335,CASA DE CARNES TORQUATO LTDA.,SAO PAULO,7,1997,Sociedade Limitada
35214579343,EDSON MULINA E CIA LTDA,SAO JOSE DO RIO PARDO,7,1997,Sociedade Limitada
35214579351,LODDI INFORMATICALTDA,SANTO ANDRE,7,1997,Sociedade Limitada
35214579360,JWA. K CONSTRUTORA E INCORPORADORA LTDA.,DIADEMA,7,1997,Sociedade Limitada
35214579378,ALEXANDRIA & DAMASCENO ARTIGOS RECREATIVOS LTDA,RIBEIRAO PRETO,7,1997,Sociedade Limitada
35214579386,L. BRITE ENGENHARIA LTDA.,SAO PAULO,7,1997,Sociedade Limitada
35214579394,ABRABOM DISTRIBUIDORA DE PRODUTOS ALIMENTICIOS LTDA.,RIBEIRAO PRETO,7,1997,Sociedade Limitada
35214579408,ANTONIO CARLOS PERINA DE VASCONCELOS & CIA LTDA.,AGUAI,7,1997,Sociedade Limitada
35214579416,LETIPE INDUSTRIA COMERCIO DE CALCADOS LTDA.,BIRIGUI,7,1997,Sociedade Limitada
35214579424,MIMO'S CAFE LTDA.,SAO PAULO,7,1997,Sociedade Limitada
35214579432,SINBRAS INTERNET & TELECOM LTDA,SANTANA DE PARNAIBA,7,1997,Sociedade Limitada
35214579441,BRASIL LOCACOES E COMERCIO LTDA.,CAMPINAS,7,1997,Sociedade Limitada
35214579459,MOLDURAS NOBRE QUADROS E OBRAS DE ARTE LTDA.,SAO PAULO,7,1997,Sociedade Limitada
35214579467,M3 REPRESENTACOES EM VENDAS LTDA,SAO PAULO,7,1997,Sociedade Limitada
35214579327,TRADEFAC FOMENTO MERCANTIL LTDA.,SAO PAULO,7,1997,Sociedade Limitada
35214579335,CASA DE CARNES TORQUATO LTDA.,SAO PAULO,7,1997,Sociedade Limitada
35214579343,EDSON MULINA E CIA LTDA,SAO JOSE DO RIO PARDO,7,1997,Sociedade Limitada
35214579351,LODDI INFORMATICALTDA,SANTO ANDRE,7,1997,Sociedade Limitada
35214579360,JWA. K CONSTRUTORA E INCORPORADORA LTDA.,DIADEMA,7,1997,Sociedade Limitada
35214579378,ALEXANDRIA & DAMASCENO ARTIGOS RECREATIVOS LTDA,RIBEIRAO PRETO,7,1997,Sociedade Limitada
35214579386,L. BRITE ENGENHARIA LTDA.,SAO PAULO,7,1997,Sociedade Limitada
35214579394,ABRABOM DISTRIBUIDORA DE PRODUTOS ALIMENTICIOS LTDA.,RIBEIRAO PRETO,7,1997,Sociedade Limitada
35214579408,ANTONIO CARLOS PERINA DE VASCONCELOS & CIA LTDA.,AGUAI,7,1997,Sociedade Limitada
35214579416,LETIPE INDUSTRIA COMERCIO DE CALCADOS LTDA.,BIRIGUI,7,1997,Sociedade Limitada
35214579424,MIMO'S CAFE LTDA.,SAO PAULO,7,1997,Sociedade Limitada
35214579432,SINBRAS INTERNET & TELECOM LTDA,SANTANA DE PARNAIBA,7,1997,Sociedade Limitada
35214579441,BRASIL LOCACOES E COMERCIO LTDA.,CAMPINAS,7,1997,Sociedade Limitada
