NIRE,Empresa,Município,Month,Year,Type
35109372777,ILARINO DE SOUZA.,SÃO PAULO,7,1997,Empresario
35115271839,SEBASTIAO JORGE DE SOUSA OSASCO,OSASCO,7,1997,Empresario
35115276679,IVONE DE CASTRO,LIMEIRA,7,1997,Empresario
35115276687,ROSA MARIA ESCAMANHANI TREVIZANUTO DROGARIA,AMERICANA,7,1997,Empresario
35115276695,VALDOMIRO GUELERE SUMARE,SUMARÉ,7,1997,Empresario
35115276709,SILVANA MARI DA SILVA,SÃO PAULO,7,1997,Empresario
35115276717,VINICIUS RODRIGUES DOS SANTOS INFORMATICA,SÃO VICENTE,7,1997,Empresario
35115276725,JAIR DIAS TINOCO,SANTOS,7,1997,Empresario
35115276733,MARCIO APARECIDO DE SOUZA VIEGAS,CERQUILHO,7,1997,Empresario
35115276741,ELIANA A. DE OLIVEIRA,PEDREIRA,7,1997,Empresario
35115276750,JOSE EDILSON DE WERNEKE ITARARE,ITARARÉ,7,1997,Empresario
35115276768,ANA MARIA LOPES GENEROSO,ITARARÉ,7,1997,Empresario
35115276776,ALVARO AUGUSTO RODRIGUES,CONCHAS,7,1997,Empresario
35115276784,M.H. SPINELLI,SANTOS,7,1997,Empresario
35115276792,FRANCISCO ALIPIO DE ALMEIDA PRADO SOBRINHO,JAÚ,7,1997,Empresario
35115276806,ANA APARECIDA DA SILVA MATZUMURA,RINCÃO,7,1997,Empresario
35115276814,AUREA SILVA EDUARDO,IGARAPAVA,7,1997,Empresario
35115276822,JOSE PELIPECKI PERUIBE,PERUÍBE,7,1997,Empresario
35115276831,DORACI CERRATO REQUENA,SANTO ANDRÉ,7,1997,Empresario
35115276849,LAURA LINA DA SILVA,SÃO PAULO,7,1997,Empresario
35115276857,MARIA APARECIDA DE ALMEIDA SOARES,JAÚ,7,1997,Empresario
35115276865,JOSE GOMES DA CUNHA BAURU,BAURU,7,1997,Empresario
35115276873,SIRLEI APARECIDA SOARES,BARRETOS,7,1997,Empresario
35115276881,PAULA CASTILHO CHAVES,RIBEIRÃO PRETO,7,1997,Empresario
35115276890,RODRIGO ACAIABE DIAS,SANTO ANTÔNIO DO JARDIM,7,1997,Empresario
35115276903,ANTONIO CARLOS LEO PADILHA,SÃO PEDRO DO TURVO,7,1997,Empresario
35115276911,JOSE LUIS DE OLIVEIRA PRADO,ATIBAIA,7,1997,Empresario
35115276920,VERA LUCIA DIAS CORREA,ITAPETININGA,7,1997,Empresario
35115276938,NILTON JOSE LEME GUARARAPES,BENTO DE ABREU,7,1997,Empresario
35115276946,ELIZEU V. PAUVELHO,MARACAÍ,7,1997,Empresario
35115276954,ROSANA MARTINS BOCONCELLO BAURU,BAURU,7,1997,Empresario
35115276962,RICARDO KUMAZAWA BIRIGUI,BIRIGÜI,7,1997,Empresario
35115276971,EDSON MORENO ARACATUBA,ARAÇATUBA,7,1997,Empresario
35115276989,CLAUDEMIR BERNARDES TAQUARITINGA,TAQUARITINGA,7,1997,Empresario
35115276997,JOSE ALFREDO RIBEIRO - CANTINA,SÃO PAULO,7,1997,Empresario
35115277004,RONALDO ABRAHAO,,7,1997,Empresario
35115277012,MARIO AUGUSTO GONCALVES SOARES,SÃO PAULO,7,1997,Empresario
35115277021,ROBERTO CAMISOTTI,SÃO PAULO,7,1997,Empresario
35115277039,EVANILDE BEZERRA LIMA BERNARDINELLI PROMISSAO,PROMISSÃO,7,1997,Empresario
35115277047,GEORGE AUGUSTO VILLELA,SOROCABA,7,1997,Empresario
35115277055,REGINA CELIA DA CORTE NASCIMENTO DA SILVA SOROCABA,SOROCABA,7,1997,Empresario
35115277063,MARIA HELENA ALVES COIGNAT,SOROCABA,7,1997,Empresario
35115277071,NEUZA BUENO RODRIGUES,SOROCABA,7,1997,Empresario
35115277080,ANTONIO BODO FILHO,TUPÃ,7,1997,Empresario
35115277098,ADRIANA SAYURI HAJIME DE OLIVEIRA PROMISSAO,PROMISSÃO,7,1997,Empresario
35115276954,ROSANA MARTINS BOCONCELLO BAURU,BAURU,7,1997,Empresario
35115276962,RICARDO KUMAZAWA BIRIGUI,BIRIGÜI,7,1997,Empresario
35115276971,EDSON MORENO ARACATUBA,ARAÇATUBA,7,1997,Empresario
35115276989,CLAUDEMIR BERNARDES TAQUARITINGA,TAQUARITINGA,7,1997,Empresario
35115276997,JOSE ALFREDO RIBEIRO - CANTINA,SÃO PAULO,7,1997,Empresario
35115277004,RONALDO ABRAHAO,,7,1997,Empresario
35115277012,MARIO AUGUSTO GONCALVES SOARES,SÃO PAULO,7,1997,Empresario
35115277021,ROBERTO CAMISOTTI,SÃO PAULO,7,1997,Empresario
35115277039,EVANILDE BEZERRA LIMA BERNARDINELLI PROMISSAO,PROMISSÃO,7,1997,Empresario
35115277047,GEORGE AUGUSTO VILLELA,SOROCABA,7,1997,Empresario
35115277055,REGINA CELIA DA CORTE NASCIMENTO DA SILVA SOROCABA,SOROCABA,7,1997,Empresario
35115277063,MARIA HELENA ALVES COIGNAT,SOROCABA,7,1997,Empresario
35115277071,NEUZA BUENO RODRIGUES,SOROCABA,7,1997,Empresario
35115277080,ANTONIO BODO FILHO,TUPÃ,7,1997,Empresario
35115277098,ADRIANA SAYURI HAJIME DE OLIVEIRA PROMISSAO,PROMISSÃO,7,1997,Empresario
35115277250,PAULO EDUARDO LIMA CHAGAS,SÃO PAULO,7,1997,Empresario
35115277268,MARCIA DE FATIMA SAVOINE,SÃO JOSÉ DO RIO PRETO,7,1997,Empresario
35115277276,SUELI MARIA DA SILVA SANTOS,EMBU DAS ARTES,7,1997,Empresario
35115277284,ARLINDO PEREIRA DE ALMEIDA-S.J RIO PRETO,SÃO JOSÉ DO RIO PRETO,7,1997,Empresario
35115277292,LUIZ CARLOS MARCONDES FOTOGRAFIAS,SÃO PAULO,7,1997,Empresario
35115277306,APARECIDO MARTINS DE SOUZA,APIAÍ,7,1997,Empresario
35115277314,CLAUDIA LUIZA CORREA DA SILVA,IGUAPE,7,1997,Empresario
35115277322,MARIA DE FATIMA ROSSETI PEREIRA,ITOBI,7,1997,Empresario
35115277331,GISELA HELENA CARDIA,OSASCO,7,1997,Empresario
35115277349,RITA ALEXANDRINA MUNIZ CALCADO,SÃO PAULO,7,1997,Empresario
35115277357,SOLANGE ALMEIDA SILVA BAR,OSASCO,7,1997,Empresario
35115277365,PAULO ALEXANDRE ARANTES DE SOUZA,SÃO PAULO,7,1997,Empresario
35115277381,JOAO MARTINS CORDEIRO FILHO APIAI,APIAÍ,7,1997,Empresario
35115277390,JOSE FERNANDES DOS SANTOS AMERICANA,AMERICANA,7,1997,Empresario
35115277403,ALEXANDRE DELFINO DE OLIVEIRA,CAMPINAS,7,1997,Empresario
35115277411,IVANIA MARIA RABELLO,CAMPINAS,7,1997,Empresario
35115277420,CLAUDIO MARQUES ROSADO CAMPINAS,CAMPINAS,7,1997,Empresario
35115277438,ENIO FORTUNATO SUMARE,SUMARÉ,7,1997,Empresario
35115277446,NICOLAU FERREIRA NEVES SUMARE,SUMARÉ,7,1997,Empresario
35115277454,EVANDRO CESAR MUNIZ VIRADOURO,VIRADOURO,7,1997,Empresario
35115277462,MARA CRISTINA COSTA SILVA,RIOLÂNDIA,7,1997,Empresario
35115277489,IDAIR BUZO - CARNES DE FRANGOS,OSASCO,7,1997,Empresario
35115277497,GILSON VELEZ DE OLIVEIRA,FERRAZ DE VASCONCELOS,7,1997,Empresario
35115277501,VITOR SANCHES,SÃO PAULO,7,1997,Empresario
35115277519,MARIA CRISTINA FELIX BOVE MANDURI,MANDURI,7,1997,Empresario
35115277527,CELIA MARIA PEREIRA DE MORAES DEO,VOTUPORANGA,7,1997,Empresario
35115277535,MARIA NEUSA DE ALMEIDA BURI,BURI,7,1997,Empresario
35115277543,MARCO A LEANDRO,NOVO HORIZONTE,7,1997,Empresario
35115277551,ANTONIO RODRIGUES SANTA CRUZ DAS PALMEIRAS,SANTA CRUZ DAS PALMEIRAS,7,1997,Empresario
35115277560,SEBASTIAO DE PAULA LANCHONETE,NOVO HORIZONTE,7,1997,Empresario
35115277578,MARIA DE LOURDES MONTINI TRENTINO,SOCORRO,7,1997,Empresario
35115277586,SANDRA APARECIDA DAS VIRGENS CONFECCOES,MAUÁ,7,1997,Empresario
35115277594,CLEIDE APARECIDA CORCELLI VIEIRA,ITATIBA,7,1997,Empresario
35115277608,MONICA GASTARDO AZEVEDO,ITATIBA,7,1997,Empresario
35115277616,ABSOLON MESSIAS DE SOUZA,SÃO PAULO,7,1997,Empresario
35115277624,MARIA DAS GRACAS PEREIRA ALVES,PRAIA GRANDE,7,1997,Empresario
35115277632,CELIA MARIA GARDIANO BARBIN SUMARE,SUMARÉ,7,1997,Empresario
35115277641,TEREZINHA DA APARECIDA PINHEIRO,NAZARÉ PAULISTA,7,1997,Empresario
35115277659,CESAR AUGUSTO DE OLIVEIRA PEDREGULHO,PEDREGULHO,7,1997,Empresario
35115277667,MARIA CRISTINA DA SILVA BARRETOS,BARRETOS,7,1997,Empresario
35115277675,MARIA MIRIAM LACERDA CARVALHO,GENERAL SALGADO,7,1997,Empresario
35115277683,W S MATOS LOCADORA,SÃO PAULO,7,1997,Empresario
35115277691,VALERIA DA SILVEIRA TATUI,TATUÍ,7,1997,Empresario
35115277705,JOSE J DE PAULI,DOIS CÓRREGOS,7,1997,Empresario
35115277713,LUCIO CLAUDIO OLIVEIRA MOREIRA,SÃO PAULO,7,1997,Empresario
35115277721,ALMERINDO JOSE TRINDADE,SÃO PAULO,7,1997,Empresario
35115277730,FRANCISCO MARQUES DE LIMA-LANCHONETE,SÃO PAULO,7,1997,Empresario
35115277748,SILVIO MIGLIORI CELULARES,FERRAZ DE VASCONCELOS,7,1997,Empresario
35115277756,A S GONCALVES FRANCA,FRANCA,7,1997,Empresario
35115277764,MARIA CECILIA BIOLCHINI GONCALVES,MOGI DAS CRUZES,7,1997,Empresario
35115277772,OSMAR MARIANO DA SILVA,MOGI DAS CRUZES,7,1997,Empresario
35115277781,ANTONIO TAVARES CAPAO BONITO,CAPÃO BONITO,7,1997,Empresario
35115277799,VALENTINA RAPOSO DA SILVA RIFAINA,RIFAINA,7,1997,Empresario
35115277802,SALVADOR ALVES RIBEIRAO CORRENTE,RIBEIRÃO PRETO,7,1997,Empresario
35115277811,MAURICIO SILVA MANOEL,RIBEIRÃO CORRENTE,7,1997,Empresario
35115277829,IONE ROSA DO PRADO FRANCA,FRANCA,7,1997,Empresario
35115277837,ILIO VICENTE FERREIRA FRANCA,FRANCA,7,1997,Empresario
35115277845,G M CARMOZINE,FRANCA,7,1997,Empresario
35115277853,EDSON SOUZA BATISTA,FRANCA,7,1997,Empresario
35115277861,C. E. FERREIRA,FRANCA,7,1997,Empresario
35115277870,ALEX GOMES BALDUINO FRANCA,RESTINGA,7,1997,Empresario
35115277888,ODON FERNANDES RIBEIRO,SÃO PAULO,7,1997,Empresario
35115277896,QUITERIA FERREIRA DA SILVA,SÃO PAULO,7,1997,Empresario
35115277900,ROSA MARIA ROBLES NEIRA,SÃO PAULO,7,1997,Empresario
35115277918,JOSE ALVES BARBOSA - CONSTRUCOES,SÃO PAULO,7,1997,Empresario
35115277926,GILSON MIGUEL HOFFER GEBAILE SOROCABA,SOROCABA,7,1997,Empresario
35115277934,CINTIA CAROLINA LOPES DA CRUZ INDAIATUBA,INDAIATUBA,7,1997,Empresario
35115277942,N A DA SILVA PANIFICADORA,INDAIATUBA,7,1997,Empresario
35115277951,LUCIANA GONCALVES CHINAIT.,SÃO PAULO,7,1997,Empresario
35115277969,LUCIANO JOSE DE BARROS MOTOS,SÃO PAULO,7,1997,Empresario
35115277977,EVA GRUNWALD DA SILVA,SÃO PAULO,7,1997,Empresario
35115277985,LEONILDA APARECIDA GERALDO BIZERRA LIMA,,7,1997,Empresario
35115277993,ROBERTO RIVELINO VOLPATO AMERICANA,AMERICANA,7,1997,Empresario
35115278001,ROSANGELA ALVES DE MELO,SÃO PAULO,7,1997,Empresario
35115278019,CLAUDICEIA SOARES DOS SANTOS FERREIRA,TATUÍ,7,1997,Empresario
35115278027,MARIA VACI LADEIRA DOS SANTOS-SOROCABA,SOROCABA,7,1997,Empresario
35115278035,MARIA DE FATIMA SANTOS RIBEIRO SOROCABA,SOROCABA,7,1997,Empresario
35115278043,GENI APARECIDA FERNANDES SEBASTIAO SOROCABA,SOROCABA,7,1997,Empresario
35115278051,DIOGENES SERGIO SANCHES,PARANAPUÃ,7,1997,Empresario
35115278060,ADRIANA APARECIDA DE FREITAS,GUARIBA,7,1997,Empresario
35115278078,J H DE AZEVEDO BRAGANCA PAULISTA,BRAGANÇA PAULISTA,7,1997,Empresario
35115278086,EDNO APARECIDO FELISBINO,BRODOWSKI,7,1997,Empresario
35115278094,MADALENA GARCIA,RIBEIRÃO PRETO,7,1997,Empresario
35115278108,ORLANDO JESUINO BOMBONATO RIBEIRAO PRETO,RIBEIRÃO PRETO,7,1997,Empresario
35115278116,ANDRESSA NABARRO SALEH,BARRINHA,7,1997,Empresario
35115278124,M A MALAQUIAS SOARES,INDAIATUBA,7,1997,Empresario
35115278132,EUGENIO FURLANETTO NETO INDAIATUBA,INDAIATUBA,7,1997,Empresario
35115278141,JOSE CARLOS DE OLIVEIRA INDAIATUBA,INDAIATUBA,7,1997,Empresario
35115278159,HIDERALDO LUIS BELINI SALTO,SALTO,7,1997,Empresario
35115278167,FRANCISCA ROSA INDAIATUBA,INDAIATUBA,7,1997,Empresario
35115278175,CLEUZA DURANTE ALVARES MACHADO,ÁLVARES MACHADO,7,1997,Empresario
35115278183,MARCOS DE MENEZES CASTILHO,PRESIDENTE PRUDENTE,7,1997,Empresario
35115278191,DEBORAH MARQUES MORAES,PRESIDENTE PRUDENTE,7,1997,Empresario
35115278205,LUIZ CARLOS PEREIRA BUENO TATUI,TATUÍ,7,1997,Empresario
35115278213,EDUARDO TEIXEIRA DOS SANTOS,TATUÍ,7,1997,Empresario
35115278221,AIR ALVES MOREIRA SOROCABA,SOROCABA,7,1997,Empresario
35115278230,ELVIRA DO NASCIMENTO LOPES,SÃO JOÃO DA BOA VISTA,7,1997,Empresario
35115278248,CLAUDINEY MARCELINO ZANELLO,SÃO JOÃO DA BOA VISTA,7,1997,Empresario
35115278256,A DE F F BENZONI,SÃO JOSÉ DO RIO PRETO,7,1997,Empresario
35115278264,A. W. KUBIS,SÃO JOSÉ DO RIO PRETO,7,1997,Empresario
35115278272,AURIOVALTE ALVES DE MOURA,POLONI,7,1997,Empresario
35115278281,MARILENE SANFELICE CAPUSSO,SÃO JOSÉ DO RIO PRETO,7,1997,Empresario
35115278299,M.A.ROQUE PEREIRA,SÃO JOSÉ DO RIO PRETO,7,1997,Empresario
35115278302,NEIDE LEMOS DOS SANTOS M APRAZIVEL,MONTE APRAZÍVEL,7,1997,Empresario
35115278311,ANTONIO DE OLIVEIRA RUIVO SJCAMPOS,SÃO JOSÉ DOS CAMPOS,7,1997,Empresario
35115278329,MARIA L A LOPES SJCAMPOS,SÃO JOSÉ DOS CAMPOS,7,1997,Empresario
35115278337,EDNA MARIA VIEIRA SJCAMPOS,SÃO JOSÉ DOS CAMPOS,7,1997,Empresario
35115278345,EVARISTO GONCALVES ALVES S J CAMPOS,SÃO JOSÉ DOS CAMPOS,7,1997,Empresario
35115278353,GERALDO MACHADO S J CAMPOS,SÃO JOSÉ DOS CAMPOS,7,1997,Empresario
35115278361,LUCIO B DE SOUZA SJCAMPOS,SÃO JOSÉ DOS CAMPOS,7,1997,Empresario
35115278370,EDNA DAS GRACAS ALVES DA CUNHA,CARAGUATATUBA,7,1997,Empresario
35115278388,ELIDIANE A. C. DA SILVA ROUPAS,MOGI DAS CRUZES,7,1997,Empresario
35115278396,GILMARA GONCALVES DE JESUS JACAREI,JACAREÍ,7,1997,Empresario
35115278400,M. A. MEDALHA JACAREI,JACAREÍ,7,1997,Empresario
35115278418,CONSTANTINO PEREIRA,SANTOS,7,1997,Empresario
35115278426,DOUGRAS MOGRS DE JESUS BOMFIM,PIRAJU,7,1997,Empresario
35115278434,ELISANGELA FERRAZ F. DE OLIVEIRA,FRANCISCO MORATO,7,1997,Empresario
35115278442,HIROKO FUKUSHIMA,PIRACICABA,7,1997,Empresario
35115278451,LUIZA YASSUKO MAEDA,PIRACICABA,7,1997,Empresario
35115278469,ELIESER VAZ DE LIMA CARIMBOS,PIRACICABA,7,1997,Empresario
35115278477,JOSENITA SOARES DE SOUSA,PIRACICABA,7,1997,Empresario
35115278485,TERESINA LENI TOZZI TOGNI,PIRACICABA,7,1997,Empresario
35115278493,JOAO SANTOS SILVA BAR,RIBEIRÃO PIRES,7,1997,Empresario
35115278507,A L V COMUNE,AMPARO,7,1997,Empresario
35115278515,FATIMA A AMARAL CACAPAVA,CAÇAPAVA,7,1997,Empresario
35115278523,IVAN JOSE DE MELLO DISTRIBUIÇÃO,SÃO PAULO,7,1997,Empresario
35115278531,JOSE ODAIR SILVEIRA MENDES PIRACICABA,PIRACICABA,7,1997,Empresario
35115278540,AILTON BENTO RODRIGUES RIBEIRAO PRETO,RIBEIRÃO PRETO,7,1997,Empresario
35115278558,MAGALI DE FATIMA DA SILVA BENEDITO,RIBEIRÃO PRETO,7,1997,Empresario
35115278566,NILTON DA SILVA CAIEIRAS,CAIEIRAS,7,1997,Empresario
35115278574,LUIZ DE LIMA FILHO TRANSPORTES,SANTO ANDRÉ,7,1997,Empresario
35115278582,MARIA CELIA DOS SANTOS VAREJAO,SÃO PAULO,7,1997,Empresario
35115278591,LILIAN REGINA DA SILVA FELICIO,SÃO PAULO,7,1997,Empresario
35115278604,MARILENE ALVES DA SILVA,DIADEMA,7,1997,Empresario
35115278612,LUZIA APARECIDA DA SILVA MERCEARIA,MONGAGUÁ,7,1997,Empresario
35115278477,JOSENITA SOARES DE SOUSA,PIRACICABA,7,1997,Empresario
35115278485,TERESINA LENI TOZZI TOGNI,PIRACICABA,7,1997,Empresario
35115278493,JOAO SANTOS SILVA BAR,RIBEIRÃO PIRES,7,1997,Empresario
35115278507,A L V COMUNE,AMPARO,7,1997,Empresario
35115278515,FATIMA A AMARAL CACAPAVA,CAÇAPAVA,7,1997,Empresario
35115278523,IVAN JOSE DE MELLO DISTRIBUIÇÃO,SÃO PAULO,7,1997,Empresario
35115278531,JOSE ODAIR SILVEIRA MENDES PIRACICABA,PIRACICABA,7,1997,Empresario
35115278540,AILTON BENTO RODRIGUES RIBEIRAO PRETO,RIBEIRÃO PRETO,7,1997,Empresario
35115278558,MAGALI DE FATIMA DA SILVA BENEDITO,RIBEIRÃO PRETO,7,1997,Empresario
35115278566,NILTON DA SILVA CAIEIRAS,CAIEIRAS,7,1997,Empresario
35115278574,LUIZ DE LIMA FILHO TRANSPORTES,SANTO ANDRÉ,7,1997,Empresario
35115278582,MARIA CELIA DOS SANTOS VAREJAO,SÃO PAULO,7,1997,Empresario
35115278591,LILIAN REGINA DA SILVA FELICIO,SÃO PAULO,7,1997,Empresario
35115278604,MARILENE ALVES DA SILVA,DIADEMA,7,1997,Empresario
35115278612,LUZIA APARECIDA DA SILVA MERCEARIA,MONGAGUÁ,7,1997,Empresario
35115278477,JOSENITA SOARES DE SOUSA,PIRACICABA,7,1997,Empresario
35115278485,TERESINA LENI TOZZI TOGNI,PIRACICABA,7,1997,Empresario
35115278493,JOAO SANTOS SILVA BAR,RIBEIRÃO PIRES,7,1997,Empresario
35115278507,A L V COMUNE,AMPARO,7,1997,Empresario
35115278515,FATIMA A AMARAL CACAPAVA,CAÇAPAVA,7,1997,Empresario
35115278523,IVAN JOSE DE MELLO DISTRIBUIÇÃO,SÃO PAULO,7,1997,Empresario
35115278531,JOSE ODAIR SILVEIRA MENDES PIRACICABA,PIRACICABA,7,1997,Empresario
35115278540,AILTON BENTO RODRIGUES RIBEIRAO PRETO,RIBEIRÃO PRETO,7,1997,Empresario
35115278558,MAGALI DE FATIMA DA SILVA BENEDITO,RIBEIRÃO PRETO,7,1997,Empresario
35115278566,NILTON DA SILVA CAIEIRAS,CAIEIRAS,7,1997,Empresario
35115278574,LUIZ DE LIMA FILHO TRANSPORTES,SANTO ANDRÉ,7,1997,Empresario
35115278582,MARIA CELIA DOS SANTOS VAREJAO,SÃO PAULO,7,1997,Empresario
35115278591,LILIAN REGINA DA SILVA FELICIO,SÃO PAULO,7,1997,Empresario
35115278604,MARILENE ALVES DA SILVA,DIADEMA,7,1997,Empresario
35115278612,LUZIA APARECIDA DA SILVA MERCEARIA,MONGAGUÁ,7,1997,Empresario
35115278621,LUCIANO FARINASSO MARTINS,PARAGUAÇU PAULISTA,7,1997,Empresario
35115278639,AZIZ MACEDO PEDRO PIRAJU,PIRAJU,7,1997,Empresario
35115278647,NATALIA F. NEIVA GONCALVES,SÃO PAULO,7,1997,Empresario
35115278655,MARLY KIMIE MIZ UTANI NAGATOME GUAIMBE,GUAIMBÊ,7,1997,Empresario
35115278663,LAERTE MANABU MIHARA,MARÍLIA,7,1997,Empresario
35115278671,MARIA REGINA TOFOLI GARCA,GARÇA,7,1997,Empresario
35115278680,VALDEIR ROGERIO PAVAN,TUPÃ,7,1997,Empresario
35115278698,JOAO M MANSANO TUPA,TUPÃ,7,1997,Empresario
35115278701,CLAUDEMIR APARECIDO GARCIA ESPALSA TUPA,TUPÃ,7,1997,Empresario
35115278710,VIVIANE BALIERO,RIO CLARO,7,1997,Empresario
35115278728,L.R. DOS SANTOS SJCAMPOS,SÃO JOSÉ DOS CAMPOS,7,1997,Empresario
35115278736,JOAO JOSE ELIAS CANTINA,GUARULHOS,7,1997,Empresario
35115278744,IRACI SOUZA DO NASCIMENTO LIMA VIDRACARIA,GUARULHOS,7,1997,Empresario
35115278752,REGINALDO FELICIANO,SÃO JOSÉ DO RIO PARDO,7,1997,Empresario
35115278761,ALESSANDRO GREGORIO AGUAI,AGUAÍ,7,1997,Empresario
35115278779,LUCIA ELENA DA SILVA CRUZ,SÃO SEBASTIÃO DA GRAMA,7,1997,Empresario
35115278787,ADEMIR DURAN MOCOCA,MOCOCA,7,1997,Empresario
35115278795,MARCELO A. P. CAVALHEIRO,MONGAGUÁ,7,1997,Empresario
35115278809,VALMIR ADAO DE OLIVEIRA GUERRA,SÃO PAULO,7,1997,Empresario
35115278817,CARLOS AUGUSTO PIVA DE LIMA,SÃO PAULO,7,1997,Empresario
35115278825,ALOISIO SOUZA DOS SANTOS AGOUGUE,SÃO PAULO,7,1997,Empresario
35115278833,MAGDA CRISTINA VIEIRA GUAREI,GUAREÍ,7,1997,Empresario
35115278841,SANDRA MARA DOS SANTOS NOVO HORIZONTE,NOVO HORIZONTE,7,1997,Empresario
35115278850,MARCELO LUIZ GOTARDE RIGOTTO,CAPIVARI,7,1997,Empresario
35115278868,MARTA APARECIDA ANTONIO CHIQUETE,SÃO BERNARDO DO CAMPO,7,1997,Empresario
35115278876,SERGIO JOSE DOS SANTOS LAVANDERIA,SÃO SEBASTIÃO,7,1997,Empresario
35115278884,ROSANGELA FERNANDES DE LACERDA,PARAGUAÇU PAULISTA,7,1997,Empresario
35115278892,D RODRIGUES CARRIEL JAU,JAÚ,7,1997,Empresario
35115278906,NELSON MARINO ZANUZZI,PIRACICABA,7,1997,Empresario
35115278914,MILANIA REGINA CAMARGO,IBITINGA,7,1997,Empresario
35115278779,LUCIA ELENA DA SILVA CRUZ,SÃO SEBASTIÃO DA GRAMA,7,1997,Empresario
35115278787,ADEMIR DURAN MOCOCA,MOCOCA,7,1997,Empresario
35115278795,MARCELO A. P. CAVALHEIRO,MONGAGUÁ,7,1997,Empresario
35115278809,VALMIR ADAO DE OLIVEIRA GUERRA,SÃO PAULO,7,1997,Empresario
35115278817,CARLOS AUGUSTO PIVA DE LIMA,SÃO PAULO,7,1997,Empresario
35115278825,ALOISIO SOUZA DOS SANTOS AGOUGUE,SÃO PAULO,7,1997,Empresario
35115278833,MAGDA CRISTINA VIEIRA GUAREI,GUAREÍ,7,1997,Empresario
35115278841,SANDRA MARA DOS SANTOS NOVO HORIZONTE,NOVO HORIZONTE,7,1997,Empresario
35115278850,MARCELO LUIZ GOTARDE RIGOTTO,CAPIVARI,7,1997,Empresario
35115278868,MARTA APARECIDA ANTONIO CHIQUETE,SÃO BERNARDO DO CAMPO,7,1997,Empresario
35115278876,SERGIO JOSE DOS SANTOS LAVANDERIA,SÃO SEBASTIÃO,7,1997,Empresario
35115278884,ROSANGELA FERNANDES DE LACERDA,PARAGUAÇU PAULISTA,7,1997,Empresario
35115278892,D RODRIGUES CARRIEL JAU,JAÚ,7,1997,Empresario
35115278906,NELSON MARINO ZANUZZI,PIRACICABA,7,1997,Empresario
35115278914,MILANIA REGINA CAMARGO,IBITINGA,7,1997,Empresario
35115278779,LUCIA ELENA DA SILVA CRUZ,SÃO SEBASTIÃO DA GRAMA,7,1997,Empresario
35115278787,ADEMIR DURAN MOCOCA,MOCOCA,7,1997,Empresario
35115278795,MARCELO A. P. CAVALHEIRO,MONGAGUÁ,7,1997,Empresario
35115278809,VALMIR ADAO DE OLIVEIRA GUERRA,SÃO PAULO,7,1997,Empresario
35115278817,CARLOS AUGUSTO PIVA DE LIMA,SÃO PAULO,7,1997,Empresario
35115278825,ALOISIO SOUZA DOS SANTOS AGOUGUE,SÃO PAULO,7,1997,Empresario
35115278833,MAGDA CRISTINA VIEIRA GUAREI,GUAREÍ,7,1997,Empresario
35115278841,SANDRA MARA DOS SANTOS NOVO HORIZONTE,NOVO HORIZONTE,7,1997,Empresario
35115278850,MARCELO LUIZ GOTARDE RIGOTTO,CAPIVARI,7,1997,Empresario
35115278868,MARTA APARECIDA ANTONIO CHIQUETE,SÃO BERNARDO DO CAMPO,7,1997,Empresario
35115278876,SERGIO JOSE DOS SANTOS LAVANDERIA,SÃO SEBASTIÃO,7,1997,Empresario
35115278884,ROSANGELA FERNANDES DE LACERDA,PARAGUAÇU PAULISTA,7,1997,Empresario
35115278892,D RODRIGUES CARRIEL JAU,JAÚ,7,1997,Empresario
35115278906,NELSON MARINO ZANUZZI,PIRACICABA,7,1997,Empresario
35115278914,MILANIA REGINA CAMARGO,IBITINGA,7,1997,Empresario
35115278779,LUCIA ELENA DA SILVA CRUZ,SÃO SEBASTIÃO DA GRAMA,7,1997,Empresario
35115278787,ADEMIR DURAN MOCOCA,MOCOCA,7,1997,Empresario
35115278795,MARCELO A. P. CAVALHEIRO,MONGAGUÁ,7,1997,Empresario
35115278809,VALMIR ADAO DE OLIVEIRA GUERRA,SÃO PAULO,7,1997,Empresario
35115278817,CARLOS AUGUSTO PIVA DE LIMA,SÃO PAULO,7,1997,Empresario
35115278825,ALOISIO SOUZA DOS SANTOS AGOUGUE,SÃO PAULO,7,1997,Empresario
35115278833,MAGDA CRISTINA VIEIRA GUAREI,GUAREÍ,7,1997,Empresario
35115278841,SANDRA MARA DOS SANTOS NOVO HORIZONTE,NOVO HORIZONTE,7,1997,Empresario
35115278850,MARCELO LUIZ GOTARDE RIGOTTO,CAPIVARI,7,1997,Empresario
35115278868,MARTA APARECIDA ANTONIO CHIQUETE,SÃO BERNARDO DO CAMPO,7,1997,Empresario
35115278876,SERGIO JOSE DOS SANTOS LAVANDERIA,SÃO SEBASTIÃO,7,1997,Empresario
35115278884,ROSANGELA FERNANDES DE LACERDA,PARAGUAÇU PAULISTA,7,1997,Empresario
35115278892,D RODRIGUES CARRIEL JAU,JAÚ,7,1997,Empresario
35115278906,NELSON MARINO ZANUZZI,PIRACICABA,7,1997,Empresario
35115278914,MILANIA REGINA CAMARGO,IBITINGA,7,1997,Empresario
35115278779,LUCIA ELENA DA SILVA CRUZ,SÃO SEBASTIÃO DA GRAMA,7,1997,Empresario
35115278787,ADEMIR DURAN MOCOCA,MOCOCA,7,1997,Empresario
35115278795,MARCELO A. P. CAVALHEIRO,MONGAGUÁ,7,1997,Empresario
35115278809,VALMIR ADAO DE OLIVEIRA GUERRA,SÃO PAULO,7,1997,Empresario
35115278817,CARLOS AUGUSTO PIVA DE LIMA,SÃO PAULO,7,1997,Empresario
35115278825,ALOISIO SOUZA DOS SANTOS AGOUGUE,SÃO PAULO,7,1997,Empresario
35115278833,MAGDA CRISTINA VIEIRA GUAREI,GUAREÍ,7,1997,Empresario
35115278841,SANDRA MARA DOS SANTOS NOVO HORIZONTE,NOVO HORIZONTE,7,1997,Empresario
35115278850,MARCELO LUIZ GOTARDE RIGOTTO,CAPIVARI,7,1997,Empresario
35115278868,MARTA APARECIDA ANTONIO CHIQUETE,SÃO BERNARDO DO CAMPO,7,1997,Empresario
35115278876,SERGIO JOSE DOS SANTOS LAVANDERIA,SÃO SEBASTIÃO,7,1997,Empresario
35115278884,ROSANGELA FERNANDES DE LACERDA,PARAGUAÇU PAULISTA,7,1997,Empresario
35115278892,D RODRIGUES CARRIEL JAU,JAÚ,7,1997,Empresario
35115278906,NELSON MARINO ZANUZZI,PIRACICABA,7,1997,Empresario
35115278914,MILANIA REGINA CAMARGO,IBITINGA,7,1997,Empresario
35115278779,LUCIA ELENA DA SILVA CRUZ,SÃO SEBASTIÃO DA GRAMA,7,1997,Empresario
35115278787,ADEMIR DURAN MOCOCA,MOCOCA,7,1997,Empresario
35115278795,MARCELO A. P. CAVALHEIRO,MONGAGUÁ,7,1997,Empresario
35115278809,VALMIR ADAO DE OLIVEIRA GUERRA,SÃO PAULO,7,1997,Empresario
35115278817,CARLOS AUGUSTO PIVA DE LIMA,SÃO PAULO,7,1997,Empresario
35115278825,ALOISIO SOUZA DOS SANTOS AGOUGUE,SÃO PAULO,7,1997,Empresario
35115278833,MAGDA CRISTINA VIEIRA GUAREI,GUAREÍ,7,1997,Empresario
35115278841,SANDRA MARA DOS SANTOS NOVO HORIZONTE,NOVO HORIZONTE,7,1997,Empresario
35115278850,MARCELO LUIZ GOTARDE RIGOTTO,CAPIVARI,7,1997,Empresario
35115278868,MARTA APARECIDA ANTONIO CHIQUETE,SÃO BERNARDO DO CAMPO,7,1997,Empresario
35115278876,SERGIO JOSE DOS SANTOS LAVANDERIA,SÃO SEBASTIÃO,7,1997,Empresario
35115278884,ROSANGELA FERNANDES DE LACERDA,PARAGUAÇU PAULISTA,7,1997,Empresario
35115278892,D RODRIGUES CARRIEL JAU,JAÚ,7,1997,Empresario
35115278906,NELSON MARINO ZANUZZI,PIRACICABA,7,1997,Empresario
35115278914,MILANIA REGINA CAMARGO,IBITINGA,7,1997,Empresario
35115278779,LUCIA ELENA DA SILVA CRUZ,SÃO SEBASTIÃO DA GRAMA,7,1997,Empresario
35115278787,ADEMIR DURAN MOCOCA,MOCOCA,7,1997,Empresario
35115278795,MARCELO A. P. CAVALHEIRO,MONGAGUÁ,7,1997,Empresario
35115278809,VALMIR ADAO DE OLIVEIRA GUERRA,SÃO PAULO,7,1997,Empresario
35115278817,CARLOS AUGUSTO PIVA DE LIMA,SÃO PAULO,7,1997,Empresario
35115278825,ALOISIO SOUZA DOS SANTOS AGOUGUE,SÃO PAULO,7,1997,Empresario
35115278833,MAGDA CRISTINA VIEIRA GUAREI,GUAREÍ,7,1997,Empresario
35115278841,SANDRA MARA DOS SANTOS NOVO HORIZONTE,NOVO HORIZONTE,7,1997,Empresario
35115278850,MARCELO LUIZ GOTARDE RIGOTTO,CAPIVARI,7,1997,Empresario
35115278868,MARTA APARECIDA ANTONIO CHIQUETE,SÃO BERNARDO DO CAMPO,7,1997,Empresario
35115278876,SERGIO JOSE DOS SANTOS LAVANDERIA,SÃO SEBASTIÃO,7,1997,Empresario
35115278884,ROSANGELA FERNANDES DE LACERDA,PARAGUAÇU PAULISTA,7,1997,Empresario
35115278892,D RODRIGUES CARRIEL JAU,JAÚ,7,1997,Empresario
35115278906,NELSON MARINO ZANUZZI,PIRACICABA,7,1997,Empresario
35115278914,MILANIA REGINA CAMARGO,IBITINGA,7,1997,Empresario
35115278779,LUCIA ELENA DA SILVA CRUZ,SÃO SEBASTIÃO DA GRAMA,7,1997,Empresario
35115278787,ADEMIR DURAN MOCOCA,MOCOCA,7,1997,Empresario
35115278795,MARCELO A. P. CAVALHEIRO,MONGAGUÁ,7,1997,Empresario
35115278809,VALMIR ADAO DE OLIVEIRA GUERRA,SÃO PAULO,7,1997,Empresario
35115278817,CARLOS AUGUSTO PIVA DE LIMA,SÃO PAULO,7,1997,Empresario
35115278825,ALOISIO SOUZA DOS SANTOS AGOUGUE,SÃO PAULO,7,1997,Empresario
35115278833,MAGDA CRISTINA VIEIRA GUAREI,GUAREÍ,7,1997,Empresario
35115278841,SANDRA MARA DOS SANTOS NOVO HORIZONTE,NOVO HORIZONTE,7,1997,Empresario
35115278850,MARCELO LUIZ GOTARDE RIGOTTO,CAPIVARI,7,1997,Empresario
35115278868,MARTA APARECIDA ANTONIO CHIQUETE,SÃO BERNARDO DO CAMPO,7,1997,Empresario
35115278876,SERGIO JOSE DOS SANTOS LAVANDERIA,SÃO SEBASTIÃO,7,1997,Empresario
35115278884,ROSANGELA FERNANDES DE LACERDA,PARAGUAÇU PAULISTA,7,1997,Empresario
35115278892,D RODRIGUES CARRIEL JAU,JAÚ,7,1997,Empresario
35115278906,NELSON MARINO ZANUZZI,PIRACICABA,7,1997,Empresario
35115278914,MILANIA REGINA CAMARGO,IBITINGA,7,1997,Empresario
35115278779,LUCIA ELENA DA SILVA CRUZ,SÃO SEBASTIÃO DA GRAMA,7,1997,Empresario
35115278787,ADEMIR DURAN MOCOCA,MOCOCA,7,1997,Empresario
35115278795,MARCELO A. P. CAVALHEIRO,MONGAGUÁ,7,1997,Empresario
35115278809,VALMIR ADAO DE OLIVEIRA GUERRA,SÃO PAULO,7,1997,Empresario
35115278817,CARLOS AUGUSTO PIVA DE LIMA,SÃO PAULO,7,1997,Empresario
35115278825,ALOISIO SOUZA DOS SANTOS AGOUGUE,SÃO PAULO,7,1997,Empresario
35115278833,MAGDA CRISTINA VIEIRA GUAREI,GUAREÍ,7,1997,Empresario
35115278841,SANDRA MARA DOS SANTOS NOVO HORIZONTE,NOVO HORIZONTE,7,1997,Empresario
35115278850,MARCELO LUIZ GOTARDE RIGOTTO,CAPIVARI,7,1997,Empresario
