NIRE,Empresa,Município,Month,Year,Type
35115296947,FRANCISCO GILSON BARBOSA NUNES PRAIA GRANDE,PRAIA GRANDE,7,1997,Empresario
35115296955,BENEDITO JOSE DE SANTANA NETO PRAIA GRANDE,PRAIA GRANDE,7,1997,Empresario
35115296963,ROSANGELA MARTINS RODRIGUES SUZANO,SUZANO,7,1997,Empresario
35115296971,ANTONIO CARLOS OLIVEIRA MINI MERCADO,GUARULHOS,7,1997,Empresario
35115296980,LUCIANO IGNACIO DOS SANTOS,SÃO PAULO,7,1997,Empresario
35115296998,MANOEL LEITE VANDERLEI,SÃO PAULO,7,1997,Empresario
35115297005,LIVRARIA E PAPELARIA FLOR DE CANAA,SÃO PAULO,7,1997,Empresario
35115297013,JOSE REIS DOS SANTOS BAR,SÃO PAULO,7,1997,Empresario
35115297021,ELEN DE OLIVEIRA TAVARES,SÃO PAULO,7,1997,Empresario
35115297030,J L ARRUDA - JUNDIAI,JUNDIAÍ,7,1997,Empresario
35115297048,ENEAS GUIMARAES MERCEARIA,CARAPICUÍBA,7,1997,Empresario
35115297056,DIVACIR PEREIRA DA SILVA MATSUBARA RESTAURANTE,SÃO PAULO,7,1997,Empresario
35115297064,DANIELA BONFANTE KEFERAUS ZANCHETTA,CONCHAL,7,1997,Empresario
35115297072,D. A. PIEROBON JUNIOR DIVERSOES,MOGI MIRIM,7,1997,Empresario
35115297081,JOSE JOAO ALVES,SÃO PAULO,7,1997,Empresario
35115297099,ESTER DE ALMEIDA HERMINDA VIDEO,PINDAMONHANGABA,7,1997,Empresario
35115297102,SONIA MONTEIRO DA SILVA PINDAMONHANGABA,PINDAMONHANGABA,7,1997,Empresario
35115297111,CACIO ANTONIO FARAH,PINDAMONHANGABA,7,1997,Empresario
35115297137,OSVALDIR ANTONIO BARRICHELLO,PIRACICABA,7,1997,Empresario
35115297145,JUREMA LUZIA PEIXE MUNHOZ,PIRACICABA,7,1997,Empresario
35115297153,ANGELA APARECIDA SOARES,PIRACICABA,7,1997,Empresario
35115297161,GENTIL NUNES PIRACICABA,PIRACICABA,7,1997,Empresario
35115297170,JOAO ALFREDO RODRIGUES MENDES,PIRACICABA,7,1997,Empresario
35115297188,CORIOLANO BEZERRA DOS SANTOS,ITATIBA,7,1997,Empresario
35115297196,ORESTES MENEZES MARILIA,MARÍLIA,7,1997,Empresario
35115297200,AVELINO MENDES DE OLIVEIRA BOICA,MARÍLIA,7,1997,Empresario
35115297218,MARIA ESTER GOMES ROJO LOZANO,MARÍLIA,7,1997,Empresario
35115297226,PATRICIA WENHAWA LIU,SÃO PAULO,7,1997,Empresario
35115297234,MARCIA MARIA NOTE DE MEDEIROS,SÃO PAULO,7,1997,Empresario
35115297242,HOZANA ROBERTA GALDINO FERNANDES BAZAR,SÃO PAULO,7,1997,Empresario
35115297251,V L G DE OLIVEIRA BONANI,MOGI GUAÇU,7,1997,Empresario
35115297269,ELISANDRA ESCALEIRA,SÃO CAETANO DO SUL,7,1997,Empresario
35115297277,VALQUIRIA DOS SANTOS BUENO PIRACAIA,PIRACAIA,7,1997,Empresario
35115297285,CARLOS CESAR DELGADO,VALINHOS,7,1997,Empresario
35115297293,SERGIO LEUZZI,PRESIDENTE PRUDENTE,7,1997,Empresario
35115297307,HELIO BETTIO CHURRASCARIA,BRODOWSKI,7,1997,Empresario
35115297315,M L S FARINHA.,SÃO PAULO,7,1997,Empresario
35115297323,FRANCISCO A A DE NASCIMENTO,SÃO SEBASTIÃO,7,1997,Empresario
35115297331,FRANCISCO ALVES SAO SEBASTIAO,SÃO SEBASTIÃO,7,1997,Empresario
35115297340,JOSE ERNESTO SANTANA SAO SEBASTIAO,SÃO SEBASTIÃO,7,1997,Empresario
35115297358,M.C. DE C. GARRIDO,BAURU,7,1997,Empresario
35115297366,MARIA APARECIDA DOS SANTOS ITATIBA,ITATIBA,7,1997,Empresario
35115297374,LUIZ CARLOS DE CARVALHO EMBALAGENS,SANTA ISABEL,7,1997,Empresario
35115297382,MARIA DAS GRACAS VALENTIM SOUZA BAR,SÃO PAULO,7,1997,Empresario
35115297391,TANIA REGINA BORGUI,SÃO PAULO,7,1997,Empresario
35115297404,TONY TERUHIKO KANEGAE,BARUERI,7,1997,Empresario
35115297412,MARINEIDE FRANCISCA DA SILVA GOUVEIA BAR,SÃO PAULO,7,1997,Empresario
35115297421,CRISTIANE GALEANO,JACAREÍ,7,1997,Empresario
35115297439,JEANETE DA SILVA KONESUK,PARIQUERA-AÇU,7,1997,Empresario
35115297447,TEREZA NAVARRO GOMES,SÃO CAETANO DO SUL,7,1997,Empresario
35115297455,ILSE JULIA HEISE HENRIQUE DE OLIVEIRA,PERUÍBE,7,1997,Empresario
35115297463,MARIA RIBEIRO DE OLIVEIRA PERUIBE,PERUÍBE,7,1997,Empresario
35115297471,IDALINA DE ALMEIDA FERREIRA PRESENTES,CAMPINAS,7,1997,Empresario
35115297480,DANIEL GERARDO FISCHMAN,CAMPINAS,7,1997,Empresario
35115297498,OSWALDO DE FERNANDO - S.J.RIO PRETO,SÃO JOSÉ DO RIO PRETO,7,1997,Empresario
35115297501,M E TINE MARCENARIA,SÃO PAULO,7,1997,Empresario
35115297510,ARNALDO RAIMUNDO DA SILVA,GUARULHOS,7,1997,Empresario
35115297528,JOSE EMERSON DIMAS LINO,GUARULHOS,7,1997,Empresario
35115297536,MARINA SATO PRESIDENTE PRUDENTE,PRESIDENTE PRUDENTE,7,1997,Empresario
35115297544,MARIA REGINA DE SOUZA PRESIDENTE PRUDENTE,PRESIDENTE PRUDENTE,7,1997,Empresario
35115297552,APARECIDO SIPRIANO DA SILVA REGENTE FEIJO,REGENTE FEIJÓ,7,1997,Empresario
35115297561,CARLOS HIROSHI GOYO,PRESIDENTE PRUDENTE,7,1997,Empresario
35115297579,FABIO HENRIQUE MELETI FRANCA,FRANCA,7,1997,Empresario
35115297587,JOSE ANELO DE MELHO ITIRAPUA,ITIRAPUÃ,7,1997,Empresario
35115297595,RICARDO NOGUEIRA ROGERIO FRANCA,FRANCA,7,1997,Empresario
35115297617,EURICO RAMOS DE CASTRO E SILVA JUNIOR,PEDRA BELA,7,1997,Empresario
35115297625,ADEMIR FRANCISCO DA SILVA AMERICANA,AMERICANA,7,1997,Empresario
35115297633,RONALDO COLALTO BASSI,SÃO PAULO,7,1997,Empresario
35115297641,ALBERTO FERREIRA DA SILVA FILHO,OSASCO,7,1997,Empresario
35115297650,MARIA APARECIDA BICHARA,SÃO PAULO,7,1997,Empresario
35115297668,MARIA DE LOURDES ARAUJO FEIRANTE,SÃO PAULO,7,1997,Empresario
35115297676,RAIMUNDO SANTANA OLIVEIRA,SÃO PAULO,7,1997,Empresario
35115297684,JURACI RODRIGUES DA SILVA,GUZOLÂNDIA,7,1997,Empresario
35115297692,ZELINDA CORREIA,GUARULHOS,7,1997,Empresario
35115297706,ALESSANDRA SILVA DO NASCIMENTO ORRICO INFANTINI,SÃO SEBASTIÃO DA GRAMA,7,1997,Empresario
35115297714,ALBINO GIL DE CARVALHO,SERTÃOZINHO,7,1997,Empresario
35115297722,WLADIMIR G. BORDONI LAVA RAPIDO E MECÂNICA,SÃO PAULO,7,1997,Empresario
35115297731,VALDECI ALVES BATISTA,CAMPINAS,7,1997,Empresario
35115297749,J. ROSA MADEIRA,CAMPINAS,7,1997,Empresario
35115297757,HELIO ROBERTO GUIOTTI,SÃO PAULO,7,1997,Empresario
35115297765,VALERIA JUREIDINI,SÃO PAULO,7,1997,Empresario
35115297773,RITA CRISTINA RIBEIRO MOREIRA,VOTORANTIM,7,1997,Empresario
35115297781,ANTONIO AUGUSTO SILVA SOROCABA,SOROCABA,7,1997,Empresario
35115297790,SANDRO IANACOLI,SOROCABA,7,1997,Empresario
35115297803,JOAO JORDAO FILHO - LANCHES,SUZANO,7,1997,Empresario
35115297811,ANTONIO CARLOS JUSTO.,SÃO PAULO,7,1997,Empresario
35115297820,CELINA SILVEIRA DA SILVA CAMPOS DO JORDAO,CAMPOS DO JORDÃO,7,1997,Empresario
35115297838,ROSEMARY FABRETTI,SÃO PAULO,7,1997,Empresario
35115297846,VICENTE CELESTINO DOS SANTOS,SÃO JOSÉ DOS CAMPOS,7,1997,Empresario
35115297854,ANTONIO CARLOS DA SILVA PRAIA GRANDE,PRAIA GRANDE,7,1997,Empresario
35115297862,EDMUNDO SOUSA PARENTE,CAMPINAS,7,1997,Empresario
35115297871,EMERSON ALEXANDRE ABREU,SÃO PAULO,7,1997,Empresario
35115297889,JOCIMAR LEITE DUARTINA,DUARTINA,7,1997,Empresario
35115297897,FERNANDO NOGUEIRA LIMA,SÃO PAULO,7,1997,Empresario
35115297901,GARCEZ CESAR DOS SANTOS JUNIOR SUD MENNUCCI,,7,1997,Empresario
35115297919,REGIANE PASSERO,SÃO PAULO,7,1997,Empresario
35115297927,INACIO ALVES DE OLIVEIRA,SÃO PAULO,7,1997,Empresario
35115297935,IDA MARIA GRANDO,JUNDIAÍ,7,1997,Empresario
35115297943,WAGNER FOGANHOLI,SÃO PAULO,7,1997,Empresario
35115297951,N. C. FRANCO - LOJA DE CONVENIENCIA,PRESIDENTE PRUDENTE,7,1997,Empresario
35115297960,NELSON SADAO INOHATA,PRESIDENTE PRUDENTE,7,1997,Empresario
35115297978,CLOVIS DA ROCHA SANTANA MORRO AGUDO,MORRO AGUDO,7,1997,Empresario
35115297986,JANE APARECIDA ARNOLD,RIO CLARO,7,1997,Empresario
35115297994,CELSO GOMES DA SILVA RIBEIRAO PRETO,RIBEIRÃO PRETO,7,1997,Empresario
35115298001,VINIA PEDAO RUGONI PERNOMIAN,RIBEIRÃO PRETO,7,1997,Empresario
35115298010,CASSIUS MARCELO GOULD,RIBEIRÃO PRETO,7,1997,Empresario
35115298028,ANTONIO LUIZ BARBOSA BEBEDOURO,BEBEDOURO,7,1997,Empresario
35115298036,ZULEIDE ORLANDINI ATIBAIA,ATIBAIA,7,1997,Empresario
35115298044,JURANDIR DONIZETTI RIBEIRO PINTO,ITAPETININGA,7,1997,Empresario
35115298052,MARIANO ROSARIO NASCIMENTO,RIBEIRÃO PIRES,7,1997,Empresario
35115298061,HATSUCO AKUTA GAWA TASHIRO PERUIBE,PERUÍBE,7,1997,Empresario
35115298079,ELEUDE JOSE DA SILVA,JALES,7,1997,Empresario
35115298087,LUCIA APARECIDA DE OLIVEIRA PRAIA GRANDE,PRAIA GRANDE,7,1997,Empresario
35115298095,LETAMAR DE OLIVEIRA,PORTO FERREIRA,7,1997,Empresario
35115298109,VALERIA ADRIANA BROCCO,DOIS CÓRREGOS,7,1997,Empresario
35115298117,JOAO DA CUNHA LACERDA,VOTUPORANGA,7,1997,Empresario
35115298125,NILDA CORREA DE SOUZA LUCIANO,MATÃO,7,1997,Empresario
35115298133,JOAQUIM PEREIRA COUTINHO,,7,1997,Empresario
35115298141,ANDREIA APARECIDA NOGUEIRA,URÂNIA,7,1997,Empresario
35115298150,APARECIDA DE FATIMA VIANA,QUATÁ,7,1997,Empresario
35115298168,MARIA JOSE DA SILVA ROTISSERIA,GUARULHOS,7,1997,Empresario
35115298176,V.SIQUEIRA DE LIMA TRANSPORTES,BARUERI,7,1997,Empresario
35115298184,MILTON DAS GRACAS SANTOS ARAPEI,ARAPEÍ,7,1997,Empresario
35115298192,SIDNEY JUVENAL DE OLIVEIRA,VÁRZEA PAULISTA,7,1997,Empresario
35115298206,CARLA BIAVA IBITINGA,IBITINGA,7,1997,Empresario
35115298214,J.ROBERTO CANELLA JUNDIAI,JUNDIAÍ,7,1997,Empresario
35115298222,JULIA ROGERIO DE OLIVEIRA,SÃO CARLOS,7,1997,Empresario
35115298231,VALDECIR DE SOUZA VALENTE SERTAOZINHO,SERTÃOZINHO,7,1997,Empresario
35115298249,ANA MARIA ALVES PEREIRA ZAGATTI,PEDERNEIRAS,7,1997,Empresario
35115298257,CESAR AUGUSTO DE SOUZA PEDERNEIRAS,PEDERNEIRAS,7,1997,Empresario
35115298265,MARIA ALEXANDRA BARROS DOS SANTOS,SÃO PAULO,7,1997,Empresario
35115298273,RITA DE CASSIA THEREZIANO PRAIA GRANDE,PRAIA GRANDE,7,1997,Empresario
35115298281,WILSON MIRANDA VIANA ATIBAIA,ATIBAIA,7,1997,Empresario
35115298290,VILMA YUMIKO ICHIY VIEIRA,CAMPINAS,7,1997,Empresario
35115298303,JUVENIL PIRES DE OLIVEIRA,CAMPINAS,7,1997,Empresario
35115298311,JOSE ARMANDO VALDEVINO,VALINHOS,7,1997,Empresario
35115298320,HILDEBRANDO DE SOUZA NEVES,SUMARÉ,7,1997,Empresario
35115298338,JULIO CESAR DE ARAUJO DROGARIA,ITAPECERICA DA SERRA,7,1997,Empresario
35115298346,EDIVALDO MUNIZ DE OLIVEIRA MERCEARIA,SÃO PAULO,7,1997,Empresario
35115298354,BERENICE MARIA DA SILVA FERNANDES,OSASCO,7,1997,Empresario
35115298362,SANDRO JOSE DE PAIVA CAPAO BONITO,CAPÃO BONITO,7,1997,Empresario
35115298371,MARIA ESTELA DA SILVA ROSSAFA,JALES,7,1997,Empresario
35115298389,MARCIO ALBINO DIAS BOTUCATU,BOTUCATU,7,1997,Empresario
35115298397,ISMAEL RODRIGUES ALVES,PONTALINDA,7,1997,Empresario
35115298401,ANDREIA ZANIRA MARTINEZ,DOLCINÓPOLIS,7,1997,Empresario
35115298419,EZIRLEI DE SOUZA,ANDRADINA,7,1997,Empresario
35115298427,ROBERTO FARIAS DE OLIVEIRA PANORAMA,PANORAMA,7,1997,Empresario
35115298435,SUELI BRAGA DE ARAUJO,VALENTIM GENTIL,7,1997,Empresario
35115298443,LUIZ PAULO NOGUEIRA,SÃO PAULO,7,1997,Empresario
35115298451,CARLOS ALBERTO TURAZZI BAR.,SÃO BERNARDO DO CAMPO,7,1997,Empresario
35115298460,CARLOS ALBERTO DOS SANTOS ESCAPAMENTOS,SÃO PAULO,7,1997,Empresario
35115298478,CARLOS EDUARDO DAL SANTO DE SOUZA.,SÃO PAULO,7,1997,Empresario
35115298486,FERNANDO GAYA SOLERA,SÃO PAULO,7,1997,Empresario
35115298494,J. MURAD DE HELD BADUR.,CAMPINAS,7,1997,Empresario
35115298508,EDSON AVALO MARIN.,SÃO JOAQUIM DA BARRA,7,1997,Empresario
35115298516,MARIA CARVALHO GONCALVES,CAMPINAS,7,1997,Empresario
35115298524,ANTONIO GAZOTTI BEBEDOURO.,BEBEDOURO,7,1997,Empresario
35115298532,NADIR CARVALHO DE OLIVEIRA VERSIGNASSI.,AVARÉ,7,1997,Empresario
35115298541,ELI DANIEL GONCALVES.,FRANCA,7,1997,Empresario
35115298559,ELIZABETH FORTE.,SÃO PAULO,7,1997,Empresario
35115298567,JOSE ALVES ROSO.,SÃO PAULO,7,1997,Empresario
35115298575,ELMIR GARCIA RAMIRES MECANICA,CAJAMAR,7,1997,Empresario
35115298583,ANA ISABEL CARDOSO.,ESTIVA GERBI,7,1997,Empresario
35115298591,R. DE C. DE O. E SILVA.,MOGI GUAÇU,7,1997,Empresario
35115298605,JOSE GOMES DE ASSIS MOGI MIRIM.,MOGI-MIRIM,7,1997,Empresario
35115298613,VALDEMIR PORRECA MOGI GUACU.,MOGI GUAÇU,7,1997,Empresario
35115298621,ANTONIO DE CARVALHO COLCHOES.,SANTOS,7,1997,Empresario
35115298630,JOSE CARLOS DE SA PRES. EPITACIO,PRESIDENTE EPITÁCIO,7,1997,Empresario
35115298648,MARIA DE LIMA MOTA,AVANHANDAVA,7,1997,Empresario
35115298656,ANTONIO GIVALDO DOS SANTOS P. EPITACIO,PRESIDENTE EPITÁCIO,7,1997,Empresario
35115298664,KATIA FERES CARDOSO - BALAUSTRES,SÃO PAULO,7,1997,Empresario
35115298672,VALENTINA S. P. GONCALVES,CORDEIRÓPOLIS,7,1997,Empresario
35115298681,M H DE A SOARES CONFECCOES,MAUÁ,7,1997,Empresario
35115298699,JESUS BIANCHO,SÃO PAULO,7,1997,Empresario
35115298702,WANDERLEY MESSIAS DE OLIVEIRA,REGISTRO,7,1997,Empresario
35115298711,LUIS MARIA SERRA SANTOS,LEME,7,1997,Empresario
35115298729,MARCIA LUIZA APARECIDA DE NOBREGA PIZZARIA,SÃO PAULO,7,1997,Empresario
35115298737,MARIA CRISTINA GIROTTO,PORTO FERREIRA,7,1997,Empresario
35115298745,CELIA REGINA GIL MOTTA,CRAVINHOS,7,1997,Empresario
35115298753,MARIA ZELIA SOARES CASTELO,CARAPICUÍBA,7,1997,Empresario
35115298761,MARCIO ANTONIO RODRIGUES MERCEARIA,SÃO JOSÉ DOS CAMPOS,7,1997,Empresario
35115298770,ENEIAS MARINHO PIMENTEL LENCOIS PAULISTA,LENÇÓIS PAULISTA,7,1997,Empresario
35115298788,ANDREA DA COSTA PEREIRA,ITU,7,1997,Empresario
35115298796,MARIA IZABEL VICENTE DO PRADO,PIRAJU,7,1997,Empresario
35115298800,ARNALDO PINHEIRO DE AGUIAR CATANDUVA,CATANDUVA,7,1997,Empresario
35115298818,MARILENE FIGUEIREDO DA SILVA,CATANDUVA,7,1997,Empresario
35115298826,LUIZ ANTONIO DE SOUZA PIRAJU.,PIRAJU,7,1997,Empresario
35115298834,LEONILDO LUCIANO DA CRUZ BAURU.,BAURU,7,1997,Empresario
35115298842,JACONIAS DOS SANTOS,RIO CLARO,7,1997,Empresario
35115298851,SANDRO BENEVENUTO LOUVEIRA.,LOUVEIRA,7,1997,Empresario
35115298869,CARLOS ROBERTO MIRANDOLA GUAICARA.,GUAIÇARA,7,1997,Empresario
35115298877,ERCILIA DE FARIAS MAGDA.,MAGDA,7,1997,Empresario
35115298885,MARIA ISABEL DIAZ SERRANO.,CAFELÂNDIA,7,1997,Empresario
35115298893,EDUARDO MUTTER.,BARUERI,7,1997,Empresario
35115298907,CARLOS HENRIQUE CAVICCHIA.,MATÃO,7,1997,Empresario
35115298915,DIRCEU LUIZ ROBEIRO-JAU.,JAÚ,7,1997,Empresario
35115298923,I C DE OLIVEIRA PEDERNEIRAS.,PEDERNEIRAS,7,1997,Empresario
35115298931,GILDA LUCENA DA SILVA ITU,ITU,7,1997,Empresario
35115298940,MARIA DE LOURDES MARZO,PEDERNEIRAS,7,1997,Empresario
35115298958,JOAO ALTINO DE OLIVEIRA,FLÓRIDA PAULISTA,7,1997,Empresario
35115298966,MARCOS ROBERTO CONSTANTINO,SERTÃOZINHO,7,1997,Empresario
35115298974,ROSEMARY LEAO RAMOS,AVARÉ,7,1997,Empresario
35115298982,C.L.DA SILVA S.B.D'OESTE,,7,1997,Empresario
35115298991,R.S.PROENCA SORVETERIA,,7,1997,Empresario
35115299008,MARCIA REVERSI,MONTE AZUL PAULISTA,7,1997,Empresario
35115299016,SEVERINA MARIA DE OLIVEIRA BAR,TABOÃO DA SERRA,7,1997,Empresario
35115299024,JAIR APARECIDO SOARES PEDERNEIRAS,PEDERNEIRAS,7,1997,Empresario
35115299032,ROSA MARIA DA SILVA-LANCHONETE,SANTOS,7,1997,Empresario
35115299041,SIMONE BOHNENSTENGEL FONTAO,OSASCO,7,1997,Empresario
35115299059,FLAVIO ANTONIO DOS SANTOS JUNIOR,APARECIDA,7,1997,Empresario
35115299067,MARIA FORNAZIERO DOS SANTOS,SANTA ISABEL,7,1997,Empresario
35115299075,MARIA APARECIDA CARVALHO DA CUNHA,JOSÉ BONIFÁCIO,7,1997,Empresario
35115299083,AURORA MUNIZ DA SILVA MOGI GUACU,,7,1997,Empresario
35115299091,JOSE CARLOS GOUVEIA CAMPINAS,CAMPINAS,7,1997,Empresario
35115299105,HOLANDA OLIVARI,SÃO PAULO,7,1997,Empresario
35115299113,SHIRLEI DA SILVA FELIX PIRES,SÃO PAULO,7,1997,Empresario
35115299121,MANOEL GONCALVES DE AGUIAR NETO CONFECCOES,SÃO PAULO,7,1997,Empresario
35115299130,FABIANO ARAUJO BARBOSA MOTOS,SÃO PAULO,7,1997,Empresario
35115299148,TARCIANO JORGE DIOGENES BEZERRA,GUARULHOS,7,1997,Empresario
35115299156,MARIA ISABEL MANFREDI,SOROCABA,7,1997,Empresario
35115299164,FRANCISCO ANTONIO DOS SANTOS VERDURAS,SÃO PAULO,7,1997,Empresario
35115299172,ALBANO DA ENCARNACAO BERNARDO,SANTOS,7,1997,Empresario
35115299181,JOSE ADEMILTON DO NASCIMENTO,SÃO PAULO,7,1997,Empresario
35115299199,SERGIO VINCOV,PIRAPORA DO BOM JESUS,7,1997,Empresario
35115299202,OSMAR ALONSO INFORMATICA,SÃO PAULO,7,1997,Empresario
35115299211,ANTONIO CARLOS TAVARES DE ARAUJO,SÃO PAULO,7,1997,Empresario
35115299229,RUSSIAN CORNETTI MOREIRA DA SILVA,APARECIDA,7,1997,Empresario
35115299237,SERGIO N SIMOES,ITARARÉ,7,1997,Empresario
35115299245,EZENIL APARECIDA FRADE FELIX,BOTUCATU,7,1997,Empresario
35115299253,LUIZ MARTINS XAVIER BAR,RANCHARIA,7,1997,Empresario
35115299261,SILVANA FERREIRA DE SOUZA RANCHARIA,RANCHARIA,7,1997,Empresario
35115299270,MARIA APARECIDA MACHADO RANCHARIA,RANCHARIA,7,1997,Empresario
35115299288,MIGUEL CARLOS MONTIEL SERRALHERIA,SÃO CAETANO DO SUL,7,1997,Empresario
35115299296,SERGIO APARECIDO DE SOUZA IBATE,IBATÉ,7,1997,Empresario
35115299300,EDNA LUCHES DOS SANTOS PROMISSAO,PROMISSÃO,7,1997,Empresario
35115299318,ELAINE CRISTINA DE OLIVEIRA ARAUJO PROMISSAO,PROMISSÃO,7,1997,Empresario
35115299326,UYSDIMEIRE APARECIDA DE LIMA TOYOSHIMA,BASTOS,7,1997,Empresario
35115299334,RODOLFO GERMANO BREDOW,PRESIDENTE PRUDENTE,7,1997,Empresario
35115299342,ELIZABETH VOLPI BARRETO,PRESIDENTE PRUDENTE,7,1997,Empresario
35115299351,VERA L. DE ALMEIDA PRESIDENTE EPITACIO,PRESIDENTE EPITÁCIO,7,1997,Empresario
35115299369,JOSE PEREIRA DE OLIVEIRA TACIBA,TACIBA,7,1997,Empresario
35115299377,ALDO VITORINO JAQUES,ANHUMAS,7,1997,Empresario
35115299385,CRISTINA M. DE O. JULIANO OURINHOS,OURINHOS,7,1997,Empresario
35115299393,DILCE DE OLIVEIRA HOTEL.,RIBEIRÃO PRETO,7,1997,Empresario
35115299407,MARCIEL MANDRA LIMA,IPUÃ,7,1997,Empresario
35115299415,CLEUSA FOGACA RODRIGUES DE PAULA,CESÁRIO LANGE,7,1997,Empresario
35115299423,OSMAR JANUARIO,BOITUVA,7,1997,Empresario
35115299431,LEIA DOMINGOS,PORTO FELIZ,7,1997,Empresario
35115299440,NEUSA DE ZOOPA BERTELLI,SOROCABA,7,1997,Empresario
35115299458,LORIVAL MARANGON,NOVA GRANADA,7,1997,Empresario
35115299466,GENTIL APARECIDA MONTEOLIVA FREDERICO,NIPOÃ,7,1997,Empresario
35115299474,M.J. DA SILVA SAO JOSE DO RIO PRETO,SÃO JOSÉ DO RIO PRETO,7,1997,Empresario
35115299482,LUSIA RODRIGUES DE LIMA TUPA,TUPÃ,7,1997,Empresario
35115299491,MAURICIO AUBIN VELASCO LOCACOES,SÃO VICENTE,7,1997,Empresario
35115299504,LUIZ CARLOS DA COSTA GESSO,SANTOS,7,1997,Empresario
35115299512,MATHILDE MARIA MOURA DE ARAUJO GEROTICA,SANTOS,7,1997,Empresario
35115299521,RAIMUNDO SANTANA NASCIMENTO,SÃO BERNARDO DO CAMPO,7,1997,Empresario
35115299539,ANDERSON PEDRO DE SOUSA JACAREI,JACAREÍ,7,1997,Empresario
35115299547,HELENA TEIXEIRA DE SOUZA,PORTO FELIZ,7,1997,Empresario
35115299555,FABIO MOURO,BOITUVA,7,1997,Empresario
35115299563,SUELI REGINA DA SILVA RODRIGUES - PORTO FELIZ,PORTO FELIZ,7,1997,Empresario
35115299571,ROGERIO J M RODRIGUES,SOROCABA,7,1997,Empresario
35115299580,NESTOR DOS SANTOS MALOSTI FILHO,SOROCABA,7,1997,Empresario
35115299598,CELIA REGINA MARTINS MONTEIRO S.J. DO RIO PRETO,SÃO JOSÉ DO RIO PRETO,7,1997,Empresario
35115299601,MARISA PERPETUO DE SOUZA SILVA - MOVEIS,PAULO DE FARIA,7,1997,Empresario
35115299610,RUBENS VALDEVIESO SALTO,SALTO,7,1997,Empresario
35115299628,JOSE APARECIDO DOS SANTOS SALTO,SALTO,7,1997,Empresario
35115299636,MARIA VALDIVINA DE JESUS FIGUEIREDO,NOVA GRANADA,7,1997,Empresario
35115299644,MARIA ANTONIA MARQUES DE SOUZA,SÃO JOSÉ DO RIO PRETO,7,1997,Empresario
35115299652,MARCELO CHIBENI,SÃO JOSÉ DO RIO PRETO,7,1997,Empresario
35115299661,LUCIANA BELLINI.,POTIRENDABA,7,1997,Empresario
35115299679,ELITE ALVES PEREIRA SIQUEIRA.,FRANCA,7,1997,Empresario
35115299687,LUCIANO DOUGLAS MACHADO.,FRANCA,7,1997,Empresario
35115299695,MADALENA GOULART DE SOUZA FRANCA,FRANCA,7,1997,Empresario
35115299709,TANIA MARIA DA CUNHA RIBEIRO SILVA.,FRANCA,7,1997,Empresario
35115299717,CARLOS ROBERTO DA LUZ - ITAPEVA.,ITAPEVA,7,1997,Empresario
35115299725,CINIRA SIQUEIRA DOS SANTOS.,ITAPEVA,7,1997,Empresario
35115299733,FERNANDA MARIA CARLINI ITU.,ITU,7,1997,Empresario
35115299741,ANTONIO CARDOSO SOARES CAMPINAS,SÃO PAULO,7,1997,Empresario
35115299750,MARIA FILOMENA BEGNAMI LEMBI.,PIRACICABA,7,1997,Empresario
35115299768,JOSE DA MATA MERCADO,RIO CLARO,7,1997,Empresario
35115299776,AUGUSTO DOS ANJOS LOUREIRO JUNIOR PROMISSAO,PROMISSÃO,7,1997,Empresario
35115299784,ADICLEIA CAMARGO LIMA,ITAPIRAPUÃ PAULISTA,7,1997,Empresario
35115299792,SIRLEY DIAS DE SOUSA.,SALTO,7,1997,Empresario
35115299806,JOEL PEREIRA TERRA ROXA,TERRA ROXA,7,1997,Empresario
35115299814,MARIA RIBEIRO SAMPAIO APARECIDA,APARECIDA,7,1997,Empresario
35115299822,DECIO BELEZARIO SILVA,BROTAS,7,1997,Empresario
35115299831,SILVIA DE OLIVEIRA VENTURELLI,IGARAPAVA,7,1997,Empresario
35115299849,LEVY SOARES DE SOUZA AVARE,AVARÉ,7,1997,Empresario
35115299857,JULIO GONCALVES DE MATTOS BAR,SÃO PAULO,7,1997,Empresario
35115299865,JOSETITA ALVES SANTA ROSA,AVARÉ,7,1997,Empresario
35115299873,EDINALVA DE JESUS CERIAGO,MOGI DAS CRUZES,7,1997,Empresario
35115299881,MARIA DULCE BARBOSA DA SILVA,MAUÁ,7,1997,Empresario
35115299890,MARIA ASSUNTA TAFARELO NEVES,JUNDIAÍ,7,1997,Empresario
35115299903,JOSE DA SILVA OBELISCO BAR,CARAPICUÍBA,7,1997,Empresario
35115299911,ULDA LEIRA MARTINES CAVALLO DA ROCHA,SANTO ANDRÉ,7,1997,Empresario
35115299920,LAZARA ACACIA RODRIGUES TERRA,POÁ,7,1997,Empresario
35115299938,ADILSON ANTONIO DA SILVA,GUARULHOS,7,1997,Empresario
35115299946,MARCELO FOLEGATTI SIMOES REPRESENTACOES,SÃO PAULO,7,1997,Empresario
35115299954,VALERIA ASSUNTA DA SILVA CONCEICAO,BARUERI,7,1997,Empresario
35115299962,VERA LUCIA TOBIAS CARAPICUIBA,CARAPICUÍBA,7,1997,Empresario
35115299971,SERGIO MAURICIO BERNARDES,SÃO PAULO,7,1997,Empresario
35115299989,JOSELITA D.C. DE MELLO,SÃO PAULO,7,1997,Empresario
35115299997,LUIS CARLOS FERREIRA MOTTA,SÃO PAULO,7,1997,Empresario
35115300006,MARIA AP.L. REIS,SÃO PAULO,7,1997,Empresario
35115300014,CLAUDIO GONCALVES DA SILVA,PIRAPORA DO BOM JESUS,7,1997,Empresario
35115300022,GERALDO JOSE PELEGATI,SÃO PAULO,7,1997,Empresario
35115300031,VALDILENE LOURENTINO DA COSTA DE OLIVEIRA,SÃO PAULO,7,1997,Empresario
35115300049,ZULEIDE VIEIRA NETTO BATTISTON PIRAJU,PIRAJU,7,1997,Empresario
35115300057,ROSANGELA DO CARMO MENDES PRESENTES,BARUERI,7,1997,Empresario
35115300065,PEDRO SANTANA DA COSTA ILHA COMPRIDA,ILHA COMPRIDA,7,1997,Empresario
35115300073,MARLENE MENDES DO NASCIMENTO,ITAPEVI,7,1997,Empresario
35115300081,HARUE KANASHIRO FEIRANTE,SÃO PAULO,7,1997,Empresario
35115300090,ARCILIO RUZZI MOGI MIRIM,MOGI MIRIM,7,1997,Empresario
35115300103,R.E. SILVA CALCADOS,MOGI MIRIM,7,1997,Empresario
35115300111,CHEN CANGCHANG,SÃO PAULO,7,1997,Empresario
35115300120,MARIA BENEDITA RODRIGUES DA COSTA.,TABOÃO DA SERRA,7,1997,Empresario
35115300138,ANA HELENA COLACO INDAIATUBA,INDAIATUBA,7,1997,Empresario
35115300146,ALESSANDRA CRISTINA LOPES DA CRUZ INDAIATUBA.,INDAIATUBA,7,1997,Empresario
35115300154,KAREN B DE M SARMENTO,HOLAMBRA,7,1997,Empresario
35115300162,TEREZA CRISTINA VIEIRA MARCELINO,RIBEIRÃO PRETO,7,1997,Empresario
35115300171,SANDRA MARA OLIVEIRA PARRA,RIBEIRÃO PRETO,7,1997,Empresario
35115300189,SANDRA MARA DAMIAO CONTART,PONTAL,7,1997,Empresario
35115300197,JOAO BATISTA RODRIGUES PALMITAL,PALMITAL,7,1997,Empresario
35115300201,IVANIO DA MOTA HENRIQUE.,CUBATÃO,7,1997,Empresario
35115300219,I. DOS S.R. PEREIRA BUFFET,SANTOS,7,1997,Empresario
35115300227,EDUARDO ALVES DE OLIVEIRA-GUARULHOS,GUARULHOS,7,1997,Empresario
35115300235,CARLOS DIAS NASCIMENTO,GUARULHOS,7,1997,Empresario
35115300243,VALDOMIRO CABRAL DA SILVA,GUARULHOS,7,1997,Empresario
35115300251,VALDENIR APARECIDA BARBOSA CINALLI,SÃO PAULO,7,1997,Empresario
35115300260,MARIO APARECIDO DOS SANTOS ITATIBA.,ITATIBA,7,1997,Empresario
35115300278,ANTONIO CARLOS MACEDO MECANICA,SÃO PAULO,7,1997,Empresario
35115300286,MARIA JOSE CORDEIRO FOTOS,SÃO PAULO,7,1997,Empresario
35115300294,JOAO SOARES MERCEARIA,RIBEIRÃO BONITO,7,1997,Empresario
35115300308,ROGERIO CASTELLANO,POÁ,7,1997,Empresario
35115300316,JOSE A DIAS ITATINGA,ITATINGA,7,1997,Empresario
35115300324,PAULO ELIAS DE OLIVEIRA ITARARE,ITARARÉ,7,1997,Empresario
35115300332,SIDNEY FRANCISCO DE FARIAS,OURINHOS,7,1997,Empresario
35115300341,IONEDA LACERDA DE SOUZA,FRANCISCO MORATO,7,1997,Empresario
35115300359,SONIA TOMOKO NAKABAYASHI SAINEN,ITANHAÉM,7,1997,Empresario
35115300367,P.S. DA SILVA LANCHONETE,MOGI MIRIM,7,1997,Empresario
35115300375,ADRIANO GONCALVES DE CARVALHO,CASA BRANCA,7,1997,Empresario
35115300383,R.A.G. DOS SANTOS FRANCHI,PIRACICABA,7,1997,Empresario
35115300391,LORIVAL CYPRIANO IBATE,IBATÉ,7,1997,Empresario
35115300405,ADRIANA PASSOS SOUZA DE OLIVEIRA,PERUÍBE,7,1997,Empresario
35115300413,PAULO ROGERIO BOROTTO,MAUÁ,7,1997,Empresario
35115300421,WAGNER ALEXANDRE BOROTTO,SANTO ANDRÉ,7,1997,Empresario
35115300448,CHRISTIANE B. BUFFONI ABICHABKI,SÃO JOSÉ DO RIO PARDO,7,1997,Empresario
35115300456,LUCIA ELETE DA FONSECA ALVES,GUARULHOS,7,1997,Empresario
35115300464,A. MOTA CIPRIANO CAFE,SANTOS,7,1997,Empresario
35115300472,ADRIANA SILVA AMARAL DE ALMEIDA SAO VICENTE,SÃO VICENTE,7,1997,Empresario
35115300481,LUIS CARLOS RODRIGUES RODAS,SANTO ANDRÉ,7,1997,Empresario
35115300499,LUIZ JORGE FRISCHEISEN,SANTO ANDRÉ,7,1997,Empresario
35115300502,MARCIA MARIA MOMESSO PETRUCCI,SÃO CAETANO DO SUL,7,1997,Empresario
35115300511,RONALDO FERNANDO SALES,SANTA CRUZ DO RIO PARDO,7,1997,Empresario
35115300529,GLORIA REGINA RODRIGUES TERUEL CONELIAN,MARÍLIA,7,1997,Empresario
35115300537,MARCIA REGINA MENDES BAR,MARÍLIA,7,1997,Empresario
35115300545,FERNANDO ALBERTO SUBTIL,MARÍLIA,7,1997,Empresario
35115300553,ELYZEU ANELLI PINDORAMA,PINDORAMA,7,1997,Empresario
35115300561,HENRIQUE SVERNER,SÃO PAULO,7,1997,Empresario
35115300570,V. L. VIEIRA BAR,FRANCISCO MORATO,7,1997,Empresario
35115300588,MARIA APARECIDA FERREIRA LEITE BAURU,BAURU,7,1997,Empresario
35115300596,DANIEL FERNANDO ROSA ARACATUBA,ARAÇATUBA,7,1997,Empresario
35115300600,ADRIANA DE OLIVEIRA ARACATUBA,ARAÇATUBA,7,1997,Empresario
35115300618,MARCELINO CASTRO PESTILLO,BAURU,7,1997,Empresario
35115300626,CLORINDA AP C BARBOSA BARIRI,BARIRI,7,1997,Empresario
35115300634,DEOCLECIO ROSSI,ARAÇATUBA,7,1997,Empresario
35115300642,CELSO HITOSHI TAMURA,ARAÇATUBA,7,1997,Empresario
35115300651,T L ROSA MINI-MERCADO,SÃO PAULO,7,1997,Empresario
35115300669,ANTONIO ISRAEL CARNELOS,MAIRIPORÃ,7,1997,Empresario
35115300677,ANA LIGIA OLIVEIRA DOS SANTOS FAVORETTO,SANTO ANDRÉ,7,1997,Empresario
35115300685,JAMIL HASSAN EL SEHMARANI,SÃO PAULO,7,1997,Empresario
35115300693,RENATO ANTONIO FONTANA,CÂNDIDO MOTA,7,1997,Empresario
